ienv5o6z	Way before all these delta plus and omicron variants existed and when covid wasn't as spread, I read that covid causes long term brain damage on people who were healed.  Cured patients were having "confusion, trouble focusing, changes in behaviour, brain fog" and things like that.  https://www.health.harvard.edu/blog/the-hidden-long-term-cognitive-effects-of-covid-2020100821133  https://www.hopkinsmedicine.org/health/conditions-and-diseases/coronavirus/how-does-coronavirus-affect-the-brain  I want to ask if these new vaccines also protect against this since they successfully reduce severe symptoms and even death?  By the way, this might not be a thing anymore or that vaccines were not designed to combat this. I don't know. I'm just asking.  These all seemed disastrous when I first read about it and I'm still anxious today.	1642781141.0	s9e3pz	/r/askscience/comments/s9e3pz/do_covid_vaccines_prevent_brain_damage/	Do Covid Vaccines Prevent "Brain Damage"?
9a34f50t	- can anyhow the vaccine fail and itself cause rabbies?	1642773325.0	s9b9ja	/r/askscience/comments/s9b9ja/is_there_any_small_possiblility_that_humans_get/	Is there any small possiblility that humans get rabbies from rabbies vaccine ?
4g3xybn3	Suppose you only got injected with a few drops. Would that have the same effect as the full dose or would it just not do anything. If it does have the same effect why make the dose that large?	1642784167.0	s9f960	/r/askscience/comments/s9f960/is_the_full_dose_of_the_covid_vaccine_necessary/	Is the full dose of the covid vaccine necessary?
o2b8c	In an RBMK reactor the moderator is graphite and water is boiled to generate steam, but also used as a coolant. In LWR reactors water is used as a moderator and coolant if I understood it correctly.  So my question is:  Is  the water defined as a coolant because it absorbs neutrons from fission, or simply because of its thermal properties?  And if it can absorb neutrons, thereby slowing the chain-reaction of fission how can it also be a moderator in LWRs?	1642787717.0	s9gm3p	/r/askscience/comments/s9gm3p/how_can_water_act_as_a_moderator_in_lwrs_if_it/	How can water act as a moderator in LWRs if it also absorbs neutrons?
8zvfep1b		1642786827.0	s9g9rr	/r/askscience/comments/s9g9rr/what_are_ac_and_dc_currents_and_are_there_other/	What are AC and DC currents, and are there other types of electrical currents?
13uq4n	As per the journal entry I link below, sometimes 5% of PCR tests can be false positives   The UK's COVID-19 testing programme uses real-time reverse transcription  polymerase chain reaction (RT-PCR) tests to detect viral RNA.[1](https://www.ncbi.nlm.nih.gov/pmc/articles/PMC7850182/#CIT0001)  Public Health England reports that RT-PCR assays show a specificity of  over 95%, meaning that up to 5% of cases are false positives   [https://www.ncbi.nlm.nih.gov/pmc/articles/PMC7850182/](https://www.ncbi.nlm.nih.gov/pmc/articles/PMC7850182/)  How can a PCR test be a false positive? You either have the DNA of a specific virus or pathogen you're looking for, or you don't. How can a PCR accidentally find DNA that isn't supposed to be there, and consider it "false" ?	1642797626.0	s9kcvi	/r/askscience/comments/s9kcvi/if_pcr_tests_look_for_specific_dna_sequences_how/	If PCR tests look for specific DNA sequences, how can they be false positives?
c8baovm8	I’ve heard some people claim that colours don’t exist in the external world outside our mind and that science has “proved” this. However, has science actually shown that colours don’t exist in the external world? And if so, how? Thanks!	1642822108.0	s9sy6w	/r/askscience/comments/s9sy6w/has_science_shown_that_colours_dont_exist_in_the/	Has science shown that colours don’t exist in the external world?
2hczcsqe		1642755102.0	s96eys	/r/askscience/comments/s96eys/can_a_fat_guy_survive_longer_without_food_and/	Can a fat guy survive longer without food and water than a fit guy?
7mukavth	Can someone explain the intramolecular and intermolecular forces and bonds of water molecules?	1642772503.0	s9azro	/r/askscience/comments/s9azro/what_are_the_water_molecule_bonds/	What are The Water Molecule Bonds?
hs343	A new Nature paper says that they identified a SNP mutation in a gene related to smelling. However, the mutation is in an intron. I thought the intron got removed and didn't affect the final protein. How does this mutation affect the final protein?  Nature paper: https://www.nature.com/articles/s41588-021-00986-w#MOESM1	1642858378.0	sa2m2j	/r/askscience/comments/sa2m2j/how_can_a_mutation_in_an_intron_affect_the_gene/	How can a mutation in an intron affect the gene?
3swps2l7		1642844800.0	s9z1sh	/r/askscience/comments/s9z1sh/was_smallpox_pruritic_at_any_stage_where_lesions/	Was smallpox pruritic at any stage where lesions appeared?
3nkdjfib	Since the topmost layer of skin is dead skin cells, and a virus needs living cells to create more of itself, how does it infect the skin?	1642843957.0	s9yupa	/r/askscience/comments/s9yupa/how_does_the_hpv_virus_create_warts_and_verrucas/	How does the HPV virus create warts and verrucas?
fvfiys3s	Saw a post in r/aww about a grandpa/grandson dog/puppy combo playing. Brought up the thought in the title.   I understand genetic memory & have seen studies of generations of mice being afraid of the same thing the first generation was trained to be scared of, but I’m thinking more of the anthropology aspect of it.  Do other animal species have the ability to form these concepts?	1642867840.0	sa5r2f	/r/askscience/comments/sa5r2f/do_generations_of_dogs_understand_relation_to/	Do generations of dogs understand relation to their descendants? Like, would a ‘grandpa’ dog know his relationship to a new puppy ‘grandson’?
hfdak0u0	Generally, when popular science outlets try to explain an object being in orbit simply, it is explained as "constantly falling and constantly missing" or similar. I can kind of see what they mean when they put graphics of it up, but it's in no way intuitively easy.  My thought before I saw that explanation was simply that gravity and the centrifugal force from rotating around the planet/star/etc. cancelled out, and hence the object stays in the orbit and experiences net zero acceleration/gravity.  Does the math support this interpretation? If it does, is there anything else with it that is incorrect, or is it just different ways of thinking of the same thing?	1642865075.0	sa4s88	/r/askscience/comments/sa4s88/can_orbit_be_understood_as_gravity_and/	Can orbit be understood as gravity and centrifugal force cancelling out?
of0sk	There are a different ways to take recreational drugs, but none are taken more intravenously than heroine. Why is this? Has it something to do with the chemistry of the drug that means that direct injection into the blood stream is necessary? I understand you can also inhale heroin, much like you can smoke cocaine, or eat THC. But why is heroine injected more frequently than other recreational drugs?	1642866628.0	sa5bj1	/r/askscience/comments/sa5bj1/why_is_heroine_injected_more_commonly_than_other/	Why is heroine injected more commonly than other drugs?
75kcx7k2	Would it be possible to use a neon light to grow a plant?	1642866367.0	sa587u	/r/askscience/comments/sa587u/could_one_theoretically_create_a_neon_grow_light/	Could one theoretically create a neon grow light?
d4m2k		1642865961.0	sa535n	/r/askscience/comments/sa535n/what_are_the_gravity_related_functions_of_the/	What are the gravity related functions of the human body and how they are effected and overcome in a zero gravity environments?
4uvwohcf	I saw on a (not very credible) website a post that quoted Trend in Genetics in saying that the similarity in TAD was 43 percent between a chimpanzee and a human and that would mean that they don’t share enough DNA to come from the same ancestor. I know they share over 99 percent of their DNA. I was just thinking that do TAD similarity equite DNA similarity?	1642839189.0	s9xpdb	/r/askscience/comments/s9xpdb/does_topologically_associating_domain/	Does topologically associating domain (TAD)percentage similarity between species have anything to say regarding DNA similarities between species?
zza0h	Smoking anything in general reduces/affect macrophages,reduce immunity and increases the chance of respiratory infections. cannabinoids are immunomodulators  in some capacity and have a homogenous relationship with immune cells. If they are ingested instead of smoking do they still have the same effect & reduce/impair your immunity. Making a person vulnerable to infections or exacerbating existing ones?	1642829171.0	s9v2f7	/r/askscience/comments/s9v2f7/does_ingesting_cannabis_tea_edibles_have/	Does Ingesting cannabis (tea & edibles) have immunosupressive effects ?
h8n7sz5c		1642872363.0	sa7dgc	/r/askscience/comments/sa7dgc/are_you_more_likely_to_spread_covid_while_you/	Are you more likely to spread covid while you have symptoms (since it takes a few days for symptoms to show up)? Or do the chances of spreading it stay the same as when you would have contracted it (and did not have symptoms)?
65gfe8uh	I'm actually in the math-heavy design stage to build an actual mini axial gas turbine. There are reasons why a centrifugal one is used as part of a turbocharger, but the scientific challenge really got to me. I'm even building an extra 4-axis lathe to mill the blisks for it.  Anyways. I have no problems with the design of the blades or the velocity triangles. BUT EVERY book about fluid dynamics or turbomachinery OMITS THE EXACT causal link of how a stator (if the compressor is of such design) creates pressure. It usually vaguely talks about the stator being a diffusor, but on the same time the flow area of the annular stream continually grows smaller and smaller through the compressor.  In other words: How does it work that a flow is diffused (subsonic design) and at the same time the flow area is reduced. Obviously this can't work the way I describe the question, but the phrasing of the question is well formed to exactly depict how much I understand and what's still missing.  So, what exact characteristic of the stator (is it the curvature, the thickness, the nozzle spatial geometry,...) causes the pressure to rise from the velocity AND how do I bring this in accordance of the steady reduction of flow are throughout the compressor?  I REALLY appreaciate an answer as not even fluid dynamic books really get this specific and just generalize that point.	1642879739.0	saa1mb	/r/askscience/comments/saa1mb/how_does_an_axial_compressor_create_more_pressure/	How does an axial compressor create more pressure?
9uzgsscu		1642881474.0	saanu9	/r/askscience/comments/saanu9/how_do_pathogen_reach_to_their_target_site_after/	How do pathogen reach to their target site after entering our body? Does the method differ from pathogen to pathogen and if no does medicines also work on same principle?
1v9zietd	Take tigers for example. There are several distinct subspecies and populations, all of which are endangered. I know that each population would have evolved to adapt to their specific environments. The Siberian Tiger and the Sumatran Tiger would have evolved to be comfortable in different climates and environments. So I understand not just tossing any two tigers together.  But why is it crucial not to introduce genes from the Malayan tiger into Sumatran tiger populations? In each native range, the tiger fills an important ecological niche, so wouldn’t SOME tigers, even if they’re “mixed breed” be better than no tigers at all? And before populations became so fragmented, wouldn’t there have been significant overlap and interbreeding on the edges of each population’s range?  Any help dumbing this down for me would be much appreciated!	1642880053.0	saa5nh	/r/askscience/comments/saa5nh/why_is_it_important_to_conserve_independent/	Why is it important to conserve independent subspecies/populations separately, especially within critically endangered species?
127ery	So I've heard this many times before in the context of astronomy and JWST and I realized that I don't quite understand the implications of this statement: "we perceive infrared as heat". Our eyes see visible light frequencies, we have detectors that capture this visible light emitted from far away and our brains process it and that's how we see the environment around us. But about our perception of infrared as "heat":  * Stars/flames that burn hotter appear blue, stars that are colder appear red. Does this mean blue stars emit less infrared and more visible light, or they also emit more infrared but we just can't see it with our eyes? Since infrared is heat and blue stars are hotter, I would expect more infrared from blue stars. Does this mean the blue objects also emit more red but the blue overwhelms the red? Or is "heat" and "hot temperature" not actually the same thing in this case? * Our skin "feels" infrared as "heat". But does our skin only detect infrared by direct contact, so we have to be touching something to feel that it's "hot" and tense its temperature? Or does it also detect some infrared radiation going through vacuum/air? When we feel the heat from a glowing red heater for example, do we feel the infrared radiation emitted directly by the hot metal, or do we feel the direct contact with the hot air that was heated by this nearby element and traveled to us across the room? * Infrared cameras see "heat" at a distance obviously, is that different from how our skin detects heat/IR? * When our skin feels infrared, is it only sensitive to a certain part of the infrared spectrum? Does the infrared range our skin feels correspond to a small range of IR frequencies which correspond to a range of temperatures, that happen to be a "safe" range for our bodies to come in contact with? For example, when something feels "very cold" is that just a signal for our brain that any colder is dangerous, and what feels "very hot" tells our brain that any hotter is also dangerous? But fundamentally it's just a small sliver of the possible temperatures in the universe and there's nothing really fundamentally special about them?	1642879214.0	sa9uvg	/r/askscience/comments/sa9uvg/what_does_it_mean_to_say_that_our_skin_perceives/	What does it mean to say that "our skin perceives infrared as heat"?
4zmc0q7m	I understand that fluoride is what is recommended for a reason, that it forms a barrier to acids that is stronger than the hydroxyapatite in your teeth- but I’m wondering if there is any benefit  comparable to fluoride to use this type of toothpaste that would make it worth using? I find it difficult to find un biased information that isn’t either anti-fluoride conspiracy theories or just stating why fluoride is recommended without any info on the new toothpastes that are becoming available. TIA!	1642877932.0	sa9e7b	/r/askscience/comments/sa9e7b/does_hydroxyapatite_toothpaste_offer_any_sort_of/	Does Hydroxyapatite toothpaste offer any sort of protection or remineralization similar to fluoride, or is it essentially useless when compared to fluoride?
qvjp8	I  know vapor filters can breakthrough when the absorbent is saturated,  but it seems like most particulate filters just seem to clog and reduce  flow rather than breakthrough.  Just  wondering if N95's can also saturate and breakthrough when used  repeatedly without any type of cleaning/washing. And how much it would  take to do so?	1642876992.0	sa9201	/r/askscience/comments/sa9201/do_n95_filters_have_a_breakthrough_level_or_do/	Do N95 filters have a breakthrough level? or do they just saturate and clog?
ahihdift	If we pretend there are two people, each located in a seperate room, who are both infected with the COVID-19 virus.  Their immune systems have activated and their bodies are now fighting the infection.    Now pretend that a vent is pumping further COVID virus particles into the air for just one of the rooms.  My question is, should we expect the severity or recovery timeline of the disease to be impacted for the person in the room getting a continuous feed of new/additional virus particles via the vent?  Why or why not?	1642886211.0	sacd7q	/r/askscience/comments/sacd7q/after_the_human_immune_system_is_already/	After the human immune system is already activated, does it matter if new virus is continually being fed in?
4bzsf	I'm working on a sci-fi novel, and while it's fantastical in nature, I still want to make sure I at least get the terminology as correct as possible.   There's a creature in the setting that essentially grows inside of a human body if that person is infected. This creature will kill its host for the majority of cases, but some humans can survive. The survivors are malnourished, heavily prone to addiction, and in all likelihood will die a horrible death due to addiction or other direct/indirect reasons. Of those survivors a small percentage may get benefits where they may get some sort of extraordinary ability (think of the comic book/movie Venom), but they're still constantly fighting being eaten from the inside out, needing to take medications and do other things to keep the creature inside in check.  So my question is, is a creature like that still considered a parasite? Or can parasite provide no benefit to its host at all? Is it a symbiont instead? A virus?	1642807643.0	s9o4de	/r/askscience/comments/s9o4de/can_parasites_provide_some_benefits_to_the_host/	Can parasites provide some benefits to the host?
55298ay9	According to the [Wikipedia](https://en.m.wikipedia.org/wiki/Coriolis_force) page on the Coriolis effect it occurs when we are dealing with two reference frames, a rotating one and an inertial one. If the earth is in the rotating frame and an airplane is experiencing Coriolis effect doesn't that mean the plane is in the inertial reference frame as depicted in this[animation](https://atmos.northernvermont.edu/news/coriolis-effect-demonstration/)  from the university of northern Vermont? How could that be though? Wouldn't that mean the stars would stop rotating when observed from an airplane and and when flying from the north pole to Mexico you would aim for Africa and let Mexico rotate in to it?  Alternatively if the plane is not in an inertial reference frame and it's just rotating with the earth, what would any pilot be correcting for?	1642890236.0	sadtha	/r/askscience/comments/sadtha/how_does_coriolis_effect_change_the_trajectory_of/	How does Coriolis effect change the trajectory of an airplane?
6syc4	If so, how would one calculate it?	1642917990.0	samslf	/r/askscience/comments/samslf/is_there_a_terminal_velocity_for_a_buoyant_object/	Is there a terminal velocity for a buoyant object rising through liquid water?
9ewkrugi	When we think about mountain formation, we tend to think about the processes that formed the mountains that exist as we see them today. I’ve never considered the mountains that may or may not have existed in the past until just a couple minutes ago. In my mind, it would just require a staggering amount of work to form a mountain and then un-form it, but then again the earth has been around for billions of years—plenty of time to get the job done.	1642932433.0	saqg8g	/r/askscience/comments/saqg8g/throughout_earths_history_has_the_movement_of/	Throughout earth’s history, has the movement of tectonic plates caused the disappearance of any mountains or mountain ranges?
42r7i	(b/c high RBC turnover is an indication of something bad?) And what IS the percent of the population that has high RBC turnover?   Like, if you want to do a full analysis of variance of mortality as a function of HbA1c, you want to form a hierarchical model where you explain how variation of HbA1c is DIFFERENT between both high and low levels of HbA1c AND (through matching) what percent of low HbA1c is due solely to high RBC turnover (high RBC turnover is presumably a bad thing).   \[are there hierarchical linear models that compartmentalize variance between high levels and low levels of HbA1c?\]	1642955107.0	saxb1r	/r/askscience/comments/saxb1r/why_is_the_hazardmortality_ratio_for_hba1c_higher/	Why is the hazard/mortality ratio for HbA1c higher for the lowest levels? Is it explained primarily by a significant fraction of the ill population having high RBC turnover?
ih2m2e0y	I keep reading that depression causes decreased executive function, [difficulty thinking clearly](https://www.talkspace.com/blog/how-does-depression-affect-the-brain/), etc.  I'm just wondering what is happening when we create thoughts that something like depression can mess that up.  That would mean it has the power to change how someone fundamentally thinks but how? Does it inhibit certain cells from communicating such that a thought that a healthy person has, doesnt occur if the individual is depressed?	1642952758.0	sawfex	/r/askscience/comments/sawfex/on_a_neural_level_how_does_a_condition_like/	On a neural level, how does a condition like depression cause worse cognition?
dl74xa6t	Botox is required to paralyze facial muscles which cause wrinkles. This leads me to believe that our muscles must be becoming more active with age, as younger people do not have this problem. What causes muscles to become more active with age? And does it happen elsewhere in the body, so that we gain strength with age?	1642953784.0	sawt39	/r/askscience/comments/sawt39/why_do_muscles_become_hyperactive_with_age/	Why do muscles become hyperactive with age?
he7ze9wd	I am trying to find the process, but Wikipedia didn't help.	1642950100.0	savi06	/r/askscience/comments/savi06/how_is_vanadium_pentoxide_produced/	How is vanadium pentoxide produced?
1gk28doz	In the last months there was a ever encreasing amount of new social chat AIs which are marketed as a way for lonly people to have the social interaction they need. My question is are there any prooven problems with this aplication?	1642950881.0	savrvw	/r/askscience/comments/savrvw/are_social_chatbot_good_for_human_health/	Are social chatbot good for human health?
58lwvdg0	So I have a question that there may not even be an answer to. I doubt there would be any scientific studies on this as there would be too many variables to be able to control the study. But I am curious about what other think.  But let me explain a little better what I mean before answering.  There are a few scientific facts first: 1. When a woman is born she already has all the eggs she will ever have. Women do not produce more so that's it. 2. When a woman is pregnant she (typically) will stop ovulating for the duration of the pregnancy, and may not start again for up to a year after giving birth.  So let's say a woman has 10 healthy to term pregnancies. We can average that out to 18m per pregnancy where she does not ovulate. Over those 10 pregnancies that adds up to 15 years of not ovulating.  So theoretically could that delay her from starting menopause for up to 15 years?   Also please don't come at me over this question. I am being genuine in my curiosity here and just wondering what others opinions might be. And by no means am I planning on having a whole heap of children to try and delay my own menopause. I have 3 children and that is enough for me. This is just a question.	1642939236.0	sas6ch	/r/askscience/comments/sas6ch/could_pregnancy_possibly_delay_menopause/	Could pregnancy possibly delay menopause?
dl74xa6t	Often, in theories purporting the existence of additional dimensions of space, those dimensions are said to be "curled up" in a tiny space. I can imagine there being additional "directions" of space, but I can't understand what it would even mean for a direction (which I assume dimensions are?) to be anything but, well, "straight" or "open". What does it mean for a dimension to be "curled up", compared to it being straight/open?	1642935486.0	sar7af	/r/askscience/comments/sar7af/what_does_it_mean_for_a_dimension_to_be_curled_up/	What does it mean for a dimension to be "curled up"?
6s60d	Does it hurt the stomach lining? Does this person grow a tolerance to dairy? Do they die? Does nothing happen? I miss milk.	1642924183.0	saoemg	/r/askscience/comments/saoemg/what_are_the_long_term_effects_of_a_lactose/	What are the long term effects of a lactose intolerant person continuously consuming dairy throughout their life?
7qeicdsf	And if so, is there minimum velocity differential for heat to be produced (for example, does every slight gust of wind generate some negligible heat along its borders at it interacts with air at a different velocity)?	1642914186.0	salqbo	/r/askscience/comments/salqbo/if_two_streams_of_gas_intersect_does_friction/	If two streams of gas intersect, does friction occur there? And does that friction produce heat?
e3jji		1642913011.0	saldgr	/r/askscience/comments/saldgr/in_alternating_current_how_is_electricity_carried/	In alternating current, how is electricity carried in one direction (from the power source to the electrical device) if the current is constantly changing direction?
cj5hp0r2		1642877419.0	sa97gz	/r/askscience/comments/sa97gz/if_surface_area_doesnt_affect_friction_why_do/	If surface area doesn't affect friction, why do spinning tops have a tip?
