2qdg5mpg	So we know that antibodies bind specifically to an antigen. But once you know that its bound there, how were they isolated and then thereby used for other things? Most of the antibodies have the same molecular weight and size, so they obviously can't be separated out by mass or size or chemicals.   Do they do it by separating out the antibodies once they've bound to the antigen? If so, then how?	1642600864.0	s7qr2t	/r/askscience/comments/s7qr2t/how_are_specific_antibodies_identified/	How are specific antibodies identified?
i2nghabr		1642535634.0	s7676d	/r/askscience/comments/s7676d/how_much_stronger_is_james_web_than_the_hubble/	How much stronger is James Web than the Hubble?
ignyp	In the winter time, people are wearing layers of heavy clothes that rub up against each other. Combine that with the fact that more laundry loads contain fluffy stuff like blankets and sweats and you have a static electricity perfect storm! Any advice on how to neutralize yourself before touching laundry fresh from the dryer?	1642613804.0	s7vl1k	/r/askscience/comments/s7vl1k/what_are_some_ways_reduce_static_electricity_from/	What are some ways reduce static electricity from clothes fresh from the dryer?
h263bsbf		1642541476.0	s78h03	/r/askscience/comments/s78h03/how_much_land_area_do_we_lose_per_year_due_to/	How much land area do we lose per year due to rising sea levels?
4dc0r1q5		1642540570.0	s784em	/r/askscience/comments/s784em/the_hadley_cell_extends_up_to_30_degrees_north/	The Hadley Cell extends up to 30 degrees north and south of the equator. This is due to the Coriolis force. Does this mean that if Earth spun slower (say days were 72 hours long), would this have an effect on global wind patterns?
6l7lnc0e	I am not scientifically inclined.   So there's this [article](https://www.ncbi.nlm.nih.gov/pmc/articles/PMC3601087/) I read, which I think concludes that prolonged abstinence from cocaine can have individuals reach grey matter levels as those who were never on the drug. Was this interpreted right? Is this article, for lack of a better word, legit?    I know very little on this subject so any responses are helpful, thanks.	1642541280.0	s78e8q	/r/askscience/comments/s78e8q/does_abstinence_from_addiction_regrow_grey_matter/	Does abstinence from addiction regrow grey matter?
a61gq9hx		1642542013.0	s78oh8	/r/askscience/comments/s78oh8/is_the_universe_neutrally_charged_ie_would_the/	Is the universe neutrally charged? i.e. would the sum of the charges of all the particles in the universe be 0?
jix91		1642537883.0	s772um	/r/askscience/comments/s772um/is_there_a_prevailing_theory_on_why_recurrent/	Is there a prevailing theory on why recurrent dreams featuring surreal themes e.g. teeth falling out, being naked in a public forum, being unable to run/walk etc are so common?
57c2h		1642542414.0	s78u06	/r/askscience/comments/s78u06/why_are_fish_unable_to_breathe_oxygen_from_air/	Why are fish unable to breathe oxygen from air when they are able to absorb it from water which is so much more difficult?
65413afe	I always hear that the skin on our face is thinner and more fragile than the rest of our body but by how much? I'm just curious if anyone knows the actual percentage difference, thanks!	1642543351.0	s7979v	/r/askscience/comments/s7979v/how_much_thicker_is_body_skin_than_face_skin/	How much thicker is body skin than face skin?
hiyyzjak	People commonly develop T2 diabetes from insulin resistance where cells no longer respond to insulin from the Pancreas. Most sources I read online say the cause is still largely unknown but weight and sedentary lifestyles are linked with it. Are there any prevailing theories in literature behind why cells lose their ability to respond to insulin? Is it some sort of over exertion of the cells from people with high sugar intakes always needing sugar to be stored? (I've come across the term beta cell exhaustion while reading some articles). What sort of genetic links are there?	1642552728.0	s7crfl	/r/askscience/comments/s7crfl/what_specifically_causes_insulin_resistance/	What specifically causes insulin resistance?
dq3yo3oy	Hi,  &#x200B;  So, wouldn't you want to equalize pressure as soon as possible? That would mean like more oxygen, not having stuff flying around, etc.  However, I read somewhere that experienced pilots do this slowly as possible instead of quickly. Why?     Is it cause of pressure sickness? I thought that occurred in divers cause they absorb nitrogen gas, how does that happen for people in a pressurized cabin? Do other fluids potentially expand?	1642624989.0	s800bg	/r/askscience/comments/s800bg/in_the_even_of_an_explosive_decompression_why/	In the even of an explosive decompression, why would pilots change altitude slowly instead of quickly??
14jbpy	I want to look into properties of potential combinations of the 6 colors of quarks but I know that simply adding their individual masses is only a fraction of the end result. Is there a way to predict how much energy/mass would be involved when any given set of quarks are bound together?	1642624351.0	s7zr7n	/r/askscience/comments/s7zr7n/is_there_a_way_to_predict_the_binding_energy/	Is there a way to predict the binding energy between two or more quarks?
a9zk35me		1642630743.0	s829jb	/r/askscience/comments/s829jb/what_happens_at_certain_increments_of_fasting/	What happens at certain increments of fasting?
13xsl6	I've heard from family and friends that the omicron variant has a shorter period of immunity than the previous variants. Currently in the UK after you've tested positive for covid you have a 3 month period where you are considered immune but I've heard reports that this could be shorter. I have looked into is but I've not found any strong evidence either way.  If anyone could give me some further insight and sources I'd appreciate it,  Thank you  (edit: I understand that omicron has had less severe symptoms but I'm living with a cancer patient so I want to be as well informed as I can be)	1642639034.0	s85duj	/r/askscience/comments/s85duj/does_the_omicron_variant_of_covid19_have_a_faster/	Does the omicron variant of COVID-19 have a faster reinfection rate than other variants?
4yuut	Is the math used to describe melting of solids any different from that used to capture reversible unfolding of macromolecules? Can I analyze raw DSC data (for a melting crystalline solid) in Excel by subtracting a sigmoid curve spanning two sloped baselines on either side of the melt, and assuming the peak of the resulting shape is Tm, where the remaining shape would be the integral of some sigmoidal curve capturing the enthalpy change of the sample?   If not, does anyone have a resource that describes the math in an accessible way which would be fairly straightforward to implement in Excel?  Edit:  > Can I...[assume] the peak ... is Tm  Answer: no.	1642636334.0	s84eo5	/r/askscience/comments/s84eo5/is_dsc_analysis_of_melting_solids_any_different/	Is DSC analysis of melting solids any different from DSC or DSF of macromolecules?
hqvizui	I think it doesn't, but don't know why. Thanks.	1642662394.0	s8cyl7	/r/askscience/comments/s8cyl7/would_an_upsidedown_tv_antenna_make_the_image_on/	Would an upside-down TV antenna make the image on the TV screen upside down as well? If not, why?
a8e2vc5c	So I read that some drinks contain terpenes like citral to make up the flavour. I'm using terpenes to make liquid for the vaporizer and they taste really good so I wondered if I could make some kind of flavoured softdrinks, but I'm not sure how that works as most terpenes are not solluble in water	1642645867.0	s87r0u	/r/askscience/comments/s87r0u/how_do_drinks_that_contain_terpenes_solve_them_in/	How do drinks that contain terpenes solve them in water?
1397r2	"All other things being equal," if instead of 9.8m/s^2 we had half that gravitational pull at sea level, would atmospheric pressure also be half? The reason I'm asking is because I'm trying to conceptualize what flying would be like with our level of technology on a planet will lower gravity.   Would it become easier to fly since you have to overcome less gravity, or would it be harder because you need more lift due to the atmosphere being thinner, or would it be relatively the same, because the lower gravity would result proportionally similarly lowered density?	1642634494.0	s83qe8	/r/askscience/comments/s83qe8/how_is_our_atmospheric_pressure_connected_to_the/	How is our atmospheric pressure connected to the gravitational pull of Earth?
5cl0smw8	If so, how is it done?  Via bone marrow extraction perhaps?	1642670495.0	s8f0cf	/r/askscience/comments/s8f0cf/can_tlymphocytes_of_a_person_be_cloned_in_vitro/	Can T-lymphocytes of a person be cloned in vitro?
n5wx3	My understanding is that sound travels faster through solids and liquids than through gases because the former states are denser. In other words, molecules would collide with less delay between neighbors when passing along a pressure wave if the density is higher.  But it seems that [the speed of sound is higher in hotter air.](https://www.engineeringtoolbox.com/air-speed-sound-d_603.html) Hotter air is less dense than cooler air (e.g., hot air balloon).  Can someone please explain what causes the speed of sound to increase in warm air, but also increase when gases are turned to liquids or solids?	1642682494.0	s8i3v8	/r/askscience/comments/s8i3v8/why_is_the_speed_of_sound_higher_in_warmer_air/	Why is the speed of sound higher in warmer air?
qxyyy	Just as the title asks. Since most of the public has an idea of the Mt. Vesuvius eruption how much does the recent eruption compare.  We have a TON of scientific and recorded data with the recent eruption so how accurately can we compare it to Vesuvius?	1642632036.0	s82rz7	/r/askscience/comments/s82rz7/how_does_the_recent_tonga_eruption_compare_to_the/	How does the recent Tonga eruption compare to the famous Mt. Vesuvius eruption?
tfmdsv1		1642694770.0	s8mble	/r/askscience/comments/s8mble/why_root_canal_hurts_soo_much_if_the_nerve_is_dead/	Why root canal hurts soo much if the nerve is dead?
f5e6ff7k	I have been reading about the different antibody responses to natural infection vs. antibody responses to the different types of vaccination (mRNA, viral vector etc), as well as how in cases of both infection and vaccination, the response can be different if you were infected first, or vaccinated first.  I'm wondering what, exactly, a commonly available, relatively cheap (ideally a two figure sum) antibody test would reveal. Will the result just be positive or negative? Or is it given in terms of the types of antibodies and their relative concentrations?  In other words can such tests differentiate between those with infection- and vaccine-aquired immunity?	1642694766.0	s8mbjb	/r/askscience/comments/s8mbjb/what_do_common_antibody_tests_reveal_can_they/	What do common antibody tests reveal? Can they tell between a person previously infected, or vaccinated, or both infected and vaccinated?
1uf95kr7	How is it possible to distribute home test kits, such as COVID but not exclusively, by mail during periods of freezing temperatures when the tests are supposed to be stored above 36F/2C? Can freezing influence the results of these kinds of tests?	1642692767.0	s8ll6n	/r/askscience/comments/s8ll6n/are_lateral_flow_test_kits_damaged_by_freezing/	Are lateral flow test kits damaged by freezing temperatures?
2d510dz7	An undergraduate in a health related field here I’ve come across some really confusing stuff regarding this topic. I’ve always been kind of health conscious from a  young age and interested in this kind of stuff.   I was under the impression that saturated fat and cholesterol both contribute to raising serum cholesterol levels.   However one of my professors who’s now a epidemiologist/professor and was a practising cardiologist stated that dietary cholesterol raising serum cholesterol levels has been debunked and that saturated (and trans) fats contribute to serum cholesterol levels but not dietary cholesterol.   I’ve been reading on this and am more confused than I was before.  I see stuff like this   Harvard School of Public Health:  >Choose foods with healthy fats, limit foods high in saturated fat, and avoid foods with trans fat.   >Although it is still important to limit the amount of cholesterol you eat, especially if you have diabetes, for most people dietary cholesterol isn’t nearly the villain it’s been portrayed to be. Cholesterol in the bloodstream, specifically the bad LDL cholesterol, is what’s most important. And the biggest influence on blood cholesterol level is the mix of fats and carbohydrates in your diet—not the amount of cholesterol you eat from food.   But the American heart association and FDA recommend limiting cholesterol consumption etc. and have also come across many studies showing dietary cholesterol does effect heart health as well as websites claiming that a lot of studies are industry funded and not reliable.  I would like some clarity on this thanks any input is appreciated	1642678270.0	s8gy96	/r/askscience/comments/s8gy96/does_dietary_cholesterol_raise_serum_serum/	Does dietary cholesterol raise serum serum cholesterol levels?
y15kq		1642678156.0	s8gx0d	/r/askscience/comments/s8gx0d/why_do_oak_woodlands_and_savannahs_thrive_in_the/	Why do Oak Woodlands and Savannahs thrive in the Bay Area and Central Valley but only exist in small pockets in Southern California?
4pohvswa		1642676030.0	s8gdi7	/r/askscience/comments/s8gdi7/were_there_periods_of_rapid_or_runaway_global/	Were there periods of rapid or 'runaway' global warming, due to tipping points and feedback loops, during the Paleocene-Eocene Thermal Maximum occur?
3n50mem0	The delta and omicron variants have both been touted as more transmissible, replacing the existing variants as the dominant forms in the population. With the emergence of omicron as the new dominant variant, does delta simply disappear as omicron is able to outcompete it for hosts? And using that logic would the next major variant have to be even more transmissible?	1642704250.0	s8pwmg	/r/askscience/comments/s8pwmg/are_we_tending_towards_more_infective_variants_of/	Are we tending towards more infective variants of coronavirus?
bg80fmw0	Cheers fellas.	1642701188.0	s8oqq7	/r/askscience/comments/s8oqq7/would_terminal_velocity_on_mars_be_the_same_as_on/	Would terminal velocity on Mars be the same as on earth and take longer to reach, or be lower on Mars?
n2u4a		1642709790.0	s8rvrf	/r/askscience/comments/s8rvrf/are_people_who_catch_covid19_multiple_times_more/	Are people who catch COVID-19 multiple times more at risk for long COVID?
jse90	...therefore the star would be nearly invisible to the naked eye. Are there any examples of such (or similar) known stars?	1642628190.0	s8195s	/r/askscience/comments/s8195s/is_it_possible_for_a_star_to_only_output_light/	Is it possible for a star to only output light outside of the human visible spectrum?
172hv0	Because tea comes from a plant, how do the remove the caffeine from it? The same for coffee etc.	1642707642.0	s8r5h7	/r/askscience/comments/s8r5h7/how_do_they_make_caffeinated_drinks_not/	How do they make caffeinated drinks not caffeinated?
6i2jom	Clearly not ALL plant and animal life died out with the dinosaurs. How did the ones that clung to life in the post-Chixculub dark era do so?	1642660258.0	s8cd4m	/r/askscience/comments/s8cd4m/after_the_kt_extinction_how_did_the_survivors/	After the K-T extinction, how did the survivors live while the Earth was recovering?
zc545	What I mean is how many return to exactly how they were before, without any lingering issues at all?	1642643928.0	s87303	/r/askscience/comments/s87303/what_percentage_of_patients_who_survive_due_to/	What percentage of patients who survive due to CPR return to fully functioning states?
y6wto	I realise it’s probably a selection bias at play but I seem to regularly hear stories where someone who was otherwise healthy and led a healthy lifestyle dropping dead from a heart attack with no prior symptoms. Are there non Invasive diagnostic tools available that can pick up any issues with a regular GP check up or do you generally just go to hospital after you have symptoms?	1642648190.0	s88jeh	/r/askscience/comments/s88jeh/do_arterial_blockages_get_diagnosed_regularly/	Do arterial blockages get diagnosed regularly before symptoms?
mo3u2	And does it have anything to do with being similar to the sky during the day?	1642657851.0	s8bnij	/r/askscience/comments/s8bnij/why_does_blue_light_mess_up_your_sleep/	Why does blue light mess up your sleep?
19z3ojzr	I have watched many videos about genetics and is still a little confused about two things:  1. Do most people have the same genes in the same order on their chromosomes? For example, these are some genes on chromosome 5 (according to wikipedia): ABLIM3, ADAMTS2, AGXT2, ANKRD31,APBB3,APC, are these genes all on chromosome 5 in the same order for 99% of humans? Genes don't somehow jump to a different chromosome, right? 2. Most people have 2 sets of each chromosome, one from your mother, one from your father, are they indistinguishable? Is there anything on the chromosomes that tell us if it came from the sperm or the egg? Or that information has to be inferred?	1642662971.0	s8d461	/r/askscience/comments/s8d461/are_genes_arranged_basically_the_same_in_most/	Are genes arranged basically the same in most people?
1jpnre1q		1642678991.0	s8h4sq	/r/askscience/comments/s8h4sq/what_is_the_delta_v_required_to_reach_the/	What is the delta V required to reach the Lagrange point between Sol and Earth and what's an effective way to reach it?
5e23eqif	I’m just wondering why we only have L1 and L2 in GPS (and L5 that will be implemented soon). Wouldnt having more signals to compare against each other improve accuracy of points taken? Is it because a third signal would be redundant, or that it wouldnt increase accuracy to the point of being cost effective? Thank you	1642706442.0	s8qpe8	/r/askscience/comments/s8qpe8/why_are_there_only_two_signals_used_in_gps/	Why are there only two signals used in GPS? Wouldn’t having more than two be more accurate?
hggxt	Even in multi-lingual countries, how did they decide what the place should be called in the different languages? Where does the English name for Germany or Austria come from when their German-language names are vastly different in pronunciation and literal interpretation? Who took "Nippon" and said, "yeah, that's 'Japan', now."??	1642708135.0	s8rbw0	/r/askscience/comments/s8rbw0/how_are_countries_named_in_their_nonnative/	How are Countries named in their non-native languages?
4we1a	Consider this scenario:   * Two bodies of mass (A and B) with a great distance between them is orbiting each other in a circular orbit. * The time for gravitational waves to reach the other body 1 hour.  For body A, does the force pull towards B's position at the point of wave emission or is it somehow being pulled towards B's current position? If the latter is the case, how does A know B's current position?  Bonus question. Does gravitational waves from different sources collapse into one direction or will the body be pulled towards all the sources directions?	1642729269.0	s8yph3	/r/askscience/comments/s8yph3/how_does_gravity_work_in_terms_of_which_direction/	How does gravity work in terms of which direction the force is applied?
ec1ey	**Please read this entire post carefully and format your application appropriately.**  This post is for new panelist recruitment! The previous one is [here](https://www.reddit.com/r/askscience/comments/or5p3q/askscience_panel_of_scientists_xxv/).  The panel is an informal group of Redditors who are **either professional scientists or those in training to become so**. All panelists have at least a graduate-level familiarity within their declared field of expertise and answer questions from related areas of study. A panelist's expertise is summarized in a color-coded AskScience flair.  Membership in the panel comes with access to a panelist subreddit. It is a place for panelists to interact with each other, voice concerns to the moderators, and where the moderators make announcements to the whole panel. It's a good place to network with people who share your interests!  \-------------------  **You are eligible to join the panel if you:**  * Are studying for at least an MSc. or equivalent degree in the sciences, AND, * Are able to communicate your knowledge of your field at a level accessible to various audiences.  \-------------------  **Instructions for formatting your panelist application:**  * Choose exactly one general field from the side-bar (Physics, Engineering, Social Sciences, etc.). * State your specific field in one word or phrase (Neuropathology, Quantum Chemistry, etc.) * Succinctly describe your particular area of research in a few words (carbon nanotube dielectric properties, myelin sheath degradation in Parkinsons patients, etc.) * Give us a brief synopsis of your education: are you a research scientist for three decades, or a first-year Ph.D. student? * Provide links to comments you've made in AskScience which you feel are indicative of your scholarship.  Applications will not be approved without several comments made in /r/AskScience itself.  \-------------------  Ideally, these comments should clearly indicate your fluency in the fundamentals of your discipline as well as your expertise. We favor comments that contain citations so we can assess its correctness without specific domain knowledge.  Here's an example application:  `Username: /u/foretopsail`  `General field: Anthropology`  `Specific field: Maritime Archaeology`  `Particular areas of research include historical archaeology, archaeometry, and ship construction.`  `Education: MA in archaeology, researcher for several years.`  `Comments: 1, 2, 3, 4.`  Please do not give us personally identifiable information and please follow the template. We're not going to do real-life background checks - we're just asking for reddit's best behavior. However, several moderators are tasked with monitoring panelist activity, and your credentials will be checked against the academic content of your posts on a continuing basis.  You can submit your application by replying to this post.	1642744588.0	s93rpe	/r/askscience/comments/s93rpe/askscience_panel_of_scientists_xxvi/	AskScience Panel of Scientists XXVI
4kmv5tzz	I work with mass labelled standards a lot, particularly C13 labelled compounds. How are these synthesized with such accuracy they can be used as standards? How do we seperate them from their more abundant counter parts?	1642743421.0	s93g0c	/r/askscience/comments/s93g0c/how_does_one_create_a_mass_labelled_standard/	How does one create a mass labelled standard?
ec1ey	Hi Reddit! I'm Dr. Yasmin Hurd, the Director of the Addiction Institute within the Mount Sinai Behavioral Health System, and the Ward Coleman Chair of Translational Neuroscience and Professor of Psychiatry and Neuroscience at the Icahn School of Medicine at Mount Sinai in New York. I'm an internationally renowned neuroscientist whose translational research examines the neurobiology of drug abuse and related psychiatric disorders. My research exploring the neurobiological effects of cannabis and heroin has significantly shaped the field. Using multidisciplinary research approaches, my research has provided unique insights into the impact of developmental cannabis exposure and epigenetic mechanisms underlying the drug's protracted effects into adulthood and even across generations. My basic science research is complemented by clinical laboratory investigations evaluating the therapeutic potential of novel science-based strategies for the treatment of opioid addiction and related psychiatric disorders. Based on these high-impact accomplishments and my advocacy of drug addiction education and health, I was inducted into the National Academy of Medicine, complementing other honors I have received in the field. Recently, I was featured in the NOVA PBS film "[The Cannabis Question](https://www.youtube.com/watch?v=w-dxMTDzMLY)," which premiered in September and explores the little-known risks and benefits of cannabis use. I'll be on at 3 p.m. (ET, 20 UT), ask me anything!	1642766482.0	s997hz	/r/askscience/comments/s997hz/askscience_ama_series_im_the_director_of_the/	AskScience AMA Series: I'm the Director of the Addiction Institute at Mount Sinai who studies the neurobiological effects of cannabis and opioids. AMA!
8ox92	I understand the general concept behind redshifting, and that it has to do with the universe expanding. But I have never understood how someone can tell redshifted light apart from light that might come from a red supergiant.  Alongside that, how do they determine the *amount* of redshifting that has occurred?	1642691462.0	s8l47a	/r/askscience/comments/s8l47a/when_using_telescopes_to_map_out_the_universe/	When using telescopes to map out the universe (like DESI), how do astronomers/astrophysicists tell the difference between light that has been redshifted versus light that is coming from a reddish star?
