8km0q	My understanding of shockwaves is that they form from air moving at faster than the speed of sound due to an external force, and given enough distance they drop to a standard pressure wave moving at the speed of sound.   Is the drop linear based on initial speed? Inverse squared based on distance?	1642317154.0	s569rr	/r/askscience/comments/s569rr/how_quickly_do_shockwaves_transition_down_to_the/	How quickly do shockwaves transition down to the speed of sound?
ect3o	How long could a new-New Zealand form?	1642336370.0	s5ays9	/r/askscience/comments/s5ays9/with_the_tonga_volcano_happening_my_son_asked_me/	With the Tonga Volcano happening; my son asked me how long it would take for another New Zealand-sized island to emerge in the south pacific. Would it be a matter of thousands of years or billions? Or could it happen tomorrow?
zrkp5	Why is it a constant shaking aswell, why not a single "jolt"?	1642331697.0	s59sch	/r/askscience/comments/s59sch/if_an_earthquake_is_caused_by_a_sudden_release_of/	If an earthquake is caused by a sudden release of built up pressure, why do they last so long?
yt34o	EPV prevalence for adults is about 95% worldwide. What about the remaining 5%? Are they naturally immune? Do we know why?	1642355591.0	s5h9ea	/r/askscience/comments/s5h9ea/how_can_some_people_escape_epsteinbarr_virus/	How can some people escape Epstein-Barr virus?
e08l7	If molecules in a liquid are moving past each other and bumping into each other, at what speed are they moving? Given room temperature is 20°C	1642294687.0	s4zbtq	/r/askscience/comments/s4zbtq/in_a_room_temperature_glass_of_water_how_quickly/	In a room temperature glass of water, how quickly are atoms moving relative to, say, the average position of all the atoms in that glass of water?
12mh0c	Hi.  I'm reading Kurt Vonnegut's Galapagos and at one point it says that marine iguanas dive underwater, scoop a large amount of algae and then bask in the sun to increase their body temperature until the algae have been boil and cooked, at which point they are soft enough to be digested. It even says that the digestive system forms a kind of pressure boiler.  I've found this fascinating, but I haven't been able to confirm it. I've seen many pictures of iguanas basking in the sun and information about how much and which kinds of algae they eat, but I find no mention of the boiling part.  Can anyone confirm it/debunk it?	1642359792.0	s5it4q	/r/askscience/comments/s5it4q/is_it_true_that_marine_iguanas_boil_the_algae/	Is it true that marine iguanas boil the algae they consume before digesting them?
1ym7a713	As a child, I had to have 4 extra canine teeth removed. I had a complete extra set, top and bottom. I’ve only met one other person with extra adult teeth, and it was one extra tooth. My dentist said he never saw it before. Is it really that rare?	1642348868.0	s5esva	/r/askscience/comments/s5esva/how_rare_is_it_for_humans_to_have_extra_adult/	How rare is it for humans to have extra adult teeth?
ahl9unb6	Do we have AI-powered motion tracking satellites that actively monitor these objects every second, their position, size, luminosity, anything else they can read, or is there more or less involved? And who does it? NASA, and/or different observatories?	1642288637.0	s4x7em	/r/askscience/comments/s4x7em/to_what_extent_are_we_keeping_track_of_stars_and/	To what extent are we keeping track of stars and other things in space?
musuq	As in, what is the most recent animal to go extinct because of nature? Preferably larger animals and not insects or very small creatures	1642291460.0	s4y81q	/r/askscience/comments/s4y81q/what_is_the_most_recent_extinct_animal_that/	What is the most recent extinct animal that humans played little to no impact in?
54jsblee	There is a plenty of sources that states that cones are used to see colors under well-lit conditions (photopic vision) and rods are used under low-light levels, because they're more sensitive (scotopic vision).  However, I can't find anything, whether rods are also used in good light conditions.  (I'm sorry for any mistakes. English is not my mother tounge.)	1642370114.0	s5mouy	/r/askscience/comments/s5mouy/are_rod_cells_also_used_in_photopic_vision/	Are rod cells also used in photopic vision?
4q45k	I can imagine that the atmosphere might be too thin to produce lightning, but if it does happen I’m curious what it’s like there. Do rovers and other instruments have to be designed for the possibility of a lightning strike?	1642366363.0	s5la8w	/r/askscience/comments/s5la8w/does_lightning_occur_on_mars_if_so_what_is_the/	Does lightning occur on Mars? If so, what is the effect of such a high-temperature phenomenon in such a cold environment?
5gzb9x5l	If the atmosphere is hot, won't the water in the clouds be hot as well? Also if it isn't hot, why does it take so long for the day to heat up again? Does it have something to do with humidity?	1642361565.0	s5jhfh	/r/askscience/comments/s5jhfh/how_does_the_rain_wash_the_heat_away/	How does the rain "wash" the heat away?
6qs1n	I know uranium deposits are fairly rare, but given all the volcanoes in the world and throughout the ages I'm wondering if there was ever, or if there could be, an eruption that contained radioactive elements such as uranium in the lava and the ashes?    If not, why?  Similarly, what about other interesting, precious metals (gold etc)?     Note: Funnily enough it's impossible to Google this question as all results point to the brilliant idea to put radioactive waste IN volcanoes!	1642372877.0	s5npd2	/r/askscience/comments/s5npd2/can_volcanos_release_radioactive_elements/	Can volcanos release radioactive elements?
80ggngg	I'm arguing about a character who can outrun explosions, but I'm having trouble finding a concrete answer.  Basically, I keep looking up things related to explosion speed. How fast the shockwaves move, how fast grenade fragments are launched, etc. Google keeps bringing me back to Detonation Velocity.  Other users in the thread tell me that air can slow down explosions speed dramatically. The example they gave was "Soundwaves travelling at mach 12 through ice with no air bubbles in it will drop right down to mach 1if they transition into the air"  However I can't find anything about that on google either, and I can't understand half of the answers it does give.  &#x200B;  Can someone give an answer on how fast explosions normally travel, and if those speeds are the same as detonation velocity or not?	1642381820.0	s5qxb2	/r/askscience/comments/s5qxb2/is_the_detonation_velocity_the_same_speed_at/	Is the Detonation Velocity the same speed at which an explosion travels at?
afvmymxg		1642375828.0	s5osuw	/r/askscience/comments/s5osuw/is_it_possible_for_the_tor_network_to_have_better/	Is it possible for the Tor network to have better connection speed without sacrificing security/privacy?
10cpon	I was curious about either in vaccinated individuals or for young children (five or younger), but any cohort would be of interest. Some recommendations say "safe for 90 days" but it's unclear if this holds for this variant.  Edit: We are vaccinated, with booster, and have a child under five. Not sure why people keep assuming we're not vaccinated.	1642421054.0	s62icy	/r/askscience/comments/s62icy/is_there_research_yet_on_likelihood_of/	Is there research yet on likelihood of reinfection after recovering from the omicron variant?
7vw81n8x		1642404946.0	s5y8hi	/r/askscience/comments/s5y8hi/how_did_we_contain_ebola_but_couldnt_contain_covid/	How did we contain Ebola but couldn't contain Covid?
7cndjrxx	Hi! This is for You rocket engineers out here! From my (very limited) understanding, a big problem with reignition of a liquid-fuel rocket engine in space is the 'sloshing' of liquid within the tanks.  When the engines are already fired it causes no issue, since the g-forces during acceleration keep the fuel at the 'bottom' of the tank, where the pump is.  But how is this risk, of the pumps running empty, mitigated during reignition? I can imagine you could give the rocket a "push" with reaction thrusters to force the fuel to the bottom of the tank and then start up the pumps, but I haven't managed to find any real literature addressing this problem.   If You know something about this I would be interested to hear Your take on it! Thank You!	1642416195.0	s616q7	/r/askscience/comments/s616q7/how_do_liquid_fuel_rocket_engines_reignite_in/	How do liquid fuel rocket engines reignite in zero-g without destroying the turbopump? (fuel sloshing problem)
14vurp	The boiling point of isopropanol is 82.5C, while ethanol is 78.3C. This makes sense to me, as iso has more hydrocarbons in its structure. However, the enthalpies of vaporization trend in the opposite direction, with ethanol requiring 204 cal/g of heat, with isopropanol only needing  159 cal/g.   Can anyone please explain this to me? Thank you!	1642360477.0	s5j2m3	/r/askscience/comments/s5j2m3/why_does_isopropyl_alcohol_evaporate_faster_than/	Why does isopropyl alcohol evaporate faster than ethanol?
5qvfuqtv		1642360618.0	s5j4li	/r/askscience/comments/s5j4li/if_an_embryo_develops_a_mutation_during/	If an embryo develops a mutation during development, is it possible that some cells will have the mutation and others won't?
dwzlduwz	In 2011 when the Japan earthquake tsunami waves hit California, tsunami was 6” high. The waves did significant damage, ripping apart the marina docks in Santa Cruz and other Northern California coastal harbors. The tsunami from the Tonga quake yesterday was expected to be 8”-9” inches tall, yet little damage was expected. Why would a higher tsunami wave be expected to have less force than a smaller one?	1642363744.0	s5kapa	/r/askscience/comments/s5kapa/what_determines_the_power_of_a_tsunami_wave/	What determines the power of a tsunami wave?
1zgacoyc	For example would a fly evolve more quickly than a tortoise?   And if yes why don't species evolve to have shorter life spans in order to evolve more quickly?	1642372046.0	s5nej3	/r/askscience/comments/s5nej3/do_species_with_shorter_life_spans_evolve_more/	Do species with shorter life spans evolve more quickly than ones with longer life spans?
gtlcybm8	For example, could the ice made with a freezer be softer than the one in Antarctica? Like is ice harder at -70C than at -10C? I know ice can be thinner and support less weight (like at the surface of a lake), but is that ice less strong than other types of ice? All of this stemmed because I saw a video of someone making clear ice with no bubbles and wondered if that's stronger/harder than your average ice with bubbles.	1642385436.0	s5s6gd	/r/askscience/comments/s5s6gd/can_some_ice_be_harder_than_other/	Can some ice be harder than other?
6whjh0ws	Suppose I have the power to submerge a fourth of a vertical, circular tube 50 feet in diameter and 500 feet high inside a deep vat of water so that the base of the tube isn't touching the base of the vat. Then, suppose I insert a rigid seal with an airtight grip around the inner edges of the tube at its submerged base and then begin pulling upwards on the seal so that the seal makes its way up through the tube while maintaining its airtight seal. The tube would remain stationary, vertical, and partly submerged the whole time I pull the seal upwards.   I'd imagine that pulling the airtight seal upward would create a vacuum under the seal that, as the seal rises, would draw in/"suck" water into the tube from the vat. Would it then be possible that I pull the seal all the way up to the top of the 500 ft tube and create a water column that reaches the top of this 500 ft tube? Kind of like a syringe, but on a massive scale.   I keep hearing that the most I can "suck" water upwards is around 30 feet at standard atmospheric conditions. But I found an old /askscience thread where one Redditor was saying how negative pressure and cavitation, like in a piston "sucking" up water in a tube, can help one "suck" water to a vertical height of more than a mile. Here's the old thread:   [https://www.reddit.com/r/askscience/comments/3zy9co/what\_is\_the\_maximum\_distance\_one\_can\_vertically/cyqsqp4/](https://www.reddit.com/r/askscience/comments/3zy9co/what_is_the_maximum_distance_one_can_vertically/cyqsqp4/)  The original Redditor doesn't seem to be active anymore, and the thread is years old, so I wanted to ask in a new threat. **Could my syringe-like contraption be able to draw water to the top of the tube?** Any inputs would be much appreciated.	1642386100.0	s5sem7	/r/askscience/comments/s5sem7/what_is_the_maximum_distance_one_can_vertically/	What is the maximum distance one can vertically "suck" water like a syringe?
zpzu7	I've drunk malaria tablets which were bitter as hell, and I thought why not a capsule? It was taken beforehand (prophylactic I think) so the difference in metabolising time should not matter.   On the other hand, I have had pain capsules, where I thought a tablet would have done better because it may kick in quicker.	1642395998.0	s5vmp5	/r/askscience/comments/s5vmp5/what_is_the_decision_process_to_decide_which/	What is the decision process to decide which medicines becomes tablets and which becomes capsules?
a1dteiia	When Europeans migrated to the New World, they brought with them many diseases that ravaged the native human populations, which had no immunity due to a lack of domesticated animals. However, both populations already had domesticated dogs. Were there any major infections caused by a canine disease? Or did human proximity to dogs since prehistory give us immunity, and so no potential for more recent pandemics, or are our immune systems too dissimilar for transmission?	1642442836.0	s6afyz	/r/askscience/comments/s6afyz/domesticated_animals_are_known_to_be_a_source_of/	Domesticated animals are known to be a source of many diseases in humans. Historically, are there any pandemics that have been caused by canine diseases? If not, why do dogs not carry plague-worthy illnesses, or why are humans immune?
461ha14g		1642472965.0	s6m5sa	/r/askscience/comments/s6m5sa/when_measuring_how_high_terrain_is_on_the_moon/	When measuring how high terrain is on the moon and Mars, what do they use for/how do they determine “sea level”?
11ebxv	Just got my booster last night and feeling the side effects. Just came to mind as I was learning a bit about how the vaccine works.	1642480405.0	s6oopy	/r/askscience/comments/s6oopy/what_happens_when_your_body_fights_off_omicron/	What happens when your body fights off Omicron and afterwards get a booster. Are both types of antibodies identical? How does your body know what to use?
93u3teqp		1642517437.0	s6z9br	/r/askscience/comments/s6z9br/how_banking_of_roads_will_help_the_vehicle_to/	How banking of roads will help the vehicle to travel along a circular path?
l1q4t	I just got a new periodic table and noticed that Cn is listed as part of the transition metals rather than the synthetic suoer-heavy elements. Does anyone know why this is?	1642515571.0	s6yl0u	/r/askscience/comments/s6yl0u/why_is_copernicium_listed_as_a_transition_metal/	Why is copernicium listed as a transition metal on certain periodic tables, but not the surrounding synthetic elements?
ijrh2j0v		1642441022.0	s69okj	/r/askscience/comments/s69okj/what_was_the_reaction_of_physics_community_when/	What was the reaction of physics community when the results of the double split experiment were published?
dg207	If we can measure that the Earth's atmosphere is heating up, then does that mean the core is also heating up, and could that possibly mean that the outer surface made up of hard rock is getting thinner because of the increasing ratio of magma to solid rock? Could this lead to more tectonic shifts and volcanoes as well as speed up the sea's warming by thinning the gap between the deepest points in the sea and the lava underneath?   I made a 10 minute video explaining it here. [https://www.youtube.com/watch?v=KV3rza7GZ6M&t=199s](https://www.youtube.com/watch?v=KV3rza7GZ6M&t=199s)   Is this possible and could it be happening?	1642515067.0	s6yeqz	/r/askscience/comments/s6yeqz/is_the_earths_core_getting_hotter/	Is The Earth's Core Getting Hotter?
2uogag0y	 So let me begin by telling from which direction I'm coming from. After  using my water boiler in the kitchen for a couple of days, lime will  settle at the bottom of it. Why does this happen? As far as I know warm  water is capable of holding more salts and lime then cold water. Is this  right? And my question then is, why is that even the case, why is there  a difference in the amount of slat/lime, water can hold with different  temperatures. I was wondering that because I don't understand why the  lime settles down if it more it can dissolve in warm water. Is it only  because of the steam that can't hold the lime? But then, why does there  is no lime at the top of my boiler but only at the bottom?	1642513991.0	s6y19k	/r/askscience/comments/s6y19k/why_does_saltlime_dissolve_in_water_and_why_is/	Why does salt/lime dissolve in water and why is the amount dependent on the temperature?
fvj3lzpi	Title basicly. Is it related to the lipids making it easier for it to reproduce ? Or is it their immune system as fast foods are both related to lower immune responses and well, gaining weight as well ? If y'all have videos I love to watch that too :)  Edit : no clue why I keep getting downvoted, perhaps its my bad english and I thank you for your patience with my learning of this language xoxox all the best to y'all     Edit 2 : thank you so very much for all the answers ! i feel like i learned much today and I'm extra motivated to keep my lifestyle active and healthy !!	1642525399.0	s7279i	/r/askscience/comments/s7279i/why_does_covid_hit_overweight_people_harder/	Why does covid hit overweight people harder ?
35mlv	Table salt is fortified with iodine because many areas don't have enough in their ground water. As people replace table salt with sea salt, are they putting themselves at risk or are our diets varied enough that the iodine in salt is superfluous?	1642529663.0	s73vk1	/r/askscience/comments/s73vk1/has_there_been_any_measurable_increase_in_goiters/	Has there been any measurable increase in Goiters as sea salt becomes more popular?
dxfs7roc	   So, I've been watching lots of documentaries about Venus. Science tells us that once, Venus was a planet that was very similar to earth.  Now, it's a treacherous poisonous inferno.  Is there any science to suggest that global warming will send Earth to exactly the same fate.	1642527290.0	s72xry	/r/askscience/comments/s72xry/will_earth_suffer_the_same_fate_as_venus/	Will Earth suffer the same fate as Venus?
5rtk6	I've always been a highly strung person, but recently I've been under a lot of stress (who hasn't?) and as well as my stutter getting worse I've developed a tendency towards random twitches. Now, I'm getting help with my anxiety, so I'm not looking to get free therapy, I'm just wondering what causes the stress to manifest in this particular way.  What's going on that makes my brain say "Hey, this is a difficult situation, so let's make the left arm wave randomly or the head twitch to the side."  I'm pretty sure I'm not doing it for attention because it's almost always when I'm alone. Could it possibly be some sort of learned behaviour? If you had asked me to "act like a crazy person" a few months ago, I'm pretty sure this is what I would have done as I've seen similar behaviour on tv.  Writing this post has made me think about it which has caused and unusual amount of twitches in a short time, including a kind of clenched shrugging, which is new. Interesting, but quite uncomfortable.	1642465624.0	s6jkcd	/r/askscience/comments/s6jkcd/why_does_stress_sometimes_manifest_itself_as_tics/	Why does stress sometimes manifest itself as tics and twitches?
dhfburue	I’ve noticed that while both groups are from the same order, they behave very differently from one another, even outside of their anatomical differences. You can really see this when looking at a comparison between a legless lizard and a snake. I don’t know much about brain anatomy, but I’m curious how snake and lizard brains may differ, and how that may impact their behaviour.	1642463627.0	s6iuav	/r/askscience/comments/s6iuav/are_there_any_major_brain_differences_between/	Are there any major brain differences between snakes and lizards?
fop0i	So I came across an article [here](https://www.sciencealert.com/scientists-identify-specific-gene-variant-that-protects-against-severe-covid-19) and was wondering if there is any difference between the two, in light of the article which I mentioned above that deals with the specific Gene Variant that protects against severe COVID-19.	1642456926.0	s6g95e	/r/askscience/comments/s6g95e/what_is_the_difference_between_rs10774671g_and/	What is the difference between rs10774671-G and rs10774671-A?
7xncydkz	When banking things like chiffon or sponge cake, egg whites are usually beaten with some acid to help stabilise it and ultimately get stiffer peaks. I can only think of acids creating an unfavourable environment for enzymes but that doesn't seem relevant here :)	1642539440.0	s77oao	/r/askscience/comments/s77oao/why_does_adding_an_acid_to_egg_whites_help/	Why does adding an acid to egg whites help stiffen it?
37taz5gn	Let me elaborate my question. The LSD molecule binds to the 5HT2B receptor between the III and IV Helice. LSD is considered as a partial agonist of the 5TH-Receptors. How would the binding look with a full agonist. Additionally what are these Helices made of. I know it's a G-Protein but how can I think of it. What's the complex of Helices?	1642538505.0	s77bg3	/r/askscience/comments/s77bg3/why_do_different_molecules_bind_to_different/	Why do different molecules bind to different Helices on receptors?
5ne1mwdr	In my understanding each vaccine, before it enters regular usage, must undergo trials. During trials one group of people gets a vaccine, the other gets placebo, so that we can compare number of infections in each group.  I can see how it works with diseases like influenza, COVID or measles. But how it works with rabies?  Rabies vaccines are post-exposure and the disease is always lethal. It surely is unethical to give people exposed to rabies placebo if there is a potential vaccine, even if untested?  Rabies is very rare, so the trial groups must be huge to gather enough data?  Is there maybe a different process for diseases like rabies?	1642546535.0	s7afiw	/r/askscience/comments/s7afiw/how_are_rabies_vaccines_tested_on_humans/	How are rabies vaccines tested on humans?
1qo6		1642518315.0	s6zkwv	/r/askscience/comments/s6zkwv/how_are_birds_able_to_imitate_human_labial_and/	How are birds able to imitate human labial and dental phonemes without lips or teeth?
xfqeb	I've been playing with online cartesian drawing tools. When n=1, it is a rotated square at half PI. Then it will transform into a circle while rising n slowly towards 2.  Then, an interesting thing began. Any increase in n will make it more square-y but will never become a complete square.  Will it became a true square when n reaches infinity? What is the proof?	1642572347.0	s7j8vl	/r/askscience/comments/s7j8vl/is_there_any_non_graphic_proof_that_when_n/	Is there any non graphic proof that when n appoaches infinity, |(x^n)| + |(y^n)| = r is a square?
18ii90sm		1642591191.0	s7ny5j	/r/askscience/comments/s7ny5j/are_there_any_studies_suggesting_whether/	Are there any studies suggesting whether long-COVID is more likely to be a life-long condition or a transient one?
9rymvljl	I was wondering if there is some other mechanism for creation of photons/light or if black body radiation is the sole origin of photons.	1642573501.0	s7jken	/r/askscience/comments/s7jken/is_every_photon_created_by_black_body_radiation/	Is every photon created by black body radiation?
l4mnr	If you have a wire that is very long (100s of km) and you put an AC current over that wire, will the phase of the AC at both ends be the same?  Considering that there is a delay between the current moving from one end to the other.	1642590112.0	s7nod1	/r/askscience/comments/s7nod1/is_the_phase_of_ac_over_a_very_long_wire_the_same/	Is the phase of AC over a very long wire the same at both ends?
156f36ym		1642544907.0	s79sx8	/r/askscience/comments/s79sx8/why_is_warm_air_lighter_than_cold_air/	Why is warm air lighter than cold air?
8km0q	My understanding of shockwaves is that they form from air moving at faster than the speed of sound due to an external force, and given enough distance they drop to a standard pressure wave moving at the speed of sound.   Is the drop linear based on initial speed? Inverse squared based on distance?	1642317154.0	s569rr	/r/askscience/comments/s569rr/how_quickly_do_shockwaves_transition_down_to_the/	How quickly do shockwaves transition down to the speed of sound?
ect3o	How long could a new-New Zealand form?	1642336370.0	s5ays9	/r/askscience/comments/s5ays9/with_the_tonga_volcano_happening_my_son_asked_me/	With the Tonga Volcano happening; my son asked me how long it would take for another New Zealand-sized island to emerge in the south pacific. Would it be a matter of thousands of years or billions? Or could it happen tomorrow?
zrkp5	Why is it a constant shaking aswell, why not a single "jolt"?	1642331697.0	s59sch	/r/askscience/comments/s59sch/if_an_earthquake_is_caused_by_a_sudden_release_of/	If an earthquake is caused by a sudden release of built up pressure, why do they last so long?
yt34o	EPV prevalence for adults is about 95% worldwide. What about the remaining 5%? Are they naturally immune? Do we know why?	1642355591.0	s5h9ea	/r/askscience/comments/s5h9ea/how_can_some_people_escape_epsteinbarr_virus/	How can some people escape Epstein-Barr virus?
