aj9jprmf	I know this seems like a simple question, but the context of this question comes from a debate I heard between two classmates. One claimed that sex of an organism was first and foremost a question of gamete type. The other claimed that sex was a question of general reproductive function, i.e. a woman with Complete Androgen Insensitivity syndrome would not be male because despite having testes, the rest of her body was geared towards female reproduction.  Their analogy is that if a left shoe was put on a right foot, it would still be a left shoe because its structure is organized around the left foot, regardless of what it's being used for or wether or not it's functional. Basically, that a "male phenotype" was an organism organized towards the production of sperm, and that this is born out by the definition of sex that comes up on Google.  >either of the two main categories (male and female) into which humans and most other living things are divided on the basis of their reproductive functions.  The however, the gamete-based definition seems to be favored by dictionaries like miriam webster which say that "female" is  >"of, relating to, or being the sex that typically has the capacity to bear young or produce eggs"  And vice versa for men. The Oxford Dictionary similarly favors it with even less ambiguity.  >Denoting the gamete (sex cell) that, during sexual reproduction, fuses with a male gamete in the process of fertilization. Female gametes are generally larger than the male gametes and are usually immotile (see oosphere; ovum).  Which of these perspectives is correct? I understand that this is a touchy topic for a lot of people, especially with current debates about gender and intersex people.	1642878582.0	sa9ms2	/r/askscience/comments/sa9ms2/how_is_biological_sex_defined_gametes_or_body/	How is biological sex defined, gametes or body types?
qi37j	Basically the title; does nutrition have an impact on how sick you get?  Have there been studies and if yes; A) where can I find them? B) is there a simple way of explaining those to the laymen like myself?	1642965279.0	sb1b9v	/r/askscience/comments/sb1b9v/has_there_been_a_comparison_study_for_nutrition/	Has there been a comparison study for nutrition versus seriousness of physical impact of COVID-19?
77q2cyy8	when the human body is infected by a virus, what is happening on a cellular level within the body  that causes the extreme tiredness/exhaustion??	1642962019.0	sb00fg	/r/askscience/comments/sb00fg/why_does_virus_infection_cause_tirednessexhaustion/	why does virus infection cause tiredness/exhaustion?
8xu4tvyt	Like, binoculars for instance. If I look one way it acts like a telescope. But would it double as a microscope looking at it with it flipped?   I was just wondering what the Hubble would see if we inverted it as a microscope instead of a telescope.   Not sure what I’m going for here other than I’m not sure where the end of space is and where the end of zooming into a atom stops.	1642973633.0	sb4jbb	/r/askscience/comments/sb4jbb/are_microscopes_and_telescopes_the_same_thing/	Are microscopes and telescopes the same thing?
bbfwm	I would imagine all personally identifiable information(PII) would be stripped, but this would be a huge waste of an opportunity to do some other research if we didn't collect the data.	1642982079.0	sb7qan	/r/askscience/comments/sb7qan/with_all_the_covid_tests_going_on_are_we_getting/	With all the covid tests going on are we getting any non-covid related data from the tests?
1sopn29s	Sometimes when you eat an apple you can see that either its core or around it is of a brownish color (not caused by exposing it, it was already that way when you bit into it or cut it), what causes that? Does ethylene accumulates there? Is that a thriving place for microbiota? If so, why?	1642989260.0	sba8bm	/r/askscience/comments/sba8bm/why_do_apples_start_to_go_bad_around_their_cores/	Why do apples start to go bad around their cores?
dc84igb5		1642988346.0	sb9wxd	/r/askscience/comments/sb9wxd/when_we_hear_about_the_temperature_in_weather/	When we hear about the temperature in weather forecasts, what temperature are they referring to? And how and where do they measure it and predict its future value?
biy7zc4s		1643016783.0	sbic0f	/r/askscience/comments/sbic0f/why_do_fusion_reactors_use_vacuums_when_fusion/	Why do fusion reactors use vacuums when fusion happens in the Sun under extremely high pressure?
zzags	Bonus: Does temperature alter the pitch of sound?	1643015445.0	sbhzwe	/r/askscience/comments/sbhzwe/do_sound_waves_move_faster_or_slower_depending_on/	Do sound waves move faster or slower depending on temperature?
6f87hox8		1643002460.0	sbehp5	/r/askscience/comments/sbehp5/when_an_object_moves_within_a_fluid_is_a_vacuum/	When an object moves within a fluid, is a vacuum created behind it as it moves?
bjc5vrn	I heard about this test where patients have to collect urine for 1 day and then creatinine amount is determined (concentration x urine amount). But like how do they do this? They surely can't use a 1.5L sample. Do they just give the container a good shake and then take a small sample? And what about bacteria growth? I've heard sometimes the container has a special powder, what is this substance and what is its purpose?  thanks	1643038188.0	sboq6i	/r/askscience/comments/sboq6i/how_do_hospitals_use_1day_urine_to_determine/	How do hospitals use 1-day urine to determine kidney function?
ft3jy	From what I've read [L4 and L5 lagrange points are stable equilibrium points](https://en.wikipedia.org/wiki/Lagrange_point#Stability), so why aren't there debris accumulated at these points?	1643032717.0	sbmt50	/r/askscience/comments/sbmt50/why_arent_there_stuff_accumulated_at_lagrange/	Why aren't there "stuff" accumulated at lagrange points?
5imxo	I got some high-powered LED's which emit light within the visible spectrum, and I am wondering, can I do damage with these, or is it just light in the UV range which is actually dangerous?	1643021519.0	sbjj0a	/r/askscience/comments/sbjj0a/is_visible_light_damaging_to_your_eyes_and_vision/	Is visible light damaging to your eyes and vision, or just UV?
dk8dj		1643021148.0	sbjffp	/r/askscience/comments/sbjffp/why_a_high_dose_of_vitamin_c_pose_risk_for_people/	Why a high dose of vitamin C pose risk for people with G6PD deficiency?
48nlpok3	How do chemists predict how a chemical reaction or product will behave, I understand how and why molecules combine themselves in the structures they end up in (like H2O for example) I also understand things like the acidity, charge and reactivity of the different elements. But the thing I can't wrap my head around is how we know about the ways a certain molecule will behave, take for example table salt, it is composed of 2 individually dangerous elements but the molecule they produce in this case is completely harmless. So how do chemists predict how these compositions behave. I am a aspiring material / composite engineer (mostly self taught)	1643021001.0	sbje6x	/r/askscience/comments/sbje6x/how_do_chemists_predict_chemical_compositions_and/	How do chemists predict chemical compositions and their properties?
n5wx3	My understanding is that sound travels faster through solids and liquids than through gases because the former states are denser. In other words, molecules would collide with less delay between neighbors when passing along a pressure wave if the density is higher.  But it seems that [the speed of sound is higher in hotter air.](https://www.engineeringtoolbox.com/air-speed-sound-d_603.html) Hotter air is less dense than cooler air (e.g., hot air balloon).  Can someone please explain what causes the speed of sound to increase in warm air, but also increase when gases are turned to liquids or solids?	1642682494.0	s8i3v8	/r/askscience/comments/s8i3v8/why_is_the_speed_of_sound_higher_in_warmer_air/	Why is the speed of sound higher in warmer air?
qxyyy	Just as the title asks. Since most of the public has an idea of the Mt. Vesuvius eruption how much does the recent eruption compare.  We have a TON of scientific and recorded data with the recent eruption so how accurately can we compare it to Vesuvius?	1642632036.0	s82rz7	/r/askscience/comments/s82rz7/how_does_the_recent_tonga_eruption_compare_to_the/	How does the recent Tonga eruption compare to the famous Mt. Vesuvius eruption?
tfmdsv1		1642694770.0	s8mble	/r/askscience/comments/s8mble/why_root_canal_hurts_soo_much_if_the_nerve_is_dead/	Why root canal hurts soo much if the nerve is dead?
1uf95kr7	How is it possible to distribute home test kits, such as COVID but not exclusively, by mail during periods of freezing temperatures when the tests are supposed to be stored above 36F/2C? Can freezing influence the results of these kinds of tests?	1642692767.0	s8ll6n	/r/askscience/comments/s8ll6n/are_lateral_flow_test_kits_damaged_by_freezing/	Are lateral flow test kits damaged by freezing temperatures?
2d510dz7	An undergraduate in a health related field here I’ve come across some really confusing stuff regarding this topic. I’ve always been kind of health conscious from a  young age and interested in this kind of stuff.   I was under the impression that saturated fat and cholesterol both contribute to raising serum cholesterol levels.   However one of my professors who’s now a epidemiologist/professor and was a practising cardiologist stated that dietary cholesterol raising serum cholesterol levels has been debunked and that saturated (and trans) fats contribute to serum cholesterol levels but not dietary cholesterol.   I’ve been reading on this and am more confused than I was before.  I see stuff like this   Harvard School of Public Health:  >Choose foods with healthy fats, limit foods high in saturated fat, and avoid foods with trans fat.   >Although it is still important to limit the amount of cholesterol you eat, especially if you have diabetes, for most people dietary cholesterol isn’t nearly the villain it’s been portrayed to be. Cholesterol in the bloodstream, specifically the bad LDL cholesterol, is what’s most important. And the biggest influence on blood cholesterol level is the mix of fats and carbohydrates in your diet—not the amount of cholesterol you eat from food.   But the American heart association and FDA recommend limiting cholesterol consumption etc. and have also come across many studies showing dietary cholesterol does effect heart health as well as websites claiming that a lot of studies are industry funded and not reliable.  I would like some clarity on this thanks any input is appreciated	1642678270.0	s8gy96	/r/askscience/comments/s8gy96/does_dietary_cholesterol_raise_serum_serum/	Does dietary cholesterol raise serum serum cholesterol levels?
y15kq		1642678156.0	s8gx0d	/r/askscience/comments/s8gx0d/why_do_oak_woodlands_and_savannahs_thrive_in_the/	Why do Oak Woodlands and Savannahs thrive in the Bay Area and Central Valley but only exist in small pockets in Southern California?
4pohvswa		1642676030.0	s8gdi7	/r/askscience/comments/s8gdi7/were_there_periods_of_rapid_or_runaway_global/	Were there periods of rapid or 'runaway' global warming, due to tipping points and feedback loops, during the Paleocene-Eocene Thermal Maximum occur?
3n50mem0	The delta and omicron variants have both been touted as more transmissible, replacing the existing variants as the dominant forms in the population. With the emergence of omicron as the new dominant variant, does delta simply disappear as omicron is able to outcompete it for hosts? And using that logic would the next major variant have to be even more transmissible?	1642704250.0	s8pwmg	/r/askscience/comments/s8pwmg/are_we_tending_towards_more_infective_variants_of/	Are we tending towards more infective variants of coronavirus?
bg80fmw0	Cheers fellas.	1642701188.0	s8oqq7	/r/askscience/comments/s8oqq7/would_terminal_velocity_on_mars_be_the_same_as_on/	Would terminal velocity on Mars be the same as on earth and take longer to reach, or be lower on Mars?
jse90	...therefore the star would be nearly invisible to the naked eye. Are there any examples of such (or similar) known stars?	1642628190.0	s8195s	/r/askscience/comments/s8195s/is_it_possible_for_a_star_to_only_output_light/	Is it possible for a star to only output light outside of the human visible spectrum?
172hv0	Because tea comes from a plant, how do the remove the caffeine from it? The same for coffee etc.	1642707642.0	s8r5h7	/r/askscience/comments/s8r5h7/how_do_they_make_caffeinated_drinks_not/	How do they make caffeinated drinks not caffeinated?
6i2jom	Clearly not ALL plant and animal life died out with the dinosaurs. How did the ones that clung to life in the post-Chixculub dark era do so?	1642660258.0	s8cd4m	/r/askscience/comments/s8cd4m/after_the_kt_extinction_how_did_the_survivors/	After the K-T extinction, how did the survivors live while the Earth was recovering?
zc545	What I mean is how many return to exactly how they were before, without any lingering issues at all?	1642643928.0	s87303	/r/askscience/comments/s87303/what_percentage_of_patients_who_survive_due_to/	What percentage of patients who survive due to CPR return to fully functioning states?
y6wto	I realise it’s probably a selection bias at play but I seem to regularly hear stories where someone who was otherwise healthy and led a healthy lifestyle dropping dead from a heart attack with no prior symptoms. Are there non Invasive diagnostic tools available that can pick up any issues with a regular GP check up or do you generally just go to hospital after you have symptoms?	1642648190.0	s88jeh	/r/askscience/comments/s88jeh/do_arterial_blockages_get_diagnosed_regularly/	Do arterial blockages get diagnosed regularly before symptoms?
mo3u2	And does it have anything to do with being similar to the sky during the day?	1642657851.0	s8bnij	/r/askscience/comments/s8bnij/why_does_blue_light_mess_up_your_sleep/	Why does blue light mess up your sleep?
19z3ojzr	I have watched many videos about genetics and is still a little confused about two things:  1. Do most people have the same genes in the same order on their chromosomes? For example, these are some genes on chromosome 5 (according to wikipedia): ABLIM3, ADAMTS2, AGXT2, ANKRD31,APBB3,APC, are these genes all on chromosome 5 in the same order for 99% of humans? Genes don't somehow jump to a different chromosome, right? 2. Most people have 2 sets of each chromosome, one from your mother, one from your father, are they indistinguishable? Is there anything on the chromosomes that tell us if it came from the sperm or the egg? Or that information has to be inferred?	1642662971.0	s8d461	/r/askscience/comments/s8d461/are_genes_arranged_basically_the_same_in_most/	Are genes arranged basically the same in most people?
1jpnre1q		1642678991.0	s8h4sq	/r/askscience/comments/s8h4sq/what_is_the_delta_v_required_to_reach_the/	What is the delta V required to reach the Lagrange point between Sol and Earth and what's an effective way to reach it?
5e23eqif	I’m just wondering why we only have L1 and L2 in GPS (and L5 that will be implemented soon). Wouldnt having more signals to compare against each other improve accuracy of points taken? Is it because a third signal would be redundant, or that it wouldnt increase accuracy to the point of being cost effective? Thank you	1642706442.0	s8qpe8	/r/askscience/comments/s8qpe8/why_are_there_only_two_signals_used_in_gps/	Why are there only two signals used in GPS? Wouldn’t having more than two be more accurate?
hggxt	Even in multi-lingual countries, how did they decide what the place should be called in the different languages? Where does the English name for Germany or Austria come from when their German-language names are vastly different in pronunciation and literal interpretation? Who took "Nippon" and said, "yeah, that's 'Japan', now."??	1642708135.0	s8rbw0	/r/askscience/comments/s8rbw0/how_are_countries_named_in_their_nonnative/	How are Countries named in their non-native languages?
4we1a	Consider this scenario:   * Two bodies of mass (A and B) with a great distance between them is orbiting each other in a circular orbit. * The time for gravitational waves to reach the other body 1 hour.  For body A, does the force pull towards B's position at the point of wave emission or is it somehow being pulled towards B's current position? If the latter is the case, how does A know B's current position?  Bonus question. Does gravitational waves from different sources collapse into one direction or will the body be pulled towards all the sources directions?	1642729269.0	s8yph3	/r/askscience/comments/s8yph3/how_does_gravity_work_in_terms_of_which_direction/	How does gravity work in terms of which direction the force is applied?
ec1ey	**Please read this entire post carefully and format your application appropriately.**  This post is for new panelist recruitment! The previous one is [here](https://www.reddit.com/r/askscience/comments/or5p3q/askscience_panel_of_scientists_xxv/).  The panel is an informal group of Redditors who are **either professional scientists or those in training to become so**. All panelists have at least a graduate-level familiarity within their declared field of expertise and answer questions from related areas of study. A panelist's expertise is summarized in a color-coded AskScience flair.  Membership in the panel comes with access to a panelist subreddit. It is a place for panelists to interact with each other, voice concerns to the moderators, and where the moderators make announcements to the whole panel. It's a good place to network with people who share your interests!  \-------------------  **You are eligible to join the panel if you:**  * Are studying for at least an MSc. or equivalent degree in the sciences, AND, * Are able to communicate your knowledge of your field at a level accessible to various audiences.  \-------------------  **Instructions for formatting your panelist application:**  * Choose exactly one general field from the side-bar (Physics, Engineering, Social Sciences, etc.). * State your specific field in one word or phrase (Neuropathology, Quantum Chemistry, etc.) * Succinctly describe your particular area of research in a few words (carbon nanotube dielectric properties, myelin sheath degradation in Parkinsons patients, etc.) * Give us a brief synopsis of your education: are you a research scientist for three decades, or a first-year Ph.D. student? * Provide links to comments you've made in AskScience which you feel are indicative of your scholarship.  Applications will not be approved without several comments made in /r/AskScience itself.  \-------------------  Ideally, these comments should clearly indicate your fluency in the fundamentals of your discipline as well as your expertise. We favor comments that contain citations so we can assess its correctness without specific domain knowledge.  Here's an example application:  `Username: /u/foretopsail`  `General field: Anthropology`  `Specific field: Maritime Archaeology`  `Particular areas of research include historical archaeology, archaeometry, and ship construction.`  `Education: MA in archaeology, researcher for several years.`  `Comments: 1, 2, 3, 4.`  Please do not give us personally identifiable information and please follow the template. We're not going to do real-life background checks - we're just asking for reddit's best behavior. However, several moderators are tasked with monitoring panelist activity, and your credentials will be checked against the academic content of your posts on a continuing basis.  You can submit your application by replying to this post.	1642744588.0	s93rpe	/r/askscience/comments/s93rpe/askscience_panel_of_scientists_xxvi/	AskScience Panel of Scientists XXVI
4kmv5tzz	I work with mass labelled standards a lot, particularly C13 labelled compounds. How are these synthesized with such accuracy they can be used as standards? How do we seperate them from their more abundant counter parts?	1642743421.0	s93g0c	/r/askscience/comments/s93g0c/how_does_one_create_a_mass_labelled_standard/	How does one create a mass labelled standard?
ec1ey	Hi Reddit! I'm Dr. Yasmin Hurd, the Director of the Addiction Institute within the Mount Sinai Behavioral Health System, and the Ward Coleman Chair of Translational Neuroscience and Professor of Psychiatry and Neuroscience at the Icahn School of Medicine at Mount Sinai in New York. I'm an internationally renowned neuroscientist whose translational research examines the neurobiology of drug abuse and related psychiatric disorders. My research exploring the neurobiological effects of cannabis and heroin has significantly shaped the field. Using multidisciplinary research approaches, my research has provided unique insights into the impact of developmental cannabis exposure and epigenetic mechanisms underlying the drug's protracted effects into adulthood and even across generations. My basic science research is complemented by clinical laboratory investigations evaluating the therapeutic potential of novel science-based strategies for the treatment of opioid addiction and related psychiatric disorders. Based on these high-impact accomplishments and my advocacy of drug addiction education and health, I was inducted into the National Academy of Medicine, complementing other honors I have received in the field. Recently, I was featured in the NOVA PBS film "[The Cannabis Question](https://www.youtube.com/watch?v=w-dxMTDzMLY)," which premiered in September and explores the little-known risks and benefits of cannabis use. I'll be on at 3 p.m. (ET, 20 UT), ask me anything!	1642766482.0	s997hz	/r/askscience/comments/s997hz/askscience_ama_series_im_the_director_of_the/	AskScience AMA Series: I'm the Director of the Addiction Institute at Mount Sinai who studies the neurobiological effects of cannabis and opioids. AMA!
8ox92	I understand the general concept behind redshifting, and that it has to do with the universe expanding. But I have never understood how someone can tell redshifted light apart from light that might come from a red supergiant.  Alongside that, how do they determine the *amount* of redshifting that has occurred?	1642691462.0	s8l47a	/r/askscience/comments/s8l47a/when_using_telescopes_to_map_out_the_universe/	When using telescopes to map out the universe (like DESI), how do astronomers/astrophysicists tell the difference between light that has been redshifted versus light that is coming from a reddish star?
ienv5o6z	Way before all these delta plus and omicron variants existed and when covid wasn't as spread, I read that covid causes long term brain damage on people who were healed.  Cured patients were having "confusion, trouble focusing, changes in behaviour, brain fog" and things like that.  https://www.health.harvard.edu/blog/the-hidden-long-term-cognitive-effects-of-covid-2020100821133  https://www.hopkinsmedicine.org/health/conditions-and-diseases/coronavirus/how-does-coronavirus-affect-the-brain  I want to ask if these new vaccines also protect against this since they successfully reduce severe symptoms and even death?  By the way, this might not be a thing anymore or that vaccines were not designed to combat this. I don't know. I'm just asking.  These all seemed disastrous when I first read about it and I'm still anxious today.	1642781141.0	s9e3pz	/r/askscience/comments/s9e3pz/do_covid_vaccines_prevent_brain_damage/	Do Covid Vaccines Prevent "Brain Damage"?
9a34f50t	- can anyhow the vaccine fail and itself cause rabbies?	1642773325.0	s9b9ja	/r/askscience/comments/s9b9ja/is_there_any_small_possiblility_that_humans_get/	Is there any small possiblility that humans get rabbies from rabbies vaccine ?
4g3xybn3	Suppose you only got injected with a few drops. Would that have the same effect as the full dose or would it just not do anything. If it does have the same effect why make the dose that large?	1642784167.0	s9f960	/r/askscience/comments/s9f960/is_the_full_dose_of_the_covid_vaccine_necessary/	Is the full dose of the covid vaccine necessary?
o2b8c	In an RBMK reactor the moderator is graphite and water is boiled to generate steam, but also used as a coolant. In LWR reactors water is used as a moderator and coolant if I understood it correctly.  So my question is:  Is  the water defined as a coolant because it absorbs neutrons from fission, or simply because of its thermal properties?  And if it can absorb neutrons, thereby slowing the chain-reaction of fission how can it also be a moderator in LWRs?	1642787717.0	s9gm3p	/r/askscience/comments/s9gm3p/how_can_water_act_as_a_moderator_in_lwrs_if_it/	How can water act as a moderator in LWRs if it also absorbs neutrons?
8zvfep1b		1642786827.0	s9g9rr	/r/askscience/comments/s9g9rr/what_are_ac_and_dc_currents_and_are_there_other/	What are AC and DC currents, and are there other types of electrical currents?
13uq4n	As per the journal entry I link below, sometimes 5% of PCR tests can be false positives   The UK's COVID-19 testing programme uses real-time reverse transcription  polymerase chain reaction (RT-PCR) tests to detect viral RNA.[1](https://www.ncbi.nlm.nih.gov/pmc/articles/PMC7850182/#CIT0001)  Public Health England reports that RT-PCR assays show a specificity of  over 95%, meaning that up to 5% of cases are false positives   [https://www.ncbi.nlm.nih.gov/pmc/articles/PMC7850182/](https://www.ncbi.nlm.nih.gov/pmc/articles/PMC7850182/)  How can a PCR test be a false positive? You either have the DNA of a specific virus or pathogen you're looking for, or you don't. How can a PCR accidentally find DNA that isn't supposed to be there, and consider it "false" ?	1642797626.0	s9kcvi	/r/askscience/comments/s9kcvi/if_pcr_tests_look_for_specific_dna_sequences_how/	If PCR tests look for specific DNA sequences, how can they be false positives?
