evad63bk	ANy link to the original article ??	1640832393.0	hqhvs75	t3_rrnggo	t3_rrnggo	/r/antifeminists/comments/rrnggo/un_report_confirms_women_are_the_majority_of_sex/hqhvs75/
737crz7b	My wife is a therapist who had a client who was sex trafficked by a “friend”. They went to NYC to go shopping and see the sights. Before they were to return home, the “friend” said she wanted to visit a friend of hers. They went to the person’s apartment and hung out for awhile. The “friend” excused herself to go to the corner store to buy cigarettes…and, never returned. The woman was repeatedly raped and then forced to prostitute herself. It took her five years to escape that life. The kicker is that she still sees her “friend” around town and the person, when she sees her, doesn’t acknowledge her or apologize.	1640832898.0	hqhwxjz	t3_rrnggo	t3_rrnggo	/r/antifeminists/comments/rrnggo/un_report_confirms_women_are_the_majority_of_sex/hqhwxjz/
82h98hd9	You got downvoted (why?!) and I upvoted you. I do think everyone should be able to vote. I also think **everyone** should be subject to the military draft, and that **includes** women. I once dated a chick in grad school who came over from Israel to attend grad school in the US. She was fit and pretty and very nice. She showed me pictures of her with her unit in the IDF, carrying a rifle. I asked her what she thought about compulsory military service, and she said "Would you fight and possibly sacrifice your life for your people and your way of life?" I said I would, and told her about my own service. She said "Well then you understand. It's about loving your people and being willing to sacrifice for your people."   She was an awesome person. She totally got it. She thought American chicks were fu&%ing children, and I understood that. She had been rocketed, shelled, and fired on, and had fired back, to defend her people. And in doing so, she had earned the right to have strong fu&%ing opinions about the world and what should be done, and I respected that. She wasn't a feminist or an anti-feminist... she didn't have time for that. She was a world citizen and had confidence and knowledge about her positions, and people respected her for it, because she had stepped up and done the big scary things, for the greater good.  I'm not Jewish, though, so things didn't proceed beyond that, LOL	1640832947.0	hqhx1d7	t3_rri0cf	t1_hqhi3ba	/r/antifeminists/comments/rri0cf/male_privilege_im_sorry_but_this_fact_gives_a/hqhx1d7/
qpx9g	This is heartbreaking. May they rest in peace. The false accuser should be punished severely by law.	1640833343.0	hqhxx13	t3_rrnijq	t3_rrnijq	/r/antifeminists/comments/rrnijq/false_accusations_take_another_victim/hqhxx13/
18q1w2ti	https://www.unodc.org/unodc/data-and-analysis/glotip.html  Here's the UN report (albeit this is the most recent one).	1640833372.0	hqhxzc5	t3_rrnggo	t1_hqhvs75	/r/antifeminists/comments/rrnggo/un_report_confirms_women_are_the_majority_of_sex/hqhxzc5/
18q1w2ti	>"Globally, most persons prosecuted and convicted of trafficking in persons continue to be male, with around 64 and 62 per cent respectively."  This is a direct quote from the UN report cited.  While I wouldn't be surprised that female offenders are more likely to fly under the radar or cry their way out of convictions (ie "I had to or else I'd have been hurt...") there's no evidence that supports the claim in this post that a majority of trafficking is committed by females.	1640833949.0	hqhz98v	t3_rrnggo	t3_rrnggo	/r/antifeminists/comments/rrnggo/un_report_confirms_women_are_the_majority_of_sex/hqhz98v/
evad63bk	Feminism from start is just bullshit, you can see in the interview of Erin Pizzey she clearly mentioned feminism from start was crap and was just are same as any other cult. feminist from start was not advocating for equal rights they were advocating for women's supremacy.	1640834558.0	hqi0lzt	t3_rr2xzj	t3_rr2xzj	/r/antifeminists/comments/rr2xzj/these_are_the_feminists_i_support_western/hqi0lzt/
qgjik0p	i meant firewood as in the twigs branches and chunks of wood from rotten or insect ridin trees. my sister certainly doesnt like chopping firewood. that's a solid point about how time consuming cooking was. one of the keys to economic development is childhood nutrition and education. i was trouble when i was a kid then during highschool i did a 180. if a household is large like if a family is rich or they have to work some distance from one another there is plenty of work to do and women would let their neighbors or friends use equipment or materials or they would outright hire folks. a lot of education can go into those aspects and i think about 60 of small farmers worldwide are women and that can take a lot of education. lol the thing about the more agreeable sex is that if they see someone as predatory, exploitative or disgusting then they will have it in them to be even more cruel and disgusting "in return". its also pretty damaging to be in the military even outside of combat due to all the trekking material transport poor conditions and the risk of hanging around low ranking military personel as it turns out that the same traits that make for good officers also makes them more trustworthy XD so support personel will be left tending to the larger portions of the army who arnt as likely to be so trustworthy due to a number of factors. overall women tend to avoid poor working conditions and even with dating a women will tend to rate herself as above average while rating an average man below average. with men it tends to be a bit more accurate but guys will rate girls based on both looks and personality but tend to be bad with estimating a girls personality	1640835738.0	hqi37cc	t3_rri0cf	t1_hqhtsuq	/r/antifeminists/comments/rri0cf/male_privilege_im_sorry_but_this_fact_gives_a/hqi37cc/
2u414jx5	Man invented the interpretation of religion, religion invented the sciences, the interpretation of religion stimulated the idea of strategic warfare, the military kicked out the Puritans who created an important country for the world, the cycle of war created the United States and who did not fight was destroyed. The woman took the subway built by men, came to the house designed by men, put her things on the furniture assembled by men, turned on the computer designed by men and wrote on the Internet invented by men that men are not needed and men are evil because of whom all the troubles of the earth. Well, I can only add that men motivated the leftist agenda in the geopolitics of all countries, because 20th century capitalism doesn't work in 2021.  Women scream and hate men the loudest at the moment when men gave women privileges. Ordinary men who love women do not understand how to live in this world.	1640835907.0	hqi3k7i	t3_rri0cf	t1_hqgubxe	/r/antifeminists/comments/rri0cf/male_privilege_im_sorry_but_this_fact_gives_a/hqi3k7i/
11lf14	The more you know 🌈	1640836571.0	hqi4zlj	t3_rrnggo	t3_rrnggo	/r/antifeminists/comments/rrnggo/un_report_confirms_women_are_the_majority_of_sex/hqi4zlj/
5q3hmblw	Now I like to imagine I don't judge people based on looks, but that woman looks like she thought she was posing for a feminist article on "10 reasons he migt be cheating on you"	1640837337.0	hqi6lcf	t3_rrnggo	t3_rrnggo	/r/antifeminists/comments/rrnggo/un_report_confirms_women_are_the_majority_of_sex/hqi6lcf/
8bmr6umi	Yeah I was about to say I downloaded the thing and it reveled that only around 35% of traffickers are women.    Yet still this is a surprisingly high number though especially since a large number of the trafficng involves children.	1640837899.0	hqi7qtg	t3_rrnggo	t1_hqhz98v	/r/antifeminists/comments/rrnggo/un_report_confirms_women_are_the_majority_of_sex/hqi7qtg/
82h98hd9	> a women will tend to rate herself as above average while rating an average man below average. with men it tends to be a bit more accurate but guys will rate girls based on both looks and personality but tend to be bad with estimating a girls personality  Wise words here. Thank you for these! Very very true, and this has been demonstrated in experiments.	1640838107.0	hqi867w	t3_rri0cf	t1_hqi37cc	/r/antifeminists/comments/rri0cf/male_privilege_im_sorry_but_this_fact_gives_a/hqi867w/
hxhjztgv	Ur stupid	1640839258.0	hqiahc1	t3_rrf8ec	t3_rrf8ec	/r/antifeminists/comments/rrf8ec/this_sub_is_toxic/hqiahc1/
7bjndvbl	Hey bro you dropped this "/s"	1640840856.0	hqidkb6	t3_rrnggo	t1_hqhhl8g	/r/antifeminists/comments/rrnggo/un_report_confirms_women_are_the_majority_of_sex/hqidkb6/
8gop6iqu	If you know you know	1640841029.0	hqidvzc	t3_rrnggo	t1_hqidkb6	/r/antifeminists/comments/rrnggo/un_report_confirms_women_are_the_majority_of_sex/hqidvzc/
qgjik0p	XD thank you as well. its always nice to get a positive response	1640841341.0	hqiegsf	t3_rri0cf	t1_hqi867w	/r/antifeminists/comments/rri0cf/male_privilege_im_sorry_but_this_fact_gives_a/hqiegsf/
kyyrvk8	did she report her "friend" to the police?	1640841824.0	hqifch9	t3_rrnggo	t1_hqhwxjz	/r/antifeminists/comments/rrnggo/un_report_confirms_women_are_the_majority_of_sex/hqifch9/
737crz7b	I don’t know…never asked. I’m surprised she didn’t try to kill her.	1640842214.0	hqig1l9	t3_rrnggo	t1_hqifch9	/r/antifeminists/comments/rrnggo/un_report_confirms_women_are_the_majority_of_sex/hqig1l9/
buzx5j39	Most men who fought and died for Britain in the First World War couldn't vote. As voting was restricted to married men, those over thirty years if age or land owners. So women, join the club. Not many feminists mention this inconvenient truth!	1640842351.0	hqigagb	t3_rqy10y	t3_rqy10y	/r/antifeminists/comments/rqy10y/angry_feminist_on_tinder_subreddit/hqigagb/
br9fnycu	It sounds like you’re very young and have spent too much time on the internet and not enough time around real husbands and wives. Men are not equivalent to Jewish people in the Holocaust that’s retarded and offensive to people who were actually persecuted. Check out r/persecutionfetish	1640842518.0	hqigl6g	t3_rpz60x	t1_hqgpb17	/r/antifeminists/comments/rpz60x/im_not_a_feminist/hqigl6g/
ezj2furm	Be careful, some feminists are gonna call you a “pick me.” Happened to me many times 🙄	1640844267.0	hqijngc	t3_rri0cf	t3_rri0cf	/r/antifeminists/comments/rri0cf/male_privilege_im_sorry_but_this_fact_gives_a/hqijngc/
104q8w	Everytime FDS gets brought up remember those femcels are [miserable and old](https://subredditstats.com/subreddit-user-overlaps/femaledatingstrategy)	1640844938.0	hqikrm5	t3_rrsoy0	t3_rrsoy0	/r/antifeminists/comments/rrsoy0/whawhat_in_the_f/hqikrm5/
90r51b93	Except for that song thing, everything else is just plain BS	1640845270.0	hqilb83	t3_rqy10y	t3_rqy10y	/r/antifeminists/comments/rqy10y/angry_feminist_on_tinder_subreddit/hqilb83/
90r51b93	Next thing you know, looking at a girl will be called rape	1640845302.0	hqild5b	t3_rqy10y	t1_hqedoc1	/r/antifeminists/comments/rqy10y/angry_feminist_on_tinder_subreddit/hqild5b/
g18g1co6	Let’s hear them say how horrible women are now 🦗	1640846018.0	hqimhaz	t3_rrnggo	t3_rrnggo	/r/antifeminists/comments/rrnggo/un_report_confirms_women_are_the_majority_of_sex/hqimhaz/
4gqhrq59	In a mire of hypocrisy, ignoring sex crimes by its own blue helmets…	1640846473.0	hqin6hj	t3_rrnggo	t3_rrnggo	/r/antifeminists/comments/rrnggo/un_report_confirms_women_are_the_majority_of_sex/hqin6hj/
1udiaefw	I guess nobody asks them.	1640846506.0	hqin8ag	t3_rri0cf	t1_hqijngc	/r/antifeminists/comments/rri0cf/male_privilege_im_sorry_but_this_fact_gives_a/hqin8ag/
1k4tkno7	I don’t think there’s anything wrong with being either one IF both people know that it’s purely for getting rich/ showing off a pretty face. If one person is in love and the other is lying to the person about also being in love , to me, that’s sleazy and cruel because you’re messing with someone’s feelings.  Am I missing the big picture?	1640847531.0	hqior3m	t3_rrsoy0	t3_rrsoy0	/r/antifeminists/comments/rrsoy0/whawhat_in_the_f/hqior3m/
aba5aa1o	Let them. I wouldn't regard them. I am proud to do satisfying things to my bf.	1640847608.0	hqiov66	t3_rri0cf	t1_hqijngc	/r/antifeminists/comments/rri0cf/male_privilege_im_sorry_but_this_fact_gives_a/hqiov66/
aba5aa1o	I'm not sarcastic. Sorry If I have sounded so. Please don't get me wrong. I am just awkward with my words sometimes.	1640847757.0	hqip2yj	t3_rri0cf	t1_hqh8cy0	/r/antifeminists/comments/rri0cf/male_privilege_im_sorry_but_this_fact_gives_a/hqip2yj/
78t1d1jn	She's got a point thought. Anyway down with the feminazis	1640848064.0	hqipj97	t3_rrsoy0	t3_rrsoy0	/r/antifeminists/comments/rrsoy0/whawhat_in_the_f/hqipj97/
aba5aa1o	I understand. It sucks that even Google and Wikipedia villanizes mgtow.	1640848097.0	hqipkxc	t3_rovy9v	t1_hqhr4rv	/r/antifeminists/comments/rovy9v/just_asking_rmgtow_and_rredpill_used_to_exist/hqipkxc/
8pk9bven	I've read through the thread. Man I feel like this girl gets her information from shitty Facebook post like "10 Reasons Women Were Oppressed in the Past"  The way she argued is too illogical. You go on and debunk her claims and she comes up with new ones, instead of reading what you are actually saying. It's like arguing with a wall.  The funniest part is, that she thinks that being anti-feminism means hating and opressing women lol.	1640848275.0	hqipu2x	t3_rqy10y	t3_rqy10y	/r/antifeminists/comments/rqy10y/angry_feminist_on_tinder_subreddit/hqipu2x/
gj36qb8e	The premise is good. Make yourself a good person of good character but don't fall into the trap that's you absolutely need a relationship for the sake of it.  I honestly have never met a radical feminist in my life. The girls I meet are normal and we have normal interactions. I think these radical types only live on the internet.  I have also never met a guy who hated women. I wouldn't have a friend like that.   I did know a man who was bitter about the courts because his divorce was messy and  another guy who was wrongfully accused of rape. Even when she said it was false it was too late he could never go back to his town.   I was reading a bit of FDS and it's shocking to be honest.	1640848994.0	hqiqukg	t3_rovy9v	t1_hqipkxc	/r/antifeminists/comments/rovy9v/just_asking_rmgtow_and_rredpill_used_to_exist/hqiqukg/
aba5aa1o	Yh, fds is a madhouse. But normal people for sure try to stay away from trouble.	1640849172.0	hqir3di	t3_rovy9v	t1_hqiqukg	/r/antifeminists/comments/rovy9v/just_asking_rmgtow_and_rredpill_used_to_exist/hqir3di/
5nxmp43f	Are you calling me smol pp? Because yes, my pp is so smol that it's actually a vagina	1640849347.0	hqirbyx	t3_rjuaha	t1_hpa6u9h	/r/antifeminists/comments/rjuaha/hmmm/hqirbyx/
aba5aa1o	Yh, they scream and shout without realizing that those actions harms them, and drag them away from happiness. I think that they are the ones misunderstanding how to live in this world.	1640849395.0	hqireas	t3_rri0cf	t1_hqi3k7i	/r/antifeminists/comments/rri0cf/male_privilege_im_sorry_but_this_fact_gives_a/hqireas/
gj36qb8e	I was reading your comments out of curiosity and you seem to be an old school thinking feminist which is great. I listen to a lot of podcasts with old school feminists like Christina Hoff Sommers.	1640849764.0	hqirwby	t3_rovy9v	t1_hqir3di	/r/antifeminists/comments/rovy9v/just_asking_rmgtow_and_rredpill_used_to_exist/hqirwby/
5xaik0ab	…she isn’t necessarily wrong though.	1640849859.0	hqis124	t3_rrsoy0	t3_rrsoy0	/r/antifeminists/comments/rrsoy0/whawhat_in_the_f/hqis124/
5ylu99mn	I'm not against prostitution, even if slightly overpriced.	1640850052.0	hqisagb	t3_rrsoy0	t3_rrsoy0	/r/antifeminists/comments/rrsoy0/whawhat_in_the_f/hqisagb/
8gop6iqu	There's this thing I do called humor sometimes. It's one of the things I love about myself the most.	1640850103.0	hqiscy0	t3_rrnggo	t1_hqirv2t	/r/antifeminists/comments/rrnggo/un_report_confirms_women_are_the_majority_of_sex/hqiscy0/
aba5aa1o	Nice. Tbh feminism is like an antibiotic, which kills viruses and bacteria. If for example America and Europe are healthy bodies, they don't need this antibiotic. It will just harm them, as it does. But if Middle East is a sick body, it needs this antibiotic. Doctors say that antibiotic as a medicine can kill good bacteria along with the viruses, that's why they reccomend small dose consumption. Or can even write probiotics, that protect from antibiotics damage. (Speaking from experience. Antibiotic didn't hurt me when I was sick because I was getting probiotics).	1640850210.0	hqisi42	t3_rovy9v	t1_hqirwby	/r/antifeminists/comments/rovy9v/just_asking_rmgtow_and_rredpill_used_to_exist/hqisi42/
16bcjp	The post is more of a joke / dark humour. Most businesses however, legal and illegal are run and organised by men. Very few criminal enterprises are 1/3 female led!!!, that's a really high proportion.	1640850276.0	hqisl9p	t3_rrnggo	t1_hqi7qtg	/r/antifeminists/comments/rrnggo/un_report_confirms_women_are_the_majority_of_sex/hqisl9p/
4wku7w	I have a friend who went through pretty much the same situation, just not in NY but in Paris. The worst part is that she excuses her friend saying that they were very young and they had to do all those things to survive.	1640850473.0	hqisut6	t3_rrnggo	t1_hqig1l9	/r/antifeminists/comments/rrnggo/un_report_confirms_women_are_the_majority_of_sex/hqisut6/
8bmr6umi	Can anyone give me a summarization of what all the waves of feminism were like as well as main point in all of them.    Thank you in advance.	1640850993.0	hqitjhr	t3_rrvw2v	t3_rrvw2v	/r/antifeminists/comments/rrvw2v/4th_wave_feminism_everyone/hqitjhr/
gj36qb8e	So true. You would never see a new wave feminist actually protesting for middle eastern women's rights.   It like all the supporters of communism live in democratic countries.  Have to fly now. It was nice chatting. Have a nice day. 😀	1640851019.0	hqitkpz	t3_rovy9v	t1_hqisi42	/r/antifeminists/comments/rovy9v/just_asking_rmgtow_and_rredpill_used_to_exist/hqitkpz/
755yskn4	In America ... The Congress shall have Power . . . To declare War, grant Letters of Marque and Reprisal, and make Rules concerning Captures on Land and Water; “To raise and support Armies, but no Appropriation of Money to that Use shall be for a longer Term than two Years; “To provide and maintain a Navy; “To make Rules for the Government and Regulation of the land and naval Forces; “To provide for calling forth the Militia to execute the Laws of the Union, suppress Insurrections and repel Invasions; “To provide for organizing, arming, and disciplining, the Militia, and for governing such Part of them as may be employed in the Service of the United States, reserving to the States respectively, the Appointment of the Officers, and the Authority of training the Militia according to the discipline prescribed by Congress” —U.S. Constitution, Article I, section 8, clauses 11–16  Men sending men to war ...	1640851478.0	hqiu6ag	t3_rri0cf	t3_rri0cf	/r/antifeminists/comments/rri0cf/male_privilege_im_sorry_but_this_fact_gives_a/hqiu6ag/
hy1v32qe	I’m gonna go out on a limb and guess it has to do with you saying their rule 2 was sexist	1640851940.0	hqiusf5	t3_rrp26d	t3_rrp26d	/r/antifeminists/comments/rrp26d/that_was_fast/hqiusf5/
2u414jx5	entropy hasn't gone anywhere.   When you constantly yell at a man and tell him he is bad, in a moment the man will believe he is bad and the world will fall into chaos.   It takes a long time for a man to tolerate and sympathize, trying to find a democratic solution. But in my opinion, a man's radical resistance will not be long in coming.	1640852010.0	hqiuvq4	t3_rri0cf	t1_hqireas	/r/antifeminists/comments/rri0cf/male_privilege_im_sorry_but_this_fact_gives_a/hqiuvq4/
7llhvwwm	Check out all these 21 years of their lives and find them even begging for their lives... Quit giving emotional stance to simple historical facts! US had made that land so pathetic that rn those who r breathing there are luckier enough than u!	1640852060.0	hqiuy1d	t3_rr2xzj	t1_hqhb2qm	/r/antifeminists/comments/rr2xzj/these_are_the_feminists_i_support_western/hqiuy1d/
755yskn4	Let me guess your one of those men that think it's all fine in dandy over there right?  I mean let's not forget the thousands of people panicking to escape , and the hundreds of people hanging off of airplanes when they were trying to fly out of there because it's so friendly, wealthy , and butterflies are flying everywhere over there. Hahaha, right !!! Nobody's kids are digging through the trash right now because they're starving and  nobody's being restricted from going away from their house , and people aren't being mandated to stay within the country right ? Mean they can totally travel all they want all by themselves out of the country ,  who are you kidding ?!!!  You legitimately trying to pass your horse of a shit story over to me , man we are well informed over here in America  about the pieces of shit the Taliban is. Go take a long walk off a short peer, and go tell your horse shit nonsense somewhere else.	1640852466.0	hqivh3i	t3_rr2xzj	t1_hqiuy1d	/r/antifeminists/comments/rr2xzj/these_are_the_feminists_i_support_western/hqivh3i/
7exrq0w2	Well, do you not believe in equality?	1640853326.0	hqiwl6o	t3_rquh65	t1_hqhmwmo	/r/antifeminists/comments/rquh65/science_proves_the_world_has_a_profemale_bias/hqiwl6o/
5h9t55ol	Facebook.com/CureFeminism	1640853392.0	hqiwoa1	t3_rrvw2v	t1_hqitjhr	/r/antifeminists/comments/rrvw2v/4th_wave_feminism_everyone/hqiwoa1/
1udiaefw	I won't toss the word "golddigger" out if the window. It's up-to-date and has no defined sex attached to it. Plus once it was a profession, you know — to go into the specific regions and dig the earth in search of gold. Guess who worked their asses out the most...	1640853745.0	hqix4pm	t3_rrsoy0	t3_rrsoy0	/r/antifeminists/comments/rrsoy0/whawhat_in_the_f/hqix4pm/
1udiaefw	What point?	1640853780.0	hqix6f6	t3_rrsoy0	t1_hqipj97	/r/antifeminists/comments/rrsoy0/whawhat_in_the_f/hqix6f6/
26hxithd	1. I want to vote without registering for the draft.  2. I want a job with the same pay and still be a SAHW if I want.  3. I don’t need a man, want to blame men for all my problems, and I don’t want to change sexist divorce laws.  4. I have to work like a man now, have abortion parties, I think men should be kept in cages. Also thinks discrimination against women is a hate crime, discrimination against men doesn’t exists.  Done .	1640854330.0	hqixw04	t3_rrvw2v	t1_hqitjhr	/r/antifeminists/comments/rrvw2v/4th_wave_feminism_everyone/hqixw04/
7bjndvbl	Women didn't even want the right to vote, men wanted them to	1640854490.0	hqiy3aw	t3_rri0cf	t1_hqgv18o	/r/antifeminists/comments/rri0cf/male_privilege_im_sorry_but_this_fact_gives_a/hqiy3aw/
2l1wbyja	If asked they would twist it so she is a victim	1640854843.0	hqiyjej	t3_rrnggo	t1_hqhh7eu	/r/antifeminists/comments/rrnggo/un_report_confirms_women_are_the_majority_of_sex/hqiyjej/
7llhvwwm	Oh yes, now u r feeling proud of knowing some nonsense bullshit sitting, reclining back there in couches... What's ur source? The same people who encouraged n enforced the miserable state I'm Afghan? Or is it those shitty white pigs u voted, to sit on those seats and stand on that unjust and racist podium? American families r right now divin thru the trash, to sustainance, but ofc u got no eyes there, lemme tell u why, bcoz u hear what ur govt wants u to hear n u see what ur govt wants u to see...  Dont end ur note with that 'we' r well informed, u r being fed with pig dump and cow dung, and it's funny how ur majority is happy to digest it! If u feel my words stink, wipe off ur nose coz that's where the horse has shitted!	1640854926.0	hqiyn9g	t3_rr2xzj	t1_hqivh3i	/r/antifeminists/comments/rr2xzj/these_are_the_feminists_i_support_western/hqiyn9g/
755yskn4	Oh shut up😂 The UN people they had cameras taking pictures , and photographs , Reporters , translators etc  . Every news world organization on the planet . You really can't be that obtuse.  Actual people that live there have escaped to other lands, and are talking about you Taliban tallywackers horribly and the horrible conditions you place on the citizens.  No y'all's families are shit because you have to make people stay with you because they wouldn't even touch you unless you mandated it 😂😂 that's how fucked up y'all are. Now go dig a hole and shit in it somewhere.    We living the good life over here.  Electricity , Wifi 24/7 , in door plumbing, Running HOT water . Stores filled to capacity.   It's good to be an American .	1640855363.0	hqiz7hu	t3_rr2xzj	t1_hqiyn9g	/r/antifeminists/comments/rr2xzj/these_are_the_feminists_i_support_western/hqiz7hu/
9kkm5wi1	No, not when it comes to domestic violence lmao	1640855586.0	hqizhp1	t3_rquh65	t1_hqiwl6o	/r/antifeminists/comments/rquh65/science_proves_the_world_has_a_profemale_bias/hqizhp1/
aa7jk0bx	Looks like you didn't even read what I wrote.  You're ignorant and brainwashed, your mere words and shaming language are not going to change my mind.I have seen plenty of evidence, this is not at all "edgy kid" like you'd like to think.The fact that you have to rely on that means you got no argument, therefore I'm right.	1640855855.0	hqiztui	t3_rpz60x	t1_hqigl6g	/r/antifeminists/comments/rpz60x/im_not_a_feminist/hqiztui/
7exrq0w2	Why?	1640856123.0	hqj05wk	t3_rquh65	t1_hqizhp1	/r/antifeminists/comments/rquh65/science_proves_the_world_has_a_profemale_bias/hqj05wk/
