1qtwbpeq	The entire incel phenomenon is a coping mechanism. Because there’s literally no so such thing as an incel.  If a man’s got $100 in his pocket, his celibacy is entirely voluntary.	1640920219.0	hqmvs8n	t3_rs77yz	t1_hqle6dr	/r/antifeminists/comments/rs77yz/she_couldnt_handle_the_fact_that_i_have_a_height/hqmvs8n/
a8k6rqjk	You are correct that it's from 2016. I think if anything, posting that story again shows to everyone that nothing has changed regarding the situation of false accusations of r@pe in 6 years as we are now almost at 2022. In fact, the situation is getting worse for men.	1640920249.0	hqmvudm	t3_rrnijq	t1_hqlexc5	/r/antifeminists/comments/rrnijq/false_accusations_take_another_victim/hqmvudm/
1qtwbpeq	Then your daughters will be giant uggos.	1640920371.0	hqmw3sc	t3_rs77yz	t1_hqm2aog	/r/antifeminists/comments/rs77yz/she_couldnt_handle_the_fact_that_i_have_a_height/hqmw3sc/
euyojipd	Yes you are, judging from the monumental idiotic comments made about how we should all be touchy Feely about the weakest.	1640920485.0	hqmwce0	t3_rn818p	t1_hq7yvns	/r/antifeminists/comments/rn818p/totally_cucked_and_anti_men_society/hqmwce0/
euyojipd	Women should know how to cook and feed her family. It's a women's job. Men's job is to bring in the cash and give protection. That's why nature made men stronger. Nothing you can do about it.	1640920539.0	hqmwgh6	t3_rn818p	t1_hq7z4e8	/r/antifeminists/comments/rn818p/totally_cucked_and_anti_men_society/hqmwgh6/
euyojipd	Well if you are too fat to be a real woman and cook and clean, it's not my issue. And real women speak when spoken to.	1640920605.0	hqmwlhy	t3_rn818p	t1_hq7yzxc	/r/antifeminists/comments/rn818p/totally_cucked_and_anti_men_society/hqmwlhy/
6q6b4eu7	Voted yes I believe that there are a few that out there that want the best for both sex. Only that extremist crazy ones are the most loud and make it sound like they are the majority. Hope they realize that because now they are very extreme and radical.	1640920654.0	hqmwp92	t3_rsi039	t3_rsi039	/r/antifeminists/comments/rsi039/if_they_could_define_misandry_and_feminism_as_two/hqmwp92/
euyojipd	I'm saying what my first amendment right allows me to do. If you can't handle that, cook and clean and make babies living in the house as nature intended you to. My gf does precisely that.	1640920730.0	hqmwv1c	t3_rn818p	t1_hq7yd5l	/r/antifeminists/comments/rn818p/totally_cucked_and_anti_men_society/hqmwv1c/
7z9sh3ir	SOMEONE MAKE SURE THIS KING DOESN’T DROP HIS CROWN	1640920994.0	hqmxf2f	t3_rs77yz	t3_rs77yz	/r/antifeminists/comments/rs77yz/she_couldnt_handle_the_fact_that_i_have_a_height/hqmxf2f/
wtb0x26	Me: I practice abstinence because of my religion Woman: so you're an incel	1640921004.0	hqmxftr	t3_rs77yz	t1_hqle6dr	/r/antifeminists/comments/rs77yz/she_couldnt_handle_the_fact_that_i_have_a_height/hqmxftr/
1qtwbpeq	>*Yes sir, I do agree with your sentiment. However, pump’n’dumping these women turns them into ‘jaded harpies’ who then make amusing posts to the /r/FDS and /r/DatingOver30 subreddits, and the thought of this makes me smile.*	1640921052.0	hqmxje6	t3_rs77yz	t1_hqkx1y6	/r/antifeminists/comments/rs77yz/she_couldnt_handle_the_fact_that_i_have_a_height/hqmxje6/
1qtwbpeq	I don’t know even what a “date” is, but I do regularly relieve myself into the orifii of smaller, weaker creatures.	1640921412.0	hqmyap6	t3_rs77yz	t1_hqmpgzq	/r/antifeminists/comments/rs77yz/she_couldnt_handle_the_fact_that_i_have_a_height/hqmyap6/
hgc1ci31	I checked your profile it's ok if ur a transwoman i Believe trans women are equal to real woman but not real women and if ur Feminist that believes in woman supremacy then u can stay mad	1640921562.0	hqmym4o	t3_rs77yz	t1_hqmyap6	/r/antifeminists/comments/rs77yz/she_couldnt_handle_the_fact_that_i_have_a_height/hqmym4o/
1qtwbpeq	> trans women are equal to real woman  Wrong, we’re superior by every metric.  Stronger. Faster. Smarter. More logical. Bigger penis. Powered by testosterone.  Anything a woman can do, I can do better. While earning an extra 28 cents on her dollar.	1640923191.0	hqn21kj	t3_rs77yz	t1_hqmym4o	/r/antifeminists/comments/rs77yz/she_couldnt_handle_the_fact_that_i_have_a_height/hqn21kj/
hgc1ci31	Wait you don't have a pussy ? Still ur a man and men are equal to women so you're equal to women	1640923301.0	hqn29ob	t3_rs77yz	t1_hqn21kj	/r/antifeminists/comments/rs77yz/she_couldnt_handle_the_fact_that_i_have_a_height/hqn29ob/
1clw9nz5	I will always romanticise the sacrifices my parents made. Thank you mum and dad. I love you.	1640923489.0	hqn2ndv	t3_rsk85y	t3_rsk85y	/r/antifeminists/comments/rsk85y/because_thats_why_mothers_are_praised/hqn2ndv/
a7dxasqy	Traditional gendered expectations also demand fathers to be the sole/main providers and sacrifice precious time with their children. All parents deserve better.	1640923677.0	hqn30vw	t3_rsk85y	t3_rsk85y	/r/antifeminists/comments/rsk85y/because_thats_why_mothers_are_praised/hqn30vw/
1qtwbpeq	> you're equal to women  Tell that to the woman who’s skull I caved in a couple months ago at the women’s jiu jitsu class.  And also tell the rest of those pussies who don’t want to spar with me now.	1640923824.0	hqn3bir	t3_rs77yz	t1_hqn29ob	/r/antifeminists/comments/rs77yz/she_couldnt_handle_the_fact_that_i_have_a_height/hqn3bir/
bir2jxpe	What is more meaningful is that which is most self sacrificial. Is that not what heroes indeed do? Sacrifice their own selves for the sake of others, especially those least able to care for themselves?	1640924007.0	hqn3oyz	t3_rsk85y	t3_rsk85y	/r/antifeminists/comments/rsk85y/because_thats_why_mothers_are_praised/hqn3oyz/
copi4yq2	Golddiggers are garbage scum, just all the subhuman lowlifes who post at FDS	1640924362.0	hqn4elj	t3_rrvw2v	t3_rrvw2v	/r/antifeminists/comments/rrvw2v/4th_wave_feminism_everyone/hqn4elj/
889cpj99	ya well to me all feminist are bad, that is why I said women and not feminist, and any girl in America not feminist in America, IF you cough that,	1640924489.0	hqn4np2	t3_rr2xzj	t1_hqj24kh	/r/antifeminists/comments/rr2xzj/these_are_the_feminists_i_support_western/hqn4np2/
a8k6rqjk	>How can someone be that retarded that They just typed out double standards and still don't see it.  It seems that you're unfamiliar with women's nature.	1640924635.0	hqn4y9b	t3_rs77yz	t1_hql67vs	/r/antifeminists/comments/rs77yz/she_couldnt_handle_the_fact_that_i_have_a_height/hqn4y9b/
51hlfm7m	Screw traditional. The new age demands the father to be the sole provider for the mother/child and himself while they are in different households.   The mother gets a truck load of government benefits, and child support. While the father pays for the truck, fuel, government on top of paying child support	1640924962.0	hqn5l2q	t3_rsk85y	t1_hqn30vw	/r/antifeminists/comments/rsk85y/because_thats_why_mothers_are_praised/hqn5l2q/
1clw9nz5	The crazies are nowhere near as bigger problem with feminism as the original premise is. The original premise is that women are the victims and men are the oppressors. Because of this, they can’t ever be a suitable option for advancing male rights. If this is misandrist (and I think it is), then by taking away the misandry, you take away feminism.   I believe in equality of opportunity irregardless of gender, thus I am an egalitarian, and not a feminist.	1640926134.0	hqn7uwe	t3_rsi039	t3_rsi039	/r/antifeminists/comments/rsi039/if_they_could_define_misandry_and_feminism_as_two/hqn7uwe/
3sl19poy	You like to make assumptions huh? My degree is in biotechnology and I don’t really care about who’s bringing in money when both my boyfriend and I are so two people building wealth is better than one	1640926390.0	hqn8co7	t3_rn818p	t1_hqmwgh6	/r/antifeminists/comments/rn818p/totally_cucked_and_anti_men_society/hqn8co7/
c5lkz7z8	Who uses the word incel outside of Reddit?	1640926482.0	hqn8ivo	t3_rs77yz	t3_rs77yz	/r/antifeminists/comments/rs77yz/she_couldnt_handle_the_fact_that_i_have_a_height/hqn8ivo/
3sl19poy	Well that’s not how the current world works right now. Also I’m 115 pounds which is 52 kilograms so idk what fat youre talking about 🤷🏾‍♀️	1640926518.0	hqn8lap	t3_rn818p	t1_hqmwlhy	/r/antifeminists/comments/rn818p/totally_cucked_and_anti_men_society/hqn8lap/
3sl19poy	I’m also saying what my first amendment right allows me to. Besides you’re referencing that you don’t want to be cucked by American women so if you have a first amendment right that applies to you, then I’m guessing you’re in America. And unless you’re maintaining a relationship with your gf online, then I’m guessing she’s American too. 🤦🏾‍♀️ the amendment rights are only applicable to American citizens	1640926700.0	hqn8xs5	t3_rn818p	t1_hqmwv1c	/r/antifeminists/comments/rn818p/totally_cucked_and_anti_men_society/hqn8xs5/
4dfswjoi	Dodged a fucking thermonuclear bomb dude	1640926776.0	hqn92tm	t3_rs77yz	t3_rs77yz	/r/antifeminists/comments/rs77yz/she_couldnt_handle_the_fact_that_i_have_a_height/hqn92tm/
1clw9nz5	Tbf, not sure that smart women would be taking dating advice from 30+ year old single women…	1640926799.0	hqn94c9	t3_rrvw2v	t3_rrvw2v	/r/antifeminists/comments/rrvw2v/4th_wave_feminism_everyone/hqn94c9/
4dfswjoi	G A Y F R O G S	1640926931.0	hqn9def	t3_rsepwj	t3_rsepwj	/r/antifeminists/comments/rsepwj/this_is_the_ideal_male_facial_expression_you_may/hqn9def/
1g0rkoke	Femcels use it as an insult to make themselves feel better, it’s typical.	1640927102.0	hqn9p5z	t3_rs77yz	t1_hqlcw9g	/r/antifeminists/comments/rs77yz/she_couldnt_handle_the_fact_that_i_have_a_height/hqn9p5z/
1g0rkoke	Women can’t handle rejection lol get used to it sweetheart. At least with guys like this.	1640927144.0	hqn9s2n	t3_rs77yz	t3_rs77yz	/r/antifeminists/comments/rs77yz/she_couldnt_handle_the_fact_that_i_have_a_height/hqn9s2n/
4dfswjoi	this is manslaughter x2	1640927181.0	hqn9ule	t3_rrnijq	t1_hqhfmzo	/r/antifeminists/comments/rrnijq/false_accusations_take_another_victim/hqn9ule/
1g0rkoke	I’ll support NO form of feminism.	1640927346.0	hqna5lt	t3_rsi039	t3_rsi039	/r/antifeminists/comments/rsi039/if_they_could_define_misandry_and_feminism_as_two/hqna5lt/
1g0rkoke	Wear it like a badge of honor, I know I do	1640927506.0	hqnag19	t3_rrp26d	t3_rrp26d	/r/antifeminists/comments/rrp26d/that_was_fast/hqnag19/
g1orgqa8	I would 100%.  I am 100% for Equality.  All Humans are Created Equal.  Thomas Jefferson understood this concept.  The fact that he did not practice it made him evil.	1640927912.0	hqnb6gd	t3_rsi039	t3_rsi039	/r/antifeminists/comments/rsi039/if_they_could_define_misandry_and_feminism_as_two/hqnb6gd/
3x3wodgy	Lol - now he's an incel for turning her down.  That is literally the opposite of incel.	1640929041.0	hqnd6uu	t3_rs77yz	t3_rs77yz	/r/antifeminists/comments/rs77yz/she_couldnt_handle_the_fact_that_i_have_a_height/hqnd6uu/
32l6zyi1	This is a good post because it also shows the distinction that it is the ideology itself that we think is flawed. We do not base our opinions by the behaviour of the radical feminists, to then dislike feminism. That would be just what they accuse us of doing.  However, when the ideology itself is flawed, it doesn't matter what its followers do at this point.	1640930971.0	hqnghvg	t3_rsmsmq	t3_rsmsmq	/r/antifeminists/comments/rsmsmq/feminism_was_broken_from_the_start/hqnghvg/
dmwlt5jl	This is one of my favorite resources to provide on this topic, hope it helps clear up any confusions or misconceptions someone may have  https://www.reddit.com/r/MensLib/comments/3tn9kc/a_list_of_feminist_resources_tackling_mens_issues/	1640931751.0	hqnhs46	t3_rsmsmq	t3_rsmsmq	/r/antifeminists/comments/rsmsmq/feminism_was_broken_from_the_start/hqnhs46/
6e1t40rq	Kay why es and gtfo from this sub,your b||tch a_$ isn't welcome here	1640933013.0	hqnjroi	t3_rrsoy0	t1_hqmi08a	/r/antifeminists/comments/rrsoy0/whawhat_in_the_f/hqnjroi/
6e1t40rq	You being in stem dosent matter,the percentage of women is less,grow some brains,ehmm,I mean balls	1640933334.0	hqnk9d3	t3_rphcx7	t1_hq615wv	/r/antifeminists/comments/rphcx7/pornstar_pay_gap/hqnk9d3/
3sl19poy	Okay so less women being in porn doesn’t matter 🤷🏾‍♀️	1640933394.0	hqnkcp4	t3_rphcx7	t1_hqnk9d3	/r/antifeminists/comments/rphcx7/pornstar_pay_gap/hqnkcp4/
8vdc91sr	But still his dick is bigger than her height	1640934099.0	hqnle9c	t3_rs77yz	t3_rs77yz	/r/antifeminists/comments/rs77yz/she_couldnt_handle_the_fact_that_i_have_a_height/hqnle9c/
9rd5ai1e	This but unironic	1640934557.0	hqnm28v	t3_rsjg1e	t3_rsjg1e	/r/antifeminists/comments/rsjg1e/be_a_real_man_bois_believe_in_gender_equality/hqnm28v/
6nwyvlut	I'm pretty sure most actually do, but internet has some fucked up people on it	1640935647.0	hqnnmcq	t3_rsi039	t3_rsi039	/r/antifeminists/comments/rsi039/if_they_could_define_misandry_and_feminism_as_two/hqnnmcq/
6p54znpe	Anti vaxxers don't believe in doctor's authority and Basic education    And none of them is required here  To see how wrong this  "woman" is.  Idk how we can draw parallels  Aside from fact that both of which are retarded.	1640936585.0	hqnowt5	t3_rs77yz	t1_hqlgob2	/r/antifeminists/comments/rs77yz/she_couldnt_handle_the_fact_that_i_have_a_height/hqnowt5/
6p54znpe	I think i am familiar with woman's nature   A normal woman's that is.	1640936668.0	hqnp0vn	t3_rs77yz	t1_hqn4y9b	/r/antifeminists/comments/rs77yz/she_couldnt_handle_the_fact_that_i_have_a_height/hqnp0vn/
7bjndvbl	I mean yeah... Lesbian couples are more abusive than gay and heterosexual couples. Shows that even women can be violent	1640936842.0	hqnp9gz	t3_rso2fn	t3_rso2fn	/r/antifeminists/comments/rso2fn/lesbian_abuse/hqnp9gz/
6h7qkesw	A cannon ball	1640937281.0	hqnpv3n	t3_rs77yz	t1_hqksevu	/r/antifeminists/comments/rs77yz/she_couldnt_handle_the_fact_that_i_have_a_height/hqnpv3n/
6p54znpe	I mean kindness is good and basic massage  That this dood is trying to get across  I think this is possible with mutual divorce with no hatred or bad encounters involved   In other cases  Where you were wronged     you should try to be firm on your stance and not bend over As that would teach kids that bad behavior is rewarded which is what we should avoid at all costs.	1640937396.0	hqnq0p9	t3_rsomra	t3_rsomra	/r/antifeminists/comments/rsomra/an_interesting_post_from_fds_simping_is_their/hqnq0p9/
4eubowkh	Can she shut the fuck up please	1640937698.0	hqnqfch	t3_rsa9p0	t3_rsa9p0	/r/antifeminists/comments/rsa9p0/well_where_the_gents_at/hqnqfch/
67mofgzp	Oh well, looks like you just avoided a train wreck aniway... Incel... 😂 They just can't handle rejection..	1640937949.0	hqnqrh9	t3_rs77yz	t3_rs77yz	/r/antifeminists/comments/rs77yz/she_couldnt_handle_the_fact_that_i_have_a_height/hqnqrh9/
7xtu3	So... She took the Feminism version of The Red Pill?  Isnt TRP a "hate movement against Women"?	1640938916.0	hqns1lr	t3_rsoxug	t3_rsoxug	/r/antifeminists/comments/rsoxug/when_feminism_meats_rselfawarewolves/hqns1lr/
1k4tkno7	I appreciate the sacrifice my parents made to have me. Especially my mother because we had a very low chance of making it out the hospital and then she got heart failure, kidney failure and lupus years afterwards and still carried us both by still working( parents didn’t get married). Dad didn’t really do much  and relied on his mother for money  until a few years ago and really didn’t offer to help while my mom had seizures on the road and went to the ER frequently. He is now hard-working factory worker and sells shoes on the side and is now there for the both of us. Even though he’s a million years late and we still don’t see eye-to-eye, I still appreciate the sacrifice.	1640939119.0	hqnsb6x	t3_rsk85y	t3_rsk85y	/r/antifeminists/comments/rsk85y/because_thats_why_mothers_are_praised/hqnsb6x/
hr1glbu2	I could sit there and come up with a fat list of nazis who helped jews	1640939277.0	hqnsiir	t3_rsmsmq	t1_hqnhs46	/r/antifeminists/comments/rsmsmq/feminism_was_broken_from_the_start/hqnsiir/
c6ygd1k1	Fitting name	1640939581.0	hqnswp0	t3_rs77yz	t3_rs77yz	/r/antifeminists/comments/rs77yz/she_couldnt_handle_the_fact_that_i_have_a_height/hqnswp0/
aba5aa1o	Probably burly ladies are more likely to go to the army, as not all ladies are small, some are tall and big - 1.8 - 2 m. I think they have higher chances. I am 1.74m, not burly enough, especially when I lost some weight 2 years ago. I'm 22. And I've seen people who look small and soft but are strong and big people, who look burly but aren't strong enough. You don't need visible muscles to be strong. You don't even have to be the strongest human in the world.  F-movement followers complain loudly that they are the ones forced to perform toxic roles and think that society has toxic expectations for them, which seem annoying. But that's false. The most toxic expectations are towards the males, and this triggers me a lot. They say, that noone would give a crap for a man who doesn't provide or similar things and the worst nightmare is not being allowed to show emotions. Guys are not robots and they too deserve unconditional love and compassion and this is why the submissive feminine pages on Instagram teach ladies to be loving and supportive to their partners. And this is why I am here, as a lady to catch every chance to send you positive nurturing vibes.	1640939946.0	hqntdzr	t3_rri0cf	t1_hqj1mf5	/r/antifeminists/comments/rri0cf/male_privilege_im_sorry_but_this_fact_gives_a/hqntdzr/
5x9r4ntn	Not a bad start. Good on you!  Some things you can try to dive into next: the philosophies that feminism evolved from; feminism being contradicted by neuroscience; feminism having no historical or factual basis; the core of the people that shaped feminism were abusive, pro-pedophilia, and wanted to kill men; the improvements in mental health and personal relationships of those who abandoned feminism.  Let me know if you want any pointers to start.	1640940488.0	hqnu2uu	t3_rsmsmq	t3_rsmsmq	/r/antifeminists/comments/rsmsmq/feminism_was_broken_from_the_start/hqnu2uu/
aca0r70m	Based	1640940522.0	hqnu4fo	t3_rsjg1e	t3_rsjg1e	/r/antifeminists/comments/rsjg1e/be_a_real_man_bois_believe_in_gender_equality/hqnu4fo/
3s2hgg53	Lmfaooo so you just wake up in the morning and decide to be a pathetic loser that disappoints mommy everyday?   Ask me if I care?…I don’t. Block me bitch.	1640941819.0	hqnvrea	t3_rrsoy0	t1_hqnjroi	/r/antifeminists/comments/rrsoy0/whawhat_in_the_f/hqnvrea/
4uj85tsl	It seems like we live in a feminine world where compassion and kindness come first at all cost. This is a huge danger for the children as it teaches them self-depreciation and harmlessness as a virtue in and of itself which means the children will be either very weak (if they are boys) and doormats or entitled brats(girls). Instead, he should show them kindness and compassion have a value as a sacrifice for something greater to be achieved in the future. There is no honour and respect that you get by depreciating yourself in front of someone who may not feel that way about you and whereas he may have done it with good intent, the road to hell for men becoming weak and incapable of standing up for themselves and valuing themselves is paved with such chivalrous gestures.	1640942206.0	hqnw8ho	t3_rsomra	t1_hqnq0p9	/r/antifeminists/comments/rsomra/an_interesting_post_from_fds_simping_is_their/hqnw8ho/
51jxmxgo	> This is how you know this “equity” stuff is bullshit. All they want is privilege over men.  Where is it written that this woman even calls herself a feminist?	1640942282.0	hqnwbuk	t3_rs77yz	t1_hqlm4to	/r/antifeminists/comments/rs77yz/she_couldnt_handle_the_fact_that_i_have_a_height/hqnwbuk/
b79ocoe0	Fds is basically a cult. They are preying on undesirable women and turning them into hate mongers.	1640942318.0	hqnwdg7	t3_rrvw2v	t1_hqn94c9	/r/antifeminists/comments/rrvw2v/4th_wave_feminism_everyone/hqnwdg7/
6p54znpe	Yup as i said  Kindness is good thing  However it shouldn't be done if it costs your respect going above and beyond  For someone who wronged you Is thing i disagreed with in my comment.   Kindness is good  And could be expressed  In  Mutual divorce  On which no hatred is involved from any party.	1640942698.0	hqnwu6g	t3_rsomra	t1_hqnw8ho	/r/antifeminists/comments/rsomra/an_interesting_post_from_fds_simping_is_their/hqnwu6g/
7c5l7lw7	People often call me names when I don't support something or believe something that's a temporary fix because I actually look at the end result of what happens long term with certain movements. I was born a woman, I was designed to be a woman and I have absolutely no desire to be equal to a man. Equal respect yes, for our differences. I really don't care if a man makes more than I do, they are providers by nature, they should. I don't care if they have the majority of the jobs. I don't care or desire to take on the responsibilities they have or have had. I just want to be able to be a woman, and I can't anymore. Because of the feminism movement, men don't make as much anymore, men don't have the benefits anymore, society assumes every household is two income so the price of everything is based on that. Relationships suffer now, marriages suffer, children suffer because we aren't allowed to be men and women anymore,  we have to be both and that goes against human nature! Don't hate me.	1640943422.0	hqnxq2y	t3_rri0cf	t3_rri0cf	/r/antifeminists/comments/rri0cf/male_privilege_im_sorry_but_this_fact_gives_a/hqnxq2y/
aba5aa1o	I understand you. Feminism originally was about free Choice. Simple. But feminists are scared to be dependent and perceive the homemaking as slavish dependence, think that housewives are victims and slaves of domestic violence shit. And this poison fear turns into hatred against homemaking and the desiring homemakers end up being underrated and seen as doormats, but they are diamonds. Material success, whatever it is doesn't matter, the most important thing in life is being a good person. The point of a life is to love and being loved. I wish you to find a loving guy, if you have him, I wish you blissful relationship.	1640943935.0	hqnycth	t3_rri0cf	t1_hqnxq2y	/r/antifeminists/comments/rri0cf/male_privilege_im_sorry_but_this_fact_gives_a/hqnycth/
4c00a6oz	> After i started reading more feminist theories and started being critically thinking.  Feminist theories corrupt critical thinking. This is like eating junk food & talking about nutrition.	1640944434.0	hqnyzdp	t3_rsoxug	t3_rsoxug	/r/antifeminists/comments/rsoxug/when_feminism_meats_rselfawarewolves/hqnyzdp/
1udiaefw	>fact that both of which are retarded.  ...is the key.	1640944624.0	hqnz7uz	t3_rs77yz	t1_hqnowt5	/r/antifeminists/comments/rs77yz/she_couldnt_handle_the_fact_that_i_have_a_height/hqnz7uz/
aa7jk0bx	Projection^	1640945076.0	hqnzrfv	t3_rpz60x	t1_hqm6drl	/r/antifeminists/comments/rpz60x/im_not_a_feminist/hqnzrfv/
glkrg48i	That's the thing about opinions. This isn't FDS. I'm allowed them here..   the first wave of feminism had plenty of merit, and bought up valid points. in regards to ownership of property and many other issues which unfairly kept women under..   Just because some purple haired harpy 3 cat having twazzock has proclaimed 'all men are shit' on twitter, it doesn't mean I'm willing to write off an entire gender, or undo the legacy of some very impressive ladies! I'm in this sub not because I hate women, but the opposite, because I love my mom, wife, daughter and want them to be in a world where this cancerous incarnation of feminism isn't in their lives.. not so I can be a little bitch going 'hurr durr wimmenz are less than'	1640945515.0	hqo0aky	t3_rrnelc	t1_hqmqcne	/r/antifeminists/comments/rrnelc/from_the_horses_mouth/hqo0aky/
7c5l7lw7	I was a single mom, supported my 2 boys, worked like crazy, I hated it. I hated carrying the responsibility of providing for my family, I did it, but I wasn't able to be myself or the mother I wanted to be or the woman I wanted to be during that time. A man who does this for a lifetime, I respect fully, if he wants a mancave, he deserves a mancave. And who helped me during that time and had respect for me? Men, not women at all.	1640945533.0	hqo0bc4	t3_rn1a6m	t3_rn1a6m	/r/antifeminists/comments/rn1a6m/yet_again_more_hate_keeping_from_these_absolute/hqo0bc4/
hgc1ci31	Help me please I beg	1640945880.0	hqo0q6q	t3_rsqx1k	t3_rsqx1k	/r/antifeminists/comments/rsqx1k/guys_please_help_my_friend_i_beg_you_guys_a_woman/hqo0q6q/
7c5l7lw7	I joined the fds not knowing what is was, then I started seeing the complaints about men and misogyny and I was out. So sick of hearing that word to describe men. Let men be men and women be women. Please..	1640946425.0	hqo1e01	t3_rn1a6m	t1_hpqhja5	/r/antifeminists/comments/rn1a6m/yet_again_more_hate_keeping_from_these_absolute/hqo1e01/
glkrg48i	Honestly, I kind of feel what your asking is too broad. to make any kind of definitive statement the 'feminists' would need a manifesto, as for me, I'm never on just one side. there are parts I agree with on the left, and parts on the right etc.. and parts where I don't care, others where I do, but am not informed enough etc etc..   my point being, I'd need to see a clearly defined list of what you're asking me to support :P because SO much of feminism today starts good, and drops off a cliff.   'we want more women in the tech world' - Ok, I'm down, if they want to sure!   'we want more women in the tech world, then patriarchy is keeping them out' - Well, no, go fuck yourselves.   If you see what I mean? I'm all for the first, but the latter bullshit foot stamping 'find a target and yell' style... fuck no. never.	1640946642.0	hqo1ne1	t3_rsi039	t3_rsi039	/r/antifeminists/comments/rsi039/if_they_could_define_misandry_and_feminism_as_two/hqo1ne1/
7c5l7lw7	I'm not against men. I respect men. I don't hate men for being men. Most behavior these feminists find so bad are just simply men being men. Geez.	1640946734.0	hqo1rg6	t3_rn818p	t3_rn818p	/r/antifeminists/comments/rn818p/totally_cucked_and_anti_men_society/hqo1rg6/
