dq15p5vh	It's all online. I've met no man or woman like it in real life.  I recently saw a elderly man and woman holding hands in the steet and overheard the elederly women tell the man "I love you". This is what I see. I constantly see men and women getting on just fine. I dont see women running away from me and other men and i don't see men pacing around looking for someone to assault. Yet that's what everyone online wants me to believe lol.   These freaks live online but I agree it's depressing to read. How the f*ck do people get to this level of insanity?  How do you get to a point of stupid where you hate an entire gender of people. Its werid.	1640872844.0	hqjoj2q	t3_rqo20x	t1_hqc32lk	/r/antifeminists/comments/rqo20x/feminist_gets_owned/hqjoj2q/
8jlej5vz	Well considering the downvotes most don’t know	1640873594.0	hqjq1qr	t3_rrnggo	t1_hqidvzc	/r/antifeminists/comments/rrnggo/un_report_confirms_women_are_the_majority_of_sex/hqjq1qr/
18q1w2ti	That's Ghislaine Maxwell... y'know Jeffrey Epstein's partner in human trafficking and pedophile sex rings.	1640873764.0	hqjqe5b	t3_rrnggo	t1_hqi6lcf	/r/antifeminists/comments/rrnggo/un_report_confirms_women_are_the_majority_of_sex/hqjqe5b/
d4q2zezk	We probably agree on more issues than we disagree.  Lets leave it at that.  Im not that interested in being an anti fan for feminism but for the wokes and woke feminists. The woke just tend to be supremacists for their own agenda, which makes it fun to hate on them, ngl	1640873901.0	hqjqob7	t3_rpftbk	t1_hqjn8nz	/r/antifeminists/comments/rpftbk/do_women_cringe_at_you_guys_or_do_they_pray_to/hqjqob7/
9kkm5wi1	Its not just about the severity but about the frequency, and you can bet your ass both these things are tipped to one side especially in muslim countries	1640874501.0	hqjrxnh	t3_rquh65	t1_hqj68cy	/r/antifeminists/comments/rquh65/science_proves_the_world_has_a_profemale_bias/hqjrxnh/
d3wh3ueq	Been there, sat on a crowded bus next to a girl  not doing anything and before you know it I was kicked out. I'm 17 btw so no pedo business here	1640875869.0	hqjuvht	t3_rqy10y	t1_hqild5b	/r/antifeminists/comments/rqy10y/angry_feminist_on_tinder_subreddit/hqjuvht/
h2jt1i58	You can't win with these types of people.  Their topics and issues are always specifically to benefit them and will change as needed.  Basically sociopathic behavior in my arm chair opinion	1640875906.0	hqjuyhm	t3_rrvw2v	t1_hqj653g	/r/antifeminists/comments/rrvw2v/4th_wave_feminism_everyone/hqjuyhm/
90r51b93	Why tho?	1640875945.0	hqjv1nd	t3_rqy10y	t1_hqjuvht	/r/antifeminists/comments/rqy10y/angry_feminist_on_tinder_subreddit/hqjv1nd/
51jxmxgo	I can’t see why you can’t hold both positions. Sex work should be legal (though heavily regulated) to make it safer, and the workers and their work should be respected. At the same time, it’s tragic that some people are driven to do something their body interprets as rape out of desperation, and we should do what we can to avoid putting people in that situation.  Also, sex-negative self proclaimed feminists are not that rare. The entirety of FDS is anti-sex work, and they seem to be called feminists in your book.	1640876552.0	hqjwdnv	t3_rqxo0v	t1_hqj4sxm	/r/antifeminists/comments/rqxo0v/if_it_wasnt_ever_enjoyablethen_why_did_you_do_it/hqjwdnv/
4o06q2s5	Doens't even surprise me. Just like, according to Harvrad, most of perpetrators of domestic violence are women, too.	1640876626.0	hqjwjte	t3_rrnggo	t3_rrnggo	/r/antifeminists/comments/rrnggo/un_report_confirms_women_are_the_majority_of_sex/hqjwjte/
1clw9nz5	The difference between beauty and someone’s money is that a person’s looks is still them - you still love them. A person’s money is something they own and is not them.   An example would be her listing ‘hardworking’ as a character trait that she’d like. I can give my old economics teacher who was an amazing teacher, hard working, dedicated, inspiring, properly made you love the subject. He was the poster boy for hard working, but, as a teacher, he probably didn’t make as much as he could’ve. Reckon this woman would want to date him, or is it money that she’s attracted to, and not the hard working personality trait.	1640876650.0	hqjwlrp	t3_rrsoy0	t3_rrsoy0	/r/antifeminists/comments/rrsoy0/whawhat_in_the_f/hqjwlrp/
h2jt1i58	>When girls go through puberty, the world changes for them. Feminism has the ability to protect them from the horrors they face.  You don't see a major issue with a *rights* movement dictating the lives of young women?  Women having their period or going through puberty has absolutely nothing to do with rights what so ever.    You just summed up why feminism is NOT about rights, but about favoring women.  Which is perfectly fine honestly, it is a guise though.	1640876892.0	hqjx5dm	t3_rrf8ec	t3_rrf8ec	/r/antifeminists/comments/rrf8ec/this_sub_is_toxic/hqjx5dm/
1clw9nz5	Women 100% were oppressed back then…but so were men. Feminism was never the movement to progress society.	1640876998.0	hqjxdxq	t3_rri0cf	t3_rri0cf	/r/antifeminists/comments/rri0cf/male_privilege_im_sorry_but_this_fact_gives_a/hqjxdxq/
hctzx5he	Did you break every rule at once?	1640877373.0	hqjy8rn	t3_rrp26d	t3_rrp26d	/r/antifeminists/comments/rrp26d/that_was_fast/hqjy8rn/
gkby0imn	Is this referring to the r/facepalm post?	1640877639.0	hqjyuv3	t3_rs0gge	t3_rs0gge	/r/antifeminists/comments/rs0gge/theory_on_incels_and_femcels/hqjyuv3/
4nq3sx11	FDS is full of femcels,they banned me for being male,so i guess thats why they banned you	1640877728.0	hqjz2dm	t3_rrp26d	t1_hqj50l8	/r/antifeminists/comments/rrp26d/that_was_fast/hqjz2dm/
4hdde02g	Horse?	1640877893.0	hqjzg1j	t3_rrnelc	t3_rrnelc	/r/antifeminists/comments/rrnelc/from_the_horses_mouth/hqjzg1j/
dokaa57a	They are right….. Why are gold diggers shamed but the shallow old men aren’t? The women are being smart the men are just thinking with their dicks	1640878670.0	hqk19uq	t3_rrsoy0	t3_rrsoy0	/r/antifeminists/comments/rrsoy0/whawhat_in_the_f/hqk19uq/
g18g1co6	The term incels is what’s used very common more common than femcel. And that’s a term that bitter woman use to degrade men that they most likely don’t have a chance with. It’s a rather hateful word because it literally means hatred for women. And I don’t think I’ve ever met even one guy that actually feels that way. Maybe that Elliot Rogers guy but then again I never met him and supposedly his issue wasn’t that he hated women he hated the fact that he couldn’t get a particular type not sure if this led to him becoming a real incel or not that’s up for debate. But regardless I have yet to meet a man that is the actual incel. Like I said it’s just a term used by women that are either upset or trying to insult usually a man when they are right about something or saying something logical or truthful that they don’t agree with.	1640878866.0	hqk1qno	t3_rs0gge	t3_rs0gge	/r/antifeminists/comments/rs0gge/theory_on_incels_and_femcels/hqk1qno/
4c9h0	>I can’t see why you can’t hold both positions. Sex work should be legal (though heavily regulated) to make it safer, and the workers and their work should be respected. At the same time, it’s tragic that some people are driven to do something their body interprets as rape out of desperation, and we should do what we can to avoid putting people in that situation.  I don't disagree with you on any point. But you do realize that this woman in the picture, Andrea Heinz, joined the sex industry because she had gotten herself into a lot of debt by 22 due to bad life choices and then made millions of dollars doing it, and then opened up a brothel for other women during the last 4 years of her career. So if she was being raped for her entire experience, I highly doubt she would have opened a brothel for other women to get raped too.  This is what we're making fun of. A transactional relationship that you agree to is not rape, especially if you consented to it.  She by the way is completely sex-negative, and believes that all sex work is bad for women, even heavily regulated.  >Also, sex-negative self proclaimed feminists are not that rare. The entirety of FDS is anti-sex work, and they seem to be called feminists in your book.  FDS is a group of extremists and is the most hated sub on reddit. Most Feminists would not identify those women among themselves. We call them Feminists because that's what they call themselves.	1640879900.0	hqk496a	t3_rqxo0v	t1_hqjwdnv	/r/antifeminists/comments/rqxo0v/if_it_wasnt_ever_enjoyablethen_why_did_you_do_it/hqk496a/
aba5aa1o	Yh, it sucks. Hoping they have loving wives at home to relieve and nurture them. I wish you to find a good partner too.	1640880116.0	hqk4sa5	t3_rri0cf	t1_hqjo29m	/r/antifeminists/comments/rri0cf/male_privilege_im_sorry_but_this_fact_gives_a/hqk4sa5/
8pk9bven	I think their main problem is that they don't like to be criticised. They feel personally attacked when you call out their mistakes or encourage them to fix them.   Personally, I know like 3 people (not incels) who are extremely stubborn and don't take any critique or feedback. I know, it feels like a different kind of problem but I think these people share the same kind of belief in their head. (Incels & stubborn people)  They often block their own progress because they don't want to work on themselves. They keep their bad mindset and stay at the same spot in life.	1640880125.0	hqk4t1l	t3_rs0gge	t3_rs0gge	/r/antifeminists/comments/rs0gge/theory_on_incels_and_femcels/hqk4t1l/
aba5aa1o	I wish they were more aware of that and what brutal sacrifices has been made, there would be more loving girls. War is such a pain in the ass.	1640880300.0	hqk58lo	t3_rri0cf	t1_hqjb62e	/r/antifeminists/comments/rri0cf/male_privilege_im_sorry_but_this_fact_gives_a/hqk58lo/
15hxps55	\[2\]	1640880459.0	hqk5mrv	t3_rpsgog	t1_hq6sriq	/r/antifeminists/comments/rpsgog/is_it_really_because_of_that_or_do_we_not_have/hqk5mrv/
8pk9bven	I agree with you. A lack of empathy is one of the components that shape these people.	1640880478.0	hqk5oh5	t3_rs0gge	t1_hqjepgb	/r/antifeminists/comments/rs0gge/theory_on_incels_and_femcels/hqk5oh5/
7wprb40q	It's okay to date rich men, as long as you like them as actual people and their money is just a plus.  Dating rich men *solely for their money* is wrong.	1640881367.0	hqk7w81	t3_rrsoy0	t3_rrsoy0	/r/antifeminists/comments/rrsoy0/whawhat_in_the_f/hqk7w81/
hgl681a4	Looool	1640881800.0	hqk8zha	t3_rqo20x	t3_rqo20x	/r/antifeminists/comments/rqo20x/feminist_gets_owned/hqk8zha/
25w1lx9p	That sub is crazy.  I went in expecting it to be about people choosing not to have children and the benefits, etc., but it ended up being just complaining about people who do have children.	1640881949.0	hqk9d3g	t3_rrsoy0	t1_hqjmmre	/r/antifeminists/comments/rrsoy0/whawhat_in_the_f/hqk9d3g/
7exrq0w2	>Its not just about the severity but about the frequency, and you can bet your ass both these things are tipped to one side especially in muslim countries  Women are both much more likely to commit domestic violence and do it more frequently as well.  Quoting Dr. Donald Dutton (domestic violence researcher):  > Then there's the data, the information on who perpetrates domestic violence. Now, you know the US is the world leader in this respect because there's been five excellent victim surveys done in the US. Huge samples, representative samples, starting from 1989 and running right up to 2004. And they all say the same thing. That it's 50% of reported domestic violence is bilateral. It's a two person thing, back and forth, back and forth. 35% of the remainder, the unilateral domestic violence, is female perpetrated. 15% is male perpetrated. And of that 15%, 10% or 2/3 of it, is just like a push or a shove or a slap, it's not the serious stuff. So that leaves 5% that fits the stereotype of serious domestic violence, male perpetrated domestic violence. 5% of domestic violence actually fits that stereotype. That's all.  From [Differences in Frequency of Violence and Reported Injury Between Relationships With Reciprocal and Nonreciprocal Intimate Partner Violence (Whitaker et al., 2007)](https://www.ncbi.nlm.nih.gov/pmc/articles/PMC1854883/):  > Almost 24% of all relationships had some violence, and half (49.7%) of those were reciprocally violent. In nonreciprocally violent relationships, women were the perpetrators in more than 70% of the cases.  That means women are 2 1/3 as likely to commit domestic violence as men.  See also [References Examining Assaults by Women on Their Spouses or Male Partners: An Updated Annotated Bibliography (Fiebert, 2014)](https://www.researchgate.net/publication/261543769_References_Examining_Assaults_by_Women_on_Their_Spouses_or_Male_Partners_An_Updated_Annotated_Bibliography):  > This annotated bibliography describes 343 scholarly investigations (270 empirical studies and 73 reviews) demonstrating that women are as physically aggressive as men (or more) in their relationships with their spouses or opposite-sex partners. The aggregate sample size in the reviewed studies exceeds 440,850 people ___ > especially in muslim countries  Hard to know without data. Either way, why does the average prevalence / frequency even matter in an individual case? Just because a certain race of people murders more on average, doesn't mean we should punish an individual from that race committing murder more, right? In a similar way, I don't see how you justify not punishing a woman in the same way as a man, unless you believe women are inherently better than men.	1640882396.0	hqkai4e	t3_rquh65	t1_hqjrxnh	/r/antifeminists/comments/rquh65/science_proves_the_world_has_a_profemale_bias/hqkai4e/
1x6rbyhc	Of course they did. Broken arrows.	1640882644.0	hqkb56n	t3_rix4o6	t1_hqjn6kz	/r/antifeminists/comments/rix4o6/what_roblox_posted_during_international_mens_day/hqkb56n/
73164w52	It's her option, nobody forced her to do it	1640882845.0	hqkbo5h	t3_rqxo0v	t3_rqxo0v	/r/antifeminists/comments/rqxo0v/if_it_wasnt_ever_enjoyablethen_why_did_you_do_it/hqkbo5h/
73164w52	Ummm k	1640882925.0	hqkbvnm	t3_rrp7ja	t3_rrp7ja	/r/antifeminists/comments/rrp7ja/its_the_responsibility_of_doctors_to_make_sure/hqkbvnm/
5nxmp43f	r/STFUYoureJustMadThatYourInsultDidntWork	1640883373.0	hqkd1pd	t3_rjuaha	t1_hqjjc6y	/r/antifeminists/comments/rjuaha/hmmm/hqkd1pd/
8j1cqsb9	They inspire the hate they claim to fight.	1640883599.0	hqkdmua	t3_rrsoy0	t3_rrsoy0	/r/antifeminists/comments/rrsoy0/whawhat_in_the_f/hqkdmua/
b3kp9h0g	Well... In the normal world the wife is there to support the man and man does the same. They build great memories togheter and a solid foundation of a home. Cuz a great home, builds a great neighborhood and that builds great societies and that makes great countries.  Prostitusion it the decadent and corrupted side of humanity. And as long men and women are unhappy, they will destory themself and normalize that behavior. Its the downfall of humanity and its collective concioussnes. But I blame the society, because we who came from dysfunctional families got brainwashed by sex in the city, Californication and the goverment. They never had the tools to save themself until its to late or someone catches them. Unhappy people are easy to rule.	1640883668.0	hqkdtdd	t3_rffh9f	t3_rffh9f	/r/antifeminists/comments/rffh9f/whats_the_difference_between_wife_and_prostitute/hqkdtdd/
1x6rbyhc	No. That would contravene the private information statute.     Regardless, in STEM, reducing cut off points is similar to allowing sub par individuals into fields they are not qualified for. That happens, and it's not going to end well. But I'm looking at the whole picture, And the whole picture does show this to be a fact. It is not Sci-Fi. I have lived it, and seen how it ends. Feminism by gynocentrism is the cause.  Biohacking is not the same as dieting and playing such games. Biohacking is gene editing to create desired results in living organisms. From creating better seeds, to creating seeds susceptible to certain diseases in order to damage the standing of agro-companies. This actually happens a lot nowadays, just more sophisticated due to the interesting methods we have of verifying produce.  Going back to stem, this gynocentric BS, make it very difficult to trust females in STEM. One always has to consider the risk that the individual is sub par, only acquiring papers through the mercies of a system laden with favoritism.  As for your point on building porfolios, that's great in the west, but doesn't work around here. A portfolio is great, but one cannot stay hungry and homeless for 5 years. You do what you need to do, and get to your life goals.  The point stands. You females want equality, then you must be treated exactly like men. That is equality. That is the stated goal of feminism. You cannot justify favoritism, based on the fact that you are female. You had the same chances in life, you got through high school. Then given the fact that we have the same capacity for intelligence, then you must attain the same cut off point as the boys. Otherwise, you're all just full of it, and equality through your methodology is just female supremacy, nothing more.	1640883852.0	hqkearq	t3_rix4o6	t1_hqjma86	/r/antifeminists/comments/rix4o6/what_roblox_posted_during_international_mens_day/hqkearq/
4o06q2s5	According to feminism and FDS, women can do no wrong and can not bear any sort of responsibility.	1640883940.0	hqkej0w	t3_rrsoy0	t3_rrsoy0	/r/antifeminists/comments/rrsoy0/whawhat_in_the_f/hqkej0w/
1x6rbyhc	Well, it's difficult for them to enter the career. If you got your hands on freshman applicants, many are females. Before the end of the semester, very few are left. A look at the coursework will show you that the material has over time been easier. Whether this is due to advancement in technology to pick up the slack, or just gynocentric activism in the senate boards, is up to you. Of course, one only has to look at how the job market is to understand these things. There's less females in the workplaces, because you can't have lower requirements for one gender to enter the workplace than another. A worker is a number that must output the market average to be viable. Otherwise, fire her and employ the young lad who can actually do the job.	1640884331.0	hqkfk16	t3_rix4o6	t1_hp0iqfj	/r/antifeminists/comments/rix4o6/what_roblox_posted_during_international_mens_day/hqkfk16/
1x6rbyhc	Just like...	1640884389.0	hqkfphu	t3_rix4o6	t1_hp0kr4g	/r/antifeminists/comments/rix4o6/what_roblox_posted_during_international_mens_day/hqkfphu/
h4g48y8a	Personal responsibility and the victim card don’t mix well.	1640884462.0	hqkfwlf	t3_rs1mxo	t3_rs1mxo	/r/antifeminists/comments/rs1mxo/i_dont_blame_men_for_all_my_setbacks_and_problems/hqkfwlf/
1x6rbyhc	Everyone is the hero of their own story. Have a good one.	1640884532.0	hqkg3ea	t3_rpftbk	t1_hqjqob7	/r/antifeminists/comments/rpftbk/do_women_cringe_at_you_guys_or_do_they_pray_to/hqkg3ea/
dmwlt5jl	Rule two says no bigotry of any kind including transphobia and misogyny	1640884676.0	hqkgh9f	t3_rs5j9h	t3_rs5j9h	/r/antifeminists/comments/rs5j9h/many_of_the_most_accomplished_women_are_now_men/hqkgh9f/
6o7ki2ap	i saw this shit 2 mins ago. I also got banned from that sub-reddit. Let me tell you those women have problems.	1640884877.0	hqkh0jg	t3_rrsoy0	t3_rrsoy0	/r/antifeminists/comments/rrsoy0/whawhat_in_the_f/hqkh0jg/
exd3z21q	I would have had this conversation after having sex first.	1640885722.0	hqkja68	t3_rs77yz	t3_rs77yz	/r/antifeminists/comments/rs77yz/she_couldnt_handle_the_fact_that_i_have_a_height/hqkja68/
e13pa32v	They banned me because I was in Men's Rights, and woosh I got banned, yup that was even the reason for the ban, no jokes.... Lol XD	1640885767.0	hqkjehr	t3_rrp26d	t1_hqjz2dm	/r/antifeminists/comments/rrp26d/that_was_fast/hqkjehr/
17go3t	why didnt the person who abducted her just abduct her friend since they obviouosly had access to her first	1640885774.0	hqkjf3p	t3_rrnggo	t1_hqhwxjz	/r/antifeminists/comments/rrnggo/un_report_confirms_women_are_the_majority_of_sex/hqkjf3p/
ezj2furm	Don’t you know? It’s cause of the ✨patriarchy✨	1640885795.0	hqkjh4b	t3_rs1mxo	t3_rs1mxo	/r/antifeminists/comments/rs1mxo/i_dont_blame_men_for_all_my_setbacks_and_problems/hqkjh4b/
f3oveo68	If you think THIS sub is toxic, you wouldn't have stood a snowball's chance in a microwave in either of the MGTOW subs.  Not that I disagree with MGTOW, nor am I suggesting for one second that the idea of MGTOW is toxic.  I'm just saying that sometimes things got heated in the original MGTOW sub and you would've been eaten alive.	1640885837.0	hqkjl39	t3_rrf8ec	t3_rrf8ec	/r/antifeminists/comments/rrf8ec/this_sub_is_toxic/hqkjl39/
ezj2furm	Oh shit. Didn’t know that sub existed. Haven’t even looked at it and I’m already pissed off.	1640885887.0	hqkjpzu	t3_rrp26d	t3_rrp26d	/r/antifeminists/comments/rrp26d/that_was_fast/hqkjpzu/
e13pa32v	Dude having sex like that with a feminist is the worst thing one can do, you are giving value to them by doing that, stop it, and rather be calm and choose a girl who's better and loyal, well yeah i got your sarcasm too lol	1640886048.0	hqkk5em	t3_rs77yz	t1_hqkja68	/r/antifeminists/comments/rs77yz/she_couldnt_handle_the_fact_that_i_have_a_height/hqkk5em/
737crz7b	No idea.	1640887019.0	hqkmpvh	t3_rrnggo	t1_hqkjf3p	/r/antifeminists/comments/rrnggo/un_report_confirms_women_are_the_majority_of_sex/hqkmpvh/
6oglk9ti	Golddiggers are smart but exchange wealth for their moral values. Paradoxical, isn't it?	1640887283.0	hqknf8c	t3_rrsoy0	t3_rrsoy0	/r/antifeminists/comments/rrsoy0/whawhat_in_the_f/hqknf8c/
g18g1co6	There always has to be an oppressor with feminists	1640887936.0	hqkp5cq	t3_rs1mxo	t3_rs1mxo	/r/antifeminists/comments/rs1mxo/i_dont_blame_men_for_all_my_setbacks_and_problems/hqkp5cq/
dokaa57a	Wow you really thought you did something here	1640887981.0	hqkp9ls	t3_rphcx7	t3_rphcx7	/r/antifeminists/comments/rphcx7/pornstar_pay_gap/hqkp9ls/
6p54znpe	Something tells me that this had to be fake like Noone is actually this stupid right?    Riiiiiight?	1640888090.0	hqkpk1w	t3_rs77yz	t3_rs77yz	/r/antifeminists/comments/rs77yz/she_couldnt_handle_the_fact_that_i_have_a_height/hqkpk1w/
dokaa57a	You literally have a group against women’s right but when someone has a group against men’s rights suddenly you lose your shit.	1640888249.0	hqkpz8m	t3_ro90mg	t3_ro90mg	/r/antifeminists/comments/ro90mg/fds_part_2/hqkpz8m/
dokaa57a	If all you men are so concerned about your reproductive rights get a vasectomy or be celibate pretty fucking simple	1640888692.0	hqkr57o	t3_rmtdju	t3_rmtdju	/r/antifeminists/comments/rmtdju/men_have_absolutely_no_reproductive_rights/hqkr57o/
ajjeyose	If 't be true all thee men art so concern'd about thy reproductive rights receiveth a vasectomy 'r beest celibate quaint fucking simple  ***    ^(I am a bot and I swapp'd some of thy words with Shakespeare words.)  Commands: `!ShakespeareInsult`, `!fordo`, `!optout`	1640888706.0	hqkr6k7	t3_rmtdju	t1_hqkr57o	/r/antifeminists/comments/rmtdju/men_have_absolutely_no_reproductive_rights/hqkr6k7/
eakcnzp8	Shakespeare-Bot, thou hast been voted most annoying bot on Reddit. I am exhorting all mods to ban thee and thy useless rhetoric so that we shall not be blotted with thy presence any longer.	1640888722.0	hqkr82v	t3_rmtdju	t1_hqkr6k7	/r/antifeminists/comments/rmtdju/men_have_absolutely_no_reproductive_rights/hqkr82v/
dxmbczrh	Well, yeah...we want the hottest piece of arm candy we can find. The real issue here is that *you* pretend to not care about that while we're all about it and see no reason to apologize for it, either.	1640888728.0	hqkr8mj	t3_rrsoy0	t3_rrsoy0	/r/antifeminists/comments/rrsoy0/whawhat_in_the_f/hqkr8mj/
dxmbczrh	Meh...they can do whatever they want as both parties get exactly what they're after.	1640888855.0	hqkrkor	t3_rrsoy0	t1_hqk7w81	/r/antifeminists/comments/rrsoy0/whawhat_in_the_f/hqkrkor/
dxmbczrh	Well, I guess they're "smart" the same way a starving man eating is "smart".	1640888942.0	hqkrsvy	t3_rrsoy0	t1_hqk19uq	/r/antifeminists/comments/rrsoy0/whawhat_in_the_f/hqkrsvy/
dokaa57a	No this place is just for sad lonely incel boys	1640888964.0	hqkrv0n	t3_rk5v30	t3_rk5v30	/r/antifeminists/comments/rk5v30/are_there_any_antifeminist_women_on_this_sub/hqkrv0n/
8nllk	Looks like you dodged a huge bullet there buddy.	1640889175.0	hqksevu	t3_rs77yz	t3_rs77yz	/r/antifeminists/comments/rs77yz/she_couldnt_handle_the_fact_that_i_have_a_height/hqksevu/
9d5310md	Reddit is a weird echo chamber sometimes but my votes seem more normal now. I also do not have a problem with women voting however they should be required to serve the nation as much as men do. Otherwise I dont care how much a woman cries for "equality", it will only be her asking for privileges.   I dislike compulsory military service personally especially since I am in the Middle East but it is one of those aspects of life you gotta take care of. I feel like it's the state's way of getting free labor without calling it slavery.   In the very least, I think that accountability between the sexes should be equal. I hate nothing more than a "strong independent woman" that blames literally everyone else once things go wrong in her life.	1640889189.0	hqksg89	t3_rri0cf	t1_hqhx1d7	/r/antifeminists/comments/rri0cf/male_privilege_im_sorry_but_this_fact_gives_a/hqksg89/
dokaa57a	Well maybe if men were smarter they wouldn’t get with gold diggers in the first place	1640889453.0	hqkt5c2	t3_rrsoy0	t1_hqkrsvy	/r/antifeminists/comments/rrsoy0/whawhat_in_the_f/hqkt5c2/
