h2jt1i58	Honest question: how is feminism a good thing for equality?  Seriously would love an answer.  because you people love to say this, you literally never back it up.  You people just spew out talking points with zero substance behind them.  At least here people can actually explain their stance and give non anecdotal reasoning behind their statement.  If it's so good, why is it literally not working and no progress has been made in 50 years?  Why is it such a rejected concept by like 75% of people if it's so good?  Funny we can agree stealing is bad, but we can't seem to agree feminism is any good.  It's not where near as clear cut as you want to pretend it is, not even close.  So I ask again, how is feminism good *for equality*?  And no, I'm not patronizing you, I am asking you to support your claim with facts as a common curtsey because of a statement on a forum you made publicly (and managed to throw insults in there too unprompted... feminism sooo good.  right? Such reasonable actions by you).	1640981042.0	hqpz2gn	t3_rsvbv7	t1_hqpma4f	/r/antifeminists/comments/rsvbv7/most_of_the_comments_under_this_post_are_from/hqpz2gn/
hr1glbu2	Imagine how 1st world women would feel if the world actually oppressed them the way it does men. They wouldn't have to resort to movies and television and fantasy worlds to feel oppressed. They would be getting thrown in jail by their abusers and their children and money taken from them, and nobody listening when they are assaulted, and having people publicly calling for their extinction, like what men go through. Instead they have to look to fantasy make believe worlds to find oppression.	1640981235.0	hqpzj9w	t3_rsoxug	t3_rsoxug	/r/antifeminists/comments/rsoxug/when_feminism_meats_rselfawarewolves/hqpzj9w/
h2jt1i58	Motherhood is a choice and it's 100% in control of her hands (abortion, BS, just ya know, not having unprotected sex).  They don't deserve shit (or as feminists like to say "I don't owe you anything!!!") other than what they sow then reap, like everyone else.   It's always we don't owe men shit... but also, hey, I'm a woman of this group, you should respect me by default and fuck it, give me more because I "**deserve** better"  You deserve what you earn, period.  If you earned a life being a single mother because you got pregnant and kicked the father out, that's a you problem, and unfortunately the child's too to a much bigger and impactful degree.  I don't give a shit about single mothers when it comes to their kids, kids first.  Stop making it all about you, grow up, own your mistake and do the better things for your child. *You have a kid, your life as you knew it is over, end of story.  Deal with it.*	1640981474.0	hqq03i2	t3_rsk85y	t3_rsk85y	/r/antifeminists/comments/rsk85y/because_thats_why_mothers_are_praised/hqq03i2/
1udiaefw	First can make you weaker. Know when to be strong and when you can soften up a bit.	1640981563.0	hqq0b0y	t3_rsomra	t1_hqpv53m	/r/antifeminists/comments/rsomra/an_interesting_post_from_fds_simping_is_their/hqq0b0y/
304eh18o	I have no clue what "indecent" is. But I guess this is feminist media trying is best to exaggerate. Four months in jail for a card. And here is the list of charges from wiki:   &#x200B;  Subsequently, a first information report was lodged on charges of, inter alia, sections 420 (cheating and dishonestly inducing delivery of property), 467 (Forgery of valuable security), and 468 (forgery for purpose of cheating) of the Indian Penal Code, as well as various provisions of the Information Technology Act,	1640981612.0	hqq0f48	t3_rt25nb	t3_rt25nb	/r/antifeminists/comments/rt25nb/mp_lawyer_in_jail_for_sending_indecent_birthday/hqq0f48/
h2jt1i58	lol at how she had to make sure she said no harm, because she is always going on about getting rid of all men in her vile ideas.	1640981637.0	hqq0hdq	t3_rszltb	t3_rszltb	/r/antifeminists/comments/rszltb/dumbest_person_on_twitter_has_posted_this_every/hqq0hdq/
h2jt1i58	This is basically a copy of a third of women's bios, on dating apps at least. Which is just a whole other world to start with.  Man or woman, both are trashy and superficial as hell to put that garbage out there.	1640981725.0	hqq0ote	t3_rt1jw0	t3_rt1jw0	/r/antifeminists/comments/rt1jw0/it_seems_that_men_arent_allowed_to_have/hqq0ote/
h2jt1i58	All good, carry on.  We'll mark this one up as a lack of coffee and move right along.	1640981775.0	hqq0szi	t3_rsvbv7	t1_hqpyv0h	/r/antifeminists/comments/rsvbv7/most_of_the_comments_under_this_post_are_from/hqq0szi/
2i0bd26i	No.  What I wrote above is common enough to have been stereotyped.  If you don't see it, good for you, but it's the day to day reality for a lot of people.   Modern Feminism has three rules:  1. Blame men. 2. All men are bad and want to hurt you. 3. You cannot be a good or moral person without being a Feminist.  And you can prove all three of these rules true yourself by reading the comments under any post on r/Feminism	1640981819.0	hqq0won	t3_rsvbv7	t1_hqpfiut	/r/antifeminists/comments/rsvbv7/most_of_the_comments_under_this_post_are_from/hqq0won/
hn1rlj7e	agreed.	1640982000.0	hqq1c1s	t3_rt1jw0	t1_hqq0ote	/r/antifeminists/comments/rt1jw0/it_seems_that_men_arent_allowed_to_have/hqq1c1s/
16waqz	Read the replies to your comment.   Still don't get it?	1640982356.0	hqq266f	t3_rsvbv7	t1_hqppogq	/r/antifeminists/comments/rsvbv7/most_of_the_comments_under_this_post_are_from/hqq266f/
16waqz	I didn't think so but lol...   How do you group women and "soyboys" together in an antifeminist group?	1640982410.0	hqq2at3	t3_rsvbv7	t1_hqoqwpx	/r/antifeminists/comments/rsvbv7/most_of_the_comments_under_this_post_are_from/hqq2at3/
16waqz	Actually kinda glad this is floating around Reddit and being popularized.   Obviously there's even a pretty big collective of men that either are blind to the realistic situations or are just....  .... White Knights.	1640982487.0	hqq2h6b	t3_rsvbv7	t3_rsvbv7	/r/antifeminists/comments/rsvbv7/most_of_the_comments_under_this_post_are_from/hqq2h6b/
hs0u6nbh	No we won't;-)	1640982602.0	hqq2ql4	t3_rsvbv7	t1_hqq0szi	/r/antifeminists/comments/rsvbv7/most_of_the_comments_under_this_post_are_from/hqq2ql4/
h3jnyzo2	"She has tits and glasses. She must be into NFTs or something." --You	1640982615.0	hqq2rp3	t3_rsjg1e	t1_hqp9k3j	/r/antifeminists/comments/rsjg1e/be_a_real_man_bois_believe_in_gender_equality/hqq2rp3/
19w9grf9	from wikipedia:  Feminism is a range of social movements and ideologies that aim to define and establish the political, economic, personal, and social equality of the sexes. Feminism incorporates the position that societies prioritize the male point of view, and that women are treated unjustly within those societies. Efforts to change that include fighting against gender stereotypes and establishing educational, professional, and interpersonal opportunities and outcomes for women that are equal to those for men.  u just said to give some substance then pulled out a 50 years of useless feminism and 75% of people rejecting it out your ass. lmao.  fighting for womens rights has stopped in the last couple of years as women have equal rights in most places. thats why the term now isnt all about women its equality of the sexes. to be anti feminist is undermining all the shit people have fought for.   to directly answer your question, feminism is fighting for equality. not against it. i think this sub has a skewed definition of feminism, or a lot of them are incels who wont take the time to google what it is. not saying you are but thats probably what majority of reddit sees this sub as.	1640982913.0	hqq3gee	t3_rsvbv7	t1_hqpz2gn	/r/antifeminists/comments/rsvbv7/most_of_the_comments_under_this_post_are_from/hqq3gee/
dsa9cr2s	It looks made up.	1640982931.0	hqq3hu5	t3_rs77yz	t1_hqksevu	/r/antifeminists/comments/rs77yz/she_couldnt_handle_the_fact_that_i_have_a_height/hqq3hu5/
6p54znpe	>First can make you weaker  Bro first of all that's edgy asf  Second of all There's no proof of that Don't confuse being  Kind woth  Being simp or doormat or  Getting someones priority  Over yours that's not being kind.   >Know when to be strong and when you can soften up a bit.   That's exactly what strong and kind people know  Only "strong" people don't even know when to soften up and just stay "strong" all the damn time which breeds weakness  Since it just bottles up their emotions and makes them vulnerable to outbursts which contradicts their whole agenda.  Hence why people who focus on only "strong" part and not take into account "kind" part  Are weaker than ppl who are both.	1640984012.0	hqq61nw	t3_rsomra	t1_hqq0b0y	/r/antifeminists/comments/rsomra/an_interesting_post_from_fds_simping_is_their/hqq61nw/
5htxi7gf	Accurate.	1640984113.0	hqq6a57	t3_rso2fn	t1_hqnp9gz	/r/antifeminists/comments/rso2fn/lesbian_abuse/hqq6a57/
h2jt1i58	So first off, I really appreciate your response and having a conversation. I am not attacking you, but am giving a detailed rebuttal.  Christianity is about helping the poor.  How does that work out?  point here you can say all you want, but what you do is what actually matters.  A man can say he doesn't hit women and believes women are princesses, does that matter though if he hits his wife?  Of course not, you don't care about the words, you care what he actually did.  >to directly answer your question, feminism is fighting for equality. not against it.  If you fight for ONE group and not ALL groups that is NOT equality.  If you own 5 cars, but you only drive one, are you driving them equally?  No, you are not, you're favoring one.  Say you are trying to get the miles up (say miles are rights) so you drive that car to get the miles up *like the rest*, are you being equal?  No, you are STILL not driving the other cars the same amount.  When you fight **for** women that is **NOT** fighting for everyone.  Calling feminism about equality sounds nice, but that's absolutely not what you people do, you favor women over men.  That is by definition not equal.  Which is 100% fine, but we ask y'all stop saying one thing while doing the other.    Let me put it this way, mens rights, MRA, *is not about equality*, it's about men, no one else.  Same concept as feminism, but for men.  Neither of those movements are about equality, egalitarianism is.    Here is a real life example of how feminism is not about equality and in fact against men, abortion.  I have literally never, not once, seen a feminist say "hold up, we are fucking men over with this, we need to include them since this impacts them"  Literally never.  Equality with abortion would be "Women need the choice, but it should not come at the expense of men (say he wants the child or not, just the opposite stance of the mother), so we should include them in the conversation"  But it's not that, at all.  It's "men make abortion hard and it's *women's* health", which is framed that way to make it all about women and blame men, that's why they refuse to use the term "family planning" anymore like we did 15 years ago.  It was to intentionally exclude men, that is by definition not equality.  I understand your reasoning behind giving me the wiki page and definition.  But what I am saying is I don't care what you say, I care what you do. And my point is *what feminism does* is flat out, undeniably, not good for the overwhelming majority of men.  If you exclude men or any group, at all, in any capacity, you are not about equality no matter what you say.  Saying it's to get women even or whatever is fine, but it's not equality and it does not benefit everyone, it benefits women.   You simply can not be about equality if you do not treat all involved equally, feminism as you stated with your definition is fighting for women, no mention of men.  That's flat out not equal treatment.  If you favor women that's fine, but don't pretend favoring women is good for everyone, it's good for women and no one else.   Feminism: the advocacy of women's rights on the basis of the equality of the sexes *favors women, excludes men*  Mens rights: The MRM in particular consists of a variety of groups and individuals (men's rights activists or MRAs) who focus on general social issues and specific government services which adversely impact, or in some cases structurally discriminate against, men. *favors men, excludes women*  Egalitarian: the doctrine that all people are equal and deserve equal rights and opportunities. *favors no one, excludes no one*	1640984414.0	hqq6zbc	t3_rsvbv7	t1_hqq3gee	/r/antifeminists/comments/rsvbv7/most_of_the_comments_under_this_post_are_from/hqq6zbc/
dp335yea	Movement claims to be about equality for men and women yet makes statements like this lol full of shit. Any man who doesn’t see the truth about these bastards is fooling himself.	1640984830.0	hqq7y6z	t3_rszltb	t3_rszltb	/r/antifeminists/comments/rszltb/dumbest_person_on_twitter_has_posted_this_every/hqq7y6z/
12r9x1	Look at the sub this post OP cross posted from.	1640984856.0	hqq80ed	t3_rsvbv7	t1_hqq2at3	/r/antifeminists/comments/rsvbv7/most_of_the_comments_under_this_post_are_from/hqq80ed/
19w9grf9	well then you are right but feminism is still needed in a couple of third world countries where it isnt equal and im pretty sure since it started as women only thing people just havent started saying egalitarian but mean to say it thats why when you google it it doesnt say anything about favouring women right away. there are some radical feminists out there that ruin it, FDS is a sub like that.	1640985830.0	hqqa975	t3_rsvbv7	t1_hqq6zbc	/r/antifeminists/comments/rsvbv7/most_of_the_comments_under_this_post_are_from/hqqa975/
63o6mdq9	At any point a man pointing out bad women  Feminist : INCEL ! INCEL!! INCEL !!!!!	1640986417.0	hqqblar	t3_rso2fn	t1_hqomp6p	/r/antifeminists/comments/rso2fn/lesbian_abuse/hqqblar/
a1695msn	Your whole argument is “yOu HaTe WoMeN!111”.   Typical to claim I’m a woman-hater. Normally that would silence me but not here. I don’t hate women fyi.   Also, your reading comprehension is terrible. I didn’t say 99% of women identify as feminists. I said they buy into the feminist narrative ( “women are oppressed, underpaid, sexually repressed by men, etc.”) That in turn makes for misandrist legislation and policies that discriminate against men.	1640986442.0	hqqbn8v	t3_rs77yz	t1_hqofrpu	/r/antifeminists/comments/rs77yz/she_couldnt_handle_the_fact_that_i_have_a_height/hqqbn8v/
h2jt1i58	I am stating through action, forge the definition, feminism is not for equality, that's all.  Which is 100% fine, we just ask that people stop pretending it is when it favors women.  It's like it's worse to admit it favors women, but honestly even this sub would not care if feminists would just say they are looking out for themselves and no one else, because then we can have a discussion which leads to fixing things (much like you and I discussing here and not throwing insults and stuff).  If more responded like you did to me, the tension would be almost zero.  So I, and I am sure most others here, appreciate you for this.  We need these conversations and need them to be productive for either side to move forward with the other.  And yes, I 100% agree feminism even as we know it here and now in the US, is needed elsewhere.  There is no doubt about that.  If you lurk around here and MRA enough you'll see we mention this often.  Almost as a dig at western feminists to say you want women's rights, but you care about petty things instead of standing up for women living in real rape cultures and real male dominated societies.    I get what you are saying about FDS, but FDS is like Scientology to Christianity in my analogy.  Regular feminism is still rather extreme to men.  FDS does though crank it up way more to beyond extreme levels.  So again, I appreciate the conversation and I appreciate, and will speak for others, that you took my response for what it was and to see my perspective instead of throwing talking points at me.	1640986479.0	hqqbqct	t3_rsvbv7	t1_hqqa975	/r/antifeminists/comments/rsvbv7/most_of_the_comments_under_this_post_are_from/hqqbqct/
16waqz	I think they have a good point. Especially when comparing comments.	1640986587.0	hqqbzej	t3_rsvbv7	t1_hqq80ed	/r/antifeminists/comments/rsvbv7/most_of_the_comments_under_this_post_are_from/hqqbzej/
4hb4k0mo	Ya gotta love the double standard from this chick well done dude Stay toxic King	1640986688.0	hqqc7pp	t3_rs77yz	t3_rs77yz	/r/antifeminists/comments/rs77yz/she_couldnt_handle_the_fact_that_i_have_a_height/hqqc7pp/
1k4tkno7	It is pretty sad that some women actually do this. Losing your standards and labels regardless of how bizarre they are for some handsome boi.	1640987194.0	hqqdd5h	t3_rsvbv7	t3_rsvbv7	/r/antifeminists/comments/rsvbv7/most_of_the_comments_under_this_post_are_from/hqqdd5h/
7xo29s8e	Strong women. Not good. Notice the difference.	1640988295.0	hqqfukc	t3_rsomra	t3_rsomra	/r/antifeminists/comments/rsomra/an_interesting_post_from_fds_simping_is_their/hqqfukc/
h4g48y8a	Not everything has been built by men. There are millions of women out there in the trades, making everything available under the Sun.   What you’re implying here is that no woman at anytime, or anyplace has ever created anything, and that’s simply just not true.	1640989152.0	hqqhs8s	t3_rt42sb	t3_rt42sb	/r/antifeminists/comments/rt42sb/its_funny_isnt_it_the_amount_of_disrespect_men/hqqhs8s/
hmmm0prs	Women are more abusive in any kind of relationship	1640990068.0	hqqjuey	t3_rso2fn	t1_hqnp9gz	/r/antifeminists/comments/rso2fn/lesbian_abuse/hqqjuey/
htykpjn0	All I said was all the modern conveniences these feminists enjoy and tweet “men suck” from are created by men.	1640990380.0	hqqkjli	t3_rt42sb	t1_hqqhs8s	/r/antifeminists/comments/rt42sb/its_funny_isnt_it_the_amount_of_disrespect_men/hqqkjli/
9lkd56oo	go back to simping in fds!	1640990537.0	hqqkw05	t3_rso2fn	t1_hqomp6p	/r/antifeminists/comments/rso2fn/lesbian_abuse/hqqkw05/
dsa9cr2s	That’s because women like men. Actual grown-up take responsibility for their own actions, take care of themselves and have a good heart for taking care of people around them men.  NOT whiny-assed little boys.  But do not be deceived, I don’t care how good looking a man is; if he treats me badly either in words or actions I will leave.  Life is too short to put up with that kind of treatment. If a man is kind, honest and has integrity it doesn’t matter what he looks like because strength of character stands the test of time. Looks fade. Not just of course for women but for men as well.  I do not believe men get better looking with time.  This site says women don’t have the same “quote” market value as they age but neither do men. Men lose their hair. And their teeth. And they get bellies. And their muscle turns to mush. Same as us. Men and women really are not different in that way at all. And if that’s not attractive to a man to see a woman like I doubt most women would find  that attractive either. I know I don’t.  I don’t care how much money he makes because I make plenty of my own.  However if a man respects himself and takes care of himself a woman notices and that is hugely attractive to a woman.  And of course speaking for myself I noticed that right off. No one wants to crawl spend time with someone who is flabby and smelly. Doesn’t matter whether they’re a man or a woman. That’s a big ole’ turn off!	1640990620.0	hqql2lx	t3_rsvbv7	t1_hqouvsj	/r/antifeminists/comments/rsvbv7/most_of_the_comments_under_this_post_are_from/hqql2lx/
1k4tkno7	I never got why this became a double standard. As long as you’re not bullying or harassing those whose qualities you don’t like, I see no problem. There’s a difference between “ I don’t want fat chicks.” and “I don’t want greasy fat pigs that smell like wet dogs.”	1640990769.0	hqqle5p	t3_rt1jw0	t3_rt1jw0	/r/antifeminists/comments/rt1jw0/it_seems_that_men_arent_allowed_to_have/hqqle5p/
ls4hu	I'd still rather ask a rock. Better to look at.	1640990823.0	hqqli92	t3_rsvbv7	t1_hqp3z0x	/r/antifeminists/comments/rsvbv7/most_of_the_comments_under_this_post_are_from/hqqli92/
dmwlt5jl	Do keep in mind that women also had a lot of involvement in many of the inventions you're discussing, but that they weren't always given credit, or their involvement was written off, or they worked under their husbands name, that they weren't actually allowed to have an education, or that it wasn't socially acceptable for them to do stuff like that, etc.	1640990875.0	hqqlmds	t3_rt42sb	t1_hqqkjli	/r/antifeminists/comments/rt42sb/its_funny_isnt_it_the_amount_of_disrespect_men/hqqlmds/
hn1rlj7e	True	1640990902.0	hqqlogp	t3_rt1jw0	t1_hqqle5p	/r/antifeminists/comments/rt1jw0/it_seems_that_men_arent_allowed_to_have/hqqlogp/
9lkd56oo	fds user spotted in public😂	1640990927.0	hqqlqgo	t3_rsa9p0	t3_rsa9p0	/r/antifeminists/comments/rsa9p0/well_where_the_gents_at/hqqlqgo/
9lkd56oo	not necessarily that, but you gotta recognize the reality that women are held less accountable than men	1640991007.0	hqqlws6	t3_rs9u4w	t1_hqmrb8v	/r/antifeminists/comments/rs9u4w/the_cheers_and_claps_said_it_all/hqqlws6/
htykpjn0	You literally post pics of posts in this sub on “anti misogyny” accounts lmfao. Your opinion means Jack shit.	1640991036.0	hqqlz1l	t3_rt42sb	t1_hqqlmds	/r/antifeminists/comments/rt42sb/its_funny_isnt_it_the_amount_of_disrespect_men/hqqlz1l/
2i0bd26i	Rocks certainly don't have crippling daddy-issues like they do.	1640991146.0	hqqm7ql	t3_rsvbv7	t1_hqqli92	/r/antifeminists/comments/rsvbv7/most_of_the_comments_under_this_post_are_from/hqqm7ql/
b80o6	Sex has always been and will always be a commodity for women.  That's why they get upset when we dont want to buy because of the 'packaging' it's wrapped up in, especially when that's all they're selling.  ----------------------------------------------  *Hell hath no fury like a woman scorned.*  😉	1640992146.0	hqqobwj	t3_rt1jw0	t3_rt1jw0	/r/antifeminists/comments/rt1jw0/it_seems_that_men_arent_allowed_to_have/hqqobwj/
9lkd56oo	well they got downvoted as deserved	1640992256.0	hqqok7w	t3_rqpals	t3_rqpals	/r/antifeminists/comments/rqpals/on_a_post_about_a_guy_being_raped_these_comments/hqqok7w/
b80o6	Women always look for a man who is taller, richer, smarter than them. That means for a man, you are with a woman who shorter, poorer, and dumber...  *Chris Rock.*	1640992263.0	hqqoktp	t3_rt1jw0	t1_hqpvk2g	/r/antifeminists/comments/rt1jw0/it_seems_that_men_arent_allowed_to_have/hqqoktp/
3x3wodgy	Kindness by weak people isn't virtuous at all because they have no other choice.  Typical "(not really) nice guy" behavior.  Notice the poster closes:  "Raise good men. Raise strong women."	1640992474.0	hqqp1a6	t3_rsomra	t1_hqnw8ho	/r/antifeminists/comments/rsomra/an_interesting_post_from_fds_simping_is_their/hqqp1a6/
aba5aa1o	Happy new year, dear ladies and gentlemen.  Let the new year bring you relief, serenity, love, success, good Karma and healing positivity.  Let the old year take away your pain and suffering, because you deserve healthy and splendid life.  I am here for you. I honor you and send you nurturing, joyful energy.	1640992638.0	hqqpe0l	t3_rt5eay	t3_rt5eay	/r/antifeminists/comments/rt5eay/happy_new_year_everybody/hqqpe0l/
1k4tkno7	Happy New Year, you absolute legends!	1640993935.0	hqqs97y	t3_rt5eay	t3_rt5eay	/r/antifeminists/comments/rt5eay/happy_new_year_everybody/hqqs97y/
759a31o4	Is that really a woman? Look more like an abomination	1640994272.0	hqqt0b2	t3_rewttq	t3_rewttq	/r/antifeminists/comments/rewttq/a_french_feminist_writes_a_book_called_i_hate_men/hqqt0b2/
759a31o4	Anyone who says “I’m a man/woman so [fill in blank]” is a *PIECE OF SHIT !!!!*	1640994639.0	hqqtttb	t3_rs77yz	t3_rs77yz	/r/antifeminists/comments/rs77yz/she_couldnt_handle_the_fact_that_i_have_a_height/hqqtttb/
9yil24fz	My town has a noticeable number of lesbians and NON of them take care of themselves or have healthy relationships.	1640995613.0	hqqvwn2	t3_rso2fn	t3_rso2fn	/r/antifeminists/comments/rso2fn/lesbian_abuse/hqqvwn2/
4dfswjoi	Be a gentleman but don't be a simp	1640996863.0	hqqyiua	t3_rsomra	t3_rsomra	/r/antifeminists/comments/rsomra/an_interesting_post_from_fds_simping_is_their/hqqyiua/
7bjndvbl	Nobody would be doing the difficult and dangerous jobs.	1640997208.0	hqqz91f	t3_rszltb	t1_hqpocfk	/r/antifeminists/comments/rszltb/dumbest_person_on_twitter_has_posted_this_every/hqqz91f/
9j48ogkj	Definitely not	1640997486.0	hqqzuhg	t3_rihzh9	t3_rihzh9	/r/antifeminists/comments/rihzh9/aita/hqqzuhg/
d1h4a	Or at least that was the basic reaction at the mensrights sub.	1640998743.0	hqr2ibf	t3_rt7rys	t3_rt7rys	/r/antifeminists/comments/rt7rys/vile_misogynist_swinecreature_claims_women_are_by/hqr2ibf/
51jxmxgo	> Your whole argument is “yOu HaTe WoMeN!111”.  1. It’s not my whole argument, it was an offhand comment that followed my main argument, that you can’t assume this woman is a feminist just on the basis of being female.  2. “You hate women” is my *point*, not my *argument*. My argument is that admitting to hating 99% of women counts as hating women. And I think that’s valid reasoning.	1641000670.0	hqr6lly	t3_rs77yz	t1_hqqbn8v	/r/antifeminists/comments/rs77yz/she_couldnt_handle_the_fact_that_i_have_a_height/hqr6lly/
99cker03	Dodged a fucking truck, bus, and anti tank missile.	1641005020.0	hqrfjts	t3_rs77yz	t3_rs77yz	/r/antifeminists/comments/rs77yz/she_couldnt_handle_the_fact_that_i_have_a_height/hqrfjts/
37whekn5	"Incel recruitment for the alt-right"     When I heard the above rationalization I stopped reading the original comments. I'm not contracting 'stupid' and carrying it into 2022.	1641005217.0	hqrfxq4	t3_rsvbv7	t3_rsvbv7	/r/antifeminists/comments/rsvbv7/most_of_the_comments_under_this_post_are_from/hqrfxq4/
