author	body	created_at	c_id	s_id	p_id	permalink
8wwjsfel	I've heard numerous places that open air fires, with maybe a hole in the roof or a door opened, and chimnerias were used quite often *indoors* until relatively recently. This seems astonishing seeing my friends and family can barely sit around a camp fire without coughing up a lung when the smoke goes our way.  Were previous generations simply "used to it", or was suffocation and lung cancer just like super common? "Oh, Tim died last night, shut his door too much"	1642727724.0	htjci3x	t3_s7qqa4	t3_s7qqa4	/r/AskHistorians/comments/s7qqa4/short_answers_to_simple_questions_january_19_2022/htjci3x/
6o00bi9p	King Song Myong of Paekche, a kingdom in the Korean Peninsula, officially introduced Buddhism in Japan. Sometime between 538-552 AD (sources are differing about the timeline), he sent some sutras and monks along with a Buddha image.   According to _Nihon Shoki_, Soga no Umako (belonging to the influential Soga family) who was presented with the aforementioned image,  after building a temple to house this image, he commissioned a former priest to train three women as nuns. These nuns went to Paekche to study more about Buddhism, returning to Japan in 590AD. And _Nihon Shoki_ states this exchange as the beginning of Buddhism in Japan.   After its official introduction, Prince Shōtoku, nephew of Empress Suiko, the first empress in Japan and also a Buddhist, promoted Buddhism. He played an important role in establishing Buddhism in Japan, erecting two temples, one in Nara and one in Osaka, that are still standing tall today.   A little shy of a century later, Emperor Shōmu's government encouraged people to convert,  they built more temples and preached Buddhism.   There are no records of any Hindu missionaries in Japan. It is said that the renditions of Hindu culture that we see in Japan spread through slow immigration or through  travellers visiting India or other parts of Asia(where Hinduism spread) who took elements of this culture back home, which is how Japan has so many Indian deities and you'll find a harmonious blend of Hinduism and Buddhism. However, there was never any active preaching and converting involved.    Sources: 1. _A History of Japanese Buddhism_, by Kenji Matsuo  2. _Japanese Buddhism_, by Yoshirō Tamura	1642778775.0	htlwd7o	t3_s974xa	t3_s974xa	/r/AskHistorians/comments/s974xa/how_did_buddhism_spread_to_japan_and_china_while/htlwd7o/
brj23ud1	It seems like this conversation has strayed quite far from the original point into debating specific cases that were only intended as possible examples, which is unfortunate because it's an excellent conversation otherwise.   It began with this quote, which I think is fairly uncontroversial  > how teaching a too simplified version of the history of science might actually be detrimental to emerging scientists.  And you said this, which relevant baseball seems to have mostly agreed with  > I think this is what the previous comment referred to as the "march of winners", not in the sense of winners and losers as people, but rather ideas that "won" because they better explained the facts. Because the scientist isn't really interested in the people, they are just convenient names to hang ideas on. Instead, the "history" is just an account of how our understanding of some phenomenon proceeded from A to B, via steps X, Y and Z in between.  > This kind of account absolutely does not replace history, but it's not meant to. It's just a consequence of the division of labor between scientist and historian, with the scientist providing an account of the evolution of an idea, and the historian providing the context surrounding the idea.  This seems to me like the real crux of the problem, before getting into the definition of "shitty papers", "politicization of science" and the details of Morgan's Canon. Because the ideas that better explained the facts may not have been accepted by the wider scientific community at the time, or they may not better explain the facts compared to more modern ideas/theories. The division between scientist and historian is a valid description of the two fields, but that doesn't justify enforcing the division or preclude attempts to bridge the gap. The context surrounding an idea is an important part of how that idea came to be discovered, and even more important to how it came to be accepted by the community at large.   Many modern discoveries and new areas of scientific study come from the combination and overlap of distinct disciplines, occasionally even ones that might be considered outside the realm of hard science. Specialization is understandable and even necessary as the wealth of scientific knowledge increases, but enforcing or relying on strict delineations between disciplines doesn't seem beneficial to Science at large.   Teaching that (theory x) was developed by (some guy) who happened to be obsessed (weird thing) doesn't undermine (some guy)'s achievement. It just leaves the door open for some curious future scientist to get the idea "hey what if (unanswered question) is answered by something (some guy) missed because of his obsession?"  The recent example that lives rent-free in my mind is the airborne particle misunderstanding that we all learned of during the pandemic. The [Wired article](https://www.wired.com/story/the-teeny-tiny-scientific-screwup-that-helped-covid-kill/) describes physicists and aerosol scientists trying to convince WHO advisers - scientists themselves! - of the actual danger of airborne particles:  > Morawska had spent more than two decades advising a different branch of the WHO on the impacts of air pollution. When it came to flecks of soot and ash belched out by smokestacks and tailpipes, the organization readily accepted the physics she was describing—that particles of many sizes can hang aloft, travel far, and be inhaled. Now, though, the WHO’s advisers seemed to be saying those same laws didn’t apply to virus-laced respiratory particles. To them, the word airborne only applied to particles smaller than 5 microns. Trapped in their group-specific jargon, the two camps on Zoom literally couldn’t understand one another.  This [NYT column](https://www.nytimes.com/2021/05/07/opinion/coronavirus-airborne-transmission.html) mentions the case of John Snow discovering how cholera spreads and not being believed for over a decade. So the point of trying to contextualize the "march of winners" approach isn't about politicizing science or trying to make scientists into historians. It's about reminding them the core idea of science - that we should continue to question our assumptions, that there is always more knowledge to be gained. And another idea, that what "science knows" is only what has been accepted and widely disseminated, which is not always the totality of discoveries. Even uncontroversial discoveries take time to be disseminated, validated, and accepted. Making that knowledge a more core part of scientific education seems like a great way to improve the quality and pace of scientific research at the broadest level.	1642800637.0	htnjvbq	t3_s8kqxq	t1_htm2lm3	/r/AskHistorians/comments/s8kqxq/how_should_i_do_history_as_a_scientist/htnjvbq/
1ouz4fvr	Smithsonian affiliate in your city? As your grandfather was from x city who worked in Nuremberg trials?  Depending what the stuff is, it makes sense taking it to a museum.  My boss worked with a man who was with patton who was one of the ones who picked up stuff off the German capital building (can’t spell it) floor after the soviets took the metal filing  cabinets but not the documents. He picked stuff off the floor and took it home with him  His stuff went to my library (where I worked) and then onto the smithsonian affiliate. He was an am ambassador who married a Rich women (money family) their kids knew the stuff was important so it went to where scholars can research their lives.   I never saw his collection but my boss cried when the Smithsonian came and took it back to the city.	1642818010.0	htorr4f	t3_s9qsbu	t3_s9qsbu	/r/AskHistorians/comments/s9qsbu/how_do_i_ethically_get_rid_of_inherited_nazi/htorr4f/
brj23ud1	> Returning to the topic, as I said, I am totally in favor of teaching the history of science. The question addressed the narrower point of teaching it in science classes.  I was addressing the narrower point as well, specifically why a small amount of science history as context around those lessons could be very helpful.  > Perhaps the issue had been politicized already, as the WHO was at many points during COVID  The Wired article I linked is a good read. It answers this question and all of your hypotheticals. Specifically, it's about a woman who was already researching the 100 micron misconception a decade before COVID and her difficulties in convincing other scientists. In other words - mid-pandemic politicization had nothing to do with it. I brought it up because a scientist with a good idea that gets ignored by other scientists is a trend that seems common through history, and if scientists had been taught in the way being discussed - that added context of these major discoveries being ignored or rejected - could have potentially saved many lives. When I talked about dissemination of scientific ideas, I didn't mean to the public. I meant from the scientists making discoveries, to the other scientists ignoring them.	1642818641.0	htot94m	t3_s8kqxq	t1_htoqr0x	/r/AskHistorians/comments/s8kqxq/how_should_i_do_history_as_a_scientist/htot94m/
hv1636wk	>the reason for anti-Jewish hatred and persecution has absolutely nothing to do with things Jewish men and women did, said or thought.  Bless you for this.  Thank you.	1642850622.0	htqcex4	t3_sa01c6	t1_htqau7m	/r/AskHistorians/comments/sa01c6/what_did_jewish_people_do_to_get_persecuted_so/htqcex4/
9m9x95w9	I never read that Napoleon struggled to speak French. That he spoke it with an accent, sure (and even then, accent change with time and Napeolon surely didn't speak with the same corsican accent after 20 years surrounded by people who had other accents), but given that most aristocrats in Europe and especially in Corsica had their children learn French from a young age, and that Napoleon spent many years in immersion in France starting in 1779 when he was just 10 years old, I'm pretty certain that he was fluent at least by the time the French Revolution began.	1642850755.0	htqclli	t3_s9r5do	t3_s9r5do	/r/AskHistorians/comments/s9r5do/what_languages_did_people_in_france_speak_before/htqclli/
236mhxs	Thank you for doing this. I just recently finished Stannard's American Holocaust which is what introduced me to this subject.	1642892600.0	htsz1xz	t3_s75mv2	t1_ht88hub	/r/AskHistorians/comments/s75mv2/is_the_assimilation_of_immigrants_into_american/htsz1xz/
h8ny3uyr	I can’t speak about what the internal Church discussions about the excommunication were, hopefully someone else can.  I can add some and some information however:   The Catholic Church did do some excommunicating for being a Nazi leader, but it doesn’t appear as if Goebbels was specifically excommunicated for only that.   First, a some background:   Church excommunications of Nazis began in September 1930, when the bishop of Mainz excommunicated every Catholic member of the Nazi party in his diocese, banned uniformed groups from entering churches, and forbade Nazis from taking part in services and ceremonies.   In February 1931, the German bishops had their annual conferences and and decided to support the bishop of Mainz, but limited excommunications to Nazi leaders and activists, and exemptions “followers” who might have supported the Nazi Party for specific policies and without understanding the Nazis’ ultimate goals regarding religion.   In December 1931, Goebbels married. This was the time of his excommunication. While he had considering becoming a priest while younger, by this point he was already quite anti-Christianity, especially against the Catholic Church.   The Church eased its restrictions on Nazi party membership in 1933, at first to accommodate a law requiring all civil employees and union members to be party members, and then as part of maneuvers with the Nazis; cumulating in some public assurances by Hitler and the Reichsconcordant, an agreement signed in July 1933 between the Catholic Church and the German government ostensibly preserving the rights of the Church in Germany (note: Hitler became chancellor in January 1933, and seized full power in 1934). Some Catholics even helped Hitler take power, most prominently Franz von Papen.   With all of this in mind, while his own anti-Church rhetoric and string Nazis ties may well have been preexisting “strikes” that attracted Church attention, I do not believe they were the only reason Goebbels was excommunicated and here is why:  1. His excommunication was not during the general “we excommunicate Nazis leaders as a whole” time of February 1931. His excommunication occurred in at the time of his marriage, in December 1931,. It wasn’t explicitly lifted with the general ban in 1933 either, not even when the Church wasn’t excommunicating Catholics like van Papen for enabling the Nazis to take total power.   2. Geobbels wrote in his diary that he was excommunicated for his marriage, at the time of his marriage. He published an edited version that diary in 1933 before the Nazis took power and when they still the Catholic Church could have been a strong opponent, and then later had all of his diaries processed for posterity, so it is possible that he lied to maintain the fiction that a good Catholic could be a Nazi, but the original, handwritten versions remained, and were published in 2004. They say the same thing.   3. No other major Nazi leaders were excommunicated by name, not even Hitler. Some argue he doesn’t count as he had already made himself an apostate years before so the Church considered him not to be a member, but no one else was excommunicated by name either. If the only reason Geobbels was excommunicated was his Nazi leadership, then why weren’t other Nazis treated similarly?   4. His marriage was going to cause trouble. Catholic canon law from 1917-1983, specifically canon 2319 ​​§1, 1°, said that marrying, baptizing a child, or teaching a child in a belief other than Catholicism was cause for automatic excommunication.    Goebbels married a divorced Protestant, who was only a Protestant herself because she was a Catholic apostate who converted to Protestantism to marry her now ex-husband, in a civil ceremony filled with the leaders of an anti Catholic party, but no priests. This was enough for automatic excommunication, and the high profile of the wedding meant that the Church was sure to know about it.   So why didn’t the Church excommunicated more Nazis?  It is very late for me, and this is in an entire question itself, but the extremely brief answer is that there are two ways to be excommunicated.   The fast way is the automatic way (latae sententiae) that Goebbels did it. Break the wrong church rule, and you get automatic excommunication the moment that you do it. Perhaps there may be some paperwork, but that is all that it is. You are out.  The other is by trail (sententiae ferendae). This is rare, and the existing canon law didn’t apply perfectly to what the Nazis were doing.   Of course it could have been done in some form, as the 1930/31 decisions showed, but the ultimately failed efforts to maintain Church independence in Germany and some ambivalence about some Nazi policies by some in the Church made it not Really Worth It until it was way too late.  Then, the war was on, oppression was already great, Hitler’s ally Mussolini was also a strong church supporter at home in Italy and couldn’t be pushed too far, and then after that, the war was over.   Die Tagebücher von Joseph Goebbels, Aufzeichnungen 1923–1941, Volume 1, page 189  Scholder, Klaus, The Churches and the Third Reich. 2 vols. Fortress Press, 1988   Bonney, Richard, The 'Kulturkampf’ Newsletters, 1936-1939, Peter Lang Ltd. 2009z   Code of Canon Law, Vatican.va	1642898548.0	httdlte	t3_sa5sns	t3_sa5sns	/r/AskHistorians/comments/sa5sns/was_joseph_goebbels_excommunicated_from_the/httdlte/
h8ny3uyr	I can’t speak about what the internal Church discussions about the excommunication were, hopefully someone else can.  I can add some and some information however:   The Catholic Church did do some excommunicating for being a Nazi leader, but it doesn’t appear as if Goebbels was specifically excommunicated for only that.   First, a some background:   Church excommunications of Nazis began in September 1930, when the bishop of Mainz excommunicated every Catholic member of the Nazi party in his diocese, banned uniformed groups from entering churches, and forbade Nazis from taking part in services and ceremonies.   In February 1931, the German bishops had their annual conferences and and decided to support the bishop of Mainz, but limited excommunications to Nazi leaders and activists, and exemptions “followers” who might have supported the Nazi Party for specific policies and without understanding the Nazis’ ultimate goals regarding religion.   In December 1931, Goebbels married. This was the time of his excommunication. While he had considering becoming a priest while younger, by this point he was already quite anti-Christianity, especially against the Catholic Church.   The Church eased its restrictions on Nazi party membership in 1933, at first to accommodate a law requiring all civil employees and union members to be party members, and then as part of maneuvers with the Nazis; cumulating in some public assurances by Hitler and the Reichsconcordant, an agreement signed in July 1933 between the Catholic Church and the German government ostensibly preserving the rights of the Church in Germany (note: Hitler became chancellor in January 1933, and seized full power in 1934). Some Catholics even helped Hitler take power, most prominently Franz von Papen.   With all of this in mind, while his own anti-Church rhetoric and string Nazis ties may well have been preexisting “strikes” that attracted Church attention, I do not believe they were the only reason Goebbels was excommunicated and here is why:  1. His excommunication was not during the general “we excommunicate Nazis leaders as a whole” time of February 1931. His excommunication occurred in at the time of his marriage, in December 1931,. It wasn’t explicitly lifted with the general ban in 1933 either, not even when the Church wasn’t excommunicating Catholics like van Papen for enabling the Nazis to take total power.   2. Geobbels wrote in his diary that he was excommunicated for his marriage, at the time of his marriage. He published an edited version that diary in 1933 before the Nazis took power and when they still the Catholic Church could have been a strong opponent, and then later had all of his diaries processed for posterity, so it is possible that he lied to maintain the fiction that a good Catholic could be a Nazi, but the original, handwritten versions remained, and were published in 2004. They say the same thing.   3. No other major Nazi leaders were excommunicated by name, not even Hitler. Some argue he doesn’t count as he had already made himself an apostate years before so the Church considered him not to be a member, but no one else was excommunicated by name either. If the only reason Geobbels was excommunicated was his Nazi leadership, then why weren’t other Nazis treated similarly?   4. His marriage was going to cause trouble. Catholic canon law from 1917-1983, specifically canon 2319 ​​§1, 1°, said that marrying, baptizing a child, or teaching a child in a belief other than Catholicism was cause for automatic excommunication.    Goebbels married a divorced Protestant, who was only a Protestant herself because she was a Catholic apostate who converted to Protestantism to marry her now ex-husband, in a civil ceremony filled with the leaders of an anti Catholic party, but no priests. This was enough for automatic excommunication, and the high profile of the wedding meant that the Church was sure to know about it.   So why didn’t the Church excommunicate more Nazis?  It is very late for me, and this is in an entire question itself, but the extremely brief answer is that there are two ways to be excommunicated.   The fast way is the automatic way (latae sententiae) that Goebbels did it. Break the wrong church rule, and you get automatic excommunication the moment that you do it. Perhaps there may be some paperwork, but that is all that it is. You are out.  Not a lot of what the Nazis did the the pre-war years were covered by these rules. They focused more on internal church matters.  The other is by trial (sententiae ferendae). This is rare, and the existing canon law didn’t apply perfectly to what the Nazis were doing.   Of course it could have been done in some form, as the 1930/31 decisions showed, but the ultimately failed efforts to maintain Church independence in Germany and some ambivalence about some Nazi policies by some in the Church made it not Really Worth It until it was way too late.  Then, the war was on, oppression was already great, Hitler’s ally Mussolini was also a strong church supporter at home in Italy and couldn’t be pushed too far, and then after that, the war was over.   Die Tagebücher von Joseph Goebbels, Aufzeichnungen 1923–1941, Volume 1, page 189  Scholder, Klaus, The Churches and the Third Reich. 2 vols. Fortress Press, 1988   Bonney, Richard, The 'Kulturkampf’ Newsletters, 1936-1939, Peter Lang Ltd. 2009  Code of Canon Law, Vatican.va	1642898685.0	httdxgt	t3_sa5sns	t3_sa5sns	/r/AskHistorians/comments/sa5sns/was_joseph_goebbels_excommunicated_from_the/httdxgt/
