author	body	created_at	c_id	s_id	p_id	permalink
h8ny3uyr	I can’t speak about what the internal Church discussions about the excommunication were, hopefully someone else can.  I can add some and some information however:   The Catholic Church did do some excommunicating for being a Nazi leader, but it doesn’t appear as if Goebbels was specifically excommunicated for only that.   First, some context:  Church excommunications of Nazis began in September 1930, when the bishop of Mainz excommunicated every Catholic member of the Nazi party in his diocese, banned uniformed groups from entering churches, and forbade Nazis from taking part in services and ceremonies.   In February 1931, the German bishops had their annual conferences and and decided to support the bishop of Mainz, but limited excommunications to Nazi leaders and activists, and exemptions “followers” who might have supported the Nazi Party for specific policies and without understanding the Nazis’ ultimate goals regarding religion.   In December 1931, Goebbels married. This was the time of his excommunication. While he had considering becoming a priest while younger, by this point he was already quite anti-Christianity, especially against the Catholic Church.   The Church eased its restrictions on Nazi party membership in 1933, at first to accommodate a law requiring all civil employees and union members to be party members, and then as part of maneuvers with the Nazis; cumulating in some public assurances by Hitler and the Reichsconcordant, an agreement signed in July 1933 between the Catholic Church and the German government ostensibly preserving the rights of the Church in Germany (note: Hitler became chancellor in January 1933, and seized full power in 1934). Some Catholics even helped Hitler take power, most prominently Franz von Papen.   With all of this in mind, while his own anti-Church rhetoric and string Nazis ties may well have been preexisting “strikes” that attracted Church attention, I do not believe they were the only reason Goebbels was excommunicated and here is why:  1. His excommunication was not during the general “we excommunicate Nazis leaders as a whole” time of February 1931. His excommunication occurred in at the time of his marriage, in December 1931,. It wasn’t explicitly lifted with the general ban in 1933 either, not even when the Church wasn’t excommunicating Catholics like van Papen for enabling the Nazis to take total power.   2. Geobbels wrote in his diary that he was excommunicated for his marriage, at the time of his marriage. He published an edited version that diary in 1933 before the Nazis took power and when they still the Catholic Church could have been a strong opponent, and then later had all of his diaries processed for posterity, so it is possible that he lied to maintain the fiction that a good Catholic could be a Nazi, but the original, handwritten versions remained, and were published in 2004. They say the same thing.   3. No other major Nazi leaders were excommunicated by name, not even Hitler. Some argue he doesn’t count as he had already made himself an apostate years before so the Church considered him not to be a member, but no one else was excommunicated by name either. If the only reason Geobbels was excommunicated was his Nazi leadership, then why weren’t other Nazis treated similarly?   4. His marriage was going to cause trouble. Catholic canon law from 1917-1983, specifically canon 2319 ​​§1, 1°, said that marrying, baptizing a child, or teaching a child in a belief other than Catholicism was cause for automatic excommunication.    Goebbels married a divorced Protestant, who was only a Protestant herself because she was a Catholic apostate who converted to Protestantism to marry her now ex-husband, in a civil ceremony filled with the leaders of an anti Catholic party, but no priests. This was enough for automatic excommunication, and the high profile of the wedding meant that the Church was sure to know about it.   So why didn’t the Church excommunicate more Nazis?  It is very late for me, and this is in an entire question itself, but the extremely brief answer is that there are two ways to be excommunicated. One didn’t apply most of the time and the other wasn’t worth it to the Church leadership at the time.   The fast way is the automatic way (latae sententiae) that Goebbels did it. Break the wrong church rule, and you get automatic excommunication the moment that you do it. Perhaps there may be some paperwork after the fact, but that is all that it is. You are already out.  Not a lot of what the Nazis did the the pre-war years were covered by these rules. They focused more on internal church matters.  The other is by trial (sententiae ferendae). This is rare, and the existing canon law didn’t apply perfectly to what the Nazis were doing.   Of course it could have been done in some form, as the 1930/31 decisions showed, but the ultimately failed efforts to maintain Church independence in Germany and some ambivalence about some Nazi policies by some in the Church made it not Really Worth It until it was way too late.  Then, the war was on, oppression was already great, Hitler’s ally Mussolini was also a strong church supporter at home in Italy and couldn’t be pushed too far, and then after that, the war was over.   Die Tagebücher von Joseph Goebbels, Aufzeichnungen 1923–1941, Volume 1, page 189  Scholder, Klaus, The Churches and the Third Reich. 2 vols. Fortress Press, 1988   Bonney, Richard, The 'Kulturkampf’ Newsletters, 1936-1939, Peter Lang Ltd. 2009  Code of Canon Law, Vatican.va	1642898810.0	htte850	t3_sa5sns	t3_sa5sns	/r/AskHistorians/comments/sa5sns/was_joseph_goebbels_excommunicated_from_the/htte850/
hiag0s4	I think more can be written, but here is a previous similar question and its answer.   * [Why did Buddhism spread into China/Japan while Hinduism stayed more local to India?](https://www.reddit.com/r/AskHistorians/comments/2q46hn/why_did_buddhism_spread_into_chinajapan_while/) answered by u/[deleted] and u/Jasfss  Here is a post also about Hinduism.   * [How do we know that Hinduism is one of the oldest religions if it is ?](https://www.reddit.com/r/AskHistorians/comments/qg2426/how_do_we_know_that_hinduism_is_one_of_the_oldest/) answered by u/MaharajadhirajaSawai	1642947714.0	htvrd8b	t3_s974xa	t3_s974xa	/r/AskHistorians/comments/s974xa/how_did_buddhism_spread_to_japan_and_china_while/htvrd8b/
apk26h4	**What is a autobiography book of the personal writings of people who have achieved major successes that hasn't been repeated often in history?**  The personal writings of the author doesn't have to cover every major thing that happened in their life, their major successes should be things that hasn't been repeated often in history.  Examples:  * [Meditations](https://en.wikipedia.org/wiki/Meditations)  Marcus Aurelius was a emperor who was very successful at leading the Roman Empire to fight both a pandemic that has a 25% fatality rate and massive foreign invasions at the same time.  * [My Inventions](https://en.wikipedia.org/wiki/My_Inventions:_The_Autobiography_of_Nikola_Tesla)  Nikola Tesla was an inventor, major rival and former close ally of Thomas Edison who was very ahead of his time especially when comes to pushing for major advancements in energy and mechanics.  * [American Sniper](https://en.wikipedia.org/wiki/American_Sniper_(book))  Chris Kyle was a United States Navy SEAL sniper who was by far the deadliest American sniper due the amount of confirmed kills that he carried out according to the US Department of Defense.  Please note that I was advised to post this question by a mod.	1642953861.0	htw5e6h	t3_s7qqa4	t3_s7qqa4	/r/AskHistorians/comments/s7qqa4/short_answers_to_simple_questions_january_19_2022/htw5e6h/
11ax7v	Das ist jetzt keine direkte Frage zu dem tatsächlich spannenden Thema, sondern geht mehr in Richtung zu erwartender Qualität:  Wie gut ist Ihr Deutsch?  Bitte nicht falsch verstehen ;-)	1642954803.0	htw7qmb	t3_savz63	t3_savz63	/r/AskHistorians/comments/savz63/im_dr_nancy_reagin_author_of_reliving_the/htw7qmb/
fixjn	Nowadays some fan creations are tremendous in scope, practically worlds of their own; I’m wondering what some of these looked like in the past. What’s the most ambitious piece of pre-1960s fan media you’ve seen, and what’s the story behind it?	1642955017.0	htw8a9m	t3_savz63	t3_savz63	/r/AskHistorians/comments/savz63/im_dr_nancy_reagin_author_of_reliving_the/htw8a9m/
iovlhi6b	Good question, and I agree that it's a "chicken and egg" one.  Germans emigrated to many parts of the world during the 19th century, but particularly to the U.S. and Canada.  There, they became part of a transnational German culture, which had frequent exchanges and contacts with Germans "back home."  German-language press in North America reported on white settlement and conflicts with Indigenous cultures, and these reports were sometimes reprinted in Germany.  Using their contacts in German-American communities, German artists and authors sometimes came to North America and met with Indigenous peoples; after they went home, they published travel literature, novels, gave lectures, and sold art based on their observations of the West and its peoples; Rudolf Cronau is a good example of someone with this type of career.  There was a clear audience for this type of travel literature or fiction, since many Germans had grown up reading James Fenimore Cooper's *Leatherstocking Tales* (very popular in 19th century Germany), along with popular German author of Westerns like Friedrich Gerstaecker and Balduin Moellhausen.  For more on the transnational cultural exchanges between Germans around the West and its peoples, I'd recommend H. Glenn Penny's *Kindred by Choice*.	1642957016.0	htwdfn8	t3_savz63	t1_htw1se0	/r/AskHistorians/comments/savz63/im_dr_nancy_reagin_author_of_reliving_the/htwdfn8/
2mdk872f	Well, they didn't divide into Russians, Ukrainians, and Belarusians. Ukrainians original endonym was Rus' or Rusyns. Belarusian endonym was Litvins. Idk much about Muscovy, it was originally populated by many fino-ugric peoples (Merya, Murom, Meshchera, Mordvinians). I think the apropriate question would be when people of Muscovy became assimilated by Slavic people.	1642971714.0	htxfhb6	t3_sb37w1	t3_sb37w1	/r/AskHistorians/comments/sb37w1/when_did_the_east_slavs_divide_themselves_into/htxfhb6/
7zv78xey	It’s in Alison Weir’s “The Six Wives of Henry VIII”  [link](https://books.google.com/books?id=uUV3JgWK5dsC&printsec=frontcover&source=gbs_atb#v=onepage&q=She%20had%20wanted%20to%20breastfeed%20Elizabeth%20herself&f=false)	1642987151.0	htyir6f	t3_s6wyah	t1_htx9z9c	/r/AskHistorians/comments/s6wyah/why_did_upper_class_european_women_not_breastfeed/htyir6f/
yfege	This submission has been removed because it involves current events.  To keep from discussion of politics, we have a [20-year rule](http://www.reddit.com/r/AskHistorians/wiki/rules#wiki_no_current_events) here.  You may want to try /r/ask_politics, /r/NeutralPolitics, or another current-events focused sub. For further explanation of this rule, feel free to consult [this Rules Roundtable](https://www.reddit.com/r/AskHistorians/comments/glj8c4/rules_roundtable_xii_the_twenty_year_rule/).	1643033103.0	hu0pnzh	t3_sblxe2	t3_sblxe2	/r/AskHistorians/comments/sblxe2/what_are_some_recent/hu0pnzh/
96gqp	Hi there - unfortunately we have had to remove your question, because [/r/AskHistorians isn't here to do your homework for you](https://www.reddit.com/r/AskHistorians/wiki/rules#wiki_homework). However, our rules DO permit people to ask for help with their homework, so long as they are seeking clarification or resources, rather than the answer itself.     If you have indeed asked a homework question, you should consider resubmitting a question more focused on finding resources and seeking clarification on confusing issues: tell us what you've researched so far, what resources you've consulted, and what you've learned, and we are more likely to approve your question. Please see this [Rules Roundtable](https://www.reddit.com/r/AskHistorians/comments/hplxyf/rules_roundtable_xx_the_no_homework_rule/) thread for more information on what makes for the kind of homework question we'd approve. Additionally, if you're not sure where to start in terms of finding and understanding sources in general, we have a six-part series, "[Finding and Understanding Sources](https://www.reddit.com/r/AskHistorians/wiki/theory#wiki_monday_methods.3A_finding_and_understanding_sources)", which has a wealth of information that may be useful for finding and understanding information for your essay. Finally, other subreddits are likely to be more suitable for help with homework - try looking for help at /r/HomeworkHelp.     Alternatively, if you are not a student and are not doing homework, we have removed your question because it resembled a homework question. It may resemble a common essay question from a prominent history syllabus or may be worded in a broad, open-ended way that feels like the kind of essay question that a professor would set. Professors often word essay questions in order to provide the student with a platform to show how much they understand a topic, and these questions are typically broader and more interested in interpretations and delineating between historical theories than the average /r/AskHistorians question. If your non-homework question was incorrectly removed for this reason, we will be happy to approve your question if you **wait for 7 days** and then ask a less open-ended question on the same topic.	1643043615.0	hu1fg9r	t3_sbpztw	t3_sbpztw	/r/AskHistorians/comments/sbpztw/what_are_many_ways_classical_greek_civilization/hu1fg9r/
