author	body	created_at	c_id	s_id	p_id	permalink
4duy22aq	Yeah you're right informed consent and bodily autonomy mean nothing You literally have brain worms	1642836275.0	htps8yp	t3_s9gzx4	t3_s9gzx4	/r/offmychest/comments/s9gzx4/my_dad_got_fired_for_not_getting_the_vaccine/htps8yp/
a79xq82i	Didn’t the court just rule that jobs/employers cannot mandate their employees to be vaccinated?	1642838866.0	htpw339	t3_s9gzx4	t3_s9gzx4	/r/offmychest/comments/s9gzx4/my_dad_got_fired_for_not_getting_the_vaccine/htpw339/
itns4rcn	Well here's the thing. Right now it's just 1-2 a day but it's most likely going to be more than that some day. I used to only smoke on bad days. Now it's everyday. Hopefully it won't grow beyond this but it most likely will.	1642839068.0	htpwdii	t3_s9uk87	t1_htpmet6	/r/offmychest/comments/s9uk87/i_started_smoking_in_nursing_school/htpwdii/
dex16	JFC what a pathetic, self-righteous post. Shockingly, despite your childish holier-than-thou attitude, you're no better than the people you complain about. People have lost family, friends and so much more to this virus, but your only takeaway was "people fighting over vaccines and masks is annoying"? what the actual fuck is wrong with you???	1642839525.0	htpx1lv	t3_s9by4g	t3_s9by4g	/r/offmychest/comments/s9by4g/im_sick_and_tired_of_the_antimask_and_antivaxx/htpx1lv/
gaaeshr0	You should absolutely divorce him.  Because he cheated.   IDGAF what you look like. You deserve better. You could be Quasimodo or Gabrielle Union. No one deserves a cheating a-hole.	1642842821.0	htq1q9k	t3_s9c18f	t3_s9c18f	/r/offmychest/comments/s9c18f/im_divorcing_my_husband_because_im_dark_and_ugly/htq1q9k/
60kn343t	who knew a pandemic would reveal how massively (and easily) manipulated people are	1642845115.0	htq4uxo	t3_s9gzx4	t1_htngq8u	/r/offmychest/comments/s9gzx4/my_dad_got_fired_for_not_getting_the_vaccine/htq4uxo/
dw683tcv	nah	1642845981.0	htq61eg	t3_s9ta34	t3_s9ta34	/r/offmychest/comments/s9ta34/is_having_a_girlfriend_useful/htq61eg/
eefr72ot	Congratulations on your (official) engagement.  " I am your Mom, I come first".  Nope.  The "devouring mother" as described by Jung comes to mind.	1642847796.0	htq8hwb	t3_s9zfl4	t3_s9zfl4	/r/offmychest/comments/s9zfl4/my_mom_cant_accept_my_husband_so_of_nearly_20/htq8hwb/
g0pvc24u	Sure.	1642848409.0	htq9bwa	t3_s9zfux	t1_htq6tct	/r/offmychest/comments/s9zfux/the_last_12_months/htq9bwa/
4q4b0m91	are they aware snapchat is for teenagers?	1642850208.0	htqbtzd	t3_sa082h	t3_sa082h	/r/offmychest/comments/sa082h/my_wife_has_been_snapchattingtexting_her_boss/htqbtzd/
9qj4gpbh	Yes! Now get back to work, that’s the only way you will be able to gain respect. The world is a shitshow and there is jackshit we can do about it. You just got to suck it up.	1642850318.0	htqbzp0	t3_s9zwcs	t3_s9zwcs	/r/offmychest/comments/s9zwcs/i_fucking_hate_being_a_man/htqbzp0/
i88fqj2x	Seems that way.	1642850866.0	htqcr72	t3_sa082h	t1_htqcpp4	/r/offmychest/comments/sa082h/my_wife_has_been_snapchattingtexting_her_boss/htqcr72/
g0pvc24u	I'm pretty sure I was diagnosed with ADHD? When I was a kid at least.	1642850934.0	htqcula	t3_s9zfux	t1_htqbwp0	/r/offmychest/comments/s9zfux/the_last_12_months/htqcula/
i88fqj2x	Thanks.	1642851010.0	htqcyhk	t3_sa082h	t1_htqcvot	/r/offmychest/comments/sa082h/my_wife_has_been_snapchattingtexting_her_boss/htqcyhk/
i88fqj2x	My wife talks to EVERYONE on Snapchat. Which I find so stupid, because she’ll be texting the same exact people at the same exact time. I personally hate Snapchat and I always have. Lol always found it pointless. This situation with her boss is just weird.	1642851943.0	htqeaxv	t3_sa082h	t1_htqdjf7	/r/offmychest/comments/sa082h/my_wife_has_been_snapchattingtexting_her_boss/htqeaxv/
g0pvc24u	The only thing I'm confused about is aren't ADHD and ADD like, behavioural disorders or something? I'm kinda unsure how it relates to my situation.	1642851970.0	htqecd4	t3_s9zfux	t1_htqd7bp	/r/offmychest/comments/s9zfux/the_last_12_months/htqecd4/
ik1f1dd0	Said by me, not by you.	1642856981.0	htqm5j4	t3_sa256c	t1_htqm2ya	/r/offmychest/comments/sa256c/i_absolutely_hate_women/htqm5j4/
5d2idjo2	If you give me your legs I can be a human spider	1642857279.0	htqmn8m	t3_sa1v2a	t3_sa1v2a	/r/offmychest/comments/sa1v2a/i_want_to_amputate_my_own_legs/htqmn8m/
ik1f1dd0	I'm not trolling. The answer to your wonder is in the text.   Thankfully this sub exists, this has to be said somewhere without public reprimand.	1642857398.0	htqmui7	t3_sa256c	t1_htqmevx	/r/offmychest/comments/sa256c/i_absolutely_hate_women/htqmui7/
58f9jskr	pro life = pro fetus	1642857402.0	htqmuos	t3_sa26rp	t3_sa26rp	/r/offmychest/comments/sa26rp/pro_choice_pro_abortion/htqmuos/
3vd2hyyn	A good day to be gay ✨	1642858983.0	htqppjq	t3_s9wbyk	t3_s9wbyk	/r/offmychest/comments/s9wbyk/all_the_young_fellas_with_no_kids_be_careful_who/htqppjq/
ik1f1dd0	Thank you friend.	1642859840.0	htqrcte	t3_sa256c	t1_htqr8g2	/r/offmychest/comments/sa256c/i_absolutely_hate_women/htqrcte/
ik1f1dd0	There's a violation of natural mechanisms in the world right now. Women wanting to gain control over men, men falling victim to women's weakness and trying to become women, children being up children and children killing children. Complete debauchery.	1642860134.0	htqrx4z	t3_sa256c	t1_htqrljf	/r/offmychest/comments/sa256c/i_absolutely_hate_women/htqrx4z/
ik1f1dd0	Everyone who knows me knows I'm cool. You would too if you knew me.	1642860646.0	htqsx8i	t3_sa256c	t1_htqssep	/r/offmychest/comments/sa256c/i_absolutely_hate_women/htqsx8i/
61fukqqh	YIKES	1642861610.0	htquv6x	t3_sa256c	t3_sa256c	/r/offmychest/comments/sa256c/i_absolutely_hate_women/htquv6x/
i4vjixt6	I remember reading recently that people who are 60+ and not vaccinated are more prone to these current Covid-19 variant.  Take care of your day as it seems impossible to convince him for vaccination.	1642861740.0	htqv502	t3_s9gzx4	t3_s9gzx4	/r/offmychest/comments/s9gzx4/my_dad_got_fired_for_not_getting_the_vaccine/htqv502/
il1qxnb0	I was in the same situation in my senior year of high school - People in my class (who weren't even my friends) would ask me to text them the answers to the homework and stuff after class. At first I did because I felt like it was the nice thing to do, but they took advantage. It got annoying and when I vented about it to my close friends, they were angry on my behalf and told me I should set my foot down, so I finally did.  The next time those people asked for my homework, I said no and went on to explain that I don't exist to do the work for them, and honestly I was pretty pissed when I sent that message so I was pretty blunt. They were shocked but accepted it and never bothered me again, though they did act like I had "suddenly done a 180" and that I needed to "chill" but I didn't care. I was just relieved they stopped asking and guilt-tripping me into giving them my work. These people really sucked for other reasons (like cyberbullying, being patronizing to me all the time etc.) but I was so glad I finally set a boundary and told them off.  You may feel like a jerk/guilty when doing it but later on you really see that it was for the best and it's a confidence-booster honestly. So don't be afraid of saying no :) I used to say the small lies like "Oh I haven't done it yet" etc. but some people are dense or won't care and will still continue to bother you. Being blunt can be scary but from my experience (even after high school) it's been the best remedy to leeches lol.	1642861839.0	htqvca2	t3_s9krkg	t1_htoewu1	/r/offmychest/comments/s9krkg/i_love_to_make_people_feel_wanted_and_included_in/htqvca2/
2t7v348q	If she's all alone and broken, never talks good about your friends AND husband, maybe she wants to trap you in her loneliness...	1642862371.0	htqwgup	t3_s9zfl4	t1_htq8hwb	/r/offmychest/comments/s9zfl4/my_mom_cant_accept_my_husband_so_of_nearly_20/htqwgup/
4q4b0m91	clearly someone’s never made a midnight snack	1642863376.0	htqyo2t	t3_sa082h	t1_htqb11l	/r/offmychest/comments/sa082h/my_wife_has_been_snapchattingtexting_her_boss/htqyo2t/
cfo5wnze	It seems like he did it when I was drunk/drinking. The first time I was drinking  and I never had someone cum in me before so I didn’t know the feeling. With my first born I didn’t even know I was pregnant until 3 months later.  The most recent time, we were on a date so I was drinking as well. I don’t remember if there were other times.  All I remember was the first time and most recent.  To be honest I also wasn’t looking for signs that he was stealthing me (like condoms being on the floor) because  I believed this was someone I can trust.  I was just enjoying sex and the cuddling after.	1642863599.0	htqz5kb	t3_s9rcs8	t1_htq3nww	/r/offmychest/comments/s9rcs8/i_cant_stop_thinking_about_it/htqz5kb/
38kaahpv	Wtf is wrong with you? And having a username like that paired with it? Jesus man	1642863684.0	htqzcbj	t3_s9z1p6	t1_htqyzzr	/r/offmychest/comments/s9z1p6/the_only_reason_i_havent_killed_myself_is_because/htqzcbj/
cfo5wnze	I’m honestly starting to believe he is a narcissist. I’m just waking up to everything now. My mind was clouded for all these years because I was dealing with grief and postpartum . It’s like I’m having this awakening yet I still don’t want to be with anyone else. It’s dumb so fucking dumb.	1642863857.0	htqzq3k	t3_s9rcs8	t1_htqvpc1	/r/offmychest/comments/s9rcs8/i_cant_stop_thinking_about_it/htqzq3k/
5ujyzpev	The same thing happened to me. I'm a male(22yrs old), and used to be the athletic guy who used to go out with the hottest girls at high school and college. I have hypothyroidism and went through a depressive period, which caused me to gain a lot of weight. Though i'm overweight, i'm still rather fit, but now every single male person that knew me when i was athletic points out how fat i've become. I've avoided to meet people from college and highschool for that same reason. Girls have never pointed out my weight gain though.	1642864550.0	htr19bu	t3_s9xuta	t3_s9xuta	/r/offmychest/comments/s9xuta/im_a_former_hot_girl_who_gained_weight_due_to_a/htr19bu/
cfo5wnze	Thank you. I don’t have much more to say but you’re definitely helping me to have a clearer mind. Even though it’s hard. Thank you	1642864850.0	htr1y38	t3_s9rcs8	t1_htpm133	/r/offmychest/comments/s9rcs8/i_cant_stop_thinking_about_it/htr1y38/
cfo5wnze	It probably wont feel real for a long time. Mine has been gone 7 years and I’m still waiting for her to come home. I have constant dreams of her and I have to remind her that she has passed on. I think that’s my brain still fighting the thought of her being gone.   I’m so sorry for your loss ,I hope you can find peace in her not suffering anymore.  Grief is not an easy thing to deal with however I do wish your life gets filled with love and positivity.	1642865472.0	htr3daa	t3_s9mlrn	t3_s9mlrn	/r/offmychest/comments/s9mlrn/my_mum_just_died/htr3daa/
iwibxopv	Thank you for responding! I will certainly do both of these! I think it'll take time but we will slowly get through the slump	1642867373.0	htr7w86	t3_sa54xc	t1_htr74wm	/r/offmychest/comments/sa54xc/my_entire_relationship_was_a_lie_i_am_heartbroken/htr7w86/
iwibxopv	I am glad to read your bit about feeling dirty-I keep feeling so used and secondary but I know all of this is just a reflection of his behaviour. I did the best I could have done and never knew someone could do this and its nice to hear I wasn't silly for missing this either. It sounds silly but even with all the evidence I still thought there is no way he actually cheated because I had real built faith in him. Thank you for your wishes, I really appreciate that and I hope with time things look up!	1642867537.0	htr8aei	t3_sa54xc	t1_htr7dwj	/r/offmychest/comments/sa54xc/my_entire_relationship_was_a_lie_i_am_heartbroken/htr8aei/
cfo5wnze	Ahahaha I’m not ready for that.	1642868372.0	htraayo	t3_s9rcs8	t1_htr7mbp	/r/offmychest/comments/s9rcs8/i_cant_stop_thinking_about_it/htraayo/
iwibxopv	Thank you, I appreciate the response. I think time will help heal some of this for sure. It is only coming up to two months in a few days so it is definitely still early days!	1642868585.0	htratuf	t3_sa54xc	t1_htragwc	/r/offmychest/comments/sa54xc/my_entire_relationship_was_a_lie_i_am_heartbroken/htratuf/
iwibxopv	That does make me feel better!! I kind of hope most of the missing him (or the version of him) goes by six months! I think the deeper wounds will take time. But hopefully by summer it should feel less intense.	1642868980.0	htrbspm	t3_sa54xc	t1_htrbfbn	/r/offmychest/comments/sa54xc/my_entire_relationship_was_a_lie_i_am_heartbroken/htrbspm/
