author	body	created_at	c_id	s_id	p_id	permalink
1mksns5s	Thank you so much!	1642759391.0	htkx9gq	t3_s96w0b	t1_htkx13o	/r/offmychest/comments/s96w0b/it_feels_so_good_to_see_your_life_untangling_for/htkx9gq/
5677wxxi	Did you read the post at all? It's quite clear that they are referring to how long it had been since it happened. Don't snip it out of context.	1642760071.0	htky37v	t3_s8re1l	t1_htkma5a	/r/offmychest/comments/s8re1l/five_years_ago_yesterday_i_was_rped/htky37v/
i52ncczu	i don’t understand.	1642760196.0	htky8oy	t3_s96dxt	t1_htkvq68	/r/offmychest/comments/s96dxt/im_tired/htky8oy/
bzshoexs	Once a cheater always a cheater. You have your own life now. Fuck him! Or are you still stuck on him? It sounds like you still are.	1642762995.0	htl1stw	t3_s97ng6	t3_s97ng6	/r/offmychest/comments/s97ng6/my_cheating_ex_just_got_married/htl1stw/
sffr3	It is absolutely not okay that people have treated you this way, and I hope you know this is not how the entire world thinks. The people who invalidate men or assume "they're all the same" are just as bad as the people who made feminism necessary. Sexism goes both ways, and anyone who treats you this badly simply for being male is just making the problem worse and giving all feninists a bad name.	1642765218.0	htl4u7v	t3_s98lnd	t3_s98lnd	/r/offmychest/comments/s98lnd/with_the_current_state_of_feminism_i_feel/htl4u7v/
6bvi2j3c	If you attract men with cheating behaviour, then the problem is with you allowing this to happen and not taling actions when you see the small red flags. Not their skin color.	1642766595.0	htl6vu9	t3_s97n4x	t3_s97n4x	/r/offmychest/comments/s97n4x/after_being_constantly_traumatized_im_honestly/htl6vu9/
5tatll8	Apologies, what I should have said was "in my experience, I haven't seen sexism anywhere near as bad as what it's been like in the past". I understand I'm not the one that would typically experience it, what I was trying to say was compared to the past, sexism is not as bad. It's still terrible and not where it should be, but not as bad.	1642770009.0	htlclvg	t3_s98lnd	t1_htl98uc	/r/offmychest/comments/s98lnd/with_the_current_state_of_feminism_i_feel/htlclvg/
3yoyd1ay	Your post was deleted before I could read more than the 1st few lines but those line I 100% agree with. Human beings are a parasite & they destroy everything they touch.	1642771166.0	htlesid	t3_s8drje	t3_s8drje	/r/offmychest/comments/s8drje/i_believe_that_humanity_should_go_extinct_and/htlesid/
5tatll8	Sorry, I didn't realise sexism hasn't been shown in the media. On top of that, are you stating that men can't experience sexism?  I accept that predominantly it's females who experience it but your close-mindedness is adding to the problem. Please educate yourself.	1642771401.0	htlf9a0	t3_s98lnd	t1_htlf1y7	/r/offmychest/comments/s98lnd/with_the_current_state_of_feminism_i_feel/htlf9a0/
5tatll8	It's a fact that it isn't as bad as it used to be. I'm not declaring anything. And your argument of "OP, you're a dude" is incredibly outdated and adding to the problem.  If you read the post you'd see I clearly stated more than once that I'm a feminist. I want all genders to have the exact same opportunities and rights. Stop being ignorant.	1642771652.0	htlfreu	t3_s98lnd	t1_htlfj30	/r/offmychest/comments/s98lnd/with_the_current_state_of_feminism_i_feel/htlfreu/
4m84iobx	yup and then they get pregnant again and strictly refer to their new baby as their "rainbow baby" and "miracle".	1642771907.0	htlg9xs	t3_s8xqpa	t3_s8xqpa	/r/offmychest/comments/s8xqpa/im_tired_of_miscarriage_moms/htlg9xs/
11ki83	Totally agree. Came across a schoolfriends Facebook the other day. She miscarried somewhere in the second trimester. Had a photoshoot at the hospital with her three other kids holding the corpse of the baby and made it her cover photo. Birthday posts for the older kids included photo reels with the pics in. My stomach was in my shoes for those poor kids.	1642771928.0	htlgbee	t3_s8xqpa	t3_s8xqpa	/r/offmychest/comments/s8xqpa/im_tired_of_miscarriage_moms/htlgbee/
5tatll8	Better doesn't mean good, as I said in my post. It's awful what's still happening in terms of sexism, but it is a fact that it has improved since the past. You can't challenge that.  Women can vote, own property, be fully independent. The job market is more open for women, more assaults towards women are getting reported and taken far more seriously, the governments are actively seeking ways to reduce the danger women face. Women are allowed to study freely, they're able to gain quslifications and benefits, they're able to lead in parliament and run countries.  None of that could happen in the past. That's the improvement I was referring to. It isn't perfect by any means but please stop adding to the problem.	1642772369.0	htlh7x7	t3_s98lnd	t1_htlganz	/r/offmychest/comments/s98lnd/with_the_current_state_of_feminism_i_feel/htlh7x7/
5tatll8	You aren't calling me out though, you're trying to argue against a fact. Everything you've tried to call me out for is just you taking my words wrongly.  What's adding to the problem is your assumption that because I'm male, sexism hasn't affected me. You're saying that sexism can't happen to other genders apart from females. And to top it all off, you're responding like you didn't even read or understand the post. I know there is still sexism and it's predominantly not towards males, but it doesn't make militant feminism (which is bordering on sexism itself) ok.   No matter what I say will change your opinion because it seems you came here purely to argue so I'll leave it there.	1642773054.0	htliozo	t3_s98lnd	t1_htli12g	/r/offmychest/comments/s98lnd/with_the_current_state_of_feminism_i_feel/htliozo/
gvkl7unj	You WILL still encounter all the same behavior with men who aren’t white. I do think that whiteness is a contributing factor in increasing some aspects of toxic masculinity. But these features you’re describing define toxic masculinity which is pretty much globally pervasive. If you’re really looking for love and a genuine connection, don’t exclude an entire skin color, exclude all of the behaviors you’re describing and you’ll be left with guys of many different skin tones. There are shit guys in every demographic and unfortunately they do outnumber the good ones.	1642774805.0	htlml5r	t3_s97n4x	t3_s97n4x	/r/offmychest/comments/s97n4x/after_being_constantly_traumatized_im_honestly/htlml5r/
5tatll8	Oh aren't you a barrel of fun.  You say I'm "telling other people what they're really up to, when they're the best judges of their own experiences" but that's what you're doing here to me.  I also don't understand your idea of an "unsupported sweeping announcement about sexism" because I'm literally referring to the fact that sexism overall has decreased and that was what I was saying by it getting "better". Maybe I worded that incorrectly.  I'd also disagree that I've benefitted from sexism but if you made that claim I'm glad to hear where you got that information about my personal life from.	1642774843.0	htlmo81	t3_s98lnd	t1_htlj43y	/r/offmychest/comments/s98lnd/with_the_current_state_of_feminism_i_feel/htlmo81/
6bvi2j3c	You make 0 sense, maybe OPs story isnt even real. But the message is clear, hate on skin color based on generalizing.	1642775298.0	htlnqdg	t3_s97n4x	t1_htliwoe	/r/offmychest/comments/s97n4x/after_being_constantly_traumatized_im_honestly/htlnqdg/
ivdqnx2s	Omg same!!	1642776081.0	htlpkyc	t3_s3ks9v	t1_hslf40z	/r/offmychest/comments/s3ks9v/im_22_and_i_have_no_friends/htlpkyc/
hshtq3ae	yeehaw 🔍	1642776268.0	htlq1gv	t3_s9c6m2	t3_s9c6m2	/r/offmychest/comments/s9c6m2/i_dont_forgive_you/htlq1gv/
cemb4tkw	I’m not here to judge whether you are good or bad, but you need professional help if you can afford it, and possibly even if you can’t afford it	1642776559.0	htlqr7g	t3_s9afzh	t3_s9afzh	/r/offmychest/comments/s9afzh/i_am_beginning_to_realize_that_i_am_an_awful/htlqr7g/
kg4qf	Dude the same thing happens to me every time I get sweets for the office. I bought mini eclairs from a French bakery to boost morale and ended up eating them with coffee for a week. I also got donuts once and only one of my coworkers ate one with me, with others stating that they were watching their sugar intake. No more office sweets. I sometimes get mini chocolates for holidays but I've learned my lesson!	1642777277.0	htlsjli	t3_s8ndv8	t3_s8ndv8	/r/offmychest/comments/s8ndv8/i_bought_donuts_for_everybody_at_work_and_im_the/htlsjli/
it87i94w	> I think, like many people, you are experiencing COVID fatigue. I’m 22 and spent my early 20’s dealing and hearing about COVID. It just seems to never end.  Yeah, for sure.	1642778297.0	htlv4wr	t3_s9by4g	t1_htls7yh	/r/offmychest/comments/s9by4g/im_sick_and_tired_of_the_antimask_and_antivaxx/htlv4wr/
3yuka	A girl I went to high school with posts her stillborn baby every year. We don't need to see it.	1642779513.0	htlyb5r	t3_s8xqpa	t3_s8xqpa	/r/offmychest/comments/s8xqpa/im_tired_of_miscarriage_moms/htlyb5r/
9tncl	> I'm sick and tired of the anti-mask and anti-vaxx drama.  Me too.  I just can't wrap my head around how we managed to politicize a fucking virus.  It doesn't care who you voted for - wear the fucking mask.  > Both sides are annoying as fuck and people never shut up about it.  Really?  On the one side you've got people who don't want to die...  And on the other side you've got folks who've decided wearing a mask is the same as the Holocaust.  I just don't see the equivalence.	1642781755.0	htm4754	t3_s9by4g	t3_s9by4g	/r/offmychest/comments/s9by4g/im_sick_and_tired_of_the_antimask_and_antivaxx/htm4754/
it87i94w	> caring about your health is not bad. i genuinely don’t understand how you don’t care.  Way to twist what my post around like an exorcist head spin. I don't know how you got the impression that I "don't care" about health. I even said in my post that I actually do mask up and have been vaxxed. It's probably more about me having compassion fatigue or being emotionally exhausted. Not that I literally don't care about the health of other people.	1642782658.0	htm6lzu	t3_s9by4g	t1_htlz6hg	/r/offmychest/comments/s9by4g/im_sick_and_tired_of_the_antimask_and_antivaxx/htm6lzu/
b6yd0q5c	I consider myself maybe a 6.5. I am a female btw. I used to be more like a 2 when I was in my early/mid teens. Shot up to like an 8 for a little while. Put some make up on. I made sure my hair looked good. Got sylish clothes. I remember getting rejected all the time for being ugly. Looks matter a lot to guys. I didn't realize how much it did until I looked better.   I am not all about looks but yeah I have some standards. How dare I have standards. Who do I think I am?	1642783101.0	htm7t1c	t3_s96zxx	t3_s96zxx	/r/offmychest/comments/s96zxx/when_attractive_people_have_high_standards_they/htm7t1c/
3w2fyi3g	Your husband loving you would absolutely stop him from cheating. You need to love yourself and see yourself how he sees you.	1642783751.0	htm9l3q	t3_s9c18f	t3_s9c18f	/r/offmychest/comments/s9c18f/im_divorcing_my_husband_because_im_dark_and_ugly/htm9l3q/
im20s3uy	Begging someone for sex isn’t rape. It’s people like you who make actual rape seem trivial.	1642783840.0	htm9tr1	t3_s94j4n	t1_htkp3z3	/r/offmychest/comments/s94j4n/i_slept_with_a_friend_and_its_haunting_me/htm9tr1/
jx7n4s2	I think losing an already born baby is an order of magnitude worse than a miscarriage	1642784395.0	htmbcms	t3_s8xqpa	t1_htjsuho	/r/offmychest/comments/s8xqpa/im_tired_of_miscarriage_moms/htmbcms/
1tbxy2qe	Doesn't he get a say in this? Come on lady, don't let low key racist bastards rule your life.	1642785406.0	htme2zw	t3_s9c18f	t3_s9c18f	/r/offmychest/comments/s9c18f/im_divorcing_my_husband_because_im_dark_and_ugly/htme2zw/
6eg5dl4i	Wow your childhood really messed you up	1642785722.0	htmeyae	t3_s9fsqa	t3_s9fsqa	/r/offmychest/comments/s9fsqa/i_enjoy_getting_into_relationships_with_women_for/htmeyae/
9tncl	Yeah...  Sometimes it isn't "*both sides*"...  Sometimes there really **is** a wrong answer.	1642787902.0	htmkyey	t3_s9by4g	t1_htmgxfw	/r/offmychest/comments/s9by4g/im_sick_and_tired_of_the_antimask_and_antivaxx/htmkyey/
55frtvzk	i guess its just confusing because he makes jokes and says out of pocket things too. But that doesnt mean I should have done things the way I did. Ty <3	1642789295.0	htmosvh	t3_s95pe6	t1_htkoiab	/r/offmychest/comments/s95pe6/i_was_such_an_asshole_and_i_never_properly/htmosvh/
4fs3bl71	If you guys love each other and are happy then the rest of the world be damned what they say. You deserve happiness. Don’t make yourself unhappy to please some losers on the internet.	1642789565.0	htmpjnf	t3_s9c18f	t3_s9c18f	/r/offmychest/comments/s9c18f/im_divorcing_my_husband_because_im_dark_and_ugly/htmpjnf/
9tncl	> I'm divorcing my husband because ~~I'm dark and ugly and he deserves better~~ **he's a piece of shit**  Come on now...  He's cheated on you multiple times.  You deserve better.	1642790805.0	htmssr1	t3_s9c18f	t3_s9c18f	/r/offmychest/comments/s9c18f/im_divorcing_my_husband_because_im_dark_and_ugly/htmssr1/
3n1i491n	Fuck the government for making it required. Considering the fact they threatened me (overseas im army) with not going home and seeing my family, I’ll never forget it.	1642791083.0	htmtiho	t3_s9gzx4	t3_s9gzx4	/r/offmychest/comments/s9gzx4/my_dad_got_fired_for_not_getting_the_vaccine/htmtiho/
9tncl	> So basically you're on the masking side...  There aren't **sides** here.  COVID-19 exists.  It's a real, measurable, quantifiable thing.  You don't get an opinion on that any more than you get an opinion on whether gravity exists.  COVID-19 is filling hospital beds, causing long-term issues, and killing people.  We've got the bodies to prove it.  You don't get an opinion on that any more than you get an opinion on whether the Earth is flat.  Wearing masks and getting vaccinated have been proven to be effective in reducing the spread and impact of COVID-19.  We have numerous studies and plenty of statistics to prove it.  You don't get an opinion on that any more than you get an opinion on whether we landed on the moon.  If you've decided COVID-19 is a hoax or "just the flu" or whatever, you aren't dealing with reality.  You've dipped into some sort of conspiracy theory or fantasy or whatever.  If you acknowledge the reality of COVID-19 but prioritize your own comfort over the health and safety of every single person you come in contact with; you're an asshole.  You don't get to ***both sides*** COVID-19.  There aren't two sides.  There's just reality.  > Sounds like part of the problem  The problem is that a substantial chunk of the population has decided that reality will go away if they plug their ears and hum real loud.	1642791841.0	htmvifv	t3_s9by4g	t1_htmqa1r	/r/offmychest/comments/s9by4g/im_sick_and_tired_of_the_antimask_and_antivaxx/htmvifv/
3n1i491n	What are you talking about my guy? Nothing I said was false.	1642791876.0	htmvlvo	t3_s9gzx4	t1_htmvhyp	/r/offmychest/comments/s9gzx4/my_dad_got_fired_for_not_getting_the_vaccine/htmvlvo/
3n1i491n	I’m also a fellow 11B, active duty overseas tho	1642792129.0	htmwale	t3_s9gzx4	t1_htmw13e	/r/offmychest/comments/s9gzx4/my_dad_got_fired_for_not_getting_the_vaccine/htmwale/
avz2zs8i	I'm not anti mask but I am personally anti covid vax (cue the sea of downvotes)  I had covid in 2019 and I thought I was going to die. Natural immunity is better than the vaccine immunity which could be more than just what they're telling us. I don't need the vaccine.  You want fear porn? Imagine the technology that can go into a single injection. We can genetically modify things, play God. What secret scientist are working on stuff in closed doors in rooms we shouldn't know exist?	1642792180.0	htmwfrc	t3_s9by4g	t3_s9by4g	/r/offmychest/comments/s9by4g/im_sick_and_tired_of_the_antimask_and_antivaxx/htmwfrc/
avz2zs8i	Even if theres nothing detrimental to the vaccine for humanity's future generations to inherit,,, like,,, the only point of it is to make rich pharma bros richer with all the fear mongering and insisting its necessary for absolutely everyone. One size doesn't fit all.	1642792330.0	htmwugc	t3_s9by4g	t1_htmwfrc	/r/offmychest/comments/s9by4g/im_sick_and_tired_of_the_antimask_and_antivaxx/htmwugc/
3n1i491n	The fact it doesn’t do anything against covid lmao. I’ve had covid 4 times and only got the vaccine because I was threatened with not going home.	1642792561.0	htmxh2z	t3_s9gzx4	t1_htmx3nb	/r/offmychest/comments/s9gzx4/my_dad_got_fired_for_not_getting_the_vaccine/htmxh2z/
hvx8al7g	How the fuck is OP going to be the centrist on this? Yeah man of course we're fucking upset that theres a huge group of people who are dead set on being walking plague dispensers. Their goal is literally to exhale death and illness in public spaces. I'm supposed to shut up and be ok with this while we're racing towards o n e m i l l i o n covid deaths, most of which we could have prevented? Suck my dick and chortle my swinging, pendulous nuts.	1642792756.0	htmy07v	t3_s9by4g	t1_htmcl2a	/r/offmychest/comments/s9by4g/im_sick_and_tired_of_the_antimask_and_antivaxx/htmy07v/
3n1i491n	Everyone is different it seems. Like I said, I got it multiple times. Sure I had a fever but that was about it.	1642792777.0	htmy28r	t3_s9gzx4	t1_htmxxq7	/r/offmychest/comments/s9gzx4/my_dad_got_fired_for_not_getting_the_vaccine/htmy28r/
3n1i491n	Literally don’t care about you or your opinion. Do something in life	1642793134.0	htmz1or	t3_s9gzx4	t1_htmyr2u	/r/offmychest/comments/s9gzx4/my_dad_got_fired_for_not_getting_the_vaccine/htmz1or/
3n1i491n	What are you talking about 😂 You don’t know anything about me but here you are calling me unintelligent. I guess college without debt is stupid, or not having any bills but my car bill is stupid.	1642793663.0	htn0i35	t3_s9gzx4	t1_htmzz8a	/r/offmychest/comments/s9gzx4/my_dad_got_fired_for_not_getting_the_vaccine/htn0i35/
dt1yjl51	cry about it lol	1642793786.0	htn0ugl	t3_s9hh1c	t1_htmwmdp	/r/offmychest/comments/s9hh1c/women_with_small_breasts_are_invisible/htn0ugl/
apkiruyy	As a half black half white woman, I’m honestly taken aback by this post. I’m surprised your race is such a big factor in your negative perception of your own attractiveness. I hope you can learn to appreciate yourself and to decouple the idea than mono-racial whiteness is more attractive than biracial blackness.   I don’t know where that starts for you but I hope you get there ❤️	1642793821.0	htn0xt8	t3_s9c18f	t3_s9c18f	/r/offmychest/comments/s9c18f/im_divorcing_my_husband_because_im_dark_and_ugly/htn0xt8/
3n1i491n	For me personally, It wasn’t worth it. I already got it multiple times so why would I get vaccinated lmao	1642793976.0	htn1db3	t3_s9gzx4	t1_htn197w	/r/offmychest/comments/s9gzx4/my_dad_got_fired_for_not_getting_the_vaccine/htn1db3/
10rtib	I relate to the issues that you have with your father (which are really just his own issues that he needs to sort out). When I was 0-4, I was in a similar family dynamic to yours. My father is a violent alcoholic loser and I still remember what he subject my mum to. We got away, but unfortunately my mother got into another relationship with an even worse man 10 years later as well. I remember having the same fear that you mention when you think about having to move in with your mum and her new bf. The change when we moved in with my step-dad was absolutely terrifying because what if he turned out to be the same as my dad? In my case it turned out that he was even worse than my father, but you have to try to remember that there are so many more men that do turn out to be great father figures. The lack of trust towards guys kinda stays with me today, although I'm getting better at managing it. Hopefully you will be able to as well.  In regards to navigating your trauma alone and feeling fucked up, I want you to know that NOBODY is naturally equipped to handle these things alone. It's the situation, it isn't you. I know this doesn't fix your situation but I want you to know how much I respect you for sharing it. If you'd like to talk about anything, I'm open to that. I wish you the best and I hope you and your mum stay safe.	1642794627.0	htn36jj	t3_s9irco	t3_s9irco	/r/offmychest/comments/s9irco/i_have_to_move_in_with_my_mom_and_her_bf_to_get/htn36jj/
i9bqdtsc	Why would you call him out? Does it give you so much pleasure to kink shame? A piece of underwear hardly costs anything...	1642794820.0	htn3q09	t3_s99rjw	t3_s99rjw	/r/offmychest/comments/s99rjw/i_saw_someone_stealing_a_used_underwear_at_the_gym/htn3q09/
3ga6iow	That’s so hot. I’ll have to find me a woman like that one of these days. 🙈	1642795043.0	htn4cbd	t3_s9f844	t3_s9f844	/r/offmychest/comments/s9f844/i_love_my_husbands_phobia/htn4cbd/
1c2r3pa5	When you grow older you’ll realize what you stand for is more important than money.	1642795057.0	htn4dqh	t3_s9gzx4	t3_s9gzx4	/r/offmychest/comments/s9gzx4/my_dad_got_fired_for_not_getting_the_vaccine/htn4dqh/
avz2zs8i	Conspiracy theorists have been right too many times to not question the validity of what is being told to us. I refuse the vaccine as well. Natural immunity is better than the vaccine. That's a fact. If he had it before, he's more likely to have adverse effects from getting the vaccine than someone who didn't.  Its honeslty infuriating that they're trying to mandate the vaccine for everyone. One size does not fit all. Isnt that against the Geneva convention?	1642795397.0	htn5bfr	t3_s9gzx4	t3_s9gzx4	/r/offmychest/comments/s9gzx4/my_dad_got_fired_for_not_getting_the_vaccine/htn5bfr/
1x4auhn9	Oh yeah, because continuing to spread the virus and thinking some imagined "natural immunity" is better and then ending up with a massive bill for ventilators, oxygen machines, expensive medicine, horse dewormers etc, which is waaaaay more expensive than a fucking vaccine is not making the rich pharma bros richer 🤣🤣 seriously, this is the least logical argument ever	1642795468.0	htn5ibc	t3_s9by4g	t1_htmwugc	/r/offmychest/comments/s9by4g/im_sick_and_tired_of_the_antimask_and_antivaxx/htn5ibc/
avz2zs8i	Talking about his age, too, since he's older, My grandpa passed from Covid and he had both recommended doses at the time. Lots of people who got the vaccine still ended up contracting the virus. They just tell you to go get more vaccine? The only point of it I'm seeing is to make the rich pharma bros richer. You're all being shown fear porn all the time about it, but the more scary thing will be to think, about the technology that can go into an injection... We can genetically modify things, Play God. Who plays God better than the rich elite who control our government?	1642795792.0	htn6dqo	t3_s9gzx4	t1_htn5bfr	/r/offmychest/comments/s9gzx4/my_dad_got_fired_for_not_getting_the_vaccine/htn6dqo/
avz2zs8i	CUE THE FUCKING DOWNVOTES OH NO SOMEONE DOESNT AGREE THAT EVERY MAN WOMAN AND CHILD SHOULD BE INJECTED OH NOOOOO	1642795910.0	htn6p84	t3_s9gzx4	t1_htn6dqo	/r/offmychest/comments/s9gzx4/my_dad_got_fired_for_not_getting_the_vaccine/htn6p84/
avz2zs8i	YOU GUYS ARE FUCKING STUPID	1642795937.0	htn6rvd	t3_s9gzx4	t1_htn6p84	/r/offmychest/comments/s9gzx4/my_dad_got_fired_for_not_getting_the_vaccine/htn6rvd/
avz2zs8i	Hey smart smarty, did you know that if you had Covid and beat it, that you now have built in natural immunity to it? Thats what natural immunity is. That means I don't need your vaccine.	1642796076.0	htn75hd	t3_s9by4g	t1_htn5ibc	/r/offmychest/comments/s9by4g/im_sick_and_tired_of_the_antimask_and_antivaxx/htn75hd/
1c2r3pa5	Self hate is terrible. I pray that you get out of the self hate mindset soon.	1642796437.0	htn859z	t3_s9c18f	t3_s9c18f	/r/offmychest/comments/s9c18f/im_divorcing_my_husband_because_im_dark_and_ugly/htn859z/
e3gngj4k	I hate to say it, but krispy creme donuts are nasty. They feel like the cheapest of donuts, pure sugar.	1642797294.0	htnajdr	t3_s8ndv8	t3_s8ndv8	/r/offmychest/comments/s8ndv8/i_bought_donuts_for_everybody_at_work_and_im_the/htnajdr/
a5cn0t6c	Girl delete this…	1642797438.0	htnaxu8	t3_s9c18f	t3_s9c18f	/r/offmychest/comments/s9c18f/im_divorcing_my_husband_because_im_dark_and_ugly/htnaxu8/
duql0z2l	Yeah that's super selfish. I have friends that are definitely against the vaccine and he has a government job too. The vaccine is required. My friend (his wife) was pissed when he decided he would get it to keep his job. He still hates it and hates that he had to get it. But he made the choice with his family and their future in mind. My friend sees that he made the choice for her and their kids.  It sucks that people are having to be forced into this. It really should be a choice and no one should have to decide to put something they don't trust into their body against their will basically. But here we are and some people have tough decisions.  I am for taking the vaccine if people want it but against the mandatory mandates for taking the vaccine.  I'm pro choice and everyone should have a right to their own body.  Sodenote: It's amazing to see the same people saying women should not have the right to their own body are the same people saying they should have rights to their own body against the masks and vaccine mandates. Hypocrisy at its finest.	1642797958.0	htnce43	t3_s9gzx4	t1_htn37x9	/r/offmychest/comments/s9gzx4/my_dad_got_fired_for_not_getting_the_vaccine/htnce43/
ylanq	My parter’s assistant was fired by corporate for getting vaxxed. She then turned around and asked partner for a recommendation letter. Um…you just left the job and left partner hanging…	1642799058.0	htnfgtz	t3_s9gzx4	t1_htn26i9	/r/offmychest/comments/s9gzx4/my_dad_got_fired_for_not_getting_the_vaccine/htnfgtz/
190nacih	And he absolutely deserves to loose his job.	1642799083.0	htnfjbt	t3_s9gzx4	t3_s9gzx4	/r/offmychest/comments/s9gzx4/my_dad_got_fired_for_not_getting_the_vaccine/htnfjbt/
