author	body	created_at	c_id	s_id	p_id	permalink
fkvj20ie	Working in customer service doesn’t really afford me that privilege	1642799320.0	htng7ew	t3_s9jbv7	t1_htn5usb	/r/offmychest/comments/s9jbv7/ive_turned_into_such_a_misanthrope_these_last_two/htng7ew/
duql0z2l	It's so wrong for requirements to be vaccinated or weekly tests. My job is doing that too. So they are only testing the unvaccinated. The vaccinated can have it and bring it into the office to have it spread around. Yet the unvaccinated are being blamed for it.  They are being tested to enter the office! How can they be the spreaders? It's ridiculous honestly.	1642799562.0	htngvua	t3_s9gzx4	t1_htn88wm	/r/offmychest/comments/s9gzx4/my_dad_got_fired_for_not_getting_the_vaccine/htngvua/
3t0xg5oy	Sorry dude. Wish I had an answer. It takes extreme patience as some of our family members and other community members double down deeper into that toxic ideology. And it's all spread by wealthy corporate donor and pundit class who are all vaccinated. Makes me sick and angry. It's taken a toll on all of us. I hope dad comes around.	1642800211.0	htniog7	t3_s9gzx4	t3_s9gzx4	/r/offmychest/comments/s9gzx4/my_dad_got_fired_for_not_getting_the_vaccine/htniog7/
58c9gafc	I think the only way we really get through it is by trusting in the governments are doing the right thing by giving us vaccines. Unfortunately the trust isn’t there by everyone which can be frustrating. While I do totally agree it should be a choice I do think they need to know the outcomes of that choice. We can’t live in a society where covid is such a killer virus. By lessening the effects it can be tolerable and we can carry on living as normal. The problem here is the way a lot of people have see it. The “not being entitled to the same as the vaccinated” or not being allowed in because of a mask. People who don’t want to get the vaccine should be thankful that others are to keep them safe. There’s lockdowns in some countries for unvaccinated people. There’s a divide happening I do agree but you do have to see sometimes it’s self inflicted. If you don’t want to be let go from a job because it requires a vaccine it’s up to you to find one that doesn’t. I wouldn’t be going to a doctor that didn’t believe in washing their hands for instance.	1642800313.0	htniyqa	t3_s9gzx4	t1_htnhfup	/r/offmychest/comments/s9gzx4/my_dad_got_fired_for_not_getting_the_vaccine/htniyqa/
wc3eh	Immunocompromised here and it most certainly makes a difference.  It doesn’t protect me from not getting it but it helps lower the severity.  I was in the hospital with Covid and had zero symptoms which mt doctors were thankful for because of being vaxed and boosted.	1642800475.0	htnjf31	t3_s9gzx4	t1_htnekvs	/r/offmychest/comments/s9gzx4/my_dad_got_fired_for_not_getting_the_vaccine/htnjf31/
duql0z2l	Yep that's what I was seeing. Especially when Texas came out with their ruling. I called out a lot of people that I saw posting pro life/ anti abortion stuff a year prior. Then posting pro choice in regards to the mask mandates. The vaccine wasn't even a thing yet.  When Texas came out with their abortion law I asked them how can you support what Texas is doing but you were just posting my body my choice and saying the government should not control a person's body and what we do with it. IE not wearing masks and not taking the vaccine. One person did tell me they had changed their views on abortion becausethey did not belongthe vaccine should be forced.   People can be pro life and still support another person's right to have an abortion. But to completely say these are not comparable like others have said. It's the bottom line of "if you don't want the government making choices about what you do with your own body, it has to be overall not just to fit your agenda".	1642800857.0	htnkhd0	t3_s9gzx4	t1_htniiyr	/r/offmychest/comments/s9gzx4/my_dad_got_fired_for_not_getting_the_vaccine/htnkhd0/
duql0z2l	THIS IS FALSE. It has not stopped the spread. Most out breaks I have heard about were amongst the vaccinated spreading it to the vaccinated. There is an issue. This false information that the vaccinated are exempt from getting it and spreading it. They can get it just like an unvaccinated person and they can spread it just like an unvaccinated person.  The only thing they have found is that they spread it for shorter period of time but that doesn't stop the spread of they are seeing people and going into large gatherings without testing.	1642801080.0	htnl3z7	t3_s9gzx4	t1_htnjiy3	/r/offmychest/comments/s9gzx4/my_dad_got_fired_for_not_getting_the_vaccine/htnl3z7/
r9mp07m	I am unvaccinated and don’t mask just straight up cause I don’t think the virus will do anything to me and I don’t have any family that would be too affected by it either. Parents are vaccinated anyway.	1642802241.0	htnob8a	t3_s9by4g	t1_htmvifv	/r/offmychest/comments/s9by4g/im_sick_and_tired_of_the_antimask_and_antivaxx/htnob8a/
duql0z2l	What's the link, I would be interested in reading it?   I was just stating about people around me and my job. All my vaccinated friends have been getting it. They get it from another vaccinated person. Or they spread it to another vaccinated person.  At my job also the spread is amongst the vaccinated.   The reason being is that the vaccinated can go anywhere and just show their card or proof of vaccine and never be tested. So a lot of vaccinated people are just meeting up having basically covid parties.  But it's okay because they are vaccinated! Right?	1642802327.0	htnojtc	t3_s9gzx4	t1_htnnkns	/r/offmychest/comments/s9gzx4/my_dad_got_fired_for_not_getting_the_vaccine/htnojtc/
r9mp07m	I am unvaccinated and only make when required. I don’t think covid is a hoax I just straight up don’t think the virus will severely affect me. The only people in my family that could be hit hard by covid are vaccinated too.	1642802970.0	htnqa75	t3_s9by4g	t3_s9by4g	/r/offmychest/comments/s9by4g/im_sick_and_tired_of_the_antimask_and_antivaxx/htnqa75/
duql0z2l	More of forced to choose between the vaccine or his job and he did choose to take the vaccine. For a person to be forced into that position to have to make that choice is a hard decision. You think it's the right choice. Others believe it's the wrong choice.	1642804395.0	htnu3n4	t3_s9gzx4	t1_htntewk	/r/offmychest/comments/s9gzx4/my_dad_got_fired_for_not_getting_the_vaccine/htnu3n4/
il9hwlzp	Thank you	1642804575.0	htnukpb	t3_s9mv95	t1_htnu22y	/r/offmychest/comments/s9mv95/i_suspect_my_mom_has_always_suffered_from_ocd_but/htnukpb/
bzqmxndq	“ when you assume, you make an ass out of yourself not me. “	1642804826.0	htnv8uv	t3_s9mb8f	t3_s9mb8f	/r/offmychest/comments/s9mb8f/just_because_a_person_is_sitting_alone_doesnt/htnv8uv/
4vjwu1jd	I work at an ice skating rink and parents let their kids curb stop vending/arcade machines while wearing skates. Straight up fucking gremlins.	1642805249.0	htnwday	t3_s9n36j	t3_s9n36j	/r/offmychest/comments/s9n36j/walked_out_of_my_crap_job_today_due_to_an_out_of/htnwday/
ba7bab8o	What if you get the poison shot and still get covid. It happened before.	1642805628.0	htnxdld	t3_s9gzx4	t1_htnx1e9	/r/offmychest/comments/s9gzx4/my_dad_got_fired_for_not_getting_the_vaccine/htnxdld/
ba7bab8o	He's brainless? He is? He's brainless? Really?	1642805692.0	htnxjmy	t3_s9gzx4	t1_htnw3xv	/r/offmychest/comments/s9gzx4/my_dad_got_fired_for_not_getting_the_vaccine/htnxjmy/
ba7bab8o	A nonsense conspiracy? Wow this website is so far left you might fall if the chart. That's it km deleting this.	1642805827.0	htnxw77	t3_s9gzx4	t1_htnsvv1	/r/offmychest/comments/s9gzx4/my_dad_got_fired_for_not_getting_the_vaccine/htnxw77/
214meu31	I still feel your age.  My mind is still 20-something, I swear to god.  But fuck, my face, skin, bones, etc. remind me every day that I was born in the '60s.  Thanks for your note, I appreciate you reading my crap and caring!  Enjoy your youth, young one!  That's an order.	1642805868.0	htny01x	t3_s9n8w8	t1_htnxefc	/r/offmychest/comments/s9n8w8/i_hate_getting_old_and_i_dont_intend_on_getting/htny01x/
214meu31	I'm grateful to still be alive, I really am, and grateful not to be fighting MS or cancer or any of the million other awful diseases a lot of women my age face.  But today is a "glass half empty" kind of day.   :/	1642805928.0	htny5oi	t3_s9n8w8	t1_htnx9bs	/r/offmychest/comments/s9n8w8/i_hate_getting_old_and_i_dont_intend_on_getting/htny5oi/
7wmlf0hy	Two of you are pieces of shit and I hope you live miserable lives. Get fucked:	1642806908.0	hto0osu	t3_s9f1d7	t3_s9f1d7	/r/offmychest/comments/s9f1d7/it_hurts_knowing_my_mental_health_stops_me_from/hto0osu/
5hzm4shr	I just needed to rant! I absolutely despise of these moments but I know they too shall pass	1642806945.0	hto0s74	t3_s9nupp	t3_s9nupp	/r/offmychest/comments/s9nupp/i_hate_days_like_these/hto0s74/
9hzodwu3	Might as well end your life then, because if you plan on living your life being THAT insecure well might as well end your suffering asap	1642807861.0	hto34hk	t3_s9c18f	t3_s9c18f	/r/offmychest/comments/s9c18f/im_divorcing_my_husband_because_im_dark_and_ugly/hto34hk/
50baj197	I already did. Hence the post on this specific sub.	1642808084.0	hto3oyw	t3_s9n67f	t1_htnzv5x	/r/offmychest/comments/s9n67f/liver_king_is_a_shithead_steroid_abusing_grifter/hto3oyw/
2q3h622q	Calm down he was in the moment don't think it was rape he just forced something on you haven't done before. Sorry he didn't ask before he did it so I guess its rape	1642810051.0	hto8lcw	t3_s9k8oi	t3_s9k8oi	/r/offmychest/comments/s9k8oi/was_i_raped_30f/hto8lcw/
z20r9h7	some kind words of support,  everybody is dealing with something,  the others aren’t more lucky,  they may just be dealing with something different,  and self love comes from within,  insults only hurt if you let them,  i have seen cis guys complaining that they are boring and they have nothing soecial going on in their lives to differentiate them from others, and even jealous of the attention that LGBT may get.	1642810419.0	hto9hn6	t3_s9oyo9	t3_s9oyo9	/r/offmychest/comments/s9oyo9/sucide_mention_wish_cis_guys_guys_born_as_guys/hto9hn6/
c4r98udp	Why don’t you try and tell us when the feds pick you up in 3… 2…	1642810537.0	hto9ryq	t3_s9p2mg	t3_s9p2mg	/r/offmychest/comments/s9p2mg/curious/hto9ryq/
7hcvh	Why don’t you just delete social media? That’s the cause, so remove it and you’ll be happier for it.	1642811284.0	htobmjz	t3_s9c18f	t3_s9c18f	/r/offmychest/comments/s9c18f/im_divorcing_my_husband_because_im_dark_and_ugly/htobmjz/
10qqst	I've only ever seen anti-vaxxers use the term 'pro-vaxxer'.	1642811411.0	htobxqp	t3_s9gzx4	t1_hto20lw	/r/offmychest/comments/s9gzx4/my_dad_got_fired_for_not_getting_the_vaccine/htobxqp/
a52lbuo8	Oh yeah. I’ve had some pretty rough interactions with people but it’s something you get use to while being black in the U.S.   The other employee who brought the other conversation to my attention all he has said is he’ll have my back whenever I say something to HR. I just want to dip first and then say something. I’ve already faced and seen the sort of repercussions that happen if you complain to HR in this job.	1642813048.0	htofx0t	t3_s9oenv	t3_s9oenv	/r/offmychest/comments/s9oenv/my_boss_used_a_racial_slur_and_now_i_hate_coming/htofx0t/
36humad	What does skin colour have got to do with anything? There are are attractive people of all colors - mixed color maybe even more so!	1642813978.0	htoi65p	t3_s9c18f	t3_s9c18f	/r/offmychest/comments/s9c18f/im_divorcing_my_husband_because_im_dark_and_ugly/htoi65p/
ieznpwxl	that's very privileged of you to call these hard times, may i remind you we're a first world country. So the problems you're referring to are first world problems. There's loads of people that would take what we have over what they have. But if this is the best we can do, that's pretty sad. That being said, i have to assume you calling me stupid is you projecting.	1642814586.0	htojn2p	t3_s9q6sh	t1_htoim3y	/r/offmychest/comments/s9q6sh/us_needs_hard_times/htojn2p/
50baj197	No I got what you were saying. I just thought it was dumb 😕	1642815022.0	htokopn	t3_s9n67f	t1_hto3tdy	/r/offmychest/comments/s9n67f/liver_king_is_a_shithead_steroid_abusing_grifter/htokopn/
ieznpwxl	You must be one of the one's with your head stuck up your ass, that's why you're offended. I bet you go out and vote every presidency, thinking the rich prick you vote for has your best interests in mind. Most of these people are rich from shitting on us, and y'all want to make them our president. Watch Donald Trump's net worth, I bet he set himself up real good for the years to come.	1642815150.0	htokzje	t3_s9q6sh	t1_htoim3y	/r/offmychest/comments/s9q6sh/us_needs_hard_times/htokzje/
9u0ogv2m	A clear act and combination of betrayal manipulation and disregard for you and your feelings. It's disrespectful in the exact same way that she would find it if she wanted to do something with you only for her to find out that you did it with someone else after telling her no then telling someone else yes.	1642815544.0	htolwxf	t3_s9qqud	t3_s9qqud	/r/offmychest/comments/s9qqud/i_feel_upset/htolwxf/
c6xxaa8f	ok	1642816648.0	htoojks	t3_s9c18f	t3_s9c18f	/r/offmychest/comments/s9c18f/im_divorcing_my_husband_because_im_dark_and_ugly/htoojks/
b1rfie19	Thank you :)	1642817901.0	htorhsd	t3_s9kvq2	t1_htnfz95	/r/offmychest/comments/s9kvq2/i_feel_like_im_so_behind_in_life_due_to_my_social/htorhsd/
5gxt66jd	I think you need to go to a different doctor. I’d suggest an endocrinologist	1642817949.0	htorlvf	t3_s9rg3b	t3_s9rg3b	/r/offmychest/comments/s9rg3b/i_did_what_no_man_should_have_done/htorlvf/
b1rfie19	I'm proud of you too ❤️	1642817964.0	htorn62	t3_s9kvq2	t1_htnn5sv	/r/offmychest/comments/s9kvq2/i_feel_like_im_so_behind_in_life_due_to_my_social/htorn62/
es0aa	You know a lot of immunocompromised can't get vaccines...that's why we need the rest of the population to vaccinate to help protect us. ESPECIALLY medical personal and first responders.	1642818516.0	htosy8s	t3_s9gzx4	t1_htonam4	/r/offmychest/comments/s9gzx4/my_dad_got_fired_for_not_getting_the_vaccine/htosy8s/
2q3h622q	Sorry I am not okay with it but he didn't ask her because he was in the moment too much	1642818636.0	htot8oc	t3_s9k8oi	t1_htoplj6	/r/offmychest/comments/s9k8oi/was_i_raped_30f/htot8oc/
ieznpwxl	I'm still mad at him too, if i ever see him i'll smack the bullshit out of him. I have a problem with the people that inhabit this place, including him. How can someone be so worried about other shit to forget their son? Maybe that person shouldn't have been so worried about getting laid. The fatherless children rate is at an all-time high. And the mom's are just as much to blame, for picking a POS father for their child. Maybe they shouldn't have been so worried about getting laid too. This all comes back to having too much downtime. I don't understand why people are so blind, and have been so blind for so long. Multiple generations of people with their head in their ass, that's how we got where we are today. This country has been dog shit since it started, but the first president at least fought for what he believed in.	1642819249.0	htoup0x	t3_s9q6sh	t1_htoo7sp	/r/offmychest/comments/s9q6sh/us_needs_hard_times/htoup0x/
51qoueyt	you need a motivation board, pictures of a goal body or weight or whatever to serve as motivators. when we don’t have a solid vision or goal, we become undisciplined and forget why we started. get up and go burn some calories u got this	1642819569.0	htovgcw	t3_s9s35f	t3_s9s35f	/r/offmychest/comments/s9s35f/tonight_is_one_of_those_nights_i_really_need_to/htovgcw/
7qlle485	If I used that as motivation I would’ve quit years ago.  The reason I do my workouts now is because I couldn’t imagine what my life would look like without them- they’re ingrained in my daily routine. Sure those things are nice to have but they’re not what I’m after when exercising.	1642819584.0	htovhmm	t3_s9s35f	t3_s9s35f	/r/offmychest/comments/s9s35f/tonight_is_one_of_those_nights_i_really_need_to/htovhmm/
5groy9qa	 I also found a dead body in Philly when I was in college, who ALSO died with his eyes open. He had come into the vestibule of the dorm sometime either late at night or very early morning (I found him around 7:00a.m.) and passed away while leaning against a wall. I told the security guard inside the actual building, and he put his jacket over his head until people could get there. I will never forget it, and it’s been more than 10 years.	1642819699.0	htovrba	t3_s9rynw	t3_s9rynw	/r/offmychest/comments/s9rynw/i_saw_a_potentially_dead_guy_at_a_train_station_a/htovrba/
e4ftve6y	Haven’t seen a doctor, I don’t even know how I’d go about doing that. I don’t have a family doctor or anything and came from a shitty home who never took me to the doctors, I have no idea how any of that stuff works. I read online though that the treatments are ineffective, I feel like it’s just easier to end things	1642820133.0	htowsf9	t3_s9s40d	t1_htovv7v	/r/offmychest/comments/s9s40d/i_have_peyronies_disease_and_i_never_even_got_to/htowsf9/
ieznpwxl	I hate how normal it is for people here to put out so easy, wtf do you know about someone after 1 or 2 dates? I'm not sticking my dick in a woman with 10+ people she fucked, if she couldn't find one to stick with before 10+ she wasn't looking for a good one, she was looking for a fuck, and some of them probably just turned into temporarily more frequent fucks. You will not find my dick in there.	1642820390.0	htoxeau	t3_s9q6sh	t1_htoo7sp	/r/offmychest/comments/s9q6sh/us_needs_hard_times/htoxeau/
e4ftve6y	Yeah. Thanks.	1642820494.0	htoxn8u	t3_s9s40d	t1_htoxa6d	/r/offmychest/comments/s9s40d/i_have_peyronies_disease_and_i_never_even_got_to/htoxn8u/
51qoueyt	endocrinologist won’t do anything. you need to see a neurologist (deal with nerves can do sensation tests) or maybe a different urologist. sounds like you have friction burns that damaged the skin	1642820535.0	htoxqs5	t3_s9rg3b	t3_s9rg3b	/r/offmychest/comments/s9rg3b/i_did_what_no_man_should_have_done/htoxqs5/
51qoueyt	have you considered PA school?	1642821099.0	htoz2g7	t3_s9sjq1	t3_s9sjq1	/r/offmychest/comments/s9sjq1/need_to_give_up_on_my_childhood_dream_how_do_i/htoz2g7/
hh71s2al	Wow you’re disgusting.	1642821459.0	htozwmw	t3_rd0z0j	t1_hnz66mr	/r/offmychest/comments/rd0z0j/i_am_a_sad_bitter_and_angry_human_being_and_i/htozwmw/
bkgs7604	There has just been so many things I could go on about I hate how I feel but I can’t help being in love with him.	1642821634.0	htp0bgl	t3_s9sqyy	t3_s9sqyy	/r/offmychest/comments/s9sqyy/i_dont_know_what_i_feel/htp0bgl/
desume7o	I feel the same about a friend of mine right now. He's so "Q"razy that he's willing to lose his job if they make it mandatory.	1642822651.0	htp2mcf	t3_s9gzx4	t3_s9gzx4	/r/offmychest/comments/s9gzx4/my_dad_got_fired_for_not_getting_the_vaccine/htp2mcf/
319nnhr2	Im so sorry… if you really believe they are going to harm you then please run away. Get as far away as possible from them	1642823252.0	htp3zjd	t3_s9sy4v	t3_s9sy4v	/r/offmychest/comments/s9sy4v/i_got_outed_to_my_muslim_parents_and_im_scared/htp3zjd/
c4fxufwn	Can we please have some sympathy for this man?  Your attitude is exactly what's creating the division that is responsible for 40% of our population being unvaccinated.  This guy was suddenly told in the past year by heavily biased scientists to take a vaccine known to cause allergic reactions and myocardititis or whatever it's called, that hasn't until recently been FDA approved, etc.  Yes, scientists are biased, I am one.  Maybe not as biased as individuals or the news but peer review is far from the perfect filter people hold it up to be.    Yes, he should get the vaccine.  But for God's sakes, have some respect for the fact that this guy is scared and angry.  Stop calling him an idiot.  People like you are the reason for COVID being as bad as it is.  If you'd approach vaccine hesitant people with understanding we'd have a lot fewer of them.  I am a scientist and have been triple vaccinated.  I also have a severe nut allergy and was extremely hesitant.  Luckily my friends and family aren't like you.	1642823919.0	htp5ia2	t3_s9gzx4	t3_s9gzx4	/r/offmychest/comments/s9gzx4/my_dad_got_fired_for_not_getting_the_vaccine/htp5ia2/
dg2lqces	He’s absolutely incapable of doing anything himself and he wonders why I’m so burnt out.	1642824500.0	htp6rm2	t3_s9ta4p	t1_htp6onx	/r/offmychest/comments/s9ta4p/my_husband_put_my_elderly_father_at_risk_tonight/htp6rm2/
gh0oya8	Not sure if you guys are hearing yourselves but are we stuck in 1940s Germany? Whether you believe in the vaccines or not, under no circumstances should people be losing their jobs, especially at 63, for making their own individual choice not to have a vaccine. There’s people in this thread actually glad he lost his job? What the fuck has happened to the world	1642824518.0	htp6t1l	t3_s9gzx4	t1_htn50l1	/r/offmychest/comments/s9gzx4/my_dad_got_fired_for_not_getting_the_vaccine/htp6t1l/
b3lt2zmf	Usually, when you harbor hatred against a certain group—especially a marginalized group—it speaks more to your own personal problems than it does about the group of people that literally have nothing to do with you or your life.	1642824612.0	htp70d1	t3_s9th1r	t1_htp6ouv	/r/offmychest/comments/s9th1r/im_not_a_fan_of_sex_workers/htp70d1/
cfo5wnze	Exactly !! That’s what I thought as well. He must be the same person but only found different ways to mask it.. I don’t know how to proceed I’m in too deep 😓😓	1642825817.0	htp9ije	t3_s9rcs8	t1_htp425u	/r/offmychest/comments/s9rcs8/i_cant_stop_thinking_about_it/htp9ije/
ivr6tu9n	Thank you for reply! I'm trying not to beat myself up about it because I know depression isn't an easy thing but damn it's hard. I was able to talk to my primary doctor and she's going to message the new psychiatrist and the old one to see if they can do anything before I see the new psychiatrist. Just hate that the medicine stopped working because it was doing such a good job.	1642826682.0	htpb9qd	t3_s9tgka	t1_htp9awu	/r/offmychest/comments/s9tgka/slipping_back_into_the_claws_of_depression/htpb9qd/
9j5uw8o7	God. As a sex worker I have so much to say about people like you. But Instead I'm just gonna go back to work, I have to pay rent.	1642827225.0	htpcca4	t3_s9th1r	t3_s9th1r	/r/offmychest/comments/s9th1r/im_not_a_fan_of_sex_workers/htpcca4/
g0q4g	Agreed	1642827249.0	htpcdzw	t3_s9ubxm	t1_htpbz13	/r/offmychest/comments/s9ubxm/i_cheated/htpcdzw/
3v8mz1z4	This is 100% a troll	1642827444.0	htpcrpj	t3_s9c18f	t3_s9c18f	/r/offmychest/comments/s9c18f/im_divorcing_my_husband_because_im_dark_and_ugly/htpcrpj/
8z1fn1eb	I’m white and think black women are hotter for plenty of reasons. I believe you will find someone. That guys a dumbass	1642827713.0	htpdafi	t3_s9c18f	t3_s9c18f	/r/offmychest/comments/s9c18f/im_divorcing_my_husband_because_im_dark_and_ugly/htpdafi/
c4fxufwn	If you have to ask, the answer is no.	1642829072.0	htpfwvn	t3_s9k8oi	t3_s9k8oi	/r/offmychest/comments/s9k8oi/was_i_raped_30f/htpfwvn/
gh0oya8	Get back behind your couch with your 3 vaccines and paper masks	1642830723.0	htpj15y	t3_s9gzx4	t1_htp9t44	/r/offmychest/comments/s9gzx4/my_dad_got_fired_for_not_getting_the_vaccine/htpj15y/
cfo5wnze	Yeah I’m in l.a. I told him the same thing about stealthing .   I feel like I fucked Up 1000% after he confessed because only a crazy person would make a lifelong decision like that on a whim and unfortunately it’s my childrens father. I’ve been struggling with the thought of divorce or still raising our children as a family unit but risk the children picking up his behaviors.  I feel like it’s a double edged sword.	1642831266.0	htpjzyo	t3_s9rcs8	t1_htphkyo	/r/offmychest/comments/s9rcs8/i_cant_stop_thinking_about_it/htpjzyo/
iw6jikig	it’s my mindset because it’s been done to me. It’s like if someone beat you up, you’re gonna want to do it back. I’m not a bad person because I want to go out and flirt guys and have a good time because my boyfriend has done it too. However it’s clearly not a good relationship if that’s what’s going on so I will have to do some thinking	1642833297.0	htpnh4y	t3_s9w0pw	t1_htpmsvo	/r/offmychest/comments/s9w0pw/i_want_to_cheat_on_my_bf_because_he_cheated_on_me/htpnh4y/
ei3nioiy	You can still turn your life around don’t worry	1642833670.0	htpo3oi	t3_s9uri0	t3_s9uri0	/r/offmychest/comments/s9uri0/my_birthday/htpo3oi/
3x0nsgq5	Good news, in regards to being tired of antivaxxers!  …	1642833695.0	htpo579	t3_s9by4g	t3_s9by4g	/r/offmychest/comments/s9by4g/im_sick_and_tired_of_the_antimask_and_antivaxx/htpo579/
aqrwo47s	I don't care.. Move on.	1642834358.0	htpp88i	t3_s9gzx4	t3_s9gzx4	/r/offmychest/comments/s9gzx4/my_dad_got_fired_for_not_getting_the_vaccine/htpp88i/
iw6jikig	Everyone flirts when they’re in relationships? This is why seemingly every guy cheats, they think it’s okay cuz it’s not sex. It’s basic respect not to catch up with some girl you used to have sex with and feelings for. He was on tinder and asking girls for nudes at the ripe age of 23 yet I’m the bad guy for wanting to do it back lol. No personality disorder here, just me being fed up wanting to hurt him like he hurt me, but not wanting to end the relationship because of how attached I am. I “well you should’ve broken up with him at that time when he was doing it” I thought I could get past it.	1642834475.0	htppeyv	t3_s9w0pw	t1_htpomhs	/r/offmychest/comments/s9w0pw/i_want_to_cheat_on_my_bf_because_he_cheated_on_me/htppeyv/
ca8nx2ey	Weak minded individual	1642834735.0	htpptpt	t3_s9c18f	t3_s9c18f	/r/offmychest/comments/s9c18f/im_divorcing_my_husband_because_im_dark_and_ugly/htpptpt/
13za5e	Fallout	1642834854.0	htpq0kq	t3_s9w6nt	t3_s9w6nt	/r/offmychest/comments/s9w6nt/we_are_doomed/htpq0kq/
