author	body	created_at	c_id	s_id	p_id	permalink
iv0xwbd5	My stepmom doesn't love me. She yells at me all the time and favors her own kid and my brother.	1642750233.0	htkla6i	t3_s9500l	t1_htkl64u	/r/AmItheAsshole/comments/s9500l/aita_for_adjusting_my_stepmoms_zoom/htkla6i/
35waolhj	The whole situation is messed up but I can see how the biological child feels that way.	1642750434.0	htklkhz	t3_s8m0dm	t1_htkkybq	/r/AmItheAsshole/comments/s8m0dm/aita_for_saying_our_oldest_biological_child/htklkhz/
cbkd7yrl	So science is the only factor they’re judging? K	1642750498.0	htklnns	t3_s8z12x	t1_htkjby4	/r/AmItheAsshole/comments/s8z12x/aita_for_being_honest_about_why_i_would_not_vote/htklnns/
8yqmntk7	YYA because the kids should be making it up to you and not the parents. What does $200 worth of hard yard child labour look like to you?	1642750758.0	htkm0sx	t3_s8x7nn	t3_s8x7nn	/r/AmItheAsshole/comments/s8x7nn/aita_for_wanting_my_sister_to_pay_me_back_for_the/htkm0sx/
8yqmntk7	NTA I hope that you called him back to hand him the huge red flag that he dropped on the way out.	1642750983.0	htkmc54	t3_s8v16p	t3_s8v16p	/r/AmItheAsshole/comments/s8v16p/aita_for_refusing_to_kick_my_best_friend_out_of/htkmc54/
8yqmntk7	YTA Jeez that escalated quickly. Ask your father for family therapy.	1642751343.0	htkmtw8	t3_s92wts	t3_s92wts	/r/AmItheAsshole/comments/s92wts/aita_for_telling_my_fathers_wife_that_i_didnt/htkmtw8/
ayop6qnd	ALEX	1642751412.0	htkmxc4	t3_s7li5d	t1_htanm9p	/r/AmItheAsshole/comments/s7li5d/aita_for_ignoring_my_friend_at_her_birthday_party/htkmxc4/
ayop6qnd	14	1642751420.0	htkmxqa	t3_s7li5d	t1_htkmxc4	/r/AmItheAsshole/comments/s7li5d/aita_for_ignoring_my_friend_at_her_birthday_party/htkmxqa/
iv0xwbd5	I'm not in her class.	1642751442.0	htkmyu1	t3_s9500l	t1_htkmptc	/r/AmItheAsshole/comments/s9500l/aita_for_adjusting_my_stepmoms_zoom/htkmyu1/
8yqmntk7	NTA and I hesitate to ask this but it has to be addressed… has your wife ever had an “encounter” with her bff? It seems like there is another conversation to be had here.	1642751463.0	htkmzwm	t3_s8tfop	t3_s8tfop	/r/AmItheAsshole/comments/s8tfop/aita_for_kicking_her_out_my_wifes_best_friend/htkmzwm/
88t8soph	NTA, he has no right to speak to you that way and you are not obligated to give him something that you worked hard to save for, and he is not entitled to your binder just because he is trans.	1642751561.0	htkn4ul	t3_s8z4o3	t3_s8z4o3	/r/AmItheAsshole/comments/s8z4o3/aita_for_not_giving_my_poor_trans_friend_my/htkn4ul/
ayop6qnd	No comment pal	1642751717.0	htkncfp	t3_s7li5d	t1_htazyq2	/r/AmItheAsshole/comments/s7li5d/aita_for_ignoring_my_friend_at_her_birthday_party/htkncfp/
68zaj	Holy exaggeration batman, yeah the dude could have communicated a bit bigger but if this is the biggest AH you have seen you have not been here long AT ALL	1642751798.0	htkngdh	t3_s8w3l0	t1_htkbhqv	/r/AmItheAsshole/comments/s8w3l0/aita_for_stopping_cooking_for_my_partner_without/htkngdh/
1kzkqece	I would suggest getting something in writing from her anyway - even if it's an email - to show that she is confirming that you own the cat.   Don't get me wrong, she just doesn't seem like the reliable type who you can trust.	1642755366.0	htks7ax	t3_s8wf3r	t1_htj3r0y	/r/AmItheAsshole/comments/s8wf3r/update_aita_for_stopping_my_roommate_from_being/htks7ax/
h51nj	Your sister is getting support for her and her son. You’re also not responsible for your parents choices. I think you need to consider getting a loan to cover school expenses and giving a origin back if she actually decides to go to school though	1642756079.0	htkt4g7	t3_s9611p	t3_s9611p	/r/AmItheAsshole/comments/s9611p/aita_for_using_my_sisters_college_money/htkt4g7/
8byx368y	I still get the feeling the brother is a big hoe.	1642756887.0	htku5pw	t3_s8ypg1	t3_s8ypg1	/r/AmItheAsshole/comments/s8ypg1/aita_for_being_upset_with_my_brother_for_having/htku5pw/
dqxe28kq	NTA    It is also not the babies faults and they are your siblings, so may I suggest you try and see them as siblings and enjoy being around them at least. You don't have to forgive your Dad and Step-Mum you do need to find some peace, for your own sake.  I've also edited to add, that at your age you should be allowed to choose your custody agreement and have a say at least. You choosing to not stay there shouldn't make any difference to the financial side, ask your Mum to speak to a lawyer.	1642756939.0	htku857	t3_s92wts	t3_s92wts	/r/AmItheAsshole/comments/s92wts/aita_for_telling_my_fathers_wife_that_i_didnt/htku857/
12bcsz	Say that to a rape victim	1642757294.0	htkuoce	t3_s8mtt4	t1_htkukwv	/r/AmItheAsshole/comments/s8mtt4/aita_for_not_drinking_as_much_as_everyone_else_at/htkuoce/
h6guwx23	Crazy. The brother from an ex was so lazy and his gf too, he payed his mom to clean up their house.	1642757679.0	htkv5i6	t3_s96c9o	t1_htkt7fx	/r/AmItheAsshole/comments/s96c9o/aita_for_blowing_up_after_my_partner_said/htkv5i6/
6ydi4z3a	I just seen a post where a mom didn’t like her (23) year old son dating a (33) man and everyone called her homophobic and said she was the asshole.	1642758029.0	htkvl55	t3_s95hyc	t1_htkt5bx	/r/AmItheAsshole/comments/s95hyc/aita_my_35m_girlfriend_20f_said_i_was_ignoring_her/htkvl55/
hf2cdzll	You have a toxic family member, V, who you and other family members are NC with. After V tried to involve your grandma in the drama (pressure her to tell us to talk to him again,…), you explained the situation to grandma and told her very firmly that you didn't want to talk with her about V.  Now, when you ask grandma what did you do this weekend? or did you hear from the family?, and V is involved, she will lower her voice and say: You-Know-Who came to visit, You- Know-Who called...  You find it hilarious and you like the nickname, so you were telling your sister about it when she said you are AITA	1642758101.0	htkvoar	t3_s96xec	t3_s96xec	/r/AmItheAsshole/comments/s96xec/aita_for_not_telling_my_grandma_who_youknowwho_is/htkvoar/
iv56d20a	Can you imagine babysitting kids all day and then going home and babysitting more?	1642760590.0	htkyqd0	t3_s977bn	t1_htkyo99	/r/AmItheAsshole/comments/s977bn/aita_for_asking_my_dad_why_he_lets_strangers_into/htkyqd0/
7bemr2qk	Oof this is hard. Although he sounds like an AH for calling things you like stupid it might hit harder if you do the same for his furniture because these are thing he built from scratch so maybe there’s more sentimental value there? Idk.   Maybe there’s just a better way to tell him that you would prefer if you just buy your furniture? You did say him building everything is going to be expensive.	1642761071.0	htkzble	t3_s97hhh	t3_s97hhh	/r/AmItheAsshole/comments/s97hhh/wibta_if_i_told_my_bf_i_hate_his_diy_furniture/htkzble/
co00793a	YTA However stupid the rule is (and it certainly is stupid) its your parents house so you do have to follow it	1642762439.0	htl12ur	t3_s97yot	t3_s97yot	/r/AmItheAsshole/comments/s97yot/aita_for_sleeping_in_my_bed_with_my_boyfriend/htl12ur/
3mvfeqri	If they want it so badly they can buy it when he puts it up for sale	1642762815.0	htl1kc4	t3_s8xfkv	t1_htj7vrx	/r/AmItheAsshole/comments/s8xfkv/wibta_if_i_sold_my_dads_house/htl1kc4/
ieqvybiu	I’m not sure where you live but I worked in a juvenile court. You are old enough to decide which parent you want to live with and judges will take that into consideration when they issue their custody order. If you want to live with your mom full time (this wasn’t clear from your post), your mom can petition the court to have the custody and child support agreement changed. If you live with your mother full time, your father is legally REQUIRED to pay child support. It’s not optional. Until it’s changed, you need to abide by the agreement because if your mother doesn’t comply, she is legally responsible since you are a minor. It sounds like you’d be better off not staying with them and I know that no one wants to go to court but it might be worth it for your mental health.	1642762923.0	htl1pdd	t3_s92wts	t3_s92wts	/r/AmItheAsshole/comments/s92wts/aita_for_telling_my_fathers_wife_that_i_didnt/htl1pdd/
co00793a	NTA You shouldn't have been caught in the middle of this, she should never have been asking you to put your name on her work	1642763018.0	htl1tz0	t3_s9855s	t3_s9855s	/r/AmItheAsshole/comments/s9855s/aita_for_deciding_to_not_speak_to_my_sister_again/htl1tz0/
ghmcm	NTA it’s great you are having this conversation before marriage and children. Now the next step is what you do with this information. Is there room for compromise, do you believe either side will stick to said compromise when the time comes, or is this a friction point that could be the downfall of your relationship. Better to figure all this out now when the stakes are much lower.	1642763562.0	htl2joq	t3_s96syg	t3_s96syg	/r/AmItheAsshole/comments/s96syg/aita_for_refusing_to_be_a_stay_at_home_mom/htl2joq/
gw2cnmdb	> Everyone has pronouns  Everyone has pronouns in English, I think what this person is driving at is that in certain other languages they do not use gendered pronouns. I've heard that Japanese and Farsi are both examples of this.	1642763697.0	htl2q3y	t3_s8z4o3	t1_htkzqpx	/r/AmItheAsshole/comments/s8z4o3/aita_for_not_giving_my_poor_trans_friend_my/htl2q3y/
7e9rkmdh	YTA you overreacted and is not diner fault if she complimented your husband, the right thing to do is take down the review	1642766132.0	htl66mw	t3_s98s3t	t3_s98s3t	/r/AmItheAsshole/comments/s98s3t/aita_for_leaving_a_bad_review_on_a_diner_and/htl66mw/
dch9r4y6	Yta.massive ungrateful asshole	1642766320.0	htl6gmp	t3_s8ypg1	t3_s8ypg1	/r/AmItheAsshole/comments/s8ypg1/aita_for_being_upset_with_my_brother_for_having/htl6gmp/
i4xafw3	Dude I literally said that is a lot to ask of a 10 year old but she could try and say it now. He thought he was keeping it separate. What he did was wrong but also parents suck at times and he didn’t even know what he did wrong for 5 years so he could try to fix it. The mom should have at least told him when she found out so he could make a change. If he didn’t change after his mistake was pointed out then no contact makes sense.   I grew up with a gaslighting narcissist who I am low contact with now. I get that sometimes parents just suck but as a current teacher I’ve learned that some parents don’t realize that they suck until you tell them exactly what they are doing wrong.   15yr old may not be the asshole but both parents are.	1642766443.0	htl6nfn	t3_s8lsgt	t1_htkrib3	/r/AmItheAsshole/comments/s8lsgt/aita_for_refusing_to_go_to_my_dads_house_on_the/htl6nfn/
hk6izjlj	YTA - there are ways you could have gone about this and they way you have decided to is IMO very wrong. YEs what she said could have been harmful but you reprimanded her on the spot and she apologised, you've then gone out of your way and manipulated the situation to get the girl fired? That is gross.	1642766518.0	htl6ris	t3_s98s3t	t3_s98s3t	/r/AmItheAsshole/comments/s98s3t/aita_for_leaving_a_bad_review_on_a_diner_and/htl6ris/
3xi0k1e8	ESH	1642766632.0	htl6xv8	t3_s92wts	t3_s92wts	/r/AmItheAsshole/comments/s92wts/aita_for_telling_my_fathers_wife_that_i_didnt/htl6xv8/
efpbgi3l	YTA. How dense are you?	1642766649.0	htl6ytb	t3_s94usq	t3_s94usq	/r/AmItheAsshole/comments/s94usq/wibta_if_i_dont_invite_my_wife_to_my_birthday/htl6ytb/
a4yd0g2z	I really don’t get all the YTA if the roles were reversed, it would be classed as sexual harassment. NTA	1642766752.0	htl74l8	t3_s98s3t	t3_s98s3t	/r/AmItheAsshole/comments/s98s3t/aita_for_leaving_a_bad_review_on_a_diner_and/htl74l8/
8xqf2zk4	INFO: What do you mean by inappropriate comments?	1642766831.0	htl792o	t3_s98s3t	t3_s98s3t	/r/AmItheAsshole/comments/s98s3t/aita_for_leaving_a_bad_review_on_a_diner_and/htl792o/
7oagy	[NTA] Seems like allot of commenters here "saying yta" are entitled thieves that don't appreciate you changing your detergent. You all have your own closet as you stated. Why should it be your problem to go and talk with every person to find out who is going into your closet and stealing your detergent. You also mentioned the landlord made it clear that you all have separate closets, so they can't claim oh I didn't know. I lived in many apartments, don't steal people's stuff. Detergent is expensive!	1641120754.0	hqx7pe4	t3_rtzk6l	t3_rtzk6l	/r/AmItheAsshole/comments/rtzk6l/aita_for_putting_bleach_in_our_bottle_of_laundry/hqx7pe4/
9rp69zbe	You either take rent or you don't. What's the point of taking 50? You're criticizing taking rent at all then. Not the amount, because that's very very low already.	1641125501.0	hqxdjgn	t3_rty7o4	t1_hqxcb2i	/r/AmItheAsshole/comments/rty7o4/aita_for_not_letting_my_daughter19_move_back_in/hqxdjgn/
aobxq	damn man you’re a petty and self absorbed fucking asshole	1641134329.0	hqxrjps	t3_rua5y9	t3_rua5y9	/r/AmItheAsshole/comments/rua5y9/aita_for_storming_out_of_a_new_years_eve_party/hqxrjps/
f4zpl	I always find this notion ridiculous. He is living in their home country. If a conservative Muslim man came into a western country and refuse to shake a womans hand (pre pandemic) people here would call him an asshole, and that he has to integrate.   It is not too much to ask to use the respected names of people. There are many cultures you call elder people mother, father, uncle, aunt etc. Not doing so is rude.   Her sister does want the good parts of a close knit culture, without accepting that you need to be close knit for it. The price you pay for everyone having your back, is that they have their noses in your business.   She is literally whining about the consequences of her actions.	1641137235.0	hqxxjrc	t3_ru7oas	t1_hqxamdm	/r/AmItheAsshole/comments/ru7oas/aita_for_telling_my_sister_its_her_fault_nobody/hqxxjrc/
5ojhxith	All she did was drive her son closer to his problematic wife and even farther away from OP, so now he’s definitely never going to talk to OP about his very real problems in this relationship. Is his relationship going to last with his wife? I’d be shocked if it did, it’s clearly so unhealthy. But there’s a kid now. Permanently. The wife will never stop being the mother and OP could have been a stable element in this kid’s life and she just blew that chance to hell at least for the near term, and she will continue to drive him away if she keeps trying to undermine her son and do things behind his back instead of support him in a healthy way. You can’t control what other people do, but you should be there for your kids when they make mistakes as long as they aren’t being abusive. She can also give advice, but only a couple of times per topic, not repeatedly and never drop it because he doesn’t listen.	1641142715.0	hqyanzd	t3_ru270z	t1_hqxjkeo	/r/AmItheAsshole/comments/ru270z/aita_for_taking_a_dna_test_behind_my_sons_back/hqyanzd/
hu2rqa3m	Nta Most women poop during childbirth.  Even female ANIMALS poop while giving birth. I thought that was common knowledge? It literally feels like you need to take such a huge shit it might kill you.   He's an insensitive, cruel asshole who takes joy in degrading and humiliating you to everyone because he thinks he's funny. I literally have no idea if I did or not during my birth experience, because I had other things to worry about. My husband may have seen, but he has literally never once brought it up.	1641145204.0	hqyh6si	t3_ru7yin	t3_ru7yin	/r/AmItheAsshole/comments/ru7yin/aita_for_blowing_up_on_my_husband_infront_of_his/hqyh6si/
8fem47x1	NTA - time to nut up and protect your kid from being bullied in his own home. Wife and sons are no longer allowed to speak to him unsupervised. For what it’s worth, your wife is a massive C	1641146516.0	hqykm42	t3_ru89xu	t3_ru89xu	/r/AmItheAsshole/comments/ru89xu/aita_for_refusing_to_force_my_son_to_apologize_to/hqykm42/
hpqfnpgl	NTA.  Having been through a similar experience, I can offer this advice to anyone in OP's position: 1. Don't get offended on other people's behalf. For instance, if the husband won't call OP's parents by a name they want, that's their problem to sort out or grin and bear or whatever. 2. If you care about your relative who isn't following customs. You can still support them even if you don't agree with their decisions by wishing them well and doing what you can for them outside of your traditions. Like friendly visits, etc. 3. Stay neutral. If you are not the parent this will be easy because it's usually the parents that decide if cows will be slaughtered and whatnot. Focus on yourself and your own role and expectations as a sister, daughter, etc.	1641150537.0	hqyvozd	t3_ru7oas	t3_ru7oas	/r/AmItheAsshole/comments/ru7oas/aita_for_telling_my_sister_its_her_fault_nobody/hqyvozd/
5ojhxith	Exactly, I have personal experience with it and the tragic reality of domestic violence never ends with the karmic revenge fantasy people see in the movies. I’m so sorry about your horrible experience and your friend’s death.	1641150645.0	hqyvzkg	t3_ru270z	t1_hqxu49c	/r/AmItheAsshole/comments/ru270z/aita_for_taking_a_dna_test_behind_my_sons_back/hqyvzkg/
b375wbl6	A total lack of punctuation/spacing? Yikes. But it sounds like, after 4 years, you still haven't established clear boundaries with one another, and that leads to stuff like this. I don't think there's anything for people here to judge other than the reality that your expectations might not be compatible. I do think you're the asshole for suspecting and accusing before you got all the details in the first instance, and maybe this is just more confusing BS.	1642532085.0	ht7n1zo	t3_s74nle	t3_s74nle	/r/AmItheAsshole/comments/s74nle/aita_for_bringing_up_old_texts/ht7n1zo/
3czfyt9t	I made that assumption because it is clear that the husband is concerned about the money. If the split was as clean as you say, the husband wouldn't care. But I cannot imagine a world where a couple's finances are perfectly hermetically sealed and have no overlap (unless you are in the top 0.0001% and money is excessive).  And for your budget, you haven't included food, travel, vacations, entertainment, etc... Or is that covered by the partner?	1642532323.0	ht7npf7	t3_s6vldv	t1_ht6qsqh	/r/AmItheAsshole/comments/s6vldv/aita_for_choosing_a_lower_paying_job_without/ht7npf7/
54fmjcko	NTA, your mum has checked out of being a parent. Your dad is enabling her behaviour.	1642534534.0	ht7tnoe	t3_s6xwom	t3_s6xwom	/r/AmItheAsshole/comments/s6xwom/aita_for_telling_my_mum_i_wont_play_happy_family/ht7tnoe/
5ojhxith	NTA you’re not projecting anything, he’s showing his immaturity. My jaw dropped when I saw his age. I was expecting it to be 10+ years younger from the title. Not that he’s gaming, but not knowing without being told he can’t be acting like he’s in a bar while you’re working. You are at work. You need a work environment. Is he on some really strong pain killers from the accident?	1642536929.0	ht804jc	t3_s76fob	t3_s76fob	/r/AmItheAsshole/comments/s76fob/aita_for_telling_my_partner_that_he_cant_game_on/ht804jc/
hu2rqa3m	i like how it was you SISTER who abandoned a small child alone but somehow everyone in your family is blaming you.  maybe its just me, but i feel like it's far more petty and selfish to neglect small dependent children in your care to go fuck off and do "something important". also, how fucking manipulative to try to send you a message stating how she'd already abandoned the kid alone and it's your problem. what the fuck is so important she can get away with that without being seen as the asshole to your family, but you saying no and STUDYING is wrong?  fuck everyone there except you, your BIL, and the kid. wtf.  &#x200B;  NTA by the way, not at all. your sister is a piece of work though. i'm curious whats SO IMPORTANT she thinks child endangerment and neglect is worth it? i'm guessing drugs or infidelity. what the hell else could be so important it has to be done when her husband isn't home?  &#x200B;  and you didn't stir shit up in their marriage. she was already doing that all by herself.	1642539305.0	ht86nob	t3_s74e8q	t3_s74e8q	/r/AmItheAsshole/comments/s74e8q/aita_for_refusing_to_watch_my_sisters_stepkid_and/ht86nob/
ahrcu	YTA  Do you have any idea how difficult it is to be a caregiver? You called the police instead of going to assist your brother, you are worse than SIL by a lot. You've just made caring for your brother much more difficult going forward because now they are in the system. It's likely they will send a social worker now which is miserable to deal with, even if you have nothing to hide.   Even if you went to help him but still called the police you'd be the asshole, just less of one.   Absolutely disgusting reaction. You should be ashamed.	1642539340.0	ht86r5h	t3_s727o4	t3_s727o4	/r/AmItheAsshole/comments/s727o4/aita_for_calling_the_cops_on_my_sil_for_leaving/ht86r5h/
deg1vm9u	Well if only I had a nickel for every hair cut, eye brow trim ,full facial care and ear cleaning I gave my boyfriend :)   Well actually I did, he did buy me an apple watch with the money he ended up saving but he made the decision to do so. I didn’t ask him to send me a DEPOSIT wtf ?!	1642541700.0	ht8d8am	t3_s6w22x	t3_s6w22x	/r/AmItheAsshole/comments/s6w22x/aita_for_not_wanting_to_pay_for_my_gfs_services/ht8d8am/
e8sc83ki	Because this woman thinks she owns her child.	1642541705.0	ht8d8s5	t3_s729ie	t1_ht7k95j	/r/AmItheAsshole/comments/s729ie/aita_for_hating_my_mils_tattoo/ht8d8s5/
hhulv1fz	>Hours later, I got a call from my brother in law asking where my sister was, I said I had no idea. he proceeded to tell me he just came home at 1pm and found his son by himself at the house. >  Something doesn't add up. It sounds like your sister doesn't want her husband to find out that anyone else besides her is looking after her step kid. if that's the case, wouldn't your sister have been home already by 1pm when her husband gets home so that she doesn't get caught? Imagine if either you or your mom did end up babysitting her step kid. She would've gotten into trouble anyway when her husband comes home at 1pm and finds you babysitting her step kid. Unless she didn't know that her husband would get home earlier than expected?	1642542798.0	ht8g85p	t3_s74e8q	t3_s74e8q	/r/AmItheAsshole/comments/s74e8q/aita_for_refusing_to_watch_my_sisters_stepkid_and/ht8g85p/
ikdkzgmc	NTA. This  ⬆️ person sums it up perfectly though.	1642548401.0	ht8ul83	t3_s7920b	t1_ht8i8tv	/r/AmItheAsshole/comments/s7920b/aita_for_triggering_my_friends_roommate_and/ht8ul83/
chjsyq6t	NTA. Wait, what? She touched your baby without your permission? Who does that? You were absolutely in the right to report that, it absolutely IS a big deal.	1642550247.0	ht8z0wz	t3_s7bq4j	t3_s7bq4j	/r/AmItheAsshole/comments/s7bq4j/aita_for_complaining_about_the_bartender_and/ht8z0wz/
52u6g9fl	>Who books a flight (across the country - coast to coast) to see a newborn without asking the mother first?  My MIL. She booked a flight to another continent to see my newborn without asking me first.  Trust me, a new baby will bring out the selfishness and ignorance in some people. It's not unheard of, unfortunately.	1642552759.0	ht9517d	t3_s6ymvs	t3_s6ymvs	/r/AmItheAsshole/comments/s6ymvs/wibta_is_i_told_my_friend_i_was_upset_with_her/ht9517d/
io4zykfi	> Emotionally maturity is not guaranteed with age  No, but it's certainly likely.   > and even if a parent emotionally matures later, that doesn’t change the psychological damage they may have subjected their children to before.  We don't remove children from their homes because their families fight occasionally. That's not emotional damage worthy of subjecting a child to foster care and the trauma of separation from a loved parent.  > Direct adoption is also an option to completely circumvent the foster care system.   Which is still traumatic to both the mother and child.   > just that it is a possible option to consider if things at home aren’t ideal or you aren’t prepared to do what you need to do.  The daughter tried to get one night out after a *year* of school and childcare. That is not indicative enough of a troubled home life that would require giving a child up for adoption.  > Again, I am not saying the emotional abuse is or will happen, just that its a strong possibility  And I'm saying you're basing the "strong possibility" thing on literally nothing except one comment in this thread.  >  And people can say or even genuinely believe they love someone, their actions, and how they treat them speak much louder however, and that comment about children not being entitled to their grandparents just very much rubbed me the wrong way.  Their actions and how they treat them isn't what you're basing this on though. You're basing it on another comment made on this post.	1642702149.0	hthlabp	t3_s89w9f	t1_hthix7l	/r/AmItheAsshole/comments/s89w9f/aita_for_not_hiring_a_nanny_for_my_granddaughter/hthlabp/
54fmjcko	YTA. Why is your gf cooking for you?	1642706400.0	hthwvmb	t3_s8ibip	t3_s8ibip	/r/AmItheAsshole/comments/s8ibip/aita_for_not_liking_indian_food/hthwvmb/
cesvh	NTA  I agree with others... Write an email to your entire family detailing the past 16 years of your life and the emotional trauma it caused you. Tell them you may never be able to forgive your biological parents and sibling and that you're in therapy because of them. You will not compromise your mental health nor derail your progress to appease their guilt. Tell them if/when you are ready, YOU will reach out to them and to please respect your decision or you will forever be no contact.  Then be LC/NC.   Sounds like you've overcome a great deal in your life and are happy despite them.	1642708598.0	hti2udx	t3_s8nj3g	t3_s8nj3g	/r/AmItheAsshole/comments/s8nj3g/aita_for_refusing_to_go_to_any_family_event_with/hti2udx/
