author	body	created_at	c_id	s_id	p_id	permalink
16j9q5	Ok, I'm an autistic man, so while you are smart enough to understand that isn't an excuse for what I'm about to say, show it to your husband. Apparently, he's a big enough doof that he'll immediately forgive me.   Hey, OPs hubby! Do you know why there are autistic people that use the excuse "oh, I'm autistic, I can't help it, I do stupid stuff but you have to deal with it"? Because of people like you. Naive people that think that autistic people have no self-control. To put it bluntly? Gullible people.   Your friend is 100% aware of what he is doing. He isn't your friend. All you are to him is a doormat.   But I'm just autistic, I have no self-control, right? So I guess I have no free will or any sort of self-agency. So, you'll just ignore me (since I have no control) and go back to believing that Mark gives any sort of damn about you. Because there's no possible way that I might be actually telling you the truth. Right?	1641125302.0	hqxdacd	t3_rttu1v	t3_rttu1v	/r/AmItheAsshole/comments/rttu1v/aita_for_saying_i_wont_hang_out_with_my_husbands/hqxdacd/
dnx37u00	NTA call me insensitive but why should OP have to change her baby’s name for a woman she barely knows? Sure I understand her brother’s girlfriend may still be grieving but that’s not really her problem. I wouldn’t even consider changing the name if I were op. Maybe address the baby using their initials as other redditors suggested	1641125435.0	hqxdgc7	t3_rtueci	t3_rtueci	/r/AmItheAsshole/comments/rtueci/aita_for_not_changing_my_babys_name_to_appease_my/hqxdgc7/
kijpg	YTA. You should have asked more questions and kinda checked in with Margot if you were confused. Having a polite, but confrontational conversation is a sign of being a mature adult.   For example, Job descriptions are often HR documents where they cover all the basis for every single person in that company with that title. My job description says that I might be in a lab setting up to 75% of my time. I haven’t been in the lab in two years because of my specific role in my specific department. Other people in my position in different departments are though. So the descriptions have to say that. Being able to do some physical tasks might also be expected SOME times and almost every HR description has to include that. Also, the company probably want you to live close to the office so when they bring people back, they can do that easily.   So they could’ve been telling you the truth. Or  could’ve explained the differences and cleared up any discrepancies. But you chose to just blow up the bridge and throw her husband under the bus.	1641125558.0	hqxdm4j	t3_qclk15	t3_qclk15	/r/AmItheAsshole/comments/qclk15/aita_for_not_accepting_a_job_i_was_nearly/hqxdm4j/
8yqmntk7	OP says that the fence is on the boundary line. My understanding is that boundary fences are paid 50-50 by the owners of the property on each side. Perhaps it is country specific.	1641125908.0	hqxe2my	t3_rttpdb	t1_hqxcaow	/r/AmItheAsshole/comments/rttpdb/aita_for_welding_outside_when_my_neighbor_was/hqxe2my/
dnx37u00	That doesn’t mean it’s her responsibility to appease her brother’s girlfriend	1641126143.0	hqxee22	t3_rtueci	t1_hqx7u1x	/r/AmItheAsshole/comments/rtueci/aita_for_not_changing_my_babys_name_to_appease_my/hqxee22/
95gz5div	Fun fact: misogyny is inherent to homophobia; women who marry homophobes will suffer, regardless of their sexuality.	1641126179.0	hqxefse	t3_rtzbrv	t1_hqwz9m3	/r/AmItheAsshole/comments/rtzbrv/aita_for_snapping_at_a_friend_because_her_idea_of/hqxefse/
hrgmc7tk	NTA. Your dad should put you on the first place and his gf to be on the second	1641126233.0	hqxeif9	t3_ru8azr	t3_ru8azr	/r/AmItheAsshole/comments/ru8azr/aita_for_telling_my_dad_i_hate_his_girlfriend/hqxeif9/
bdjrxldx	Not sure what you mean by reread? I did and I stand by what I said she can already leave and come back at whatever time she wants she’s not my sister I frankly don’t care but her comments to mind our business, that my gf isn’t her mom, and if she wanted to be treated like a kid she would’ve stayed home don’t sit right with me especially after she lives very comfortably for free.	1641128470.0	hqxhlno	t3_ru8dmi	t1_hqxg3wd	/r/AmItheAsshole/comments/ru8dmi/aita_for_telling_my_gf_sister_she_will_be_treated/hqxhlno/
3wzp2slp	Let's make fun of dyslexic people now:DD	1641128471.0	hqxhlpm	t3_ru2ox6	t1_hqwonld	/r/AmItheAsshole/comments/ru2ox6/aita_for_only_saying_no_once/hqxhlpm/
dkvrg4si	NTA your wedding - you do you.  Both me and my sister went wedding dress shopping with our dad.  It was a big dream for him to help us find the perfect dress.	1641128700.0	hqxhxxf	t3_ru1u74	t3_ru1u74	/r/AmItheAsshole/comments/ru1u74/aita_for_wanting_to_bring_my_bridesmaids_wedding/hqxhxxf/
f48vx6of	I have no idea what happened in that room. I'm not saying something bad didn't happen...but to extrapolate that to all healthcare workers is nonsensical. it's like getting a hair in a dish at an Italian restaurant and writing off all Italian restaurants.   during covid no one knew how or why it was spreading. a lot of healthcare workers died. no procedures were done without a covid test first. all those healthcare workers in that room had families too.	1641128721.0	hqxhz2s	t3_rtz1ku	t1_hqxhibd	/r/AmItheAsshole/comments/rtz1ku/aita_for_walking_out_of_my_boyfriends_celebratory/hqxhz2s/
30xjtdsu	Yeah, I'll never understand this line of thinking.	1641128869.0	hqxi6y0	t3_ru8dia	t1_hqxg49a	/r/AmItheAsshole/comments/ru8dia/aita_for_refusing_to_give_a_family_recipe_to_my/hqxi6y0/
6glewtj1	True. I didn’t think of that before.	1641130494.0	hqxkpwa	t3_ru2ink	t1_hqxhhdn	/r/AmItheAsshole/comments/ru2ink/aita_for_insulting_my_stepmother_during_family/hqxkpwa/
66aase3g	Lol I just can't imagine thinking humans are all that great.   But you're right, that's not the point. So then my thing is they were at the office where he found out. Grief is tricky and some people CAN'T hold it in in that moment. People lose their animals in vet offices, they're surrounded by workers who understand & see this every day or people who care about their animals just the same. It's not like he lost it in a Walmar parking lot, people around them would know and could be sympathetic to what he was going through.  Regardless, she's not TA for feeling embarrassed. She's TA for thinking her feelings are above his own when he is grieving just because she doesn't understand why. That's being an unsupportive partner, and also clearly a sexist one who thinks men shouldn't feel emotions or cry.	1641130560.0	hqxktqa	t3_ru8ve3	t1_hqxk9se	/r/AmItheAsshole/comments/ru8ve3/aita_for_telling_my_boyfriend_he_was_embarrassing/hqxktqa/
9kiiyabj	NTA. Delete those videos and then break up with him. Remember to check his email and notes (if he has an iPhone) as he could have saved/ sent those videos there for back up, also check his snap (my eyes only) just to be on the safe side. Just don’t continue to have sex with him. I think he is cheating on you. Trust your gut.	1641130596.0	hqxkvua	t3_ru7it3	t3_ru7it3	/r/AmItheAsshole/comments/ru7it3/aita_for_going_through_my_boyfriends_phone/hqxkvua/
60mgv7es	INFO: If your brother marries his girlfriend would you share the recipe then?	1641130994.0	hqxljqd	t3_ru8dia	t3_ru8dia	/r/AmItheAsshole/comments/ru8dia/aita_for_refusing_to_give_a_family_recipe_to_my/hqxljqd/
bh81o6np	NTA. Your “friend” is psychotic.	1641131039.0	hqxlmev	t3_ru9pwr	t3_ru9pwr	/r/AmItheAsshole/comments/ru9pwr/aita_for_saying_me_freind_is_faking_being_trans/hqxlmev/
i49tmgii	Fair enough.   I personally didn't see anywhere that he'd done anything on purpose to cause harm. I could make that judgement if OP stated that sister's husband was made aware that what he was doing was frowned upon, but continued to do it- in which case yes, husband is a prick. But imo it seems husband is more unaware overall and may not be intending harm as OP assumes.	1641132514.0	hqxo6d4	t3_ru7oas	t1_hqxnvuv	/r/AmItheAsshole/comments/ru7oas/aita_for_telling_my_sister_its_her_fault_nobody/hqxo6d4/
3vf0i836	> They are Jewish and the decorations offend them  I may be wrong but weren't Jesus, Mary Joseph  all Jewish?  Mary To my point of view Christmas is celebrating the birth of a wee Jewish baby.  **NTA**	1641132625.0	hqxodet	t3_rmnjh5	t3_rmnjh5	/r/AmItheAsshole/comments/rmnjh5/aita_for_being_over_the_top_petty_and_loving_it/hqxodet/
69howvl2	I'm not saying that at all.  I'm saying that unless a parent can literally watch their child 100% of the time it is *impossible* to prevent them from having sex.    Repressive parenting behaviours like preventing your child from being in a room alone in your house with a boy only serve to make your child feel ashamed if they are having sex (meaning they won't talk to you) and to push them into having sex somewhere else, which can often be much more dangerous.    The vast majority of American families (at least until recently) have approached this issue by repressing their children, and experiencing abuse during childhood is alarmingly common - it's *clearly* not working.  The best way to keep a child safe is to foster an environment where they can be honest with you.  At 11, I'm definitely not saying you should just "let" a kid have sex - but if your kid is trying to do so the correct response is to take them to a therapist and engage in an open conversation with them so you can find out what is going on (and in the case of grooming by an older person, you can find out who to report), not punish them.  When I was 13 and being abused, my parents went with the punishment route instead of actually asking me what was going on and it left me in danger and just guaranteed I would never talk to them about it again - this shouldn't happen to anyone.	1641132673.0	hqxogfj	t3_rt7nbf	t1_hqww0a3	/r/AmItheAsshole/comments/rt7nbf/aita_for_grounding_my_daughter_for_sneaking_a_boy/hqxogfj/
66aase3g	I think you phrased this perfectly. I've been commenting back and forth getting different perspectives and I really just think it comes down to a fundamental difference: Do you love your dog like family? If so, OP is a monster. If you don't, you're just as baffled and confused as she was.  But regardless, I still think she should've given him more time. Telling him he embarrassed her the same day he finds out his dog has cancer is just an AH move, because at the end of the day it's really not about her.	1641132806.0	hqxoosw	t3_ru8ve3	t1_hqxm9hp	/r/AmItheAsshole/comments/ru8ve3/aita_for_telling_my_boyfriend_he_was_embarrassing/hqxoosw/
d5tdw	Nta. You need to end this entitled behavior ASAP. (Not saying you will always have the party on his birthday, sometimes it's going to fall on a Thursday) but let them know that if you can you will  Put your kid first.	1641132904.0	hqxov6t	t3_ruaa2t	t3_ruaa2t	/r/AmItheAsshole/comments/ruaa2t/aita_for_refusing_to_move_my_sons_birthday_to/hqxov6t/
b4bxobs5	NTA. I don't know if I pooped during birth. If I did, I didn't notice, and my husband wouldn't tell me if I did.   I remember reading an AITA comment about this topic a few months ago where a guy who was no longer with the mother of his child who said, no matter how acrimonious things got, he would take that piece of information to the grave. And your husband is sharing it and making fun of you? Think about how much more respectful other people's exes are than your husband.	1641134268.0	hqxrfbw	t3_ru7yin	t3_ru7yin	/r/AmItheAsshole/comments/ru7yin/aita_for_blowing_up_on_my_husband_infront_of_his/hqxrfbw/
2cuzov2i	Seriously, downvoters. What was her expectation?	1641134391.0	hqxro3s	t3_rtcrfi	t1_hqxol5s	/r/AmItheAsshole/comments/rtcrfi/aita_for_leaving_a_girl_at_the_club/hqxro3s/
e3miqzjq	NTA- sleep deprivation is not an excuse to be abusive to your DIL and behave in a sh*tty way.   She needs to own up for her poor behaviour and actions. It can be difficult if you’re used to sleeping a certain way but irregardless of insomnia, you can’t excuse only being abusive to you.   Absolutely not. She needs to own up and grow up.	1641135342.0	hqxtl1b	t3_rub348	t3_rub348	/r/AmItheAsshole/comments/rub348/aita_for_saying_that_mil_needs_to_apologize_and_i/hqxtl1b/
8myrkvl1	I'm not sure why you're putting all the blame on the OP. I don't see how it was right for the wife's friend to just spring the babysitting on him as if he would have nothing else to do.	1641135445.0	hqxtskz	t3_ru2ox6	t1_hqwiexa	/r/AmItheAsshole/comments/ru2ox6/aita_for_only_saying_no_once/hqxtskz/
es9aum7y	Also, I don't know how this is in other countries, but in Germany, missing a couple of days at work due to the birth of a child would have zero effect on a promotion. I'm not 100% sure, but I think that would probably be illegal here, actually. Our law and mentality is very pro-workers though, so it might be different in other parts of the world. Just seems very exaggerated to me how he thinks he can't miss a single day of work if his child is being born?? NTA	1641135528.0	hqxtymg	t3_ru0h5s	t1_hqw4ckp	/r/AmItheAsshole/comments/ru0h5s/aita_for_telling_my_husband_im_sick_and_tired_of/hqxtymg/
bm5c2ozo	> How can you know how the guy feels about the dog?  I think it’s quite obvious that he feels very strongly about the dog. He should also be free to feel and deal with his emotions as he sees fit but there is such a thing as dealing with your emotions poorly. Imo he did so in this instance.   As I said, people that get dogs do so knowing that they will likely pass before them. Losing a pet is sad but is expected. His reactions is how I’d expect a woman or couple to react to a miscarriage. It’s worth her wondering how he’s going to deal with more tragic events that they will have to experience together	1641135581.0	hqxu2hc	t3_ru8ve3	t1_hqxt337	/r/AmItheAsshole/comments/ru8ve3/aita_for_telling_my_boyfriend_he_was_embarrassing/hqxu2hc/
cwcnc9jg	YTA. I hope your boyfriend really takes in on board that you cared more about what other people might think than about how he was feeling in the midst of overwhelming grief. Your boyfriend sounds like he has a big, wonderful heart. And it sounds like he is someone that is incredibly emotionally healthy. It's great that he was not ashamed to express his heartbreak and grief and it's really sad and alarming that you are bringing this kind of toxic bullshit into his life.	1641135612.0	hqxu4qf	t3_ru8ve3	t3_ru8ve3	/r/AmItheAsshole/comments/ru8ve3/aita_for_telling_my_boyfriend_he_was_embarrassing/hqxu4qf/
5095zlmt	Gonna go with a gentle YTA, for the simple reason that a recipe isn’t really an heirloom, despite the great memories you associate with it (which can’t be diminished by sharing it).   A story for some context: my grandfather used to make waffles and claimed it was an old family recipe that he wouldn’t part with. When he came down with cancer and we were spending our last Christmas with him, I begged him to give me the recipe so I could be the one to make the waffles when he was gone. He refused. On the second to last day I was there, he admitted the “secret recipe” was in the back of the waffle iron that my grandmother bought him in the 50s. Did it change how good the waffles were? No. If anything, it made it an even better story, and my brother and cousins and I can all make the recipe for our families when we need to remember or just want some great waffles. Food is a community experience and you don’t lose anything by expanding the community.	1641135643.0	hqxu75r	t3_ru8dia	t3_ru8dia	/r/AmItheAsshole/comments/ru8dia/aita_for_refusing_to_give_a_family_recipe_to_my/hqxu75r/
d5scd	I got you	1641135690.0	hqxuamu	t3_ru7yin	t1_hqxi901	/r/AmItheAsshole/comments/ru7yin/aita_for_blowing_up_on_my_husband_infront_of_his/hqxuamu/
efknn47a	ESH. Two wrongs don't make a right, and you just don't say some things to people, even horrible people. She's obviously not in her right mind. You, on the other hand, have no excuse. She's accountable for her behavior, but so are you.	1641137192.0	hqxxgbv	t3_rubgj6	t3_rubgj6	/r/AmItheAsshole/comments/rubgj6/aita_for_saying_im_glad_my_cousin_is_infertile/hqxxgbv/
tfwpz	Man must not show weakness	1641137206.0	hqxxhd6	t3_ru8ve3	t3_ru8ve3	/r/AmItheAsshole/comments/ru8ve3/aita_for_telling_my_boyfriend_he_was_embarrassing/hqxxhd6/
832idg07	read comment above to understand my point lol	1641137350.0	hqxxstx	t3_ru8ve3	t1_hqxjmwn	/r/AmItheAsshole/comments/ru8ve3/aita_for_telling_my_boyfriend_he_was_embarrassing/hqxxstx/
4sjyqdng	YTA. Your blended family has been making fun of your son and torturing him with probably warped statistics and you chose them over him. While you wife waxed nostalgic about family it came to a head emotionally for him.   You should be addressing your son being alienated and, instead, you alienated him further.   Your son is adult aged and you should not be surprised when he goes no contact with all of you for his own mental health.	1641138443.0	hqy09dx	t3_ru89xu	t3_ru89xu	/r/AmItheAsshole/comments/ru89xu/aita_for_refusing_to_force_my_son_to_apologize_to/hqy09dx/
2yff69e2	Yikes. AITA with them hot takes as always. Yes totally divorce him because of this! Reddit does it again! Saved!	1641138456.0	hqy0afe	t3_ru7yin	t1_hqxcget	/r/AmItheAsshole/comments/ru7yin/aita_for_blowing_up_on_my_husband_infront_of_his/hqy0afe/
ct69h	Hey, I’m 33 and my bedroom was given to my brother. I haven’t had a place in my childhood home in 19 years (yeah, do that math),  and it still hurts, so have fun with the hurt you gave your daughter to carry being here years later.    Just selfish and sad. Your job is to take care of your kids. Just because she isn’t under 18 anymore doesn’t magically make her stop being your flesh and blood that you should care about. Sadly you appear to be the kind of person who will not understand this as your emotional intelligence seems to be nil.    Good luck with your future loneliness. YTA.	1641138606.0	hqy0msp	t3_rty7o4	t3_rty7o4	/r/AmItheAsshole/comments/rty7o4/aita_for_not_letting_my_daughter19_move_back_in/hqy0msp/
4lfmvuov	YTA. I have severe anxiety and depression. One thing that is important to know-your mental limitations are YOURS to deal with. The world will not bend for you nor should it. The sooner you figure that out, the better. Part of what helped me with my anxiety was learning that my responsibilities led to me having control, too.	1641138685.0	hqy0tgr	t3_ru997u	t3_ru997u	/r/AmItheAsshole/comments/ru997u/aita_for_refusing_to_make_my_own_doctors/hqy0tgr/
bowmk	Same for me! I started pausing them and asking “venting or advice” and it’s helped a ton.	1641138707.0	hqy0va2	t3_rtzbrv	t1_hqwd04f	/r/AmItheAsshole/comments/rtzbrv/aita_for_snapping_at_a_friend_because_her_idea_of/hqy0va2/
77834428	Get off the lease. You’re not together anymore, no need to be financially involved with her anymore. Also, if you can’t afford to take care of the cats alone then you need to re-home them. No need to involve her with the cats, they are in your care and now your responsibility.	1641138728.0	hqy0wy5	t3_rubei7	t1_hqy050h	/r/AmItheAsshole/comments/rubei7/wibta_for_not_paying_my_exgirlfriends_rent/hqy0wy5/
5p1bd5xo	Your father certainly isnt the asshole . He still offered you a one bedroom.  Who could blame him for not wanting to provide shelter for the lady that cheated on him	1641138810.0	hqy13w7	t3_ru9dlh	t3_ru9dlh	/r/AmItheAsshole/comments/ru9dlh/aita_for_suing_my_father_after_he_kicked_me_and/hqy13w7/
btyxpx9w	A door is not necessarily enough.   I could hear my flat-mate through the wall if the circumstances were right / wrong. White Noise Machines, and reorganizing furniture helped with my issues.	1641140209.0	hqy4f23	t3_ruc5sd	t1_hqy0o3v	/r/AmItheAsshole/comments/ruc5sd/aita_for_talking_loudly_when_working_from_home/hqy4f23/
27zf3hed	I’m sorry this happened. Don’t back down, don’t be made to feel you overreacted. You set a boundary.	1641140258.0	hqy4jal	t3_ru7yin	t3_ru7yin	/r/AmItheAsshole/comments/ru7yin/aita_for_blowing_up_on_my_husband_infront_of_his/hqy4jal/
5ql6udxa	I think you're in the right here but also doesn't seem like half of your son's family ignoring him on his birthday every year is gonna be a great experience for him.	1641140283.0	hqy4lec	t3_ruaa2t	t1_hqxojlv	/r/AmItheAsshole/comments/ruaa2t/aita_for_refusing_to_move_my_sons_birthday_to/hqy4lec/
hkvc7qo5	Actually, she apparently did know he was going to propose in the spring because he asked our mother for permission to marry me. And our mom knew my sister's boyfriend was going to propose on NYE because my sister's daughter told her. So, maybe her bf wanted to beat my fiance to the punch?	1641140358.0	hqy4rrv	t3_ruc5dv	t1_hqy3l67	/r/AmItheAsshole/comments/ruc5dv/aita_for_getting_engaged_the_day_after_my_sister/hqy4rrv/
h6zxlyw5	my wife sometimes tells me to fix up my clothes. If I gave her the silent treatment or abused her in some other form in response to that rather than communicate with her she would be a victim.	1641140383.0	hqy4u2t	t3_rttacw	t1_hqy3688	/r/AmItheAsshole/comments/rttacw/aita_for_telling_my_girlfriend_that_she_should/hqy4u2t/
7g42bjjc	Well no, not really  You are basically saying he has 0 rights what so ever because he is unemployed?    End of the day, the are a partnership, and they should treat each other with love and respect.   If one partner is doing something knowing they are causing issues with the other partner in the relationship then surely that is the AH?  You argument has been predicated on the fact, her partner is unemployed, therefore he has no right.  It's not like he does nothing around the home, he cooks and cleans the house.  Sure he is unemployed at the moment, but that doesn't mean he doesn't have a right.	1641140440.0	hqy4z51	t3_ruc5sd	t1_hqy46kx	/r/AmItheAsshole/comments/ruc5sd/aita_for_talking_loudly_when_working_from_home/hqy4z51/
f5mdc28s	Not that I know of but I will be asking the children.	1641142583.0	hqyabi1	t3_ru7pcr	t1_hqy95ko	/r/AmItheAsshole/comments/ru7pcr/aita_for_telling_my_husband_he_is_a_terrible/hqyabi1/
eqgir2ti	How do you know he’s living in “their” country?	1641142598.0	hqyacwp	t3_ru7oas	t1_hqxyf0f	/r/AmItheAsshole/comments/ru7oas/aita_for_telling_my_sister_its_her_fault_nobody/hqyacwp/
f9t7s407	https://www.reddit.com/r/AmItheAsshole/comments/ru2ox6/aita_for_only_saying_no_once/hqx756f/?utm_source=share&utm_medium=ios_app&utm_name=iossmf&context=3	1641142671.0	hqyajsx	t3_ru2ox6	t1_hqxhlpm	/r/AmItheAsshole/comments/ru2ox6/aita_for_only_saying_no_once/hqyajsx/
10b7et	Update. He locked me out of the house.	1641142712.0	hqyanqf	t3_rudj4t	t3_rudj4t	/r/AmItheAsshole/comments/rudj4t/aita_for_being_a_happy_drunk/hqyanqf/
5vb1cjr	NTA   The person you are responding to is technically right, but that's all.  It is totally disrespectful and damaging to your relationship with your parents. They are acting like animals.	1641142800.0	hqyavvp	t3_rudmst	t1_hqy9z17	/r/AmItheAsshole/comments/rudmst/aita_for_being_repulsed_due_to_my_narcissistic/hqyavvp/
63uguwfw	So it’s ok for him to humiliate you like that but you can’t to him? 🥴  Also women poop all the time during childbirth it’s not embarrassing / abnormal so there’s not even a “joke” to make there	1641143837.0	hqydkyw	t3_ru7yin	t3_ru7yin	/r/AmItheAsshole/comments/ru7yin/aita_for_blowing_up_on_my_husband_infront_of_his/hqydkyw/
cnei687z	YTA — you’re going slower than the speed limit and are surprised people are trying to pass you? you’re a reckless driver, please stay off the roads.	1641143967.0	hqydxi9	t3_rudwvt	t3_rudwvt	/r/AmItheAsshole/comments/rudwvt/aita_for_accelerating_when_being_overtaken/hqydxi9/
dlnatwns	No. We don't live near family. My mom won't travel to a cold state, step dad wouldn't want to come, neither my dad or step mom.	1641143983.0	hqydyzf	t3_rue77h	t1_hqydpp0	/r/AmItheAsshole/comments/rue77h/wibtah_i_feel_like_i_would_be_give_it_to_me/hqydyzf/
dlnatwns	I understand.	1641144002.0	hqye0uj	t3_rue77h	t1_hqydnhm	/r/AmItheAsshole/comments/rue77h/wibtah_i_feel_like_i_would_be_give_it_to_me/hqye0uj/
dlnatwns	I understand.	1641144035.0	hqye3vv	t3_rue77h	t1_hqydxzm	/r/AmItheAsshole/comments/rue77h/wibtah_i_feel_like_i_would_be_give_it_to_me/hqye3vv/
17e6chpu	Your sister and her husband aren’t your peers? They aren’t part of society? They can’t decide whether or not to play along with cultural practices that belong in the garbage bin?  Says a lot about how little you respect your sister and her husband.   They can live their lives without you inflicting your traditional practices upon them. You and your family are living in the past and your close minded , rigid adherence to tradition is destroying your relationships with your sister and her husband.   Playing the “colonial” card isn’t winning you any points. I have no colonialist guilt and it’s not going to work on me. Go sacrifice a cow or something.	1641144046.0	hqye4tz	t3_ru7oas	t1_hqyd6vy	/r/AmItheAsshole/comments/ru7oas/aita_for_telling_my_sister_its_her_fault_nobody/hqye4tz/
dlnatwns	I understand.	1641144061.0	hqye6ab	t3_rue77h	t1_hqye38d	/r/AmItheAsshole/comments/rue77h/wibtah_i_feel_like_i_would_be_give_it_to_me/hqye6ab/
