author	body	created_at	c_id	s_id	p_id	permalink
k1a6f	YTA you don't put anything before your daughters birthday except maybe work because you have to.	1642541656.0	ht8d3ww	t3_s78hap	t3_s78hap	/r/AmItheAsshole/comments/s78hap/aita_for_missing_my_daughters_birthday_to_go_ice/ht8d3ww/
a8y1ugod	Thanks for joining in the conversation? There’s a lot of good and bad opinions. I guess we can’t have a reasonable conversation ….???	1642541682.0	ht8d6h5	t3_s771tw	t1_ht8cvgx	/r/AmItheAsshole/comments/s771tw/aita_for_suggesting_a_nose_job_to_my_sons_teacher/ht8d6h5/
f7reuaj	NTA.  This is an odd thing for her to lie about.	1642541708.0	ht8d93k	t3_s752c7	t3_s752c7	/r/AmItheAsshole/comments/s752c7/aita_for_possibly_being_too_closeminded_when_my/ht8d93k/
k1a6f	NTA but know it can be hard to get a job right now in some cases. November/December is a terrible time for hiring except seasonal retail workers. My advice is to tell her that she has like 1-3 months to find a job. If she fails to get one, then she will be extremely restricted in the house. You won't pay any bills for her (cell phone) she won't be allowed wifi or internet unless supervised job hunting. And other privileges removed. It will just be room and food and little else. The reason is that if she has no job and you push her into the street at 20 years old, that's a bad situation for her. She could be forced to become a stripper or prostitute or some other bad situation. You'll just make it so miserable and boring to live with you that she'll either get a job or find a way to move out. But you won't be kicking her out. It have been all her choice.      Reminder, too, that even children have legal tenant rights and removing her could actually require a full eviction if she wanted to fight it.	1642542894.0	ht8ghi9	t3_s78s09	t3_s78s09	/r/AmItheAsshole/comments/s78s09/aita_for_telling_my_daughter_she_either_takes/ht8ghi9/
dbj2yud	YTA.  Why would it wrong for your daughters grandmother to get a tattoo of your daughter’s name? If anything, that’s very freaking bad aZz of her! You should feel proud that she was willing to do that, with or without your permission. I’d understand if she had no relation to your daughter but THAT’S YOUR DAUGHTERS GRANDMOTHER!	1642542937.0	ht8glrt	t3_s729ie	t3_s729ie	/r/AmItheAsshole/comments/s729ie/aita_for_hating_my_mils_tattoo/ht8glrt/
innpxqgg	Thank you for telling me your story. It does feel like I’ve been left with a bucket of problems here, along with my own personal ones, and am receiving no emotional support for it. Even when he has time. Even though most people think I’m in the wrong here, I stand by my decision to cut off contact for the moment.	1642543903.0	ht8j5ht	t3_s698pf	t1_ht5g03h	/r/AmItheAsshole/comments/s698pf/aita_for_telling_my_deployed_husband_i_dont_want/ht8j5ht/
z5mou	That'a absolutely bonkers to me. To be more excited for a *grandchild* than your own full-blood child is *insanity*.	1642544755.0	ht8lddh	t3_s729ie	t1_ht8bhs1	/r/AmItheAsshole/comments/s729ie/aita_for_hating_my_mils_tattoo/ht8lddh/
dbq1ffi1	YTA. She is a new owner. Were her requests spoiling and over the top? Maybe. But it’s HER dog, not yours, and you should have at least tried to follow the instructions a little bit.  In a year from now she’s going to look back on this time and say wow I was over the top with how much I pampered rover, and when that happens, you can say I told you so.   However she should still pay you.	1642544933.0	ht8ltvf	t3_s79e9r	t3_s79e9r	/r/AmItheAsshole/comments/s79e9r/aita_for_letting_my_sisters_dog_be_a_dog/ht8ltvf/
fqpgo	Your admittedly doughy body!?!?!?! Bro…..Lmao what is this	1642545055.0	ht8m56d	t3_s28qce	t3_s28qce	/r/AmItheAsshole/comments/s28qce/aita_for_asking_my_friend_to_pay_for_skin/ht8m56d/
hrk9nii8	You're allowed to choose to meet her after. You're allowed to have your feelings. And you're definitely allowed to say these are simply the wrong circumstances. NTA, not spiteful, not juvenile. That commenter is seriously projecting.	1642545149.0	ht8mdua	t3_s6k1ax	t1_ht844bx	/r/AmItheAsshole/comments/s6k1ax/aita_for_not_wanting_my_dad_to_bring_his/ht8mdua/
awha2bt9	NTA!! at all! im 19f and would avoid going to school as much as i could for years because my mental health was in terrible condition, it ended up becoming so severe that I had to leave halfway through my last year and delay my uni plans while i focus on rehab (still ongoing). anything you can do to avoid that happening is good for you, but if something like that ends up happening anyway thats also ok. the people who struggle very badly with mental health during school cant operate the same way their peers do and you may even need to completely restructure how you go about school to help alleviate some of the pressure on your mental health. you could try to talk to the school and get their support to talk to your parents to understand the gravity of your situation so that you can make the right changes. as someone who delayed it for years because i thought i had no other choice than to attend school like everyone else while i was severely depressed, you NEED to find support and try to make changes. if attending school is at the centre of your stress, it is not worth it to keep going despite your mental health! (feel free to dm if you want to talk about it more ❤)	1642546909.0	ht8qwuc	t3_s795ek	t3_s795ek	/r/AmItheAsshole/comments/s795ek/aita_for_skipping_school/ht8qwuc/
5mdb4vlo	She's cheating, or meeting her dealer. Probably cheating because it's every Monday and there is no reason to react like that unless she knows she's fucked.  NTA	1642548199.0	ht8u3hh	t3_s74e8q	t3_s74e8q	/r/AmItheAsshole/comments/s74e8q/aita_for_refusing_to_watch_my_sisters_stepkid_and/ht8u3hh/
8e9xyep8	It's a gift, you're dad said so.  NTA, but you're dad is.	1642548318.0	ht8udzx	t3_s7asld	t3_s7asld	/r/AmItheAsshole/comments/s7asld/wibta_if_i_didnt_pay_back_the_cost_of_a_car_that/ht8udzx/
d58mnvdd	I'm 30 years old! I have never owned a car before and always biked everywhere before this. Yes it's very unfortunate that I don't know but this post has opened my eyes that I should really learn. I've never come across this situation before and no one has ever shown me how to boost a car before and I've never witnessed it either. I'm honestly wondering how I've gone this long and never encountered it until now! I use an electofisher at work and I know the potential dangers of electricity so I guess out of an abundance of caution, I went straight to worst possible outcome.	1642548390.0	ht8ukdd	t3_s763xo	t1_ht81ai8	/r/AmItheAsshole/comments/s763xo/aita_for_refusing_to_jump_start_my_husbands_car/ht8ukdd/
incd7o3h	Not sure, he hasn’t said what he would do. Don’t want to risk it.	1642548403.0	ht8ulgz	t3_s7asld	t1_ht8tzok	/r/AmItheAsshole/comments/s7asld/wibta_if_i_didnt_pay_back_the_cost_of_a_car_that/ht8ulgz/
d58mnvdd	Thank you! Noted	1642548440.0	ht8uooq	t3_s763xo	t1_ht8qkbt	/r/AmItheAsshole/comments/s763xo/aita_for_refusing_to_jump_start_my_husbands_car/ht8uooq/
incd7o3h	It’s in his name. I hope it does end well.	1642548471.0	ht8urds	t3_s7asld	t1_ht8u4n4	/r/AmItheAsshole/comments/s7asld/wibta_if_i_didnt_pay_back_the_cost_of_a_car_that/ht8urds/
d58mnvdd	Agreed! Thank you	1642548488.0	ht8ustp	t3_s763xo	t1_ht80rv6	/r/AmItheAsshole/comments/s763xo/aita_for_refusing_to_jump_start_my_husbands_car/ht8ustp/
8e9xyep8	NTA  Don't ruin the happiness you have now.	1642548618.0	ht8v49s	t3_s7auhe	t3_s7auhe	/r/AmItheAsshole/comments/s7auhe/aita_fractured_family/ht8v49s/
incd7o3h	The $60,000 car is his, technically so is mine ($38,000 with trade-in). I don’t think he should be buying a new car either.  Would have to consider all the factors of “downsizing” first.	1642548677.0	ht8v9hf	t3_s7asld	t1_ht8u9o3	/r/AmItheAsshole/comments/s7asld/wibta_if_i_didnt_pay_back_the_cost_of_a_car_that/ht8v9hf/
ldpyr	NTA.  She is jealous. And unfortunately social media makes it easy to give into the unhealthy stalking of people we are jealous of. It makes it easy to follow them and keep them in our life bubble.  She is comparing her life to this woman because she feels less than when compared to her, and nothing short of therapy is going to help at this point as it's gone on for so long.   She has become obsessed.	1642550198.0	ht8ywt5	t3_s780sl	t3_s780sl	/r/AmItheAsshole/comments/s780sl/aita_for_siding_with_a_home_wrecker/ht8ywt5/
tu56xn2	I’m a CPA with an MBA and have yet to charge my partner for doing his taxes.	1642550642.0	ht8zyry	t3_s6w22x	t1_ht7tdol	/r/AmItheAsshole/comments/s6w22x/aita_for_not_wanting_to_pay_for_my_gfs_services/ht8zyry/
incd7o3h	I was going to pay 100% for my new car that would’ve been picked because it was in my budget. I do like the car he picked out, only part I don’t like is that the price is something I would’ve never agreed to and that the agreement was that I would pay for what I picked. The car cost $38,000, the new car he bought himself to have as a second car cost $60,000. He himself said it was a gift…  He was very firm in saying that I needed to pay all of it. No room for discussion on that. Entitled for not wanting to pay for a gift that I clearly expressed I didn’t want? Maybe a little bit selfish but it shouldn’t be my responsibility to take the cost of it.	1642550900.0	ht90ktm	t3_s7asld	t1_ht8z8se	/r/AmItheAsshole/comments/s7asld/wibta_if_i_didnt_pay_back_the_cost_of_a_car_that/ht90ktm/
incd7o3h	Officially never accepting a gift again	1642553268.0	ht9686q	t3_s7asld	t1_ht94bc3	/r/AmItheAsshole/comments/s7asld/wibta_if_i_didnt_pay_back_the_cost_of_a_car_that/ht9686q/
5uauezg1	YTA. You typed these horrible quotes you supposedly said here and still have to ask who the A is. It is you.	1642554881.0	ht99ssp	t3_s7d0qr	t3_s7d0qr	/r/AmItheAsshole/comments/s7d0qr/aita_for_making_these_comments_to_my_housemate/ht99ssp/
17v63eg	There's a lot deeper issues going on here than we know about.	1642555521.0	ht9ba3u	t3_s7d462	t3_s7d462	/r/AmItheAsshole/comments/s7d462/aita_for_ripping_my_brothers_wedding_invitation/ht9ba3u/
4ryehr6n	Dude. Do your own dishes. You are an adult. And yes, your language is extremely problematic and immature.   YTA.	1642555605.0	ht9bh33	t3_s7d0qr	t1_ht98cm6	/r/AmItheAsshole/comments/s7d0qr/aita_for_making_these_comments_to_my_housemate/ht9bh33/
gya5jdm	NTA  But I think your mom should have confronted your dad about this two years ago. If she’d said “You gotta do a better job of hiding this stuff next time our kid visits. Make sure that one door is locked and make sure ALL posters with the name of your party are taken down”, then maybe you wouldn’t have had to miss 2 whole years with your dad.  Honestly I can see why your dad would be upset. Leaving a normally-locked door unlocked and leaving up an “only flush toilet paper please” poster with a Google-able name on it could be honest mistakes if he was cleaning the house in a rush. (I’m assuming the cage thing was just a photo you found online.)  To miss two whole years with your kid because one time you cleaned the house in a hurry? That’s awful.  It’s not good that he flew off the handle and called your mom names, but it’s also very not good that your mom waited two whole years to tell him why you weren’t visiting.  As for not wanting to sleep in a bed that someone else has slept in… it’s totally understandable that a 13 year old would feel that way. But realistically, if you’ve ever slept in a hotel bed it’s exactly the same thing.	1642700918.0	hthhvtq	t3_s8lsgt	t3_s8lsgt	/r/AmItheAsshole/comments/s8lsgt/aita_for_refusing_to_go_to_my_dads_house_on_the/hthhvtq/
42wnkux9	YTA, not for what you did or didn’t do, that’s all fine, but you were an insensitive prick about it and your attitude towards pets is just shitty	1642701026.0	hthi6ma	t3_s8oflf	t3_s8oflf	/r/AmItheAsshole/comments/s8oflf/aita_for_telling_bro_that_his_dog_is_not_my/hthi6ma/
f6kjxlxc	Do you have the link please?	1642702101.0	hthl5gm	t3_s8j5cq	t1_hth2yf1	/r/AmItheAsshole/comments/s8j5cq/aita_for_kicking_my_sisters_husband_out_of_my/hthl5gm/
ayop6qnd	AYY I'm famous, hello everyone I am she	1642702111.0	hthl6i7	t3_s7li5d	t3_s7li5d	/r/AmItheAsshole/comments/s7li5d/aita_for_ignoring_my_friend_at_her_birthday_party/hthl6i7/
2llxdvsr	> calls OP racist   > makes racist stereotype of white people	1642702120.0	hthl7fy	t3_s8ibip	t1_htgcum6	/r/AmItheAsshole/comments/s8ibip/aita_for_not_liking_indian_food/hthl7fy/
ayop6qnd	And the guy lied, he's 14	1642702131.0	hthl8gl	t3_s7li5d	t1_hthl6i7	/r/AmItheAsshole/comments/s7li5d/aita_for_ignoring_my_friend_at_her_birthday_party/hthl8gl/
6lqlitcv	YTA yes everybody is responsible for their own actions, but if you are truly their friend then i consider it your responsibility to not take advantage. I mean with that to actually discourage them of playing with so much money.   Most friend groups i know actually don’t keep the money at the end to prevent such situations. They use the money to buy alcohol for the next time.	1642702148.0	hthla7f	t3_s8mtt4	t3_s8mtt4	/r/AmItheAsshole/comments/s8mtt4/aita_for_not_drinking_as_much_as_everyone_else_at/hthla7f/
ayop6qnd	😎 exposed biatch	1642702152.0	hthlajx	t3_s7li5d	t1_hthl8gl	/r/AmItheAsshole/comments/s7li5d/aita_for_ignoring_my_friend_at_her_birthday_party/hthlajx/
u9gnwek	"Get out now. Don’t marry someone who would compare you to rapists and murderers..."  The boyfriend was probably referring to his fellow police officers.	1642702162.0	hthlblp	t3_s8jp2i	t1_htgjp5j	/r/AmItheAsshole/comments/s8jp2i/aita_for_interrupting_at_my_fiances_sleep_and/hthlblp/
7jnj24a3	NAH. Check out r/deadbedroom	1642704103.0	hthqn6t	t3_s8m7qf	t3_s8m7qf	/r/AmItheAsshole/comments/s8m7qf/aita_for_being_upset_with_my_wife_for_telling_me/hthqn6t/
3by8cn4u	A-ha. Once on a 10 hr flight the airline was so smart as to sit my then 8 year old next to a random guy. 2 rows ahead of my husband and other daughter. I was another couple of rows away.   Should I have sucked that up?  As it was they told me I had to talk to the guy. I did. He refused. So I went to talk to the flight attendant and she finally made him move.  My seat was literally the same seat as his but 4 rows back.	1642704211.0	hthqxzj	t3_s8me40	t1_hthmgf3	/r/AmItheAsshole/comments/s8me40/aita_for_asking_for_my_old_airline_seat_back/hthqxzj/
8dmky	Honestly, any time someone needs to say "it's not racist" --- it's racist -- even YOU know it's racist, as otherwise you wouldn't feel the need to preface it; you just don't want to admit to yourself that you are a racist.	1642705105.0	hthtf5d	t3_s8ibip	t1_htgkswj	/r/AmItheAsshole/comments/s8ibip/aita_for_not_liking_indian_food/hthtf5d/
qfefq	If they expect you to put on your "big girls pants" and deal with it, then they can at the very least apologize and own up to their errors.   NTA	1642706206.0	hthwd57	t3_s8nj3g	t3_s8nj3g	/r/AmItheAsshole/comments/s8nj3g/aita_for_refusing_to_go_to_any_family_event_with/hthwd57/
92jjnf7z	Ya i was kinda mixed on this one too, the hypocrisy viewpoint i usually stand by though, so maybe you both just need to talk it out and stop bein assholes to eachother?	1642706210.0	hthwdjq	t3_s8qi2m	t1_hthw38e	/r/AmItheAsshole/comments/s8qi2m/aita_for_being_upset_because_my_sister_is_being/hthwdjq/
emd6jble	Don’t book basic economy flights where you can’t pick seats then.	1642706233.0	hthwfqn	t3_s8me40	t1_hthw8gh	/r/AmItheAsshole/comments/s8me40/aita_for_asking_for_my_old_airline_seat_back/hthwfqn/
36qke8te	I wanna know why ex is giving one of his daughters money but not the other?? They live together most of the time!	1642706237.0	hthwg2p	t3_s8nqkc	t1_hthcw3q	/r/AmItheAsshole/comments/s8nqkc/aita_for_telling_my_ex_to_stop_giving_my_daughter/hthwg2p/
r6v0p	YTA  You're fucking racist. Why would you date an Indian girl if you don't appreciate her culture? and not just that bar her from eating food she grew up with.   YTA YTA YTA	1642706286.0	hthwkqy	t3_s8ibip	t3_s8ibip	/r/AmItheAsshole/comments/s8ibip/aita_for_not_liking_indian_food/hthwkqy/
3mea3id5	ESH. Him for being so irresponsible, of course. But he’s right that the nagging isn’t going to help. Your husband has shown you who he is, so now you can make your choice on how to deal with it. Book the place, take a friend? Maybe go alone? Then decide if this is a recurring issue or a one-off and how you want to deal with it in your relationship.	1642707528.0	hthzwdc	t3_s8qw7v	t3_s8qw7v	/r/AmItheAsshole/comments/s8qw7v/aita_for_wanting_to_go_on_a_holiday/hthzwdc/
plkyryj	They signed an agreement a month before school started and before room assignments were final I made sure everyone would be okay with it. Personally, I wouldn’t want to room with another cat so if it gets registered I’m switching rooms, she’s wanting to do this before.	1642707543.0	hthzxva	t3_s8bjy4	t1_htfcsef	/r/AmItheAsshole/comments/s8bjy4/wibta_if_i_go_to_the_ra/hthzxva/
w8gnn	Daughter is going to be a physical therapist and son is in the running for a scholarship in his Engineering program.   We struggled and my kids did not get knocked up at 16.	1642707563.0	hthzzvs	t3_s89w9f	t1_htg9ogt	/r/AmItheAsshole/comments/s89w9f/aita_for_not_hiring_a_nanny_for_my_granddaughter/hthzzvs/
wf2dv	Info: what exactly is he calling the girls as nicknames? Cuz calling another women honey, sweetheart, sweet cheeks is completely different than calling them squirt, red, tiger.   I’m all about respect and especially respecting when your in a relationship and having boundaries, but I also never heard of the rule where if you’re in a relationship, it’s inappropriate to call someone nicknames. He does it to everyone including guys and you say it yourself, that it’s not in a flirtatious way so I feel like you’re making this an issue when it’s not.	1642707614.0	hti04rg	t3_s8m8fz	t3_s8m8fz	/r/AmItheAsshole/comments/s8m8fz/aita_for_asking_my_husband_to_not_call_other/hti04rg/
plkyryj	If she gets it approved I’m moving? I just don’t feel comfortable with it here before then, when it’s not even allowed to be here and could hurt my cat.	1642707627.0	hti0631	t3_s8bjy4	t1_hthxwkq	/r/AmItheAsshole/comments/s8bjy4/wibta_if_i_go_to_the_ra/hti0631/
ezm9ojtg	YTA. either give him the time off, unpaid. or you’re probably going to lose an employee. how are you this heartless	1642707640.0	hti07bf	t3_s8mhuh	t3_s8mhuh	/r/AmItheAsshole/comments/s8mhuh/aita_for_not_wanting_to_give_my_employee_time_off/hti07bf/
plkyryj	If her cat acts fine around him I don’t care if she has the cat. I just don’t want anything to happen to mine	1642708563.0	hti2qwe	t3_s8bjy4	t1_hti2iuy	/r/AmItheAsshole/comments/s8bjy4/wibta_if_i_go_to_the_ra/hti2qwe/
12bcsz	But it isn't just 1 day, she never let's her sister visit and she's gone to college where her sister can't see her at all	1642708575.0	hti2s3e	t3_s8i1f5	t1_hthb1mh	/r/AmItheAsshole/comments/s8i1f5/aita_for_not_wanting_my_12yo_sister_to_visit_me/hti2s3e/
k1a6f	I'm going to side with you that he seems to have some commitment issue. Maybe there is another underlying stress. You did say these fights were marriage ending, right? Maybe that's the insecurity. Sounds like you two need to cool off a bit and you gotta drop it for a few months.	1642708616.0	hti2wa6	t3_s8qw7v	t1_hti0nw5	/r/AmItheAsshole/comments/s8qw7v/aita_for_wanting_to_go_on_a_holiday/hti2wa6/
12bcsz	You said you think it's because she's jealous. But it's more likely that she wants to visit you considering you're siblings and gone for college	1642708669.0	hti31gw	t3_s8i1f5	t1_hti2m22	/r/AmItheAsshole/comments/s8i1f5/aita_for_not_wanting_my_12yo_sister_to_visit_me/hti31gw/
618eg8v9	Absolutely NTA it's understandable how uncomfortable it would be to tell him yourself since that kind of business is none of your business. Well he should have done better concealing his guilty pleasures from you.	1642716967.0	htioh4e	t3_s8lsgt	t3_s8lsgt	/r/AmItheAsshole/comments/s8lsgt/aita_for_refusing_to_go_to_my_dads_house_on_the/htioh4e/
itbhmz4p	Personally, I think re-homing my dog completely is a lot worse than him leaving his dog with his parents, who his dog spends most of his time with anyway due to my husband traveling during the week for work. Maybe my opinion but I won’t rehome my dog when his dog already has a home.	1642716967.0	htioh71	t3_s8txcb	t1_htilee2	/r/AmItheAsshole/comments/s8txcb/aita_for_getting_upset_that_my_22m_husband_23m/htioh71/
12bcsz	Obviously it's not black and white, it's an analogy.  His friends are drunk making bad decisions. He's sober and taking advantage of those bad decisions because they benefit him. Any good friend wouldn't let their friends continue.  Saying they could've not drank is stupid. Just like telling someone that was raped that they shouldn't have drank is stupid.	1642716969.0	htiohcv	t3_s8mtt4	t1_htinztm	/r/AmItheAsshole/comments/s8mtt4/aita_for_not_drinking_as_much_as_everyone_else_at/htiohcv/
b3nvi0f	As a foreigner that moved to the us a couple years ago and has been dating a chicana for the past year... I've noticed Americans seem to have a sort of idea about race and culture that to them is all-encompassing across the world. To Americans there are only a handful of "races" and everyone falls inside that category in one way or another.   To me I'd say its this:  White = anglo-germanic / European  Latino = a mestizo from Mexico or Puerto Rico  Brown/Middle eastern = Greeks, arabs, Persians, central   Asians, and even INDIANS fall under this category it seems  Black = anyone who has any African blood (even just a tiny bit)  Asian = any east Asian (Japan, Indonesia, Philippines, Korea)  To me (in my experience) most Americans don't really seem to understand that the world is much more complicated than that outside of the us and if someone doesn't easily fall into one of those categories they'll be all confused and ask why you're not the stereotypical example of that category??	1642717000.0	htiokhl	t3_s8rf1r	t3_s8rf1r	/r/AmItheAsshole/comments/s8rf1r/aita_for_refusing_to_embrace_africanamerican/htiokhl/
6nrwwn3	It was in Frankfurt Germany!	1642717865.0	htipmlc	t3_s8rf1r	t1_htikp22	/r/AmItheAsshole/comments/s8rf1r/aita_for_refusing_to_embrace_africanamerican/htipmlc/
gsenc7zz	NTA. I'm actually crying reading this and that is very very unlike me. You were neglected, abandoned and now they have the audacity to expect this of you? Fuck them.  What has your aunt said about this?	1642717936.0	htipqmn	t3_s8nj3g	t3_s8nj3g	/r/AmItheAsshole/comments/s8nj3g/aita_for_refusing_to_go_to_any_family_event_with/htipqmn/
ldpyr	ESH.  Especially your husband. He needed to put a hard stop to this behavior right away. Him letting it slide is what let it get to this point where you had to step in and make yourself look bad.	1642718086.0	htipyqq	t3_s8smfk	t3_s8smfk	/r/AmItheAsshole/comments/s8smfk/aita_for_telling_my_husbands_female_friend_he/htipyqq/
a8vel	Ok, so both your mom and your wife are unwell. Neither of them should be behaving that way, but your mothers poor behavior does not negate your wife’s also horrible behavior.   They are both mentally unwell, but I really think you are ignoring the fact that this problem wasn’t just a mom problem: your wife played a huge part. For your daughters sake (so she doesn’t grow up thinking that type of behavior is acceptable) I highly encourage you to get your wife into therapy. You said she cries hysterically at the drop of a hat. That is NOT healthy and it’s NOT a healthy environment for your daughter.	1642718343.0	htiqbt2	t3_s8juj7	t1_htilqpf	/r/AmItheAsshole/comments/s8juj7/aita_for_blowing_up_at_my_wife_for_giving_my/htiqbt2/
3hc9z426	Time to move on and find another girl. Before you do though please share her only fans link.	1642718454.0	htiqint	t3_s8tw9a	t3_s8tw9a	/r/AmItheAsshole/comments/s8tw9a/aita_for_not_wanting_my_girlfriend_to_do_onlyfans/htiqint/
12bcsz	I think you're forgetting that these are his friends. Taking advantage of your friends is shitty, regardless of they led themselves into that situation or not	1642718506.0	htiqm8x	t3_s8mtt4	t1_htiqa4q	/r/AmItheAsshole/comments/s8mtt4/aita_for_not_drinking_as_much_as_everyone_else_at/htiqm8x/
4e71tg2	I’m not going back and forth with someone who clearly does not understand systemic racism. If that child looks black, they will be treated as every other black person in the US. Take it up with racists, not me.	1642718597.0	htiqsyi	t3_s8rf1r	t1_htilpck	/r/AmItheAsshole/comments/s8rf1r/aita_for_refusing_to_embrace_africanamerican/htiqsyi/
inh0i3l	idk the title says left my kids home alone so I'm not gonna assume anything which is why i asked for clarification in the first place...	1642718713.0	htir206	t3_s8tld9	t1_htiqtk1	/r/AmItheAsshole/comments/s8tld9/aita_because_i_left_my_kids_home_alone/htir206/
12bcsz	You cant be this dumb. It's not a decision relating to poker, and they're not opponents they're friends. And I never compared rape to gambling, I compared taking advantage of a drunk person to have sex with them to taking advantage of a drunk person to take their money.	1642718758.0	htir5n2	t3_s8mtt4	t1_htiqulg	/r/AmItheAsshole/comments/s8mtt4/aita_for_not_drinking_as_much_as_everyone_else_at/htir5n2/
i0ppijif	NTA  I don't care what kind of neighborhood it is, lock your damn doors people.	1642720191.0	htiukx1	t3_s8ufs8	t3_s8ufs8	/r/AmItheAsshole/comments/s8ufs8/aita_for_expecting_my_roommate_to_lock_the_door/htiukx1/
d0d62ks2	NTA.  You feel how you feel.  You don't want your neglectful parents in your life, that is completely acceptable	1642720290.0	htiutn0	t3_s8oem6	t3_s8oem6	/r/AmItheAsshole/comments/s8oem6/aita_for_telling_my_parents_they_put_all_their/htiutn0/
