author	body	created_at	c_id	s_id	p_id	permalink
2xjirbh5	> 7 years  > small age gap  Looks at myself (24) and my youngest sister (17)  Right....   Also OP, why have another kid if you were going to treat her like this?	1640870045.0	hqjjd0c	t3_rryjz3	t1_hqj6g86	/r/AmItheAsshole/comments/rryjz3/aita_for_telling_my_daughter_to_get_over_herself/hqjjd0c/
16j9q5	When I went through a very dark space in the beginning of my marriage, I shut my wife out. I thought I was protecting her from my pain also, when in reality I was hurting her very deeply because she wanted to help me and I pushed her away.   She didn't cry because of your pain, man. She cried because she loves you, and you refused to let her help you.	1640870064.0	hqjje2q	t3_rrps6d	t1_hqhxegi	/r/AmItheAsshole/comments/rrps6d/aita_for_not_wanting_my_brother_to_bring_my_ex/hqjje2q/
gxcvpwvw	YTA You want to back out because financial reason thats fine, but it seems like you are just using that and the real reason is in your words the novelty has wore off.	1640870243.0	hqjjp9x	t3_rs122s	t3_rs122s	/r/AmItheAsshole/comments/rs122s/wibta_for_backing_out_of_being_a_bridesmaid_at_my/hqjjp9x/
4vri0a47	YTA.	1640870255.0	hqjjq0j	t3_rs1hvd	t3_rs1hvd	/r/AmItheAsshole/comments/rs1hvd/aita_for_not_paying_a_restaurant_for_a_pepsi_i/hqjjq0j/
3u8b8yzi	Am I the only one who thinks OP needs to work on himself a little, okay a LOT, before he deserves her? It is **not her job** to fix him. What happens when his Mom gets  sick or his dog gets run over? His issues have not been resolved, he doesn’t get the happy ending yet.	1640870629.0	hqjkdkg	t3_rrps6d	t1_hqhsw61	/r/AmItheAsshole/comments/rrps6d/aita_for_not_wanting_my_brother_to_bring_my_ex/hqjkdkg/
5rg6cnn1	How many people have woken up screaming in this room before Kara? Why did the twins refuse to go near the bed/sleep in that room? Sounds like you need to safe that room - there’s some bad energy in there.	1640872275.0	hqjnf89	t3_rs0z3c	t3_rs0z3c	/r/AmItheAsshole/comments/rs0z3c/aita_for_making_my_daughter_get_up_at_3am/hqjnf89/
7e60b7rc	NTA, that really sucks from your brother. But to echo everyone else here GO GET YOUR WIFE!! I can only speak for myself, but my boyfriend who I’m *desperately* in love with had an abusive childhood and severe depression the last few years; we wound up involuntarily separated due to COVID for more than a year and he would barely speak to me, tell me everything was fine even though I knew it wasn’t, etc etc- it was rough. But not nearly as rough as when he broke up with me because he thought it would spare me somehow from having to suffer with his depression. I worried about him ALL THE TIME, and the fact that I knew he was going through it alone made it even worse. I didn’t need to be protected I needed him. Your wife clearly needs you too and has waited all this time for you, I hope you listen to all the Reddit people and reach out to her ♥️ also sending you a big hug for everything you’ve been though, and still managing to be a support for your bro, don’t underestimate yourself	1640872406.0	hqjno9o	t3_rrps6d	t3_rrps6d	/r/AmItheAsshole/comments/rrps6d/aita_for_not_wanting_my_brother_to_bring_my_ex/hqjno9o/
7rjgeuo	NTA	1640873811.0	hqjqhl8	t3_rrwt05	t3_rrwt05	/r/AmItheAsshole/comments/rrwt05/aita_for_taking_my_sisters_money_house/hqjqhl8/
7rjgeuo	NTA	1640873815.0	hqjqhwk	t3_rrc2ok	t3_rrc2ok	/r/AmItheAsshole/comments/rrc2ok/aita_for_ordering_a_drink_on_a_separate_tab/hqjqhwk/
geuluzbw	NTA you do you honey! You didn’t make those kids, your mama did. Some mom she is though, can’t even stand up for her kids.	1640874097.0	hqjr2zs	t3_rrutpm	t3_rrutpm	/r/AmItheAsshole/comments/rrutpm/aita_for_leaving_my_half_siblings_without_child/hqjr2zs/
dd2qcxe4	I wonder if the people here are just as disgusted by circumcision as they are baby ear piercings.	1640874126.0	hqjr597	t3_rs1qmi	t3_rs1qmi	/r/AmItheAsshole/comments/rs1qmi/aita_for_getting_my_daughters_ears_peirced/hqjr597/
gyl506ec	YTA And the way you write makes you seem bothered even if you say it doesn't	1640875637.0	hqjud88	t3_rs3596	t3_rs3596	/r/AmItheAsshole/comments/rs3596/aita_for_telling_my_best_friend_that_hes_still/hqjud88/
eioje	YTA - who proposes to someone they’re not even in a relationship with?!   You say you’re not creepy/obsessed but you’re still obsessing over it three years later. I know this is an overused comment on Reddit but I really think you need to see someone about your mental health if you’re still this upset over it years later.	1640875672.0	hqjufzz	t3_rs39ci	t3_rs39ci	/r/AmItheAsshole/comments/rs39ci/aita_for_loving_a_girl/hqjufzz/
knigg	Dudes just reminiscing about the fun times in his life.  Memories are what make us human.  I understand how it can get under a 3rd parties skin but if this is something they can’t handle between themselves then they don’t have much of a chance.	1640875735.0	hqjukxq	t3_rs2qxu	t1_hqjsxb7	/r/AmItheAsshole/comments/rs2qxu/aita_for_telling_my_boyfriend_i_no_longer_feel/hqjukxq/
amlj6v2	YTA  1: Babies should not be getting their ears pierced. It's not even in your culture so there's not even that to hide behind.  2: You went behind your husband's back to do this knowing he wasn't in agreement with you.  3: You tried to blame your mother.  You are awful and you are the asshole.	1640875785.0	hqjuoxa	t3_rs1qmi	t3_rs1qmi	/r/AmItheAsshole/comments/rs1qmi/aita_for_getting_my_daughters_ears_peirced/hqjuoxa/
ypna5r1	ESH You definitely have every right to dress your baby as you like and you MIL does not get a say in this. Also I don't believe in this "Boy clothes" and "Girl clothes" thing. However, you called the clothes that MIL gave as "ugly" which honestly is a thing somebody with an agenda would say, just because you dislike a style of clothing, doesn't make it ugly. Imagine if somebody did not like your style and chose to call it "ugly", how would you feel? You both blew up instead of actually addressing the matter like adults and putting forth your point of view, so yes you are both TA for being immature over a bunch of clothes and colours which doesn't matter any which way.	1640875788.0	hqjup6z	t3_rrpb9w	t3_rrpb9w	/r/AmItheAsshole/comments/rrpb9w/aita_for_dressing_my_daughter_in_boys_clothes/hqjup6z/
e7z24e0	YTA, no question about it. But it does concern me you don't seem to even be trying to understand *why* YTA.   Also, you don't get to be dismissive and cavalier about 'oh it's only piercing' and also act like it was SO important that you couldn't wait a while for your husband to answer. Like, it's either a big deal or it's not.  Also, you behaved in an extremely disrespectful and untrustworthy way. So of course he doesn't trust you.	1640876877.0	hqjx457	t3_rs1qmi	t1_hqjpkvs	/r/AmItheAsshole/comments/rs1qmi/aita_for_getting_my_daughters_ears_peirced/hqjx457/
bu826wca	Wait I'm extremely confused. Why do you think your Man is a narcissist?	1640876886.0	hqjx4vb	t3_rrwm8m	t3_rrwm8m	/r/AmItheAsshole/comments/rrwm8m/aita_for_only_donating_blood_with_my_nan_in_mind/hqjx4vb/
4mj1ovx6	YTA. If I was your spouse I would remove the earrings.	1640876895.0	hqjx5n7	t3_rs1qmi	t3_rs1qmi	/r/AmItheAsshole/comments/rs1qmi/aita_for_getting_my_daughters_ears_peirced/hqjx5n7/
hftv3ten	I think the mods have removed my post. Is it still on the forum?	1640876962.0	hqjxb35	t3_rs3sm3	t1_hqjx808	/r/AmItheAsshole/comments/rs3sm3/aita_for_declining_an_invitation_to_see_a_musical/hqjxb35/
hftv3ten	Do you think they don't like it because I haven't presented both sides equally?	1640877899.0	hqjzgjp	t3_rs3sm3	t1_hqjy8l5	/r/AmItheAsshole/comments/rs3sm3/aita_for_declining_an_invitation_to_see_a_musical/hqjzgjp/
hlbfpcsx	NTA.  Of course their opinion is important. They will be moving in soon anyway. Grandchildren will need some qualified parenting, not that loser like you.  And why the fuck you are not in the kitchen?	1640877926.0	hqjzit0	t3_rrxhkf	t3_rrxhkf	/r/AmItheAsshole/comments/rrxhkf/aita_for_giving_my_fiancé_permission_to_make_an/hqjzit0/
9yhr8dje	I was about to say NTA because it's her body her choice. Then I read that she's an infant and she has no idea what just happened. YTA	1640878045.0	hqjzsps	t3_rs1qmi	t3_rs1qmi	/r/AmItheAsshole/comments/rs1qmi/aita_for_getting_my_daughters_ears_peirced/hqjzsps/
hxxv10g0	So you’re correct! I never went to Japanese school, but I have a cousin that does. From elementary and middle school is mandatory for students to learn English, but it’s very basic stuff. I’m not sure about high school, but maybe it’s the same? Similar to American school systems, most high schools require us to take a language class and achieve certain amount of credits. That doesn’t mean all students will become fluent in that select language they learned. Just like how not all Japanese kids will be fluent in English because they learned a bit in school.   One of the things I learned from another friend of mine learning English. She has a difficult time speaking (she has a heavy accent and her vocabulary isn’t really high) and understanding people because people talk fast (that’s how it feels to her). I feel like learning languages takes a lot of time and to get to the point of being fluent takes more than a basic classes in school. In the defense of my friends girlfriend.   Anyways I do see them struggling to speak to each other, but I usually see them whip out their phones and communicate through google. So at least they have that for now.   > I think it’s also possible that someone in this chain of events is not completely forthright.   You mean my friend (the bf)?	1640878127.0	hqjzzij	t3_rs3hv1	t1_hqjxzjz	/r/AmItheAsshole/comments/rs3hv1/aita_23f_for_not_wanting_to_be_the_translator_for/hqjzzij/
hg5bswa4	No, her husband HADN'T said he didn't like it yet; he hadn't given OP an answer at all. Only after the deed was done did he say anything about it at all.	1640879210.0	hqk2kqa	t3_rs1qmi	t1_hqk1tv3	/r/AmItheAsshole/comments/rs1qmi/aita_for_getting_my_daughters_ears_peirced/hqk2kqa/
hxxv10g0	Well it’s not uncommon for Americans (military) get into relationships with local women in whatever country they’re stationed in. Personally, I don’t think I could get into a relationship with someone due with a language barrier. Just my preference, seems really stressful.  > relies on a third party   That’s where it bothers me, both of them aren’t actively try to learn each other’s languages. Plus, she’s not really nice to be around either… I didn’t even know about the invite situation until after it happened (heard from our mutual friends). I literally don’t want to have anything to do with her. My friend isn’t a bad guy, but I really don’t appreciate trying to put me in between their drama. I have distanced myself between them already, but I do occasionally see them whenever we hang out in a group with our mutual friends.	1640879236.0	hqk2n08	t3_rs3hv1	t1_hqk1f7q	/r/AmItheAsshole/comments/rs3hv1/aita_23f_for_not_wanting_to_be_the_translator_for/hqk2n08/
5jkdtpp0	YTA  Your husband is right. You did go behind his back and betray his trust, and worse, with regards to the well-being of your child. How will he trust you after this?   As for your mother, that's horrible advice she gave you, and the sort that will destroy your marriage. Women are not powerless any more, and so manipulation and deceit are horrible leftovers from an awful system that no longer have a place in a healthy relationship today. Also, we know better today about respecting babies'/children's rights and safety.    Is this the person you want to be, OP? Someone who cannot be trusted to honour her partner's role and wishes, who cannot be trusted with her child's well-being and safety, and who goes behind her partner's back to get her own way?	1640879240.0	hqk2nbx	t3_rs1qmi	t3_rs1qmi	/r/AmItheAsshole/comments/rs1qmi/aita_for_getting_my_daughters_ears_peirced/hqk2nbx/
gbhsr	Who wants to bet it's not even there? She probably spent it all years ago but still plans to use it to dangle over your head for eternity.	1640879256.0	hqk2orc	t3_rriaju	t1_hqjae9q	/r/AmItheAsshole/comments/rriaju/aita_for_telling_my_mum_to_not_come_into_my/hqk2orc/
hxxv10g0	You know I never thought about that as a possibility! More of a reason why I don’t want to be in between their drama.	1640879285.0	hqk2rcb	t3_rs3hv1	t1_hqk1zew	/r/AmItheAsshole/comments/rs3hv1/aita_23f_for_not_wanting_to_be_the_translator_for/hqk2rcb/
9yhr8dje	Victims do need to prove their abuse if they want everyone around them to be morally obligated to believe them. By automatically believing someone who says they're the victim you do realize this hurts the falsely accused, right? Do you not think false accusations exist or do you just not care?	1640879383.0	hqk2zxd	t3_rrwzqj	t1_hqjs1da	/r/AmItheAsshole/comments/rrwzqj/aita_for_inviting_someone_who_was_allegedly/hqk2zxd/
b4l6un3o	YTA  As someone whose ears were pierced as a baby (for cultural reasons), and who was happy about it, still YTA! It’s not cool to try a “cool new experience” that could be harmful to your baby behind the other parent’s back. And did you even ensure it was done safely?  The fact that you got this done behind your husband’s back and then tried to blame your mother? And then acted like being the mother made your opinion better? You really suck for that.	1640879446.0	hqk35ly	t3_rs1qmi	t3_rs1qmi	/r/AmItheAsshole/comments/rs1qmi/aita_for_getting_my_daughters_ears_peirced/hqk35ly/
jtmol	ETA but you're the larger one here.  If it was that important then you shouldn't have waited weeks for him to bring it up again.  Instead you decided to go behind his back?  If you two can't communicate like adults about the simplest of thing then you probably shouldn't have brought a child into this world.  But now that you have, get counseling ASAP.    A normal relationship would discuss the pro's and con's and make a decision.  With my daughter I thought it would be better doing it when she wouldn't remember the pain while my wife wanted to use it as a award for doing good in school later in life.   Never once did I think, 'screw that I'm going to do it anyway'.    The only reason I give your hubby the A is because he did drag his feet about the issue.  I don't know why but your solution was not the correct response to his.  You get the primary A for 1. going behind his back, 2. listening to your mom over your husband and 3. thinking you have more say over your kids than your husband.    Get some group counseling, stat...	1640880451.0	hqk5lzf	t3_rs1qmi	t3_rs1qmi	/r/AmItheAsshole/comments/rs1qmi/aita_for_getting_my_daughters_ears_peirced/hqk5lzf/
aqqaj1fu	I hope your wife sees this and divorces you for hating your own child and being a horrible father.	1640880501.0	hqk5qik	t3_rs0z3c	t1_hqjie0s	/r/AmItheAsshole/comments/rs0z3c/aita_for_making_my_daughter_get_up_at_3am/hqk5qik/
3yb1sorc	Years ago my parents traveled back and forth from their retirement home to their old home 2 states over. I happened to live in between their two homes so when they traveled to and from, they’d spend the night to rest. It was about a 16 hr drive for them. My dad asked for my house key so in case they arrived and I was at work or out and about, they could let themselves in. (This happened prior to cell phones) One day my husband and I returning home from being out, saw my dad’s car in the driveway. Immediately I thought, oh crap, did I clean up? Is there a mess? Is the bathroom clean? I felt like when you’re a kid and parents get home and you haven’t finished your chores. When I went in the house my parents were sitting in the living room watching tv. I asked why didn’t they call to let me know they were coming and they just shrugged it off. I told them to please call ahead in the future. They never did. Later we moved in to military housing on base. My dad asked for they key but this time I had a great excuse. Guests on the base require a sponsor, I have to escort them on, where they must register their vehicle and issued a pass for a day or two. My dad wasn’t happy about that. But it turned out worse for me. They still wouldn’t call ahead so I’d get a phone call at work that they were waiting across the street from base at a gas station. I would have to leave work to go sponsor them on base (long process, wait in a line with others sponsoring their guests where military police would then write down all their info (drivers license/proof of insurance) and finally issue the pass. Then I’d have to rush back to work. Sometimes I couldn’t leave work and I’d have to call my husband to go sponsor them in. They did this for 6 yrs while we lived on base. I should have set boundaries early on. My dad was a snoopy person. He would go into my sister’s house and look through her mail and around the house. My sister asked for the key and it caused some tension but that was on them, not her. I regret not standing firm, after all it was my home.	1640880541.0	hqk5u3g	t3_rrjhmz	t3_rrjhmz	/r/AmItheAsshole/comments/rrjhmz/aita_for_giving_my_mil_a_fake_copy_of_my_house/hqk5u3g/
5nlsrfj2	Forget she is their mother and have her husband drive them to grandma's, like she is doing now and like she has done so far. At least the 2 oldest have a decent father....   YTA OP your daughter was right, you should have another kid, you are already a shitty mother to the two kids you already have, now you will just be a bad mom for 3.	1640880602.0	hqk5zge	t3_rs4pj4	t1_hqk4r41	/r/AmItheAsshole/comments/rs4pj4/aita_for_not_wanting_my_kids_to_visit_their_new/hqk5zge/
7jnj24a3	NAH. She may have a point but so do you. Hygiene is important.	1640881534.0	hqk8bbl	t3_rs4y9h	t3_rs4y9h	/r/AmItheAsshole/comments/rs4y9h/aita_for_telling_my_gf_her_moldy_toothbrush_is/hqk8bbl/
89j1kycq	Its very unusual to see anyone actively championing racism like the person you responded to.  Sadly, what you are talking about is easily dismissed by people who have never experienced it. A subset of 'If i dont understand it, it must be simple / trivial'	1640881580.0	hqk8fho	t3_rs5dex	t1_hqk7v3m	/r/AmItheAsshole/comments/rs5dex/aita_for_making_a_racist_meme_about_my_teacher/hqk8fho/
4wortdmt	INFO because I want to see that I understand everything correctly.  The student council came up with “janitor day” to thank the janitors, Mrs. Smith got butthurt about it because she felt more attention should be paid to the teachers. You make a meme about Custer’s last stand, only replacing Mrs. Smith for Custer and her “last stand” being this whole janitors day situation. The school finds out about the meme because they think it makes them look bad and because you changed Native American chiefs into (I’m assuming white) Mrs. Smith, which they took to be racist?   If I am following the story correctly, I guess I’d say NTA per se, but you probably should take the memes down before more trouble is caused.	1640881663.0	hqk8mux	t3_rs5dex	t3_rs5dex	/r/AmItheAsshole/comments/rs5dex/aita_for_making_a_racist_meme_about_my_teacher/hqk8mux/
eklcqzl7	Lol, you can't replace sex with a dildo.	1640881724.0	hqk8sg7	t3_rs5jmt	t1_hqk8juc	/r/AmItheAsshole/comments/rs5jmt/aita_f26_for_wanting_to_reduce_my_bf_m28_to_fwb/hqk8sg7/
gaedj	My guess is OP only gets off on sexually assaulting prepubescent children and had no use for Kara once she developed breasts. Hence why they didnt have another until she was 12.	1640882816.0	hqkbldz	t3_rs0z3c	t1_hqk3cqx	/r/AmItheAsshole/comments/rs0z3c/aita_for_making_my_daughter_get_up_at_3am/hqkbldz/
msbvt	Your last paragraph is just conjecture from the most biased OP I have ever seen on this sub. Had he offered her the house at cost, she'd very likely accept, as any sane human would.	1640882849.0	hqkboim	t3_rrdti6	t1_hqk1iy2	/r/AmItheAsshole/comments/rrdti6/aita_for_making_my_dads_girlfriend_pay_rent_when/hqkboim/
3euu7wbv	I get the joke but it's still not funny. If you promote a racist, you're going to come across as racist.	1640882852.0	hqkbos3	t3_rs5dex	t1_hqkak1f	/r/AmItheAsshole/comments/rs5dex/aita_for_making_a_racist_meme_about_my_teacher/hqkbos3/
43eo47ym	YTA - I did a similar thing when my daughter was three. My husband was hesitant to allow me to take her to get her ears pierced before she was old enough to really choose for herself and take care of them properly. I took advantage of his hesitation and took her to get it done. He was rightfully angry that I went ahead with it, and it took some time to rebuild trust. I ended up taking the piercings out and letting them heal, and my daughter eventually chose to get them done when she was 14. The only reason we came away from that moment in tact is because I acknowledged that I was in the wrong and didn’t try to shift blame or justify my actions. I was the AH in that situation and you are the AH in this one.	1640882949.0	hqkbxyh	t3_rs1qmi	t3_rs1qmi	/r/AmItheAsshole/comments/rs1qmi/aita_for_getting_my_daughters_ears_peirced/hqkbxyh/
4bp3vb1a	Sorry, but what does WIBTA and YWNBTA stand for?	1640882984.0	hqkc16h	t3_rrzkn4	t3_rrzkn4	/r/AmItheAsshole/comments/rrzkn4/wibta_if_i_complained_to_friends_about_paying_for/hqkc16h/
c9xegvji	NTA.  If it's not something you ever plan to a t on, then it's not relevant, and there's no real need to share it.  That being said, you stated you are actively engaged in demi communities online. For what purpose?	1640883002.0	hqkc2t6	t3_rs5ut8	t3_rs5ut8	/r/AmItheAsshole/comments/rs5ut8/aita_for_not_telling_my_husband_that_im_demisexual/hqkc2t6/
3euu7wbv	YTA. You're taking offense to something that wasn't meant to be offensive. Being silent in class is usually not a problem, but sometimes it's caused or influenced by certain factors. They were just concerned and tried to communicate that.	1640884181.0	hqkf5sj	t3_rs63qx	t3_rs63qx	/r/AmItheAsshole/comments/rs63qx/aita_for_telling_my_sons_teachers_to_stop/hqkf5sj/
hjdmy	TRIGGER WARNING UNPOPULAR OPINION: I like being circumcised.   Definitely glad I don’t remember it at all vs wanting to do it as an adult and actually remembering it happening.   It shouldn’t be a big deal but many people actually do make a big deal over whether someone has foreskin or not. I’m happy not having it and would have definitely chosen to get it if I wasn’t already.	1640884182.0	hqkf5us	t3_rs1qmi	t1_hqk0fxr	/r/AmItheAsshole/comments/rs1qmi/aita_for_getting_my_daughters_ears_peirced/hqkf5us/
x2fj5	>I'm the mother and my opinion does have heavier weight than his to some degree.  How would it make you feel if Dad said this?   YTA.	1640884198.0	hqkf7e7	t3_rs1qmi	t3_rs1qmi	/r/AmItheAsshole/comments/rs1qmi/aita_for_getting_my_daughters_ears_peirced/hqkf7e7/
rsh67l2	You shouldn’t assume everyone wants kids…	1640885134.0	hqkhpf3	t3_rrjhmz	t1_hqgxovj	/r/AmItheAsshole/comments/rrjhmz/aita_for_giving_my_mil_a_fake_copy_of_my_house/hqkhpf3/
3u8b8yzi	Your friend doesn’t want to bang the waitress, the gym girls, or *you*. Get over it. YTA.	1640885214.0	hqkhx5n	t3_rs3596	t3_rs3596	/r/AmItheAsshole/comments/rs3596/aita_for_telling_my_best_friend_that_hes_still/hqkhx5n/
42ffd7za	>permanently modify a child’s body  It's not a tattoo. THAT permanently modifies a body in case you don't know. With a pair of earrings you take them out, and at most the child may have a little dot on their ear lobe. Hardly a noticiable modification.    I wonder how many critics here in the post are sitting around with whole sleeves, thighs, backs etc tatted? And how many started when they were underage, w/out parental consent?	1640885223.0	hqkhy1v	t3_rs1qmi	t1_hqkdhds	/r/AmItheAsshole/comments/rs1qmi/aita_for_getting_my_daughters_ears_peirced/hqkhy1v/
3ko8yplt	I was a bit hung up on that was well. They're married, so it should be their vacation home right? Only she clearly considers it to be his.	1640885251.0	hqki0ox	t3_rs65vg	t1_hqke3zm	/r/AmItheAsshole/comments/rs65vg/aita_for_telling_the_wife_of_my_husbands_friend/hqki0ox/
73dxq	*Trina, Jennifer Lopez, four kids*  *And I gotta take all they bad ass to ShowBiz?*  *Okay, get your kids, but then they got their friends*  *I pulled up in the Benz, they all got up in*  *We all went to Den and then I had to pay*  *If you fuckin' with this girl, then you better be paid*	1640886405.0	hqkl3ch	t3_rs71rq	t3_rs71rq	/r/AmItheAsshole/comments/rs71rq/aita_for_telling_my_girlfriend_that_i_will_no/hqkl3ch/
ghao447k	I cant wake up from nightmares unless I scream awake. I have 5 sleep disorders, 4 trauma disorders. But sure Asshole dad. Uour kid is doing it intentionally. You should fuck off you obviously favor your precious "twins" more. I hope you realize that kid will grow to hate YOU.	1640886444.0	hqkl6zl	t3_rs0z3c	t3_rs0z3c	/r/AmItheAsshole/comments/rs0z3c/aita_for_making_my_daughter_get_up_at_3am/hqkl6zl/
2zq9x993	YTA. You are punishing your daughter for something she can’t control, no matter how much you think she can. You say she had no trauma? Of course she does, you’re her dad! I don’t say this lightly, but from your post and responses, you seem to be a truly evil person.	1640886470.0	hqkl9h4	t3_rs0z3c	t3_rs0z3c	/r/AmItheAsshole/comments/rs0z3c/aita_for_making_my_daughter_get_up_at_3am/hqkl9h4/
8rb9ynmn	OP literally can tell other people what to do here, though... many social media sites have reporting options for photos of you that you don't give permission to be posted. They can take them down themselves, or report them and the sites can do it for them instead. It's not cool to post photos of someone that they don't want. Taking photos ≠ posting photos.	1640887731.0	hqkoluo	t3_rs4ghl	t1_hqkjlz2	/r/AmItheAsshole/comments/rs4ghl/aita_for_not_allowing_an_ex_friend_to_post_photos/hqkoluo/
16j9q5	Then why did you feel comfortable "giving tough love" since you don't want to make an effort to deliver it properly?	1640887751.0	hqkonp5	t3_rs3596	t1_hqkg0oh	/r/AmItheAsshole/comments/rs3596/aita_for_telling_my_best_friend_that_hes_still/hqkonp5/
