author	body	created_at	c_id	s_id	p_id	permalink
3ejjm	This is so epically based and he doesn't even know it.   If men and women have kids, the father has to pay for it and the mother cannot kill it.   I don't think the left even knows what reality is anymore.	1642927701.0	htuyjqf	t3_saktm1	t3_saktm1	/r/Anarcho_Capitalism/comments/saktm1/what_do_you_think_of_this/htuyjqf/
bxkwye1i	It's hard to beat the efficiency of enslaving the population, for a short time at least.	1642928785.0	htuzy3p	t3_sa02on	t1_httbyic	/r/Anarcho_Capitalism/comments/sa02on/what_communism_does_to_a_country/htuzy3p/
ijfzw7ug	Do you have to eat with your mask on there?	1642937500.0	htvb7el	t3_sanuy0	t3_sanuy0	/r/Anarcho_Capitalism/comments/sanuy0/a_rebuttal_to_the_freedumb_lovers_out_there/htvb7el/
9dfdbkk1	You should’ve been more cautious about who you spread your legs for	1642939208.0	htvdfm1	t3_saktm1	t1_htuka4j	/r/Anarcho_Capitalism/comments/saktm1/what_do_you_think_of_this/htvdfm1/
bxkwye1i	This seems like an own-goal. It establishes that a duty of care begins at conception, and it's not so far from that to a pro-life stance.   Once born, most people believe the parents are duty-bound to care for the child or keep it safe until they can hand care to somebody else. In other words, the baby has a claim to use their parents' bodies in a certain way.   Using a part of the body that evolved to care for the fetus is not the same as being a parasite or having an organ forcibly extracted (two common pro-choice arguments).   This could also be extended to people who smoke, drink or abuse drugs during pregnancy.   For what it's worth, I am a fence-sitter. To me, whether abortion should be legal depends on when that duty of care begins. I don't know when that should be.	1642941400.0	htvgh1q	t3_saktm1	t3_saktm1	/r/Anarcho_Capitalism/comments/saktm1/what_do_you_think_of_this/htvgh1q/
4vsxho2a	Do you think you could, in your own words, clarify who these ‘lesser races’ are?	1642944648.0	htvlmk5	t3_sadpa7	t1_htv6off	/r/Anarcho_Capitalism/comments/sadpa7/so_weird/htvlmk5/
k5l5176	We have the shittiest health care even though people from Canada come to the US for medical treatment. Makes sense. US healthcare definitely has flaws but to say it’s the shittiest, you’re just an idiot.  https://www.google.com/amp/s/www.usnews.com/news/best-countries/articles/2016-08-03/canadians-increasingly-come-to-us-for-health-care%3fcontext=amp?espv=1	1642951245.0	htvyzsg	t3_sanmdb	t1_htvfdpt	/r/Anarcho_Capitalism/comments/sanmdb/hypocrite_moment/htvyzsg/
7weeejwl	Lmao, yeah, what are you 12? I'm sure your insights into the middle class in the midwest post ww2 are profound. Lmao!	1642954962.0	htw8541	t3_sav8rz	t1_htw580m	/r/Anarcho_Capitalism/comments/sav8rz/til_lenin_sent_the_army_to_suppress_a_workers/htw8541/
7weeejwl	Oops. Wrong sub. Thanks	1642955311.0	htw90tu	t3_sav8rz	t1_htw8uuc	/r/Anarcho_Capitalism/comments/sav8rz/til_lenin_sent_the_army_to_suppress_a_workers/htw90tu/
3thzwd2q	I have looked into how to legally get a supply of anthrax for self defense. But now I am waiting for the constitution to actually be enforced.   Apparently similar challenge with getting mustard gas for self defense.	1642956117.0	htwb3gu	t3_sau67g	t1_htw7u4q	/r/Anarcho_Capitalism/comments/sau67g/does_the_second_amendment_apply_to_lazer_guns/htwb3gu/
2u8593qe	And you must be new here. That is an edgy hot take	1642956123.0	htwb412	t3_sav8rz	t1_htvxphf	/r/Anarcho_Capitalism/comments/sav8rz/til_lenin_sent_the_army_to_suppress_a_workers/htwb412/
bxkwye1i	You're on an ancap sub. A bomb and plane designed at taxpayer expense, with conscripts, against a mixture of military personnel and innocent civilians. There wouldn't have been a Pearl Harbor if the USA wasn't playing Age of Empires in the Philippines.	1642957659.0	htwf38z	t3_saxjb5	t3_saxjb5	/r/Anarcho_Capitalism/comments/saxjb5/was_hiroshima_and_nagasaki_justified/htwf38z/
cmml5syw	Serious question here, why not just stop working.   Force them to fire you, knowing full well you’ll get a job somewhere else, or take the paid vacation until they’ve had enough.	1642957869.0	htwfmte	t3_saw4yv	t1_htw3eri	/r/Anarcho_Capitalism/comments/saw4yv/judge_allows_wisconsin_hospital_to_prevent_its/htwfmte/
it4dyisp	Um, you're missing my point. Me going to Somalia is not an accurate representation of what my life would be like if I decided to go off-grid here in the states. It was a bad analogy.	1642957920.0	htwfrl4	t3_sagpfa	t1_htvfn1o	/r/Anarcho_Capitalism/comments/sagpfa/what_exactly_is_anarchocapitilism/htwfrl4/
1pcaqr3y	Chad elitist USSR	1642959501.0	htwjx01	t3_sav8rz	t3_sav8rz	/r/Anarcho_Capitalism/comments/sav8rz/til_lenin_sent_the_army_to_suppress_a_workers/htwjx01/
96u8z1gl	A fascist doesn’t want certain people who disagree to vote. A communist would shoot them in the face.	1642966408.0	htx1s2c	t3_sb0l7y	t3_sb0l7y	/r/Anarcho_Capitalism/comments/sb0l7y/am_i_going_crazy_bc_when_tf_has_fascism_had/htx1s2c/
ht5ppqwu	Fuck off, no one’s hard earned money should be taking away from them to house illegals.	1642966512.0	htx21jv	t3_saxydo	t3_saxydo	/r/Anarcho_Capitalism/comments/saxydo/conservative_logic/htx21jv/
hp4kj	We won't forget	1642967155.0	htx3nrp	t3_sb1z3i	t3_sb1z3i	/r/Anarcho_Capitalism/comments/sb1z3i/europe_is_on_the_brink_of_civil_war_but_that_wont/htx3nrp/
bu9jm	Drummer for a shitty bar band?  🚩	1642971262.0	htxebeu	t3_saktm1	t1_htuka4j	/r/Anarcho_Capitalism/comments/saktm1/what_do_you_think_of_this/htxebeu/
bu9jm	Not really. It’s always consumers/taxpayers at the end of the day.	1642971365.0	htxekxv	t3_sazb1t	t1_htx042s	/r/Anarcho_Capitalism/comments/sazb1t/why_would_anyone_want_to_choose_to_pay_ridiculous/htxekxv/
3ab3dhz5	I support the rights for gays/trans/bi/etc. but like blm, the organization itself is ran by a bunch of complete idiots	1642974814.0	htxnmzp	t3_sb0ptb	t3_sb0ptb	/r/Anarcho_Capitalism/comments/sb0ptb/do_you_support_the_lgbtq_community/htxnmzp/
a6823yp6	the stupidity never ceases to amaze me you people are insane	1642976003.0	htxqoxg	t3_sb0l7y	t3_sb0l7y	/r/Anarcho_Capitalism/comments/sb0l7y/am_i_going_crazy_bc_when_tf_has_fascism_had/htxqoxg/
fpbeozg2	Honestly didn't know **most** of American history didn't have income tax until I saw this.	1642976218.0	htxr8yk	t3_sazg10	t3_sazg10	/r/Anarcho_Capitalism/comments/sazg10/a_quick_history_lesson/htxr8yk/
14jtvt	Back room party deals	1642978059.0	htxw4h3	t3_sb4eb5	t3_sb4eb5	/r/Anarcho_Capitalism/comments/sb4eb5/how_the_fuck_did_this_guy_become_president/htxw4h3/
7rkp2	Slippery slope fallacy	1642978549.0	htxxej6	t3_sb535m	t1_htxu1hm	/r/Anarcho_Capitalism/comments/sb535m/what_do_you_make_of_this_exchange_i_had_on/htxxej6/
fdtz7gbf	Or killing all Humans to prevent Elephant Poaching	1642980469.0	hty2ktb	t3_s9qzaj	t1_hty1m9x	/r/Anarcho_Capitalism/comments/s9qzaj/in_auckland_the_māori_people_protest_against/hty2ktb/
hk3ni9pl	Trash Police trash government behavior	1642981604.0	hty5f4c	t3_rx01i2	t3_rx01i2	/r/Anarcho_Capitalism/comments/rx01i2/germany_police_state_in_munich_a_father_is_taken/hty5f4c/
fpbeozg2	Before tax.	1642983848.0	htyaux3	t3_sb45ov	t1_htxxz0b	/r/Anarcho_Capitalism/comments/sb45ov/free_market/htyaux3/
fpbeozg2	GDP per worker in the US is $150K, think bigger comrade.	1642984476.0	htyce5l	t3_sb45ov	t1_htyc1oz	/r/Anarcho_Capitalism/comments/sb45ov/free_market/htyce5l/
dtwlakmk	Pro-choice here. A woman's body is her property and can do what they want with it and there is no authority to intervene it. Comparing is it to an already born child doesn't make sense, an already born child is an individual but something in your body isn't. These are my opinions and only valid to me because my moral standards only apply to me.	1642987297.0	htyj3gk	t3_sb9gbg	t3_sb9gbg	/r/Anarcho_Capitalism/comments/sb9gbg/pro_life_or_pro_choice/htyj3gk/
dndvwhvn	Only if they’re trying to come here legally.	1642987607.0	htyjtyz	t3_sb9avt	t3_sb9avt	/r/Anarcho_Capitalism/comments/sb9avt/i_hope_youre_a_prepper_canadian_mexico_truckers/htyjtyz/
a6823yp6	oh i see u were making a joke okay lmao   yea im sorry but if you actually think that u are a joke and should definitely try reading a book or two like on the nazis so u dont sound so silly or maybe learn what socialism means lol   like anyone with a college education would laugh at you	1642987731.0	htyk4ec	t3_sb0l7y	t1_htyjhpp	/r/Anarcho_Capitalism/comments/sb0l7y/am_i_going_crazy_bc_when_tf_has_fascism_had/htyk4ec/
3r7jz8ub	So you're vegan? All life is precious? Or are you just discriminating animals that aren't human?	1642987937.0	htykmf8	t3_sb9gbg	t1_htyjpcx	/r/Anarcho_Capitalism/comments/sb9gbg/pro_life_or_pro_choice/htykmf8/
bxvhbqde	Many dont agree with your statement, But this is the most just way i can support pro-life, not because of religious purposes, but because the baby could literally been born into a world and have accomplished great things, I can go into a deeper theory about abortion of course but, this aint the place for that lol	1642987967.0	htykp2j	t3_sb9gbg	t1_htyjpcx	/r/Anarcho_Capitalism/comments/sb9gbg/pro_life_or_pro_choice/htykp2j/
3r7jz8ub	>the baby could literally been born into a world and have accomplished great things  That's subjective   In the eyes of Hitler, great things were accomplished during The Third Reich	1642988096.0	htyl03s	t3_sb9gbg	t1_htykp2j	/r/Anarcho_Capitalism/comments/sb9gbg/pro_life_or_pro_choice/htyl03s/
3r7jz8ub	🤣 bro.. you always say the dumbest shit	1642988386.0	htylpx6	t3_sb9gbg	t1_htyl3j0	/r/Anarcho_Capitalism/comments/sb9gbg/pro_life_or_pro_choice/htylpx6/
3my26	Nice try.  Your people have a near monopoly on crazy public baby ranting.	1642988448.0	htylvef	t3_sb5kyu	t1_hty9aq0	/r/Anarcho_Capitalism/comments/sb5kyu/tds_karen_showed_up_at_the_defeat_the_mandates/htylvef/
fpbeozg2	Galt's Gulch	1642988672.0	htymfyy	t3_sb45ov	t1_htydtzr	/r/Anarcho_Capitalism/comments/sb45ov/free_market/htymfyy/
bxvhbqde	Cant tell if he trolling or not	1642989627.0	htyoq1n	t3_sb9gbg	t1_htylpx6	/r/Anarcho_Capitalism/comments/sb9gbg/pro_life_or_pro_choice/htyoq1n/
1382vr	This sub is so lame.  One video of a psycho… der der state of ther party….  Gotcha dems	1642990503.0	htyqtym	t3_sb5kyu	t3_sb5kyu	/r/Anarcho_Capitalism/comments/sb5kyu/tds_karen_showed_up_at_the_defeat_the_mandates/htyqtym/
fpbeozg2	>I have real skills…. Licenses…  Licences are state-backed monopolies on trades.	1642990614.0	htyr3do	t3_sb45ov	t1_htyqd1r	/r/Anarcho_Capitalism/comments/sb45ov/free_market/htyr3do/
dx965ytm	I have cleaned shit in a gas station bathroom. Level up your skills to levels up your life. Abolish minimum wage laws and let low skill people earn while they learn.	1642990712.0	htyrbdc	t3_sb9qty	t3_sb9qty	/r/Anarcho_Capitalism/comments/sb9qty/poor_wage_slaves_raise_of_hands_who_here_couldnt/htyrbdc/
dndvwhvn	Everyone is a genius. But if you judge a fish by its ability to climb a tree, it will live its whole life believing that it is stupid.	1642990742.0	htyrdud	t3_sbaihb	t3_sbaihb	/r/Anarcho_Capitalism/comments/sbaihb/do_dumb_people_deserve_to_be_poor/htyrdud/
54kvp	> You guys are all idiots if you think Trump was good.  Point me to the post in this thread where someone said that. Oh that's right, you can't, because you're arguing with a straw man.  > Go ahead and hate Biden, but acknowledge what an absolute train wreck Trump was or you have zero credibility.  Why would such a thing have to be acknowledged in a thread **specifically about Biden and no one else**? Really, explain that to me. Are you of the mistaken belief that a majority of people here supported Trump? If that's the case I'm sorry to inform you you're dead fucking wrong on that front, so unfortunately your go-to tactic of using a whataboutism "argument" in response to any Biden critique with "yeah, but what about Trump doing this and this..." doesn't work on us. The majority of us didn't vote for Biden. The majority of us didn't vote for Trump. Maybe this garbage logically fallacious argument tactic of yours works on a lot of the voting public, but not on a group of people who mostly votes either third-party or not at all.  Over 80 million people eligible to vote didn't vote. Nearly 3 million people voted for someone not named Biden or Trump. Combined, that's ~35% of eligible voters (and 2020 was an incredibly high turnout election; the non-voter percentage is normally much higher than that). It would do you well to remember that next time it enters your head to make a moronic whataboutism, straw man, assumptive "argument"...especially when speaking to a radical ideological group which you have very little understanding of.	1642992357.0	htyvf9c	t3_sb4eb5	t1_htyal5r	/r/Anarcho_Capitalism/comments/sb4eb5/how_the_fuck_did_this_guy_become_president/htyvf9c/
3my26	See?  Another crazy public baby rant.  Exactly as predicted from your kind.	1642993112.0	htyxerl	t3_sb5kyu	t1_htyt7ud	/r/Anarcho_Capitalism/comments/sb5kyu/tds_karen_showed_up_at_the_defeat_the_mandates/htyxerl/
fpbeozg2	"Hey Boss, look at this ad, I can make more money doing an easier job... How about a raise?"	1642993285.0	htyxwze	t3_sb45ov	t1_hty7l1f	/r/Anarcho_Capitalism/comments/sb45ov/free_market/htyxwze/
fpbeozg2	Apparently wages are 25% higher for union members in the private sector.  I might look around for one of those soon...	1642993480.0	htyyfp9	t3_sb45ov	t1_htyy284	/r/Anarcho_Capitalism/comments/sb45ov/free_market/htyyfp9/
3k4umkav	you specifically deserve nothing and are dumb	1642993723.0	htyz1p9	t3_sbaihb	t1_htyq2q6	/r/Anarcho_Capitalism/comments/sbaihb/do_dumb_people_deserve_to_be_poor/htyz1p9/
3my26	:P  I was just trolling you a little.  But seriously, there are significantly more leftists acting this kind of crazy in public than there are righties.  There really is a general rule:  righties think lefties are wrong;  leftists think righties are evil.	1642994463.0	htz0uc6	t3_sb5kyu	t1_htyyplc	/r/Anarcho_Capitalism/comments/sb5kyu/tds_karen_showed_up_at_the_defeat_the_mandates/htz0uc6/
16w7pusm	I worked at a restaurant in college. I did not change these. I think the dudes from the company did.	1642994763.0	htz1k02	t3_sb9qty	t3_sb9qty	/r/Anarcho_Capitalism/comments/sb9qty/poor_wage_slaves_raise_of_hands_who_here_couldnt/htz1k02/
fpbeozg2	I can't find any job paying less than $20 in my city right now.	1642995274.0	htz2pt6	t3_sb45ov	t1_htz1yo5	/r/Anarcho_Capitalism/comments/sb45ov/free_market/htz2pt6/
zpcah	I'm gonna get downvoted to oblivion in there, I commented.   "You literally unscrew it and screw a new one in. Not really a skill lol, there's better examples of minimum wage stuff like EMT that would further this conversation more."	1642995908.0	htz459u	t3_sb9qty	t3_sb9qty	/r/Anarcho_Capitalism/comments/sb9qty/poor_wage_slaves_raise_of_hands_who_here_couldnt/htz459u/
fpbeozg2	Not sure, but I pay $800 for a room in a 2BR with one other roommate.  Before that I was living in a studio that went for $1,100.  I'm sure you could find more affordable accomodations.  Some people split the rent on a house 4 or 5 ways and get away with $600. That's a couple sharing a room sometimes.	1642996836.0	htz67fs	t3_sb45ov	t1_htz5gzl	/r/Anarcho_Capitalism/comments/sb45ov/free_market/htz67fs/
1i5iflj9	If you've never had cancer you can't talk about cancer!	1642996943.0	htz6fp4	t3_sb9qty	t3_sb9qty	/r/Anarcho_Capitalism/comments/sb9qty/poor_wage_slaves_raise_of_hands_who_here_couldnt/htz6fp4/
1i5iflj9	If you've never had a million dollars in the bank you can't talk about ~~stealing from~~ taxing millionaires!	1642997312.0	htz782x	t3_sb9qty	t1_htyr4db	/r/Anarcho_Capitalism/comments/sb9qty/poor_wage_slaves_raise_of_hands_who_here_couldnt/htz782x/
cq0lcvzm	I make $700k a year and I remember how to do this.	1643000346.0	htzd9f4	t3_sb9qty	t3_sb9qty	/r/Anarcho_Capitalism/comments/sb9qty/poor_wage_slaves_raise_of_hands_who_here_couldnt/htzd9f4/
85okvvrs	It's astonishing how self-important these unskilled workers are. If you're an adult working a high school job, no one should care what you have to say.	1643000683.0	htzdvmp	t3_sb9qty	t3_sb9qty	/r/Anarcho_Capitalism/comments/sb9qty/poor_wage_slaves_raise_of_hands_who_here_couldnt/htzdvmp/
fpbeozg2	https://careers.mcdonalds.com/main/	1643002279.0	htzgqe4	t3_sb45ov	t1_htzgmgd	/r/Anarcho_Capitalism/comments/sb45ov/free_market/htzgqe4/
ds58vdli	Come to WY!	1643003646.0	htzj3fv	t3_sb37nb	t1_htxgh01	/r/Anarcho_Capitalism/comments/sb37nb/or_we_could_divide_germany_into_east_and_west/htzj3fv/
4o16amrq	Um... that's not really communism. Duh (s/)	1643009583.0	htzrzuz	t3_sb37nb	t3_sb37nb	/r/Anarcho_Capitalism/comments/sb37nb/or_we_could_divide_germany_into_east_and_west/htzrzuz/
26lquckc	I don’t think that’s the question	1643010997.0	htztvy2	t3_sbgoe3	t1_htzte2m	/r/Anarcho_Capitalism/comments/sbgoe3/what_do_yall_think/htztvy2/
cnekc1s3	Apparently your an idiot, never mind.	1643015555.0	htzzmxf	t3_sbfian	t1_htzxtrm	/r/Anarcho_Capitalism/comments/sbfian/if_the_govt_prints_its_own_money_why_do_they_need/htzzmxf/
7xsr1cih	I actually sucked at changing these, can’t lie 😂. And the stickiness is just unpleasant but I’m well aware I’m being precious.	1643017869.0	hu02e98	t3_sb9qty	t3_sb9qty	/r/Anarcho_Capitalism/comments/sb9qty/poor_wage_slaves_raise_of_hands_who_here_couldnt/hu02e98/
669vk	A picture perfectly describing everything wrong with the antiwork shit. Your plethora of useless skills, that could be done by robots or trained monkeys, don't entitle you to respect or a six figure salary. Almost universally we all started in these sorts of jobs and on our own through education or personal work gained skills to get better jobs.   This sort of inflated self importance is much more a hinderance than anything to getting away from this sort of work	1643021597.0	hu06y9a	t3_sb9qty	t3_sb9qty	/r/Anarcho_Capitalism/comments/sb9qty/poor_wage_slaves_raise_of_hands_who_here_couldnt/hu06y9a/
3o1tqj6	The Arab spring was actually a thing.	1643025887.0	hu0crx3	t3_sb1z3i	t1_htzxzy4	/r/Anarcho_Capitalism/comments/sb1z3i/europe_is_on_the_brink_of_civil_war_but_that_wont/hu0crx3/
cnwjrvc5	I don’t think you’re correct at all there’s noting unconstitutional about Non-compete clauses. They’ve been upheld in several big cases. You’re kinda talking out of ur ass	1643032944.0	hu0pc5w	t3_saw4yv	t3_saw4yv	/r/Anarcho_Capitalism/comments/saw4yv/judge_allows_wisconsin_hospital_to_prevent_its/hu0pc5w/
7xsr1cih	Do you not think demi sort of just looks the exact same but with shorter hair and less provocative clothes or am I blind? She was always sort of chubby and wore a lot of make up/tan, she just talks a lot more shit now.	1643033242.0	hu0pyig	t3_sbkp4c	t1_hu0gtgq	/r/Anarcho_Capitalism/comments/sbkp4c/i_saw_this_earlier/hu0pyig/
7xsr1cih	Fair enough. Reality of ageing and excess shit talking I suppose.	1643033733.0	hu0r01o	t3_sbkp4c	t1_hu0qjwt	/r/Anarcho_Capitalism/comments/sbkp4c/i_saw_this_earlier/hu0r01o/
wqutd	A guy threw both his shoes at Bush back in 2008 [at a press conference in Baghdad.](https://m.youtube.com/watch?v=_RFH7C3vkK4)	1643034833.0	hu0tepn	t3_sbme9k	t1_hu0rzjm	/r/Anarcho_Capitalism/comments/sbme9k/antivax_riots_in_brussels_throwing_fences_at/hu0tepn/
2u8593qe	😂😂	1643043253.0	hu1egw2	t3_sb9qty	t1_hu1dall	/r/Anarcho_Capitalism/comments/sb9qty/poor_wage_slaves_raise_of_hands_who_here_couldnt/hu1egw2/
5cizwpbe	That is apparent. Just want to hear opinions why	1643043764.0	hu1fuks	t3_sb1z3i	t1_htzy19w	/r/Anarcho_Capitalism/comments/sb1z3i/europe_is_on_the_brink_of_civil_war_but_that_wont/hu1fuks/
1377f5	I laughed that it was *that* part of the title that upset you, not being peers with someone who is clearly stupid.	1643044833.0	hu1iqh8	t3_sbme9k	t1_hu0tf2d	/r/Anarcho_Capitalism/comments/sbme9k/antivax_riots_in_brussels_throwing_fences_at/hu1iqh8/
16zbrg	It’s not anti-pass, it’s pro-plague	1643051064.0	hu1znbo	t3_sbme9k	t1_hu19yw7	/r/Anarcho_Capitalism/comments/sbme9k/antivax_riots_in_brussels_throwing_fences_at/hu1znbo/
4xhi1urd	proof?	1643051983.0	hu2233m	t3_sbsvik	t1_hu21cwx	/r/Anarcho_Capitalism/comments/sbsvik/this_guys_starting_to_get_it/hu2233m/
36l61z94	Idk about you guys, but if schools all became religious, everyone would become dumb as rocks, and the answer to everything would be "because god intended so"  Like Mrs Parker is that why your husband fucked that 18 year old behind your back? Stfu  Christianity is a cult, and i'd rather not be fed bs about Christ being our savior and all that	1643052332.0	hu230rb	t3_sbsvik	t3_sbsvik	/r/Anarcho_Capitalism/comments/sbsvik/this_guys_starting_to_get_it/hu230rb/
111cuwp6	This has nothing to do with the vaccine, or corona. Its about freedom from facist governments!	1643052431.0	hu23a5z	t3_sbme9k	t3_sbme9k	/r/Anarcho_Capitalism/comments/sbme9k/antivax_riots_in_brussels_throwing_fences_at/hu23a5z/
2871ys0x	Its the people who pay politicians you want to go for. Its very easy to replace a politician.	1643052811.0	hu24a19	t3_sbme9k	t1_hu0oo9y	/r/Anarcho_Capitalism/comments/sbme9k/antivax_riots_in_brussels_throwing_fences_at/hu24a19/
te0pj9v	I suppose the title refers to *this*.	1643056398.0	hu2dmwa	t3_sbug1r	t3_sbug1r	/r/Anarcho_Capitalism/comments/sbug1r/a_major_protest_is_underway_in_canada_as_an/hu2dmwa/
bmrlx9pm	 Hello! You have made the mistake of writing "ect" instead of "etc."  "Ect" is a common misspelling of "etc," an abbreviated form of the Latin phrase "et cetera." Other abbreviated forms are **etc.**, **&c.**, **&c**, and **et cet.** The Latin translates as "et" to "and" + "cetera" to "the rest;" a literal translation to "and the rest" is the easiest way to remember how to use the phrase.   [Check out the wikipedia entry if you want to learn more.](https://en.wikipedia.org/wiki/Et_cetera)  ^(I am a bot, and this action was performed automatically. Comments with a score less than zero will be automatically removed. If I commented on your post and you don't like it, reply with "!delete" and I will remove the post, regardless of score. Message me for bug reports.)	1643060652.0	hu2oxx7	t3_sbuirt	t1_hu2owqb	/r/Anarcho_Capitalism/comments/sbuirt/_/hu2oxx7/
1pcaqr3y	Democracy gives power to the people, which is why I hate democracy.	1643062039.0	hu2sl1y	t3_sbq5yy	t3_sbq5yy	/r/Anarcho_Capitalism/comments/sbq5yy/gang_rape_is_literally_democracy_in_action/hu2sl1y/
4gkk1k0p	Go easy on her she's definitely got a screw loose	1643067075.0	hu359im	t3_sbkp4c	t3_sbkp4c	/r/Anarcho_Capitalism/comments/sbkp4c/i_saw_this_earlier/hu359im/
egqb4p44	Ah wonderful, we've reached the part where you repeat everything.   Please leave me out of your scat fetish.	1643067702.0	hu36m6r	t3_sb9qty	t1_hu35bqy	/r/Anarcho_Capitalism/comments/sb9qty/poor_wage_slaves_raise_of_hands_who_here_couldnt/hu36m6r/
egqb4p44	Ah wonderful, we've reached the part where you repeat everything.   Please leave me out of your scat fetish.	1643067716.0	hu36mwy	t3_sb9qty	t1_hu35bqy	/r/Anarcho_Capitalism/comments/sb9qty/poor_wage_slaves_raise_of_hands_who_here_couldnt/hu36mwy/
on92dd	I wouldn't expect the person who got fired for being a lazy worker to understand any of this. You're doomed to be a low wage worker your whole life, all the while blaming society, racism and elitism for your lack of work ethic and drive for success. Good luck with that 🤣.	1643067780.0	hu36r3c	t3_sbxieq	t1_hu36il6	/r/Anarcho_Capitalism/comments/sbxieq/honest_question_from_anarchocommunist/hu36r3c/
egqb4p44	Ah wonderful, we've reached the part where you repeat everything.   Please leave me out of your scat fetish.	1643067784.0	hu36r7d	t3_sb9qty	t1_hu35bqy	/r/Anarcho_Capitalism/comments/sb9qty/poor_wage_slaves_raise_of_hands_who_here_couldnt/hu36r7d/
on92dd	I wouldn't expect the person who got fired for being a lazy worker to understand any of this. You're doomed to be a low wage worker your whole life, all the while blaming society, racism and elitism for your lack of work ethic and drive for success. Good luck with that 🤣.	1643067791.0	hu36rlf	t3_sbxieq	t1_hu36il6	/r/Anarcho_Capitalism/comments/sbxieq/honest_question_from_anarchocommunist/hu36rlf/
on92dd	I wouldn't expect the person who got fired for being a lazy worker to understand any of this. You're doomed to be a low wage worker your whole life, all the while blaming society, racism and elitism for your lack of work ethic and drive for success. Good luck with that 🤣.	1643067802.0	hu36s5q	t3_sbxieq	t1_hu36il6	/r/Anarcho_Capitalism/comments/sbxieq/honest_question_from_anarchocommunist/hu36s5q/
on92dd	I wouldn't expect the person who got fired for being a lazy worker to understand any of this. You're doomed to be a low wage worker your whole life, all the while blaming society, racism and elitism for your lack of work ethic and drive for success. Good luck with that 🤣.	1643067814.0	hu36sri	t3_sbxieq	t1_hu36il6	/r/Anarcho_Capitalism/comments/sbxieq/honest_question_from_anarchocommunist/hu36sri/
egqb4p44	Ah wonderful, we've reached the part where you repeat everything.   Please leave me out of your scat fetish.	1643067825.0	hu36tg2	t3_sb9qty	t1_hu35bqy	/r/Anarcho_Capitalism/comments/sb9qty/poor_wage_slaves_raise_of_hands_who_here_couldnt/hu36tg2/
egqb4p44	Ah wonderful, we've reached the part where you repeat everything.   Please leave me out of your scat fetish.	1643067831.0	hu36tyx	t3_sb9qty	t1_hu35bqy	/r/Anarcho_Capitalism/comments/sb9qty/poor_wage_slaves_raise_of_hands_who_here_couldnt/hu36tyx/
on92dd	I wouldn't expect the person who got fired for being a lazy worker to understand any of this. You're doomed to be a low wage worker your whole life, all the while blaming society, racism and elitism for your lack of work ethic and drive for success. Good luck with that 🤣.	1643067843.0	hu36uxr	t3_sbxieq	t1_hu36il6	/r/Anarcho_Capitalism/comments/sbxieq/honest_question_from_anarchocommunist/hu36uxr/
