author	body	created_at	c_id	s_id	p_id	permalink
dndvwhvn	Because he doesn’t send mean tweets. So he gets a pass.	1642704858.0	hthsqpp	t3_s8q25l	t3_s8q25l	/r/Anarcho_Capitalism/comments/s8q25l/why_dont_people_see_the_obvious_corruption_of/hthsqpp/
qzcuwon	Bombing a govt building is based. With that being said, fuck Marxism.	1642706310.0	hthwn4w	t3_s8j3r7	t1_hth5ty3	/r/Anarcho_Capitalism/comments/s8j3r7/do_you_support_the_black_lives_matter_movement/hthwn4w/
14883j	Support of any group, party, or movement is the surrender of critical thought.  As such, no, I do not support "the movement."  That said, I directly oppose unchecked use of force by government agents against citizens, period.	1642706565.0	hthxbnq	t3_s8j3r7	t3_s8j3r7	/r/Anarcho_Capitalism/comments/s8j3r7/do_you_support_the_black_lives_matter_movement/hthxbnq/
t86ywwe	Don’t support BLM, but I do support black people, and well any race.	1642706864.0	hthy4fz	t3_s8j3r7	t3_s8j3r7	/r/Anarcho_Capitalism/comments/s8j3r7/do_you_support_the_black_lives_matter_movement/hthy4fz/
eaaromyj	Even leftist Starbucks got rid of their mandates…	1642707292.0	hthz92f	t3_s8md7y	t3_s8md7y	/r/Anarcho_Capitalism/comments/s8md7y/carhartt_fuck_this_private_business/hthz92f/
gvy0s	I did not talk about government mandates. I am very against them. I talked about getting mad a private company made their own mandate. That's the opposite of anarcho capitalism. We are not a socialist government democrats and Republicans are capitalists who socialize the success of capitalism. I will agree we're a corpocracy. A lot of democrats probably lined their pockets from the pharmacy companies. I don't believe in a federal government in the first place but vaccines work and mRNA vaccines work. Can we talk about property laws?	1642707843.0	hti0r89	t3_s8md7y	t1_hthycs1	/r/Anarcho_Capitalism/comments/s8md7y/carhartt_fuck_this_private_business/hti0r89/
gxe1v27t	You’re clumping a bunch of things that don’t really have much in common with one another. Those who were rioting and looting would identify themselves as being on the far left end of the spectrum. Those who support tax increases and ‘socialised healthcare’ would identity as centre-left.  Now, I’m not a upper-middle/lower-upper class white liberal who makes $200k-400k a year but I can say confidently that being wealthy does not exclude you from progressive politics. You can be wealthy and also want to see those from lower classes have access to healthcare or have more funding for public schools. Not everyone has the mindset of ‘I’ll only vote for what benefits me’, I personally vote for what will better my country, because rarely do political parties have policies that’ll directly benefit me.   New York in particular has always been more progressive than most places in the U.S. It’s acted as a hub for internationalism, progressivism and diversity for decades, and whilst there are divides amongst different parts of New York, wealthy liberals *do* exist and don’t mind having to pay more tax if it means better funded public schools or public services.   I remember reading about 100 millionaires who wanted the government to tax them more to help distribute wealth better and provide for the working-class. Rich people wanting to help the less fortunate isn’t a myth, albeit it isn’t as common as I’d like it to be.	1642710862.0	hti7pmp	t3_s8s1vo	t3_s8s1vo	/r/Anarcho_Capitalism/comments/s8s1vo/what_do_affluent_white_liberals_get_out_of/hti7pmp/
gvy0s	Not at all, I honestly don't see much of a difference between the left and right. They're both trying to get power in their own way, but one side literally just tried to overthrow our democracy. You can complain about it but I don't see what it has to do with anarcho capitalism.	1642710870.0	hti7qfj	t3_s8md7y	t1_hti6glu	/r/Anarcho_Capitalism/comments/s8md7y/carhartt_fuck_this_private_business/hti7qfj/
hzljsjt5	btw, you can buy it too (you will help me a lot with that)  Flag: [https://gbrand-5.creator-spring.com/listing/ancap-gadsden?product=584](https://gbrand-5.creator-spring.com/listing/ancap-gadsden?product=584)  Mug: [https://gbrand-5.creator-spring.com/listing/ancap-gadsden?product=1565](https://gbrand-5.creator-spring.com/listing/ancap-gadsden?product=1565)  Mask: [https://gbrand-5.creator-spring.com/listing/ancap-gadsden?product=972](https://gbrand-5.creator-spring.com/listing/ancap-gadsden?product=972)	1642713551.0	htif3rh	t3_s8t4uo	t3_s8t4uo	/r/Anarcho_Capitalism/comments/s8t4uo/didnt_find_anything_similar_on_amazonebay_so_i/htif3rh/
hzljsjt5	btw, you can buy it too and this will help me a lot:  Flag: [https://gbrand-5.creator-spring.com/listing/ancap-gadsden?product=584](https://gbrand-5.creator-spring.com/listing/ancap-gadsden?product=584)  Mug: [https://gbrand-5.creator-spring.com/listing/ancap-gadsden?product=1565](https://gbrand-5.creator-spring.com/listing/ancap-gadsden?product=1565)  Mask: [https://gbrand-5.creator-spring.com/listing/ancap-gadsden?product=972](https://gbrand-5.creator-spring.com/listing/ancap-gadsden?product=972)	1642714348.0	htihcik	t3_s8tic5	t3_s8tic5	/r/Anarcho_Capitalism/comments/s8tic5/didnt_find_anything_similar_on_amazonebay_so_i/htihcik/
gvy0s	I don't know what tankie means but if you really think that's true I would say you do not belong on an anarcho capitalist sub. We had an egotistical fascist who spewed misinformation constantly. Everything he claimed was proved wrong by the courts. If you really think that you're a big government statist in my opinion.	1642716154.0	htimblg	t3_s8md7y	t1_htikgvo	/r/Anarcho_Capitalism/comments/s8md7y/carhartt_fuck_this_private_business/htimblg/
hzzel	"I don't care what wing you are on, nor do I care"  So are you such a pedant that capitalization and apostrophes matter that much to you? on the internet? Or am I missing something?	1642718359.0	htiqcqn	t3_s8md7y	t1_htioije	/r/Anarcho_Capitalism/comments/s8md7y/carhartt_fuck_this_private_business/htiqcqn/
3n5kt	Super edgy, kiddo.	1642719766.0	htitjui	t3_s8md7y	t1_hti3ola	/r/Anarcho_Capitalism/comments/s8md7y/carhartt_fuck_this_private_business/htitjui/
dndvwhvn	Well our female generals can pee standing up. So checkmate chYna.	1642719977.0	htiu26x	t3_s8vb38	t3_s8vb38	/r/Anarcho_Capitalism/comments/s8vb38/likely_powered_by_genocide/htiu26x/
16fusg	Seems accurate.	1642720849.0	htiw74q	t3_s8uqnr	t3_s8uqnr	/r/Anarcho_Capitalism/comments/s8uqnr/unarmed_communists/htiw74q/
8azzd	You aren't wrong, lmao!	1642727123.0	htjb4e2	t3_s8md7y	t1_hth3a1q	/r/Anarcho_Capitalism/comments/s8md7y/carhartt_fuck_this_private_business/htjb4e2/
4u6og	Cool but these clips have been chosen and edited together.	1642727156.0	htjb76r	t3_s8uqnr	t1_htj4im2	/r/Anarcho_Capitalism/comments/s8uqnr/unarmed_communists/htjb76r/
bmkofnkr	See ya out there on the battlefield, commie	1642727566.0	htjc531	t3_s8uqnr	t1_htj1ne2	/r/Anarcho_Capitalism/comments/s8uqnr/unarmed_communists/htjc531/
77jtrept	Yeah buddy  Corn fed ground beef a corn syrup white bun with corn syrup ketchup washed down with corn syrup coke.	1642729566.0	htjgrit	t3_s8wqvp	t1_htjao8w	/r/Anarcho_Capitalism/comments/s8wqvp/obesity_is_the_most_common_comorbidity_in/htjgrit/
5dmxvs04	Moral of the story: communists are either mentally disturbed to the point of being suicidal, or they are 12 years old	1642730518.0	htjixvq	t3_s8uqnr	t3_s8uqnr	/r/Anarcho_Capitalism/comments/s8uqnr/unarmed_communists/htjixvq/
mpt9x	Dann lasst euch doch einfach Impfen, wappler...	1642730908.0	htjju94	t3_s8pkx3	t1_hthxpdz	/r/Anarcho_Capitalism/comments/s8pkx3/its_official_mandatory_vaccinations_in_austria/htjju94/
a5ou4an3	I'm a communist in America and I don't own guns because.. oh wait I have nine guns.	1642732772.0	htjo540	t3_s8uqnr	t3_s8uqnr	/r/Anarcho_Capitalism/comments/s8uqnr/unarmed_communists/htjo540/
qzcuwon	Most of these games are free now and devs add 10 dollar skins to make money, it’s a little pricey for a skin but people buy them. I’ve spent hundreds of dollars on Apex legends. If you don’t like it don’t play it! That’s optional, you can play for free.	1642733593.0	htjq1wt	t3_s8xm4n	t3_s8xm4n	/r/Anarcho_Capitalism/comments/s8xm4n/game_studios_were_socialist_collectives_before/htjq1wt/
buucjyxp	So they are putting up a statue of Klaus Schaub for starting the great reset by kicking it off with the covod coup..... awesome only in America.	1642740488.0	htk4xn0	t3_s8zs1c	t3_s8zs1c	/r/Anarcho_Capitalism/comments/s8zs1c/without_the_government_how_can_we_erase_history/htk4xn0/
1xx9hckv	My cutoff is the rates things were at before Reagan . We've tried tax breaks for the wealthy, it does nothing for society. When we had a corporate tax rate in the 90s, society had a fucking explosion of benefits.   I do think government is corrupt, the only problem is most anarcho libertarians have no problem holding their nose and voting for a republican statist - while most anarcho communists hate dems and repubs equally and refuse to vote for them. So who is really practicing what they preach? You guys are mostly republicans that want to smoke weed and pay less taxes. Guess what? That's just a young republican, not an anarchist of any kind.	1642741035.0	htk5zqe	t3_s78bxb	t1_htk4ctt	/r/Anarcho_Capitalism/comments/s78bxb/when_antiwork_finally_gets_a_job_only_to_have/htk5zqe/
14jtvt	BODY POSITIVITY!  &#x200B;  \^ And here i am eating flavorless dross in the morning (oatmeal), running 5ks in 25 minutes twice a week like a sucker!	1642741667.0	htk77bc	t3_s8wqvp	t3_s8wqvp	/r/Anarcho_Capitalism/comments/s8wqvp/obesity_is_the_most_common_comorbidity_in/htk77bc/
a42h7iy9	Yup, a lot of conservatives poke around here thinking workers joining to bargain together = COMMuNISM  The argument that government regulations make this somehow against anarchism is wrong as there is a helluva lot more partnership and power between industry and government than there is government laws legislating rights of workers. And people banding together to collectively make an influence, is more in the spirit of anarchism and decentralization of power than some industry titans who have already benefited by government legislation butting heads over who gets the bigger end of the pie the government cuts for them (ie, who is the better pet....its actually sad to see the power that certain companies could have but they just waste it...often citing they do so out of responsibility to their "employees" that in other circumstance theyd lay off to preserve the company).   Giving a shit about working class does not = communism.  That's caring about most of the people on earth whose labour provides most of the things we call ESSENTIAL, and yes, it's undervalued compared to someone who sits in a boardroom. Theres lots of shit that goes on to keep the average person out of genuinely competing in the free market. There aint no free market right now.	1642743190.0	htka1dy	t3_s8vmrr	t3_s8vmrr	/r/Anarcho_Capitalism/comments/s8vmrr/i_think_this_sub_is_full_of_people_who_dont/htka1dy/
ukj8e0l	Agreed	1642747524.0	htkhcb4	t3_s8zs1c	t1_htkgv75	/r/Anarcho_Capitalism/comments/s8zs1c/without_the_government_how_can_we_erase_history/htkhcb4/
asqce74t	Population reduction coupled with poor health so they can farm the population for subscription based medical monopoly bullshit. Weaker and sicker than every before, which wasn't thought possible. The Food Pyramid from the 80's did more to expedite diabetes in kids and adults than anything up to this point.	1642750468.0	htklm66	t3_s8wqvp	t3_s8wqvp	/r/Anarcho_Capitalism/comments/s8wqvp/obesity_is_the_most_common_comorbidity_in/htklm66/
16r2vf	That’s really ironic coming from someone who doesn’t pay rent and makes knives in their parents house	1642751893.0	htknkzt	t3_s8xbeq	t1_htjypm3	/r/Anarcho_Capitalism/comments/s8xbeq/rent_do_these_people_want_free_shit/htknkzt/
mpt9x	Na. Hurnkinder wie ihr seid der Grund warum wir 3 Jahre in dieser scheiß Pandemie seid. Ihr seid der Grund warum ne Freundin von mir seit Monaten ned in der Gastro hackeln kann, obwohl sie voll geimpft is. Vielleicht sollt man statt der Hofburg doch was anderes nieder brennen...	1642760235.0	htkyae3	t3_s8pkx3	t1_htkn24m	/r/Anarcho_Capitalism/comments/s8pkx3/its_official_mandatory_vaccinations_in_austria/htkyae3/
fdtz7gbf	"Why can't the police just kick the gun out of the perps hand? I saw Captain America do it in Marvel Movies."	1642760682.0	htkyufb	t3_s8uqnr	t1_htj2rve	/r/Anarcho_Capitalism/comments/s8uqnr/unarmed_communists/htkyufb/
hum06d0o	What is the issue with alcohol????  Oh ya,  cars and toxic domestic relationships that people can’t escape because poverty prevents them from moving.   Outlaw those things.	1642760943.0	htkz5vi	t3_s95yvt	t1_htktwlp	/r/Anarcho_Capitalism/comments/s95yvt/oh_sweet_jesus_no/htkz5vi/
9dk7xp8p	Oh we can be prejudiced. Whoever told you that thought is definitely racist..: But who benefits most from a white patriarchal supremacist society most? I guess the question is… how come I have to reconcile the fact that I wouldn’t exist if it wasn’t for slavery. My great grandfather was born a slave in Columbus MS, the product of a rape by my great great grandfather against my great great grand mother his Slave.  All you are doing is supposition. Teddy Roosevelt has had his Time in front of one of America’s great institutions, sitting on a horse towering over two Natives, taming these “Brutes” and lording over the land stolen from them and destroying their nations and utilizing the land to populate it with Enslaved Africans to build an economy from free labor.   Black people have had to reconcile hundreds of years of this atrocity-the privilege and legacy of white folks frees them of having any reason to observe or honor to the past by knowing it should never happen again. Teddy going to a new museum somewhere is fine.  Decolonizing our public spaces is mindful and empathetic. and making way for new voices and a vision for the future with knowledge and respect for the past and how it benefits many and terrorize many others.	1642761524.0	htkzw9a	t3_s8zs1c	t1_htkckwq	/r/Anarcho_Capitalism/comments/s8zs1c/without_the_government_how_can_we_erase_history/htkzw9a/
i041shar	One of the top replies is "Them: The fReE mArKeT Also them: NO NOT LIKE THAT"  How stupid can you be?	1642764369.0	htl3n2i	t3_s92p2b	t3_s92p2b	/r/Anarcho_Capitalism/comments/s92p2b/using_government_to_force_you_to_keep_working/htl3n2i/
312dr	When I was in junior high I went around for a couple months saying I was a communist without truly having any understanding of the concept, just trying to be edgy or something. I cringe so hard looking back.	1642768527.0	htl9zk9	t3_s8uqnr	t1_htitfor	/r/Anarcho_Capitalism/comments/s8uqnr/unarmed_communists/htl9zk9/
huwl54v8	"Left wing" I assume you mean commies as those are the only type offended by Western society.	1642770198.0	htlcya4	t3_s8zs1c	t3_s8zs1c	/r/Anarcho_Capitalism/comments/s8zs1c/without_the_government_how_can_we_erase_history/htlcya4/
9dk7xp8p	Have no grudges to give up, boo. I don’t begrudge my own life. I’m just being truthful. I’m an educator. “Good advice grates on the ear”	1642774439.0	htllrik	t3_s8zs1c	t1_htlhx5k	/r/Anarcho_Capitalism/comments/s8zs1c/without_the_government_how_can_we_erase_history/htllrik/
8jrao7w	Man, Americans who love communism are baffling.   So you want to give the means of production to the workers?   Yup.   Which means taking it from the “ruling/management class.”   Yup.   So you disown authority and wish to bring power to the masses?   Makes sense to me.   Then why do you keep voting for the most authoritarian side?   Because I can’t let my internet friends think I’m right-wing, I’d lose all my internet points!	1642777580.0	htltaw0	t3_s8uqnr	t3_s8uqnr	/r/Anarcho_Capitalism/comments/s8uqnr/unarmed_communists/htltaw0/
6zsjrsay	I had one ceo that was great but I’m pretty sure my current one could be replaced. He related to a lot of the old CEOs and current partners. We just need a robot that will corner women, pay them off then go on CNBC to promote the stock.	1642777821.0	htltwvr	t3_s9a1iw	t3_s9a1iw	/r/Anarcho_Capitalism/comments/s9a1iw/and_yet_it_is_one_of_the_jobs_that_cant_be/htltwvr/
h62g6	Trump made something up because he knows people like you will gobble up anything he says with no proof? I'm shocked.	1642779405.0	htly0vm	t3_s9d6vb	t3_s9d6vb	/r/Anarcho_Capitalism/comments/s9d6vb/biden_admitted_it/htly0vm/
7kr5fl8	Just ask to see the box/bottle when you get your next booster. Or you can use a search engine on the internet. You have access to all the same information I do. Besides, you're the one who doesn't believe me. So, go find out. That way you won't need to second-guess yourself.	1642779424.0	htly2nw	t3_s8b9s1	t1_htjy6uw	/r/Anarcho_Capitalism/comments/s8b9s1/selfidentify_as_pregnant/htly2nw/
aaqpyyp	Because it would shame  a lot of women and public sector union employees who could use a bit of shaming.      Have you seen your average government clerk or teacher, for example? Imagine a 40 pounds overweight high school biology teacher having to preach the values of working out to high school kids when it's obvious she doesn't work out.	1642780285.0	htm0bnp	t3_s8wqvp	t1_htkddu6	/r/Anarcho_Capitalism/comments/s8wqvp/obesity_is_the_most_common_comorbidity_in/htm0bnp/
aaqpyyp	Shitloads of situps are bad. You can still do situp variations on a decline bench with some resistance bands to work your hip flexors. You just don't do many of them, and you do slow reps to get maximum squeeze.      Part of the reason situps are bad for your back is that people slam their spine into the ground over and over for 50+ reps in multiple sets. When I was in the Army most of the dudes could knock out 70+ situps in two minutes during a PT test.	1642780495.0	htm0vsh	t3_s8wqvp	t1_htl4kbd	/r/Anarcho_Capitalism/comments/s8wqvp/obesity_is_the_most_common_comorbidity_in/htm0vsh/
aaqpyyp	Pilates and Yoga offer a lot of movements that strengthen the core without torqueing your back.      If you (correctly) get annoyed by all the 'namaste' fake mystical bullshit of some yoga classes, then look into pilates instead.	1642780557.0	htm11r3	t3_s8wqvp	t1_htlkb48	/r/Anarcho_Capitalism/comments/s8wqvp/obesity_is_the_most_common_comorbidity_in/htm11r3/
845hcmvt	Good idea we should starve you guys off for being tyrannical nonces	1642780813.0	htm1pvb	t3_s9c33i	t1_htlvz6l	/r/Anarcho_Capitalism/comments/s9c33i/unvaccinated_truck_driver_entering_canada14_day/htm1pvb/
3o61v	You fucking babies	1642781255.0	htm2vo5	t3_s9csi9	t3_s9csi9	/r/Anarcho_Capitalism/comments/s9csi9/and_everyone_was_so_nice_too/htm2vo5/
8sm0vcm0	I'm not an ancap but I came here to see if you had anything more interesting to say than the stereotypes and it turns out you guys did, so that's pretty nice.  Seeing your comments gave me an idea and I'm curious what you think of it: Minimal gun control but with the creation of some kind of gunowner liability insurance industry that severely penalizes incompetent jackoffs but has lenient fees otherwise.	1642781353.0	htm34vh	t3_s9adex	t3_s9adex	/r/Anarcho_Capitalism/comments/s9adex/this_thread_is_makes_me_want_to_rip_my_eyes_out/htm34vh/
7edtf	This article makes me think of Henry Fondle from bojack horseman: https://youtu.be/8J1nW0YnvN4	1642782036.0	htm4y1j	t3_s9a1iw	t3_s9a1iw	/r/Anarcho_Capitalism/comments/s9a1iw/and_yet_it_is_one_of_the_jobs_that_cant_be/htm4y1j/
3bdai	It's called capitalism and human greed	1642782515.0	htm689u	t3_s8sc4f	t1_htkfbtc	/r/Anarcho_Capitalism/comments/s8sc4f/sigh_these_people_dont_even_understand_the/htm689u/
7pf2m	 Mexico doesn't use innocent Islamic people as slave labor in forced labor camps. Mexico doesn't commit genocide against their own populace. Mexico doesn't support an insanity driven 3rd world country with a cult for a government with nukes.  That's a smart goddamn 3rd grader if you ask me.	1642783471.0	htm8tg2	t3_s8md7y	t1_hti829h	/r/Anarcho_Capitalism/comments/s8md7y/carhartt_fuck_this_private_business/htm8tg2/
6b7gvgye	Respect	1642784079.0	htmahh5	t3_s9csi9	t3_s9csi9	/r/Anarcho_Capitalism/comments/s9csi9/and_everyone_was_so_nice_too/htmahh5/
5ejojkrr	Fucking idiot	1642790946.0	htmt66p	t3_s9bg9c	t3_s9bg9c	/r/Anarcho_Capitalism/comments/s9bg9c/they_at_it_again/htmt66p/
3my26	Obama was a puppet too.	1642791330.0	htmu4rw	t3_s9da7o	t3_s9da7o	/r/Anarcho_Capitalism/comments/s9da7o/biden_is_only_a_puppet/htmu4rw/
1il6ia0i	Research black on Asian hate crime without switching it to white people. Mainstream media won’t show you, but only white people can be racist? Can we address why the murdering and beating and threats and racial slurs against Asians? Hundreds of videos, statistics evidence you cannot argue. Extremely hypocritical. Golden rule.	1642791993.0	htmvxe6	t3_s8zs1c	t1_htlwzei	/r/Anarcho_Capitalism/comments/s8zs1c/without_the_government_how_can_we_erase_history/htmvxe6/
dndvwhvn	I’d you think they care just fo to one of their protests after its over and see all the garbage on the ground. Liberalism is a mental disorder.	1642792072.0	htmw53e	t3_s9i3wc	t3_s9i3wc	/r/Anarcho_Capitalism/comments/s9i3wc/does_anyone_else_find_it_strange_that_the_same/htmw53e/
dndvwhvn	He got 80 million votes. They came from 40 million people that’s the problem.	1642797433.0	htnaxcm	t3_s9jzi3	t3_s9jzi3	/r/Anarcho_Capitalism/comments/s9jzi3/bidens_approval_rating_is_just_north_of_30/htnaxcm/
gqigp	- they still get treated just like it is now.  If they can't pay, they can't pay.  - the strongest military in the world would stop them.  - street cleaning is paid through taxes, just like it is now.  - free market set wages and prices.	1642797705.0	htnbonf	t3_s9k95r	t3_s9k95r	/r/Anarcho_Capitalism/comments/s9k95r/hello_im_not_an_ancap_but_i_have_some_questions/htnbonf/
7q331wlw	*Oh so the feds and*  *Fda are taking a poll on*  *Who has had COVID?*  \- bain2486  ---  ^(I detect haikus. And sometimes, successfully.) ^[Learn&#32;more&#32;about&#32;me.](https://www.reddit.com/r/haikusbot/)  ^(Opt out of replies: "haikusbot opt out" | Delete my comment: "haikusbot delete")	1642798022.0	htnckjr	t3_s9jcit	t1_htncj5u	/r/Anarcho_Capitalism/comments/s9jcit/who_hasnt_had_covid_yet/htnckjr/
kahq8	Disregard the article but has anybody ever seen an election graph jump like this?  https://factcheck.afp.com/wisconsin-vote-surge-was-not-fraud  I don’t believe the election was fraudulent, but I’ve also never seen a graph jump like this. Several counties mustve voted 90%+ for Biden which seems crazy.	1642801418.0	htnm1ke	t3_s9jzi3	t3_s9jzi3	/r/Anarcho_Capitalism/comments/s9jzi3/bidens_approval_rating_is_just_north_of_30/htnm1ke/
fdtz7gbf	Truckers getting fuck over is why Trump won. Imagine what's happen once trucking becomes fully automated. Truckers are literally not allowed to compete with a robot that can drive 24/7	1642802365.0	htnongt	t3_s9c33i	t1_htm1v4h	/r/Anarcho_Capitalism/comments/s9c33i/unvaccinated_truck_driver_entering_canada14_day/htnongt/
1ko98rch	Inalienable civil liberties and inherent human rights are deeper than just some document.	1642805387.0	htnwqfs	t3_s9l2f4	t3_s9l2f4	/r/Anarcho_Capitalism/comments/s9l2f4/the_constitution_has_either_allowed_what_has/htnwqfs/
1s3t5obl	I have it now would you like a cough in a bag mailed to you lol	1642807526.0	hto29tk	t3_s9jcit	t1_htnak8f	/r/Anarcho_Capitalism/comments/s9jcit/who_hasnt_had_covid_yet/hto29tk/
1hq7melu	If the truck driver guy had the shot then these fucks would start complaining that the border guy is spreading a deadly disease by throwing shit in the guy's truck	1642808852.0	hto5mbv	t3_s9c33i	t3_s9c33i	/r/Anarcho_Capitalism/comments/s9c33i/unvaccinated_truck_driver_entering_canada14_day/hto5mbv/
qzcuwon	This reminds me, I heard that in Rhode Island it’s illegal to put nails on your windowsill to prevent burglars from entering your home. If someone tries breaking into your house and hurts themselves they can sue you. Absurd. I never looked into it, but I wouldn’t be surprised if it’s true.	1642809116.0	hto6act	t3_s9kgf9	t3_s9kgf9	/r/Anarcho_Capitalism/comments/s9kgf9/if_i_put_it_on_my_property_shouldnt_i_have_the/hto6act/
16k8zg	I say lets go Brandon as much as the next guy, but this sucks.	1642810499.0	hto9ohu	t3_s9d9dz	t3_s9d9dz	/r/Anarcho_Capitalism/comments/s9d9dz/f_joe_biden/hto9ohu/
3f4zt1je	I don't live by the sea specifically to avoid this kind of sharkjumping lol	1642810962.0	htoau64	t3_s7tu6o	t3_s7tu6o	/r/Anarcho_Capitalism/comments/s7tu6o/no_lies_detected/htoau64/
di48uxx4	Eat my sweaty ass	1642812758.0	htof7x3	t3_s9c33i	t1_hto1jnm	/r/Anarcho_Capitalism/comments/s9c33i/unvaccinated_truck_driver_entering_canada14_day/htof7x3/
a5g2xmu4	*Ray Epps has entered the chat*	1642814382.0	htoj59n	t3_s9nra4	t1_hto78qm	/r/Anarcho_Capitalism/comments/s9nra4/conspiracy_theory_my_asshole/htoj59n/
845hcmvt	Tested for two years. Been around Covid positive people in my household and at work. Never masked, never vaxed, always test negative. Don’t know anyone who got seriously Ill from it. Know  people who killed themselves in lockdown though.	1642816937.0	htop7wa	t3_s9jcit	t3_s9jcit	/r/Anarcho_Capitalism/comments/s9jcit/who_hasnt_had_covid_yet/htop7wa/
fb9yvyak	It’s actually washingtonews.today 🧐	1642817611.0	htoqt1r	t3_s9kmmq	t1_htnexqj	/r/Anarcho_Capitalism/comments/s9kmmq/virginia_gop_governor_fires_off_11_executive/htoqt1r/
5bse5ejo	This is pretty gay	1642818023.0	htorsa3	t3_s9qzaj	t3_s9qzaj	/r/Anarcho_Capitalism/comments/s9qzaj/in_auckland_the_māori_people_protest_against/htorsa3/
14jtvt	“But the people love me” Cindy the sjw	1642818885.0	htotttr	t3_s9qzaj	t3_s9qzaj	/r/Anarcho_Capitalism/comments/s9qzaj/in_auckland_the_māori_people_protest_against/htotttr/
12epdq	If you know anything about how effective bureaucracy is, then you know this is furthest thing from the truth.	1642818886.0	htottyx	t3_s9gcnl	t3_s9gcnl	/r/Anarcho_Capitalism/comments/s9gcnl/we_can_add_a_bunch_of_other_3_letter_agencies_in/htottyx/
