author	body	created_at	c_id	s_id	p_id	permalink
fdtz7gbf	Hahaha, you're gonna be depressed in a few years at how stupid you are now.	1643190096.0	hu9x6jn	t3_scgrqv	t1_hu9wx1k	/r/Anarcho_Capitalism/comments/scgrqv/watch_reddit_upvote_medical_segregation/hu9x6jn/
9ozkyoxx	So no answers to my questions, you just cut up a baby because you want to?	1643190709.0	hu9xxi2	t3_scn5el	t1_hu9xt2w	/r/Anarcho_Capitalism/comments/scn5el/i_believe_circumcision_before_a_certain_age/hu9xxi2/
f0ci4x12	Author: U/userleansbot	1643192031.0	hu9zjpq	t3_scy2zl	t1_hu9p7ir	/r/Anarcho_Capitalism/comments/scy2zl/big_pharma_getting_paid/hu9zjpq/
9x5f56g5	[the cameramen are laughing...](https://www.youtube.com/watch?v=ALNjevGdB5g)	1643192963.0	hua0pga	t3_sctsux	t3_sctsux	/r/Anarcho_Capitalism/comments/sctsux/genuinely_surprising_how_much_media_coverage/hua0pga/
f0ci4x12	u/userleansbot	1643193458.0	hua1c2h	t3_scy2zl	t1_hu9p7ir	/r/Anarcho_Capitalism/comments/scy2zl/big_pharma_getting_paid/hua1c2h/
f0ci4x12	u/userleansbot	1643195888.0	hua4huh	t3_s6o4c4	t1_ht5wccs	/r/Anarcho_Capitalism/comments/s6o4c4/huh_thats_weird/hua4huh/
f0ci4x12	u/userleansbot Photon_Pharmer	1643196042.0	hua4plj	t3_scy2zl	t1_hua1dju	/r/Anarcho_Capitalism/comments/scy2zl/big_pharma_getting_paid/hua4plj/
eep0ulfa	My nephew is 3 and can’t even string a proper sentence together and is still wearing diapers.	1643197685.0	hua71g3	t3_scsmve	t3_scsmve	/r/Anarcho_Capitalism/comments/scsmve/3_year_old_chimney_sweeper_in_1933_before_child/hua71g3/
dndvwhvn	No one wants to hear their shit life is the direct result of their shit decisions. It’s always an unseen, uncontrollable force keeping them where they are. Those of us who can reflect and change do much better. Those of us who March in the streets against invisible boogiemen never see their lives improve.	1643201480.0	huada3c	t3_sd4ely	t3_sd4ely	/r/Anarcho_Capitalism/comments/sd4ely/think_im_going_to_get_banned/huada3c/
ge2v7jy9	So does this mean I have to absolutely think the way you do to be in here? Or is it not enough to be somewhat likeminded? Why would you try to push people away from this sub?  Small gov. is more realistic than anything “anarcho”	1643203281.0	huago4c	t3_scww8f	t3_scww8f	/r/Anarcho_Capitalism/comments/scww8f/psa_this_is_not_a_libertarian_subreddit/huago4c/
aaqpyyp	I agree, but I was trying to be charitably neutral. :)	1643203616.0	huahbyj	t3_scgkta	t1_hu9gt4d	/r/Anarcho_Capitalism/comments/scgkta/how_many_more_years_are_we_going_to_have_an/huahbyj/
kzl1e	What do you mean it’s not Jeff Bezos’ fault that my mother had 7 kids with 9 different baby daddies and her only income was welfare? How am I supposed to compete with Chad White from Connecticut at Harvard when his papa* drives a BMW?	1643205478.0	hual909	t3_sd4ely	t1_huada3c	/r/Anarcho_Capitalism/comments/sd4ely/think_im_going_to_get_banned/hual909/
dhg9ole8	I lurk as well. I agree with a lot of things said here, but I'm taking it as a time to learn more before I make statements.	1643205659.0	hualnho	t3_scww8f	t1_hu9djj0	/r/Anarcho_Capitalism/comments/scww8f/psa_this_is_not_a_libertarian_subreddit/hualnho/
i0dqcfdi	Surprised he didn't ask her for ID.	1643206701.0	huanz47	t3_scuy5q	t3_scuy5q	/r/Anarcho_Capitalism/comments/scuy5q/thoughts/huanz47/
kzl1e	Some more melanated and with brighter hair.	1643207087.0	huaov5j	t3_sd5wh0	t1_huamg1l	/r/Anarcho_Capitalism/comments/sd5wh0/they_found_a_mod_of_rantiwork_a_30_year_old_non/huaov5j/
11p0rc	WhO WiLl bUiLd tHE rOAds	1643207170.0	huap23t	t3_sd63cu	t3_sd63cu	/r/Anarcho_Capitalism/comments/sd63cu/ugh_youre_an_ancap/huap23t/
aaqpyyp	It would be easier to sympathize with the antiwork people if more of them had some identifiable skills or had a history of doing hard work.      Retail and fast food are tedious jobs that kind of suck, but they're not skilled jobs. And it seems like most of the antiwork people come from those type of professional backgrounds. They're not yokel or hoodrat level of uneducated. They could probably graduate college if they had the commitment.      And that's kind of the problem. They view themselves as smart, productive people but they refuse to develop the skills for a white collar job, and they think too highly of themselves to work a blue collar job or skilled trade.      Judging by the person in this video, a lot of them also suffer from the fact that their toxic personality and ideology is what really holds them back. HR departments see a sad loser with a bad attitude and they're not going to hire them at the smiley face everyone needs to pretend they're happy corporate office job.	1643207719.0	huaqc8n	t3_sd5wh0	t3_sd5wh0	/r/Anarcho_Capitalism/comments/sd5wh0/they_found_a_mod_of_rantiwork_a_30_year_old_non/huaqc8n/
aaqpyyp	I kicked around at a couple of dead-end office jobs for 4 years after college. Eventually I just admitted that it wasn't working because my superiors liked having me in the production position I was in and had zero incentive to elevate me.      Instead of whining, I went out and got a teaching certification and did that for three years. I leveraged my experience as an English teacher to get a copywriting job, and that gave me the doorway into a career in marketing that's paid pretty well so far.	1643207957.0	huaqwik	t3_sd5wh0	t1_huanjyu	/r/Anarcho_Capitalism/comments/sd5wh0/they_found_a_mod_of_rantiwork_a_30_year_old_non/huaqwik/
aaqpyyp	They're dumb. Their biggest commie-style argument they could make is one they aren't making. I'll demonstrate what they could be arguing rather than just demanding arbitrary wage increases.      They could advocate for mandatory stock sharing with employees for publicly traded companies.   Everyone knows Amazon would be crippled if all those delivery drivers went on strike tomorrow. Those drivers and warehouse workers are the people who really built Amazon, but all the financial awards went to Jeff Bezos, investors, and top management.      Imagine if Amazon had to give stock to employees as part of the compensation package. The bigger the company gets, the less percentage owned by the founder. This is actually pretty fair. Once a company reaches a certain size, it's continued success is largely dependent on the workers executing all the tasks they're given. It requires a lot of intelligence in executive strategy and management, naturally, but those people are already rewarded quite well for their contributions. Sharing stocks with employees would also benefit the entire middle-management and the lower-level office workers as well at the company. They get paid better than delivery drivers, but they're not seeing record-shattering wealth increases like the investors and company ownership are.	1643208499.0	huas78y	t3_sd5wh0	t1_huap50k	/r/Anarcho_Capitalism/comments/sd5wh0/they_found_a_mod_of_rantiwork_a_30_year_old_non/huas78y/
11p0rc	It’s Almost like they’ve never really thought it thru	1643208983.0	huatdv2	t3_sd63cu	t1_huarrbv	/r/Anarcho_Capitalism/comments/sd63cu/ugh_youre_an_ancap/huatdv2/
aaqpyyp	Yeah, they'll sit there and refuse to accept any sources you link and claim that they're all right-wing rags.      Then they'll turn around without a lick of shame and link WaPo and NYT and pretend like those are the true bastions of journalism. Because a newsroom full of Democrats are totally capable, as real human beings, of separating their personal bias from their reporting. Right......	1643209549.0	huausji	t3_sctubz	t1_hu8u69p	/r/Anarcho_Capitalism/comments/sctubz/you_gotta_pump_those_numbers_up_those_are_rookie/huausji/
q9njf	For the curious ones. here's the interview:  [https://www.youtube.com/watch?v=3yUMIFYBMnc](https://www.youtube.com/watch?v=3yUMIFYBMnc)	1643209882.0	huavmrf	t3_sd5wh0	t3_sd5wh0	/r/Anarcho_Capitalism/comments/sd5wh0/they_found_a_mod_of_rantiwork_a_30_year_old_non/huavmrf/
aaqpyyp	Would the Republican campaign against the media be so effective if CNN, MSNBC, CBS, ABC, NBC, WaPo, NYT, etc. hadn't consistently portrayed the fuckups of Democrats as "unfortunate mistakes" and the fuckups of Republicans as "malicious intent" so consistently?      Look at how the white house press corps reacted to Biden calling a Fox News reporter a stupid son of a bitch. They absolutely didn't care because they don't consider Doocy to be a peer worth protecting. It's the white house press corps: the entire room, including the people on the podium, is full of stupid sons of bitches.	1643209992.0	huavwul	t3_sctubz	t1_hu9oj29	/r/Anarcho_Capitalism/comments/sctubz/you_gotta_pump_those_numbers_up_those_are_rookie/huavwul/
aaqpyyp	It's not really American society. It's more Democrat society. Hyping up racial issues means cheap votes for them, so they're never going to give it up.	1643210044.0	huaw1l5	t3_sctubz	t1_hu9fnh0	/r/Anarcho_Capitalism/comments/sctubz/you_gotta_pump_those_numbers_up_those_are_rookie/huaw1l5/
aaqpyyp	I always feel conflicted because I'm sort of left on a variety of social issues, but as an Army veteran from a working-class household, I feel like I've had to work hard to get where I am. No uncles or friends of the family opened any doors for me. I paid my way through college with zero parental assistance.      Basically, I don't feel guilty to be a straight white guy. I've worked with enough black people, Hispanics, and other races to feel like I personally don't owe them anything. I was working the same jobs as them, which means we had the same opportunity to end up in the same position.  Several of my middle-class suburban neighbors are black.	1643210332.0	huaws11	t3_sctubz	t1_huat5k4	/r/Anarcho_Capitalism/comments/sctubz/you_gotta_pump_those_numbers_up_those_are_rookie/huaws11/
aaqpyyp	Yep. Three days after my 16th birthday was my first evening stocking grocery store shelves. Also worked fast food and at a movie theater during high school. It wasn't just the work that convinced me to try and do better, it was the older people I met.      When you're 16, a 24 year old seems old to you. I guess they kind of are since they have 50% more life experience than you and have been a legal adult longer than you've been a teenager. When they're slinging pizzas at pizza hut making the same wage as you, you realize that you absolutely don't want to be in their position when you're 24.	1643210881.0	huay71v	t3_sd5wh0	t1_huatl80	/r/Anarcho_Capitalism/comments/sd5wh0/they_found_a_mod_of_rantiwork_a_30_year_old_non/huay71v/
cj5dvr8b	Reddit mods are 110% incel cockwranglers. No exceptions.	1643211702.0	hub0cs1	t3_sd5wh0	t3_sd5wh0	/r/Anarcho_Capitalism/comments/sd5wh0/they_found_a_mod_of_rantiwork_a_30_year_old_non/hub0cs1/
3x0nsgq5	A “mod.”	1643211732.0	hub0fk0	t3_sd5wh0	t3_sd5wh0	/r/Anarcho_Capitalism/comments/sd5wh0/they_found_a_mod_of_rantiwork_a_30_year_old_non/hub0fk0/
7u8ha9h	They actually only work half that. They've said they do 2 hours 5 days a week. Guessing he didn't need math skills to become a dog walker	1643211739.0	hub0g8z	t3_sd1bch	t1_huag25o	/r/Anarcho_Capitalism/comments/sd1bch/if_you_havent_seen_the_fox_news_interview_w/hub0g8z/
5k6j015n	Yeah well the idea of there being no state is pretty ridiculous so here we are	1643211741.0	hub0gfy	t3_scww8f	t3_scww8f	/r/Anarcho_Capitalism/comments/scww8f/psa_this_is_not_a_libertarian_subreddit/hub0gfy/
85qdh7cn	I thought that sub was owned by some soros ad agency to fuck up the US economy.  This type of person my second guess. But I'm honestly surprised it wasn't that first.	1643212002.0	hub157x	t3_sd5wh0	t3_sd5wh0	/r/Anarcho_Capitalism/comments/sd5wh0/they_found_a_mod_of_rantiwork_a_30_year_old_non/hub157x/
6f92c	Physiognomy is real	1643212692.0	hub30gd	t3_sd5wh0	t3_sd5wh0	/r/Anarcho_Capitalism/comments/sd5wh0/they_found_a_mod_of_rantiwork_a_30_year_old_non/hub30gd/
el3i9iti	Elon Musk is very happy :D	1643214563.0	hub839i	t3_scsmve	t3_scsmve	/r/Anarcho_Capitalism/comments/scsmve/3_year_old_chimney_sweeper_in_1933_before_child/hub839i/
9fh7t	Most laws do not interfere with rent increases when the tenant moves out.	1643214889.0	hub8zna	t3_sd8lde	t3_sd8lde	/r/Anarcho_Capitalism/comments/sd8lde/why_do_stupid_laws_exist/hub8zna/
8g682	Why has communism always been so attractive to fat ugly midwits? You only need to open a history book to see they're the first to be rounded up in an actual communist regime once a Chad takes over as dictator.	1643216188.0	hubcntx	t3_sd5wh0	t1_huanzze	/r/Anarcho_Capitalism/comments/sd5wh0/they_found_a_mod_of_rantiwork_a_30_year_old_non/hubcntx/
9q3s3	I think there is a group of people who *thought* they like that sub's ideals and elevated that particular situation. They unfortunately didn't realize that that was not a priority to the people actually running the sub, as seen in this interview. In fact, I'm not sure the people running that sub even know what their priorities are in general, considering they told the Fox interviewer they're not trying to completely abolish work... while their username is /u/AbolishWork.	1643217002.0	hubeydn	t3_sd5wh0	t1_huaxml7	/r/Anarcho_Capitalism/comments/sd5wh0/they_found_a_mod_of_rantiwork_a_30_year_old_non/hubeydn/
1i5iflj9	I think they prey on lonely people in general, and autists are often lonely.  I've noticed there are a lot of new trans people who work from home (like programmers). If they come out as trans in real life, most people will think it's weird. However, when they come out as trans online, their mind is on a constant rush of dopamine and validation from other people online who suddenly become your friends.  I've also noticed that lots of trans women online don't even make the effort to try to look like real women. They just change their pronouns in bio and let their hair grow. Imo this is because they don't even want to look like a woman, they just want to reap the "benefits" of being trans online.	1643218973.0	hubkke9	t3_sctsux	t1_hubafg1	/r/Anarcho_Capitalism/comments/sctsux/genuinely_surprising_how_much_media_coverage/hubkke9/
3l9l0	I moderate the Folk Punk subreddit (train hopping punks playing shitty music) and I don't even look like that.	1643219020.0	hubkpcv	t3_sd5wh0	t1_huamg1l	/r/Anarcho_Capitalism/comments/sd5wh0/they_found_a_mod_of_rantiwork_a_30_year_old_non/hubkpcv/
u010d	I'm just thinking if "ideas should be free" or not. In a truly anarchist society, (and i should add that personally I don't understand "anarchism" but I get anarcho capitalism), then ideas would only be free if the one coming up with it is sharing it or not protecting it enough?	1643220958.0	hubq7sx	t3_sdbmfu	t1_hubmiq4	/r/Anarcho_Capitalism/comments/sdbmfu/what_do_you_think_of_this/hubq7sx/
u010d	I agree, but if the one who comes up with it doesn't share it? Or obfuscate it in some way such that it can only be accessed in certain ways or whatever. Isn't it Thier right to do that?	1643221023.0	hubqecx	t3_sdbmfu	t1_hubnceu	/r/Anarcho_Capitalism/comments/sdbmfu/what_do_you_think_of_this/hubqecx/
u010d	For sure, Im just thinking about an "idea from a philosophical persepctive", should it be the same as property or not?	1643221160.0	hubqrzx	t3_sdbmfu	t1_hubqkj8	/r/Anarcho_Capitalism/comments/sdbmfu/what_do_you_think_of_this/hubqrzx/
wqutd	Idk. I went to the court to file for my divorce. They told me to bring three notarized copies. The guy took one copy and very slowly and deliberately flipped through each page. Picking it up and setting it aside then reversing the process so they would remain in order. You know, instead of flipping each page as he went. Then he walked it to a scanner 10 feet behind him and made three copies. Then proceeded to stamp the top of every page of both the original and the copy. The. Write the number and date on each of the stamps where there was a spot for it. I asked why he didn’t mark the document before making copies and he looked at me like that was the greatest idea he had ever heard. Two of the original notarized copies and one of the scanned copies was given back to me. They kept one notarized copy for the court.	1643221576.0	hubrxyx	t3_sd6v8w	t3_sd6v8w	/r/Anarcho_Capitalism/comments/sd6v8w/must_be_the_government_at_work_all_that_paper_not/hubrxyx/
5qbndsnr	😀wawq21qw21	1643221663.0	hubs6nr	t3_sd7mm2	t1_huavjkm	/r/Anarcho_Capitalism/comments/sd7mm2/can_we_stop_with_the_antiwork_obsession/hubs6nr/
5qbndsnr	22 w w22w9sw2 w 21w22ss211112 w 2wq	1643222073.0	hubtbwh	t3_sd7mm2	t1_huavjkm	/r/Anarcho_Capitalism/comments/sd7mm2/can_we_stop_with_the_antiwork_obsession/hubtbwh/
an3avrx1	Ugh secondhand embarrassment	1643222534.0	hubumb7	t3_sdcuic	t3_sdcuic	/r/Anarcho_Capitalism/comments/sdcuic/rantiwork_moderator_on_fox_news/hubumb7/
11p0rc	You mean, how much do they spend on the $50hr ditch diggers that stand around 5 to 1 to doing an asphalt patch? More than they should, that’s for sure.	1643223037.0	hubw1b1	t3_sdaq0g	t3_sdaq0g	/r/Anarcho_Capitalism/comments/sdaq0g/but_what_about_roads_out_of_the_trillions_of/hubw1b1/
u010d	So ideas may be treated as property to some extent?	1643223186.0	hubwgi1	t3_sdbmfu	t1_hubvjgv	/r/Anarcho_Capitalism/comments/sdbmfu/what_do_you_think_of_this/hubwgi1/
e1i2sx	Authoritarianism is authoritarianism no matter what color lipstick you put on it.	1643224706.0	huc0q3q	t3_sd3m16	t3_sd3m16	/r/Anarcho_Capitalism/comments/sd3m16/discussion_conservatives_have_ideals_much_closer/huc0q3q/
k732y	This is Breadtube's target audience.	1643225085.0	huc1shv	t3_sctsux	t3_sctsux	/r/Anarcho_Capitalism/comments/sctsux/genuinely_surprising_how_much_media_coverage/huc1shv/
aaqpyyp	Imagine if federal and state bureaucracies were committed to modernizing their processes so that they could reduce expenditures and streamline services?      I don't just mean implementing self-service website interfaces. (Those are really great, btw)     I mean actually reducing the number of state and federal employees. So many of those fucking jobs are jokes but they refuse to lay off useless people. They've put up with lazy mopes for so long that they've lost the ability to create efficient programs. So rather than try to be efficient, they just lobby for even more positions to be created. And every damn one they create comes with decades of salary, benefits, and eventually pension payouts to burden the taxpayers with.      We need to stop the practice of government jobs, particularly federal government jobs, being "from hire till retire" positions. We need to have 3rd party auditors coming in, like every damn large company does, to evaluate where waste or unnecessary processes can be trimmed to cut down on overhead.	1643226758.0	huc6hav	t3_sdaq0g	t3_sdaq0g	/r/Anarcho_Capitalism/comments/sdaq0g/but_what_about_roads_out_of_the_trillions_of/huc6hav/
4bo1wcfz	They may have realized the joke was on them on Fox and hit the ssshhhh button	1643227057.0	huc7brm	t3_sddulr	t3_sddulr	/r/Anarcho_Capitalism/comments/sddulr/either_i_just_got_banned_or_antiwork_just_went/huc7brm/
h70yk09l	test	1643227653.0	huc90i0	t3_rk4uux	t3_rk4uux	/r/Anarcho_Capitalism/comments/rk4uux/why_i_hate_rantiwork/huc90i0/
aaqpyyp	I spent 4 hours in an IRS office...despite having an appointment. None of the employees showed any concern that they were over three hours behind schedule. Nor did their pace of work indicate that they were particularly interested in speeding it up.      I imagine that, being the IRS, they were aware that they could fuck up my paperwork and potentially cost me thousands of dollars if I didn't sit there and keep a lid on my growing anger.      It took less than 15 minutes once they finally called me back to one of the agents to provide them with additional information they had requested but that I didn't feel comfortable mailing to them (Wife's passport her first year in the U.S.)	1643227696.0	huc94to	t3_sdaq0g	t1_huc6wdf	/r/Anarcho_Capitalism/comments/sdaq0g/but_what_about_roads_out_of_the_trillions_of/huc94to/
3x371zxs	He looks like Dwight from the office	1643228188.0	hucaiwg	t3_sd5wh0	t3_sd5wh0	/r/Anarcho_Capitalism/comments/sd5wh0/they_found_a_mod_of_rantiwork_a_30_year_old_non/hucaiwg/
iujh93nl	The government? You can't be serious.    More like this https://youtu.be/ONFj7AYgbko	1643228302.0	hucaub7	t3_sd6v8w	t3_sd6v8w	/r/Anarcho_Capitalism/comments/sd6v8w/must_be_the_government_at_work_all_that_paper_not/hucaub7/
a1azpuxx	How do I find this panel on the internet bc YouTube is trying to block it?	1643228577.0	hucbmcx	t3_sd2g9u	t3_sd2g9u	/r/Anarcho_Capitalism/comments/sd2g9u/covid19_a_second_opinion_senator_ron_johnson/hucbmcx/
4bo1wcfz	Who thinks the dog walker lives with his parents?	1643228687.0	hucbxgo	t3_sddzuf	t3_sddzuf	/r/Anarcho_Capitalism/comments/sddzuf/picture_says_everything_looool_i_think_its/hucbxgo/
xwhagka	Maybe stop brigading and I’ll have a real debate with you	1643228789.0	hucc83s	t3_scsmve	t1_hua9axm	/r/Anarcho_Capitalism/comments/scsmve/3_year_old_chimney_sweeper_in_1933_before_child/hucc83s/
xwhagka	Cry more, you can’t un-due the rent	1643229062.0	hucd0et	t3_scsmve	t1_hucckjj	/r/Anarcho_Capitalism/comments/scsmve/3_year_old_chimney_sweeper_in_1933_before_child/hucd0et/
9hekknvw	I have hope it’ll be over soon fellow Canadians!!! I am unvaccinated and haven’t been able to do anything in the last 8 months or so, I am sick of this bullshit. I hope these politicians rot in hell. This protest is huge, Canadians are united like never before, the end is near. See you all in Ottawa!!!	1643229347.0	hucdtfi	t3_sdfpdc	t3_sdfpdc	/r/Anarcho_Capitalism/comments/sdfpdc/canadian_freedom_convoy_2022/hucdtfi/
xwhagka	YOU DELETED YOUR ANTIWORK POST AFTER I CALLED YOU OUT LMFAOOOOOOO	1643229696.0	hucet36	t3_scsmve	t1_hucdwzy	/r/Anarcho_Capitalism/comments/scsmve/3_year_old_chimney_sweeper_in_1933_before_child/hucet36/
xwhagka	You cheered on the death of your own cousin dude you have no right to call me a piece of shit	1643229855.0	hucf9l4	t3_scsmve	t1_hucf0wv	/r/Anarcho_Capitalism/comments/scsmve/3_year_old_chimney_sweeper_in_1933_before_child/hucf9l4/
mbtrj	That's not it. I think it's "against" work not anti	1643230332.0	hucgmcc	t3_sddulr	t1_huc4dkr	/r/Anarcho_Capitalism/comments/sddulr/either_i_just_got_banned_or_antiwork_just_went/hucgmcc/
kzl1e	Big Soviet Great Purge Energy on that sub.	1643231417.0	hucjnts	t3_sddzuf	t3_sddzuf	/r/Anarcho_Capitalism/comments/sddzuf/picture_says_everything_looool_i_think_its/hucjnts/
kzl1e	They deleted of their comments lmao	1643231533.0	hucjzfs	t3_sdd3o7	t1_huc9xfu	/r/Anarcho_Capitalism/comments/sdd3o7/that_special_moment_when_rantiwork_enters_the_chat/hucjzfs/
h70yk09l	test	1643231683.0	huckei0	t3_rk4uux	t3_rk4uux	/r/Anarcho_Capitalism/comments/rk4uux/why_i_hate_rantiwork/huckei0/
xj114	They're just out walking the dog.	1643231772.0	hucknfr	t3_sddulr	t3_sddulr	/r/Anarcho_Capitalism/comments/sddulr/either_i_just_got_banned_or_antiwork_just_went/hucknfr/
bhh34tn3	No, just dumbfuck Minnesotans. They're partly to blame for the current dumpster fire of an administration. And I'm pretty positive that YOU are the type of sheep who got his feelings hurt by Trump, and voted for Biden.   Great job, cupcake.	1643231908.0	hucl1d3	t3_sd5wh0	t1_huceq8d	/r/Anarcho_Capitalism/comments/sd5wh0/they_found_a_mod_of_rantiwork_a_30_year_old_non/hucl1d3/
xj114	Jesse Watters	1643232207.0	huclvif	t3_sddulr	t1_hucfbdq	/r/Anarcho_Capitalism/comments/sddulr/either_i_just_got_banned_or_antiwork_just_went/huclvif/
9ozkyoxx	I hate having a place to live that I didnt have to get a mortgage and pay for years to have with no obligations to repair! 🤬😡	1643232442.0	hucmixm	t3_sdfx0x	t3_sdfx0x	/r/Anarcho_Capitalism/comments/sdfx0x/landlord_bad/hucmixm/
blag55q0	The mods are doing an awful lot of free work for a sub that's against working.	1643232466.0	hucmlbc	t3_sddulr	t3_sddulr	/r/Anarcho_Capitalism/comments/sddulr/either_i_just_got_banned_or_antiwork_just_went/hucmlbc/
xj114	I have decided to create a robotics company and I'll rent out the robots for $14.99 per hour. One year minimum.	1643232470.0	hucmlpx	t3_sddulr	t1_hucbh1u	/r/Anarcho_Capitalism/comments/sddulr/either_i_just_got_banned_or_antiwork_just_went/hucmlpx/
kzl1e	No I mean the thing on the screenshot. Unless 99% of his comments where on antiwork	1643233232.0	hucopr2	t3_sdd3o7	t1_hucmr4s	/r/Anarcho_Capitalism/comments/sdd3o7/that_special_moment_when_rantiwork_enters_the_chat/hucopr2/
dndvwhvn	The mandates been defeated. Except healthcare workers. Apparently the constitution has a clause that excludes them from having rights.	1643233274.0	hucotx2	t3_sdh2l7	t3_sdh2l7	/r/Anarcho_Capitalism/comments/sdh2l7/fjb_flags_defeat_the_mandates_rally_at_washington/hucotx2/
dndvwhvn	Voting doesn’t fix that.	1643233651.0	hucpviq	t3_sdgwkk	t3_sdgwkk	/r/Anarcho_Capitalism/comments/sdgwkk/they_wont_even_let_me_go_to_the_grocery_isle_to/hucpviq/
bhh34tn3	Minnesota is colder, that's true. But no one has ever called it cool. What is it today, 24 below with the wind? Sounds awesome. You're really living the life, as a carpenter in the arctic.	1643233676.0	hucpxzv	t3_sd5wh0	t1_hucm3r2	/r/Anarcho_Capitalism/comments/sd5wh0/they_found_a_mod_of_rantiwork_a_30_year_old_non/hucpxzv/
ds58vdli	They booted everyone I think. It basically seems like they just killed the sub.	1643233820.0	hucqcfx	t3_sddulr	t1_huc0qoq	/r/Anarcho_Capitalism/comments/sddulr/either_i_just_got_banned_or_antiwork_just_went/hucqcfx/
11p0rc	Exactly right, this is always my standard answer to this pedestrian question “Who will build the roads?!” : the same people that build them now	1643235053.0	huctpnc	t3_sd63cu	t1_hucqkcr	/r/Anarcho_Capitalism/comments/sd63cu/ugh_youre_an_ancap/huctpnc/
6j3yolib	.	1643235294.0	hucucpf	t3_sdg8x1	t3_sdg8x1	/r/Anarcho_Capitalism/comments/sdg8x1/starts_today_jan2630_the_greater_reset_davos_the/hucucpf/
