author	body	created_at	c_id	s_id	p_id	permalink
2fnc3rb2	This has been my conclusion as well. This is all just mental masturbation whereas you will always have some form of "state" where everything is not 100% pure free choice.   What's more important IMO is a culture of liberty. Look at how certain US states responded to COVID restrictions versus a place like Australia. That matters way more than trying to dream up the perfect Mars settlement where every second of your life is voluntary.	1642943304.0	htvjd1d	t3_sambwv	t1_htvd0rs	/r/Anarcho_Capitalism/comments/sambwv/without_a_government_whats_stopping_people_from/htvjd1d/
kzl1e	Is no one on the left going to screechingly point out that he is using woman and man in a patriarchal heteronormative way? What if it’s the man that gets pregnant and the woman the one that needs to stick around and pay her fair share?	1642947814.0	htvrkcc	t3_saktm1	t3_saktm1	/r/Anarcho_Capitalism/comments/saktm1/what_do_you_think_of_this/htvrkcc/
bkpkqdsp	“He was in the prime of his life!”	1642954155.0	htw64lu	t3_sawc0e	t3_sawc0e	/r/Anarcho_Capitalism/comments/sawc0e/without_the_government_how_can_important/htw64lu/
aaqpyyp	There’s that real communism the tankies claim has never been tried	1642960128.0	htwll3a	t3_sav8rz	t3_sav8rz	/r/Anarcho_Capitalism/comments/sav8rz/til_lenin_sent_the_army_to_suppress_a_workers/htwll3a/
honw0	Capitalism is private ownership and control. It is explicitly incompatible with state control.	1642963124.0	htwteui	t3_saw4yv	t1_htwngys	/r/Anarcho_Capitalism/comments/saw4yv/judge_allows_wisconsin_hospital_to_prevent_its/htwteui/
4bo1wcfz	She said the quite part out loud	1642966114.0	htx11a1	t3_sab51p	t3_sab51p	/r/Anarcho_Capitalism/comments/sab51p/i_love_working_for_president_oba_president_biden/htx11a1/
11p0rc	Laughs in Pelosi	1642967853.0	htx5ftg	t3_sb0l7y	t3_sb0l7y	/r/Anarcho_Capitalism/comments/sb0l7y/am_i_going_crazy_bc_when_tf_has_fascism_had/htx5ftg/
ou78y	is this sub becoming retarded?	1642982121.0	hty6om8	t3_sb4eb5	t1_htxk0sw	/r/Anarcho_Capitalism/comments/sb4eb5/how_the_fuck_did_this_guy_become_president/hty6om8/
aaqpyyp	New York Post.   NYT hid the story	1642983602.0	htya9j5	t3_sb4eb5	t1_htxp59f	/r/Anarcho_Capitalism/comments/sb4eb5/how_the_fuck_did_this_guy_become_president/htya9j5/
kzl1e	They will.	1642991627.0	htytlpt	t3_sapfw7	t1_htuzfbo	/r/Anarcho_Capitalism/comments/sapfw7/migrating_away_from_more_robbery_is_ancapistan/htytlpt/
kzl1e	Wasn’t the whole point of Brexit to not waste pounds on European matters?   And the West stopped standing up for itself years ago.	1642993156.0	htyxjqb	t3_sba2g7	t3_sba2g7	/r/Anarcho_Capitalism/comments/sba2g7/big_fan_of_bureaucrats_always_writing_checks/htyxjqb/
efqnw	Give yourself a challenge!!	1642997084.0	htz6qn5	t3_sbcqca	t3_sbcqca	/r/Anarcho_Capitalism/comments/sbcqca/i_wasnt_born_in_the_us_but_ill_still_make_a/htz6qn5/
1i5iflj9	And if you've never had a million dollars you can't talk about taxing millionaires!	1642997392.0	htz7e4v	t3_sb9qty	t1_htyr4db	/r/Anarcho_Capitalism/comments/sb9qty/poor_wage_slaves_raise_of_hands_who_here_couldnt/htz7e4v/
kzl1e	Shit like this confuses me because judging from the date I assume it’s about BLM protests but then when the other side storms the Capitol that’s not how you’re supposed to do it? Make it make sense.	1642997838.0	htz8bie	t3_sb49j0	t3_sb49j0	/r/Anarcho_Capitalism/comments/sb49j0/truth/htz8bie/
gem4qb69	Write it on my dick with your mom’s mouth.	1643007847.0	htzpk6s	t3_sbbsvl	t1_htzini5	/r/Anarcho_Capitalism/comments/sbbsvl/world/htzpk6s/
gem4qb69	Their grandma has to suck my cock first.	1643010796.0	htztmdz	t3_sbgoe3	t3_sbgoe3	/r/Anarcho_Capitalism/comments/sbgoe3/what_do_yall_think/htztmdz/
2vce5z2p	I'm allowed to talk about whatever I want, thank you.	1643021903.0	hu07c4r	t3_sb9qty	t3_sb9qty	/r/Anarcho_Capitalism/comments/sb9qty/poor_wage_slaves_raise_of_hands_who_here_couldnt/hu07c4r/
2vce5z2p	Imagine refusing to interact with someone because they don't like being controlled.	1643021992.0	hu07g70	t3_sb3zr9	t1_htzs6pn	/r/Anarcho_Capitalism/comments/sb3zr9/2022_extremists/hu07g70/
2vce5z2p	This is even funnier without audio.	1643022127.0	hu07mi4	t3_sb5kyu	t3_sb5kyu	/r/Anarcho_Capitalism/comments/sb5kyu/tds_karen_showed_up_at_the_defeat_the_mandates/hu07mi4/
2u8593qe	That is very twisted, fucked up logic. I bet a union is involved.	1643030439.0	hu0kdfp	t3_saw4yv	t3_saw4yv	/r/Anarcho_Capitalism/comments/saw4yv/judge_allows_wisconsin_hospital_to_prevent_its/hu0kdfp/
4bo1wcfz	Lame stream media was a big help	1643031140.0	hu0lpmq	t3_sb4eb5	t3_sb4eb5	/r/Anarcho_Capitalism/comments/sb4eb5/how_the_fuck_did_this_guy_become_president/hu0lpmq/
dndvwhvn	I need to see what happened before the fence throwing.	1643031859.0	hu0n4jv	t3_sbme9k	t3_sbme9k	/r/Anarcho_Capitalism/comments/sbme9k/antivax_riots_in_brussels_throwing_fences_at/hu0n4jv/
7ehm1	aww he gets mad when the facts destroy everything he has said	1643038784.0	hu12th3	t3_s9nra4	t1_hu0ytof	/r/Anarcho_Capitalism/comments/s9nra4/conspiracy_theory_my_asshole/hu12th3/
8czit4ng	Yeah but the exact specs of the plastic spout, bag, and box are designed to accomplish the goal in the absolute cheapest way possible. I’m not sure many people could get the design as cheap as it is now. Close maybe	1643041329.0	hu19d88	t3_sb9qty	t1_hu18foh	/r/Anarcho_Capitalism/comments/sb9qty/poor_wage_slaves_raise_of_hands_who_here_couldnt/hu19d88/
7ehm1	aw appeal to emotion after  getting destroyed by facts  republicunts are almost as bad as dems you idiot, stop living your life thru twitter screenshots	1643043263.0	hu1ehvc	t3_s9nra4	t1_hu19eem	/r/Anarcho_Capitalism/comments/s9nra4/conspiracy_theory_my_asshole/hu1ehvc/
13d589	Protestor armed with long fence	1643045680.0	hu1l1x1	t3_sbme9k	t1_hu0uj7l	/r/Anarcho_Capitalism/comments/sbme9k/antivax_riots_in_brussels_throwing_fences_at/hu1l1x1/
kzl1e	She’s not a she anymore. She’s a they.	1643047615.0	hu1qcic	t3_sbkp4c	t1_hu0n5lw	/r/Anarcho_Capitalism/comments/sbkp4c/i_saw_this_earlier/hu1qcic/
kzl1e	She was already in rehab in 2010, just barely 18 years old…	1643047833.0	hu1qxpw	t3_sbkp4c	t1_hu0ge9t	/r/Anarcho_Capitalism/comments/sbkp4c/i_saw_this_earlier/hu1qxpw/
zohqx	Microchip vaccines? What the hell is even that?	1643051897.0	hu21v10	t3_sbp8p7	t1_hu1e1v6	/r/Anarcho_Capitalism/comments/sbp8p7/name_the_wins/hu21v10/
zohqx	Ah.... yes, I did see that actually did happen. Some idiots volunteered for it.	1643056954.0	hu2f3f1	t3_sbp8p7	t1_hu26qad	/r/Anarcho_Capitalism/comments/sbp8p7/name_the_wins/hu2f3f1/
11p0rc	It’s the State injecting itself between the free commerce of private individuals and private businesses. How is that on the company? The first word of the tittle is Judge, not Boss or Owner.	1643057265.0	hu2fx5c	t3_sbld4i	t1_hu1j9ax	/r/Anarcho_Capitalism/comments/sbld4i/its_almost_like_they_have_an_inconsistent/hu2fx5c/
2vce5z2p	Will you please show me anything I said on this thread that shows I'm not calm?	1643057551.0	hu2goa0	t3_sb3zr9	t1_hu0cnw0	/r/Anarcho_Capitalism/comments/sb3zr9/2022_extremists/hu2goa0/
11p0rc	Absolutely right, knowing that the only entity who could “legally” restrain its employees with the threat of force is the court. Without it it was powerless.   Your move.	1643058089.0	hu2i479	t3_sbld4i	t1_hu2g2vp	/r/Anarcho_Capitalism/comments/sbld4i/its_almost_like_they_have_an_inconsistent/hu2i479/
buucjyxp	Hshah now that's funny shit. The French in Canada certainly don't have the fight like in France.	1643062003.0	hu2shph	t3_sbvue4	t3_sbvue4	/r/Anarcho_Capitalism/comments/sbvue4/what_the_fuck_america_please_invade_canada/hu2shph/
2vce5z2p	So now the government is telling us to DRINK our problems away? It's almost like they WANT us to be weaker.	1643062909.0	hu2utwu	t3_sayl6k	t3_sayl6k	/r/Anarcho_Capitalism/comments/sayl6k/jen_psaki_my_advice_to_everyone_out_there_whos/hu2utwu/
wluy5	But it isn't if the person is unaware of it, right?	1643064369.0	hu2ykfv	t3_sbq5yy	t3_sbq5yy	/r/Anarcho_Capitalism/comments/sbq5yy/gang_rape_is_literally_democracy_in_action/hu2ykfv/
dndvwhvn	Good times create weak men.	1643065094.0	hu30dyh	t3_sbyxag	t3_sbyxag	/r/Anarcho_Capitalism/comments/sbyxag/without_our_glorious_government_how_can_we_have/hu30dyh/
cvu62qki	Yes! Good forbid it you have a view which dissents against anything outside of CNN democratic talking points—you’ll be maligned by everyone in the comment section even if what you’re saying is objective fact or you’re being rather uncontroversial.   If you don’t agree, you must be looked down upon. So obnoxious 💀	1643067482.0	hu367sv	t3_sbvjxn	t1_hu2wxod	/r/Anarcho_Capitalism/comments/sbvjxn/is_it_just_me_or_is_rlibertarian_been_infiltrated/hu367sv/
cvu62qki	Love and agree with everything about this comment.	1643067728.0	hu36nda	t3_sbvjxn	t1_hu31k47	/r/Anarcho_Capitalism/comments/sbvjxn/is_it_just_me_or_is_rlibertarian_been_infiltrated/hu36nda/
cvu62qki	Want to start that subreddit? I’m in support.	1643067833.0	hu36u67	t3_sbvjxn	t1_hu36ixq	/r/Anarcho_Capitalism/comments/sbvjxn/is_it_just_me_or_is_rlibertarian_been_infiltrated/hu36u67/
aaqpyyp	Why was Ray Epps, a man who was on video multiple times clearly telling people they needed to breach the capitol building, taken off the FBI's wanted list and never charged with anything? The dude was on video talking to the individual who breached the first barricade seconds before the guy attacked the barricade.      The case against him is all on video viewable to the public. Yet the FBI didn't arrest him, and instead tried to make him disappear from their website.      When we combine this with the fact that over half the conspirators in the Gretchen Whitmer kidnapping plot were FBI CIs or agents, and the history of the FBI creating plots where none existed, we have every fucking reason to question what role the FBI played on January 6th. All we can say for certain right now is that they did not play the role of a law enforcement agency trying to prevent violence or crime....which is part of their goddamn job.	1643143497.0	hu79x9s	t3_scgkta	t1_hu750b2	/r/Anarcho_Capitalism/comments/scgkta/how_many_more_years_are_we_going_to_have_an/hu79x9s/
aaqpyyp	Fair enough.	1643143539.0	hu7a1b6	t3_scgkta	t1_hu76vla	/r/Anarcho_Capitalism/comments/scgkta/how_many_more_years_are_we_going_to_have_an/hu7a1b6/
41y0n90d	Get a job, or leave	1643145702.0	hu7ftg5	t3_scl9vi	t1_hu76e3d	/r/Anarcho_Capitalism/comments/scl9vi/society_destroying_degenerates_must_be_physically/hu7ftg5/
d9dzef9o	a great example of taxation is on the first godfather where don fanucci sees corleone is doing well, and claims he needs his cut   the only way to combat this is the same way corleone handled fanucci :)	1643146636.0	hu7ianq	t3_scnxux	t3_scnxux	/r/Anarcho_Capitalism/comments/scnxux/i_hate_it_when_libertarians_say_that_taxation_is/hu7ianq/
4bo1wcfz	The media is doing a great job tearing us apart!	1643146671.0	hu7idw5	t3_scgbnu	t3_scgbnu	/r/Anarcho_Capitalism/comments/scgbnu/ad_placement/hu7idw5/
1gmw09yg	People's definitions of rights are "things that would be nice to have".  And that's fine for "food", but becomes a serious problem when that same standard is applied to free speech, criminal justice, guns, etc.  Declaring food a right is an attack on the very concept of rights.	1643146928.0	hu7j2g0	t3_scg8x7	t1_hu5ve31	/r/Anarcho_Capitalism/comments/scg8x7/look_north_korea_and_most_of_africa_is_green_how/hu7j2g0/
kzl1e	A lot of people got checks to do nothing for months on end in 2020.	1643148225.0	hu7mc8l	t3_scnz19	t1_hu7h1r4	/r/Anarcho_Capitalism/comments/scnz19/h_o_w/hu7mc8l/
kzl1e	Yes, also economically illiterate.	1643148246.0	hu7me6n	t3_scnz19	t1_hu7iwfe	/r/Anarcho_Capitalism/comments/scnz19/h_o_w/hu7me6n/
dkkoy	Depends what you mean by worse I guess...	1643148317.0	hu7mkhv	t3_scgkta	t1_hu7dxh8	/r/Anarcho_Capitalism/comments/scgkta/how_many_more_years_are_we_going_to_have_an/hu7mkhv/
alzudt3q	You talking about all the black people racially harassing or murdering Asians?	1643148604.0	hu7n9t0	t3_scgbnu	t1_hu72jkj	/r/Anarcho_Capitalism/comments/scgbnu/ad_placement/hu7n9t0/
dndvwhvn	Why would they ever use gofundme. They deserve to lose the funds.	1643148835.0	hu7ntx5	t3_scop0m	t3_scop0m	/r/Anarcho_Capitalism/comments/scop0m/truckers_against_vax_mandate_raise_millions/hu7ntx5/
4bo1wcfz	Was it by chance the Fauci ouchie song	1643149386.0	hu7p67e	t3_sc56v3	t3_sc56v3	/r/Anarcho_Capitalism/comments/sc56v3/all_cuz_i_commented_one_thing_on_churchofcovid/hu7p67e/
7rkp2	They're going to be laughing all the way to the bank with your money. They aren't helping you if you ever need it	1643149422.0	hu7p9ds	t3_scn2iz	t3_scn2iz	/r/Anarcho_Capitalism/comments/scn2iz/anyone_know_any_venmo_or_paypal_accounts_where/hu7p9ds/
xj114	Nah, they just added a little spin /s	1643150971.0	hu7t69x	t3_scgkta	t1_hu74332	/r/Anarcho_Capitalism/comments/scgkta/how_many_more_years_are_we_going_to_have_an/hu7t69x/
gf5oonsc	The capital gains tax and income tax more generally is probably one of the worst taxes ever conceived. A tax on productivity. I wish Hazlitt's *Economics in One Lesson* was mandatory reading in high schools.	1643151423.0	hu7uc4x	t3_scpup1	t3_scpup1	/r/Anarcho_Capitalism/comments/scpup1/taxes/hu7uc4x/
4bo1wcfz	Bofl, sorry for your luck but the Banned Game/Censorship is strong around this digital jungle. We all can banned in a snap and I ain’t talkin chat either 🤣	1643151656.0	hu7uxjb	t3_sc56v3	t1_hu7tum6	/r/Anarcho_Capitalism/comments/sc56v3/all_cuz_i_commented_one_thing_on_churchofcovid/hu7uxjb/
4bo1wcfz	GET EMMMM! And best of luck Mr. President George Washington	1643152021.0	hu7vuoh	t3_sc56v3	t1_hu7v5yf	/r/Anarcho_Capitalism/comments/sc56v3/all_cuz_i_commented_one_thing_on_churchofcovid/hu7vuoh/
dndvwhvn	Don’t give them any attention. Who cares	1643152350.0	hu7wo4o	t3_scqo3x	t3_scqo3x	/r/Anarcho_Capitalism/comments/scqo3x/wheres_the_sign_that_says_your_body_your_choice/hu7wo4o/
dndvwhvn	Someone has to pay for politicians children to get high paying jobs at foreign gas companies. Don’t be selfish. Do you know how expensive a foot job from underage prostitute is?	1643153003.0	hu7yban	t3_scpup1	t3_scpup1	/r/Anarcho_Capitalism/comments/scpup1/taxes/hu7yban/
4bo1wcfz	And what happened to the celebs that said vaccines cause autism? Where did that movement go?	1643153412.0	hu7zbuc	t3_scqo3x	t3_scqo3x	/r/Anarcho_Capitalism/comments/scqo3x/wheres_the_sign_that_says_your_body_your_choice/hu7zbuc/
fuhtfkbx	Are you kidding me	1643154509.0	hu820cl	t3_sceicv	t3_sceicv	/r/Anarcho_Capitalism/comments/sceicv/look_at_this_and_tell_me_with_a_straight_face/hu820cl/
4bo1wcfz	Damn	1643154516.0	hu8210b	t3_scr42w	t3_scr42w	/r/Anarcho_Capitalism/comments/scr42w/lol_one_fuccing_deleted_comment_caused_this/hu8210b/
4bo1wcfz	You went for there Washington sir!	1643154577.0	hu826cr	t3_scr42w	t3_scr42w	/r/Anarcho_Capitalism/comments/scr42w/lol_one_fuccing_deleted_comment_caused_this/hu826cr/
hp4kj	Weird coz they won't take blood donations from c19 vaxd folks 🤔	1643154762.0	hu82mfu	t3_scrh2f	t3_scrh2f	/r/Anarcho_Capitalism/comments/scrh2f/seems_bad_but_at_the_end_of_the_day_he_would_be/hu82mfu/
4bo1wcfz	🤣	1643155937.0	hu85fpg	t3_scqo3x	t1_hu83691	/r/Anarcho_Capitalism/comments/scqo3x/wheres_the_sign_that_says_your_body_your_choice/hu85fpg/
4bo1wcfz	It’s sad he doesn’t get a heart, if covid didn’t exist then he would’ve most likely received a transplant. I thought all hospitals in America have an obligation to save a life, not matter what. I thought they took an oath but I’m not positive if that is still a thing in that profession	1643157249.0	hu88kxr	t3_scrh2f	t3_scrh2f	/r/Anarcho_Capitalism/comments/scrh2f/seems_bad_but_at_the_end_of_the_day_he_would_be/hu88kxr/
fuhtfkbx	I really hope he can start a new homestead , far far away from society. Seems like he has some nice ideas of living. The while thing is so sad and unjust…	1643158580.0	hu8bsg1	t3_scc192	t3_scc192	/r/Anarcho_Capitalism/comments/scc192/what_do_you_guys_think_of_this_sounds_like/hu8bsg1/
4dnznyrq	You said nothing happens without government grants or investments I sarcastically said, and nothing would either right. If the government didn't steal to provide investments or grants it wouldn't be in anyone's own self interest to provide that which the government was not.	1643158590.0	hu8btan	t3_scpup1	t3_scpup1	/r/Anarcho_Capitalism/comments/scpup1/taxes/hu8btan/
d9dzef9o	$1 says they cant beat themselves outta wet paper bag	1643158776.0	hu8c9g7	t3_scqo3x	t3_scqo3x	/r/Anarcho_Capitalism/comments/scqo3x/wheres_the_sign_that_says_your_body_your_choice/hu8c9g7/
1pcaqr3y	You should’ve just got a vaccine, lmao.	1643159215.0	hu8dbus	t3_scruds	t3_scruds	/r/Anarcho_Capitalism/comments/scruds/i_dropped_out_of_university_today/hu8dbus/
a2uo5gjw	If your gonna talk that way to us you better have level 4 plates and steel balls	1643159495.0	hu8dznb	t3_scqo3x	t3_scqo3x	/r/Anarcho_Capitalism/comments/scqo3x/wheres_the_sign_that_says_your_body_your_choice/hu8dznb/
7wgx6k83	Dumb. There's no link posted at 6:55.   The next link posted in the video is for a different data set. You didn't read it, did you?	1643159506.0	hu8e0ib	t3_s8ufwl	t1_hu7l7s6	/r/Anarcho_Capitalism/comments/s8ufwl/guess_it_wasnt_china_under_reporting_their_deaths/hu8e0ib/
chhhgzxk	#Lauren jobs(wife of late Steve jobs) made net 3.2 billion dollars in 2020  #Tim cook CEO of apple got 98 million dollars in salary in 2020.	1643160040.0	hu8faj9	t3_sct4x5	t3_sct4x5	/r/Anarcho_Capitalism/comments/sct4x5/gotta_love_a_little_rantiwork_roast/hu8faj9/
oqmzy	I wonder if they would agree if the hospital refused to treat a smoker or a pothead or someone who Engages in risky sex or a drug addict? I wonder if they would feel the same way if the person who didn’t want to be vaccinated was a person of color who was fearful of a government who had previously carried out atrocities like the Tuskegee experiment.	1643160068.0	hu8fd0c	t3_scgrqv	t3_scgrqv	/r/Anarcho_Capitalism/comments/scgrqv/watch_reddit_upvote_medical_segregation/hu8fd0c/
fp6kojs6	TIL I've needed to show papers and a secure QR code to be employed in certain places, go to a restaurant/mall or even go to Walmart even before COVID.	1643160157.0	hu8fkm5	t3_sbq5yy	t1_hu4npkj	/r/Anarcho_Capitalism/comments/sbq5yy/gang_rape_is_literally_democracy_in_action/hu8fkm5/
d9dzef9o	i doubt it. she prolly wears one in the car on her way to work, alone.	1643160371.0	hu8g2xr	t3_scsvc6	t1_hu8fr32	/r/Anarcho_Capitalism/comments/scsvc6/masks_are_for_the_cult/hu8g2xr/
4bo1wcfz	I see your valid point indeed, could there be an offer for the gift vs the funds for the gift wager? Don’t employers need you as much as you/me/we need them (Serious questions please no attitude). Now no the company doesn’t need to give gifts but in 2022, a little Swiss Army knife, that might be considered a deadly weapon where you might need a permit to carry legally. I totally understand the paycheck point of view, but if all your employers quit, will most company’s survive?	1643161816.0	hu8jh6g	t3_scttda	t3_scttda	/r/Anarcho_Capitalism/comments/scttda/people_often_forget_the_real_gift_for_working_for/hu8jh6g/
4bo1wcfz	Awesome! Above and beyond	1643164507.0	hu8pulh	t3_scuy5q	t3_scuy5q	/r/Anarcho_Capitalism/comments/scuy5q/thoughts/hu8pulh/
11p0rc	Shootin fish in a barrel really	1643164516.0	hu8pvbn	t3_sctt7y	t3_sctt7y	/r/Anarcho_Capitalism/comments/sctt7y/only_took_me_one_comment_to_get_banned_feeling/hu8pvbn/
5p41dhx2	Bro that first point. I can relate so hard. I’ve been cancelled by some leftists in my uni. My days, this teacher destroyed ky grades simply because of political disagreements. I feel U	1643164558.0	hu8pyy4	t3_scruds	t3_scruds	/r/Anarcho_Capitalism/comments/scruds/i_dropped_out_of_university_today/hu8pyy4/
gf5oonsc	Yep. One of the only taxes I can see myself supporting in the future. The problem is that I imagine if it gets proposed it will be in ADDITION to income tax, as opposed to replacing it.	1643167599.0	hu8wzjk	t3_scpup1	t1_hu8jhz9	/r/Anarcho_Capitalism/comments/scpup1/taxes/hu8wzjk/
gf5oonsc	The idea of being punished for improvement really bothers me. Why be productive and earn 50k more when I'll only keep half of it?	1643167694.0	hu8x7at	t3_scpup1	t1_hu7z4dl	/r/Anarcho_Capitalism/comments/scpup1/taxes/hu8x7at/
fuhtfkbx	Sickening. These liberal minimum wage workers get a power trip of enforcing the masks… just shut up and serve the customer	1643167799.0	hu8xfuo	t3_scsvc6	t3_scsvc6	/r/Anarcho_Capitalism/comments/scsvc6/masks_are_for_the_cult/hu8xfuo/
3my26	I agree 100% that it's not required to be good in the field but I've been in it for 25 years and I STILL have to submit and have my college CS degree verified for a new job.  You might not like the student loan but I'm not sure it wasn't the smartest move.	1643168178.0	hu8yalc	t3_scruds	t1_hu856w1	/r/Anarcho_Capitalism/comments/scruds/i_dropped_out_of_university_today/hu8yalc/
d9dzef9o	i believe that is an aged yogurt raisin	1643168237.0	hu8yfbj	t3_sctsux	t1_hu8tphd	/r/Anarcho_Capitalism/comments/sctsux/genuinely_surprising_how_much_media_coverage/hu8yfbj/
58hqmaf6	If the cops are cool, why does Noemi object to following the will of the people when legalization went through?	1643169868.0	hu91zaa	t3_scuy5q	t3_scuy5q	/r/Anarcho_Capitalism/comments/scuy5q/thoughts/hu91zaa/
34k4pw7d	Hmm. Speaks a lot about DoorDash’s background checks.	1643170118.0	hu92i8r	t3_scuy5q	t3_scuy5q	/r/Anarcho_Capitalism/comments/scuy5q/thoughts/hu92i8r/
xwhagka	Herman Cain Award poster detected.  Opinion rejected.	1643171389.0	hu954sb	t3_scsmve	t1_hu92n72	/r/Anarcho_Capitalism/comments/scsmve/3_year_old_chimney_sweeper_in_1933_before_child/hu954sb/
cplwbxsf	Is there a link ? I could use a laugh rn.	1643172340.0	hu970is	t3_sctsux	t1_hu8x0p6	/r/Anarcho_Capitalism/comments/sctsux/genuinely_surprising_how_much_media_coverage/hu970is/
85okvvrs	*Highmore  You from SD too?	1643173106.0	hu98hph	t3_scuy5q	t1_hu91qhb	/r/Anarcho_Capitalism/comments/scuy5q/thoughts/hu98hph/
5ofewp3i	Damn the fact that you guys support child labor is seriously disgusting that’s almost like supporting pedophilia.	1643175557.0	hu9czht	t3_scsmve	t3_scsmve	/r/Anarcho_Capitalism/comments/scsmve/3_year_old_chimney_sweeper_in_1933_before_child/hu9czht/
6mwia	Probably the same way we read anti-work	1643175928.0	hu9dmls	t3_sctsux	t1_hu985qw	/r/Anarcho_Capitalism/comments/sctsux/genuinely_surprising_how_much_media_coverage/hu9dmls/
6dfrffnz	Yeah except most of what happens there are people who come together and help others understand their worth as skilled labor instead of being a exploited cog in the machine. I doubt you’d get a consensus if you went in there advocating for the seizure of the means of production. Almost every post I’ve seen is “Look at my incompetent manager, I quit and found a better job that pays a reasonable salary.” Rarely if ever are they straight up advocating for not working.	1643176088.0	hu9dwcg	t3_scnz19	t3_scnz19	/r/Anarcho_Capitalism/comments/scnz19/h_o_w/hu9dwcg/
1i5iflj9	Somehow he/she/meow looks exactly as I thought a mod from that sub would look like	1643176576.0	hu9eqlu	t3_sctsux	t1_hu8macv	/r/Anarcho_Capitalism/comments/sctsux/genuinely_surprising_how_much_media_coverage/hu9eqlu/
cnekc1s3	u/userleansbot	1643177373.0	hu9g1pw	t3_scy2zl	t1_hu9ejpz	/r/Anarcho_Capitalism/comments/scy2zl/big_pharma_getting_paid/hu9g1pw/
16k8zg	/u/userleansbot	1643178606.0	hu9hzei	t3_scy2zl	t3_scy2zl	/r/Anarcho_Capitalism/comments/scy2zl/big_pharma_getting_paid/hu9hzei/
16k8zg	/u/userleansbot	1643178668.0	hu9i2ty	t3_scy2zl	t1_hu9hzei	/r/Anarcho_Capitalism/comments/scy2zl/big_pharma_getting_paid/hu9i2ty/
iujh93nl	Poor guy. Shouldn't have revealed his face online. Those terminally online leftists are going to find his place and ruin his life for daring to criticize them.	1643178866.0	hu9idqe	t3_sct4x5	t3_sct4x5	/r/Anarcho_Capitalism/comments/sct4x5/gotta_love_a_little_rantiwork_roast/hu9idqe/
cnekc1s3	u/userleansbot	1643179905.0	hu9jxsf	t3_scy2zl	t1_hu9igh4	/r/Anarcho_Capitalism/comments/scy2zl/big_pharma_getting_paid/hu9jxsf/
cnekc1s3	u/userleansbot	1643179917.0	hu9jyek	t3_scy2zl	t1_hu9g2mn	/r/Anarcho_Capitalism/comments/scy2zl/big_pharma_getting_paid/hu9jyek/
emll94he	u/userleanbot	1643180082.0	hu9k741	t3_scy2zl	t1_hu9i5fe	/r/Anarcho_Capitalism/comments/scy2zl/big_pharma_getting_paid/hu9k741/
emll94he	Fr (for real)	1643180224.0	hu9kehq	t3_scy2zl	t1_hu9jbgr	/r/Anarcho_Capitalism/comments/scy2zl/big_pharma_getting_paid/hu9kehq/
7zt8qr5o	u/userleanbot	1643180441.0	hu9kplc	t3_scy2zl	t1_hu9kehq	/r/Anarcho_Capitalism/comments/scy2zl/big_pharma_getting_paid/hu9kplc/
iujh93nl	This post is getting brigaded by r/enoughlibertarianspam which are a bunch of commies. Funny how they somehow seem to tell us we don't care about mental health while they are literally abusing reddits mental health system to basically tell you to off yourself.  link to the post  https://www.reddit.com/r/EnoughLibertarianSpam/comments/s8xls1/fake_anarchists_trivializingmocking_the_us_mental/?utm_medium=android_app&utm_source=share	1643181292.0	hu9lwp8	t3_s8uqnr	t1_htjkwrw	/r/Anarcho_Capitalism/comments/s8uqnr/unarmed_communists/hu9lwp8/
14883j	Do you have any idea why the republican numbers are so pumped up versus Dems?  5 decades of anti-media campaigning by Republicans.   Not only has it worked out well, it makes piles of money for right-wing news shills.	1643183212.0	hu9oj29	t3_sctubz	t1_hu8q0ad	/r/Anarcho_Capitalism/comments/sctubz/you_gotta_pump_those_numbers_up_those_are_rookie/hu9oj29/
gem4qb69	Gatekeeping an already small movement is surely for your own ego.	1643185165.0	hu9r41i	t3_scww8f	t3_scww8f	/r/Anarcho_Capitalism/comments/scww8f/psa_this_is_not_a_libertarian_subreddit/hu9r41i/
