author	body	created_at	c_id	s_id	p_id	permalink
fl446d9h	The fact that this is a place where you can still speak openly about most any topic speaks volumes in itself.  Still, I am wondering if this place has proverbially outstayed its welcome judging by this influx of attacks on alt covid talk.  This could be it for this place.	1642705990.0	hthvskw	t3_s8q8xh	t1_hthvhbl	/r/conspiracy/comments/s8q8xh/these_people_all_posting_that_this_sub_shouldnt/hthvskw/
fl446d9h	Very few niche subs have contributers who know their shit well enough that majority quality posts come through.  Suggesting this sub delete every other post that comes through is almost as bad as what they want, which is to shut this place down entirely.	1642706281.0	hthwkau	t3_s8q8xh	t1_hthwaae	/r/conspiracy/comments/s8q8xh/these_people_all_posting_that_this_sub_shouldnt/hthwkau/
fl446d9h	Precisely, they have been slowly making their way in as to not draw much attention then they will launch their big co-ordinated strike like they do every other sub.  Btw I hope you are feeling better and make a speedy recovery.	1642706413.0	hthwwvc	t3_s8q8xh	t1_hthw739	/r/conspiracy/comments/s8q8xh/these_people_all_posting_that_this_sub_shouldnt/hthwwvc/
fdvbdwv7	What's the greatest post or bit of information that confirms that for you?	1642706628.0	hthxhoy	t3_s8qngu	t1_hthx2m9	/r/conspiracy/comments/s8qngu/with_the_end_of_the_coronavirus_pandemic_i_am/hthxhoy/
ferqa0fp	Dunno how anyone with a conscious can be a news anchor. Imagine selling your soul and misleading the public daily for scummy corporate interests. I'd feel like a total piece of shit.	1642706802.0	hthxyg2	t3_s8qp1i	t3_s8qp1i	/r/conspiracy/comments/s8qp1i/msnbc_anchor_leaves_network_because_hes_done_with/hthxyg2/
co6qko8a	Can someone please lock up every single "Public Health Expert" in the World?	1642706845.0	hthy2nn	t3_s8c8x0	t3_s8c8x0	/r/conspiracy/comments/s8c8x0/cdc_finally_admits_prior_infection_offered_better/hthy2nn/
co6qko8a	I doubt the "vaccinated" that ended up hospitalized think they work great!	1642706928.0	hthyahq	t3_s8c8x0	t1_htgdqlm	/r/conspiracy/comments/s8c8x0/cdc_finally_admits_prior_infection_offered_better/hthyahq/
12tjcv	"Chief of Staff" (for the 1st Lady lol) comments on meetings she wasn't at, according to anonymous sources familiar with the matter.	1642707113.0	hthys3b	t3_s8qfsa	t3_s8qfsa	/r/conspiracy/comments/s8qfsa/trump_held_secret_meetings_in_days_before_capitol/hthys3b/
14mk1w	Where is conspiracy?	1642707487.0	hthzs9v	t3_s8r2bw	t3_s8r2bw	/r/conspiracy/comments/s8r2bw/new_reddit/hthzs9v/
21zog805	It’s not that type of mercury.	1642711061.0	hti899k	t3_s8r3ei	t3_s8r3ei	/r/conspiracy/comments/s8r3ei/if_there_are_toxic_chemicals_like_mercury_and/hti899k/
21zog805	…what? Who copped out?	1642711226.0	hti8pf3	t3_s8r6kg	t1_hti87pb	/r/conspiracy/comments/s8r6kg/phew_for_a_minute_i_thought_these_dangerous_side/hti8pf3/
69ro3	How are more people having to stay home and take care of people sick with covid now than last year? Obviously, it can't be that they are all antivaxxers or unvaccinated because last year more people were unvaccinated.  You could argue well it is because of omicron is more infectious which is true; however, it does appear boosters are not working all that well against omicron anymore, 10 weeks at most and data coming out of Israel doesn't look too good for a fourth dose or continuous boosters.	1642711357.0	hti91yq	t3_s70669	t1_hthogyk	/r/conspiracy/comments/s70669/unless_i_get_the_vaccine_i_am_forever_stuck_in/hti91yq/
4h1wddu5	Chris Farley would be proud, kind of	1642711401.0	hti966n	t3_s8rtib	t1_hti7z1e	/r/conspiracy/comments/s8rtib/shocked_face/hti966n/
7loj3	Just get vaccinated and you'll be fine	1642711536.0	hti9jah	t3_s8ifnw	t1_hti7fxh	/r/conspiracy/comments/s8ifnw/why_are_people_all_for_restrictions/hti9jah/
3qe2bd9w	When they feed behavioral data prediction models of x amount of people's behaviors, thus essentially mapping out what entire cities are doing yeah its evil... It's basically a soft form of time travel except they are only viewing the various possible futures... With all the data they track on people currently they already know I'm 99% likely to go to work m-f, the likelihood i'll do x/y/z over the weekend etc...  From there plug in entire cities, yeah you basically have a looking glass into the future... Tweak it a bit and you basically have full control, especially if they can actually exert subtle control over people's feelings and/or thoughts. They can push someone from quitting a job or push someone into doing something horrible. It's just purely about control, the depopulation aspect is just a minor part of it.  So yeah HOW they INTEND to use AI is evil. It's basically an attempt to take away free will, atleast from the weak minded... Look how well the propaganda box is doing, people mindlessly clinging to whatever 'truth' or narrative that they keep consuming... If you think they can't use AI for evil then you are sorely mistaken, I'm sure TPTB have pretty complex profiles and know more about us than we know about ourselves. Albeit they probably don't bother to look at most individuals unless they are rocking the boat aka "have the tablets of destiny." Which is why when someone LIKE Lady Gaga comes out, they use other means to control them, its why the satanic imagery is so prominent in holly wood. Most people can be controlled by SOMETHING, whether its the love of money or they are motivated by fear.      Maybe I have a unique perspective here though, I have a degree in psychology and computer science. Part of this also goes on the assumption that the technology they have is vastly superior. It's been said before the military is usually 25-50 years ahead of the common populace as far as technological advancements. I could make a pretty BA computer now for 10k and it wouldn't even match an entity/group that has a couple billion to piss away...	1642711697.0	hti9z8z	t3_s80kjk	t1_htf2wxy	/r/conspiracy/comments/s80kjk/my_theory_of_whats_unfolding_from_an_indigenous/hti9z8z/
8da07	Oh shit, someone must've spilled orange juice on a computer server in somewhere in the Philippines and now this troll bot is accidentally posting confusing garbage.	1642711913.0	htiakz2	t3_s8sf55	t3_s8sf55	/r/conspiracy/comments/s8sf55/i_dont_think_that_she_should/htiakz2/
8da07	> *What's really going to change?*  People awaken to the inverted matrix we find ourselves in, we revoke our consent to this terrible order, and we forge a new framework for society. It requires disclosure and discussion. *Not* talking about it solves *nothing*.  To quote the Dowager Countess from Downton Abbey:  > *"Don't be defeatist, dear. It's very middle class."*	1642712032.0	htiawsl	t3_s8ox4w	t1_hthnjka	/r/conspiracy/comments/s8ox4w/this_is_essentially_just_a_covid_sub_at_this_point/htiawsl/
9kuw38t3	I step aside in shame haha	1642712377.0	htibuyb	t3_s8ksze	t1_hti6yt4	/r/conspiracy/comments/s8ksze/my_theory_of_everything/htibuyb/
10ju3n	I agree that she probably shouldn't run again, but it will totally be a real war. Last month's attack was the biggest this country has seen since 2/26!	1642712625.0	hticjhw	t3_s8sf55	t3_s8sf55	/r/conspiracy/comments/s8sf55/i_dont_think_that_she_should/hticjhw/
8yhih18u	Barnard College and some of the community that were involved. It's pretty far off the deep end type of connections but there are links to 18th century Bavaria. Not really wanting to go into all of it but it's enlightening and Salomon(Bernays great-grandfather) had some interesting friends.	1642712639.0	hticl00	t3_s8abm3	t1_htgyg15	/r/conspiracy/comments/s8abm3/interesting_question_about_the_mediagovernement/hticl00/
21zog805	Don’t try to act like you’re the intelligent one here when you can’t even read an article to find the answer to your question.	1642712688.0	hticpt4	t3_s8r6kg	t1_hti9wol	/r/conspiracy/comments/s8r6kg/phew_for_a_minute_i_thought_these_dangerous_side/hticpt4/
664ijd8m	Jeepers!  Next thing they will say one should take an antibody test prior to being even considered for covid vaccination!   Crazy talk!	1642712734.0	hticul6	t3_s8lma5	t3_s8lma5	/r/conspiracy/comments/s8lma5/no_way/hticul6/
34g10	out of sight, out of mind	1642712927.0	htiddsd	t3_s8iezp	t3_s8iezp	/r/conspiracy/comments/s8iezp/container_ships_bound_for_la_and_long_beach_ports/htiddsd/
f84es	Im not suprised at all, this sub grants special access to lives or minds of ppl that might otherwise be incognito on all other platforms.  Edit to add: it goes both way inside and out	1642713225.0	htie79n	t3_s8s62y	t3_s8s62y	/r/conspiracy/comments/s8s62y/is_anyone_else_legitimately_surprised_that_this/htie79n/
35ru1206	Not selfish at all unless you use it as a podium to preach. People have all kinds of "silly" reasons for choosing a mate and none of them are wrong as long as you're polite. Just ask if they are vaccinated and ghost them if you don't like the answer. If you can't ask someone without telling them your story then therapy may be a better solution.	1642713255.0	htiea6b	t3_s8s00o	t3_s8s00o	/r/conspiracy/comments/s8s00o/is_it_selfish_not_to_want_to_date_somebody_whos/htiea6b/
9jtwznld	Reptilian Hitler, sated with the adrenochromed baby blood of a billion innocents, and his army of Vril Droned Satanic Celebrities and Politicians, and Super-Ai controlled Robotic German shepards.	1642713291.0	htiedta	t3_s8t1sc	t3_s8t1sc	/r/conspiracy/comments/s8t1sc/what_do_you_believe_is_hiding_in_antarctica/htiedta/
8da07	We invite in a self-imposed hell if we give it real estate in our head and heart.   The media is going to bloviate about geopolitical drama up until we achieve widespread disclosure and overthrow the cabal. Stay resolute in your feeling and thinking state. Be sovereign. Be empowered. Steer this realm and this timeline.	1642713473.0	htievzt	t3_s8t4c0	t3_s8t4c0	/r/conspiracy/comments/s8t4c0/i_have_no_mouth_and_i_must_scream/htievzt/
21zog805	Or that you’re asking questions that would be easily answered by reading them. But I get that you’re just trying to be disingenuous and argue in bad faith by only mentioning the rarest, most severe of side effects.	1642713479.0	htiewm9	t3_s8r6kg	t1_htid7by	/r/conspiracy/comments/s8r6kg/phew_for_a_minute_i_thought_these_dangerous_side/htiewm9/
85ee69sk	is the whole fuckin elite monarch slaves???? depressing shit. after reading about his mother it really seems like she was a beta slave	1642713726.0	htiflhp	t3_s8o99y	t3_s8o99y	/r/conspiracy/comments/s8o99y/can_you_spit_the_difference/htiflhp/
95cmy	I don't mind people saying to get the vaccine, that's fine. "If you had covid get the vaccine anyway" is bonkers, though.	1642713740.0	htifn14	t3_s8ppz0	t3_s8ppz0	/r/conspiracy/comments/s8ppz0/the_number_of_people_defending_the_vaccine_after/htifn14/
x0t2iop	Where does it say that?	1642713774.0	htifqkt	t3_s8qoov	t1_hthyqz5	/r/conspiracy/comments/s8qoov/companies_still_requiring_experimental_mrna/htifqkt/
5r7n8sco	Holmseth is a fucking lunatic. He claims someone stole his fingerprints, he claims he died 3 times. He's a fucking whack job who needs to get psychological help--stat!	1642713778.0	htifr1k	t3_s855dy	t3_s855dy	/r/conspiracy/comments/s855dy/timothy_charles_holmseth_his_workproduct_was/htifr1k/
7pdur	Black goo	1642713898.0	htig39q	t3_s8t1sc	t3_s8t1sc	/r/conspiracy/comments/s8t1sc/what_do_you_believe_is_hiding_in_antarctica/htig39q/
d40018hc	Yeah I guess some people here still think it's inflated. I don't know. I think it's a real crisis. Just like 9/11 was a "real" crisis.	1642714107.0	htigo71	t3_s8jf8o	t1_hthwmpy	/r/conspiracy/comments/s8jf8o/weve_been_saying_it_for_the_past_2_years/htigo71/
6k89if7s	They do offer that but only through ASU online.	1642714648.0	htii72v	t3_s8qoov	t1_hti5nwz	/r/conspiracy/comments/s8qoov/companies_still_requiring_experimental_mrna/htii72v/
97stva43	Artists have psychic ability, it might actually only show in their art. They tap into something when they're drawing, and it comes out in their art. Good investors have psychic ability when they invest, they somehow know what's going to happen and invest accordingly.   I get this with fashion. I would always get in my head that I wanted a certain look, shop everywhere for it and it doesn't exist. Two years later it's a trend and everywhere. I also got in my head that I wanted a specific paint color (one that wouldn't even usually be my taste), a year later its color of the year 2022.	1642714768.0	htiiix1	t3_s8ssq8	t3_s8ssq8	/r/conspiracy/comments/s8ssq8/what_is_up_with_the_simpsons_predicting_shit/htiiix1/
4c5iu	Never assume these new-fangled ways of interaction and community WON'T include disgusting amounts of child grooming. They always do, they always will. It's sad that whenever something like this does come along, the general public's first reaction isn't BURN IT BEFORE IT GROWS BIGGER.  Until the pedophiles in every position of power are removed, always assume whatever new social phenomenon comes around is first and foremost designed with THEIR disgusting desires in mind. Because it is.	1642714909.0	htiix5p	t3_s8m9yp	t3_s8m9yp	/r/conspiracy/comments/s8m9yp/i_am_an_adult_film_maker_and_i_have_been_fighting/htiix5p/
cgrbelsu	I was in 6th or 7th grade when I heard about the national debt.    Naturally I asked, "well, who do we owe all that money to, and for what?"  No adult could answer the question.	1642714928.0	htiiz48	t3_s8kodz	t3_s8kodz	/r/conspiracy/comments/s8kodz/believe_it_or_not_the_united_states_was_a_debt/htiiz48/
co6qko8a	This is what is so insane. I have never just gotten an AIDS test.	1642714998.0	htij65r	t3_s8dr33	t3_s8dr33	/r/conspiracy/comments/s8dr33/i_got_covid_mildest_flu_ive_ever_had_okay_cool/htij65r/
3ks7o	>Any attempt to discuss the other side is downvoted into the ground  So basically like every single other sub on Reddit, when trying to discuss something that goes against the current perceived authorities narrative?  >I’m against vaccine mandates!  The government doesn't really need to mandate when they can coerce/influence mega corporations to mandate internally.  >Lots of doctors and professionals say the vaccine is safe?  Easy to do when there's no legal liability for being wrong.  >It’s just that if I have a dice roll coming up on “OK” 99.9% of the time,  Exactly my thought when concerning this virus.	1642715050.0	htijbbu	t3_s8lqhs	t1_hti8fyt	/r/conspiracy/comments/s8lqhs/probably_not_related/htijbbu/
b9cavtgi	SS: This video was recorded on the 13th of this month. I like hearing first hand accounts from the people involved.	1642715094.0	htijfr8	t3_s8trol	t3_s8trol	/r/conspiracy/comments/s8trol/trudeau_put_38000_truckers_on_unpaid_leave/htijfr8/
d4o6gtlk	Vatos be like "  I'M DA CAPTAIN NOW" essay 🤣 ...fml	1642715130.0	htijje9	t3_s8iezp	t1_htggm6f	/r/conspiracy/comments/s8iezp/container_ships_bound_for_la_and_long_beach_ports/htijje9/
cgrbelsu	It's like when you try to let a guy out of prison after 30 years.....he's just gonna want to go right back in.  It's what he's used to.  It's the only thing that makes sense to him.	1642715159.0	htijmb5	t3_s8ifnw	t1_htgesbz	/r/conspiracy/comments/s8ifnw/why_are_people_all_for_restrictions/htijmb5/
12rcoc	If someone doesn't belive this, just show them this article - https://www.thelancet.com/journals/laninf/article/PIIS1473-3099(21)00676-9/fulltext  A mainstream medical journal with multiple references to different studies from different countries. It shows how at most 0.7% of people get reinfected with delta, and even mentions how vaccination may be unnecessary for those who've previously contracted covid.   Yet despite this evidence you still see media articles saying how vaccination is the way to go for everyone, as is recommended by their resident 'experts'...  It also mentions how there was a minimal decline in natural immunity after 10 months, although its unsure how long the immunity might last beyond this point. Yet despite this, you still see people believing that natural immunity wanes massively after 6 months...	1642715334.0	htik3nd	t3_s8lma5	t3_s8lma5	/r/conspiracy/comments/s8lma5/no_way/htik3nd/
b7ki8ah	So does labor, delivery, sleep deprivation, never being able to use the toilet without an audience, cleaning poop, snot, vomit and staying home with the kids while everyone else is out partying 😆.  And yes, I know you were being sarcastic.	1642715336.0	htik3uw	t3_s8tfqu	t1_htih9wc	/r/conspiracy/comments/s8tfqu/propaganda_everywhere/htik3uw/
21zog805	Given how mild most side effects are, ya that’s not unbelievable. They’re talking about shit like headaches and nausea. Not myocarditis and blood clots.	1642715369.0	htik748	t3_s8r6kg	t1_htifj8k	/r/conspiracy/comments/s8r6kg/phew_for_a_minute_i_thought_these_dangerous_side/htik748/
2p9nc8an	SS: Has any politician spoken about the unprecedented mental damage of babies born into lockdowns and restrictions?    If you were born after 2020, this is all you've known. A world of little to no social contact, little to no social gatherings, not seeing anyone's faces, etc.  [The importance of how crucial it is for babies to learn from seeing faces](https://bold.expert/the-importance-of-faces-for-infants-learning/#:~:text=Across%20the%20first%20year%20of,and%20emotions%2C%20and%20learn%20language.)  [NY Times Article](https://www.nytimes.com/2018/10/29/well/family/how-children-learn-to-recognize-faces.html)  [Study from National Center of Biotechnology](https://www.ncbi.nlm.nih.gov/pmc/articles/PMC4496551/)	1642715503.0	htikka8	t3_s8tus3	t3_s8tus3	/r/conspiracy/comments/s8tus3/at_six_months_old_babies_born_during_the_first/htikka8/
ejzcupzz	I don't think confusing your neighboring country with an island half way across the world makes a lot of sense. Maybe that's just me though.	1642715558.0	htikppn	t3_s8pmhn	t1_htibtlp	/r/conspiracy/comments/s8pmhn/austrian_government_just_made_the_covid_vaccine/htikppn/
3w9ctpie	> Where the fuck were Russia and China? Weren't they buddies back then and now with Cuba? Why didn't they fill up those shelves with the plenty that is generated from socialism and communism? Or were they too fucking greedy? >  >   The Soviet Union literally did fill up their shelves dumbass. You're just showing how little you actually know about Cuba besides CIA talking points. The CIA has been working for the US robber barons that Castro expelled from Cuba, the same group of mobsters and thugs who quite honestly treated the Cuban people as slaves and the Cuban economy as a piggy bank. Castro created a world class healthcare system where before poor people could never see a doctor. The Cuban people are 99% literate where before the American puppet dictator kept them ignorant. I'm not a Castro groupie, but he made massive improvements in SPITE of the United States and the CIA's best attempt to return his country to colonialism and for that he's earned my respect	1642715740.0	htil7hq	t3_s8o99y	t1_htihifn	/r/conspiracy/comments/s8o99y/can_you_spit_the_difference/htil7hq/
mu16lv0	I can agree there are many pics of contrails on this sub, but it would be amiss to suggest chemtrails aren’t a real thing, because I can assure you they are.	1642715793.0	htilckr	t3_s8s6ua	t1_hti8uxj	/r/conspiracy/comments/s8s6ua/hmmm/htilckr/
e3dpn39d	Natural immunity is stronger. I realize i dont have any offical stats to back that up. But look at kids. Kids are fine because their immune systems are the best.  The vaccine is bad.  What works better is ivermectin, moncolonal antibodies, hydroxycohlorquine, z pack, zinc, vitamin d supplement, NAD + drip, and a sick person vitamin drip.	1642715803.0	htildjk	t3_s8dsl5	t1_htho6q6	/r/conspiracy/comments/s8dsl5/pfizer_ceo_says_people_who_spread_misinformation/htildjk/
3s22ekb5	ah, i understand.	1642716139.0	htima4e	t3_s8lfjz	t1_htgvs0z	/r/conspiracy/comments/s8lfjz/i_got_vaxxed_with_2_shots_never_wanted_to_do_it/htima4e/
e3dpn39d	I am reading Don Quixote right now. Are not there other books?  And fuck them for banning books.	1642716340.0	htimtfb	t3_s8jsvu	t3_s8jsvu	/r/conspiracy/comments/s8jsvu/first_they_dumb_you_down/htimtfb/
4fsrs1om	What does that have to do with my comment?   And where do you get those fake stats? The vaccine helps against severe disease even after months. It doesn’t help against infection as it used to which sucks, but preventing severe disease has always been the top priority. We will not eradicate the virus, but with the help of vaccines everyone fewer people die or experience severe disease?  Also current data from Israel shows the 4th shot is more or less useless at this point. But the third shot is important, especially for older people.	1642716415.0	htin0i0	t3_s8onvq	t1_htib79o	/r/conspiracy/comments/s8onvq/i_live_in_small_town_switzerland_where_vax_pass/htin0i0/
94yn0h21	Same same. But different. You understood me lol	1642716614.0	htinjiy	t3_s8ppz0	t1_htie96o	/r/conspiracy/comments/s8ppz0/the_number_of_people_defending_the_vaccine_after/htinjiy/
94yn0h21	Oh poor baby. I served my country and live in the middle of nowhere. Don't project on me bud	1642716661.0	htinnym	t3_s8ppz0	t1_htiednd	/r/conspiracy/comments/s8ppz0/the_number_of_people_defending_the_vaccine_after/htinnym/
21zog805	I mean, if they weren’t given a real vaccine, what would you attribute it to? Lol  I didn’t read about people not being able to lift their arms. Just that they reported pain at the injection site. Which I mean, in fairness, they could have regardless of whether they got a real vaccine or not - they are still getting a needle stuck in their arm. But placebo/nocebo effect is definitely a real thing, and like most things, can be more severe in some people than others. The human brain is wild, man. There are psychosomatic reactions to a lot of things. I would absolutely believe that someone thought they couldn’t lift their arm.	1642716674.0	htinp76	t3_s8r6kg	t1_htikmzg	/r/conspiracy/comments/s8r6kg/phew_for_a_minute_i_thought_these_dangerous_side/htinp76/
dxdyrrrx	Covid is a lie 👍  In a few weeks they will have forgotten about it and get I to what they were using it to cover all along.  The war.	1642716935.0	htioe3h	t3_s8ppz0	t3_s8ppz0	/r/conspiracy/comments/s8ppz0/the_number_of_people_defending_the_vaccine_after/htioe3h/
dih7t2wn	Lmfaooo iight, not even gonna lie, that was pretty funny . You had me in the first half	1642716968.0	htioh7n	t3_s8tt0q	t3_s8tt0q	/r/conspiracy/comments/s8tt0q/got_the_jab_and_everything_went_wrong/htioh7n/
4rbbg	I'm sorry, if you want the truth read the *Bible*?! A book of fables written by power hungry men thousands of years ago, and then re-written by power hungry men hundreds of years ago? Uhhh yeah ok bro....	1642718393.0	htiqer7	t3_s8o99y	t1_hthodiw	/r/conspiracy/comments/s8o99y/can_you_spit_the_difference/htiqer7/
5kkhegep	OP trying his level best to get banned	1642718704.0	htir1aj	t3_s8tp4q	t1_htikp0n	/r/conspiracy/comments/s8tp4q/nasa_lies/htir1aj/
dih7t2wn	Some weird shit that liberal arts students call themselves to put themselves into even smaller boxes	1642718719.0	htir2hc	t3_s8uurx	t1_htiqg1h	/r/conspiracy/comments/s8uurx/out_of_curiousity_whats_everyones_mbti/htir2hc/
gm3lw3nv	Intj	1642718840.0	htirc7i	t3_s8uurx	t3_s8uurx	/r/conspiracy/comments/s8uurx/out_of_curiousity_whats_everyones_mbti/htirc7i/
177yua67	My babygirl was born in 2020. She has never seen a world without lockdowns and restrictions.   It pains me.	1642718923.0	htirj0h	t3_s8tus3	t3_s8tus3	/r/conspiracy/comments/s8tus3/at_six_months_old_babies_born_during_the_first/htirj0h/
6bt2k4gl	Intp 9w1	1642718991.0	htironc	t3_s8uurx	t3_s8uurx	/r/conspiracy/comments/s8uurx/out_of_curiousity_whats_everyones_mbti/htironc/
a06auq7r	Vax not supposed to be in the ICU to begin with.  Look at the numbers in the hospital (not icu) really is that working ?	1642718995.0	htirp1w	t3_s8izkz	t1_htin8cy	/r/conspiracy/comments/s8izkz/its_over_for_canada_i_want_out/htirp1w/
6exqpfgc	The dumbing down started 2 decades ago. It clear it has worked.	1642719148.0	htis22i	t3_s8jsvu	t3_s8jsvu	/r/conspiracy/comments/s8jsvu/first_they_dumb_you_down/htis22i/
gm3lw3nv	Just as weird as labeling myself as a female, using a random sequence of letters as my name, using the decimal system, speaking in a made up language. Somehow these things work, so I use them.	1642719209.0	htis79v	t3_s8uurx	t1_htirwaa	/r/conspiracy/comments/s8uurx/out_of_curiousity_whats_everyones_mbti/htis79v/
dfyf31qx	NASA never release structure formations in their pictures.	1642719294.0	htisenv	t3_s8tp4q	t3_s8tp4q	/r/conspiracy/comments/s8tp4q/nasa_lies/htisenv/
4iwwbg7u	god	1642719426.0	htisq3c	t3_s8uurx	t3_s8uurx	/r/conspiracy/comments/s8uurx/out_of_curiousity_whats_everyones_mbti/htisq3c/
dfyf31qx	4k.	1642719449.0	htiss39	t3_s8u8vc	t1_htishke	/r/conspiracy/comments/s8u8vc/long_dark_winter_take_your_vitamin_d_supplement/htiss39/
6bt2k4gl	It’s personality typing. It’s not always entirely accurate some people take a 10 minute quiz then believe their result is their type because they’re lazy. If you put in a large amount of work and self analysis you can find what personality type you really are- basically information about the type of person you are.	1642719454.0	htissie	t3_s8uurx	t1_htis82l	/r/conspiracy/comments/s8uurx/out_of_curiousity_whats_everyones_mbti/htissie/
dih7t2wn	It’s actually 2020-3*	1642719786.0	htitlm9	t3_s8urk0	t1_htiq53i	/r/conspiracy/comments/s8urk0/will_life_ever_return_to_2019_normal/htitlm9/
cgz2n69b	one dollar at a time	1642719827.0	htitp53	t3_s8kodz	t3_s8kodz	/r/conspiracy/comments/s8kodz/believe_it_or_not_the_united_states_was_a_debt/htitp53/
