author	body	created_at	c_id	s_id	p_id	permalink
bsacb	The difference between this guy and the majority of people is that this guy actually watched a full white house press conference with biden whereas the majority of people will read the cliff notes from msnbc or something.   Even the people who want to watch, alot of them will just absentmindedly end up scrolling through Instagram and not listen to the conference.	1642781111.0	htm2hvn	t3_s94ny9	t1_htkml3e	/r/conspiracy/comments/s94ny9/i_am_a_democrat_my_eyes_are_now_open/htm2hvn/
5wvptdhw	Sexuality.  Most people believe in the narrative that Kinsey somehow 'introduced' the US to sexuality through his Scale. Not to mention he was an associate of Alister Crowley.. FFS!  Turns out sexuality was viewed much differently before modern times and that has been kept from us.  They seem to have built it up as a tool to twist Non Binary and Trans agenda for the purpose of eugenics and population control, not because they actually care about gay rights. Quite the opposite. Simply put, they want to feminize men to weaken any opposition, a problem they also fix with Wars.  And hey if your most virile and physically strong men all have head injuries from sports/football or going to Vietnam or Desert Storm then they can't become strong community and family leaders. NFL was started by Skull and Bones for that very reason.   It's crazy to think that RuPauls Drag Race, All Gender Bathrooms and the NFL all have the same intentions.. and sponsors behind them	1642781344.0	htm3432	t3_s91me4	t3_s91me4	/r/conspiracy/comments/s91me4/do_you_ever_just_think_about_how_everything_is_a/htm3432/
4uf1e	They're trying to hide this link. Funny how someone talking about the moon landing has 1700+ upvotes, but this article... brazenly pointing out that the FDA is corrupt... is struggling to stay around 70	1642781410.0	htm3aas	t3_s98u4r	t1_htl7023	/r/conspiracy/comments/s98u4r/why_a_judge_ordered_fda_to_release_covid19/htm3aas/
4uf1e	I thought the research was subsidized by taxes...	1642781519.0	htm3kq2	t3_s9aujs	t3_s9aujs	/r/conspiracy/comments/s9aujs/pfizersvaccine_trial_was_funded_by_the_company/htm3kq2/
4uf1e	This is no oasis	1642781642.0	htm3wa4	t3_s9ba02	t1_htlm3jk	/r/conspiracy/comments/s9ba02/nypd_officers_arrest_9_year_old_who_didnt_show/htm3wa4/
bnuku89a	Nope, we're probably just one (of many in the universe) place where conditions were such that life could form and eventually evolve. We are meat computers that can think about themselves, it's pretty wild. As science expands the territory of "God" retreats. Science is pitching a shutout at this point, I don't see God getting back in the game.	1642781644.0	htm3wgx	t3_s9ba02	t1_htm2x2b	/r/conspiracy/comments/s9ba02/nypd_officers_arrest_9_year_old_who_didnt_show/htm3wgx/
bnuku89a	You seem to have confused me for someone who is interested in "debating" this with you. How long have I got doc?	1642784284.0	htmb1o5	t3_s9ba02	t1_htmaizj	/r/conspiracy/comments/s9ba02/nypd_officers_arrest_9_year_old_who_didnt_show/htmb1o5/
9crbp	This is Bob. Bob had bitch tits. This was a support group for men with testicular cancer. The big moosie slobbering all over me... that was Bob.	1642784298.0	htmb2zt	t3_s9712y	t1_htm8pg0	/r/conspiracy/comments/s9712y/his_name_is_robert_paulson_and_i_dont_give_a_fuck/htmb2zt/
bnuku89a	How many boosters is fatal, in your expert opinion?	1642784434.0	htmbgjf	t3_s9ba02	t1_htmb7pk	/r/conspiracy/comments/s9ba02/nypd_officers_arrest_9_year_old_who_didnt_show/htmbgjf/
bnuku89a	So sounds like I'm good! Thanks for putting my mind at ease.	1642784705.0	htmc6qd	t3_s9ba02	t1_htmbpzd	/r/conspiracy/comments/s9ba02/nypd_officers_arrest_9_year_old_who_didnt_show/htmc6qd/
dvlxzaap	Idk why I put Moses? I was half asleep when I posted it..	1642784963.0	htmcw72	t3_s91me4	t1_htkjyce	/r/conspiracy/comments/s91me4/do_you_ever_just_think_about_how_everything_is_a/htmcw72/
bnuku89a	> It would be decent of you to allow others to exercise their free will without denigrating them for their choice over their own body however.  Not sure where I did this, but I'm happy to be your boogey-man if you want me to be. Guess what... every animal who has ever been used in a medical study has or will die.	1642785036.0	htmd37x	t3_s9ba02	t1_htmcnsw	/r/conspiracy/comments/s9ba02/nypd_officers_arrest_9_year_old_who_didnt_show/htmd37x/
bnuku89a	What a sad worldview to exist with. I thought I was too cynical	1642785305.0	htmdtez	t3_s9ba02	t1_htmde8m	/r/conspiracy/comments/s9ba02/nypd_officers_arrest_9_year_old_who_didnt_show/htmdtez/
bnuku89a	Yea, the most critical of all targets that the government is trying to depopulate with their specifically formulated lots of vaccines... Football players.	1642785430.0	htme5d2	t3_s9ba02	t1_htmdwnq	/r/conspiracy/comments/s9ba02/nypd_officers_arrest_9_year_old_who_didnt_show/htme5d2/
bnuku89a	Oh my, that's a lot of big words	1642785751.0	htmf12o	t3_s9ba02	t1_htmemm8	/r/conspiracy/comments/s9ba02/nypd_officers_arrest_9_year_old_who_didnt_show/htmf12o/
bnuku89a	You are so smart and informed. Your science is the best science	1642785841.0	htmfa80	t3_s9ba02	t1_htmf48k	/r/conspiracy/comments/s9ba02/nypd_officers_arrest_9_year_old_who_didnt_show/htmfa80/
bnuku89a	I don't talk to cowardly people who delete their posts.	1642786042.0	htmfu5w	t3_s9ba02	t1_htmflmo	/r/conspiracy/comments/s9ba02/nypd_officers_arrest_9_year_old_who_didnt_show/htmfu5w/
16p0f5jt	This will NOT be coming to Canada.	1642786143.0	htmg448	t3_s9c3kp	t1_htmdy4s	/r/conspiracy/comments/s9c3kp/seriously_whats_going_on/htmg448/
bnuku89a	Did I mention how smart you are?	1642786158.0	htmg5jb	t3_s9ba02	t1_htmg1k2	/r/conspiracy/comments/s9ba02/nypd_officers_arrest_9_year_old_who_didnt_show/htmg5jb/
5wvptdhw	And that there is literally tons of cheese stored in caves in Kentucky from almost 200 years ago that the US government still uses today.. very strange	1642786323.0	htmglob	t3_s91me4	t1_htlh5ju	/r/conspiracy/comments/s91me4/do_you_ever_just_think_about_how_everything_is_a/htmglob/
3y7xpapm	Crowley, Blavatsky, Tavistok have done so much more damage than the average person could dream - msot people haven't even heard of at least one or two of these.	1642786501.0	htmh33n	t3_s91me4	t1_htm3432	/r/conspiracy/comments/s91me4/do_you_ever_just_think_about_how_everything_is_a/htmh33n/
15dh4c	Yeah and that was early mid 90’s. He’d be going off on  the pussification of America if he was still alive.	1642786538.0	htmh6qw	t3_s93brl	t1_htmgrkb	/r/conspiracy/comments/s93brl/comedian_or_prophet_george_carlin_the_owners_of/htmh6qw/
3y7xpapm	Do you really trust the EU, though?	1642786552.0	htmh856	t3_s91me4	t1_htm1ezi	/r/conspiracy/comments/s91me4/do_you_ever_just_think_about_how_everything_is_a/htmh856/
bnuku89a	Thesaurus-ing intensifies.	1642786670.0	htmhjre	t3_s9ba02	t1_htmh287	/r/conspiracy/comments/s9ba02/nypd_officers_arrest_9_year_old_who_didnt_show/htmhjre/
bnuku89a	> instantaneous   How embarrassing	1642786794.0	htmhvvh	t3_s9ba02	t1_htmhqh2	/r/conspiracy/comments/s9ba02/nypd_officers_arrest_9_year_old_who_didnt_show/htmhvvh/
de0tt3a	A gastric bypass mandate for the obese would be better at stopping covid then the experimental gene therapy.	1642789008.0	htmo0ep	t3_s9gwsp	t3_s9gwsp	/r/conspiracy/comments/s9gwsp/court_blocks_vaccine_mandate_for_federal_employees/htmo0ep/
16p0f5jt	I hope so, anything I post on a Canadian based sub is immediately downvoted lots of negative feedback or I get kicked!	1642789294.0	htmosr1	t3_s9c3kp	t1_htmo9i7	/r/conspiracy/comments/s9c3kp/seriously_whats_going_on/htmosr1/
5wvptdhw	I've read a few books on Tavistock... people don't realize 'Think Tank' is just a fancy term for intelligent, well funded people sitting around figuring out how to manipulate and change the population's ideas and behaviors.. to a really sickening degree. It's pretty eye opening stuff.	1642789512.0	htmpecn	t3_s91me4	t1_htmh33n	/r/conspiracy/comments/s91me4/do_you_ever_just_think_about_how_everything_is_a/htmpecn/
1clo99wx	Australians are so fucked up..many don't want unvaxxed in their country	1642789542.0	htmphau	t3_s9g3r9	t1_htmh5v4	/r/conspiracy/comments/s9g3r9/majority_of_covid_restrictions_to_be_removed_in/htmphau/
60hwyb32	I was the odd man out at my work also. I worked for one of the largest banks in my country for over 20 years, but this pandemic just hypersensitized the difference between the blind followers of the narrative and those that like to make up their own minds and take responsibility for their own choices. I'm unemployed now and could not be happier. Nice will only get you so far and it will have a much bigger effect now that the narrative is crumbling all around the vaccinated. The fear is slowly dissipating, the lies that vaccine will protect you is no longer a suspicion but obvious reality so the conversation will now start to change.  My favorite will be when all those folks that were such assholes to everyone around them that chose differently, will now understand they were the assholes all along. Some realities will collapse and many eyes will open that's for sure. Those that disinvited their friends and family to their Christmas dinners because they were unvaccianted will now beg them for help as they get sick with Covid and no one there to bring them fever medication. They will now pick up their phones and ask you what treatments they should use since they remember you talking about all those alternatives. IT will all turn around now since it looks like vaccinated are getting covid at much higher rates the the unvaxxed. Karma is a bitch.	1642790005.0	htmqr7t	t3_s9gscm	t3_s9gscm	/r/conspiracy/comments/s9gscm/a_truly_beautiful_thing_just_happened_at_work/htmqr7t/
u0oe4	Yaaaaas back the blueee	1642790429.0	htmrvhj	t3_s9ba02	t3_s9ba02	/r/conspiracy/comments/s9ba02/nypd_officers_arrest_9_year_old_who_didnt_show/htmrvhj/
9ze0s0yl	Ss. From 6am tomorrow morning, the Taoiseach said the majority of public health measures will be removed:  • Guidance in relation to household visiting will no longer apply  • Restrictions on capacity for all indoor and outdoor events will no longer apply  • Closing time for hospitality and events will return to normal  • Covid pass requirement for access to hospitality and indoor activities will no longer apply  • Various requirements around managing people's movements at indoor hospitality and entertainment venues will no longer be required  • Phased return to the workplace for all staff can commence	1642790468.0	htmryvn	t3_s9hn9o	t3_s9hn9o	/r/conspiracy/comments/s9hn9o/ireland_ends_lockdown_all_restrictions_lifted/htmryvn/
706uk	Local police use fake delivery vans to carry put surveillance.   What kind of fronts do you think the top agency is capable if?	1642790589.0	htms99p	t3_s9crup	t1_htlterk	/r/conspiracy/comments/s9crup/peter_daszak_drops_bombshell_confession_ecohealth/htms99p/
480rnk7z	People aren’t getting the 3rd/ 4th jab and assholes who spread guilt and fear and hatred aren’t having any effect anymore. Party’s over for those pussies. Now if only sleepy Joe can wake up and end this shit stateside. He’s looking more and more like a puppet of big Pharma and hard left.	1642790704.0	htmsjmh	t3_s9c3kp	t3_s9c3kp	/r/conspiracy/comments/s9c3kp/seriously_whats_going_on/htmsjmh/
2p9nc8an	As usual Ireland only follows what the UK does.  Regardless, I'm delighted that the yellow stars/covid passes are gone	1642790905.0	htmt28c	t3_s9hn9o	t3_s9hn9o	/r/conspiracy/comments/s9hn9o/ireland_ends_lockdown_all_restrictions_lifted/htmt28c/
9ze0s0yl	Haha, feels good man. I held on and did not get the shot, tomorrow I can go back into restaurants and bring my grandson to the play centre.	1642791007.0	htmtbte	t3_s9hn9o	t1_htmsv1l	/r/conspiracy/comments/s9hn9o/ireland_ends_lockdown_all_restrictions_lifted/htmtbte/
9ze0s0yl	I just hope we ain't been set up for a rug pull..but let's enjoy the news.	1642791166.0	htmtpja	t3_s9hn9o	t1_htmt2kw	/r/conspiracy/comments/s9hn9o/ireland_ends_lockdown_all_restrictions_lifted/htmtpja/
9ze0s0yl	Not sure, he said international air travel will still have restrictions.	1642793955.0	htn1b7i	t3_s9hn9o	t1_htn0wfk	/r/conspiracy/comments/s9hn9o/ireland_ends_lockdown_all_restrictions_lifted/htn1b7i/
g3fg8vc1	Yeah. What a weird thing to say. I mean, if the guy had put an "/s" after his statement, we'd laugh because it was sarcasm.... but... wow.	1642794030.0	htn1is0	t3_s9ep96	t1_htmar9h	/r/conspiracy/comments/s9ep96/was_louie_anderson_another_vaccine_victim/htn1is0/
9ze0s0yl	Thanks. Finally light at the end of the tunnel.	1642794310.0	htn2aoq	t3_s9hn9o	t1_htn1uk0	/r/conspiracy/comments/s9hn9o/ireland_ends_lockdown_all_restrictions_lifted/htn2aoq/
9ze0s0yl	Thank you, I'm so happy to see my grandson again i have been crying.	1642794405.0	htn2k6e	t3_s9hn9o	t1_htn24uu	/r/conspiracy/comments/s9hn9o/ireland_ends_lockdown_all_restrictions_lifted/htn2k6e/
9ze0s0yl	I'm a bit sceptical myself, but to be able to spend time with my grandson again is a huge weight off my shoulders.	1642794525.0	htn2wck	t3_s9hn9o	t1_htn2hjv	/r/conspiracy/comments/s9hn9o/ireland_ends_lockdown_all_restrictions_lifted/htn2wck/
dvlxzaap	Non Playable Character from video games. Like the people who are just walking around hopelessly in GTA that get beat up and everything else. They don’t know how to critically think about not being a victim. They’re programmed by the masses or those in charge. And instead of being smart enough to see through the lies and manipulation. I hope this helps you? And I hope that you have a great day. Welcome to the dark side, but it’s really illuminating.	1642794641.0	htn3800	t3_s9euej	t1_htn22bv	/r/conspiracy/comments/s9euej/am_i_missing_something/htn3800/
9ze0s0yl	Thanks, we will. It's been tough, we have seen him 4 times in past 2 years and each time was from a distance or behind glass.	1642794726.0	htn3gk6	t3_s9hn9o	t1_htn31vw	/r/conspiracy/comments/s9hn9o/ireland_ends_lockdown_all_restrictions_lifted/htn3gk6/
e3gtran9	It's Reuters, you can't get more dry than that. What's wrong with mainstream media? Fox is mainstream, millions upon millions of people watch that channel.	1642794738.0	htn3hue	t3_s9j4j5	t1_htn30c2	/r/conspiracy/comments/s9j4j5/can_we_discuss_the_literal_conspiracy_to_overturn/htn3hue/
dvlxzaap	Read my explanation above 👆🏻	1642794755.0	htn3ji1	t3_s9euej	t1_htmmy1k	/r/conspiracy/comments/s9euej/am_i_missing_something/htn3ji1/
7tlasv81	Covid was supposed to wipe out Africa and it did, the continent has some of the lowest death and hospitalization rates as well as the lowest vax rates.  It's almost like doing nothing was the best way to death with the china sniffles.	1642794906.0	htn3yip	t3_s9gscm	t1_htmp1s2	/r/conspiracy/comments/s9gscm/a_truly_beautiful_thing_just_happened_at_work/htn3yip/
e3gtran9	The illegality was producing a document claiming that they were the valid electors. It became mail fraud when they sent the documents through the mail. It became election fraud when the intended effect was to call onto question the legitimate electors ballots.  I don't recall forged electors certificates being produced by Hillary's campaign after their loss.	1642794972.0	htn458v	t3_s9j4j5	t1_htn3emk	/r/conspiracy/comments/s9j4j5/can_we_discuss_the_literal_conspiracy_to_overturn/htn458v/
e3gtran9	I know, but at least one of us has to act in good faith.	1642795074.0	htn4fby	t3_s9j4j5	t1_htn3oj5	/r/conspiracy/comments/s9j4j5/can_we_discuss_the_literal_conspiracy_to_overturn/htn4fby/
9ze0s0yl	I really hope you're wrong 🥺	1642795529.0	htn5oa6	t3_s9hn9o	t1_htn5jk3	/r/conspiracy/comments/s9hn9o/ireland_ends_lockdown_all_restrictions_lifted/htn5oa6/
e3gtran9	By that logic, wouldn't Trump have been going against Scary Ackronym by producing the forged elector certificates?	1642795595.0	htn5uom	t3_s9j4j5	t1_htn5abd	/r/conspiracy/comments/s9j4j5/can_we_discuss_the_literal_conspiracy_to_overturn/htn5uom/
480rnk7z	The ballot harvesting should have always been the focus.  Not the machines or the VP overturning anything. The thing that made this election sus was the fact that you can mail in your ballot with not ID and no way of knowing who signed it. I get it it was the pandemic, but that can’t happen any more. Would Joe have still won? Maybe but we’ll never know. I know personally people who voted for their whole household one way or the other, even for people who have never voted before and wouldn’t have if they had to walk in.	1642795694.0	htn645n	t3_s9hyzr	t3_s9hyzr	/r/conspiracy/comments/s9hyzr/large_scale_voter_fraud_took_place_in_georgia/htn645n/
e3gtran9	Does "getting the picture yet" just mean jump to whatever conclusion you want?	1642795784.0	htn6cy0	t3_s9j4j5	t1_htn5pzt	/r/conspiracy/comments/s9j4j5/can_we_discuss_the_literal_conspiracy_to_overturn/htn6cy0/
7tlasv81	SS:  Quick, who are the major CDB investors?  Amazing how Vice will tout one study by ignores FDA approved drugs backed by dozens of studies.  It's all about the money - never forgot that.	1642795972.0	htn6v7j	t3_s9jp8d	t3_s9jp8d	/r/conspiracy/comments/s9jp8d/look_how_fast_dumpster_fire_vice_went_from_just/htn6v7j/
e3gtran9	"Officials on Donald Trump's 2020 campaign, led by his lawyer Rudy Giuliani, oversaw efforts to put forward illegitimate electors from seven states that the former president lost, CNN reported on Thursday, citing three sources."  Would r/conspiracy refusing to want to discuss a literal conspiracy suggest a conspiracy to prevent actual discovery of conspiratorital evidence?	1642795990.0	htn6x0e	t3_s9j4j5	t3_s9j4j5	/r/conspiracy/comments/s9j4j5/can_we_discuss_the_literal_conspiracy_to_overturn/htn6x0e/
15dh4c	Of course they have. Far right wingers are just as bad as left wingers. I’ll call them clowns out just as quick and have	1642796066.0	htn74fj	t3_s9712y	t1_htn674z	/r/conspiracy/comments/s9712y/his_name_is_robert_paulson_and_i_dont_give_a_fuck/htn74fj/
9ze0s0yl	I'm with ya. I said it to the wife yesterday about the UK and here we are today in the same boat. But been able to go see our grandson is eclipsing the scepticism for now. :)	1642798854.0	htnew8c	t3_s9hn9o	t1_htnea3v	/r/conspiracy/comments/s9hn9o/ireland_ends_lockdown_all_restrictions_lifted/htnew8c/
9ze0s0yl	Thanks, you to.	1642799183.0	htnftkl	t3_s9hn9o	t1_htnfkzv	/r/conspiracy/comments/s9hn9o/ireland_ends_lockdown_all_restrictions_lifted/htnftkl/
3f30mx8	Welcome back, family!	1642799577.0	htngxan	t3_s9l0ru	t3_s9l0ru	/r/conspiracy/comments/s9l0ru/just_got_banned/htngxan/
7tlasv81	And, the close the the equator the lower the hospital and death rate.  Buddy of mine, in South Africa, his wife took ivermectin went from feeling like she was hit by a bus to feeling pretty darn good after just 24 hours.	1642800138.0	htnihan	t3_s9gscm	t1_htni00b	/r/conspiracy/comments/s9gscm/a_truly_beautiful_thing_just_happened_at_work/htnihan/
fp41f6sc	SS: The BMJ came out strong against Big Pharma. They ask for the raw trial data, which Big Pharma refuses to turn over. Meanwhile, our doctors and people around the world are being coerced to take these experimental drugs. This is not right.  Link: [https://www.bmj.com/content/376/bmj.o102](https://www.bmj.com/content/376/bmj.o102)	1642800283.0	htnivnf	t3_s9lc99	t3_s9lc99	/r/conspiracy/comments/s9lc99/the_british_medical_journal_gets_it_we_have_no/htnivnf/
a2forfgq	Could’ve fooled me. Never too late to put those skills to use? Let me know when you are ready to explain your interpretation of the data I presented you.	1642800439.0	htnjbge	t3_s856qa	t1_htmxcnh	/r/conspiracy/comments/s856qa/this_is_very_hard_to_disagree_with/htnjbge/
5wvptdhw	Yes it matters because:  HARMFUL INGREDIENTS FOUND IN BREAD: Dough Conditioners:  The only purpose of dough conditioners is to make the process of making bread faster and cheaper for the food industry. Many dough conditioners like azodicarbonamide, DATEM, monoglycerides, diglycerides, sodium stearoyl lactylate are linked to health issues. Preservatives:  Preservatives like calcium propionate are linked to disorders such as ADHD. GMO:  Most commercially available breads contain one or many genetically modified ingredients, including various soy products. Artificial sweeteners:  It is not bad to use natural sweeteners such as honey to sweeten your bread, but most manufactures are using high fructose corn syrup or other artificial sweeteners that can pose numerous health risks. Majority of commercially-baked brands have some form of added sweetener. Artificial flavours and colouring:  The ingredients that these synthetic dyes are made up of are linked to several health issues like hyperactivity in children. They are easy to spot on the label because the FDA requires it. Aside from the typical dyes, most industrial caramel coloring is created by heating ammonia and is considered a carcinogen when created this way	1642800628.0	htnjuf8	t3_s91me4	t1_htlq0h2	/r/conspiracy/comments/s91me4/do_you_ever_just_think_about_how_everything_is_a/htnjuf8/
5wvptdhw	In short..don't buy bread from markets or restaurants. Make your own	1642800669.0	htnjyjw	t3_s91me4	t1_htnjuf8	/r/conspiracy/comments/s91me4/do_you_ever_just_think_about_how_everything_is_a/htnjyjw/
a2forfgq	I usually pretend that I’m hard of hearing and just continue about my business.	1642800835.0	htnkf51	t3_s9kysu	t3_s9kysu	/r/conspiracy/comments/s9kysu/security_guard_mask_police/htnkf51/
psabn	PANEM ET CIRCENSES the common people—rather than caring about their freedom—are only interested in “bread and circuses”  PROBITAS LAUDATUR ET ALGET "honesty is praised and left out in the cold"  - Decimus Junius Juvenalis	1642801472.0	htnm6xg	t3_s9euej	t1_htmo0bt	/r/conspiracy/comments/s9euej/am_i_missing_something/htnm6xg/
g3fg8vc1	You can't use the winky face, because then we know.	1642801794.0	htnn2td	t3_s9jk1w	t1_htn82si	/r/conspiracy/comments/s9jk1w/which_conspiracies_do_you_think_is_a_psy_op_to/htnn2td/
9ze0s0yl	Masks still have to be worn in shops .	1642804527.0	htnug6g	t3_s9hn9o	t1_htnu89o	/r/conspiracy/comments/s9hn9o/ireland_ends_lockdown_all_restrictions_lifted/htnug6g/
gfa725ty	Nothing about this shit makes any sense.   "Ah, fuck it."	1642804889.0	htnvewb	t3_s9hn9o	t3_s9hn9o	/r/conspiracy/comments/s9hn9o/ireland_ends_lockdown_all_restrictions_lifted/htnvewb/
dvlxzaap	See that’s what I’m talking about, because I don’t know many who’ve had a change of mind. And I’m not a big fan of being called a plague rat.	1642805124.0	htnw1c7	t3_s9lyf1	t1_htntvjz	/r/conspiracy/comments/s9lyf1/people_are_waking_up/htnw1c7/
v73rr	It's not so much the compliant ones but the stupid ones.   Elites: _The information is available that this is false, we're lying; that nothing is real. But if despite this, you willingly having and/or do not resist enough the injection, then you deserve the consequences - you are stupid._	1642805142.0	htnw2ze	t3_s9c3kp	t1_htmxbkn	/r/conspiracy/comments/s9c3kp/seriously_whats_going_on/htnw2ze/
dvlxzaap	Oh agreed, because there’s no excuse for calling people a racist plague rat, because they made a choice or couldn’t get the vax. And humility goes both ways.	1642805206.0	htnw985	t3_s9lyf1	t1_htnukz5	/r/conspiracy/comments/s9lyf1/people_are_waking_up/htnw985/
dvlxzaap	And it’s growing each week or two. I was on the phone with my pro vax family this morning. And got asked a lot of questions about the vax. And it surprised me that they are willing to have a open dialogue with me. So it gives me a little bit of hope, that others are starting to ask questions.	1642805480.0	htnwzjr	t3_s9lyf1	t1_htnwdzl	/r/conspiracy/comments/s9lyf1/people_are_waking_up/htnwzjr/
dvlxzaap	Yeah, I’ve noticed on the TooAfraidToAsk and NoStupidQuestions subs, a lot more people are saying they aren’t comfortable with the booster, and the way our government is lying. We can only hope that they come here, and start asking questions to help them see more of the truth.	1642805632.0	htnxdya	t3_s9lyf1	t1_htnwrr9	/r/conspiracy/comments/s9lyf1/people_are_waking_up/htnxdya/
dvlxzaap	Me and my family(wife, daughter, and Grandkids), all went out to eat. Me and my wife both aren’t vaccinated, and they asked us for our cards. I told them I’m not able to get the vax, and my wife said she’s standing by me. A group a table over, made the remark that I’m a racist plague rat. There’s no reason for that remark, especially in front of my under 8 grandkids. Who by the way are half Indian. My son in law was born in India, and that remark was extremely bad to say in front of my two granddaughters. I about lost it, but because my granddaughters were there, I kept my cool. And just told them, their ignorance is a shining example of what true racism is. And we ate and enjoyed our meal, with no further comments. Another word I feel is not ok, “White Supremacist”. Unfortunately that just shows the lake of knowledge of where that term comes from. But you’re absolutely right, they refuse to see themselves as martyrs.	1642806297.0	htnz4d7	t3_s9lyf1	t1_htnx2bq	/r/conspiracy/comments/s9lyf1/people_are_waking_up/htnz4d7/
buucjyxp	Wow unbelievable how people just go along with the lie.	1642806621.0	htnzyfc	t3_s9i7qp	t3_s9i7qp	/r/conspiracy/comments/s9i7qp/thou_shalt_not_question_the_science/htnzyfc/
bsacb	Say what you will about either of the two most recent presidents...   But life was *way* better under Trump than it is with Biden.	1642806852.0	hto0jkx	t3_s9i6gu	t1_htn7rty	/r/conspiracy/comments/s9i6gu/anyone_else_collect_their_2000_monthly_check_yet/hto0jkx/
