author	body	created_at	c_id	s_id	p_id	permalink
15jw77x2	[check out this post. ](https://www.reddit.com/r/conspiracy/comments/sbldy9/Game%2C_Set%2C_Match._%E2%80%94%E2%80%94_Harvard_Study%3A_%22Increases_in_COVID-19_are_unrelated_to_levels_of_vaccination_across_68_countries_and_2947_counties_in_the_United_States.%22/hu0h5f1/?utm_medium=android_app&utm_source=share&context=3)	1643314065.0	huhg816	t3_se16p0	t3_se16p0	/r/conspiracy/comments/se16p0/what_part_of_the_covid_vaccines_dont_prevent/huhg816/
168mhn	There's only 110,000 truckers in all of Canada, for Christ's sake. The fact that this subreddit can't see obvious disinformation is the real conspiracy.	1643314103.0	huhgbm8	t3_se57vg	t1_huh1hr5	/r/conspiracy/comments/se57vg/the_canadian_freedom_convoy_is_much_smaller_than/huhgbm8/
bpajwf1f	I don't know why I find this hilarious but they are really going with "it's not happening, don't believe your lying eyes."	1643314131.0	huhgeay	t3_se585p	t1_huhb286	/r/conspiracy/comments/se585p/o_canada_and_this_is_how_the_convoyforfreedom2022/huhgeay/
8da07	One thing I’m grateful for with lockdowns is getting out of social engagements that sound awful. Like, how good is this birthday party going to be? I’d just not reward the birthday person with my presence. Let them work their way out of their hypnosis and then rejoin the party next time.	1643314151.0	huhggah	t3_se7bzx	t3_se7bzx	/r/conspiracy/comments/se7bzx/discussion_friend_asks_to_do_a_self_test_before/huhggah/
168mhn	...despite the fact that the USA also has a vaccine mandate so unvaccinated Canadian truckers can't cross the border either way.	1643314181.0	huhgj8q	t3_se57vg	t1_huh2ge1	/r/conspiracy/comments/se57vg/the_canadian_freedom_convoy_is_much_smaller_than/huhgj8q/
19k0jzm9	I have two vaccines 😂 guess I'm marked yall.. I might be chipped hahaha	1643314191.0	huhgk5w	t3_se7bi8	t3_se7bi8	/r/conspiracy/comments/se7bi8/covid_american_cards/huhgk5w/
168mhn	The provincial vaccine mandates?	1643314202.0	huhgl9g	t3_se57vg	t1_huh2qyw	/r/conspiracy/comments/se57vg/the_canadian_freedom_convoy_is_much_smaller_than/huhgl9g/
168mhn	What are you basing that on?	1643314223.0	huhgn92	t3_se57vg	t1_huh6hre	/r/conspiracy/comments/se57vg/the_canadian_freedom_convoy_is_much_smaller_than/huhgn92/
8da07	With his grim reaper sickle!! LGBTQ+ people were walking in pride parades in the 1980’s with large protest signs saying “Dr. Fauci You Are Killing Us!” before he was a household name.	1643314254.0	huhgq8s	t3_se5vql	t1_huhg7uz	/r/conspiracy/comments/se5vql/fauci_is_named_after_fascism_change_my_mind/huhgq8s/
168mhn	50,000 semi trucks at 22m long each would be a convoy over 1,000 km long. It would also mean every 1 in 2 truckers in Canada is currently not working and is driving to Ottawa. Do you actually believe that?	1643314352.0	huhgzpb	t3_se57vg	t1_huh2cas	/r/conspiracy/comments/se57vg/the_canadian_freedom_convoy_is_much_smaller_than/huhgzpb/
168mhn	This video shows the convoy is mostly cars and pickups, yes.	1643314475.0	huhhbov	t3_se585p	t1_huhb286	/r/conspiracy/comments/se585p/o_canada_and_this_is_how_the_convoyforfreedom2022/huhhbov/
zhe6v	You must be busy working the glory holes...	1643314498.0	huhhdue	t3_sdz2mm	t3_sdz2mm	/r/conspiracy/comments/sdz2mm/truckers_coming_through_my_city_today_lots_of/huhhdue/
168mhn	Ah yes, the grand conspiracy, to block truckers from Googling how to get to "Ontario," but not to block them from Googling how to get to "Ottawa," their actual destination.	1643314549.0	huhhiou	t3_se5edb	t3_se5edb	/r/conspiracy/comments/se5edb/with_the_freedomconvoy_on_the_road_googlemaps_is/huhhiou/
5btpix8w	safe and effective	1643314603.0	huhhnyw	t3_se16p0	t1_hugd093	/r/conspiracy/comments/se16p0/what_part_of_the_covid_vaccines_dont_prevent/huhhnyw/
168mhn	> From your own 2nd link. "The convoy, which is reported to be over 17 kilometres long,  A convoy 50,000 trucks long would be over 1,000 km long, not 17 km long.   > It actually mentions over 400 trucks in that area.   Question: how do you think this proves your claim that there's "more than 50,000 trucks" participating?	1643314738.0	huhi14i	t3_se2vw6	t1_huhgp39	/r/conspiracy/comments/se2vw6/inspired_video_something_huge_is_happening_in/huhi14i/
168mhn	Be as happy as you want, as long as you can recognize the disinformation that's being pushed in this subreddit.	1643314810.0	huhi86n	t3_se57vg	t1_huhh6dr	/r/conspiracy/comments/se57vg/the_canadian_freedom_convoy_is_much_smaller_than/huhi86n/
8da07	This itself is conspiracy. That “magic” exists and is classified as such.   What we perceive to be magic is simply navigation and manipulation of this realm (or aspects of this realm) that are EXPLAINABLE by science if we had a non-inverted understanding of how this realm operates.   Surface-dwellers on Earth are basically the North Koreans of the Galaxy. We have dormant abilities and powers that go unused. We are shepherded around like livestock and are now reclaiming our liberty, sovereignty and rightful place in this cosmos. Our understanding of everything is backwards and neutered. It is to keep us in our pen.   Ancient civilizations likely had simple “life hacks” they knew about that were stupefyingly amazing to our supposedly modern sensibilities. The ability to move very large stones/objects with sound. The ability to temporarily turn stone into squishy moldable clay and then re-solidify it again. Ancient technologies were likely less “obvious” than our clunky technology in 2022. An Atlantean could probably do way cooler shit with the right crystal than I can with my top-of-the-line iPhone.   Magic is classified as magic so as to make the idea fanciful and imaginary instead of practical and immediately available to pretty much anyone. Merlin is always trotted out as a cautionary tale who rushes to get magic or play with magic to “disastrous results.” We have lots of stories in our civilization about magic genies and granting wishes that always turn out to be sabotage or a problem — for example we have sayings like “be careful what you wish for!” and we never ask ourselves why wishes and manifestation have to turn out bad.   Why can’t we steer this reality? Why shouldn’t we be able to manipulate our experience to a place of being richly abundant yet living on a small footprint? Why do we have to run wires everywhere when we can easily extract energy from thin air and have it power our dishwashers and lamps?   Magic is prime to make a raging comeback. And people in this sub are likeliest to indulge and dabble in this fantastic fringe forefront first.	1643314879.0	huhif0l	t3_se7a0v	t3_se7a0v	/r/conspiracy/comments/se7a0v/conspiracies_about_magic/huhif0l/
168mhn	The conspiracy isn't the "size" of the protests, it's the disinformation being pushed to overclaim the size of the protest. People are claiming there's 50,000 trucks and a million people participating. In reality, it's about 150 trucks...but people are so desperate to bury the truth that they'll downvote you to hell for pointing that out.	1643315061.0	huhiwom	t3_se7j6i	t3_se7j6i	/r/conspiracy/comments/se7j6i/false_flag_potential_of_the_trucker_convoy/huhiwom/
4s0abls1	I've been saying this since 2020, specifically May 2020, when many on our side began to say that we won, we're re-opening, everything is back to normal, etc. I've been insulted, mocked, bullied, outright harassed, etc. They just put their fingers in their ears and scream one/all of the stuff I said in my first sentence, and just delude themselves again and again and **again**. Meanwhile, more places introduce restrictions like vaccination passports... And places "re-open" the way they've been doing since 2020, so then they loosen...only to bring back the restrictions weeks/months down the line. Same, exact patterns since 2020. But nobody listens. People just laugh at me/whoever points this out, and continue to jerk off to how we're winning the war, and the elites are running away with their tails between their legs (in truth, the elites are laughing at all of you for playing right into their hands).	1643315096.0	huhj064	t3_se6c78	t1_huh9bal	/r/conspiracy/comments/se6c78/anyone_who_states_were_winning_is_useful_as/huhj064/
gtao5ten	I absolutely hate Biden's face. It pisses me off.	1643315232.0	huhjdfc	t3_se7q2b	t3_se7q2b	/r/conspiracy/comments/se7q2b/more_cold_hard_evidence_byren_is_swayze_swayze_is/huhjdfc/
qzqyl	They want it to be worse than it is because they want those who disagree with them to die. They they'll be correct by default. Imagine being such a little bitch that you wish harm on those with a differing opinion. Now imagine being such a bigger bitch that you don't have the balls to cause that harm yourself so you hope a microscopic organism does it for you.	1643315333.0	huhjn9e	t3_se0gcs	t3_se0gcs	/r/conspiracy/comments/se0gcs/zuby_one_of_the_most_mindblowing_things/huhjn9e/
168mhn	> What would you do in this situation?  Respect your "friend"'s wishes on his fucking birthday or don't go? Stop being a self centered asshole. It's his birthday, not yours.	1643315356.0	huhjphx	t3_se7bzx	t3_se7bzx	/r/conspiracy/comments/se7bzx/discussion_friend_asks_to_do_a_self_test_before/huhjphx/
168mhn	Because we've known that asymptomatic infection is possible for about 2 years now.	1643315415.0	huhjva0	t3_se7bzx	t1_huhhj8s	/r/conspiracy/comments/se7bzx/discussion_friend_asks_to_do_a_self_test_before/huhjva0/
4s0abls1	How? What's the plan?	1643315447.0	huhjyl8	t3_sd4e5d	t1_hub9wor	/r/conspiracy/comments/sd4e5d/things_are_getting_real_bad_over_here_in_austria/huhjyl8/
8da07	Well this was a similar worry with the rallies held worldwide last weekend. They could be prime opportunities to pull something shitty under the guise of a false flag.   But I dunno, I think we gotta exercise our Throat Chakras and stand and speak. We can’t neuter ourselves because there is the possibility that an organized crime syndicate like an intelligence agency (same thing) will pull off a fake disaster and derail the momentum.   I don’t think passivity is our way out of this lopsided power problem.	1643315485.0	huhk29u	t3_se7j6i	t3_se7j6i	/r/conspiracy/comments/se7j6i/false_flag_potential_of_the_trucker_convoy/huhk29u/
168mhn	I want to be clear: are you denying that asymptomatic infections are possible?	1643315490.0	huhk2u8	t3_se7bzx	t1_huhi608	/r/conspiracy/comments/se7bzx/discussion_friend_asks_to_do_a_self_test_before/huhk2u8/
5o0zdk27	So if a news article doesn’t mention that a player is vaccinated, in a political climate where every politician in the world looks like they’ll kill you themselves if you don’t get injected. In an insane pro-vax world where they need to inject every body from cradle to grave immediately and as much as possible - which lets call it what it is:  Pro drug addiction  Pro Pharma  Pro forced chemical injection   Pro euthanasia   Pro bodily control over others   Because the corrupt and compromised media that works directly as an institutional arm of the government omits whether or not they’re vaccinated that means they’re not vaccinated? Hilarious. You’re naive beyond words	1643315517.0	huhk5er	t3_se483v	t1_huhj73r	/r/conspiracy/comments/se483v/marylouise_mclaws_australia_epidemiologist_and/huhk5er/
168mhn	> I am not trying to prove the length of the convoy  Why did you claim in your original comment that over 50,000 trucks were participating if you knew that wasn't true? What exactly have I lied about?	1643315670.0	huhkk5s	t3_se2vw6	t1_huhkeai	/r/conspiracy/comments/se2vw6/inspired_video_something_huge_is_happening_in/huhkk5s/
zhe6v	he getting the glory holes ready...	1643315857.0	huhl2c2	t3_sdykbd	t1_huh5xn3	/r/conspiracy/comments/sdykbd/2_more_days/huhl2c2/
bpajwf1f	https://www.youtube.com/watch?v=u8CaYTl_5b4  Probably will be deleted soon, so archive.	1643315873.0	huhl3ve	t3_se669z	t3_se669z	/r/conspiracy/comments/se669z/screen_shot_of_video_thats_no_where_to_be_found/huhl3ve/
eqij6rvj	I never said Trump was smart.	1643315976.0	huhle42	t3_se2qv8	t1_huhhkgj	/r/conspiracy/comments/se2qv8/ive_had_senior_political_figures_in_canada_tell/huhle42/
19k0jzm9	Seems like you care more than a lot lol	1643315987.0	huhlf46	t3_rc8dl3	t3_rc8dl3	/r/conspiracy/comments/rc8dl3/it_continues_to_absolutely_baffle_my_mind/huhlf46/
cbmv4	Dirty dancin	1643316215.0	huhm1fb	t3_se7q2b	t3_se7q2b	/r/conspiracy/comments/se7q2b/more_cold_hard_evidence_byren_is_swayze_swayze_is/huhm1fb/
a2forfgq	You a big fan of Exxon/Mobil too, I take it?	1643316357.0	huhmf5n	t3_se16p0	t1_huhfx11	/r/conspiracy/comments/se16p0/what_part_of_the_covid_vaccines_dont_prevent/huhmf5n/
8ywo8qe	I'm curious to know the "grossly unfactual information" that he thinks has become so "life threatening" that he decided to sacrifice his discography over? Seems like he should be very clear about a stance so public and critical.	1643316381.0	huhmhcc	t3_se7jqv	t3_se7jqv	/r/conspiracy/comments/se7jqv/neil_youngs_letter_to_spotify/huhmhcc/
a2forfgq	Haha this would be GREAT but obviously the "Old Man" would melt down and throw a tantrum when questioned by JR.	1643316437.0	huhmmp8	t3_se7l7o	t1_huhk4lo	/r/conspiracy/comments/se7l7o/virtue_signaling_at_its_finest/huhmmp8/
zhe6v	I think he probably liked all the power he got and wanted more. Do i think that having the ability to have people humility themselves at his whim humanized him, no.	1643316541.0	huhmwsj	t3_se853d	t1_huhmfnw	/r/conspiracy/comments/se853d/bull_testicles/huhmwsj/
zhe6v	You saying he had no agency in taking the role?	1643316559.0	huhmyir	t3_se853d	t1_huhme1t	/r/conspiracy/comments/se853d/bull_testicles/huhmyir/
a2forfgq	WoWoWoW	1643316585.0	huhn11v	t3_se89ru	t3_se89ru	/r/conspiracy/comments/se89ru/for_those_who_dont_know_neil_youngs_boss_is_pfizer/huhn11v/
bwon5v5b	 I get that science has advanced, but damn dude. We haven't got that far yet!  https://www.fda.gov/emergency-preparedness-and-response/coronavirus-disease-2019-covid-19/comirnaty-and-pfizer-biontech-covid-19-vaccine#additional	1643316588.0	huhn1ap	t3_sdsang	t1_huh294a	/r/conspiracy/comments/sdsang/i_cant_wait_till_i_can_say_i_told_you_so/huhn1ap/
zhe6v	Or he realized how desperate people are and realized how easy it is to take advantage of people.	1643316653.0	huhn7rf	t3_se853d	t1_huhmuv1	/r/conspiracy/comments/se853d/bull_testicles/huhn7rf/
zhe6v	> Rocky Mountain Oysters  These were raw testicles.	1643316723.0	huhnejs	t3_se853d	t1_huhn9pv	/r/conspiracy/comments/se853d/bull_testicles/huhnejs/
zhe6v	Lot's of people speak truth to power. His spiel just fits your narrative.	1643316772.0	huhnjc6	t3_se853d	t1_huhnc19	/r/conspiracy/comments/se853d/bull_testicles/huhnjc6/
bpajwf1f	Let's be blunt -- Bob Hepburn is a lying piece of shit pushing a false narrative to stigmatize and harm his fellow citizens. He should lose his job.	1643316806.0	huhnmk2	t3_se7ri9	t3_se7ri9	/r/conspiracy/comments/se7ri9/let_the_divide_continue/huhnmk2/
zhe6v	Show would have went on but takes a special kind of person to want to humiliate desperate people.	1643316822.0	huhno4z	t3_se853d	t1_huhng6s	/r/conspiracy/comments/se853d/bull_testicles/huhno4z/
168mhn	Sure:  * https://www.acpjournals.org/doi/10.7326/M20-3012  * https://www.pnas.org/content/118/34/e2109229118  * https://jamanetwork.com/journals/jamanetworkopen/fullarticle/2787098  * https://www.bmj.com/content/375/bmj.n2342  * https://www.nature.com/articles/s41577-021-00631-x  * https://www.thelancet.com/journals/lanepe/article/PIIS2666-77622100059-4/fulltext  * https://www.ncbi.nlm.nih.gov/pmc/articles/PMC7267538/  * https://www.medscape.com/viewarticle/964836  Can you provide a source that asymptomatic infections aren't a thing?	1643316830.0	huhnoyb	t3_se7bzx	t1_huhnf4p	/r/conspiracy/comments/se7bzx/discussion_friend_asks_to_do_a_self_test_before/huhnoyb/
5j3iwpue	No shit. Vaccine mandates are a "Rockefeller Republican" concept. It's pretty crazy.	1643316912.0	huhnwst	t3_se52oy	t3_se52oy	/r/conspiracy/comments/se52oy/i_would_consider_myself_left_leaning_hate/huhnwst/
zhe6v	So what did the show "do"?	1643316918.0	huhnxe9	t3_se853d	t1_huhntb5	/r/conspiracy/comments/se853d/bull_testicles/huhnxe9/
zhe6v	Seems very much like a hunger games situation.	1643316968.0	huho29s	t3_se853d	t1_huhnxje	/r/conspiracy/comments/se853d/bull_testicles/huho29s/
bpajwf1f	It only works if people believe it. Everything the govt and media says is lies.	1643317004.0	huho5p1	t3_sdp3le	t1_hueetxk	/r/conspiracy/comments/sdp3le/fireworks_light_the_sky_as_truckers_in_the/huho5p1/
6wrntcp	Here's the conundrum  Men are supposed to have vaginas now, too, right?  So its phobic to say "woman".   Either that or this new whole gender identity stuff is BS.   Can't be both ways.	1643317037.0	huho8yk	t3_se8cbp	t3_se8cbp	/r/conspiracy/comments/se8cbp/while_we_keep_hearing_about_sexism_and_racism_in/huho8yk/
168mhn	> watching the videos from people actually on the ground  link?	1643317054.0	huhoao5	t3_se81bl	t1_huhndxh	/r/conspiracy/comments/se81bl/11000truck_93milelong_freedom_convoy_protests/huhoao5/
zhe6v	Nah, i got better things to do like waste the time of people who think they are smart. Thanks, though.	1643319818.0	huhvrsa	t3_se853d	t1_huhv8kj	/r/conspiracy/comments/se853d/bull_testicles/huhvrsa/
aylco	I teared up driving down the 401 today seeing every bridge full of people	1643320104.0	huhwjgt	t3_se0c5a	t1_hugipwc	/r/conspiracy/comments/se0c5a/going_on_the_ontario_board_here_on_reddit_just/huhwjgt/
a1aedp2z	Well, would you look at the time! https://youtu.be/EL9FweYDEC0	1643320141.0	huhwn0x	t3_se0bvn	t3_se0bvn	/r/conspiracy/comments/se0bvn/this_fucking_coward_is_hiding_from_the_people/huhwn0x/
4s0abls1	Bingo. I laugh when people here think Biden is running the show all on his own. So much goddamn ignorance.	1643320434.0	huhxexv	t3_se9gja	t1_huhvgi9	/r/conspiracy/comments/se9gja/elon_choosing_violence_today/huhxexv/
10eof8	It’s a sarcastic saying. I think we all know what violence is lol.	1643320454.0	huhxgto	t3_se9gja	t1_huhvhng	/r/conspiracy/comments/se9gja/elon_choosing_violence_today/huhxgto/
zhe6v	I didn't know it got so bad for Brett from Flight of the Conchords. He used to be good. I do appreciate that he got the word "poop" in there. Shows real maturity.	1643320459.0	huhxh9l	t3_se853d	t1_huhw9l7	/r/conspiracy/comments/se853d/bull_testicles/huhxh9l/
4s0abls1	Don't bother. People here won't listen to any criticism for their talking heads/idols like Musk, Rogan, Jones, and all those other guys. It could be revealed that Musk had dinner with the Clintons every week, and flew on Epstein's plane, and most here would still orgasm over everything he does.	1643320552.0	huhxq2u	t3_se9gja	t1_huhw3et	/r/conspiracy/comments/se9gja/elon_choosing_violence_today/huhxq2u/
8ukxpb9z	You’ve just described the plot of the classic film “V for Vendetta”	1643320565.0	huhxre1	t3_se9qfg	t3_se9qfg	/r/conspiracy/comments/se9qfg/a_theory_for_whats_to_come_regarding_this_whole/huhxre1/
3y3566ok	any mention of famous orders/societies founded by loyola, weishaupt, yale, moses, solomon, ezra etc?	1643320767.0	huhyako	t3_se5sct	t1_huhuv2d	/r/conspiracy/comments/se5sct/biggest_conspiracy_ever/huhyako/
n4isk	It’s a threat to the establishment and that very establishment is launching its own shit coin.  You can’t have the petrol dollar be the global currency as the energy economy is transitioning away from petroleum.  The control to define economics for all time with one currency to rule them all is *the* powergrab and everything tagging along is a means to an end.  Look how broken the existing economy is and understand part of that is 2008 and part of it is intentionally destroying that past to cover a multitude of sins while lying about the absolutely criticality of why it must be now, by the very same fucks that have created this shitstorm.  The last people you want to trust with this economic future are the clowns responsible for our past and present inequality.	1643321194.0	huhzfpk	t3_se9sp5	t3_se9sp5	/r/conspiracy/comments/se9sp5/basement_joe_thinks_cryptocurrencies_are_a/huhzfpk/
fes1kftr	[deleted]	1643321257.0	huhzlom	t3_se8kux	t3_se8kux	/r/conspiracy/comments/se8kux/why_is_george_soros_giving_millions_of_dollars_to/huhzlom/
8ukxpb9z	Yes, the movie did show the perspective of the vigilante side taking on the government. Before they revolutionized, though, the govt had started to round up their political opponents, immigrants, Jews, Muslims, atheists, homosexuals, and other "undesirables" and had them imprisoned and then killed. This was while they were releasing wave after wave of deadlier viruses that only they had the antidote for. I don’t necessarily think a sequence of viruses is what’s next. But I think expanding government control and influence on increasingly diverse areas of our lives to hold us down and make us abide by their views and rules on things like “climate change” and “racial equity” and “mass migration” is what’s coming next, if not already knocking on our door.	1643321490.0	hui07v1	t3_se9qfg	t1_huhyxbo	/r/conspiracy/comments/se9qfg/a_theory_for_whats_to_come_regarding_this_whole/hui07v1/
2isi0xe8	There are many counter-surveillance technological nuances of protests these days. To anybody going to these types of protests going forward (in case they try to false flag):  * Do it old school.   * They can collect information simply from proximity parameters.    * Less tech as possible.   * Cash only.   * Old car/no smart tech.  * [BAE Systems ARGUS-IS 1.8 Gigapixel Camera](https://www.youtube.com/watch?v=kiPSy6f7-Vc)  * [ Plus all video and cell phone feeds can be ran through computer vision software that operates in real time.](https://youtu.be/Cgxsv1riJhI?t=327) * Make as many people as alert as possible. [The more people watching, the faster you can stop bad actors.](https://youtu.be/bPG-9fYS3L8)  * Pay attention to oddly grouped and out of movement.   * Clothing: Natural or not?  * Conversation: demoralizing, anger inducing, counter-productive?     * Agents will often lack background connections or references. No one in your circles or related groups will know them.     * They tend to create messes in groups and between group members. They leave chaos in their wake.     * **They tend to gravitate toward people in the group who are dissatisfied. Once relationships with those folks grow, the dissatisfaction spreads.**     * When confronted, they will get defensive and start making their own accusations.     * They act like zealots, but they don’t have the fruit of it. They have passion but don’t truly care.	1643321811.0	hui11td	t3_se9uzh	t3_se9uzh	/r/conspiracy/comments/se9uzh/could_this_be_the_reason_why_crazy_polls_from/hui11td/
tdhja	Could you share sources that prove it doesn’t slow infection rate.	1643322140.0	hui1ws3	t3_se16p0	t3_se16p0	/r/conspiracy/comments/se16p0/what_part_of_the_covid_vaccines_dont_prevent/hui1ws3/
19kfnw43	Without evidence this is about as believable as the wet market bat soup story.	1643322287.0	hui2anp	t3_sea85s	t3_sea85s	/r/conspiracy/comments/sea85s/extreme_danger_reptilians_seen_deep_underground/hui2anp/
g314n	Remember when that stupid dumb fuck David Wilcock said in 2012 people would get super hero powers? LoL I cant believe hes still making videos. Its rabbit hole time!	1643322359.0	hui2hhg	t3_seafde	t3_seafde	/r/conspiracy/comments/seafde/michael_jackson_alive_dark_side_tiktok_exposed/hui2hhg/
co6qko8a	Iconoclast "Rage Against the Machine" has a famous song that says "Fuck you I won't do what you tell me" and no requires you buy a Pfizer "vaccine" to watch them play.	1643322786.0	hui3lei	t3_se89ru	t3_se89ru	/r/conspiracy/comments/se89ru/for_those_who_dont_know_neil_youngs_boss_is_pfizer/hui3lei/
27p71k4v	How about we just stop talking about it because David Icke and his like are probably COINTELPRO.   You put serious conspiracies on the lips of people speaking crazy shit and then sane people steer clear and the conspiracy is safe from recognition by the majority of the population.	1643322818.0	hui3ody	t3_sead45	t3_sead45	/r/conspiracy/comments/sead45/lets_stop_talking_about_reptilians/hui3ody/
co6qko8a	I have still never heard of an actual COVID-19 death. I have large extended family, go to a big church and kids in school. Zero. Nothing. If any one died I would have known instantly.	1643323121.0	hui4gj8	t3_se8436	t3_se8436	/r/conspiracy/comments/se8436/im_i_the_only_person_that_doesnt_know_anyone/hui4gj8/
zhe6v	People signed up for squid game too.	1643323138.0	hui4i1z	t3_se853d	t1_hui463j	/r/conspiracy/comments/se853d/bull_testicles/hui4i1z/
d0036u8	Somebody tell me who you think ISN'T controlled opposition	1643323320.0	hui4yr9	t3_se29r4	t3_se29r4	/r/conspiracy/comments/se29r4/controlled_opposition/hui4yr9/
ucc54	A lot of small churches are similar to meeting in homes. Just small groups of people hanging out and trying to do some good in their communities	1643323403.0	hui56gv	t3_se5sct	t1_huhw1cj	/r/conspiracy/comments/se5sct/biggest_conspiracy_ever/hui56gv/
dxapz	 But if you do it for 50 years, you get a watch.	1643324241.0	hui7bky	t3_se92kx	t3_se92kx	/r/conspiracy/comments/se92kx/psychology_and_psychiatry_are_the_biggest_scams/hui7bky/
zhe6v	Well Fear Factor is not real either. You have to assume both are conditioning humans for a not-to-distant future	1643324245.0	hui7bww	t3_se853d	t1_hui4rbw	/r/conspiracy/comments/se853d/bull_testicles/hui7bww/
6xqp3	Why not just check you vax pass… when you pay?????	1643324528.0	hui81e8	t3_sdxldi	t3_sdxldi	/r/conspiracy/comments/sdxldi/trudeaus_canada_unvaccinated_to_be_accompanied_by/hui81e8/
buucjyxp	One would think so but if you listen to Davos it was on there last year. And I get down arrows I am done on this compromised once conspiracy site.	1643324542.0	hui82k5	t3_sdrbmg	t1_huhn1ir	/r/conspiracy/comments/sdrbmg/not_sure_if_this_has_been_posted_but_felt_it/hui82k5/
