author	body	created_at	c_id	s_id	p_id	permalink
26tzkq8	Yes as i stated the entire premis is thrown  awry with the perception of the function of time.   if movies have tought us anything its that our willingness to invest in an idea is more relevant than our willingness to invest in the application of said idea. To accept being told the value of something and attempting to discover that on your own are how the TPTB keep us down.	1642808113.0	hto3rmo	t3_s9k8x7	t1_htnp2f4	/r/conspiracy/comments/s9k8x7/time_traveling_computers_thoughts/hto3rmo/
e50gj	> living more in harmony with nature  Sounds great but eventually that's as boring as fuck. AND hard work. There's only so much sitting around the lake shore, looking at the trees, the water and distant mountains, patting the lambs and collecting the eggs that a man can take (1 hour tops). Nature is for the birds and bees. The animals. THEY are at 'one' with Nature. Not us. We're still interlopers of sorts. And the elements can be very uncomfortable AND quite dangerous. Always got to be on guard; just like with living in the cities. Sitting outside a cafe with a great coffee and looking at PEOPLE and the manifestations of BRAIN POWER all round, is a lot more fun than gazing at the lake. You don't always have to be alone, sitting on a mountain top, to be free of the 'rat race'.	1642808157.0	hto3vpd	t3_s96rs1	t1_htm1b90	/r/conspiracy/comments/s96rs1/there_will_be_no_great_awakening_and_no_reckoning/hto3vpd/
d0036u8	Bots or something else camping out, auto-downvoting posts with valuable information so they don't get traction...	1642808194.0	hto3z27	t3_s9o7rr	t3_s9o7rr	/r/conspiracy/comments/s9o7rr/these_4_doctors_shred_the_prevailing_vaccine/hto3z27/
3xvtv0fp	Just picking your brain, do you like the way Kamala wrote this tweet? How does her tweet make you feel?   Please answer without using the words “Donald” or “Trump”.	1642808243.0	hto43je	t3_s9i6gu	t1_hto267x	/r/conspiracy/comments/s9i6gu/anyone_else_collect_their_2000_monthly_check_yet/hto43je/
4crjg9no	Finally!  Agree they are the super speakers—but if it has to happen @ least Omicron is the better bargain.	1642808549.0	hto4v09	t3_s9ko4o	t3_s9ko4o	/r/conspiracy/comments/s9ko4o/they_are_lifting_mandates_and_lockdowns/hto4v09/
4xdbzb9a	1. TF you want me to do? 2. If this doesn't pan out at all and ends up being a nothing burger, you'll have less credibility and look like a fool.  3. If it does pan out and cause supply chain disruptions, the normies will blame you. You'll be public enemy number 1 because little Timmy can't get his coco puffs. Think they're mad now, you ain't seen nothing yet.  I already did the revolutionary thing 10 years ago and got the right side of my body microwaved for my trouble. The regime I was opposing is still in power today.  I made fake resumes to overwhelm hiring systems when they tried to hire scabs for those Aussie truckers. What good did that do (other than waste my time and make me look even more insane to my friends and family)?  I have experience. I know a psyop when I see one.   I already lost everything. There's nothing left for me to fight for, so I don't really care.   I spoke out and the people I knew and loved think I'm insane. They don't want me near them, and will probably always look down on me. Fighting the regime isn't going to bring them back. It isn't going to stop their ridicule. The people that matter to me are all gone. What the fuck is there left for me to even fight for?   We are all like cats chasing a laser pointers. The powers you're opposing are so far beyond our capacity to understand, that we are reduced to yowling and barking like distressed animals. We are deluding ourselves into thinking we are accomplishing something.   You have no right to tell me I haven't done anything or sacrificed anything.	1642808673.0	hto565h	t3_s9lcxc	t1_hto15vc	/r/conspiracy/comments/s9lcxc/less_than_2_days_before_the_trucks_roll_for/hto565h/
d05qdhoa	Basically open a bit- deaths increase (manipulate stats out of context)- we need a new vaccine/restrictions  Rinse and repeat forever	1642808886.0	hto5phh	t3_s9c3kp	t3_s9c3kp	/r/conspiracy/comments/s9c3kp/seriously_whats_going_on/hto5phh/
d0036u8	anything they don't want to make it to the front page gets hammered with downvotes immediately, probably picking up on keywords or something, I've seen it happen to lots of people unfortunately	1642808974.0	hto5xfv	t3_s9o7rr	t1_hto5rme	/r/conspiracy/comments/s9o7rr/these_4_doctors_shred_the_prevailing_vaccine/hto5xfv/
4a6jh	Did YOU suffer an Adverse COVID-19 Vaccine Reaction? YOU may be entitled to compensation. Call today!	1642809127.0	hto6b96	t3_s9i6gu	t1_htn4b82	/r/conspiracy/comments/s9i6gu/anyone_else_collect_their_2000_monthly_check_yet/hto6b96/
4xdbzb9a	Dubai is one of those places where every franchise you can think of exists. Its the only place I've been where I see European, American, Australian, Middle Eastern, Indian and Asian franchises in the same place.	1642809232.0	hto6kkp	t3_s9hknu	t1_hto3wr4	/r/conspiracy/comments/s9hknu/naked_people_roaming_around_dubai_today/hto6kkp/
3qbixhfk	I’m here in Texas and the school I work at has mandated masks as of today. We haven’t had to wear them since like October but so many teachers and students are getting sick they’ve put this back in place. I personally am not vaccinated along with two coworkers and the vice principal. Guess who hasn’t been out sick? I’ve actually got people asking me what I take. I tell them I take grapefruit seed extract, elderberry with zinc and vitamin C, niacin, I do exercise daily, eat clean, I do tan for some vitamin D, use an infrared sauna, and most importantly drink reverse osmosis water.	1642809647.0	hto7leu	t3_s9hn9o	t3_s9hn9o	/r/conspiracy/comments/s9hn9o/ireland_ends_lockdown_all_restrictions_lifted/hto7leu/
3y3566ok	Zyozi Wszy TYFUS PLAMISTY is what it says on the propaganda poster I saved.	1642809892.0	hto875b	t3_s9ba02	t1_htn1851	/r/conspiracy/comments/s9ba02/nypd_officers_arrest_9_year_old_who_didnt_show/hto875b/
6hyeg	From Obama to Trump the only notable difference was my job gave me an extra week of vacation after Trump's tax cuts.  Which they quickly regretted as they couldn't handle that many people being off so often.    Trump to Biden though?  I panic buy groceries every few months worried about shortages and inflation.  Unemployed because I don't want to be in a trial of an experimental drug.  Most jobs are requiring me to take that drug because of Biden to be hired.    I'm not a fan of Trump but Biden seems to want me dead which I've never felt from any politician in my lifetime.	1642809893.0	hto879e	t3_s9i6gu	t1_hto0jkx	/r/conspiracy/comments/s9i6gu/anyone_else_collect_their_2000_monthly_check_yet/hto879e/
hpkh6yz	Virtue signaling at its finest	1642809938.0	hto8bap	t3_s9i6gu	t3_s9i6gu	/r/conspiracy/comments/s9i6gu/anyone_else_collect_their_2000_monthly_check_yet/hto8bap/
2aaffiml	SS. This is a conspiracy sub, and while none of this verified, why would there be an attack directed to a prison? They obviously needed someone there dead, and maybe that person had some damning info about the Saudi family. Afterall Epstein had tied with the Saudis and I'm sure it was "business" as usual. Maybe now that Maxwell stopped fighting to keep John Doe-s anonymous they are starting to clean up loose ends.	1642809951.0	hto8cfc	t3_s9ou29	t3_s9ou29	/r/conspiracy/comments/s9ou29/airstrikes_kill_70_people_and_knock_out_internet/hto8cfc/
6hyeg	> or something.	1642810234.0	hto915q	t3_s9crup	t1_htnrd2e	/r/conspiracy/comments/s9crup/peter_daszak_drops_bombshell_confession_ecohealth/hto915q/
6cfuvwy4	Dude you’re like special edition human though it’s impossible to make fun of you.. if your handsome and got a fat hog? Jesus Christ! you got the job, where do I cum?    Edit: no really these new city blacks with entitlement might want us dead and are hiding it under the guise that were causing them issues and there at war with us somehow idk man	1642810246.0	hto927e	t3_s9oy9j	t3_s9oy9j	/r/conspiracy/comments/s9oy9j/ive_seen_how_easily_a_person_can_hate_me_want_me/hto927e/
d0036u8	agreed, somebody showed me today, very reasoned dudes	1642810409.0	hto9gqo	t3_s9o7rr	t1_hto630m	/r/conspiracy/comments/s9o7rr/these_4_doctors_shred_the_prevailing_vaccine/hto9gqo/
4xdbzb9a	2012 Arab spring. ADS device. Went blind in my right eye for months. Still got a black spot that flares up when I get on an airplane. It wasn't the worst thing I encountered in my life either. At this point I'm tapped out. I feel 20 years older than I should.   Its not that I don't support the effort. I believe you can just classify me as a casualty at this point. I'm broken. Lol.	1642810649.0	htoa21o	t3_s9lcxc	t1_hto8gtz	/r/conspiracy/comments/s9lcxc/less_than_2_days_before_the_trucks_roll_for/htoa21o/
4e76frdc	trash journalist fuckwits paying off the mods to promote their semi-woke partisan agenda status quo shite	1642810777.0	htoadip	t3_s9oim0	t3_s9oim0	/r/conspiracy/comments/s9oim0/why_has_this_sub_not_got_nuked_yet/htoadip/
z6x10	You have never heard of it? LOL	1642811008.0	htoay7a	t3_s9ocna	t1_hto6irt	/r/conspiracy/comments/s9ocna/covid_doesnt_exist_its_the_regular_flu_prove_me/htoay7a/
z6x10	True. COVID does not exist and neither does any virus. Research Stefan Lanka.	1642811076.0	htob46c	t3_s9ocna	t3_s9ocna	/r/conspiracy/comments/s9ocna/covid_doesnt_exist_its_the_regular_flu_prove_me/htob46c/
ngwo9si	First post I’ve seen of this. Yes. That’s what I think. They throw away the social distancing and mandates and all that jazz. Can’t have people scared of Covid when getting shipped off to war. The war will quickly put Covid in the past and it will put all the fake bullshit and lies and deceit from the past two years under the rug. You need a distraction to come down off the past two years.	1642811228.0	htobhio	t3_s9c3kp	t1_htn2gla	/r/conspiracy/comments/s9c3kp/seriously_whats_going_on/htobhio/
6hyeg	Good sign someone doesn't know wtf they are talking about.  But you keep pushing your narrative.	1642811351.0	htobsi2	t3_s9crup	t1_htoab7k	/r/conspiracy/comments/s9crup/peter_daszak_drops_bombshell_confession_ecohealth/htobsi2/
gyw3v	It's all about to fall apart.  They got as many as they could vax'd.  Now they will let it do its thing and run stories that it's dangerous to get people riled up.  Meanwhile, war will start.	1642814112.0	htoihvx	t3_s9c3kp	t3_s9c3kp	/r/conspiracy/comments/s9c3kp/seriously_whats_going_on/htoihvx/
55k9qsd6	Just a blatantly biased article with no sources included.	1642814152.0	htoildf	t3_s9ky4d	t1_htnria0	/r/conspiracy/comments/s9ky4d/trump_draft_executive_order_would_have_authorized/htoildf/
756f76av	The problem is the pharmaceutical company's can't patent them because they're natural. That's why they've been demonized. They were doing research and seeing the benefits until Ronald Reagan's war on drugs.	1642814445.0	htojav7	t3_s9pnek	t1_htoibxz	/r/conspiracy/comments/s9pnek/am_i_crazy_to_be_questioning_all_me_meds/htojav7/
dxdyrrrx	Covid was a smokescreen.  There is war on, its been going on for several years.  We are at a flash point.  Traitors in our governments etc etc  Big bizznizz big govnezz	1642814525.0	htojhud	t3_s9c3kp	t3_s9c3kp	/r/conspiracy/comments/s9c3kp/seriously_whats_going_on/htojhud/
4xdbzb9a	You related to Farouk Shami?	1642814538.0	htojizi	t3_s9oy9j	t1_htohy6c	/r/conspiracy/comments/s9oy9j/ive_seen_how_easily_a_person_can_hate_me_want_me/htojizi/
4ygst3	It's pretty simple imo : the problem are these structures that exist - so we change the structures of power. Any administrator with any semblance of power over others has their activities broadcast 100% of the time as well as an off switch installed in their body that can be activated democratically. They make a fair stipend for their service but are banned from ulterior income. We all enter a lottery every couple of years but no one really wants the job.	1642814551.0	htojk41	t3_s9q3ca	t3_s9q3ca	/r/conspiracy/comments/s9q3ca/the_ultimate_question_for_conspiracy_theorists/htojk41/
a2forfgq	Number One: No more shill games	1642814565.0	htojlb2	t3_s9q3ca	t3_s9q3ca	/r/conspiracy/comments/s9q3ca/the_ultimate_question_for_conspiracy_theorists/htojlb2/
97stva43	What makes you think conspiracy theorists want to overthrow the elites? Far as I'm concerned society is the elite's problem and they can have it. I think overthrowing the elites and saving society would be like walking into a bdsm club and untying the submissives. Oh, you mean you're actually into this? I'd say after the submissive tells me what's your problem!	1642814593.0	htojnps	t3_s9q3ca	t3_s9q3ca	/r/conspiracy/comments/s9q3ca/the_ultimate_question_for_conspiracy_theorists/htojnps/
4iwwbg7u	oh look a person who knows how to logically think, your kind isn’t welcome around here	1642814619.0	htojpxs	t3_s9ovr3	t1_htogkqd	/r/conspiracy/comments/s9ovr3/im_sick_of_hearing_people_say_i_dont_care_if_you/htojpxs/
dih7t2wn	I don’t know man. This whole shit screams sus.  Few questions:   1) is that a school trip? If so, why so late? And where are the guardians?  2) where are the parents if not a school trip?   3) why are the police ignoring everything around them?   4) why are there so many adults just recording the shit?   This screams set-up to create outrage to me.. perfect scenario to provoke outrage. In my opinion.  Shit is weird man , I live in NYC and have literally had conversations with officers in the subway maskless about how crazy all this shit is, regarding the pandemic. This just don’t sit right with me	1642814664.0	htojtvy	t3_s9ba02	t3_s9ba02	/r/conspiracy/comments/s9ba02/nypd_officers_arrest_9_year_old_who_didnt_show/htojtvy/
756f76av	You get that happy tingly feeling that isn't addictive. I literally feel closer to the devine and nature. I usually get the best epiphany's usually telling me where I'm screwing up in my life and the changes I need to make. Even the trees wave at you. How is that a bad thing?	1642814776.0	htok3le	t3_s9pnek	t1_htoitdv	/r/conspiracy/comments/s9pnek/am_i_crazy_to_be_questioning_all_me_meds/htok3le/
5w3qg08j	Discussion of the occult, alien intelligence on the planet, synchronicity, and much more!	1642814785.0	htok4dk	t3_s9qm4u	t3_s9qm4u	/r/conspiracy/comments/s9qm4u/testimony_of_a_physician_on_the_nature_of_reality/htok4dk/
8da07	> *How could we fight against such a superior enemy? One that can travel the cosmos would destroy our planets militaries in hours. What if we knew that "resistance would be futile" so the usa and ussr developed a different kind of strategy, one that would prevent them from using our planet (assuming that true earth like planets with the correct molecules existing in the ideal ratio to support life are extremely rare)*  I just completely don’t give one iota of energy to the idea that our planet is naked out in the cosmos with its planetary ass hanging out in a vulnerable state waiting for the cosmic equivalent of European settlers to come to our world and fight us and take over.   I am sure Earth is a quarantined nature preserve in the eyes of the robust and crowded galactic community. Earth is known. Earth is observed. There are advanced humanoids living below our feet in honeycombed underground pockets of Earth’a crust. On the surface, our human species is dominant and living in a backwards and barbaric fashion. We are perceived as essentially the “North Koreans” of the cosmos. Everything we understand about this realm is backwards, and that is purposeful. It keeps us subjugated, compliant, and continually consenting to this hyper-accelerated, smothering, amnesiac reincarnation matrix with an oppressive “veil” that smothers our senses. (Think of the ending to the movie *They Live!* in terms of the frequency farted forth and blocking us from our innate senses and innate abilities tucked away dormant within our DNA).   Even though galactic reconnectivity is already underway, Earth has been left to its own devices for a few reasons, some of which are:  * Programming by the elites to portray extraterrestrial or extradimensional consciousness as sinister. People have been goaded to “not consent” to connection with the Galaxy. We have been tricked to shut our senses off. We laugh at abductees in “Weekly World News” at the check-out stand at the Piggly Wiggly grocery store — but we are never quite sure *why* we are compelled to laugh at these experiencers.   * Humans are in a volatile space energetically, emotionally and physically. We have death, sorrow, sickness, regret being felt all over our planetary surface. If an extraterrestrial flutters down and walks down the street incognito (and some do), they have to put up shielding in order to keep human passersby from “screaming at them” so to speak. Humans more nakedly broadcast than we realize.   We are arriving to a moment of breakthrough and essentially: ascension as a species. Metaphorically we are going to upgrade our lived experience from 8-bit Nintendo quality to 64-bit Nintendo quality. It will feel like a total and utter paradigm shift and we won’t even realize that after the “shift” we will still have a long way to go in terms of growth, development, and perception.   With faculties online and with understandings coming to the fore, and with past- and other-life memories returning — we will quickly rehabilitate and gentrify this Earthly, nay, *Gaian* realm.   It’s gonna be fuckin sweet. We chose this timeline so we are embodying it. Remember this place is a multiverse. Earth can and has been fucked with cosmically in the distant past. This entire solar system is littered with evidence that many wars and many destructions have occurred here in the distant past. A fucking planet blew up and now it floats around as the Asteroid Belt. Mars used to be lush and inhabited by advanced humanoids. Venus was the tits, too.   But right now we live in a state of “quarantine” and we choose in this specific timeline to lift that quarantine and to connect with our soul families and Star siblings from other systems.   No intergalactic wars for us. Only local liberation.	1642814793.0	htok54b	t3_s9pztv	t3_s9pztv	/r/conspiracy/comments/s9pztv/what_is_mutually_assured_destruction_had_a_more/htok54b/
6hyeg	Not really	1642814821.0	htok7hv	t3_s9crup	t1_htojyn6	/r/conspiracy/comments/s9crup/peter_daszak_drops_bombshell_confession_ecohealth/htok7hv/
756f76av	Really? Interesting. Like some mk ultra shit? I can see that.	1642814885.0	htokcyr	t3_s9pnek	t1_htok6d6	/r/conspiracy/comments/s9pnek/am_i_crazy_to_be_questioning_all_me_meds/htokcyr/
756f76av	I don't take that much very often. Usually when I want to look inward I take more.	1642814982.0	htokl7m	t3_s9pnek	t1_htokey2	/r/conspiracy/comments/s9pnek/am_i_crazy_to_be_questioning_all_me_meds/htokl7m/
c24bq	Live nation puts on most large concerts.	1642815183.0	htol2c9	t3_s9jdot	t3_s9jdot	/r/conspiracy/comments/s9jdot/when_we_were_young_tour_put_on_by_live_nation/htol2c9/
756f76av	Yes you're right there. It can be a little too real at times. Having an ego death isn't fun, but you don't necessarily always get the trip you want, but you get the trip that you need.	1642815189.0	htol2tl	t3_s9pnek	t1_htokqgt	/r/conspiracy/comments/s9pnek/am_i_crazy_to_be_questioning_all_me_meds/htol2tl/
8oeg55c1	I’m unvaxxed. 40 yo, healthy and fit 6’0 170lbs. Work out 3/4 times a week   Wife has had 2 Pfizer and 1 Moderna. She’s a nurse No side effects after the shots   I’ve tried to talk her out of getting the shots. Even since the first dose back in January 2021.   She had a pulmonary embolism after a miscarriage 10 years ago. She’s a clot risk.   Clot risk side effects didn’t start showing up in the news until after her first dose.   I tried to tell her to wait that it needs more trials and testing.     She still follows the guidelines to keep her job. I told her she could quit her job but she still goes to work   She got her booster last week. In Canada they will be giving out 3 doses per year (propaganda msm already testing waters with news articles of ….Canadians may need 3 doses per year until 2024   She’s had 3 doses already.   Our 14 and 8 year old are not vaxxed. I feel this is my hill to die on. And right now I’m alone in that regard. My wife said if it was up to her. She would get them vaxxed right now. I made it clear that I do not support that and will burn everything to the ground before I allow that to happen.   It’s my job to keep my family safe   The last 3 months have been the hardest to resist the shot pressures from everywhere   Me and my kids are not allowed at restaurants or indoor fun activities   It’s fucking depressing in Ontario.  She acts like nothing is wrong with what’s going on. “We are in a pandemic”  “Government is trying the best “  “The rules change because they are figuring it out as they go “    I just got diagnosed with extremely high triglycerides. I actually went to dr for chest pains around the heart   The stress and anxiety from Covid is killing me slowly  I don’t understand how I have such high levels. I don’t drink I partake in snacks foods in moderation. I work out 3 times a week anyways. I’m dealing with sleep issues anxiety, depression….  my dad died of suicide in lockdown 1.0 back in august 2020. His medical treatments got put on hold from February 2020. They needed to do cancer tests for a spot on his lung. He checked out of this world in august.   I hope you are so wrong but a lot of the data (misinformation??) I’ve been reading the last 2 years have come true   I hope you are wrong. Because it’s going to be a lonely planet…..one that might not be worth living in   It’s a fucking nightmare	1642815418.0	htolmd5	t3_s9ovr3	t3_s9ovr3	/r/conspiracy/comments/s9ovr3/im_sick_of_hearing_people_say_i_dont_care_if_you/htolmd5/
3my26	> We the people have to take responsibility and control the government  Finally we agree.  I, too, fully support the 2nd amendment.	1642815555.0	htolxt6	t3_s9fhjg	t1_htoeyg8	/r/conspiracy/comments/s9fhjg/the_reason_pyramid_schemes_are_outlawed_is/htolxt6/
756f76av	I wonder why it's so important that we believe the world is round? Why is NASA the only one who thinks the world is round. Cultures all over the world thought the Earth was flat. What's the conspiracy?( rhetorical question)	1642815585.0	htom0el	t3_s9q6dn	t3_s9q6dn	/r/conspiracy/comments/s9q6dn/flat_earthers_can_you_anwser_these_questions_no/htom0el/
dih7t2wn	1) why would it matter? … well, for one, it would imply 70+ years of money funneled away to unknown projects/purposes.   2) why are we told it’s round? My assumption would be that it creates a psychological sense that no matter how bad things are here, there is an infinite universe outside of here, it also creates this subconscious sense of our problems being small compared to the “bigger picture”. Also creates an excuse for reason 1.  3) I believe in space. I believe most of the conventional explanations, I’m not a flat earther, just providing my insight. Although I do believe in other dimensions, or levels of existence… so maybe in that regard our dimension could be “flat” in the sense that other dimensions are stacked neatly on top and below. (As above so below)   5) if the earths shape is in accordance to conventional science, then I have no reason to think the sun or the moon differ. If the earth is flat, perhaps the sun & moon are a light source outside of the Petri dish that our planet is.   Just my 2 cents	1642815621.0	htom3i0	t3_s9q6dn	t3_s9q6dn	/r/conspiracy/comments/s9q6dn/flat_earthers_can_you_anwser_these_questions_no/htom3i0/
cbmv4	Colonel Sanders getting a tattoo.	1642815632.0	htom4h6	t3_s9qs5o	t3_s9qs5o	/r/conspiracy/comments/s9qs5o/analyze_this_photo_without_any_context/htom4h6/
dih7t2wn	In regards to your answer to question 1… what if the creator is a scientist in a multi-dimensional lab somewhere else. Not saying that’s it, but it was an idea I had years ago while I was really stoned. Freaked me out for a minute	1642815761.0	htomfkp	t3_s9q6dn	t1_htoil33	/r/conspiracy/comments/s9q6dn/flat_earthers_can_you_anwser_these_questions_no/htomfkp/
1q69hq4m	See you again in another episode of P1andemic: Wuhan, Big Pharma, Bill Gates & friends take over the world	1642815918.0	htomsz6	t3_s9q6n3	t3_s9q6n3	/r/conspiracy/comments/s9q6n3/a_chemical_pharmaceutical_industry_insider_asks_a/htomsz6/
4iwwbg7u	you know there’s delivery right?  there’s plenty of ways to maneuver	1642815980.0	htomya3	t3_s9ln2f	t1_htnrg9b	/r/conspiracy/comments/s9ln2f/has_anyone_read_this_any_truth_to_it/htomya3/
h7u94	Yeah same here. Im open but skeptical  to almost everything. The film did make me think though because they specifically address many debunkers points and they made some really interesting conclusions. Its worth it if your bored ill say that.	1642815996.0	htomzlt	t3_s8ynjc	t1_htn1ln6	/r/conspiracy/comments/s8ynjc/if_you_truly_believe_we_had_the_technology_to_fly/htomzlt/
756f76av	You know, and the greatest part of taking them, is I don't have to take them all the time. I'll take them once and I find even days later, my mood is improving. In a way, they show me what I need to work on and my depression starts to subside. When I'm going through a low spot,  I'll take them again and I work through it.	1642816023.0	hton216	t3_s9pnek	t1_htoitdv	/r/conspiracy/comments/s9pnek/am_i_crazy_to_be_questioning_all_me_meds/hton216/
97stva43	You ever notice there are never any good accidents, like they forgot to give you the shot but think they did and marked you down as vaxxed?   I've been overcharged at the grocery store many times, never under- not once.	1642816100.0	hton8jt	t3_s9qrwq	t3_s9qrwq	/r/conspiracy/comments/s9qrwq/ontario_clinic_accidentally_gives_people_six/hton8jt/
