author	body	created_at	c_id	s_id	p_id	permalink
dwa1w2z7	I don't. But, I straight up cold stone lied to her face like it was nothing.	1642704682.0	hths9db	t3_s8pge5	t1_hthox74	/r/offmychest/comments/s8pge5/lied_to_my_gf_about_drinking_a_beer_yesterday/hths9db/
3j07kvqe	I stole underwear too and came in them but kept them until I deceived to toss them.	1642704701.0	hthsb75	t3_s8px52	t1_hthru2m	/r/offmychest/comments/s8px52/i_stole_underwear_when_i_was_13_and_i_cannot_deal/hthsb75/
epxm3	Yea I mean that’s true it’s just hard to not try to “fix” someone that lives in ways that are complete opposite of how I live my life	1642706221.0	hthwelo	t3_s8qcrm	t1_hthvmy6	/r/offmychest/comments/s8qcrm/one_of_my_best_friends_is_a_textbook_narcissist/hthwelo/
ef6w3stt	That's what I've been doing. I've just been avoiding them all for the time being. I don't want to tell his wife but we are also  close friends and she's gone through so much. I think my best option is to just avoid everyone until they all find out  or it blows over 😒	1642706415.0	hthwx24	t3_s8qk1w	t1_hthw8fv	/r/offmychest/comments/s8qk1w/cheating_on_her_husband_with_a_married_man/hthwx24/
eqallg3w	While I understand this, I agree with OP. As someone in a similar field (not exactly this) the comment that “our work should be enough” is very harmful to healthcare workers and to patient health as a whole. Because of course I care about my patients and want them to be healthy and happy, but I also need to take care of my family. If healthcare workers aren’t paid enough, and are completely burnt out, they aren’t able to provide the quality of care that their patients/clients need. Also, covering up the problem of payment and saying that we should all be ok with it bc we “want to help people” tends to cause therapists to not complain/try to change other issues that are detrimental to patients. For example, not having access to certain curriculum, assessments, or other materials. Which aren’t provided by the workplace, and can’t be bought by the therapists because they don’t have money…  I know that this is slightly a tangent but I hope that it gets the point across and maybe is similar to what OP is expressing!	1642706421.0	hthwxmr	t3_s8q4dl	t1_htht571	/r/offmychest/comments/s8q4dl/mental_healthaddiction_counselors_and_therapists/hthwxmr/
16i62i	I used to work in the warehouse at retail stores and absolutely would have appreciated someone buying food even if I didn't have any! Most ppl would provide jelly doughnuts and I don't like them lol. I pretty much will only eat plain doughnuts (no glaze/no powder) or crullers.  If we didn't eat them, then the next shift is like "awe shit!! Leftovers!!" and gobble them up lol	1642706618.0	hthxgs0	t3_s8ndv8	t3_s8ndv8	/r/offmychest/comments/s8ndv8/i_bought_donuts_for_everybody_at_work_and_im_the/hthxgs0/
ef6w3stt	I agree with you to an extent.  I don't want to put myself in that position which is why I haven't said anything yet. But both girls are close friends of mine and the cheaters wife had suspicions and confronted him about them and he straight out told her she was crazy and making things up  so I just feel it's not fair to keep this from her but I don't want to be the one to tell her. Anyway I'm just going to keep my mouth shut for now and see what happens	1642707179.0	hthyyav	t3_s8qk1w	t1_hthy5h1	/r/offmychest/comments/s8qk1w/cheating_on_her_husband_with_a_married_man/hthyyav/
5ihpgcu	OMG YES! I've been waiting all day for someone to say something this boring!	1642707376.0	hthzh9y	t3_s822ks	t3_s822ks	/r/offmychest/comments/s822ks/cats_are_100x_better_than_dogs_and_its_not_even/hthzh9y/
ef6w3stt	I've also been in this position and wish someone had told me.   I'm sorry this happened to you ❤	1642707389.0	hthzihx	t3_s8qk1w	t1_hthwho3	/r/offmychest/comments/s8qk1w/cheating_on_her_husband_with_a_married_man/hthzihx/
epxm3	I appreciate the advice :)	1642708474.0	hti2ibq	t3_s8qcrm	t1_hthxofg	/r/offmychest/comments/s8qcrm/one_of_my_best_friends_is_a_textbook_narcissist/hti2ibq/
iucgkduj	Most attractive people want somebody with good looks and good personality. If I require that, I’m called shallow and they’re not. Tell all the hot guys that rejected me because of my looks that they are shallow then.	1642708742.0	hti38js	t3_s8qe7g	t1_hti2q2v	/r/offmychest/comments/s8qe7g/i_cant_believe_im_called_shallow_for_having_the/hti38js/
iucgkduj	I’m average looking. So basically you are shallow if you’re unattractive huh.	1642708825.0	hti3ghr	t3_s8qe7g	t1_hti3bvm	/r/offmychest/comments/s8qe7g/i_cant_believe_im_called_shallow_for_having_the/hti3ghr/
5n6t2gfk	If you both truly love each other, I would sit down and talk with her and see if you can work it out. Ending the relationship with her, won’t make your past trauma go away. No sense in hurting someone else because you are unwilling to grow and communicate with her. That being said, do what is best for you.	1642709015.0	hti3yqe	t3_s8rk4l	t3_s8rk4l	/r/offmychest/comments/s8rk4l/im_going_to_do_it/hti3yqe/
z20r9h7	imagine those who were rejected	1642711920.0	htialpa	t3_s8sm06	t3_s8sm06	/r/offmychest/comments/s8sm06/college_made_me_realize_that_people_in_college/htialpa/
h0ocudg	What? I’m sorry, but that’s a terrible rule. You aren’t entitled to someone’s stuff just because it’s in the break room. Also, in a lot of places, the break room is the only room where people can leave their stuff in. Maybe just not touch other people’s food unless you’re given permission?!?	1642713316.0	htiega2	t3_s8ndv8	t1_hthzhzf	/r/offmychest/comments/s8ndv8/i_bought_donuts_for_everybody_at_work_and_im_the/htiega2/
h9cdx	Kind of a dick thing to say to OP, not cool man. That being said... for anyone out there that hasn't tried a Kolache, it's a MUST, those things are incredibly delicious!!   They are ridiculously more expensive than a donut though, complaining your coworker got you a free donut instead of a Kolache is just very arrogant and entitled. For reference, I once bought 2 dozen kolaches for my coworkers using one buy 6 get 6 coupon (so only paid for 18) and the total was $80. I've never bought Krispy Kreme but I imagine $80 of donuts is at least 6 dozens	1642714266.0	htih45f	t3_s8ndv8	t1_hthpcxd	/r/offmychest/comments/s8ndv8/i_bought_donuts_for_everybody_at_work_and_im_the/htih45f/
15w5yh	sometimes i wonder why people with severe hereditary mental illness decide to have kids. my mom also had all these issues and still popped us out and now every day is a struggle. for her and us.	1642714732.0	htiifdg	t3_s87llp	t3_s87llp	/r/offmychest/comments/s87llp/im_giving_my_daughters_custody_to_her_absent/htiifdg/
dr7bthpk	that's pretty bleak	1642715197.0	htijq65	t3_s8tk5o	t3_s8tk5o	/r/offmychest/comments/s8tk5o/he_actually_died/htijq65/
485g1mgz	You did good, them not eating doesn't make you dumb at all, thank you for being nice :)  also im so glad they started eating, hope the rest of your day went well 🥰	1642716133.0	htim9jy	t3_s8ndv8	t3_s8ndv8	/r/offmychest/comments/s8ndv8/i_bought_donuts_for_everybody_at_work_and_im_the/htim9jy/
btens0tl	This whole fwb is a sham. It only benefits one person usually. How can you not develop emotions unless youre a narcissist or sociopath? And hes exhibited many signs that he was a narcissist and i chose to ignore that only focusing on his nice traits	1642719527.0	htisyta	t3_s8h8fa	t1_htieon7	/r/offmychest/comments/s8h8fa/with_benefits/htisyta/
9y5oczgs	So sorry for your loss OP, as well as everyone else sharing their stories. I couldn’t even begin to imagine how you must feel and the pain you’re experiencing. Sending my condolences and virtual hugs. May he Rest In Peace ❤️	1642719698.0	htitduj	t3_s874u2	t3_s874u2	/r/offmychest/comments/s874u2/my_friend_died_in_my_house_yesterday/htitduj/
c5mnt1mf	finally someone made a post about this	1642720789.0	htiw1qi	t3_s8rhq6	t3_s8rhq6	/r/offmychest/comments/s8rhq6/youre_not_quirky_shut_up/htiw1qi/
dr7bthpk	So a daydream ended, I suppose you're entitled to be happy you had it. Beyond that there's nothing to do or say	1642722709.0	htj0p5c	t3_s8tk5o	t1_htiryld	/r/offmychest/comments/s8tk5o/he_actually_died/htj0p5c/
5w8kp4vw	What vibrator did you guys get?	1642723048.0	htj1iee	t3_s8lyjh	t3_s8lyjh	/r/offmychest/comments/s8lyjh/my_husband_is_absurdly_perfect/htj1iee/
9hg8llbd	I have a therapist, medication, I've been hospitalized, nothing works	1642723088.0	htj1lut	t3_s8whna	t1_htj1j9h	/r/offmychest/comments/s8whna/my_schizophrenia_is_so_bad_that_i_dont_think_its/htj1lut/
h0ocudg	Oh, that makes more sense. I thought you meant as long as it’s in the break room, then it’s open for anyone. Sorry for the misunderstanding.	1642723682.0	htj31co	t3_s8ndv8	t1_htj1efa	/r/offmychest/comments/s8ndv8/i_bought_donuts_for_everybody_at_work_and_im_the/htj31co/
cwqobxxr	So you came here to brag?	1642724308.0	htj4iwc	t3_s8wye4	t3_s8wye4	/r/offmychest/comments/s8wye4/statistically_speaking_i_am_better_than_80_of/htj4iwc/
5groy9qa	The good news is, you just have to learn to control your anxiety. Therapy might not hurt to lessen your fear, but it’s also wise to continue to be money conscious.	1642724450.0	htj4v20	t3_s8wii1	t3_s8wii1	/r/offmychest/comments/s8wii1/extreme_fear_of_poverty/htj4v20/
idsuz	The people on here are so freakin nice. I don't really know any nice people IRL spare a few so this always cheers me up to scroll through before I pass out at night lol.   And of course, OP, the world needs more of you! I'd LOOOOOOOVE love love a donut rn 😂	1642724552.0	htj53qm	t3_s8ndv8	t3_s8ndv8	/r/offmychest/comments/s8ndv8/i_bought_donuts_for_everybody_at_work_and_im_the/htj53qm/
j7w5q	I feel like this is definitely an unwritten rule	1642724648.0	htj5bwo	t3_s8ndv8	t1_hthzhzf	/r/offmychest/comments/s8ndv8/i_bought_donuts_for_everybody_at_work_and_im_the/htj5bwo/
22v9ii7h	Yeah okay but you’re still single	1642724839.0	htj5s9m	t3_s8wye4	t3_s8wye4	/r/offmychest/comments/s8wye4/statistically_speaking_i_am_better_than_80_of/htj5s9m/
4lwb5yfn	Better off. Not better.	1642725043.0	htj69j3	t3_s8wye4	t3_s8wye4	/r/offmychest/comments/s8wye4/statistically_speaking_i_am_better_than_80_of/htj69j3/
bhdgq	Ever considered getting her arrested? Your Dad won't press charges about the knife, likely, but she's committed felony grand theft to you.	1642725417.0	htj757b	t3_s8xbha	t3_s8xbha	/r/offmychest/comments/s8xbha/i_hope_my_sister_kills_herself/htj757b/
i67e8vn6	Lol this is literally a throwaway account and I've admitted to wanting goddamn body pillows 😭 if this isn't a loser thing to you idk what to say	1642726314.0	htj98zf	t3_s8xe9i	t1_htj7ck3	/r/offmychest/comments/s8xe9i/im_a_fucking_nerd_a_goddamn_femcel_and_i_hate_it/htj98zf/
bhdgq	okay, if you had to disarm her, that's another felony. again, not against your dad per se, but she was threatening assault with a deadly weapon.   i know a family that went through all of this with someone who had untreated bipolar disorder. it gets worse. you need to get the two of you space. after a few years wherein she spent some time in jail, she chilled out a bit and now people are able to talk from time to time. but literally all the same things. the threats of rape. all of it. almost destroyed her father's life. broke up a marriage. bankrupted the family. he had to leave the state.  anyway, good luck. no shade on mental illness it's legit, but it doesn't heal itself.	1642726364.0	htj9d6t	t3_s8xbha	t1_htj8pvd	/r/offmychest/comments/s8xbha/i_hope_my_sister_kills_herself/htj9d6t/
4c781knc	Our of curiosity, what are you getting out of this post? People cope with loss in different ways and though I haven’t gone through I’m conscious enough to know that miscarriage is an extremely difficult trauma to deal with.	1642726649.0	htja0xl	t3_s8xqpa	t3_s8xqpa	/r/offmychest/comments/s8xqpa/im_tired_of_miscarriage_moms/htja0xl/
6im79vq1	God help the man who decides you are the one.	1642728449.0	htje6jt	t3_s8yact	t1_htjdvk8	/r/offmychest/comments/s8yact/i_f28_will_always_believe_that_marriage_is/htje6jt/
mlh1y	Yeah man. This ain’t no thing. It was 2 weeks. I’m sorry you’re hurt but her dating someone new already really isn’t shocking.	1642729304.0	htjg5qv	t3_s8ylh9	t3_s8ylh9	/r/offmychest/comments/s8ylh9/i_broke_up_with_my_exgirl_she_got_with_a_new_guy/htjg5qv/
6im79vq1	Single for sure.. she thinks all the gays stole her men	1642729430.0	htjgg91	t3_s8yact	t1_htjf0t7	/r/offmychest/comments/s8yact/i_f28_will_always_believe_that_marriage_is/htjgg91/
z20r9h7	tell everybody in real life, tell your parents, tell your sibkings, tell your friends, and ask for help so you can leave this situation that is only getting worse and will damage your mental health the more you stay	1642730204.0	htji86n	t3_s8yw0k	t3_s8yw0k	/r/offmychest/comments/s8yw0k/i_feel_completely_trapped_in_my_relationship_and/htji86n/
hsidarpy	same. i used to be so crazy about climate change but no one seems to gaf so oh well. i won’t try to make it worse but im done trying to get ppl to care. i’m gonna die before 30 anyway lol	1642730412.0	htjip34	t3_s8j10m	t3_s8j10m	/r/offmychest/comments/s8j10m/ten_years_a_vegetarian_not_anymore/htjip34/
gnsk5khk	It's hard though quitting addiction isn't that easy I love my addiction more than my own girlfriend I love my addiction more than I love myself 😢💔	1642730529.0	htjiyrf	t3_s8ytr0	t1_htjhdc8	/r/offmychest/comments/s8ytr0/my_girlfriend_broke_up_with_me/htjiyrf/
8l9mdrzq	Having mental problems should not be an excuse for being a shitty person.Most of us have those and we still treat people with kindness because we know what being unkind does people’s mental health.	1642730693.0	htjjci5	t3_s8l53k	t3_s8l53k	/r/offmychest/comments/s8l53k/i_traumatized_a_beautiful_person/htjjci5/
hncb1vbk	I mean, you’re committing a logical error in assuming that procreation is directly connected to love. You can procreate with someone, doesn’t mean you love them.  By your logic, straight couples that don’t have kids or where one person is infertile aren’t in real love either.   I don’t mean to insult you, but I’m growing concerned for people who equate loving relationships to having children.	1642731693.0	htjln8a	t3_s8yact	t3_s8yact	/r/offmychest/comments/s8yact/i_f28_will_always_believe_that_marriage_is/htjln8a/
f5dlxzm3	I've known them for two years. We became best friends around this time last year.	1642733118.0	htjoy3p	t3_s8zx00	t1_htjojf0	/r/offmychest/comments/s8zx00/today_i_cut_all_contact_with_my_best_friend/htjoy3p/
9t4opiph	I thought this too. Also I couldn't tell from OP's post what country they are in. You may have to isolate in the US, but in several other countries (including UK where I'm from) you are not required to isolate if someone you live with tests positive as long as you are fully vaccinated, symptom free and test negative yourself.	1642733998.0	htjqznu	t3_s874u2	t1_htio573	/r/offmychest/comments/s874u2/my_friend_died_in_my_house_yesterday/htjqznu/
z20r9h7	how	1642735129.0	htjtjsz	t3_s90mi4	t3_s90mi4	/r/offmychest/comments/s90mi4/i_killed_my_best_friend_i_am_sorry/htjtjsz/
9omr4	They’re your parents and it’s their home, I don’t think it’s so much hate, but more so the lack of respect on your end. If they tell you not to lock the door then don’t lock it, they’re your parents, they make the rules. I don’t understand why they would tell you to fail on a test though, that doesn’t seem very encouraging. At the end of the day you need to respect them and their rules as long as you are living in their home.	1642735657.0	htjuq2t	t3_s905sm	t3_s905sm	/r/offmychest/comments/s905sm/i_think_i_hate_my_parents/htjuq2t/
bc3o0s2p	Do you just keep creating new accounts to post the same thing?	1642736558.0	htjwpb2	t3_s9143y	t3_s9143y	/r/offmychest/comments/s9143y/when_attractive_people_have_high_standards_they/htjwpb2/
9qb52ubt	Congrats on the new role. I’ve always been somewhat reluctant on the promotions, but tried to have some faith in what management sees in me. Almost 20 years into an engineering career and my imposter syndrome hasn’t gone away. Every time I present to my client, I’m waiting for them to find out my whole career has been a fraud (even though the feedback is overwhelming positive feedback).    I’ve come to terms with always feeling over my head, I may as well take the next position and pay raise.    I’ve also found the right times to be open about about my insecurities and connect with my staff, who somehow look to me mentorship even though I feel like I’ve just fumbled through a career.	1642736967.0	htjxlfh	t3_s8ztf4	t3_s8ztf4	/r/offmychest/comments/s8ztf4/just_got_a_big_promotion_at_my_job_and_am_feeling/htjxlfh/
egpn5gsk	I am sorry you feel that way OP. I can't imagine the emotions that goes with that.   I don't know how to help. I am a 25 year old widow, who wanted to start a family and never got the opportunity to- I guess my point is, we don't always get a lot of say in the cards we are dealt.  You just keep breathing and try to act in a way that won't cause guilt later down the line.	1642738972.0	htk1upy	t3_s91ti9	t3_s91ti9	/r/offmychest/comments/s91ti9/i_fucking_hate_being_a_mother_and_i_feel_so/htk1upy/
egpn5gsk	You are only 5 weeks, you just found out, breathe for a minute and process!   Congratulations are in order but it'd okay to take a hot minute to decide how you feel and want to do things.   Grab a pack of oreos and chill for a bit. Take it all in haha   You don't need to figure it all out right now.	1642739226.0	htk2dsb	t3_s91y50	t3_s91y50	/r/offmychest/comments/s91y50/im_pregnant/htk2dsb/
egpn5gsk	You might need to take a few days lol   Just center yourself a bit, you don't have to do anything- you can figure it all out. You don't have to announce it to the world yet, take a minute to figure out your situation.   There is no pressure- you are going to do fine.	1642740079.0	htk44cw	t3_s91y50	t1_htk36tj	/r/offmychest/comments/s91y50/im_pregnant/htk44cw/
iuwe6hmq	Selfishness is a celebrated attribute. So primitive and repugnant. They should pay for it.	1642740850.0	htk5mxw	t3_s92055	t1_htk5fnr	/r/offmychest/comments/s92055/sick_of_dating_people_who_always_put_themselves/htk5mxw/
egpn5gsk	To be fair you can't help how you feel always.   Yeah it's crap some of us don't get it when we want it and others get it but aren't sure about it. Here's the thing we are all human and doing the best we can with what we've got.   Don't feel guilty. You did what you thought was right. That's all any of us can do.	1642743272.0	htka6t8	t3_s91ti9	t1_htk9s6t	/r/offmychest/comments/s91ti9/i_fucking_hate_being_a_mother_and_i_feel_so/htka6t8/
5jc84asr	I wouldn’t do it. This is messy.	1642743523.0	htkanat	t3_s939zd	t3_s939zd	/r/offmychest/comments/s939zd/i_like_my_coworker/htkanat/
5jc84asr	I think this is cliche but have you seen a therapist? You deserve to be happy just like everyone else. I’m really sorry for what happened but glad that you survived through it.	1642743653.0	htkavrw	t3_s9345x	t3_s9345x	/r/offmychest/comments/s9345x/i_thought_i_was_unaffected_by_years_of_sexual/htkavrw/
5jc84asr	There’s stuff you can take for that though. Some safe supplements like St. John’s wort or something.	1642743812.0	htkb67o	t3_s92vt4	t3_s92vt4	/r/offmychest/comments/s92vt4/ugh_my_libido_is_insane/htkb67o/
5jc84asr	I don’t think this is negative at all. It just shows that you have more grasp on emotional regulation and can control your feelings better. It’s just media that shows us we need to react instead of respond.	1642744474.0	htkcd1g	t3_s91sh3	t3_s91sh3	/r/offmychest/comments/s91sh3/i_have_no_spine/htkcd1g/
icx8preq	I’m not doing anything.	1642745625.0	htkebvw	t3_s939zd	t1_htkanat	/r/offmychest/comments/s939zd/i_like_my_coworker/htkebvw/
30o6s49g	Leave them on a table and walk away.  The truth is they don’t like you.   They don’t appreciate your effort. If you bought it for them.  Leave it on the table and leave it alone.  Don’t ask anyone about it.  Just don’t buy anything for others again at work.  People you work with are not your family.	1642747414.0	htkh6cf	t3_s8ndv8	t3_s8ndv8	/r/offmychest/comments/s8ndv8/i_bought_donuts_for_everybody_at_work_and_im_the/htkh6cf/
4ilyllfx	One? I’d totally eat 5 lol	1642747748.0	htkhovb	t3_s8ndv8	t1_hthd8ih	/r/offmychest/comments/s8ndv8/i_bought_donuts_for_everybody_at_work_and_im_the/htkhovb/
w7kjo	Sorry you’re going through this. I know how you feel. I was in a car accident a couple years ago. Airbag caused jaw fractures and dental trauma. I lost a tooth, a couple broken teeth, and a few that were knocked out of place. Had over $25,000 worth of hospital bills alone and a totaled car. Not to mention more bills to cover restorative and cosmetic dental work.	1642749677.0	htkki26	t3_s89793	t3_s89793	/r/offmychest/comments/s89793/please_dont_take_your_teeth_for_granted/htkki26/
7yf90nhd	Thank you for taking the time to write this, it gave me a breath of air. I talked to my therapist at the time about my situation with this friend and she told me “don’t take yourself so seriously, just have fun you’re young” and it really shocked me because she also had told me “white men love Asian women, you’re a hot commodity right now” so I stopped going to therapy after that.	1642750052.0	htkl129	t3_s94j4n	t1_htkidmd	/r/offmychest/comments/s94j4n/i_slept_with_a_friend_and_its_haunting_me/htkl129/
9favb	You’re not alone. Many people have shitty lives. It’s what you choose to do now that will determine the rest of your life. Put all your energy into school, get good grades. Don’t just learn to memorize, learn to think critically. Read constantly. Get into a vocational school right out of high school. You can go for free in some cases and even get financial aid for going. Become an LPN in 16 months and get out making $30 an hour. You can move out and never talk to them again.  Surround yourself with good hearted moral people and you will be happy. One day have your own family. Stay away from drugs and alcohol, workout to relieve stress. Slow and steady wins the race. This is what I wish I would’ve heard when I was your age. Good luck	1642753070.0	htkp6bx	t3_s95iuh	t3_s95iuh	/r/offmychest/comments/s95iuh/i_just_want_someone_to_know_my_life/htkp6bx/
7yf90nhd	I keep telling myself that this could’ve been a form of rape. But every time I think about confronting him I feel like he will somehow twist it on me. The thought of being manipulated and gaslit terrifies me.	1642753535.0	htkpsvq	t3_s94j4n	t1_htkp3z3	/r/offmychest/comments/s94j4n/i_slept_with_a_friend_and_its_haunting_me/htkpsvq/
akk3fo6y	Some women just want the pregnancy experience. Some women just want to have their own biological baby🤷‍♀️	1642755586.0	htkshjg	t3_s920b7	t1_htkkmdg	/r/offmychest/comments/s920b7/secondary_infertility_sucks/htkshjg/
h2anr6sv	i do see the good in people. if anything that’s all i ever do. although i don’t understand most things like the world, or even myself, i knwo that i am all of my problems. so i try to be a better version every day.	1642756024.0	htkt1tf	t3_s8hk95	t1_htjxvf6	/r/offmychest/comments/s8hk95/i_strongly_dislike_everyone/htkt1tf/
4ekglbdu	I used to, but I'm stronger now.  When my ex cheated on me, I cried so hard and felt so much anger and betrayal. He cheated on me when I was literally dying in the hospital.  When I lost our baby, I cried even harder. There was a lot of guilt and shame. I was alone. Funny how some men run when things get serious. I speak to my colleague about this, and it happened to her as well. She told me he disappeared as soon as she found she was pregnant.   When I felt like my first job post hospitalization was in jeopardy due to a performance review and I was going through chemo treatments (not for cancer, but blood transfusions to treat an autoimmune disease) those were some stressful times. I cried at night. I needed health insurance to cover those treatments..that were a 20k a pop, glad its over now. Ironically the "does not meet expectations" performance review was due to something that no one was trained on so her manager told her that. Even HR was questioning her actions.   Now it's like whatever. I didn't deserve the things that happened to me. The struggles I went through made me stronger. The actions of another person isn't a reflection on your worth. This is a great learning opportunity to screen people out since all the trauma is in such a compressed time frame.   With respect to that job, the girl who started after me quit, so there's 2 people left. The manager is new, and didn't want me to grow. I felt like she was intimidated by my credentials or me taking her job. Funny thing is, I never wanted her job, I just wanted to learn. I don't judge someone by how many degrees they have. The important thing is, are you a good person.. do you treat others with kindness? Can you complete tasks and take ownership and responsibilities? When I shifted departments I'm learning things that could have helped their office had they given me a chance, I'm working with people who are a much better fit, and my manager is super chill and thinks I'm doing an awesome job. When I want to learn more responsibilities, she sends someone to train me. I really appreciate that. And I know I can take these skills with me.	1642756858.0	htku4ck	t3_s96ivp	t3_s96ivp	/r/offmychest/comments/s96ivp/do_you_ever_cry_about_all_the_sad_things_that/htku4ck/
10pfjz	how tall is he?	1642757779.0	htkv9zw	t3_s8lyjh	t3_s8lyjh	/r/offmychest/comments/s8lyjh/my_husband_is_absurdly_perfect/htkv9zw/
3tufur4m	Krispy Kremes too valuable to touch	1642757805.0	htkvb8d	t3_s8ndv8	t3_s8ndv8	/r/offmychest/comments/s8ndv8/i_bought_donuts_for_everybody_at_work_and_im_the/htkvb8d/
i52ncczu	no…	1642757906.0	htkvfph	t3_s96dxt	t1_htksssp	/r/offmychest/comments/s96dxt/im_tired/htkvfph/
