author	body	created_at	c_id	s_id	p_id	permalink
iv6kcmpr	You dodged a MAJOR bullet. Similar thing happened to me but im female. Together for years no commitment no marriage nothing. We break up and he gets married months later after bring so anti marriage. Anyways I think back on how crappy he was and how crappy his family was and I'm grateful. Guys family had him by the balls in every way and were upset that I was trying yo make him an adult that doesn't run to mommy and daddy with everything. Fast forward he marries some woman that can't cut the apron straps either so you have 2 adults clinging to their parents like 2 year olds. Count your blessings man 💯💯💯	1643221421.0	hubriil	t3_schi4u	t3_schi4u	/r/offmychest/comments/schi4u/exwife_pregnant_with_new_boyfriends_baby_after/hubriil/
hfndysf3	Lmao same	1643221469.0	hubrncv	t3_sdcj4i	t1_hubrhi0	/r/offmychest/comments/sdcj4i/harry_potter_is_not_real/hubrncv/
8x8u5xpc	Just beat her? Senseless?	1643221557.0	hubrw0f	t3_sd6hww	t3_sd6hww	/r/offmychest/comments/sd6hww/my_younger_sister_wont_stop_harming_me/hubrw0f/
gjuqs4ve	Did you read my full post or just the title?	1643222305.0	hubtzcc	t3_sdcq4k	t1_hubs97e	/r/offmychest/comments/sdcq4k/my_biggest_childhood_bully_is_going_through_some/hubtzcc/
ip1yy5lg	I got tired of typing this but anyways if anyone has recommendations for shower products, general hygiene products, any other advice, ur welcome to comment. I think I hate living this way enough now to go get a job.	1643222907.0	hubvntx	t3_sdd5j7	t3_sdd5j7	/r/offmychest/comments/sdd5j7/i_dont_know_how_to_take_care_of_myself_and_i_feel/hubvntx/
4xzcvyns	my mom hasn't told him anything at all and I feel like that's not information you should be learning about from your kids. pretty sure he thinks she just got her own apartment and randomly decided to leave us	1643223477.0	hubx9yp	t3_sd43bl	t1_huafxla	/r/offmychest/comments/sd43bl/my_mother_left_us_for_a_man/hubx9yp/
5q129oxf	Should we also ban smokers and obese people from using our health facilities?	1643224395.0	hubzuny	t3_sddni0	t3_sddni0	/r/offmychest/comments/sddni0/people_who_refuse_to_get_vaccinated_shouldnt_be/hubzuny/
14vn14zv	Respect the rights of the people.. this is the shit the powers to be have you doing. Violating or attacking other rights so they can take yours while you are distracted.	1643225530.0	huc31ee	t3_sddni0	t3_sddni0	/r/offmychest/comments/sddni0/people_who_refuse_to_get_vaccinated_shouldnt_be/huc31ee/
b26kxspw	I actually have tried psychedelics- they actually do tend to lift me up a bit but they're hard to come by in my area and I never really have the money for it anyway. as for the vitamins getting checked- literally never thought about that one but it does make sense. friends have also brought up that my depression may just be treatment resistant and I need to find better options, but it is hard and I'm quite tired and I have trouble like, going to a psych with an issue when it feels like it hasn't helped before. I'm not gonna give up but I'm also not gonna deny the fact that it's so hard to make myself do it yaknow ?	1643226743.0	huc6fs8	t3_sdd93u	t1_hubwx6n	/r/offmychest/comments/sdd93u/medications_and_therapy_not_helping_at_all_with/huc6fs8/
2v3h7tby	Make his life hell once he gets old/sick. Also learn self-defense so you may give him a well-deserved beating one day.  I just wanna tell you that it gets better, his actions do not define you and what you stand for. Once you get older it will get better 100%, you jus	1643227518.0	huc8mnr	t3_sd5tkw	t3_sd5tkw	/r/offmychest/comments/sd5tkw/i_was_just_a_kid/huc8mnr/
8cg53	Once I was walking to my local hospital to admit myself to the ER psych ward because I was too close to doing it myself. I had all the tools ready that I needed but I went to ask for help in the last minute.  On my way to the hospital, I saw someone jump from a 10th or 11th story balcony. Because it was literally across the street from the hospital, an ambulance got there within the 2 minutes I stopped. I was in shock. I saw someone kill themselves before my eyes, just minutes before I decided to ask for help for help. That also could have been me. Then came a lady with kids and a stroller and said something like "Can you believe people choose to do this in front of a childrens play area?" I told her that it was a suicide, and her face gave a disgusted look. "So he CHOSE to do this HERE?" I wanted to strangle her.  I ended up in the psych ward for a week or so before they kicked me out (because there is a constant lack of beds).	1643227979.0	huc9xml	t3_sd15gx	t3_sd15gx	/r/offmychest/comments/sd15gx/ignoring_a_suicide/huc9xml/
iwpj6w5k	Thank you!	1643228075.0	huca7gs	t3_sdb2ni	t1_hubifxz	/r/offmychest/comments/sdb2ni/one_year_ago_his_mom_passed_away/huca7gs/
iwpj6w5k	Thank you for your kind words. I was putting my life on hold waiting for him to come back home. I’m not doing that anymore, I’m focussing on me and my personal goals right now.    There is still hope in my heart and I won’t close the door in his face when he wants to talk. But I’m focussing on becoming the best version of myself and working on my mental and physical health. Putting myself first. I know only he can heal himself. I need to do that for myself.	1643228394.0	hucb3lf	t3_sdb2ni	t1_hubz06c	/r/offmychest/comments/sdb2ni/one_year_ago_his_mom_passed_away/hucb3lf/
5e0p31nk	MN Nat guard? Lol	1643229746.0	hucey5k	t3_s9wk6d	t1_htsrf6j	/r/offmychest/comments/s9wk6d/i_fell_in_love_with_a_girl_on_deployment/hucey5k/
j0s5xcym	She left during the weekend.	1643230211.0	hucga1c	t3_scpti0	t1_hubzeh2	/r/offmychest/comments/scpti0/i_am_so_scared_that_the_cops_are_possibly/hucga1c/
a5iwhj7i	😳😳😂	1643231618.0	huck7vj	t3_s4ylms	t3_s4ylms	/r/offmychest/comments/s4ylms/had_sex_with_a_homeless_woman27f_i_28m_met_on_the/huck7vj/
j0gcrd6y	when women actively go out on shooting sprees, maybe i'll consider it misandry, but for the moment no, it isn't.	1643232038.0	huclelq	t3_sdggrr	t1_huckejh	/r/offmychest/comments/sdggrr/women_cant_be_homophobic_to_say_otherwise_is/huclelq/
j1qt7eur	Why? She’s my girlfriend. I’m already attached to her.	1643232039.0	huclerz	t3_sdgk7b	t1_huckvnh	/r/offmychest/comments/sdgk7b/my_gf_f22_has_had_many_sex_partners/huclerz/
j1qt7eur	Yea I’m going to take it with a grain of salt because at the end of the day you don’t know her but I do  and I know in my heart to hearts she has feelings for me :)   Also I never posted for advice. I posted to get this off my chest. That’s what this sub is for. Take a look at the description.	1643232510.0	hucmput	t3_sdgk7b	t1_hucmclp	/r/offmychest/comments/sdgk7b/my_gf_f22_has_had_many_sex_partners/hucmput/
bwubva3v	What would totally work. Before you two do the deed. Turn the lights off. Then have a look-a-like porn star sneak in and tear it up. I would bring my percentage down to 40percent.	1643232636.0	hucn2g0	t3_sdgk7b	t3_sdgk7b	/r/offmychest/comments/sdgk7b/my_gf_f22_has_had_many_sex_partners/hucn2g0/
j1qt7eur	Wow sounds like I have lots of haters in the comment section.	1643232693.0	hucn819	t3_sdgk7b	t1_hucn2g0	/r/offmychest/comments/sdgk7b/my_gf_f22_has_had_many_sex_partners/hucn819/
gjuqs4ve	You’ve probably right in that. I would love to be healed from it. I think this has really made me realise a lot though, like how bad her childhood must have been. I wouldn’t say I had the best childhood, but it was obviously part of what made her who she was..	1643233407.0	hucp72x	t3_sdcq4k	t1_huc8rnx	/r/offmychest/comments/sdcq4k/my_biggest_childhood_bully_is_going_through_some/hucp72x/
4xzcvyns	I truly feel like it's not my place or my responsibility. it's not my fault that they are adults who can't communicate or handle their issues in an appropriate way	1643234395.0	hucryum	t3_sd43bl	t1_hucnb7r	/r/offmychest/comments/sd43bl/my_mother_left_us_for_a_man/hucryum/
eixme8yf	I had a situation like this. A guy I dated treated me terribly. I had too much of a conscience to seek revenge or be nasty back. He met a woman that was wicked and literally burned through all of the money he worked hard to save then she left him. Honestly I didn’t feel satisfaction though, I felt bad for the dude.	1643235742.0	hucvjx3	t3_sdcq4k	t3_sdcq4k	/r/offmychest/comments/sdcq4k/my_biggest_childhood_bully_is_going_through_some/hucvjx3/
gjuqs4ve	Yeah that’s very true.   I guess what I can’t get my head around is, myself, and others I know, may have had drug addicts bring us up too, we may have been been in home that was abusive, dysfunctional, toxic, and neglected, witnesses cheating, abuse and lies growing up, maybe even a parent in prison.. yet we didn’t end up hurting other people like this. We are ALL struggling in this life.. in different ways. I guess we were only teenagers, but to not have the capacity to realise that what you are doing is severely hurtful, humiliating, scary, stressful etc for the people you are bullying, is beyond my comprehension. Not being able to see the pain you are inflicting on other people and the way you are power tripping over it and wallowing in the popularity, multiple times over years, despite them begging you to stop, is unforgivable despite home issues.	1643236189.0	hucwpya	t3_sdcq4k	t1_hucu0y0	/r/offmychest/comments/sdcq4k/my_biggest_childhood_bully_is_going_through_some/hucwpya/
dwwijqxr	Honestly, this is seriously so weird. I've never disclosed my pay to coworkers, or my direct report. I don't believe in being friends with coworkers or working with friends; I do believe in being civil and kind, though.  IMO, your boss obviously holds you at a higher value than your coworker if they were coming to you about this. I wouldn't have split it.	1643236271.0	hucwxpq	t3_sdb0r7	t3_sdb0r7	/r/offmychest/comments/sdb0r7/raise_my_boss_made_me_decide_if_i_wanted_to_take/hucwxpq/
620yff0r	Sounds like some bullshit tactic to avoid having to give both a decent pay rise, this way it was your decision to have less a pay rise and the other employee feels lucky to receive something at all.	1643237780.0	hud0ujl	t3_sdb0r7	t3_sdb0r7	/r/offmychest/comments/sdb0r7/raise_my_boss_made_me_decide_if_i_wanted_to_take/hud0ujl/
c4udo842	I don’t like that he is OK with spreading misinformation and giving his listeners false information that relates to the health. Misinformation literally kills people.Misinformation isn’t protected free speech.	1643239438.0	hud51ys	t3_sdj0r7	t3_sdj0r7	/r/offmychest/comments/sdj0r7/i_fucking_hate_joe_rogan/hud51ys/
im20s3uy	Your daughter is an adult and one who grew up with social media.  If you don’t want to see these photos, unfollow her or unfriend her.	1643240703.0	hud8616	t3_sdjyie	t3_sdjyie	/r/offmychest/comments/sdjyie/daughter_27_facebook/hud8616/
872z1d4b	I don't want to be the devils advocate, because I can completely understand where you are coming from. Your past hurt, your past experiences is making this difficult for you.   But.. I actually feel sort of bad for your boyfriend. He was upfront and honest from the start, he told you that this friendship was important and he wanted to maintain it. He respected every single boundary you placed besides the one time (so it seems).   You decided to enter into the relationship knowing he had an ex as a friend, and you throughout the relationship made the decision that you weren't comfortable with it.   I guess I'm just confused because it doesn't seem like he was flirty with her or being inappropriate in anyway with his ex, but your past experience wasn't allowing you to feel secure so you made him sacrifice a friendship.   Did you go to therapy? Did you try and also create a friendship with this woman?   While your young now, you may enter into a relationship later in life that involves children, sometimes ex's are going to be apart of the picture. I would really suggest working on your trauma and heal yourself.	1643241048.0	hud90fs	t3_sdjqmd	t3_sdjqmd	/r/offmychest/comments/sdjqmd/my_bf_went_no_contact_with_his_ex_but_i_still/hud90fs/
32jku6t7	This why we don’t go over for Christmas.	1643241449.0	hud9zd7	t3_sddqic	t3_sddqic	/r/offmychest/comments/sddqic/stop_bringing_your_kids_to_obviously_adult/hud9zd7/
a4c2vnck	Long-hauler, caught covid 22 months ago and it destroyed my health.	1643241557.0	huda8st	t3_sdk4k3	t1_hud9xhh	/r/offmychest/comments/sdk4k3/im_so_pissed_off/huda8st/
a4c2vnck	And the news lie, indeed, they're way too optimistic and "don't worry everything's fine, let's bury our head in the sand-ish"	1643241632.0	hudafev	t3_sdk4k3	t1_hud9xhh	/r/offmychest/comments/sdk4k3/im_so_pissed_off/hudafev/
ixgykzm4	>I have to respectfully disagree. OP made it their goal to lose weight and they are achieving it. When people see a person sticking to their goal, it is hard not to feel happy for that person. In my opinion, people shouldn’t overthink compliments unless they are overtly confusing.  It sounds like they're not saying, "Wow, OP, you've been talking about how hard it's been to keep up the motivation for your new weight-loss routine, congrats on your commitment!" They're saying, "Wow, you're skinnier now, yay!" Her BF isn't complimenting her work ethic when she goes off for an early morning jog, he's comparing her to her past appearance \*while they're being intimate\*. I think lots people would be a bit upset if their partner dropped, "Wow, you're so much sexier in this makeup than in the makeup you usually wear," while things were getting hot and heavy.   Also, aside form OP's BF, do any of these people actually KNOW she's been working to lose weight? Or are they just seeing that she's thinner and delivering affirmation that things are better now that she's thinner? Because that's not appropriate, and a rain of that could effect how she experiences these comments overall. Sort of like how salt water on your skin doesn't hut, and neither do appropriate comments on your appearance. But if you've spent the day picking up abrasions and cuts from dealing with INAPPROPRIATE comments, salt water will sting.	1643242054.0	hudbg85	t3_scv9i4	t1_hubzq8j	/r/offmychest/comments/scv9i4/im_losing_weight_but_the_compliments_are_making/hudbg85/
icp003fd	People dont want you to succeed and that’s why you must 💪🏻	1643242645.0	hudcv7f	t3_sdk557	t3_sdk557	/r/offmychest/comments/sdk557/people_dont_want_me_to_succeed_sometimes/hudcv7f/
6egwmsdf	C+ cups	1643242837.0	huddbpf	t3_sddqic	t1_hucqoh2	/r/offmychest/comments/sddqic/stop_bringing_your_kids_to_obviously_adult/huddbpf/
414ofkb7	Does the kids really bother you? Like fuck the Karen. Who cares if you’re acting like frat boys. Real frat boys  would tell Karen to “suck some balls” while tossing her kid in the pit of titties	1643243526.0	hudez9w	t3_sddqic	t3_sddqic	/r/offmychest/comments/sddqic/stop_bringing_your_kids_to_obviously_adult/hudez9w/
9puyjohx	Well you’re doing the right thing! That should be worth it. There is no such thing as “happy outgoing person helps the depressed on up and out of their depression”. But there’s plenty of “depressed person smothers the light of the outgoing positive one”. Get your own mental health and physical health in order as much as possible and then be in a relationship. It’s childish to think that it’s not possible to ruin someone else’s life. Even if they did choose you and your problems, that doesn’t mean years down the road they won’t give up/give in and become a lot like you. Speaking from as the person who was too selfish to let go of a shining light that is now dull and depressed like me. You’re doing the right thing and it’s hard and confusing. But I’d like to think you’ll end up stronger.	1643244267.0	hudgqp2	t3_sdl1my	t3_sdl1my	/r/offmychest/comments/sdl1my/typical_just_got_out_of_long_term_relationship/hudgqp2/
fl1uazfl	  I feel I might be a little biased on this because I do suffer from a little list of mental health issues but these werent detected before i moved out in an age of 19.  I was very picky as a child and first in my age of 25 learned to put things on bread. I have faint memories of food anxiety related to the way my father would treat me around foods i didnt like and even though my mom did her best to cook for me to make me eat, I still suffer with sometimes extreme food anxiety today.   I’m just saying you might not know why your child is fuzzy around food and you might do more damage than good if theyre sensitive like myself  (I know this sounds horrificly stupid but you dont know how embarrassing it is to be grown and not be able to find things on a menu in a restaurant with your friends/parents in law/etc.)  Pls its ok to laugh, I cant do anything myself either.	1643244344.0	hudgx6h	t3_sdg6ld	t3_sdg6ld	/r/offmychest/comments/sdg6ld/whats_for_dinner_is_what_we_are_eating_insane_how/hudgx6h/
32nrr24h	No we are middle class. Also like how would a stranger know about my wealth. I literally dress thrift.	1643311281.0	huh8mjh	t3_se67x4	t1_huh8cgq	/r/offmychest/comments/se67x4/im_ugly_why_does_everyone_i_meet_find_me_so/huh8mjh/
32nrr24h	No I actually love myself I take care of my health my body, mind everything. I wouldn’t say I love the way I look but I’m okay with it. I’m not going to be saying I’m good looking if I’m not. I’m not going around telling everyone about how much I loathe myself either, because I don’t. But I have no issue admitting I’m not that good looking.	1643311605.0	huh9ih1	t3_se67x4	t1_huh92bf	/r/offmychest/comments/se67x4/im_ugly_why_does_everyone_i_meet_find_me_so/huh9ih1/
6xe6wv4n	I can't answer your question because I don't know what you look like, and even if I did, this is a very subjective topic. One thing that I've learned though, you will likely never see yourself the way other people do. You've been staring at your mug since day 1. Watched it morph over time. Everything. It is imprinted in your mind in a way that no one else will ever have. So, that being said, one thing you eventually need to do is learn to be okay with other people perceiving you differently. If they like it, so what. It just is the way it is. I have a similar complex and eventually just accepted that some people are going to like the way I look more than I do. Think of it as giving. It's nice to look at someone who you think is attractive. If they like it, and they aren't improper obv, then you're just another nice feature of nature in the world. Looks are such a contentious issue. People that are clearly attractive can think they aren't, and some folks that maybe aren't natural born models can think they are descended from heaven. It's a weird thing. Okay, maybe spun around in a tangent, but again, learning to let go and accept that other people perceive you differently and that's okay will go a long way	1643312062.0	huhaqxj	t3_se67x4	t3_se67x4	/r/offmychest/comments/se67x4/im_ugly_why_does_everyone_i_meet_find_me_so/huhaqxj/
72g0uojh	Attraction is mostly objective	1643312957.0	huhd6xc	t3_se67x4	t1_huh931y	/r/offmychest/comments/se67x4/im_ugly_why_does_everyone_i_meet_find_me_so/huhd6xc/
5wsrjr2i	I didn't know that, thanks for telling me. Covid sucks	1643313750.0	huhfd9h	t3_se703l	t1_huhepla	/r/offmychest/comments/se703l/my_boss_is_letting_people_work_with_covid/huhfd9h/
3si4rw4y	advice is welcome on this post btw	1643314229.0	huhgnrk	t3_se78t2	t3_se78t2	/r/offmychest/comments/se78t2/my_friend_had_sex_on_the_couch_next_to_me_while_i/huhgnrk/
8u8mwvzr	Tell me your gender without telling me your gender	1643315535.0	huhk75w	t3_se6grs	t1_huhcgdh	/r/offmychest/comments/se6grs/it_feels_weird_i_have_to_drop_so_much_money_on_an/huhk75w/
a0mfc4vn	I was just like this in college. It was incredibly stressful. I was doing drugs and coping with terrible habits. I did try therapy and antidepressants too and it almost broke my brain. It didn’t work, then I developed crazy panic attacks. I really thought I had gone insane some days. I told myself over and over what you’re telling yourself but I vowed to finish what I started. I slept all day. I failed classes. It’s a snow ball effect that just gets worse. You have to stop the cycle and just go. And I graduated late too. But guess what, it doesn’t really matter! Plenty of people take longer. If it’s too severe maybe dropping out and focusing on your health is better in some cases but in my case my only goal was to graduate no matter what. When I look back I realized I was holding myself back so much worrying about trivial things. Focus on what you do enjoy about school. Focus on what you can control right now. And keep trying to seek therapy as well. I’m sure your school might offer some services? And Marine biology sounds like a bad ass career. Really dive in (hardy har) to your studies and try to connect with your professors and classmates. I think you’ll realize that lots of people are going through similar things. I wish I could help you more here so sorry. My life isn’t perfect either but it did get a lot better. Do not give up on yourself.	1643316065.0	huhlmr0	t3_se7nq3	t3_se7nq3	/r/offmychest/comments/se7nq3/im_pretty_sure_im_beyond_help/huhlmr0/
j1zyoikz	You must be pretty cool person....his loss	1643318896.0	huhtan6	t3_se19fx	t3_se19fx	/r/offmychest/comments/se19fx/clearly_not_love_in_the_air/huhtan6/
5d59ff4	I’m a High school teacher. This is textbook grooming and the kind of stuff that fucks up young women for life. What you were doing with that 13-year-old girl is disgusting and criminal. You have no idea how many of my students have been a messed up psychologically by stuff like this. That’s not chemistry that is you taking advantage of a child, And worse a child in your own family. If anything ever happens or if she finds out that a person that she trusts sees her in that way it will fuck her up forever. Is that the person you want to be? Because that’s who you are. Someday you will get caught and end up on the sex offender list where you belong.	1643319185.0	huhu2vp	t3_se94w4	t3_se94w4	/r/offmychest/comments/se94w4/pedophile/huhu2vp/
8u8mwvzr	Dont even know what that means. A caring man that puts  his love before himself is a bad person if he doesnt like the completely fabricated tradition of buying overpriced carbon that a women bases her value off of	1643319434.0	huhur15	t3_se6grs	t1_huhkknm	/r/offmychest/comments/se6grs/it_feels_weird_i_have_to_drop_so_much_money_on_an/huhur15/
9d8jo19o	Listen.   I’m funny.	1643319912.0	huhw0ub	t3_se19fx	t1_huhtan6	/r/offmychest/comments/se19fx/clearly_not_love_in_the_air/huhw0ub/
j1zyoikz	I believe that  If that guy can't laugh at a little embarrassing moment and he wants to get all emotional about a fart let him.....I'm pretty sure you'll attract some better people with a good sense of humor  I am curious tho.....did he say excuse me?	1643320132.0	huhwm7h	t3_se19fx	t1_huhw0ub	/r/offmychest/comments/se19fx/clearly_not_love_in_the_air/huhwm7h/
9d8jo19o	Absolutely not. He just looked mortified, which is why I went into reassurance mode.	1643320691.0	huhy3dt	t3_se19fx	t1_huhwm7h	/r/offmychest/comments/se19fx/clearly_not_love_in_the_air/huhy3dt/
j1zyoikz	And I'm pretty sure you didn't finish either.....what a guy!   A girl queefed in my face once it was hilarious we both just laughed are asses off	1643321236.0	huhzjs8	t3_se19fx	t1_huhy3dt	/r/offmychest/comments/se19fx/clearly_not_love_in_the_air/huhzjs8/
97ko38nq	I get ya.	1643321462.0	hui058r	t3_scyl4w	t3_scyl4w	/r/offmychest/comments/scyl4w/want_to_share_my_wife/hui058r/
djev4brc	Can’t relate, I loooooove kissing my husband. 20 plus years and still smooching strong.      ‘’however, I will say this is probably a hormone thing. It happens after birth. Your brains way to not reproduce again, so the experts say.  Go to the doctor have them check your levels. The. Find yourself a good PPD therapist. This is super normal. Your not weird, or wrong, but if you want to stay married happily, get yourself some help. PPD can last years.	1643321792.0	hui101e	t3_sdxf7y	t3_sdxf7y	/r/offmychest/comments/sdxf7y/i_hate_the_way_kids_can_casually_say/hui101e/
gnsk5khk	I would've done the same thing if I was her you were leading her on lol	1643321794.0	hui109n	t3_se6y2b	t3_se6y2b	/r/offmychest/comments/se6y2b/is_this_rape/hui109n/
b2l57lk2	Slay queen	1643322393.0	hui2kos	t3_se6xsn	t3_se6xsn	/r/offmychest/comments/se6xsn/my_husband_added_a_new_person_to_our_relationship/hui2kos/
8u8mwvzr	You really need to do some self evaluation and reflection if you can make that judgement over one little rant about double standards	1643322411.0	hui2mh4	t3_se6grs	t1_huhvuky	/r/offmychest/comments/se6grs/it_feels_weird_i_have_to_drop_so_much_money_on_an/hui2mh4/
42lf2f8b	6 years and he acts like that ? Also I click your page and was confused on your age , you’re not 17 right ?	1643322688.0	hui3cb7	t3_se6xsn	t3_se6xsn	/r/offmychest/comments/se6xsn/my_husband_added_a_new_person_to_our_relationship/hui3cb7/
45z8pamc	Deeply confusing story, but sounds hot, ngl	1643322798.0	hui3mef	t3_se6xsn	t3_se6xsn	/r/offmychest/comments/se6xsn/my_husband_added_a_new_person_to_our_relationship/hui3mef/
3c4t2s89	D I V O R C E	1643323299.0	hui4wwi	t3_se6xsn	t3_se6xsn	/r/offmychest/comments/se6xsn/my_husband_added_a_new_person_to_our_relationship/hui4wwi/
3c4t2s89	The fuck?	1643323403.0	hui56gy	t3_se6xsn	t1_hui23y8	/r/offmychest/comments/se6xsn/my_husband_added_a_new_person_to_our_relationship/hui56gy/
2j030ngi	Are you the idiot husband?	1643323599.0	hui5ofu	t3_se6xsn	t1_hui23y8	/r/offmychest/comments/se6xsn/my_husband_added_a_new_person_to_our_relationship/hui5ofu/
