author	body	created_at	c_id	s_id	p_id	permalink
eixme8yf	It’s depends what city op lives in though. It’s rough in places like New York and Cali even before/after the pandemic. People still live with family or have roommates until they meet a partner to split bills w.	1642859345.0	htqqe4l	t3_s9plfn	t1_htp4az1	/r/offmychest/comments/s9plfn/i_just_want_to_have_my_own_place_god_damnit/htqqe4l/
eixme8yf	And women having to put in the same amount of effort or work harder.	1642859445.0	htqql1l	t3_s9zwcs	t1_htqqecg	/r/offmychest/comments/s9zwcs/i_fucking_hate_being_a_man/htqql1l/
eixme8yf	Bud, That’s not how ranks work.	1642859796.0	htqr9ud	t3_s9zwcs	t1_htqqrn9	/r/offmychest/comments/s9zwcs/i_fucking_hate_being_a_man/htqr9ud/
eixme8yf	You are selfless and compassionate. Don’t change, the world needs more people like you. Some people harden overtime, don’t be them.	1642860142.0	htqrxrb	t3_s9krkg	t3_s9krkg	/r/offmychest/comments/s9krkg/i_love_to_make_people_feel_wanted_and_included_in/htqrxrb/
eixme8yf	I empathize w you. If I were you I’d focus on getting a good job, hiring a lawyer and make sure your life is immaculate so you can gain full custody. I’m in a similar situation so I’m not judging but know what your priorities are. Right now it should be building a solid foundation and being able to prove you’re stable in all aspects.	1642860609.0	htqsukk	t3_s9wbyk	t1_htqr6g0	/r/offmychest/comments/s9wbyk/all_the_young_fellas_with_no_kids_be_careful_who/htqsukk/
bhzr7iwq	Ptn mais osef	1643143587.0	hu7a5w1	t3_sca1w0	t3_sca1w0	/r/offmychest/comments/sca1w0/i_had_the_funniest_fart_ever_and_i_have_no_one_to/hu7a5w1/
fx7hfbx7	My fiancee cheated on me on her birthday, with my 5 diamond star ring on her finger and me sleeping in the next room. I lost it after I found her voice message to her friend telling everything that happened in that day. Her friends knew everything, some of them were in the same room with both while this was happening. 3 stages occured in Total 1-Shock 2-Blaming, Depression and Obsessions 3-Healing You must keep yourself busy with friends. Have self respect to not contact and believe me if you don't she will life always flows from full to empty let her get full with thoughts.  2nd stage try to take the right steps. Start hitting gym, read, travel if you cannot live in the moment take lustral. 3rd stage is where you realise there are other women and you're precious in others' eyes too not just hers.  Remember. No one can hurt you unless you give them the permission to do so. Stay safe. *Whispers* (and tinder is still there)	1643145053.0	hu7e365	t3_r5trvl	t3_r5trvl	/r/offmychest/comments/r5trvl/my_girlfriend_cheated_on_me_and_im_broken/hu7e365/
3cj51avm	Sounds like someone your shouldn't be with if you want kids...	1643145183.0	hu7efoa	t3_sc2ypf	t3_sc2ypf	/r/offmychest/comments/sc2ypf/i_just_got_in_an_argument_with_my_gf_because_she/hu7efoa/
3bhk70he	Your title is a little sexist and unfair. Imagine if I said all females… it’s just not true, and I hope you find a guy who changes your mind. We’re not all bad :)	1643145755.0	hu7fym9	t3_sco3j7	t3_sco3j7	/r/offmychest/comments/sco3j7/screw_all_you_males/hu7fym9/
aunpavht	Preferences don’t mean you’re a jerk…  For talks sake (and I’m all for trans rights, be who tf you wanna be)  But let’s say you fell in love with someone. Then they tell you (after you have been intimate) they are trans… for a lot of people that breaks trust, is hurtful…  The same thing is happening here just with sexuality not gender.  OP isn’t a jerk, however you are right… if she can’t accept it she has to move on, that goes for anyone.	1643145981.0	hu7gk8s	t3_sco31m	t1_hu7f7fh	/r/offmychest/comments/sco31m/what_the_bi/hu7gk8s/
j0phzj9d	That'd be the least of my worries, honestly.  I put distance and moved to the other side of the country, but I had to come back a month ago and it's already eating me up. I just want to puke and go pretty much no contact, but I don't know why.	1643146804.0	hu7iqgo	t3_scohro	t1_hu7hwff	/r/offmychest/comments/scohro/i_feel_like_im_my_mothers_partner_rather_than_her/hu7iqgo/
8dhx5siz	I kept my last name for several reasons, mostly for a pride thing (my ((step)) dad adopted me, where my birth father was abusive) and partly because I'm too fucking lazy to pay to change it. I get the "Mrs _his name_" all the time, even from his side of the family. We went in knowing it was going to be a weird situation for everyone involved.   Tradition is just peer pressure from dead people. Some people cave to it more easier than others. lol	1643146938.0	hu7j3f3	t3_scohk9	t3_scohk9	/r/offmychest/comments/scohk9/my_name_is_my_identity/hu7j3f3/
7b5z8zsu	The truth is ... You haven't, if you have .. this post wouldn't exist..    either you have felt nothing or might be a bit happy about you ex partner for her happiness.	1643146992.0	hu7j8i5	t3_schi4u	t1_hu6ykfl	/r/offmychest/comments/schi4u/exwife_pregnant_with_new_boyfriends_baby_after/hu7j8i5/
isb41hh2	He for sure is, but was I grooming the girl when I dated a 15/16 year old at 18/19. It's something I have always worried about when I did that.	1643149280.0	hu7ox0q	t3_scoob9	t1_hu7mhul	/r/offmychest/comments/scoob9/idk_what_to_say/hu7ox0q/
1mcjz2zi	I havent say anything I think about others, since my advice is to OP. You dont have enough information to conclude that this is what I believe others (like racists or sexists) should do.  If I said anything wrong, say where.	1643149658.0	hu7pu7g	t3_sccwjr	t1_hu74uuo	/r/offmychest/comments/sccwjr/i_fucking_hate_being_black/hu7pu7g/
8wbsa0gg	Do society a favor and go off yourself	1643150198.0	hu7r7dn	t3_rtev22	t1_hqxrac6	/r/offmychest/comments/rtev22/my_roommate_and_her_active_duty_visiting_husband/hu7r7dn/
8fhkvs9a	I  my experience as a 5ft2 guy. The more you feel sorry for yourself even though logically you have a right to, the worse it will be. People will go up and down to tell you that your problems are not real. Other short guys will tell you their bad experiences and will continue to wallow in it. Here is the only thing that helps. Use what you have for as long as you can. Or die. But no inbetween and dont indulge in your thoughts	1643150885.0	hu7sy6q	t3_scq0e0	t3_scq0e0	/r/offmychest/comments/scq0e0/i_hate_being_a_short_man/hu7sy6q/
eaet1d14	Hey lovely internet stranger, I can’t offer much and being a pasty white girl from New Zealand is as far removed from your experience as it possibly can be, but  I want to send you some love and tell you I can hear you, you’re not just  shouting into the void hoping to be understood, I hear you and have lots of love for you. You are amazing and so important and I feel in my heart you will bring more to the world than any person who has ever looked down on you or judged you for existing in the skin you’re in.  You are loved.  Love an internet stranger xxoo	1643151612.0	hu7utk5	t3_sccwjr	t3_sccwjr	/r/offmychest/comments/sccwjr/i_fucking_hate_being_black/hu7utk5/
j0s8poi7	I try too man… it just feels it gets worse the older you get, I thought it would get easier :( .  Hope you are doing well too my friend 👌	1643151636.0	hu7uvpc	t3_scq0e0	t1_hu7ucbt	/r/offmychest/comments/scq0e0/i_hate_being_a_short_man/hu7uvpc/
hyc2domi	It rather mitigates the urge altogether to just have them on, but a problem I'm having now is the urge to pull on the shields and loosen the tape around them. Sometimes I feel like just ripping them off. I tend to pull on them.   I'm gonna have to look that up. Thank you!	1643152002.0	hu7vsyr	t3_scpkt4	t1_hu7r2yh	/r/offmychest/comments/scpkt4/i_was_at_risk_of_going_blind_due_to_my_tourette/hu7vsyr/
j0s5xcym	Thank you for making me feel a little better but I feel so bad about it, I don't think I have the courage to do it again.	1643152084.0	hu7w0e9	t3_scpti0	t1_hu7ts7l	/r/offmychest/comments/scpti0/i_am_so_scared_that_the_cops_are_possibly/hu7w0e9/
fcowu1yw	No. That’s quite an assumption.	1643152449.0	hu7wwzu	t3_scm49b	t1_hu7kawo	/r/offmychest/comments/scm49b/where_do_people_find_the_energy_to_eat_shower_and/hu7wwzu/
9xk3dmur	I am so sorry that you are struggling with being black. I'm white and so I know that I can't relate in the same way to the things you go through and feel, but may I share a few thoughts?   I think that being black is beautiful, personally. I lived in Queens/Brooklyn for quite awhile and in predominantly black neighborhoods and I absolutely loved it. When I was a child, I so desperately wanted "black hair" and all the beautifully amazing things that can be done with it. I am pale. Like translucent pale - I used to despise it. I always wanted my skin to have a nicer tone to it and I think that melanated skin is very pretty. But ... These are surface things at the end of the day.   What I loved most about living in Bed-Stuy (and similar neighborhoods) was the culture and community. I loved the neighborhood spirit - chilling on the stoop with family/friends, having cookouts, and that sense of "when you are here, you are family." I know there are stereotypes about black women, but I loved the boldness and spirit I saw. I am, by nature, somewhat shy/timid. But I looked up to the strong black women around me and wanted even a fraction of that strength. There is a joy and "life" (for lack of a better word) that I found in predominantly black communities that I have never seen when living in more white neighborhoods. I have some of the best memories from my time living there. I live in a very white neighborhood currently and I don't know a single neighbor. They keep to themselves and it feels like hostile undercurrent running through - and there is something missing (particularly having known something different).   I know that there is far more nuance to these things and I find myself struggling to express myself today, but ... I'm sad that you hate something that I see as so beautiful and powerful.	1643152544.0	hu7x5p6	t3_sccwjr	t3_sccwjr	/r/offmychest/comments/sccwjr/i_fucking_hate_being_black/hu7x5p6/
8fhkvs9a	You married the absolute love of your life. You have food and water and im sure your mental facilities are working. You quite literally filled up every need on Maslows heirarchy of needs accept for self actualization.  I make six figures but i would murder my own brother and chop off my nuts while giving up all my money and career to be in your place.	1643152863.0	hu7xyr5	t3_scq7nn	t3_scq7nn	/r/offmychest/comments/scq7nn/i_feel_like_ive_wasted_my_20s/hu7xyr5/
j0s8poi7	Thank you. I just wish it wasn’t so frequent, it would be easier to deal with.	1643153034.0	hu7ye05	t3_scq0e0	t1_hu7wm4o	/r/offmychest/comments/scq0e0/i_hate_being_a_short_man/hu7ye05/
5px3w8jj	I agree with this comment, maybe the loss of your child affected her more than she thought it will and she felt guilt/anger/depression post abortion, and that’s why she promised herself to never abort again.	1643153403.0	hu7zb0i	t3_schi4u	t1_hu7os1f	/r/offmychest/comments/schi4u/exwife_pregnant_with_new_boyfriends_baby_after/hu7zb0i/
ivq28znv	Ok here’s the thing. My parents know and we know irl	1643153600.0	hu7zsmb	t3_scoob9	t1_hu7y301	/r/offmychest/comments/scoob9/idk_what_to_say/hu7zsmb/
qm1pg	Give him a big dose of laxative chocolate	1643153969.0	hu80p9a	t3_scra4w	t3_scra4w	/r/offmychest/comments/scra4w/i_hate_my_stepdad_so_much/hu80p9a/
43w95t04	This comment is exactly why I'll be be unfollowing this racist hellhole.	1643154445.0	hu81uto	t3_sccwjr	t1_hu6cr7w	/r/offmychest/comments/sccwjr/i_fucking_hate_being_black/hu81uto/
96hw23wb	I’m sorry that you are going through this.  I was lucky enough to grow up going to a very diverse school. Although I’m sure it doesn’t mean much now I know from experience that there are a lot of people out there who didn’t grow up learning  racism (although no one is perfect) and who will love you for exactly who you are.	1643154871.0	hu82vse	t3_sccwjr	t3_sccwjr	/r/offmychest/comments/sccwjr/i_fucking_hate_being_black/hu82vse/
68mcvzzf	Thanks for this post. Your point about more common words is something that hits home. Today I was very frustrated at myself having three of the letters and still taking four guesses to solve it. I won't reveal what they were but they were quite a bit more arcane than today's word turned out to be! 😂	1643155168.0	hu83lat	t3_scjrki	t1_hu7zkqo	/r/offmychest/comments/scjrki/wordle_is_ruining_my_life/hu83lat/
i0t5se1c	The college bookstore said because it was delivered they can't refund me because I can't prove that it was stolen.	1643155519.0	hu84fhh	t3_scrscy	t1_hu84apb	/r/offmychest/comments/scrscy/you_know_what_really_bleep_sucks_when_some_shrimp/hu84fhh/
7ehcqibk	Trust me my parents tried other non physically disciplinary methods first and it didn’t phase me.   I’m glad my folks disciplined me. It taught me respect & boundaries at a young age. I wouldn’t change it at all.   They were parents first and my friends second. With all due respect some people have that order backwards these days.	1643155977.0	hu85j11	t3_sc2ypf	t1_hu80jx1	/r/offmychest/comments/sc2ypf/i_just_got_in_an_argument_with_my_gf_because_she/hu85j11/
ax44v83k	Cause I lied about the time frame. I never was able to tell them when I was younger and it all kind of came to a point where I had a mental break down. And I thought that even if I did tell them the real truth at the time they would have said “that was a long time ago it’s time to move on” so instead I just came up with a story and they got me into therapy. Plus coming forward wasn’t something I ever wanted to do with the initial guy he had guys that would have for sure jumped me for saying anything	1643156185.0	hu8616n	t3_scrxi8	t1_hu85mq8	/r/offmychest/comments/scrxi8/lied_about_circumstances_of_my_assault/hu8616n/
ax44v83k	And I had left a school they had really wanted me to stay at. I just couldn’t do it anymore	1643156259.0	hu867jt	t3_scrxi8	t1_hu8616n	/r/offmychest/comments/scrxi8/lied_about_circumstances_of_my_assault/hu867jt/
7hxk3uk1	I don’t know why, but I feel like it’s a safety thing out brain is doing or something.   When I was younger my brother would beat the shit out of me, but for some reason I’d say it was my dad sometimes, although we did have our own altercations.   I don’t know why I lied about it, it wasn’t like it wasn’t happening, it was just a different member.   I also lied about which side my stomach pain was on in the hospital. Don’t understand that one at all. In my mind I wanted it to be the right because it seemed easier to diagnose, so I said right. It was the left. Drs found the problem on the left, I still insisted the problem was on the right while they are palpating the left side and I’m recoiling in pain. They just said I had weird rebound pain. I don’t know wtf I was thinking.	1643156510.0	hu86td6	t3_scrxi8	t3_scrxi8	/r/offmychest/comments/scrxi8/lied_about_circumstances_of_my_assault/hu86td6/
7ehcqibk	Time outs, they’d take away some of my privileges like my bicycle and my game consoles, they’d try to show me the difference between good behavior and bad behavior. They’d ground me if necessary.  They’d reinforce my good behavior and try to be patient with my bad behavior but point out that it’s wrong.   They honestly actively tried to avoid spanking me. They’d repeatedly try to not use any kind of physical discipline.   At one point though I stopped giving a crap about all those methods and that one-two spanks set me straight.   That’s why I don’t regret anything. I respect the hell out of my folks and I’m grateful for that discipline. It taught me respect.   Like I said though there’s a big difference in lightly spanking a kid once or twice to get the message across and flat out hitting or slapping a kid in the face.	1643157081.0	hu8865k	t3_sc2ypf	t1_hu864fn	/r/offmychest/comments/sc2ypf/i_just_got_in_an_argument_with_my_gf_because_she/hu8865k/
6panl958	You're feeling this way after what your husband said about being obligated to stay together for the kids. I'd recommend listening to the others that suggested couples therapy. If your husband isn't open to that then you might want to consider divorce, but I really wouldn't recommend having a second life while you're still married to him. It will make the divorce infinitely more messy and probably ruin your reputation with your kids for life when they find out why things fell apart (keyword WHEN since a lot of women like to lie to their kids about such things but they always find out eventually).	1643157088.0	hu886r6	t3_scs4sm	t3_scs4sm	/r/offmychest/comments/scs4sm/i_want_to_live_a_double_life/hu886r6/
22u7f06v	Thank you	1643158348.0	hu8b83g	t3_scsk6h	t1_hu89ows	/r/offmychest/comments/scsk6h/my_gf_of_7_years_wanted_a_break/hu8b83g/
1mcjz2zi	If one person could understand, I already feel happy, sweetie	1643159719.0	hu8ej27	t3_sccwjr	t1_hu8771g	/r/offmychest/comments/sccwjr/i_fucking_hate_being_black/hu8ej27/
32cpdlwr	Let me tell you about my son Albert, lil Al. Named after his Granpa. Great kid, he loved The Angels (So Ca baseball team) and Tony Hawk was his hero. His mom was a real pain in the ass, we were divorced. He had an active social life filled with activities that would make it really hard for me to work extra hours. In addition I sometimes had to take time away from the office.   Here's the thing. He never existed. I made him up.   The real trick is the pain in the ass ex but do not go too far with that. You get an overly concerned co working suggesting CPS and it is a hassle.	1643160928.0	hu8hegk	t3_sce1kq	t3_sce1kq	/r/offmychest/comments/sce1kq/being_single_without_kids_having_all_the_free/hu8hegk/
iwf54fg6	It's biological. Men are wired for sex and if they don't get it they literally go insane. It's a natural process and they have very little choice in the matter.	1643161685.0	hu8j64h	t3_scf345	t1_hu7779v	/r/offmychest/comments/scf345/some_dudes_on_here_really_need_to_touch_grass_or/hu8j64h/
j0yroygk	When you asked me how I felt you were hoping that I say I'm not well because otherwise you get upset because "its unfair" that I feel good without you. You know this is the truth. You hoped I never get over you and that I struggle because of you as much as possible. Just because of your own idea that its unfair if I am good without you in my life. Then you lied about meeting a new guy just to avoid adressing what you said about me behind my back. As if I would even get jealous. When I found out about your true colors I will never get jealous over you ever again. Just feel sorry for your next guy.	1643162181.0	hu8kbyz	t3_sctwy7	t3_sctwy7	/r/offmychest/comments/sctwy7/i_was_doing_so_so_good_but_now_he_ruined_me_again/hu8kbyz/
d3hr9lr7	Idk if I want to see that. I have ways of confirming without that	1643162332.0	hu8kose	t3_scu7w9	t1_hu8kk7g	/r/offmychest/comments/scu7w9/my_husband_is_planning_on_cheating_and_im_going/hu8kose/
8f5wri7r	How much quality  time do you spend together?  Does she have your undivided attention on a regular basis?  I'm just curious if she picks these fights with you to get attention.  Sometimes I'll pick fights with my husband because he isn't helping around the house when actually I'm upset that he isn't setting aside time for us to spend together.  I'm kind of 🦇💩🤪 like that.  Even I admit it makes no sense.	1643163149.0	hu8mmwb	t3_sc9inv	t3_sc9inv	/r/offmychest/comments/sc9inv/i_love_my_wife_but_i_just_wish_shed_fucking_cheat/hu8mmwb/
9z6scl5f	I was a hypocrite. I am sorry. I am at fault here. Sorry	1643163462.0	hu8ndr5	t3_sctwy7	t1_hu8kbyz	/r/offmychest/comments/sctwy7/i_was_doing_so_so_good_but_now_he_ruined_me_again/hu8ndr5/
8znbi2gq	Yesss it does more good being a nice person than continuing to tell people stop being sensitive and be mean. I know not everyone is going to be nice & you can not care what other people say but when it comes to people that you love and they supposedly love you, that’s where I don’t think we should accept them being mean and hurting us. Having thick skin shouldn’t apply to when it comes to your partner.	1643163533.0	hu8njst	t3_sc40dg	t1_hu89ken	/r/offmychest/comments/sc40dg/im_tired_of_getting_told_to_grow_thick_skin/hu8njst/
a4t8j6de	The most fruitless thing in the Universe is a mind judging itself. Try to be kind on yourself, your emotions are valid, whatever they may be.  I am sorry about your loss.	1643164604.0	hu8q2s6	t3_scuzbp	t3_scuzbp	/r/offmychest/comments/scuzbp/im_jealous_of_a_guy_because_his_dad_is_dying/hu8q2s6/
3ps1pp5x	I’d ghost you too tbh	1643164615.0	hu8q3rl	t3_screcv	t3_screcv	/r/offmychest/comments/screcv/absolutely_fuck_anyone_that_ghost_people/hu8q3rl/
3l9396eg	I’m ultimately fine, just venting. Thanks so much for the kind words <3	1643164682.0	hu8q9ez	t3_sctkid	t1_hu8pcqw	/r/offmychest/comments/sctkid/im_in_my_40s_and_the_thought_of_having_to_work/hu8q9ez/
iwxfu9jw	Dude, I'm with you.  At some point in my life I studied computer science and even tried to compile my own Gentoo distro. But it was with joy that I gave up on that career.  15 years later I tried to give Linux a second chance by trying a couple of distros based on Ubuntu... but guess what: it still is a pain in the rear to get anything to work in Linux...	1643165053.0	hu8r4wu	t3_scug6d	t3_scug6d	/r/offmychest/comments/scug6d/a_new_os_is_a_huge_thing/hu8r4wu/
msgwc	Praise you for your post. As a biracial woman who has always lived in predominantly white neighborhoods, I realize that:    • White men will date me but not marry me.   • I will never move up the corporate chain. I am always the one or two black women in the workplace.   • I will always be followed by security at the grocery stores, department stores, or any place to buy goods and services.  • I will be the sounding board for every white person complaining about how they are not racist.  • I will always be seated in the back of the restaurant or somewhere out of view of incoming patrons.  • When I ask for a refund or complain about service, I will have to defend my point of view or accept an inadequate resolution.  • I will always have to act in a passive manner at work no matter what injustice I suffer.  • I will have to hold my tongue and accept that white people will tell me that black people are not treated differently by the police.  • I have to accept the opinion of white people that speaking in very clear English is considered a compliment.  • I accept that white people will always assume that I grew up in the ghetto.     Thanks for letting me vent.	1643165316.0	hu8rrde	t3_sccwjr	t3_sccwjr	/r/offmychest/comments/sccwjr/i_fucking_hate_being_black/hu8rrde/
8r5825zg	I'm 31 single no kids. Also gay. But the family picture on my desk says otherwise. I learned long ago that having family was a get out of jail free card at any job. My "kids" get sick all the time and someone has to take care of them since my "wife" works an hour away.	1643165399.0	hu8ryiq	t3_sce1kq	t3_sce1kq	/r/offmychest/comments/sce1kq/being_single_without_kids_having_all_the_free/hu8ryiq/
3umfglzh	As a light skinned biracial Black woman- they are still gonna call you angry.. even if you lighten your skin. If white people see you as Black, that’s what you are. Sorry	1643165424.0	hu8s0oh	t3_sccwjr	t1_hu5chu8	/r/offmychest/comments/sccwjr/i_fucking_hate_being_black/hu8s0oh/
fcowu1yw	What do you mean?	1643166149.0	hu8tp3d	t3_scm49b	t1_hu8nh11	/r/offmychest/comments/scm49b/where_do_people_find_the_energy_to_eat_shower_and/hu8tp3d/
fcowu1yw	Sounds like a shitty life.	1643166864.0	hu8vbc6	t3_scm49b	t1_hu8hhdb	/r/offmychest/comments/scm49b/where_do_people_find_the_energy_to_eat_shower_and/hu8vbc6/
im20s3uy	What happened exactly?	1643170461.0	hu937ua	t3_scwz0t	t3_scwz0t	/r/offmychest/comments/scwz0t/losing_him_because_of_my_inability_to_handle/hu937ua/
5143ph5g	Probably not the first time he's had to deal with your problems.  But it sounds like the last.  Good for him,  and you.  Get the help you need so you can stop blaming your issues on your alcohol problem and realize it has more to do with your character than liquor. Good on you for recognizing you need help.	1643170655.0	hu93m53	t3_scwz0t	t3_scwz0t	/r/offmychest/comments/scwz0t/losing_him_because_of_my_inability_to_handle/hu93m53/
7lpyqhzx	And I’m sure you’ll be fine inside with your video games	1643171981.0	hu96bfp	t3_sc5pem	t1_hu5j77x	/r/offmychest/comments/sc5pem/ima_be_honest_im_scared_about_the_whole_russia/hu96bfp/
iajplrjw	Thank you, friend. I might try the LGBTQ+ group. Therapy at school scares me a little because where I live, you never really know who might surprise you with their secret homophobia, and that would do me more harm than good I feel. But it’s good advice and I appreciate it. :)	1643172150.0	hu96ndv	t3_scx6ys	t1_hu95wss	/r/offmychest/comments/scx6ys/i_cant_afford_a_therapist/hu96ndv/
awabcp5q	Agreed	1643172498.0	hu97bfu	t3_screcv	t3_screcv	/r/offmychest/comments/screcv/absolutely_fuck_anyone_that_ghost_people/hu97bfu/
iwf331dp	im not here for jokes and sarcasm	1643172662.0	hu97n26	t3_scxhcn	t1_hu97jhk	/r/offmychest/comments/scxhcn/dating_life_is_over_for_me/hu97n26/
iwf331dp	why comment something if u not gonna say nothing. could’ve just kept your comment tbh	1643172736.0	hu97s5m	t3_scxhcn	t1_hu97p5y	/r/offmychest/comments/scxhcn/dating_life_is_over_for_me/hu97s5m/
iwf331dp	damn u very mysterious😂😂	1643172936.0	hu98612	t3_scxhcn	t1_hu97wc2	/r/offmychest/comments/scxhcn/dating_life_is_over_for_me/hu98612/
im20s3uy	What the fuck are you talking about?	1643173089.0	hu98gi4	t3_scxqjy	t3_scxqjy	/r/offmychest/comments/scxqjy/im_a_catgender_demigirl_shetheynya_and_sometimes/hu98gi4/
4h0507bm	People like you, are pretty into it and that means there's money to be made. I don't know a single influencer by name.	1643173494.0	hu998hv	t3_scxh9w	t3_scxh9w	/r/offmychest/comments/scxh9w/influencers_and_purely_white_deluxe/hu998hv/
