author	body	created_at	c_id	s_id	p_id	permalink
a1eufcnn	Hail Hilter !	1642713036.0	htidoo0	t3_s8pkx3	t3_s8pkx3	/r/Anarcho_Capitalism/comments/s8pkx3/its_official_mandatory_vaccinations_in_austria/htidoo0/
3pf3o2wi	Sooo this is a self solving problem if we give them a bunch of guns?	1642718835.0	htirbri	t3_s8uqnr	t3_s8uqnr	/r/Anarcho_Capitalism/comments/s8uqnr/unarmed_communists/htirbri/
7gk6jrzm	Or maybe all of you just are stupid lol	1642722110.0	htiz8m1	t3_s8sc4f	t1_htiytck	/r/Anarcho_Capitalism/comments/s8sc4f/sigh_these_people_dont_even_understand_the/htiz8m1/
ivb229f7	🔥THE NEXT MOONING TOKEN HAS LAUNCHED🔥              🚀TRINITY DEFI 🚀  TRI-REWARDS METAVERSE TOKEN👀  ✅ Fully Doxxed KYC ✅CERTIK Audit   🎮 Gamified Staking   🦅 SAFU  🖼️ Room collections NFT  Rewards dashboard for rewards selection in our Dapp!!!!  SOCIALS:  TG 📱: https://t.me/TrinityDefi 🌍:    https://trinitydefi.com/	1642770417.0	htldd1i	t3_s8uqnr	t3_s8uqnr	/r/Anarcho_Capitalism/comments/s8uqnr/unarmed_communists/htldd1i/
igh6s2no	Pure evil.	1642784765.0	htmccqx	t3_s99rhc	t3_s99rhc	/r/Anarcho_Capitalism/comments/s99rhc/british_student_explains_how_terrible_mask/htmccqx/
4zljy82m	Interesting take, but then if the fascist continues his statement beyond just criticism of capitalism and communism, you'll see that he will claim that true meaning and spiritual revival of the nation is not through materialism but rather through a convoluted and pseudoscientific view of race, blood-nation, and the sacred order of "natural hierarchies" engaged in perpetual conflict with one another until the strongest survives. So, the fascist does make some compelling points against economic materialism, but then devolves into replacing the emphasis on materialism with some convoluted mystical folk belief type thing. It's almost like you could see this quote replacing materialism with some type of transcendent religious or spiritual offering focused on love of one another and/or love of God, etc., but that's not where Fascism goes. It's usually about love of nation, state, tribe, etc., and then often resorts to uncritical love of the cult of personality around a single leader, which is hardly appealing to most people who are used to living in a free society.   Not to mention that Fascism has at least historically tended to find support among the wealthy elites of society, industrialists and oligarchs and the like. So while in principle this dude might be opposed to economic materialism, on practice most Fascist governments have ended up courting allies among those that dominate the economic system. In rhetoric, it's all good to be anti-materialist and strive for something more transcendent in society. In practice, ask those wealthy industrialist and aristocratic apologists who aligned and supported Fascism how they would feel if their position on the economic materialist hierarchy were upended. I'd bet they would be asking for their economic material wealth back pretty quickly.	1642820718.0	htoy6dk	t3_s9s2cj	t3_s9s2cj	/r/Anarcho_Capitalism/comments/s9s2cj/what_are_your_thoughts_on_this_fascist_take_on/htoy6dk/
igh6s2no	Blades on the end of spears, with white man heads on sticks in the background, is even more intimidating.	1642826756.0	htpbeyg	t3_s9qzaj	t1_hton08o	/r/Anarcho_Capitalism/comments/s9qzaj/in_auckland_the_māori_people_protest_against/htpbeyg/
igh6s2no	I highly doubt it. Her girlfriends' vibrator would have chipped her front teeth by now.	1642826948.0	htpbsiy	t3_s9qzaj	t1_htp43oi	/r/Anarcho_Capitalism/comments/s9qzaj/in_auckland_the_māori_people_protest_against/htpbsiy/
io9c4o2a	Her teeth are worse	1642833028.0	htpn0g4	t3_s9qzaj	t1_htp0al6	/r/Anarcho_Capitalism/comments/s9qzaj/in_auckland_the_māori_people_protest_against/htpn0g4/
io9c4o2a	Rattlesnakes have rattlers to warn you.  This is no different.  They’re just taking the high road that isn’t being taken with them.  Hope that never changes.	1642833114.0	htpn5up	t3_s9qzaj	t1_htpehs7	/r/Anarcho_Capitalism/comments/s9qzaj/in_auckland_the_māori_people_protest_against/htpn5up/
ijmvfsys	If r*ads made any sense they wouldn't need the g*vernment to pay for them, private companies built massive railway lines before the g*vernment decided to waste trillions subsidizing air pollution.	1642889251.0	htsqqte	t3_sab9a7	t1_htskwpq	/r/Anarcho_Capitalism/comments/sab9a7/taxtion_is_theft/htsqqte/
st6o02r	Build your own road, retard.	1642897499.0	httaz6u	t3_sab9a7	t1_httal6t	/r/Anarcho_Capitalism/comments/sab9a7/taxtion_is_theft/httaz6u/
9ef3tes1	Dude, are you literally retarded?	1642897800.0	httbprt	t3_sab9a7	t1_httbf3n	/r/Anarcho_Capitalism/comments/sab9a7/taxtion_is_theft/httbprt/
st6o02r	Answer the question, you drooling ape.	1642898113.0	httcjpv	t3_sab9a7	t1_httbprt	/r/Anarcho_Capitalism/comments/sab9a7/taxtion_is_theft/httcjpv/
8jn449li	Fuck off dude. Worst of  the fucking worst!	1642904195.0	httqoo3	t3_s9ucf0	t1_htqo84c	/r/Anarcho_Capitalism/comments/s9ucf0/infinitely_more_egregious_than_gf/httqoo3/
9nko9gt4	well, there's a color that does that...	1642916834.0	htuiaz9	t3_saktm1	t1_htu88u8	/r/Anarcho_Capitalism/comments/saktm1/what_do_you_think_of_this/htuiaz9/
4ozeu2ot	Your link quotes he said "maybe" look at red flag laws. Do you always take maybe as definetely?	1642924560.0	htuudto	t3_safazu	t1_httlbz7	/r/Anarcho_Capitalism/comments/safazu/another_fraud_neocon_republican_who_loved_mccain/htuudto/
11jzjr	You are such a fucking retard.	1642949545.0	htvv633	t3_sad890	t1_httzd0d	/r/Anarcho_Capitalism/comments/sad890/this_is_why_you_shouldnt_trust_government_agencies/htvv633/
ijmvfsys	Yes I did	1642953043.0	htw3caj	t3_sab9a7	t1_htvdgn4	/r/Anarcho_Capitalism/comments/sab9a7/taxtion_is_theft/htw3caj/
fs6u60vl	what's so bad about the government that rednecks always want to get rid of it?  do they simply live so far from civilization that they don't see the benefits the govt provides?  wouldn't it be better for u to move to civilization from the booneys so u can enjoy the benefits of  society	1642957837.0	htwfjw2	t3_saxydo	t1_htwf8m7	/r/Anarcho_Capitalism/comments/saxydo/conservative_logic/htwfjw2/
fs6u60vl	why do *you* hate brown people?  Seems that this anti-government Sovereign citizen movement didn't really exist until the Civil War period. It traces its roots back to Confederates hating the government because the government wanted to ban slavery  the entire "anti fed" sovereign citizen movement was because you guys were scared the govt might ban slavery  that's the first time we ever heard the "states rights" argument in america  Because you confederates didn't like that the federal government was banning slavery	1642958086.0	htwg7q3	t3_saxydo	t1_htwfuo4	/r/Anarcho_Capitalism/comments/saxydo/conservative_logic/htwg7q3/
fs6u60vl	that's a weird and misleading way to frame it  what things can the market do that couldn't be done better with consent?  Everyone consents to the government period it's common sense period most people don't consent to capitalism	1642958213.0	htwgjxz	t3_saxydo	t1_htwgbp8	/r/Anarcho_Capitalism/comments/saxydo/conservative_logic/htwgjxz/
fs6u60vl	so why are u changing the subject?  you changed it to brown people  why are u changing the subject?	1642958459.0	htwh7d8	t3_saxydo	t1_htwgvpb	/r/Anarcho_Capitalism/comments/saxydo/conservative_logic/htwh7d8/
fs6u60vl	and what happens when they can't afford to move?  It seems some people have developed a strategy of organizing the country in which even it's most poor and desperate people can afford to live happily.. and then people like you don't want that to happen and fight like hell to make sure that the poor suffer more than they have to	1642958544.0	htwhfgn	t3_saxydo	t1_htwgkoj	/r/Anarcho_Capitalism/comments/saxydo/conservative_logic/htwhfgn/
fs6u60vl	But you don't have to do what they say. For example taxation is 100% voluntary. If you don't have a job and you don't own property you don't pay taxes.    You *chose* to have a job and you chose to own property and that's what makes it voluntary  But you can stop paying taxes anytime you want by simply quitting your job and not owning property  Capitalism is not voluntary. Most people don't want to work it in jobs but they're forced to anyway. Capitalism employee slave labor in foreign countries. Forcing kids to dig for blood diamonds and kids in other countries to dig in Cobalt mines  capitalism *requires* non-consent	1642958674.0	htwhrv1	t3_saxydo	t1_htwhh12	/r/Anarcho_Capitalism/comments/saxydo/conservative_logic/htwhrv1/
fs6u60vl	Nope, not getting away with reflection nazi.	1642958693.0	htwhtm4	t3_saxydo	t1_htwhdd7	/r/Anarcho_Capitalism/comments/saxydo/conservative_logic/htwhtm4/
fs6u60vl	I don't see any Democrats advocating for slavery or Jim Crow laws    I do however see PLENTY of conservatives and right-wingers declaring that they think the civil rights act should be repealed and a version of him crow laws to be enacted..  So I'm not really sure where you're getting your information but it's clearly false just by looking outside	1642958751.0	htwhyx4	t3_saxydo	t1_htwhi05	/r/Anarcho_Capitalism/comments/saxydo/conservative_logic/htwhyx4/
fs6u60vl	just because republicans use the state in bad ways doesn't mean the state is bad  it means republicans are bad	1642958852.0	htwi852	t3_saxydo	t1_htwhsre	/r/Anarcho_Capitalism/comments/saxydo/conservative_logic/htwi852/
fs6u60vl	Just because you don't benefit from the government doesn't mean nobody does. The problem is that you reject Jesus teachings and only care about yourself. You are the party of selfishness  And  wouldn't be so hypocritical if your side wasn't constantly touting religion and Christianity as its founding principles but then you reject the basic principles of Christianity when it comes to caring about anybody other than yourself..	1642958953.0	htwihiw	t3_saxydo	t1_htwhbjv	/r/Anarcho_Capitalism/comments/saxydo/conservative_logic/htwihiw/
fs6u60vl	what YOU describe is the opposite of consent  nobody consents to paying half their paycheck to a landlord  Nobody consents to really low wages at their job period they are forced to take those wages periodically they are forced to work that job period they don't have a choice period capitalism requires non-consent and actual literal slavery period	1642959067.0	htwis5m	t3_saxydo	t1_htwiiro	/r/Anarcho_Capitalism/comments/saxydo/conservative_logic/htwis5m/
fs6u60vl	no there wouldn't  and u have no evidence that there would	1642960221.0	htwltu7	t3_sayxv6	t1_htwk2fs	/r/Anarcho_Capitalism/comments/sayxv6/yep/htwltu7/
fs6u60vl	I'm paying politicians with the universal healthcare money?  where is that happening?  it's funny u don't think ceo's are blood soaked parasites  You falsely claimed that politicians are somehow paying themselves with the money for Universal Health Care (which doesn't ever happen) but meanwhile CEOs actually do pay themselves with your insurance money  It seems people like you tend to get politicians and CEOs mixed up and Confused. The things you claim (falsely) that politicians do are things that ceos ACTUALLY do	1642960316.0	htwm2nl	t3_sayxv6	t1_htwkqby	/r/Anarcho_Capitalism/comments/sayxv6/yep/htwm2nl/
fs6u60vl	so they should starve?  ur whole argument for not caring about others falls apart right there  The problem is that one side cares about other people and wants to make other people's lives better and your side doesn't care about anybody but yourself and you're telling people to vote for you because you hate the poor	1642960410.0	htwmbdi	t3_saxydo	t1_htwjuyx	/r/Anarcho_Capitalism/comments/saxydo/conservative_logic/htwmbdi/
fs6u60vl	not once in history has deregulation led to cheaper healthcare	1642960466.0	htwmgpe	t3_sayxv6	t1_htwm6gl	/r/Anarcho_Capitalism/comments/sayxv6/yep/htwmgpe/
fs6u60vl	ur the only one seething  socialism is coming  just in the 4 trump years america got more socialist  u can't stop it  every first world nation is socialist and u can't stop it from happening  the world is changing and it's making u scaredd	1642960634.0	htwmwlr	t3_sayxv6	t1_htwmbon	/r/Anarcho_Capitalism/comments/sayxv6/yep/htwmwlr/
gm7y8c0a	You, comment more. u/rickytickyd, https://lpmisescaucus.com/war/atomic-bombings/	1642970416.0	htxc1w9	t3_saxjb5	t1_htx5527	/r/Anarcho_Capitalism/comments/saxjb5/was_hiroshima_and_nagasaki_justified/htxc1w9/
16csdf	ha , i got so much free stuff and won the unemployment lottery under trump , ill gladly have him for life if i can keep getting free money  .   so no. thats not it .	1642979039.0	htxyn3p	t3_sb4eb5	t1_htxufbs	/r/Anarcho_Capitalism/comments/sb4eb5/how_the_fuck_did_this_guy_become_president/htxyn3p/
iaefipnk	Cheating. Just like every last election since Kennedy at least..	1642986165.0	htygg74	t3_sb4eb5	t3_sb4eb5	/r/Anarcho_Capitalism/comments/sb4eb5/how_the_fuck_did_this_guy_become_president/htygg74/
iaefipnk	You think the shortages are bad now? They're coming..	1642986534.0	htyhber	t3_sb9avt	t3_sb9avt	/r/Anarcho_Capitalism/comments/sb9avt/i_hope_youre_a_prepper_canadian_mexico_truckers/htyhber/
iaefipnk	Well there's the dumbest thing I'll read today.	1642987285.0	htyj2g2	t3_sb9avt	t1_htyipke	/r/Anarcho_Capitalism/comments/sb9avt/i_hope_youre_a_prepper_canadian_mexico_truckers/htyj2g2/
55p23k2i	2xminumum wage?  Kys	1643009303.0	htzrm06	t3_sb9qty	t1_htzc8am	/r/Anarcho_Capitalism/comments/sb9qty/poor_wage_slaves_raise_of_hands_who_here_couldnt/htzrm06/
eb6tozep	Then she won't mind.	1643010048.0	htzsmm0	t3_sbbsvl	t1_htzqwka	/r/Anarcho_Capitalism/comments/sbbsvl/world/htzsmm0/
a22fr4co	There’s a video where more than 400 athletes have been injured by the vaccine so far!	1643064082.0	hu2xu8k	t3_sbxwan	t3_sbxwan	/r/Anarcho_Capitalism/comments/sbxwan/vaccine_injured_professional_mountain_biker_kyle/hu2xu8k/
2pse3x6r	Cool story.   I hope you get all the democracy you can handle in a dark alley you braindead fucking cuck.	1643064561.0	hu2z1y6	t3_sbq5yy	t3_sbq5yy	/r/Anarcho_Capitalism/comments/sbq5yy/gang_rape_is_literally_democracy_in_action/hu2z1y6/
8zzypnn8	Link to archived article:   https://web.archive.org/web/20220216064722/https://www.hyphen-report.com/csis-uses-antifa-to-dox-and-honeypot-freedom-convoy/	1645029805.0	hx6wwq3	t3_su0d67	t3_su0d67	/r/Anarcho_Capitalism/comments/su0d67/freedom_convoy_gsg_hacker_doxxed/hx6wwq3/
3w1rmmgw	Hope nothing bad happens to him and dies. That would be awful :(	1645033317.0	hx7684x	t3_su0d67	t3_su0d67	/r/Anarcho_Capitalism/comments/su0d67/freedom_convoy_gsg_hacker_doxxed/hx7684x/
