author	selftext	created_at	s_id	permalink	title
b0n6x1uw	There seem to be two prevailing opinions here-- the one I stated in the title, and the idea that whoever asked the other out ("Hey, do you want to go to X place on Y day?") should pay for both parties. There are a few people who think the man should pay everything no matter what, but they're a minority and this isn't r/FemaleDatingStrategy, so we won't spend any more time on that.  No one owes me anything just because they asked me to go out. If we're dating, and we're doing so with the intention of possibly being together eventually, we're both in this equally. I want to be there on the date just as much as you, no matter who asks who out. My time and effort is no more valuable than yours-- I'm not doing you a favor by showing up even though you asked me out. We're in this together. Neither of us is more valuable than the other. This is mutually beneficial.  Why should one party pay for everything when the goal for both of us is to go out together eventually? It's not like it's some radical idea for one person to ask the other to meet up for coffee or a meal, or one person would be content to never go out when the other person desperately wants to go out.  That being said, communication is also where many people err in this situation. Every conversation should go something like "Do you want to go X place? Is that within your budget?" If it's not, pick a different place. If they don't want to spend any money at all, do something that's free. If you can't agree on who should pay or anything like that, move on, you're probably not compatible.  This also avoids either party feeling like they've been taken advantage of, or that they owe the other person anything, which is a major problem on both sides.	1642470138.0	s6l5lw	/r/changemyview/comments/s6l5lw/cmv_in_dating_before_an_official_relationship_is/	CMV: In dating, before an official relationship is agreed upon by both parties, all dates should be split 50/50, no matter who asks who out
mwrtr	I see consciousness not as a/non-person dichotomy, but a spectrum from very simple minds to us on the far end (who knows if there are even more conscious aliens?). Pigs and chickens are very smart, and have a certain amount of emotional intelligence. Here's part of an article from Mercy for Animals:  "From anticipating future events to recalling the trajectory of a hidden object, chickens are incredibly smart. They even possess self-control, holding out for a better food reward, and can assess their own position in the pecking order—both characteristics of self-awareness."  https://mercyforanimals.org/blog/chickens-are-intelligent-and-sensitive-so/#:~:text=From%20anticipating%20future%20events%20to,both%20characteristics%20of%20self%2Dawareness.  If I remember right, pigs, too, are smarter than some human children. In my opinion intelligence alone, other qualities of near-sapience notwithstanding, makes many animals deserving more of respect than predation. They're too much like us. I don't want to cause suffering to being that can perceive it.	1642472132.0	s6lv89	/r/changemyview/comments/s6lv89/cmv_many_animals_we_consume_are_too_intelligent/	CMV: many animals we consume are too intelligent for it to be acceptable
gw92lk27	If you're not familiar with the black pill, it's basically a belief that looks are everything and that nothing matters as much as your appearance. In the eyes of black pillers if you're not a 7-8/10 your life is basically over. There are women who have swallowed the black pill, but most black pillers seem to be men.   My problem with the black pill, aside from how damaging it can be to one's psyche, is that I think it spits out hypotheses which cannot be disproven and then uses the fact that nobody can disprove them to argue for their legitimacy. For example, a black piller might say women only love Chad (very attractive man.) Somebody else will say "well that's a lie because I've seen attractive and unattractive women with unattractive men" to which the black piller responds "that's because they're rich" or "he's an orbiter" or "they aren't a couple" or any number of other things. Things which, notably, nobody would know.   If somehow a black pill detractor does know a lot about a relationship, the black piller will typically respond with "well then that's the one woman in the world like that." It doesn't make sense, but it's highly unlikely that the black pill detractor is going to have many more examples to disprove that. My issue isn't that the hypotheses are difficult to disprove, my issue is that they're set up that way. It seems to me like you can apply the black pill to any situation and find some possible explanation that supports the black pill.  If the black pill were correct, it would still be a very dark philosophy about the world, but at least it would be true. But I question many of the claims black pillers make, especially when they're hostile towards and dismissive of counterevidence.  Do I believe life is easier if you're very attractive? All else being equal, probably- although being a very attractive man or woman with social anxiety might not be fun. But do I believe life is over if you're unattractive-no, I don't. But I'm open to changing my view if the evidence suggests I'm wrong.  Edit: After thinking about everything some more, my view on this subject has been changed. Thank you to all who responded!	1642472506.0	s6m0bo	/r/changemyview/comments/s6m0bo/cmv_the_black_pill_is_an_overly_cynical_view_of/	CMV: The Black Pill is an overly cynical view of the world that goes to great lengths to protect itself from criticism-like some critical movements. It is toxic and wrong and should be ignored.
6nua1	I don't understand what stay at home parents do once their children are old enough to go to school, in my opinion *you simply do not require a full-time person to manage and clean a house*. Before you say things like "I do the washing, I cook dinner, etc" - this doesn't take 8 hours a day, you can do all of these things while also having a part-time job. Hell, you can do this with a full-time job!  The opportunity cost of not working is huge:  * You could setup your family and children's financial future instead of spinning your wheels at home. With compound interest, that extra 20-40K per year will be worth hundreds of thousands by the time you retire. * You are setting yourself up to be financially dependent on another person. If the relationship falls apart, suddenly you don't have the skills or experience needed to support yourself. The way that alimony works in some places means your partners "reward" for supporting your sedentary lifestyle is to continue to support you after you break up. * It's simply unfair on the working partner, the division of labour is skewed. One partner works full-time to support the family, while the other partner does far less. it's not the 1950's anymore, both partners can and should be contributing towards the maintenance and upkeep of the house, including the emotional labour.	1642476172.0	s6n9sv	/r/changemyview/comments/s6n9sv/cmv_stay_at_home_parents_with_kids_who_go_to/	CMV: "Stay at home parents" with kids who go to school are just lazy
58vbhds2	19 States have reached 85% capacity in their hospitals, meaning individuals who are vaccinated or have other health issues cannot get treatment due to unvaccinated people taking up all the beds in the hospital.  I do believe in people having a choice, but when your choice harms others there should be concequences.   I nearly lost my mother due to a non covid releated medical issue that could have been fixed with a minor surgery + antibiotics, but instead it takes 2 days to find a hospital bed and now she will have over 6 months of recovery time do to the damage of the infection.  Looking foward to hearing everyones thoughts!	1642482741.0	s6pfy6	/r/changemyview/comments/s6pfy6/cmv_with_hospitals_reaching_capacity_unvaccinated/	CMV: With Hospitals Reaching Capacity - Unvaccinated Individuals Should Not Get Priority Over Others For Their Covid Cases
br466lkq	alot of europeans like to say that americans are "too patriotic" however, i dont feel like this is true, infact i would go as far as to say that america is one of if not the least patriotic country in the world, as Americans are the ones who burn there own countries flag more then anyone else, americans are also all over Twitter, Reddit, tik tok, and youtube saying that "america is a 3rd world country in a gucci belt" and saying that they want to move to europe and canada, american leftists are also the only leftists to openly dispise there own country, hell even I consider patriotism to be stupid	1642484874.0	s6q3b2	/r/changemyview/comments/s6q3b2/cmv_americans_are_not_over_patriotic/	CMV: americans are not over patriotic
4akx077	**I say this for a number of reasons, as an avid (former) user of Goodreads who would come across inaccuracies on author profiles as an almost daily occurence:**  \#1) Authors and publishers are the copyright-holders of the works themselves, not Goodreads or Amazon, and to that extent, they would know their own work better than anybody. The GR moderators (called "Librarians") often butcher the accuracy of book metadata records based on whether or not a title was ever listed on Amazon. They don't check copyright registries, they don't check to see who listed the book on Amazon in the first place, and they don't check to see if there's any context as to why a title should be removed. If it has an ISBN and was ever sold on Amazon, they consider it valid.  \#2) Self-publishing has muddied the waters too much. There are self-published authors who assign ISBN numbers to rough drafts of books, self-published authors who plagiarize books, and situations in the past where self-publishing companies released unpublished books prematurely against the author's wishes due to mere technical errors (which could start another whole argument in itself, but I digress)... there's no possible way for any Goodreads Librarian or Goodreads staff member to be able to determine what makes a book record an accurate book record anymore.  \#3) Goodreads is the primary search result that arises in most cases on web browsers, unless an author is famous enough to generate better search results first, like an official webpage or a properly catalogued resource.   \#4) Goodreads gets a lot of its records from user input and Ingram/Amazon, and only some from reputable sources like The Library of Congress or WorldCat. Ingram will bring in anything with an ISBN, and sometimes doesn't even spell the titles or author names correctly.  \#5) Goodreads itself deletes and segregates book records for arbitrary reasons all the time, and it would cause to great social ill to give authors the same power over their own works. Goodreads is a social metadata website, not a bookstore or a library, and metadata can be subject to change for various reasons. Unlike Goodreads, which will delete/segregate books for the purpose of outright censorship (see "The Turner Diaries"), there's really no reason for an author to do this, except for the purpose of having some control over invalid/inaccurate information. An author whose book is already common knowledge *can't* really hide its existence anyway, and so authors could at least keep their records accurate with more power to do so.  \#6) It doesn't serve Goodreads or Amazon to have a bunch of inaccurate/false data stored on its servers. If the goal is to accumulate metadata for readers, why would Goodreads want it to be so flimsy?   \#7) Goodreads clearly can't manage its own data inaccuracies anymore. The Librarians Group and contact support links to staff are oversaturated with requests pouring in from both readers and authors to fix up bad metadata, and it's left to the discretion of Goodreads and these moderators to remove it.  \#8) Goodreads will continue to display deadnames against an author's wishes. This is in spite of Amazon's other big metadata acquisition, IMDb, allowing people like Elliot Page to change their name on all metadata records after coming out as transgender, and there's no reason why Goodreads can't do this, too.   **TL;DR: The only reason these giant book metadata platforms are allowed to get away with displaying bad metadata is because no class-action authors' collective has challenged them on it. Goodreads makes Wikipedia and Fandom look like university-grade secondary sources.**	1642485780.0	s6qdax	/r/changemyview/comments/s6qdax/cmv_goodreads_should_allow_authors_to_delete_book/	CMV: Goodreads should allow authors to delete book records from their author bibliographies, or at least segregate them to the Goodreads "NOT A BOOK" page.
s0gom	A little bit of set-up before I begin. I'm 28 years old (M) and I've never held a job in my (thus far) useless life. I also didn't go to college (due to how astronomically costly it is here in the US) and I still live with my parents, but desperately want to move out as soon as possible. All that said, let's begin.  I'll now discuss the basis of why I hold this view. It has to do with the fact that employers value candidates who have marketable skills. In this department I'm at an immediate disadvantage. That isn't because I don't think I have any skills (I certainly do). Since I've never worked before, I have no evidence that I can point an employer to. Without said evidence, I have no hope of convincing an employer to hire me. In addition, my lack of job experience, which I can't explain away, doesn't help at all. I don't know how teenagers manage to get jobs despite being in the same position as me. Many of the people I see working service jobs near me are the aforementioned teenagers and college age people. Very, very rarely do I see anyone older than that. Yes, I know that age discrimination is illegal, but that doesn't mean businesses don't try to do it anyway.  I also have what I can only describe as "performance anxiety." Typically that term is applied to sexual situations but I think it fits my situation with respect to jobs. I just don't know if I could meet a boss's expectations enough that won't be fired in a week. I'll be expected to hit the ground running and I don't think I could do that. Intertwined with this is that I'm socially awkward, making it impossible to even pass a job interview.  I could go on but I think you get the picture. If you were a employer/hiring manager, given all that I've described above, would you hire me?	1642486549.0	s6ql36	/r/changemyview/comments/s6ql36/cmv_no_employerhiring_manager_would_ever_touch_me/	CMV: No employer/hiring manager would ever touch me with a 100-foot pole
h9cqpgm0	Just happened to me and I'm still upset we evolved to not be able to sneeze on command   i tried the bright light trick, the fake sneeze to trick my nervous system and sniffing pepper just makes it worse. the whole shabang, but god simply enjoys my suffering.    i know what you're thinking - " but brain freezes , but cramps but sharts".   but i said - for those few SECONDS.   to those people i say- can you imagine if the false sneeze irritation lasted minutes?? or hours ??!    the problem with brain freezes is that they last a painfully long time, if it was only as long as a false sneeze no problem. I've never had a period cramp but blue balls is horrible mainly bc it lasts a long time, a few seconds would be nothing. and sharts are more of a betrayal than actual irritation, as long as you can run to the bathroom it's more about the embarrassment and cleanup.   no- i submit that for the brief few seconds that you cannot sneeze and you know it's not going to happen - those are intense. purgatoric if not hellish. I maybe succeed inducing a real sneeze from a false sneeze 1/100x , which makes it worse tbh.   the only silver lining i can think of is that false sneezes at least make you appreciate how satisfying real ones are, but i appreciate orgasms without ruining them and farts without false ones.    so idk man, this will be a hard one to change tbh, good luck.   edit: words   edit: apologies to the differently abled. i meant to include that i meant only the most shared human experiences of bodily functions, didn't mean to feign ignorance to the pain of those with diseases/injuries or provoke a battle of the sexes.	1642487734.0	s6qx4p	/r/changemyview/comments/s6qx4p/cmv_that_feeling_you_get_when_you_start_to_sneeze/	CMV: That feeling you get when you start to sneeze but then can't is the most irritating bodily function in existence for a few seconds
g8azu	Towards the end of the previous administration after Donald Trump's election loss, Nancy Pelosi sought assurance from the Joint Chiefs of Staff that the exiting president would not be able to use nuclear weapons in the interim period before he was replaced by Biden. While General Mark A. Milley sought to reassure her, and planned around the possibility, he may not be able to do so in the future. This, paired with Trump's pattern of grandstanding about the US nuclear arsenal, increasing tension towards China, and his resistance to any sort of external control, makes me worry that should he become President again, he will make a pre-emptive strike on a perceived enemy of the US (most likely China) and, in doing so, endanger the county and/or world through nuclear armageddon either via retaliatory destruction of economic centres within the United States, mutually assured destruction, or nuclear winter.  Are there reasons why Donald Trump, given his unpredictability beyond supporting his ego and business interests, would NOT do such a thing? Note that this is not a thread on whether Trump will become president again, but on whether his actions can be at all predicted or certain possibilities can be disregarded.	1642492762.0	s6s9fl	/r/changemyview/comments/s6s9fl/cmv_if_donald_trump_is_president_for_a_second/	CMV: If Donald Trump is President for a second term, he will use nuclear weapons on impulse and jeopardize global stability and possibly the world.
byqp9cim	 It's not a competition when someone twice the size of other contestants can trivialize their victory. Plus there were those times when a couple of  MMA fighters got their skulls bashed in and nearly died from injuries sustained from a male fighter. Not exactly a common occurrence for female-on-female fights.  [https://www.breitbart.com/sports/2020/01/22/transgender-mma-fighter-who-fractured-womans-skull-named-bravest-athlete-history/](https://www.breitbart.com/sports/2020/01/22/transgender-mma-fighter-who-fractured-womans-skull-named-bravest-athlete-history/)  Men and women are too physically different to compete against each other in sports. Sports are divided for a reason so why let someone with a male body beat up women?	1642497080.0	s6tbo3	/r/changemyview/comments/s6tbo3/cmv_transgender_women_shouldnt_be_allowed_to/	CMV: Transgender women shouldn't be allowed to "compete" in female sports.
y1qmm	This comes directly from something I saw earlier about somebody complaining about COVID etc., I'm all for the vaccination so as you can imagine when I hear somebody introduced as "Dr. \[surname\]" with a different opinion to me, it could imply that he actually knows what he's talking about.  No. A tiny bit of research shows that he has a PhD in *theology*, this was never specified, yet I see the same video circulating quite a bit around the internet (between anti-vaxxers) because he was called "Dr.", anybody that doesn't do research would therefore assume that he has some sort of medical or at least scientific background which is not the case.  I don't disagree with people being *allowed* to introduce themselves as "Dr." because a PhD does take a long time and it is a big thing etc. but it's very immoral  EDIT: When I refer to a "doctor" in this post I mean a licensed physician/MD, I've said "person with a PhD" any other time, I'm aware that they're both considered "doctors" by definition.	1642506250.0	s6vnxe	/r/changemyview/comments/s6vnxe/cmv_people_with_a_phd_in_an_unrelated_field/	CMV: People with a PhD in an unrelated field shouldn't be allowed to introduce themselves as "Dr." when presenting medical facts
ggw5fsyd	the premise of my whole view is very simple, it is always a loud minority that drives change. the best advice people give on social media is to avoid the crazy bunch but that doesn't really work when jobs are impacted because the companies are looking at the social media being manipulated but the voices of the crazy. it's the loud minority, the crazies that drive those clicks, it's these  crazy voices whose voices are amplified by media as the mainstream narrative.  let's take an example,  Contrapoints and Jessie Gender are two trans creators whom I tend to go to when i have to hear the perspective of trans people when it comes to gender debate. while i disagree with some opinions they put up, i still find them reasonable and feel that I can extend that same reasonability to majority or trans folks. The problem occurs when you hear how crazies from the trans community and TRAs drag folks like Natalie across the platform when she doesn't toe the line.  these crazies are the loudest voices and these are the same folks that fuel the whole culture war. you need 2 hands to clap and while the alt right is definitely one of those hands, the others are the crazies.  the same can be said for any topic that's a dumpster fire these days. it's the loud minority that drives the narrative and ignoring them is disastrous.	1642507500.0	s6w0ak	/r/changemyview/comments/s6w0ak/cmv_the_whole_oh_its_just_a_tiny_minority_dont/	CMV: the whole "oh it's just a tiny minority, don't pay them attention" is a disastrous proposition.
2gs3lqse	People end decade long relationships over sexual affairs, but there are worse, more insidious types of cheating as well. If you are going behind someone's back, and hiding substantial information, distorting the truth, it's cheating and that person has gone dark. Nobody will be safe with someone who is comfortable subverting situations into his or her own advantage. Real cheating is dishonesty. Real cheating is calling someone "mine" and then turning around and giving priority access to (i.e spending your birthday with) someone else. That is a morally corrupt decision to deliberately distort reality and disrespect the person's best intentions and is worse than sexual cheating.  If you are giving someone else more compassion, understanding, sympathy, time and attention, it's cheating. Making another female feel like she's got a chance is cheating. If they end up receiving more of your emotional resources that's even worse than a one-off physical affair or a mistake in the heat of the moment. If they get priority on special days it's cheating. If they start feeling like you're into them it's cheating. IF YOU FEEL LIKE YOU GOTTA LIE ABOUT IT, it's cheating!!!	1642508494.0	s6wae0	/r/changemyview/comments/s6wae0/cmv_offering_someone_else_more_time_and_emotional/	CMV: Offering someone else more time and emotional compassion is cheating.
ewngos3d	Basic geometry and algebra? Sure. But in my opinion, focusing entire sections of mathematics on advanced algebra and geometry means you’re learning a section of mathematics 90% of us will never use again, and that’s replacing mathematical functions that we should be learning and might be of good use to us down the line.   If you want to do maths at a higher level, pick it at a higher level where you *will* learn advanced algebra and geometry.  As far as I’m concerned, these subjects should be minimised. If you have an exam of let’s say 30 questions, no more than 4 total should be on these two subjects. The rest should be things like advanced multiplication/division applied to real world problems, like finance, appreciation/depreciation, taxes (incremental rates on different numbers within the same sum to get those marginal rates), mortgage rates, fractions, etc.   If you can’t find a common, real world application of a mathematical problem, save it for third level education. Kids will get their share of algebraic & geometric calculations in physics & chemistry class anyway.   Addressing the argument of “most subjects aren’t applicable to real life, should we drop those too?”: No. maths is a core, generic subject meant to be a basic necessity. Those other subjects are elective and exist to give you some freedom to pursue subjects that you’re either good at or interested in. Elective subjects (more focused subjects you choose) should, by definition and necessity, be more focused to the subjects as a vocation. But maths and English are core, mandated subjects meant to instil the basics because these are both seen as essential to functioning in society. If the basis for teaching something is “you NEED this for the real world”, why would you teach anything other than problems that have real world application?	1642511180.0	s6x4ce	/r/changemyview/comments/s6x4ce/cmv_theres_no_good_reason_to_learn_advanced/	CMV: There’s no good reason to learn advanced trigonometry, geometry or advanced algebra before third level education
