author	selftext	created_at	s_id	permalink	title
ggw5fsyd	I'd like to take up this topic with 5 different points that I've seen in other debates regarding the discussion and one major inference from the society whose structure is used in this switch and bait.   first, the Inference. i am from India and I've seen in many debates how trans advocates point to my culture and society as a proof to embolden their point. the truth is, they can't be further from the truth. they often point to how Indian society marks more than two genders and that's a weird assumption to make.   this is so because the social categorisation and biological categorisation has no difference in India, even in our language. the world for male/man is narr( i don't know how to type in devnagari script, sorry) and for a female/woman is nari.  the hijras are never fully categorised as either narr or nari.  The only story that is often cited to support the trans claim is that of Vishnu/Mohini but if you do even a basic reading of that story, it'll be clear that two different entities are talked about. so i don't even understand why my culture is appropriated to make a false claim. sure we have more than two genders but the hijras aren't social men/social women because the category on male/man and female/woman are defined in a way that biology and society mirror each other.  Now for the major points :  1. The label transphobia - the label is used as a definition of hatred, fear or aversion of trans people and it's a train wreck imo.  here's a simple example, if someone whom I can visually figure out to be a man, then I'll call him a man. if he insists on using she/her pronouns, I'll do it out of courtesy but that's about it. I won't suddenly start believe that the person is a woman just because a certain set of pronouns were asked.   Where exactly is the hatred, aversion or fear of trans people in this scenario? now, if you ask me to believe that TWAW because somehow in your head you've decoupled  sex/gender, then that's nothing but ideological imposition. i don't believe in that decoupling.   the bigger problem with this label is the way it's used to shut down conversation but i understand that it's a method used throughout history. Accuse someone of having an isms/ists so that inquiry can be avoided.   2. The Switch bait of Gender/Sex - This one is rather interesting. ok, i can't use man/woman to accurately say male and female in your ideology, but can i then use male/female? according to Trans activists, i can't because they then go into this nonsense of noun vs adjective.  as far as biology is concerned, it's classify males and females (with few abnormal conditions that result in intersex). It's also hilarious when trans activists point to intersex and i don't know how i can tell them that no matter how much they twist the definitions, Futnaris don't really manifest. there are no true hermaphrodites in Humans.    3. But but but....the WHO supports us - just because medical associations have accepted the change in language so that the suicidal rate of trans people can come down, it doesn't mean the general society has to take that up too.  a community of taxonomists don't classify litchi as a fruit  but when common people go out and buy litchi, they use the term fruit.    4. The soul argument - i don't even understand what to say to that. this is the classic, woman/man born in the wrong body of man/woman.  i mean what exactly is born in the body? are you suggesting that there's some sort of soul that transfers into a body like water being transferred in two pots and sometimes, it's transferred in a wrong pot?  if you're making that argument, how exactly do you measure and define this soul?   5. The brain scans - ah, the classic myth of Gendered brains and how it's a debunked idea.  https://www.nature.com/articles/d41586-019-00677-x   in conclusion, the only reasonable argument that's presented by Trans advocates is that of courtesy, but I've  already stated i have no issues with using a certain set of pronouns if requested. Going beyond that is just buying into an ideology based on bait and switch.   Also, if you're going to claim that there's no Gender Ideology and i am talking about lives of people, then don't bother with that argument. just like Islam is an ideology but it also impacts lives of Muslims, in a similar way Gender Ideology is and ideology.	1642844392.0	s9yy7t	/r/changemyview/comments/s9yy7t/cmv_the_whole_trans_debate_debate_is_frustrating/	CMV: The whole trans debate debate is frustrating because it's a big bait and switch on both biology and language.
12hwzhih	Don't get me wrong, it massively impacts women and their bodily autonomy.  However, I believe the central question of when a foetus becomes a sapient human being far outshines any possible social problems. If it was discovered tomorrow that sentience somehow started very shortly after contraception there would be no consideration of women's rights as it would be human life on the line.  We have an issue where people debate about when humanity starts and what counts as murder and a ton of comparatively minuscule social ills are treated like they are on the same playing field.  I get that there is an insane amount of history tieing these two issues together and certain organisations such as the church have vested interests in both but couldn't we ignore all that for such a fundamental, almost philosophical, issue?	1642855759.0	sa1tlj	/r/changemyview/comments/sa1tlj/cmv_abortion_shouldnt_be_seen_as_a_womans_rights/	CMV: Abortion shouldn't be seen as a woman's rights issue
13rafg	I don't see crypto currencies being used for anything productive. The main audience seems to be criminals or right wing hate groups that were banned from paypal. Of course there are exceptions, especially the enthusiasts but those are a tiny number of owners.   The dangers of allowing bitcoin to succeed and grow are real. White nationalist Stefan Molyneux cashed out $50 million in Bitcoin in early 2021. This wouldn't be possible before crypto. It is giving the extreme right the power they've never could have achieved before. This book below has many example of this.   https://www.upress.umn.edu/book-division/books/the-politics-of-bitcoin  I think people would be better off putting their money in traditional investments like stocks or real estate, private businesses, etc. Crypto shouldn't be a thing as it leads to more harm than good.	1642861927.0	sa3qgt	/r/changemyview/comments/sa3qgt/cmv_crypto_currency_such_as_bitcoin_and_others/	CMV: Crypto Currency such as 'Bitcoin' and others should be banned
ocj6nss	I believe that there are as many genders as society says there are, because it is a social construct. It is something that society made up. Why exactly we thought it made sense or was a good idea to create these arbitrary roles and rules for ourselves I don't know, I'm not a history major, but honestly if it were up to me there wouldn't be any such thing as gender. I think the whole concept is just divisive and in general gender polarization is harmful to society. I don't think the concept serves any purpose anymore, and the whole idea has gotten way too complicated (not because we're saying that there's more than two now, but because of the way you're supposed to base such a large part of your identity and personality off of what sex organs you were born with, which society also decided should be covered up most of the time.)  I don't think there are two genders because I can clearly observe that most of what gender is is only strongly correlated with biological sex (again, only because society says so) rather than being an actual extension of our biology. There's nothing biological about expecting females to wear what us humans call "dresses" and expecting males NOT to, often finding it strange/odd/funny when they do. There's nothing biological about believing that the color blue is masculine while pink is feminine (infact, less than 100 years ago blue was FEMININE. The main two genders we're most familiar with are always changing too. This helps prove that it's just something society made up. Another example is that not long before blue was considered feminine, it was normal for young males to wear dresses.) Basically, my point is that, somewhere in an alternate universe, males are the ones who wear dresses and carry purses, while females don't, and get judged if they do. Nothing else is different in that alternate universe, and nothing in that alternate universe doesn't make any less sense than it does in this universe.  So if this is the case, why couldn't there be more than two genders? What if I was the type of person to wear dresses and carry purses but also really liked the color blue, and was very muscular? Sure, you can try to tell me that that's just a man in a dress or just a woman with muscles depending on what my biology may be, but since when can't I call that a third gender? It clearly doesn't fit perfectly into either of the usual two. Going with the alternate universe thought experiment again, what if instead of gender, it was that every male in this world is taught that they must grow up to be a doctor, and every female a lawyer. Where males get harshly judged by many if they would rather be lawyers. Where, when a male decides to be an engineer rather than a doctor, they get told "there's only 2 professions you can't just make up a new one called 'engineer' you're just a doctor that likes to tinker around" That world is a pretty stupid world, and I think that logic translates to this world.  So far the only things I've heard in opposition to this are "God created two genders" which doesn't really carry much weight, and "XY chromosomes = boy, XX chromosomes = girl, it's that simple" which anyone with an education in biology can tell you, is actually not that simple. I'm hoping to hear something that makes more sense than this.  EDIT 1: It appears that I could've done far better with my explanation, and that I probably didn't pick the most relevant title. I also got many more comments than I was expecting, and I thank all of you who commented! There are plenty of fresh points to think about here. I will do my best to reply to as many comments as I can and will be trying to clear up any confusion in future edits here.	1642864238.0	sa4hu1	/r/changemyview/comments/sa4hu1/cmv_there_are_not_only_two_genders/	CMV: There are NOT only two genders
11g6h8	While I think the concept is interesting, like many others, I don't appreciate what NFTs have become and the hype around them, and how NFT owners are acting like they are amazing - while they aren't.  But I don't understand why people are acting like it's a horrible non-sensible pyramid scheme, and not simply dumb just like abstract art.  In my mind it's a perfect analogy, but opinions online seem to make it out to be much worse.  - Both are only worth something because someone paid for it. - Both can be made by anyone and don't (always) require much talent. - Both are used for money laundering/status symbols and not actually for art. - Both are easily reproducible.  Edit: as pointed out, a lot of abstract art requires talent. I miss worded and didn't mean to offend anyone. I still find some abstract pieces to be meaningless, like that banana that sold for 250K, but I'm sorry for generalizing.	1642876922.0	sa914a	/r/changemyview/comments/sa914a/cmv_while_nfts_are_dumb_they_arent_any_different/	CMV: While NFTs are dumb, they aren't any different than abstract art
62kyxam2	Every time this "We're in a simulation" argument comes up with scientists *who count out a deity btw* they act like humans or any other species advanced enough to make computers strong enough and big enough to simulate the universe and induce consciousness is going to be focusing their time on that.  Why would these galactic level species (powerful enough to control or use the galaxy as easily as humans use earth) give a rodents rump about simulations. We already know how to code genes, we are going to be creating whole worlds in the distant future if we are to survive the death of the sun.  Not to mention the fact that they would likely be more concerned with surviving the death of the universe and how to stop gravity from pulling everything to pieces.  Anyway literally nothing makes sense. Maybe if a species became so god like powerful that it was able to stop the death of the universe it might try to play god. But then it would just play god IRL not on a computer.	1642886053.0	sacb46	/r/changemyview/comments/sacb46/cmv_any_being_advanced_enough_to_create_planet/	CMV: Any being advanced enough to create planet sized computers to simulate a universe won't waste their time trying to simulate a universe.
gb3xu7s4	Faith and hope are two of the heavenly virtues (although the specific list of heavenly virtues isn't that relevant to my view). Even you're not into the religious aspects of it, I think most would agree they are things that most people look upon favorably. However, I think both are generally bad qualities to emphasize. The specific form of these "virtues" both get tangled up with the concept of trust. I'm focused on the primary definition which is not just a synonym for trust. There are lots of different variations to the definitions so I'll specify what I mean here.  Hope: a feeling of expectation and desire that something will happen  Faith: belief in something despite the absence of (or contrary to) available evidence  Both of these are basically irrationally clinging to a feeling. The main problem I have is that their value is basically in that it gives you extra willpower or determination. But then, why not make determination or willpower the virtue we should strive for? In themselves, it's just a way for us to fight against the looming reality that shit will go bad. If you have determination and willpower but not faith/hope then great. You get the benefits without the drawbacks of getting tangled in dogma (faith) or irrationally clinging to unrealistic outcomes (hope).  To be clear, this is not specific to religion. A couple examples - Hope: Mom loses her son someplace, and keeps hoping he's out there for years. Sure it might provide a little solace, but it's a form of self deception. Better to come to terms and overcome, than to cling to a false hope. If it turns out that the one-in-a-million result occurs and the son is found later, it's not the mom will say "fuck that kid, i've moved on!". Faith: Religion, 'nuf said... Nah I'm jk. Let's say I have a feeling deep in my bones that if I bet on 00 on the roulette wheel I'm going to win. I have absolute faith it'll happen. There is no evidence that can sway me. Is it a good bet? Obviously not. The emotion that drives that faith is leading me down a path that is worse off.  Hope and faith should not be considered major virtues, if anything we should replace them with determination and willpower.  (edit: words are hard)	1642893678.0	saf2t7	/r/changemyview/comments/saf2t7/cmv_faith_and_hope_should_not_be_considered/	CMV: Faith and Hope should not be considered virtues, and on average they do more harm than good
ewngos3d	I have no idea why anyone would give this idea credence. Some human beings keep ant farms, some of us study basic microbes, keep useless goldfish, etc.   You seriously expect me to believe an advanced species of aliens would discover earth, a planet teeming with life, and just move on? Doubt.   There’s no upside to ignoring a newly discovered planet with sentient life. If this society has mastered interstellar flight, they’d be a very scientific species - a driving emotion of science is curiosity. They’d be curious about us.	1642898949.0	sagww8	/r/changemyview/comments/sagww8/cmv_the_idea_that_any_species_advanced_enough_to/	CMV: the idea that any species advanced enough to master interstellar travel wouldn’t be interested in earth is nonsense
d20dcu60	***If you are TLTR:*** ***being that a speech is a type of presentation, I believe it should focus on being impactful, memorable, and "to the point." And since most orators do not have the ability to sustain a long speech and keep it concise and interesting, in my opinion, speeches should not exceed five minutes in length.***   First, please note that by "speech" I am referring to an address which only uses spoken words directed at an audience (such as an acceptance speech). I am not talking about presentations more generally, which use images, videos, and other content other than spoken words. In other words, speeches are a type of presentation which only use spoken words.   Given this context, I believe that speeches should never exceed five minutes in length for the following reasons:  1. Speeches shouldn't be overly detailed, they should only focus on your "thesis" and nothing else. If said "thesis" requires more than five minutes to be conveyed properly, you should probably rely on additional resources such as the ones states above to do so, thus making a *presentation*, not a speech. 2. *Most* speeches that go over five minutes become invariably boring fairly quicky (emphasis on the word "most," I didn't say all).   Now, I do want to address the fact that (as many will probably point out) almost all of the most famous speeches in history exceed five minutes in length. In my opinion, most of these speeches only became significant due to their historical context, not necessarily because of the content or quality of diction associated with them. Of course, there are some obvious outliers (such as the *I Have a Dream* speech, which was delivered brilliantly), but most of these speeches simply are not that great in and of themselves.   Conversely, there are many great, shorter speeches which are relatively less important and remembered. For example, George W. Bush's address after 9/11, while more or less known, was an excellent address: he went "to the point" and outlines all of his ideas in a concise way. But, for better or worse, it did not obtain a historical significance like other speeches on important dates have.   I do also want to point out that, as previously mentioned with Martin Luther King, Jr.'s speech, some orators have a knack for delivering great speeches, and these can sometimes exceed even fifteen minutes and still be concise and not boring.   Overall, being that a speech is a type of presentation, I believe it should focus on being impactful, memorable, and "to the point." And since most orators do not have the ability to sustain a long speech and keep it concise and interesting, in my opinion, speeches should not exceed five minutes in length.	1642904914.0	saivf8	/r/changemyview/comments/saivf8/cmv_speeches_should_never_exceed_five_minutes_in/	CMV: Speeches should never exceed five minutes in length
aqzhn	Joe Buck brings nothing distinctive to the role of play-by-play and so in that way is not the biggest problem; he is just bland and forgettable. Troy Aikman is the real problem; he is a HOF Super Bowl winning QB and so should be able to tell us insightful nuances about player psychology or game concepts. Instead, here are some of the nuggets Aikman has provided tonight, "The cold weather is affecting how the players are handling the ball", "Let's see if they pick up this third down", "These are just throws when you are under duress and these are risky throws".  Romo and Smoltz (for the MLB) have raised the expectations for quality of color commentary about the game. Buck and Aikman provide nothing useful.	1642909021.0	sak5g9	/r/changemyview/comments/sak5g9/cmv_joe_buck_and_troy_aikman_are_the_most_boring/	CMV: Joe Buck and Troy Aikman are the most boring commentary booth in the NFL
gk12urbh	This is pretty simple view. The Patriot Act was ostensibly supposed to be about stopping terrorism, but in reality has done basically nothing to stop terror and has instead greatly reduced our civil liberties and the 4th amendment, the very things that America was built on. To my knowledge the Patriot Act has also never stopped even *1* actual terrorist attack either. I believe that it should be abolished, it gives the NSA/CIA/FBI wayyy too much power while not even achieving it's goal of fighting terror. I was born after 9/11 so maybe I'm missing something but honestly people need to get over it in my opinion. Yes it was plenty bad but Bin laden is dead, Al Queda is decimated and we've spent billions fighting terror, it was clearly a black swan even that isn't going to repeat anyway. There is absolutely no reason to keep around a terrible law passed in reaction to it that was poorly conceived to begin with just because some idiots knocked over a skyscraper over 20 years ago.	1642909429.0	saka0m	/r/changemyview/comments/saka0m/cmv_the_patriot_act_and_all_its_reauthorizations/	CMV: The Patriot Act and all it's reauthorizations should be repealed
ixcmnhwr	I have a lot of problems with NFTS, and I don't produce them or buy them because of it.   However, the only problem i have with *other* people doing NFTs, is the environmental cost of the blockchain, which is the only part of NFTs that I can see that affects me.   Ethereum has stated that they will switch to proof of stake later this year, which as i'm aware, would dramatically reduce the environmental impact of NFT transactions to a level comparable to other online services such as twitter and reddit.     The NFT marketplace is full of scammers, but as far as I'm concerned, the information to educate yourself on the dangers of the NFT marketplace is out there. If you get scammed by NFTs, I would probably place the blame largely on you.   If you're acting safely and knowledgeably on the blockchain, I think that there some positives that NFTS could provide, such as new ways of monetizing artwork, for example.     You could argue that art theft is a big issue with NFT spaces, but I don't fully believe this is as big of an issue as people say it is. If someone could provide proof that enough NFTs of stolen art have been **sold** (not minted) to warrant it being an actual issue, I would also change my mind on NFTs, however I have not seen evidence that backs this up, even with the large ammount of anti-nft posts that have stormed the internet over the past year or so. I have also visited the pages of multiple NFT sellers that listed stolen work, and none of their pieces had any offers. Even then, I would just say that blockchain websites would need to do better to stop this issue, which I believe is possible.	1642909187.0	sak79h	/r/changemyview/comments/sak79h/cmv_once_nfts_go_green_im_fine_with_them/	cmv: once NFTs "go green", I'm fine with them
2l6wi504	As someone with pretty libertarian views, storming the capitol is... literally the best way to show distaste. Rioting in public areas is severely worse, that's where other people are who are innocent, while the capitol is full of politicians-- the people who oppress and make the rules. If the capitol was stormed in a unifying matter, in a general libertarian sense where all sides of the political spectrum just wanted both parties/ all politicians in general to stop oppressing the citizens, it would be patriotic and the right thing to do. Again, these are the people you want to go after, its actually way more respectful than rioting or causing chaos in the streets/public. The only reason the riot from 2021 was sickening and awful was because of the GROUNDS upon which it was stormed-- to falsely reinstate a president like a dictator.	1642911521.0	sakx3k	/r/changemyview/comments/sakx3k/cmv_storming_the_capital_was_only_wrong_because/	CMV: Storming the capital was only wrong because of how far-right nationalists were doing it to interrupt an election and were pushing fascism. However, the idea alone of storming the capitol is not BY ITSELF evil, and it is very bootlicker-ish to think it is inherently evil.
