author	selftext	created_at	s_id	permalink	title
6xcqb	I'll preface this by saying I'm a college grad, with a degree from a public university in my late 20's. I'm the first in my family to graduate college, and come from a working class background, with an immigrant parent.   I oppose the cancelation of student debt:  1. 31.2% of Americans over 25 hold a bachelors degree ([source](https://www.forbes.com/sites/michaeltnietzel/2021/02/22/new-from-us-census-bureau-number-of-americans-with-a-bachelors-degree-continues-to-grow/?sh=686a87027bbc)  2. College graduates earn on average 30k annually more than non-college graduates.   Effectively, student debt cancellation asks American taxpayers, most of whom do not have a college education to subsidize the education they themselves did not benefit from, to benefit higher income earners. Should a cashier making 35k pay for the college debt of someone making 50k? or 70k? How is this not effectively a regressive tax?  There are public universities in every state that provide a fine education. Between federal grants for lower income households and low(er) tuition rates, the average public school graduate can leave school with modest debt, or debt free. (My tuition as an in state student was 6k/year and rose to 7.5k/year by graduation). This isn't always accessable to everyone, and I realize that, but the average in state tuition is not out of reach for the average American family. I can't shake the feeling that the advocates of debt cancellation are disproportionately the graduates of expensive, second-tier private colleges that provided no better of an education than a public university, for which they borrowed heavily to attend because they wanted the textbook "college experience", paid 200k for it, only to realize their somewhat unmarketable degree was not able to generate the income needed to repay that debt.   I DO support free public college for all, as well as debt forgiveness programs for government service or teaching, etc, but I can't get behind what seems to be a regressive tax to subsidize the poor decision making of higher income earners. CMV	1642381657.0	s5qv7t	/r/changemyview/comments/s5qv7t/cmv_the_us_government_should_not_cancel_student/	CMV: The US government should not cancel student debt
8tah12m8	People often equate being able to cry when their loved ones die as a form of love and empathy, but think about it, are you crying out of “empathy”, or for yourself only?   If you truly love them and care about them, you can see that they’re in a better place with no more pain and suffering. Or if you’re religious, you May wasn’t k believe in eternal life in heaven which is full of joy (for them, not you on earth)   Children who cry over a parents death are sad because their parent is no longer there to provide them with what they need. It doesn’t have to be money or food, could be emotional support and time spent together. They’re not thinking “my mum is in a bad state now, I feel bad FOR HER”, no, they are thinking “i want my Mum to be here so I can taste her cooking again”.   People who cry after breakup are sad because they want their boyfriend to still be beside them, giving them the attention they like. They don’t feel happy when their ex boyfriend is happy. Same goes for death of a significant other. People are not happy that they’ve gone to live a happier life elsewhere, just sad that “I cannot get the affection and attention I want”.   Any counter examples where grief is beyond just “me me me”?	1642395977.0	s5vmg8	/r/changemyview/comments/s5vmg8/cmv_people_who_feel_grief_and_heartbreak_when/	CMV: People who feel grief and heartbreak when they lose someone they “love” are selfish, because it’s all about THEIR LOSS, not about the feelings of the person leaving them.
13skb5	The pandemic and prior self reflections made me come to this conclusion. Whenever I ask teachers why some students are failing in school - pre university - the most common answer is that students home environment explain students performance. In other words, schools have little impact on a student achievements. It’s their home environment and their genetics that drive performance   This study [linked here](https://files.eric.ed.gov/fulltext/EJ1266643.pdf)seems to validate what I heard.   The homeschooling industry often presents statistics that homeschooled students do better than public school students, like [here 1](https://admissionsly.com/homeschooling-statistics/), or [here 2](https://www.nheri.org/research-facts-on-homeschooling/)  If schools are indeed not adding much value, everyone who can afford to homeschool should be encouraged to do so. If you can’t afford that, the public system should quickly split kids based on ability as early as the 3rd grade so that kids who are predisposed to succeed do so, and other kids are babysat accordingly. Additionally, since schools don’t add much value, we might as well have 50 kids per teacher and reduce taxes.  I’d love to be convinced otherwise. I’d love to be convinced that schools play a key role on someone’s academic performance. I know it is a provocative opinion but I’d love to get good arguments to go against my point of view here.   PS: I’m willing to hear all sort of arguments but I’m more concerned about academics   Thank you!	1642396418.0	s5vr8l	/r/changemyview/comments/s5vr8l/cmv_primary_and_secondary_schools_are_essentially/	CMV: Primary and Secondary schools are essentially babysitting centers
1gl8ozs3	I have plenty of people draw certain parallels to real life of the stupidity of whether it be: the mundane or political, or generally an attempt to be amusing to the movie of Idiocracy.   It annoys me, that say a person points to the Former POTUS and criticizes or jokes about the pinhead sentences or actions he does, they say, "well, it is Idiocracy" or "we are at Idiocracy". No, that guy claims this, but also this in order to flare up tensions. That isn't something to disregard, that is *fascism*.   If somebody does something stupid on say a public street, whether irl, or on reddit, there is at least one comment that says something to idiocracy. Nooooo, that guy is or was in a certain way, high, mentally ill, etc. Yes being stupid could be described as an action or characteristic, but it is not proof for some arbitrary parallel that we are at or moving toward a Satirical Movie.  Most of the time, it comments on the government or politics. In which I say, do you think theres a difference of *playing* dumb to have a higher political leverage, or *being* dumb. 90% of the time, it is *playing* to score political power.   I know there are some "winners" like that one represenative from colorado who married a very unsavory person, but the person im talking about didn't win idiots, they won over exploiting those peoples feelings and "ism's".   We have to stop thinking that people are naturally stupid when we see the news, or somebody on the front page of reddit. It is not comparable to mid-2000s movie, we actually have a lot of people who are completely complex, with complex motivations, with complex relations and lives. Some people are playing stupid, some are, and some aren't.   Whatever the news or statements say, it is done for a purpose, and it isn't because what we perceive as stupid, it is done for something much deeper (most of the time).	1642408577.0	s5z79k	/r/changemyview/comments/s5z79k/cmv_no_we_arent_living_in_a_idiocracy_or_anything/	CMV: No, we aren't living in a Idiocracy or anything similar to that.
9u3vm	On August 29, 2020, Aaron "Jay" Danielson was ambushed, shot and killed in Portland. Shortly thereafter, there was [celebration in the streets](https://twitter.com/stillgray/status/1299960350226358272?lang=en). As one person joyfully explained to the crowd, the man who had died was a member of the opposing protest group. Someone they believe deserved to die. They crowed cheered when they said that "the community had held its own and taken out the trash".   The attack on Aaron "Jay" Danielson is part of a long pattern of unprovoked attacks on conservative leaning, pro-trump and anti-Black Lives Matters protesters. *  Consider [this case](https://twitter.com/mrandyngo/status/1267003300131385348) where a man was sucker punched for standing on a street corner with an American Flag. I've had sever personal exchanges with left wingers I know personally, and on Reddit saying that he had it coming to him. How he should have 'read the room'. How he should have never been there, that his mere presence there to register his opposition was an example of 'fucking around and finding out'. The man who punched him never faced charges.   * Consider [this case](https://www.youtube.com/watch?v=EUd-PQLMujg). In Minnesota, a truck driver narrowly avoids hitting a crowd as speed, apparently surprised to find the highway blocked in front of him. The crowd pulls him from the truck with shouts of 'kill him' and is beaten so badly so as to require hospitalization. The Truck driver is the only one to face criminal charges from the incident, and media widely describe this as a vehicular ramming attack.   * Consider [NPR's softball interview of the author of 'In Defense of Looting'](https://www.npr.org/sections/codeswitch/2020/08/27/906642178/one-authors-argument-in-defense-of-looting) where the author defends property destruction and theft as not just a protest tactic, but a net benefit to the world.   * Consider the left-wing claims about Kyle Rittenhouse. That he was somehow a white supremacist. That he had a moral obligation to allow his attackers to beat him to a pulp.  Consider the mockery of his tears on the stands.   * Consider [this piece](https://theintercept.com/2021/05/13/riot-squad-right-wing-video-journalists-black-lives-matter-antifa/) which condemns conservative media efforts to cover riots and suggests that violence against those producing such content has been brought about by their own acts in cover the riots, offering only the tepid condemnation of violence possible in the process:  > Violence against journalists, even ones operating in bad faith, is inexcusable. Unfortunately, videographers like D’Almeida have contributed to an atmosphere of paranoia and mistrust, making assaults on journalists more frequent. And this has also made the work of scrupulous and fair reporting on the politics that plays out on our streets much harder, and more dangerous.  I think that this attitude is common among the folks who actively identify themselves as 'leftists', to the point that I think that the majority of self-identified 'leftists' and even many mainstream democrats would approve of not only our dear activist's words but the killers actions. Moreover, I believe that they would actively support further acts of unprovoked violence. **To put this another way, the Democrats and leftists want me dead, or at least beaten to a bloody pulp so I learn the lesson to not engage in political activism again. **  I believe this for a few reasons:  1. There has *never* been an unequivocal condemnation from DNC leadership, nor from any notable ideological thought leaders on the left about any of these cases. Sure, there were Biden statements condemning 'the violence', but never mentioning the political identity of those doing the the violence. Given that the very same people didn't accept Donald Trump's 'bad actors on all sides' condemnation in Charlottesville, I'm not going to accept similar statements from the other side.   2. In cases where there is a statements by a left-wing politician on the subject, they always include language that blames either the victim or the right more broadly for the violence.   3. There has been many cases where even relatively mainstream folks have been openly welcoming of such violence. We've gone from 'punch a NAZI' to 'punch a High school kid in a MAGA hat' with some pretty frightening speed.   Things that will not change my view:  1. "But the right..." Yeah, I know there's thugs on the right too. They don't get the kind of institutional cover that the left-wing thugs do. There's no right-wing version National Lawyer's Guild coming to bail out right-wing thugs (and fund Terrorist attacks, but that's another decade).   2. "But someone did condemn all the violence..." Not good enough. They have to condemn their side explicitly and without mention or comparison to their opponents in these kind of cases.	1642410833.0	s5zse7	/r/changemyview/comments/s5zse7/cmv_mainstream_democrats_and_the_mainstream/	CMV: Mainstream Democrats and the mainstream American left generally either supportable or indifferent to left-wing violence in the US
c8ay6	It could be argued that capitalism is already a form of feudalism, though that argument would require a fairly loose interpretation of the term.  It seems to me that capitalism is really an evolution of feudalism.  Instead of serfs providing labor to a lord that owns capital in return for security, justice and redistributed resources, capitalists divorce themselves from their subjects' needs and accumulate capital, eschewing responsibility for the care of their laborers, only redistributing resources (in the form of wages) as necessary.  As consolation for the lost security, anyone with means may count themselves amongst the capitalists which dulls, but does not eliminate, issues of class in society.  It may seem like small consolation for anyone that lacks the resources to join the capitalist class, but privately-controlled cryptocurrencies threaten to erode even this basic privilege.  Recently, some savvy corporations are being tempted by the successes of Bitcoin and the NFT economy (and, let's be honest, giftcards) to begin exploring the idea of selling digital products, including proprietary currency, to customers.  Among them, the Gap and Walmart have begun the process of filing for patents and trademarks to secure early-adopter status in the metaverse market.  They're openly exploring this new way to make money, and I see this going one of three ways.  1) Their attempts are ultimately rejected by the public.  Bland but unlikely.  Buying Walmart-bux wouldn't be too far removed from buying a giftcard, or digital tokens as seen in oh-so-many videogames these days, so I don't see the public being outraged by the idea.  2) It is successful in some iteration (if at first you don't succeed, try, try again) and the government decides to regulate cryptocurrency markets.  This is far more likely, but I'm not sure if government would put its foot down and outlaw businesses creating currency out of nothing, or just set up firewalls to prevent decentralized cryptocurrencies from threatening the dominance of "legitimate" currencies ("legitimate" being those that are created by government or legal corporation).  3) It is successful and because of calls for liberty and freedom, the public will encourage their representatives in government to leave its regulation to market forces.  This is where I see things going wacky.  At some point, maybe in 50+ years, one of these corporations is going to insist that they will no longer accept any currency but their own.  You'll be able to do a currency exchange with reputable outfits, or through the stock market.  But they won't be taking government-issued moneys any more.  Naturally, employees will be compensated at least partially with their employer's play money.  At first, it'll just be seasonal bonuses.  But one day it'll creep into wages.  And at that point we're back to feudalism, but lacking security, justice, and now even redistributed resources or the ability to join the capitalist class.  Cuz they'll be paying folk with something they invented out of thin-air and can create on-demand and not even people with means will be able to create a competing cryptocurrency, because the mega-corporation won't accept it.  Dun, dun, dun!  So I'm looking for responses that assuage my concerns.  I  dunno: convince me that private-cryptocurrencies can't be a thing because of some technical reason.  Failing that, explain why crypto will ultimately be a good thing for mankind.  Show how the obsolescence of "the peoples' currency" (government-issued notes) will lead to a better, fairer, and ultimately more robust society.  Or just convince me that private fiefdoms dominating international markets isn't like feudalism.  There's lotsa ways to tackle this one.	1642419732.0	s6253d	/r/changemyview/comments/s6253d/cmv_if_corporations_successfully_launch_their_own/	CMV: If corporations successfully launch their own cryptocurrencies and NFT products, a system that more closely resembles feudalism will result. (warning: dystopian future-talk)
4zu8u	I think that camping in (shooter) games is perfectly OK. For some reason it’s considered to be an unholy sin to lay in wait for another player. I think it’s absurd for a few reasons;  1) gameplay balances almost everything out. There are trade offs for most elements of games. If you pick a long range weapon you’re not going to have rapid fire. If you pick a strong character you might move more slowly. etc. These calculated trade offs are incorporated into the fabric of the game.  Likewise there is a cost/benefit with camping. Perhaps you get fewer absolute kills but a better K/D ratio, which brings me to the next point  2) Different games have different tactics. Camping may be appropriate for certain games/certain conditions. For example, having 2 of 3 locations in Domination. The effective tactic is to hunker down and hold the 2 locations (ie “Camp”). Let the opposing team come to you, get killed, and you maintain advantage by maintaining position. It’s akin to having a large lead in football and running the ball....it’s situational. Under those conditions the way you play likely (should) change.  3) which relates to a larger point....your job is to frustrate/surprise your opponent. Why in goodness name “should” you run out to meet your opponent on a “fair” battleground? If they want/expect a battle in open field, you fight them in the trees, if they want to battle on horseback, you run them into a marsh, and so on. “Come fight me where I expect in the way I expect” doesn’t hold much weight with me.  (Perhaps that last point undermines the notion that camping is considered wrong in video games. Perhaps the vocal minority complaining about it are simply expressing their frustration at being outwitted).	1642437639.0	s68an8	/r/changemyview/comments/s68an8/cmvcamping_in_video_games_is_ok/	CMV:Camping in video games is OK
62kyxam2	For the record I wish I was in this system.  Grades K-4 are the same everyone is in the same institutions. After which time your performance is tested and your overall grades or test scores put you into one of 3 school systems.  **Hauptschule or Basic school**- which continues till 9th or 10th grade and then graduates them. Its for people who performed under satisfactory in Reading/German (English) and or Math.  **Realschule or Satisfactory secondary education** This goes beyond what they teach in tier 1 and people are finished at 11th grade and graduated. This is for people who performed satisfactory in both Reading and Math.  **Gymnasium or Advanced** These are for students who performed Proficient in both Reading and Math and they go through the full 12 years and have a chance to get into University and beyond.  The reason I would have prefered this is I would have been in Tier 1 due to being almost illiterate (couldn't read or spell for shit) until 8th grade, would have been finished at 9th or 10th and been able to start working without attempting college and failing and not wasting years I didn't need to.  **Why I think this is the best system** is because it puts children schools teaching at their level. The top students get the education they can handle without being board as the teacher slows down for the rest. Those in the middle get taught at their pace those as the bottom are taught their pace.  The percentages of who make which are about 55% tier 1 34% tier 2 and 11% tier 3.	1642438843.0	s68rqx	/r/changemyview/comments/s68rqx/cmv_the_united_states_should_switch_to_the_german/	CMV: The United States should switch to the German school system.
4denqooa	I’m a 26 year old guy and I haven’t dated anyone yet. Someone mentioned I should just date a single mother. I personally wouldn’t want to date a single mother because she already loved someone else. She loved someone else enough to conceive a child with him at one point, and I think I wouldn’t be loved as much as he was/is. If I got into a relationship with a woman who already has a child, I feel like I would always be competing with her ex. Plus I don’t like the idea of raising a child that isn’t mine. That we didn’t create together.  I was discussing this topic with a friend and he provided a different perspective: single mothers 9 times out of 10 despise the father of their child. He changed my view somewhat, but I’m still thinking that that hatred was admiration at some point.  Because I haven’t dated anyone, I just want a woman who has the same relative experience that I have. I want to be someone’s first option. Maybe it’s because I’m young and haven’t had any experience that I feel this strongly about it. Anyway, am I wrong for wanting to date a woman who doesn’t have kids?   Side note: I’m at work now so I can’t always reply immediately, but I’ll get back to your reply as fast as I can.	1642443022.0	s6aira	/r/changemyview/comments/s6aira/cmv_a_guy_shouldnt_be_shamed_for_not_wanting_to/	CMV: A guy shouldn’t be shamed for not wanting to date a single mother.
7wq79cx1	TW// disordered eating/eating disorders  I'm not saying that dieting is a bad thing in and of itself, just to clarify, but I do think we desperately need to take a far more nuanced view, especially in the face of mainstream media. Having so much focus on the extremes of being overweight or underweight perpetuates disordered eating, especially as long as mainstream media and companies continue to promote and make a profit from it. Generally speaking, as long as you eat balanced meals and exercise frequently, you should be fine.  However, I may be misguided in calling diet culture toxic because there is obvious evidence that we must consider the extremes when the extremes are present. However, I think the prevalence of eating disorders and disordered eating in general are almost as, if not as, dangerous, and it has become almost as big as an issue as obesity. I wish more people would treat it as just as important.  Lastly, though I don't have an eating disorder or disordered eating myself, this is an issue I feel is very important to me, but I don't want to speak over anyone who has or is struggling with one and their lived experiences. If that is the case ever in either this post or my replies to any comments, please point it out and I will shut up as and when it is necessary to do so.	1642449936.0	s6debi	/r/changemyview/comments/s6debi/cmv_dieting_culture_is_toxic_because_it_shouldnt/	CMV: Dieting culture is toxic because it shouldn't be so much about whether you are fat or thin, but whether you are healthy for your body weight.
6arn3gq4	To understand why the American west is so desert just study [this picture.](https://snrs.ucmerced.edu/natural-history/climate)  The Sierra Nevadas take all the rain for California causing floods and overgrowth. Then during the dry season that overgrowth catches fire. Good job nature!  Boring tunnels under the Sierra Nevadas will let us pipe excess water into the eastern slope. From there it will evaporate and meander into the parched West. Arizona Nevada Utah etcetera will get increased rain allowing greening of the deserts.  Start the tunnels about halfway up the west face of the Sierras. Slope them down to emerge out the eastern face 2/3 the way down. Collect water in giant bins on the western face and let gravity do all the work sending the water to the eastern face. We'll have to pay Elon's Boring company or someone decent upfront costs but recurring costs will be minimal.  Recoup the costs by renting out western Federal land improved by increased precipitation. Recoup the costs by sinking carbon in the improved greener lands and landing a head shot against global warming.	1642450788.0	s6dqsv	/r/changemyview/comments/s6dqsv/cmv_we_can_turn_the_west_green_with_tunnels/	Cmv: We can turn the West green with tunnels.
