author	selftext	created_at	s_id	permalink	title
e0ugcre	This seems to be an unpopular opinion around Reddit and the Internet, but I genuinely do not think that Dune was a good movie, in the sense that I believe that it failed to tell the story of Dune. I'll admit that the cinematography was mostly great, but it fell far short when it came to plot points and story details. Here are my gripes with Dune:  1) The movie missed out on many important aspects of the story. There are entire scenes, crucial to characterization, that were completely skipped over in the movie. The dinner party scene in the book, for instance, was completely skipped out on. A lot of context for parts of the lore was also missed out on - things like what Mentats are, what Thufir's role in the Atreides household was, things like that.  2) For what scenes remained, editing was bad and led to an incoherent flow of the plot at times. I remember being confused at the Sardaukar scene, and how it suddenly led to the whole betrayal/war action sequence.  3) As with point 1, a lot of scenes lacked context to show why certain things happened in a certain way. For example, Yueh's betrayal of the Atreides family seems to be completely out of nowhere - if I had not read the book, I don't think I would understand why this happens, or even who this random person is. Another one that comes to mind is Stilgar's spitting on the table, which is meant to be a gift since water is so precious on Arrakis, but we are given no explanation about this at all and it just seems really strange.  My thoughts are still a little incoherent so bear with me, but I'd appreciate some thoughtful responses! Point 1 and 3 are my main issues with the movie.	1642849910.0	sa0bgn	/r/changemyview/comments/sa0bgn/cmv_dune_2021_was_not_a_good_movie_for_telling/	CMV: Dune (2021) was NOT a good movie for telling its story.
12hwzhih	Don't get me wrong, it massively impacts women and their bodily autonomy.  However, I believe the central question of when a foetus becomes a sapient human being far outshines any possible social problems. If it was discovered tomorrow that sentience somehow started very shortly after contraception there would be no consideration of women's rights as it would be human life on the line.  We have an issue where people debate about when humanity starts and what counts as murder and a ton of comparatively minuscule social ills are treated like they are on the same playing field.  I get that there is an insane amount of history tieing these two issues together and certain organisations such as the church have vested interests in both but couldn't we ignore all that for such a fundamental, almost philosophical, issue?	1642855759.0	sa1tlj	/r/changemyview/comments/sa1tlj/cmv_abortion_shouldnt_be_seen_as_a_womans_rights/	CMV: Abortion shouldn't be seen as a woman's rights issue
13rafg	I don't see crypto currencies being used for anything productive. The main audience seems to be criminals or right wing hate groups that were banned from paypal. Of course there are exceptions, especially the enthusiasts but those are a tiny number of owners.   The dangers of allowing bitcoin to succeed and grow are real. White nationalist Stefan Molyneux cashed out $50 million in Bitcoin in early 2021. This wouldn't be possible before crypto. It is giving the extreme right the power they've never could have achieved before. This book below has many example of this.   https://www.upress.umn.edu/book-division/books/the-politics-of-bitcoin  I think people would be better off putting their money in traditional investments like stocks or real estate, private businesses, etc. Crypto shouldn't be a thing as it leads to more harm than good.	1642861927.0	sa3qgt	/r/changemyview/comments/sa3qgt/cmv_crypto_currency_such_as_bitcoin_and_others/	CMV: Crypto Currency such as 'Bitcoin' and others should be banned
ocj6nss	I believe that there are as many genders as society says there are, because it is a social construct. It is something that society made up. Why exactly we thought it made sense or was a good idea to create these arbitrary roles and rules for ourselves I don't know, I'm not a history major, but honestly if it were up to me there wouldn't be any such thing as gender. I think the whole concept is just divisive and in general gender polarization is harmful to society. I don't think the concept serves any purpose anymore, and the whole idea has gotten way too complicated (not because we're saying that there's more than two now, but because of the way you're supposed to base such a large part of your identity and personality off of what sex organs you were born with, which society also decided should be covered up most of the time.)  I don't think there are two genders because I can clearly observe that most of what gender is is only strongly correlated with biological sex (again, only because society says so) rather than being an actual extension of our biology. There's nothing biological about expecting females to wear what us humans call "dresses" and expecting males NOT to, often finding it strange/odd/funny when they do. There's nothing biological about believing that the color blue is masculine while pink is feminine (infact, less than 100 years ago blue was FEMININE. The main two genders we're most familiar with are always changing too. This helps prove that it's just something society made up. Another example is that not long before blue was considered feminine, it was normal for young males to wear dresses.) Basically, my point is that, somewhere in an alternate universe, males are the ones who wear dresses and carry purses, while females don't, and get judged if they do. Nothing else is different in that alternate universe, and nothing in that alternate universe doesn't make any less sense than it does in this universe.  So if this is the case, why couldn't there be more than two genders? What if I was the type of person to wear dresses and carry purses but also really liked the color blue, and was very muscular? Sure, you can try to tell me that that's just a man in a dress or just a woman with muscles depending on what my biology may be, but since when can't I call that a third gender? It clearly doesn't fit perfectly into either of the usual two. Going with the alternate universe thought experiment again, what if instead of gender, it was that every male in this world is taught that they must grow up to be a doctor, and every female a lawyer. Where males get harshly judged by many if they would rather be lawyers. Where, when a male decides to be an engineer rather than a doctor, they get told "there's only 2 professions you can't just make up a new one called 'engineer' you're just a doctor that likes to tinker around" That world is a pretty stupid world, and I think that logic translates to this world.  So far the only things I've heard in opposition to this are "God created two genders" which doesn't really carry much weight, and "XY chromosomes = boy, XX chromosomes = girl, it's that simple" which anyone with an education in biology can tell you, is actually not that simple. I'm hoping to hear something that makes more sense than this.  EDIT 1: It appears that I could've done far better with my explanation, and that I probably didn't pick the most relevant title. I also got many more comments than I was expecting, and I thank all of you who commented! There are plenty of fresh points to think about here. I will do my best to reply to as many comments as I can and will be trying to clear up any confusion in future edits here.	1642864238.0	sa4hu1	/r/changemyview/comments/sa4hu1/cmv_there_are_not_only_two_genders/	CMV: There are NOT only two genders
11g6h8	While I think the concept is interesting, like many others, I don't appreciate what NFTs have become and the hype around them, and how NFT owners are acting like they are amazing - while they aren't.  But I don't understand why people are acting like it's a horrible non-sensible pyramid scheme, and not simply dumb just like abstract art.  In my mind it's a perfect analogy, but opinions online seem to make it out to be much worse.  - Both are only worth something because someone paid for it. - Both can be made by anyone and don't (always) require much talent. - Both are used for money laundering/status symbols and not actually for art. - Both are easily reproducible.  Edit: as pointed out, a lot of abstract art requires talent. I miss worded and didn't mean to offend anyone. I still find some abstract pieces to be meaningless, like that banana that sold for 250K, but I'm sorry for generalizing.	1642876922.0	sa914a	/r/changemyview/comments/sa914a/cmv_while_nfts_are_dumb_they_arent_any_different/	CMV: While NFTs are dumb, they aren't any different than abstract art
62kyxam2	Every time this "We're in a simulation" argument comes up with scientists *who count out a deity btw* they act like humans or any other species advanced enough to make computers strong enough and big enough to simulate the universe and induce consciousness is going to be focusing their time on that.  Why would these galactic level species (powerful enough to control or use the galaxy as easily as humans use earth) give a rodents rump about simulations. We already know how to code genes, we are going to be creating whole worlds in the distant future if we are to survive the death of the sun.  Not to mention the fact that they would likely be more concerned with surviving the death of the universe and how to stop gravity from pulling everything to pieces.  Anyway literally nothing makes sense. Maybe if a species became so god like powerful that it was able to stop the death of the universe it might try to play god. But then it would just play god IRL not on a computer.	1642886053.0	sacb46	/r/changemyview/comments/sacb46/cmv_any_being_advanced_enough_to_create_planet/	CMV: Any being advanced enough to create planet sized computers to simulate a universe won't waste their time trying to simulate a universe.
gb3xu7s4	Faith and hope are two of the heavenly virtues (although the specific list of heavenly virtues isn't that relevant to my view). Even you're not into the religious aspects of it, I think most would agree they are things that most people look upon favorably. However, I think both are generally bad qualities to emphasize. The specific form of these "virtues" both get tangled up with the concept of trust. I'm focused on the primary definition which is not just a synonym for trust. There are lots of different variations to the definitions so I'll specify what I mean here.  Hope: a feeling of expectation and desire that something will happen  Faith: belief in something despite the absence of (or contrary to) available evidence  Both of these are basically irrationally clinging to a feeling. The main problem I have is that their value is basically in that it gives you extra willpower or determination. But then, why not make determination or willpower the virtue we should strive for? In themselves, it's just a way for us to fight against the looming reality that shit will go bad. If you have determination and willpower but not faith/hope then great. You get the benefits without the drawbacks of getting tangled in dogma (faith) or irrationally clinging to unrealistic outcomes (hope).  To be clear, this is not specific to religion. A couple examples - Hope: Mom loses her son someplace, and keeps hoping he's out there for years. Sure it might provide a little solace, but it's a form of self deception. Better to come to terms and overcome, than to cling to a false hope. If it turns out that the one-in-a-million result occurs and the son is found later, it's not the mom will say "fuck that kid, i've moved on!". Faith: Religion, 'nuf said... Nah I'm jk. Let's say I have a feeling deep in my bones that if I bet on 00 on the roulette wheel I'm going to win. I have absolute faith it'll happen. There is no evidence that can sway me. Is it a good bet? Obviously not. The emotion that drives that faith is leading me down a path that is worse off.  Hope and faith should not be considered major virtues, if anything we should replace them with determination and willpower.  (edit: words are hard)	1642893678.0	saf2t7	/r/changemyview/comments/saf2t7/cmv_faith_and_hope_should_not_be_considered/	CMV: Faith and Hope should not be considered virtues, and on average they do more harm than good
ewngos3d	I have no idea why anyone would give this idea credence. Some human beings keep ant farms, some of us study basic microbes, keep useless goldfish, etc.   You seriously expect me to believe an advanced species of aliens would discover earth, a planet teeming with life, and just move on? Doubt.   There’s no upside to ignoring a newly discovered planet with sentient life. If this society has mastered interstellar flight, they’d be a very scientific species - a driving emotion of science is curiosity. They’d be curious about us.	1642898949.0	sagww8	/r/changemyview/comments/sagww8/cmv_the_idea_that_any_species_advanced_enough_to/	CMV: the idea that any species advanced enough to master interstellar travel wouldn’t be interested in earth is nonsense
d20dcu60	***If you are TLTR:*** ***being that a speech is a type of presentation, I believe it should focus on being impactful, memorable, and "to the point." And since most orators do not have the ability to sustain a long speech and keep it concise and interesting, in my opinion, speeches should not exceed five minutes in length.***   First, please note that by "speech" I am referring to an address which only uses spoken words directed at an audience (such as an acceptance speech). I am not talking about presentations more generally, which use images, videos, and other content other than spoken words. In other words, speeches are a type of presentation which only use spoken words.   Given this context, I believe that speeches should never exceed five minutes in length for the following reasons:  1. Speeches shouldn't be overly detailed, they should only focus on your "thesis" and nothing else. If said "thesis" requires more than five minutes to be conveyed properly, you should probably rely on additional resources such as the ones states above to do so, thus making a *presentation*, not a speech. 2. *Most* speeches that go over five minutes become invariably boring fairly quicky (emphasis on the word "most," I didn't say all).   Now, I do want to address the fact that (as many will probably point out) almost all of the most famous speeches in history exceed five minutes in length. In my opinion, most of these speeches only became significant due to their historical context, not necessarily because of the content or quality of diction associated with them. Of course, there are some obvious outliers (such as the *I Have a Dream* speech, which was delivered brilliantly), but most of these speeches simply are not that great in and of themselves.   Conversely, there are many great, shorter speeches which are relatively less important and remembered. For example, George W. Bush's address after 9/11, while more or less known, was an excellent address: he went "to the point" and outlines all of his ideas in a concise way. But, for better or worse, it did not obtain a historical significance like other speeches on important dates have.   I do also want to point out that, as previously mentioned with Martin Luther King, Jr.'s speech, some orators have a knack for delivering great speeches, and these can sometimes exceed even fifteen minutes and still be concise and not boring.   Overall, being that a speech is a type of presentation, I believe it should focus on being impactful, memorable, and "to the point." And since most orators do not have the ability to sustain a long speech and keep it concise and interesting, in my opinion, speeches should not exceed five minutes in length.	1642904914.0	saivf8	/r/changemyview/comments/saivf8/cmv_speeches_should_never_exceed_five_minutes_in/	CMV: Speeches should never exceed five minutes in length
aqzhn	Joe Buck brings nothing distinctive to the role of play-by-play and so in that way is not the biggest problem; he is just bland and forgettable. Troy Aikman is the real problem; he is a HOF Super Bowl winning QB and so should be able to tell us insightful nuances about player psychology or game concepts. Instead, here are some of the nuggets Aikman has provided tonight, "The cold weather is affecting how the players are handling the ball", "Let's see if they pick up this third down", "These are just throws when you are under duress and these are risky throws".  Romo and Smoltz (for the MLB) have raised the expectations for quality of color commentary about the game. Buck and Aikman provide nothing useful.	1642909021.0	sak5g9	/r/changemyview/comments/sak5g9/cmv_joe_buck_and_troy_aikman_are_the_most_boring/	CMV: Joe Buck and Troy Aikman are the most boring commentary booth in the NFL
ixcmnhwr	I have a lot of problems with NFTS, and I don't produce them or buy them because of it.   However, the only problem i have with *other* people doing NFTs, is the environmental cost of the blockchain, which is the only part of NFTs that I can see that affects me.   Ethereum has stated that they will switch to proof of stake later this year, which as i'm aware, would dramatically reduce the environmental impact of NFT transactions to a level comparable to other online services such as twitter and reddit.     The NFT marketplace is full of scammers, but as far as I'm concerned, the information to educate yourself on the dangers of the NFT marketplace is out there. If you get scammed by NFTs, I would probably place the blame largely on you.   If you're acting safely and knowledgeably on the blockchain, I think that there some positives that NFTS could provide, such as new ways of monetizing artwork, for example.     You could argue that art theft is a big issue with NFT spaces, but I don't fully believe this is as big of an issue as people say it is. If someone could provide proof that enough NFTs of stolen art have been **sold** (not minted) to warrant it being an actual issue, I would also change my mind on NFTs, however I have not seen evidence that backs this up, even with the large ammount of anti-nft posts that have stormed the internet over the past year or so. I have also visited the pages of multiple NFT sellers that listed stolen work, and none of their pieces had any offers. Even then, I would just say that blockchain websites would need to do better to stop this issue, which I believe is possible.	1642909187.0	sak79h	/r/changemyview/comments/sak79h/cmv_once_nfts_go_green_im_fine_with_them/	cmv: once NFTs "go green", I'm fine with them
gk12urbh	This is pretty simple view. The Patriot Act was ostensibly supposed to be about stopping terrorism, but in reality has done basically nothing to stop terror and has instead greatly reduced our civil liberties and the 4th amendment, the very things that America was built on. To my knowledge the Patriot Act has also never stopped even *1* actual terrorist attack either. I believe that it should be abolished, it gives the NSA/CIA/FBI wayyy too much power while not even achieving it's goal of fighting terror. I was born after 9/11 so maybe I'm missing something but honestly people need to get over it in my opinion. Yes it was plenty bad but Bin laden is dead, Al Queda is decimated and we've spent billions fighting terror, it was clearly a black swan even that isn't going to repeat anyway. There is absolutely no reason to keep around a terrible law passed in reaction to it that was poorly conceived to begin with just because some idiots knocked over a skyscraper over 20 years ago.	1642909429.0	saka0m	/r/changemyview/comments/saka0m/cmv_the_patriot_act_and_all_its_reauthorizations/	CMV: The Patriot Act and all it's reauthorizations should be repealed
2l6wi504	As someone with pretty libertarian views, storming the capitol is... literally the best way to show distaste. Rioting in public areas is severely worse, that's where other people are who are innocent, while the capitol is full of politicians-- the people who oppress and make the rules. If the capitol was stormed in a unifying matter, in a general libertarian sense where all sides of the political spectrum just wanted both parties/ all politicians in general to stop oppressing the citizens, it would be patriotic and the right thing to do. Again, these are the people you want to go after, its actually way more respectful than rioting or causing chaos in the streets/public. The only reason the riot from 2021 was sickening and awful was because of the GROUNDS upon which it was stormed-- to falsely reinstate a president like a dictator.	1642911521.0	sakx3k	/r/changemyview/comments/sakx3k/cmv_storming_the_capital_was_only_wrong_because/	CMV: Storming the capital was only wrong because of how far-right nationalists were doing it to interrupt an election and were pushing fascism. However, the idea alone of storming the capitol is not BY ITSELF evil, and it is very bootlicker-ish to think it is inherently evil.
ikq6zcc6	CMV: Because of how cause and effect works, nothing is anyone's fault. (Predestination)  I think we've all heard this argument before but I'll phrase it here:   &#x200B;  Everything in the universe seems to obey cause and effect. This happened, so this other thing happened etc. Given that, any event you talk about, you can immediately trace back to see what 'caused' that event. If you had FULL knowledge of everything in the universe, then for any given event you could see every 'causal' factor that influenced it.  As a result when we deal with 'human' level questions, especially legal questions: "Why did that person kill this other person, was it self defence.. etc".   The question in reality is moot. If we 'trace back' the causal factors, in the end nothing is anyone's fault. Anyone's decisions are a result of their environment and their genetics. Neither of which they can control.   (Yes, they can control their environment directly etc, but the 'decision' to control their environment itself is an outcome of the environment and genetics, and thus in the end they really had no choice).  If we trace back the causal factors, it stops making sense to us as humans.   Why did he stab him? Because he stole something, Why? because he was hungry, why? because he didn't eat. Why did it get to a point where humans need to eat? cos they need energy? Why? Becuase that's how the cell biology evolved? Why? Because life evolved on earth? Why? Because of the right chemical compounds in a meteor that it the planet 3 billion years ago? Why? because it hit another rock which forced it's trajectory...  &#x200B;  And so the "REAL" causal reason he stabbed that other person was because two rocks collided billions of years ago, or some other such reason that doesn't really have any emotional resonance to us, humans.  A word on quantum phenomenon:  I don't think quantum phenomenon invalidates cause and effect, more so that we just don't understand it given the current observations, and it 'seems' to. However nothing else in the universe does, and it'd be extremely strange if such a fundamental rule would arbitrarily break down at that point for some reason.  And even if quantum mechanics invalidates cause and effect. Does that mean our justice system is based on quantum mechanics? And prior to that being known we had no basis of justice other than randomly drawing lines in the causality tree and saying. Yep it stops there. That guys the problem? Not one branch above him and not one branch below!.  And so justice is more defined by where one chooses to draw the line than the actual act being committed?	1642911652.0	sakyo4	/r/changemyview/comments/sakyo4/cmv_because_of_how_cause_and_effect_works_in/	CMV: Because of how cause and effect works, in reality no one is responsible for their actions.
