author	selftext	created_at	s_id	permalink	title
26tp4ho9	Even if you are beginner, lets say A2, try to learn as much as you can your prepositionnal verbs : which one goes with à and de (sometimes both). That will help you a long way in your study because a lot of grammar rules are working with thoses (y/en, pronoms relatifs, etc...). Maybe do a little notebook with verbs + prep as soon as you meet a new one.    For those of you that are advanced level, let me know if you did learn them, if it help you or held you back not to know them.    Good luck to all of you learning french, it is a long journey but worth it !	1643711936.0	shrzzj	/r/French/comments/shrzzj/a_little_tip_from_a_teacher_learn_your/	A little tip from a teacher, learn your prepositionnal verbs.
gksua3u2	Hello everyone  As the title suggests I am looking for course recommendations based on the CEFR levels that progressively build on each other (so A1 to A2 to B1 and so on). Do you have any experience with such courses? I don't know if this information helps in any way but I am a false beginner in French and I am looking for a structured way to learn the language since I plan on taking the DELF test in the near future.   Thank you in advance	1643714817.0	shsrv8	/r/French/comments/shsrv8/cefr_based_coursescoursebooks_recommendations/	CEFR based courses/coursebooks recommendations
g2t5whfa	I moved to the French speaking part of Switzerland with my husband, who is Swiss in September 2020. While here, I attended a language school for a year and was able to reach an A2 level of French but I still really struggle with French, especially with listening comprehension and the different conjugations. Any suggestions on how to reach a B2 level? I'm going to be starting full-time school online for design (in English) next week but still have some flexibility for studying French.	1643715987.0	sht3jb	/r/French/comments/sht3jb/going_from_a2_to_b2_living_in_country/	Going from A2 to B2 (Living in Country)
hcovw	So literally the phrase means a beautiful boy or kid. This seems to be a good phrase to use if you want to go to jail as quickly as possible. How do people use this term, what does it mean, in what situations would you be using it ?	1643716737.0	shtata	/r/French/comments/shtata/what_exactly_does_beau_gosse_mean_and_when_would/	What exactly does "beau gosse" mean and when would you actually use it ?
hcovw	So this is a question that I've had for some time now. Initially I thought that this would either be a direct translation with "par accident" or "par erreur", so :  &nbsp;  "I called you by accident" => "Je t'ai passé un coup de fil **par accident/erreur**"  "I bought this by accident" => "Je l'ai acheté **par accident/erreur**"  "I reserved this timeslot by accident" => "J'ai réservé cette plage horaire **par accident/erreur**"  &nbsp;  But then I heard that nobody actually says this and that the more natural way to say this is "je n'ai pas fait exprès"... so :  &nbsp;  "I called you by accident" => "Je t'ai passé un coup de fil, **mais je n'ai pas fait exprès**"  "I bought this by accident" => "Je l'ai acheté **mais je n'ai pas fait exprès**"  "I reserved this timeslot by accident" => "J'ai réservé cette plage horaire **mais je n'ai pas fait exprès**"  &nbsp;  Is this correct ?? This seems extremely clunky. What is the most natural way to say these things ??	1643717483.0	shtj13	/r/French/comments/shtj13/how_do_you_say_i_did_this_by_accident/	How do you say "I did this by accident" ?
9qbzffa5	Boujour mec, just been listening to some music today and I'm a little confused by the lyrics. The line is at the start is «Moi je suis né, pour n'être avec toi» and in my mind I first thought that read as «I was born, so not to be with you» but hearing the rest of the song and looking at deepl translation it actually is «I was born, so to be only with you» and I'm just wondering if I'm missing something with how I've translated it or is there a rule like other words where the négative also means thé positive. I sweat I know of other contexts in french that have the same pattern although I can't remember any atm, so any other examples you guys can think of would be greatly apprecaited to get m'y head round this. Merci.	1643718010.0	shtog9	/r/French/comments/shtog9/nêtre_en_un_chanson_de_indochine/	«N'être» en un chanson de Indochine
a90mkexd	I'm in my fifth year of learning French and am supposed to translate this French story. I understand most of the words just fine, but when they're put together they make no sense. I've checked translations as well and I'm wondering if maybe it has to do with colloquialisms. Does this make sense to anyone? I should also mention that if it matters it's a Mauritian fable, so that might be why it's a bit confusing? Here's the ending passage (from what I've gathered at first, it's about a guy who really likes eggs and has big pockets to put them in):  Il continue quelques pas et poutte ! Un deuxième œuf tombe. Il regarde les filles qui se regardent et là aussi silence !  Quelques pas encore en avant et poutte ! Un troisième œuf tombe. Il s’arrête et dit aux filles :    \- Est-ce que chez vous aussi les garçons pondent des œufs ?    \- Non répondent-elles ici ce sont les poules qui pondent des œufs.    \- Comme les hommes sont différents, dit le garçon, voyez-vous chez nous ce sont les garçons qui pondent surtout quand ils sont entourés par des filles.  Mon conte est fini, celui qui respire le premier ira au paradis.	1643721021.0	shuld0	/r/French/comments/shuld0/i_dont_understand_this_french_story_at_all_what/	I don't understand this French story at all, what does it mean?
7kl2vjr	Hey there! Going to write the C2 in a couple months, [looking for where you notice errors or room for improvement](https://voca.ro/1hF7YS9BHaf6). Thank you!  Au loin un gosse trouve, dans la belle nuit complice, une merveilleuse et fraîche jeune campagne.  Il faut déjà que vous sachiez que les bords de telles rues ne sont qu'un peu glissants le matin à Zermatt.	1643723467.0	shvery	/r/French/comments/shvery/advice_on_improving_my_accent/	Advice on improving my accent?
51uous4i	I ask because I have this fear of speaking in my own words. It’s weird; I’m great at understanding native speakers when they talk to me or when I read their words but for some reason I always feel like I butcher the grammar of the language when I try to express thoughts in my own words and because of this I think native speakers have little patience with me and switch to English.  I can’t really blame them for that. But nonetheless, if I do happen to speak to someone who hears me out and doesn’t interrupt me and switch to English after a minute, I’d like to express my gratitude.	1643723824.0	shvjo9	/r/French/comments/shvjo9/how_can_i_say_thank_you_for_listening_to_me_as_in/	How can I say « thank you for listening to me » as in, thank you for listening to me try to speak your language?
13oaol	Bonjour à tous,  Does anyone what the difference is between :  1) un morceau de fromage 2) un morceau du fromage  I always thought it was un morceau DE fromage but is it possible to use the second one too?   Thanks a lot!	1643731239.0	shycgv	/r/French/comments/shycgv/larticle_partitif_question/	L'article partitif question
5aom3e3h	I teach kids English and I don't want them to know that I speak their native language. When they ask me if I speak it I play it down and say that I only speak a little bit. How could I say this is French? Je minimise mes capacités?	1643731318.0	shydn2	/r/French/comments/shydn2/how_do_you_say_play_down_in_french_minimiser/	How do you say "play down" in French? Minimiser?
7qzmatzx	Bonjour à toutes et à tous,  I never know whether the final S is pronounced in "plu**s**." Is it always pronounced? or never? or only sometimes? I feel like I've heard it both ways, so does it depend on how it's used, or maybe there's dialect variation? In that case, how might I know when to properly pronounce it?  &#x200B;  When I've heard it pronounced, it's a regular sibilant S; but when it's not, I hear an airy ü vowel (which apparently is written çː in IPA)	1643734270.0	shziyf	/r/French/comments/shziyf/plus_or_plus_is_the_s_pronounced/	Plu(s) or Plus -- is the S pronounced?
3p3i8h80	Bonjour a tous,  I was hoping if there was anyone who could give a brief overview of their overall experience of a DUEF course at a French University. I will be moving for work to France and my partner will want to learn French. The course we are looking at in Toulouse is from A1-B2 over 6 semesters (I assume 3 years). Are these courses recommended for beginners in the language? She would be aiming to do a month or two of intensive French lessons before commencing on the course.   Thanks all for your help!	1643734952.0	shzszw	/r/French/comments/shzszw/duef_course_experience/	DUEF Course - Experience
ibz5t8nk	If I'm marketing something and I end with various ways of communicating such as SMS, email, or a phone call, how would I write, "Call +1 (222) 222-2222?" Would it be "appeler à", "appelez à", or something else? (This is not a h*mework post, ahaha).  Merci bien les ami.e.s !	1643735793.0	si0583	/r/French/comments/si0583/how_would_i_write_appeler_on_a_poster/	How would I write "appeler" on a poster?
elfk62ue	J'ai dit que j'étais bien  Tout à fait l'air serein  faire l'air ... Est-ce que ça veut dire quelque chose comme sembler? Dans ce cas pourquoi à est dit avant fait l'air ?	1643741138.0	si2948	/r/French/comments/si2948/pourriezvous_expliquer_cette_phrase_sil_vous_plaît/	Pourriez-vous expliquer cette phrase s'il vous plaît ?
ido8ei2l	After focusing on grammar for quite a while, I'm realising that the issue now is that my vocabulary is too small for listening comprehension and that I simply have to increase my wordbank. In a situation like this, most people would use spaced repetition (in like Anki) to slowly increase their banks word-by-word, but honestly I don't like spaced repetition very much for my own reasons so do you guys know of other strategies to do so?	1643743697.0	si39xw	/r/French/comments/si39xw/are_there_any_methods_to_learning_vocabulary/	Are there any methods to learning vocabulary besides spaced repetition?
4w5qrkw2	For une couverture – is « une couverte » slang or just a shortened more informal way to say blanket? Or are they equal  Which is preferred?   Le couloir/le corridor – corridor/hallway - L’entrée- entryway – are all of these okay?  Tête de lit vs le dosseret – Headboard   La salle de bain vs Les toilettes? Is “les toilettes” used for the word “toilet” and not just bathroom. Similarly to how British people use it.  Do Canadians say le WC (for toilet)  Clarification -  Une étagère (bookcase) - does this mean bookcase or shelf. Can it be both?  « une pole à rideau » is said to preferred but is Tringle à rideau ever used?   For « la chambre » is the (à coucher) necessary and how often is it actually used?   Correct or incorrect? Les rebords de fenêtre – window sill   Une table de chevet- Side table  la table de nuit- night table  Une commode - dresser/ chest of drawers can « une commode » be used for both?   How would you say  - heater - dust bin – the small trash can you keep in your room.  - the vent (referring to where the heat comes out of) - door knob  Thanks in advance. 💕	1643748006.0	si4zap	/r/French/comments/si4zap/canadian_french_vocabulary_help_part_two/	Canadian French vocabulary help. Part two.
h9fsmxq	While looking for ways to say "Where can I find", I came across examples featuring "Où puis-je trouver", but then I somehow thought about "Where to find" too, so how idiomatic is just "Où trouver"? Is perhaps the English "Where to find" more unidiomatic than I'm aware of in the first place?  For the sake of clarity, would "Où trouver des pommes ?" be a good, alternative way of saying "Où puis-je trouver des pommes ?"?	1643751314.0	si6blc	/r/French/comments/si6blc/how_interchangeable_are_où_puisje_trouver_and_où/	How interchangeable are "Où puis-je trouver" and "Où trouver"?
hy7xb	tl;pl: AJA que le mot anglais "cricket" (l'insecte) ne se traduit pas par "criquet" en français, et que "grasshopper" ne signifie pas "sauterelle" comme je l'ai cru depuis des décennies.  For context, I'm a native French speaker and amateur entomologist. All of the entomological "work" I do is in English however, as well as all of the knowledge/jargon I've accumulated on the subject in my head. I was just in another thread about locusts and was thinking about the biblical plague and couldn't remember what they were called in the Bible. So I went to look that up and, from there, learned a few surprising things.   As a preface: most people don't know what a cricket is, what a grasshopper is, what locusts are, or what the hell a katydid even is. The same confusion/amalgamation exists in French but with different words. There are important morphological distinctions between those.   Ce qui m'a le plus surpris, c'est que je pensais (à tort, bien que de bon droit) que le mot anglais "cricket" correspondait au français "criquet". Ben en fait, non. Pareil pour "grasshopper", qui ne correspond pas à "sauterelle" contrairement à ce qu'il serait légitime de penser.  Properly, a French "sauterelle" is an English "katydid" and refers to the [Tettigoniidae](https://en.wikipedia.org/wiki/Tettigoniidae), and a French "criquet" is an English "grasshopper". You'd think something that "hops" in English is something that "saute" in French. And they do hop and sautent, of course... but that's not how vocabulary works. Meanwhile, an English "cricket" usually refers to what we call a "grillon" in French. Some types of crickets like the cave cricket or camel cricket (the [Rhaphidophoridae](https://en.wikipedia.org/wiki/Rhaphidophoridae)) have a French equivalent (grillon des cavernes ou sauterelle cavernicole), while others such as the Jerusalem cricket (the [Stenopelmatidae](https://en.wikipedia.org/wiki/Stenopelmatidae)) don't (makes sense since they're not found anywhere where French is spoken). The true crickets ([Gryllidae](https://en.wikipedia.org/wiki/Gryllidae)) are just referred to as "grillons".  I also learned a totally new word, "[sauteriau](https://fr.wikipedia.org/wiki/Sauteriau)", which is used to refer to certain grasshoppers that aren't locusts (FYI all [locusts](https://en.wikipedia.org/wiki/Locust) are grasshoppers but not all grasshoppers are locusts).  Et puis enfin, il y a le mot "[courtilière](https://fr.wikipedia.org/wiki/Gryllotalpa_gryllotalpa)" dont j'avais oublié l'existence. Je l'ai reconnu tout de suite mais me suis aussitôt rendu compte qu'en fait, je n'avais jamais vraiment su de quoi il s'agit. J'ai donc appris qu'il s'agit en anglais du "mole cricket" que je connais bien ([Gryllotalpidae](https://en.wikipedia.org/wiki/Gryllotalpidae)). Les jardiniers parmi vous auront raison de dire que je ne devais pas beaucoup jardiner lorsque j'habitais dans un lieu francophone, sinon je l'aurais su. Mais maintenant, je m'en souviendrai !  It all gets a little more complicated by than that, because in both languages, these common names can overlap different insects, and those overlaps don't necessarily match up between English and French. These minutiae will be of little interest to most of you as they're largely academic, and you'll probably keep calling these insects by their more vernacular and ambiguous names, but I thought I'd share anyway because it was fun for me to learn this today. :)  FR3 aurait pu en faire un épisode de "C'est pas sorcier" dans le temps !  P.S. it turns out the translation of "locust" is "locuste" in French. That's to be expected, since the word entered the English language from French.   P.P.S. based on what I learned today, the French Bible incorrectly refers to "locusts" as "sauterelles" 😉 P.P.P.S. j'espère que les non-francophones apprenant le français qui liront ceci apprécieront que j'aie un peu alterné entre l'anglais et le français, histoire de faire travailler un peu les neurones.	1643754370.0	si7jld	/r/French/comments/si7jld/a_story_about_the_names_of_certain_insects_in/	A story about the names of certain insects in French and English, and how there's always something new and interesting to learn
j25ljtdc	One of my biggest problems is I don't know when to use en, le/la or nothing at all. Would it just be J'essaye? Or je l'essaye?	1643762888.0	siaqwq	/r/French/comments/siaqwq/how_do_i_say_im_trying_in_french/	How do I say I'm trying in french?
cvqibjox	I've been listening to this song for a while and I have some questions about it, especially the use of prenom complément "Y". "Calme, la mer efface la peine et ma peau s'y plait" - why "y" here? Doesn't "ma peau se plait" have the same meaning? "mon amour pour toi s'abîma" - not sure if this is right, it's the lyrics from Spotify. Is this the passé simple?	1643765674.0	sibs4n	/r/French/comments/sibs4n/la_jetée_by_laura_cahen/	"La Jetée" by Laura Cahen
hcovw	So I know that "au niveau de" literally means on the same level as. But I have definitely heard this phrase being used in the figurative sense to mean something like "regarding" or "in relation to" or something. Can anybody provide some concrete use cases for how to employ "au niveau de" in a figurative sense?	1643765948.0	sibvog	/r/French/comments/sibvog/how_can_you_use_au_niveau_de_in_a_figurative_sense/	How can you use "au niveau de" in a figurative sense ?
4rpyf6a9	I’m about one week into my French 101 college course and I’m really struggling! I cannot seem to understand gendered nouns and I don’t know why or how they are gendered. I’m currently making flash cards with different colors (blue and pink) to indicate the gender, but oh my goodness, I am lost. Any advice? Resources? I’m laughing because I identify as non-binary and this is just such a funny thing to struggle with. My teacher said it will get easier, I just have to memorize them. She said it’s hard to learn because we don’t use gendered words in English. I really want to do well and I know that once it “clicks” it’ll make sense. I’m so happy I found this group. I’m going to be taking a lot of notes and probably using this platform as a way to practice!	1643771952.0	sie0pt	/r/French/comments/sie0pt/bonjour_les_amis_i_need_some_help/	Bonjour, les amis! I need some help!
bqkxaqza	I'm confused about which pronunciation is more correct. In the course I'm attending, «un» and «in» are all pronounced like /ɑ̃/, darkened like «a». On the other hand, according to some online sources, «un» and «in» should be pronounced /œ̃/ and /ɛ̃/ respectively, fronted like «eu» and «ai». Which one is the most correct?	1643775283.0	sif6cf	/r/French/comments/sif6cf/do_french_un_and_in_sound_more_like_nasalized_a/	Do french «un» and «in» sound more like nasalized «a» than nasalized «eu» and «ai»?
bxtr9mwg	https://i.imgur.com/BmIDimT.jpg  I understand what it’s saying literally, I just don’t understand why you would do this? The explanation I found on Google was unsatisfactory.  Especially the example given just below the screenshot “nous nous réveillons tard”, it seems weird.	1643776768.0	sifnt3	/r/French/comments/sifnt3/can_you_help_me_understand_this_concept_from/	Can you help me understand this concept from Duolingo?
danr4	This is something that has been bothering me… whenever I order at a counter or in a cafe I’m stuck with the old school text book method:  Je voudrais  I’ve listened to others order where they merely ask for the item and an SVP eg “une baguette dorée svp” (more accurately quatre in my local bakery due to a 3+1 deal)  But I’m looking for a structure which is more akin to the British “Please can I have…?” A bit friendly and less formal?  I’ve tried << est-ce que je peux avoir… >> but it was met with a confused look so I rapidly retreated to je voudrais…   Does anyone have any suggestions?	1643781696.0	sih62i	/r/French/comments/sih62i/orderingasking_for_items_various_ways/	Ordering/asking for items - various ways?
4xtcgi2q	Hello, I'll have to take an exam on French next year spring because I will apply for a PhD program in philosophy in Japan and they ask for a second foreign language test.  The problem is, I'm Chinese and I speak only Chinese, English, and Japanese. And those languages do not count as a "second foreign language“ in the application. So, I'll have to take the French exam offered by the university. I have no idea how hard would the exam be but at least it seems that the exam will be focused on grammar and reading, in the form of the multiple-choice question.  Another problem is, I will never use French, whether in my daily life or in my academic life (I study Anglo-Saxon philosophy). Neither am I interested in French. All I want is to pass the exam.   So here's my question:  Can I learn the grammar and reading part of French without the speaking, listening and pronunciation part of French? I know that there might be a strong argument against this way of learning because pronunciation may help you to memorize words faster, etc. But I wonder if it would actually be faster and easier to learn the grammar and reading part only?	1643782035.0	sih9qr	/r/French/comments/sih9qr/can_i_learn_the_grammar_and_reading_part_of/	Can I learn the grammar and reading part of French without the speaking part of French?
j1c2sinb		1643791568.0	sijt7s	/r/French/comments/sijt7s/je_voudrais_le_podcast_pour_ameliorer_le/	Je voudrais le podcast pour ameliorer le français,s'il vous plaît aide -moi
c2mzb55a	Dit moi des tes amis , je te dire qui tu es   Tell me who tour friends are , i will tell you who you are	1643783888.0	sihsmp	/r/French/comments/sihsmp/i_tried_translating_a_turkish_saying/	I tried translating a turkish saying
bdmcmm0u	Hello, I need some help on how to convince the recruiter in a job interview that using the public transportation and not having a car will not cause me any problems to always be on time could you suggest me some phrases in french cause I have some in my head but I'm not sure how to rephrase it in a professional way.	1643800677.0	sim7xr	/r/French/comments/sim7xr/how_to_get_a_job_without_having_a_car/	How to get a job without having a car?
ido8ei2l		1643803118.0	simx2o	/r/French/comments/simx2o/why_is_there_a_d_before_espagnol_in_je_parle/	Why is there a "d'" before espagnol in "Je parle anglais et un peu d'espagnol"?
355ji0au	Hello,  Many French learners struggle with the (in)famous "r" sound pronunciation. Me and I guess many others are wondering, how does "r" sound changes in French dialects?   Are there places where natives pronounce it in a different manner than the "official" French we are studying?	1643804180.0	sin9eg	/r/French/comments/sin9eg/the_famous_french_r_in_dialects/	The famous French "R" in dialects
gaz17q9s	My mother is a native French speaker. She’d enjoy her to teach grandchildren French.‍ Her Grand kids range range from 3 - 16. Is their a structure she could use, course work, videos, etc? Also, thoughts about the age ranges and tailored coursework by age? Thanks!	1643808074.0	siojny	/r/French/comments/siojny/my_native_french_speaking_mother_wants_to_teach/	My native French speaking mother wants to teach her Grandchildren French;
8sag73pj	Bonjour à tous!  J’espère bientôt devenir enseignant de FLS en Ontario et aimerais acquérir plus de ressources intéressantes pour mes élèves.  Toutes suggestions sont appréciées.  Merci d’avance =)	1643821468.0	sitsfn	/r/French/comments/sitsfn/ressources_pour_fsl/	Ressources pour FSL?
819j7vxm	I'm Spanish and I'm currently learning French by myself using these two sites for conjugations:  [https://leconjugueur.lefigaro.fr/conjugaison/verbe/envoyer.html](https://leconjugueur.lefigaro.fr/conjugaison/verbe/envoyer.html)  [https://www.conjugacion.es/frances/verbo/prendre.php](https://www.conjugacion.es/frances/verbo/prendre.php)  I know there are some verbe tenses that are not used anymore, or that are hardly ever used. Which are they? Thanks.	1643834328.0	siz8fe	/r/French/comments/siz8fe/what_are_the_verb_tenses_that_are_no_longer_used/	What are the verb tenses that are no longer used in French?
gcr80hss	I was wondering if anybody knew any horror movies I can watch to get better at French?? Thanks!	1643834962.0	sizhdl	/r/French/comments/sizhdl/any_french_horror_movies_to_watch/	Any French Horror Movies To Watch???
5rik65y8	(my bad if this doesnt fit in here btw)  je veux regarder videos en francais mais est difficile trouver videos qui ne sont pas copies de cyprien dans mon "reccomended"  literally any video is fine just as long as its in french	1643835664.0	sizro3	/r/French/comments/sizro3/share_your_favourite_youtube_videos_in_french/	share your favourite youtube videos in french
7z8xebe	I am currently in the final year of school and have my épreuve l'orale for French in 2 months time, which is worth 25% of my final grade.  I have never been confident in speaking French and I feel like this exam is going to ruin my grade.  I have barely gotten any practice over the last two years because of Covid and our teacher has heavily concentrated on the written paper.  I do plan on studying French at university as I enjoy the language but this is a current roadblock in my journey. It's important that I do well so I get the points needed for my top choice course.   I would like some advice on I can become more confident in my speaking ability.  It would be greatly appreciated.	1643836874.0	sj09qa	/r/French/comments/sj09qa/any_advice_for_oral_production/	Any advice for oral production
