author	selftext	created_at	s_id	permalink	title
6q4lxdhw	I bought a t-shirt in Paris that says “Le lundi, je suis au bout de ma vie” or “On Monday, I’m at the end of my life”. What would be a similar expression in the US? “Mondays are the worst?”	1642365663.0	s5l0mo	/r/French/comments/s5l0mo/need_help_with_translation/	Need help with translation
6dl273lz		1642370925.0	s5mztt	/r/French/comments/s5mztt/how_to_type_french_accent_using_us_keyboard/	How to type French accent using US keyboard?
9h2f21l9	As the title says, can you guys recommend any beginner level podcasts?	1642370968.0	s5n0f3	/r/French/comments/s5n0f3/podcasts_for_beginner_listeners/	Podcasts for beginner listeners?
505dz3wu	What are the best websites to read about football in French, specifically for Ligue 1? Thanks!	1642375928.0	s5ou7n	/r/French/comments/s5ou7n/what_are_the_best_websites_to_read_about_european/	What are the best websites to read about European Football in French?
inqlzsh0	Hi! I'm interested in doing the Explore program in Canada (been wanting to do it for years, and finally have the time to!). I was wondering if I could get some insight from other people who've done it around my age (23y/o). After searching through some Reddit posts and hearing what people have to say, right now my top 3 choices are:  1. Université Sainte-Anne, Nova Scotia ([info](https://englishfrench.ca/event/universite-sainte-anne/)) 2. French Immersion School, Western University (Trois-Pistoles, QC) ([info](https://englishfrench.ca/event/french-immersion-school-western-university-trois-pistoles/)) 3. Université du Québec à Chicoutimi ([info](https://englishfrench.ca/event/universite-du-quebec-a-chicoutimi/))  in that order, but this order is flexible and I'm open to other areas too. I can only do the summer session, though, which I think is different than most of the posts I've seen. I've heard from some people that I might not enjoy myself as much if I'm around people who are a lot younger. For example, I've heard amazing things about Saint-Anne, but it's 16+ for the summer session and I'm not sure of the proportion of older vs younger students. I wonder if anyone who did it beyond 21 could give me some insight?  Also I've heard host families are the best way to learn French, but I'm a tad nervous because I've heard it can be really hit and miss about your luck of how the host family welcomes you, and would you get to meet as many people in the program?  Finally, would there be enough time to do a part time job on the side? I might have to continue with some (remote) stuff in the summer.  Any advice would be much appreciated!  Ps. For reference, I'd call myself around A2/B1 French and looking to get to at minimum B2.	1642376490.0	s5p1jf	/r/French/comments/s5p1jf/canada_fsl_explore_program/	Canada FSL Explore Program
5n7ohec8	I’m looking for a French immersion study abroad program for my daughter for the summer. She’s 16 and will be a senior in high school next year. She has been to Paris before but open to anywhere in France. Everything I find online has so many mixed reviews it’s hard to know what would be good! She’ll finish up her fourth year of French this year and would love to spend 2-6 weeks in a program. Thank you!!	1642389441.0	s5tiom	/r/French/comments/s5tiom/looking_for_a_french_immersion_summer_program_for/	Looking for a French immersion summer program for my 16 year old daughter.
2fo5x7mp	Any one know if "Par Ici" french books are quebecois or european french?  Its published by 'md editions' which is a québec based publisher but its also shows the CEFR *AND* The Canadian levels to.  I'm trying to learn quebecois french (i know european french already).  If the 'par ici' books aren't in european french, does anyone have any books they know of to help with learning quebecois? (I know they are similar to each other, but I want to learn the quebecois version though)	1642391704.0	s5u9hg	/r/French/comments/s5u9hg/any_one_know_if_par_ici_french_books_are/	Any one know if 'Par Ici' french books are quebecois or european french?
hcovw	I believe that they both mean "you will have to (do something)". Is one more formal or literary than the other?  **edit :** I have noticed the construction "vous aurez [qch] à [vb.]". For example "vous aurez toute sortes de batailles à livrer". Is this nuance something that can be expressed with "devrez"  ?	1642408447.0	s5z64h	/r/French/comments/s5z64h/what_is_the_difference_between_vous_aurez_à_faire/	What is the difference between "vous aurez à (faire qch)" vs "vous devrez (faire qch)" ?
tsxa2rw	Hi, I’m a beginner in French. I wanted to know which of these is correct? I want to say “the house of dreams”, and not “dream house”. Thank you!  1. La maison de rêves 2. La maison des rêves 3. La maison de rêve?  I think it’s 2, but I’m not quite sure if de or des comes before plural nouns when preceded by another noun. I’ve searched for this rule, but can’t find much information.	1642410683.0	s5zqx4	/r/French/comments/s5zqx4/plural_noun_after_de/	Plural noun after “de”
10jy23	More lip rounding with jeu?	1642426640.0	s647yz	/r/French/comments/s647yz/les_mots_je_et_jeu_se_prononcenttils_différemment/	Les mots je et jeu se prononcent-t-ils différemment ?
fh0pavtd	I studied French at the Alliance Francaise from 2017-2019. I did all the courses offered, A1-C1. Instead of taking the DELF at each level, I decided I'd wait to take the DALF after I finish the highest level because, at that point, the lower ones wouldn't matter... I regret not taking them now. I took the A1, did pretty well, and decided I'd wait to take the C1. I planned on taking the DALF 3 months after I finished the C1 course, in March 2020. It got postponed to June and then just cancelled because, yknow.  I finally took it in December 2021, two years after finishing the course. I didn't stay in touch with the language as much as I should have and definitely did not prepare well enough. I was still hoping I'd at least pass, but I didn't.  I'm not sure what to do next. Do I take a step back and attempt the B2 instead? Do I retake the C1 after 3-6 months of preparation? Would it be stupid of me to give myself 6 months and attempt the C2?  If anyone has had a similar experience or could offer some guidance, I'd appreciate some advice. Thanks!	1642430069.0	s65dmz	/r/French/comments/s65dmz/i_didnt_pass_the_dalf_c1_now_what/	I didn't pass the DALF C1. Now what?
25frc765	I'm watching a French movie on Netflix with French subtitles ("How I Became a Superhero").  At one point I was very confused about which character was which, because someone was referring a police lieutenant as "le lieutenant" even though she was female. Here's a snippet of dialogue (more than in the subtitles, actually, which had dropped some words):  >Moreau, je vous présente ***le*** Lieutenant Schaltzmann. ***Elle*** a passé quatre ans à la brigade financière.  I'm used to professions changing to match the gender of the person, but maybe that doesn't carry over to military and law enforcement titles or something? Or was this an error?	1642441527.0	s69w4n	/r/French/comments/s69w4n/is_lieutenant_always_masculine/	Is "lieutenant" always masculine?
al4yalxf	So I started learning frnech a few days ago through duo lingo A good app but why THE ACTUAL CRAP do you write "an american woman" like  "une femme américaine"??????	1642449961.0	s6deo6	/r/French/comments/s6deo6/i_have_a_bone_to_pick_with_whoever_decided_to/	i have a bone to pick with whoever decided to make the writing and speaking of french so weird
6xdieasf		1642443994.0	s6axh7	/r/French/comments/s6axh7/struggling_to_comprehend_this_one_sentence_i/	Struggling to comprehend this one sentence. I translate it as "I think that he has more than 35 but I don't know, it's like with the other animals: I never know, when we come to Saint-Gil, if there aren't some pigs or some other animals, that there weren't a month ago." which doesn't make sense.
f8mwjptr	Bonjour à tous ! Quelle est la différence entre un gâteau et un cake ? Je viens de lire une liste d'aliments avec ces deux options.   Y a-t-il un mot équivalent en anglais pour c'est deux-là ? Je croyais que "gâteau" voulait dire "cake" en anglais haha  Merci beaucoup (une anglophone confuse)	1642458028.0	s6gp5q	/r/French/comments/s6gp5q/différence_entre_gâteau_et_cake_en_français/	Différence entre "gâteau" et "cake" en français
9j1iq82j	Quels types de podcast écoutez-vous ?  La semaine dernière, j'ai écouté "L'Employé", ça s'agit d'un podcast fiction sur un employé qui doit interroger des déviants qui n'obéissent pas au gouvernement totalitaire. Chaque épisode un nouveau cas se déroule et drame arrive. Les actuations sont faites par des professionnels et sont très naturelles.   J'ai bien aimé ce podcast par ce que je n'avais pas écouté quelque chose pareil avant de ça.     &#x200B;  https://preview.redd.it/0yxr162w2cc81.jpg?width=640&format=pjpg&auto=webp&s=4ff6d64a7ba663bce9335682e822df3256103619  À part ça, des autres podcasts que j'écoute souvent sont :  * Les actus du jour - Hugo Décrypte (Nouvelles) * Dans La nuit (Fiction, Horreur) * Fin du game (Jeux Vidéo)     J'aimerais connaître plus des podcasts que vous écoutez.	1642462565.0	s6igls	/r/French/comments/s6igls/recommandation_du_podcast_lemployé_et_discussion/	Recommandation du Podcast : L'Employé. Et discussion d'autres podcasts intéressants
gzdhrg6n	Salut à tous. J'aimerais avoir quelques suggestions de bons livres avec un langage familier pour améliorer mon lexique . Parce que quand j'essaie de parler à mes amis français, j'ai du mal à les comprendre ou à leur parler quand ils l'utilisent des expressions familières. Par exemple : ( Être à la bourre.  Ça me prend la tête …)  Je comprend le français normal mais quand j’essaye a parler Je commence à bégayer Et je ne trouve pas les bons mots à utiliser	1642463523.0	s6isz3	/r/French/comments/s6isz3/looking_for_good_books_to_read/	Looking for good books to read.
xojudjo		1642471486.0	s6lmod	/r/French/comments/s6lmod/when_does_the_pronoun_come_before_the_subject/	When does the pronoun come before the subject? (Cette décision, quand l’a-t-elle prise)?
c3j0da6s	Do you need to buy your own textbook and exercise book for Alliance Francaise courses? Where would you buy them?	1642474193.0	s6ml1m	/r/French/comments/s6ml1m/alliance_francaise_textbook/	Alliance Francaise Textbook?
8145bj7m	The question is to find the grammar errors in the dialogue:  mom - kuldeep, aujourd'hui c'est dimanche, qu est-ce que tu vas faire?  him - rien, maman, je reste a la maison  mom - donc, te habille vite et vas a la pharmacie pour acheter des medicaments, puis pars a la banque en velo pour retirer de l'argent.  him - mais, maman, c'est dimanche, je veux regarder la television  mom- tu peux regarder la television quand tu vas revenrir a la maison  him - donc, je vais a la banque a auto  mom - d'accord.	1642491757.0	s6s0ik	/r/French/comments/s6s0ik/can_someone_help_me_with_this_question/	Can someone help me with this question?
ipi5isa2	\- Quoi qu'il arrive   \- N'importe quoi  \- Quelle que soit  Do all of these mean whatever (happens) ?	1642497966.0	s6tjd3	/r/French/comments/s6tjd3/is_there_any_difference_among_the_following/	Is there any difference among the following?
988l22pr	Currently I’m B1 and about to spend 6 months in France. At the end of the 6 months I hope to be at B2 level or at a level where I can work in French, is this too unrealistic or possible? I’d be working in marketing	1642501541.0	s6ufmn	/r/French/comments/s6ufmn/french_learners_who_found_a_job_in_france_what/	French learners who found a job in France, what level of French did you have?
6q4lxdhw	I bought a t-shirt in Paris that says “Le lundi, je suis au bout de ma vie” or “On Monday, I’m at the end of my life”. What would be a similar expression in the US? “Mondays are the worst?”	1642365663.0	s5l0mo	/r/French/comments/s5l0mo/need_help_with_translation/	Need help with translation
6dl273lz		1642370925.0	s5mztt	/r/French/comments/s5mztt/how_to_type_french_accent_using_us_keyboard/	How to type French accent using US keyboard?
9h2f21l9	As the title says, can you guys recommend any beginner level podcasts?	1642370968.0	s5n0f3	/r/French/comments/s5n0f3/podcasts_for_beginner_listeners/	Podcasts for beginner listeners?
505dz3wu	What are the best websites to read about football in French, specifically for Ligue 1? Thanks!	1642375928.0	s5ou7n	/r/French/comments/s5ou7n/what_are_the_best_websites_to_read_about_european/	What are the best websites to read about European Football in French?
inqlzsh0	Hi! I'm interested in doing the Explore program in Canada (been wanting to do it for years, and finally have the time to!). I was wondering if I could get some insight from other people who've done it around my age (23y/o). After searching through some Reddit posts and hearing what people have to say, right now my top 3 choices are:  1. Université Sainte-Anne, Nova Scotia ([info](https://englishfrench.ca/event/universite-sainte-anne/)) 2. French Immersion School, Western University (Trois-Pistoles, QC) ([info](https://englishfrench.ca/event/french-immersion-school-western-university-trois-pistoles/)) 3. Université du Québec à Chicoutimi ([info](https://englishfrench.ca/event/universite-du-quebec-a-chicoutimi/))  in that order, but this order is flexible and I'm open to other areas too. I can only do the summer session, though, which I think is different than most of the posts I've seen. I've heard from some people that I might not enjoy myself as much if I'm around people who are a lot younger. For example, I've heard amazing things about Saint-Anne, but it's 16+ for the summer session and I'm not sure of the proportion of older vs younger students. I wonder if anyone who did it beyond 21 could give me some insight?  Also I've heard host families are the best way to learn French, but I'm a tad nervous because I've heard it can be really hit and miss about your luck of how the host family welcomes you, and would you get to meet as many people in the program?  Finally, would there be enough time to do a part time job on the side? I might have to continue with some (remote) stuff in the summer.  Any advice would be much appreciated!  Ps. For reference, I'd call myself around A2/B1 French and looking to get to at minimum B2.	1642376490.0	s5p1jf	/r/French/comments/s5p1jf/canada_fsl_explore_program/	Canada FSL Explore Program
5n7ohec8	I’m looking for a French immersion study abroad program for my daughter for the summer. She’s 16 and will be a senior in high school next year. She has been to Paris before but open to anywhere in France. Everything I find online has so many mixed reviews it’s hard to know what would be good! She’ll finish up her fourth year of French this year and would love to spend 2-6 weeks in a program. Thank you!!	1642389441.0	s5tiom	/r/French/comments/s5tiom/looking_for_a_french_immersion_summer_program_for/	Looking for a French immersion summer program for my 16 year old daughter.
2fo5x7mp	Any one know if "Par Ici" french books are quebecois or european french?  Its published by 'md editions' which is a québec based publisher but its also shows the CEFR *AND* The Canadian levels to.  I'm trying to learn quebecois french (i know european french already).  If the 'par ici' books aren't in european french, does anyone have any books they know of to help with learning quebecois? (I know they are similar to each other, but I want to learn the quebecois version though)	1642391704.0	s5u9hg	/r/French/comments/s5u9hg/any_one_know_if_par_ici_french_books_are/	Any one know if 'Par Ici' french books are quebecois or european french?
hcovw	I believe that they both mean "you will have to (do something)". Is one more formal or literary than the other?  **edit :** I have noticed the construction "vous aurez [qch] à [vb.]". For example "vous aurez toute sortes de batailles à livrer". Is this nuance something that can be expressed with "devrez"  ?	1642408447.0	s5z64h	/r/French/comments/s5z64h/what_is_the_difference_between_vous_aurez_à_faire/	What is the difference between "vous aurez à (faire qch)" vs "vous devrez (faire qch)" ?
tsxa2rw	Hi, I’m a beginner in French. I wanted to know which of these is correct? I want to say “the house of dreams”, and not “dream house”. Thank you!  1. La maison de rêves 2. La maison des rêves 3. La maison de rêve?  I think it’s 2, but I’m not quite sure if de or des comes before plural nouns when preceded by another noun. I’ve searched for this rule, but can’t find much information.	1642410683.0	s5zqx4	/r/French/comments/s5zqx4/plural_noun_after_de/	Plural noun after “de”
10jy23	More lip rounding with jeu?	1642426640.0	s647yz	/r/French/comments/s647yz/les_mots_je_et_jeu_se_prononcenttils_différemment/	Les mots je et jeu se prononcent-t-ils différemment ?
fh0pavtd	I studied French at the Alliance Francaise from 2017-2019. I did all the courses offered, A1-C1. Instead of taking the DELF at each level, I decided I'd wait to take the DALF after I finish the highest level because, at that point, the lower ones wouldn't matter... I regret not taking them now. I took the A1, did pretty well, and decided I'd wait to take the C1. I planned on taking the DALF 3 months after I finished the C1 course, in March 2020. It got postponed to June and then just cancelled because, yknow.  I finally took it in December 2021, two years after finishing the course. I didn't stay in touch with the language as much as I should have and definitely did not prepare well enough. I was still hoping I'd at least pass, but I didn't.  I'm not sure what to do next. Do I take a step back and attempt the B2 instead? Do I retake the C1 after 3-6 months of preparation? Would it be stupid of me to give myself 6 months and attempt the C2?  If anyone has had a similar experience or could offer some guidance, I'd appreciate some advice. Thanks!	1642430069.0	s65dmz	/r/French/comments/s65dmz/i_didnt_pass_the_dalf_c1_now_what/	I didn't pass the DALF C1. Now what?
25frc765	I'm watching a French movie on Netflix with French subtitles ("How I Became a Superhero").  At one point I was very confused about which character was which, because someone was referring a police lieutenant as "le lieutenant" even though she was female. Here's a snippet of dialogue (more than in the subtitles, actually, which had dropped some words):  >Moreau, je vous présente ***le*** Lieutenant Schaltzmann. ***Elle*** a passé quatre ans à la brigade financière.  I'm used to professions changing to match the gender of the person, but maybe that doesn't carry over to military and law enforcement titles or something? Or was this an error?	1642441527.0	s69w4n	/r/French/comments/s69w4n/is_lieutenant_always_masculine/	Is "lieutenant" always masculine?
al4yalxf	So I started learning frnech a few days ago through duo lingo A good app but why THE ACTUAL CRAP do you write "an american woman" like  "une femme américaine"??????	1642449961.0	s6deo6	/r/French/comments/s6deo6/i_have_a_bone_to_pick_with_whoever_decided_to/	i have a bone to pick with whoever decided to make the writing and speaking of french so weird
6xdieasf		1642443994.0	s6axh7	/r/French/comments/s6axh7/struggling_to_comprehend_this_one_sentence_i/	Struggling to comprehend this one sentence. I translate it as "I think that he has more than 35 but I don't know, it's like with the other animals: I never know, when we come to Saint-Gil, if there aren't some pigs or some other animals, that there weren't a month ago." which doesn't make sense.
6dcsk2v2		1642673870.0	s8ftxs	/r/French/comments/s8ftxs/jai_marre_de_qqch_ou_jen_ai_marre_de_qqch/	J’ai marre de qqch ou j’en ai marre de qqch?
dvodvevu	Somewhat new to learning french. The phrase above translates to "...so it's not always easy to tell it apart". Why are "de" and "le" there? And what does that literally translate to?	1642711688.0	s8sjjs	/r/French/comments/s8sjjs/donc_cest_pas_toujours_facile_de_le_distinguer/	"...donc c'est pas toujours facile de le distinguer."
6hzwc8px	I did my Delf-B2 exam back in November 2021, fast forward 3 months, nothing yet. Is there a site I can check the marks on? My ID is 961009-011737	1642711732.0	s8sk4u	/r/French/comments/s8sk4u/where_can_i_find_my_delfb2_results/	Where can I find my Delf-B2 results?
diqssv6t	Hello all. I am looking for any tips anyone might have in regards to getting pronunciation correct. When I was about 5 years old I had incredibly bad speech impediments that I had to go to speech therapy for. Could not say my w's, l's, th's, ch's, sh's and worst of all my r's that took 3 years of multiple a week sessions to help correct. As I'm Canadian I spent 10 years learning French and still have never been able to get the correct pronunciations down no matter what teacher I had.   I've been trying to learn French more now with Duolingo and Rosetta Stone to start but it's frustrating as I've never been able to do the guttural R sound - never been able to roll my R's either. Does anyone have any tips or tricks on how to get that sound correct as I'm feeling at a loss here. Thanks so much for any suggestions you might have!	1642720792.0	s8vri2	/r/French/comments/s8vri2/any_tips_on_french_pronunciation/	Any tips on French pronunciation?
8qvq6x0h		1642726186.0	s8xo4n	/r/French/comments/s8xo4n/si_le_mots_biatch_à_le_même_sens_que_pte_on_peut/	Si le mots "Biatch" à le même sens que "P*te" on peut dire fils de biatch?
asnifsuy	 [Francais interactif (utexas.edu)](https://www.laits.utexas.edu/fi/)   &#x200B;  That is the link. Has anyone tried it? How helpful is it?	1642727092.0	s8xz2b	/r/French/comments/s8xz2b/what_do_you_think_of_the_university_of_texas_free/	What do you think of the University of Texas free French course?
a3syd		1642727930.0	s8y98x	/r/French/comments/s8y98x/le_mot_wordle_en_français/	Le Mot - Wordle en français!
cfrtlvfc	How can I estimate my score by the number of questions I answer? For instance, if I answer 40 questions out of 60 in the listening part, what will be my score out of 699?	1642751907.0	s95nxt	/r/French/comments/s95nxt/how_is_teftcf_score_calculated_per_question/	How is TEF/TCF score calculated per question?
a5z576mf	Could you share any only french books that you read or are reading right now?  I'm just trying to find some good french books to read	1642752521.0	s95tim	/r/French/comments/s95tim/good_online_french_books_you_read/	Good online french books you read
aasrr	Et de manière générale, il y a-t-il un point commun avec les mots terminant avec un x muet ?	1642752607.0	s95u7e	/r/French/comments/s95u7e/etymologie_doù_vient_le_x_de_aux_fromage_aux/	Etymologie: d'où vient le x de "aux" (fromage aux herbes) ?
a5z576mf	As a native or a person who is fluent in French, what would you say are the important aspect to master?   I know about reading, listening, speaking etc... could you be more specific about it	1642752670.0	s95us1	/r/French/comments/s95us1/what_do_you_have_to_master_to_become_fluent_in/	What do you have to master to become fluent in french?
ipi5isa2	je + verb - j'ai été = J'ai été **mordu** par un vampire. , J'ai été **dévoré** vivant. , J'ai été **payé** pour être ici.  je + just the state - j'étais = J'étais ici tout le temps. , j'étais malade.	1642755837.0	s96l9q	/r/French/comments/s96l9q/would_this_be_a_good_way_of_differentiating/	Would this be a good way of differentiating between 'j'étais' and 'j'ai été' ?
ipi5isa2	I've read this sentence in a book *C'est le plus beau spectacle que j'aie vu de ma vie.* It completely confused me because why would we use the subjonctif passé? I went to the deepl translator online and typed in: *It's the best cake I've ever tasted* which game me *C'est le meilleur gâteau que j'ai jamais goûté.* Which one is correct in these situations? Passé composé or subjonctif passé?	1642761236.0	s97vlc	/r/French/comments/s97vlc/could_someone_help_me_on_differentiating_between/	Could someone help me on differentiating between passé composé and subjonctif passé in this particular matter?
