author	selftext	created_at	s_id	permalink	title
op56kc	TROUVÉ SUR [CE SITE](https://www.mondedestitounis.fr/devinette-enfant.php?id=3)      Quel est le plat préféré des pompiers ?   Le plat préféré des pompiers est le pot-au-feu!       Quel est le comble pour un boulanger ?   D'être roulé dans la farine !     Dans une boulangerie-pâtisserie, comment faut-il ranger les petits pains au chocolat ?   Dans l'ordre décroissant.      Pourquoi les pécheurs sont-ils maigres ?   Parce qu’il surveille leur ligne.     Quel est le comble pour un footballeur ?   C’est de ne pas avoir de but dans sa vie ! ( *goal / goal*)     Quel est le comble pour un juge ?   De manger son avocat.      *(avocado/advocate)*     Quelle est le fruit préféré des maçons ?   La mûre.  *(berry / wall)*     Quel est le comble pour un boucher ?   Avoir un caractère de cochon       Quel est le comble pour un navigateur ?   C'est d'avoir un coup de barre !     Quelle est le comble pour une couturière ?   De perdre le fil de conversation. ( thread/ flow of convo. peut-etre )     Quel est le comble d'un plombier ?   C'est de prendre la fuite !       Quelle est le comble pour un électricien ?   D'avoir une ampoule au pied.     Quelle est le comble pour un peintre ?   De s’emmêler les pinceaux.     Quel est le comble pour un géographe ?   D’être à l’ouest !     Quel est le comble pour un facteur ?   C’est d’être timbré !     A quoi rêvent les pompiers ?   D'avoir un camion flambant neuf !      Quel est le point commun entre un marin et un boucher ?   Ils adorent les côtes ! ( coast/ribs peut etre)     Savez-vous pourquoi les chercheurs ont des trous de mémoire?   Parce qu'ils se creusent la tête !     Quelle ressemblance y a-t-il entre un facteur et un jongleur?   Il leur faut tous les deux beaucoup d'adresse.     Quel est le comble d’un marin ?   Avoir le nez qui coule.       Quel est le comble pour un professeur de musique ?   Mettre des mauvaises notes.  ( poor grades/poor music peutetre)	1643671734.0	shfplz	/r/French/comments/shfplz/quel_est_le_comble_blagues_denfants_qqn_peutil/	"QUEL EST LE COMBLE" blagues d'enfants: qqn peut-il expliquez ces calembours svp
59jdc6q9	Bonjour.  I wrote the DELF-B2 exam in November of last year and passed, getting my physical certificate in December. However, upon verifying the certificate today, I noticed that the name on it is wrong. Can this somehow be corrected? Will they issue me a new certificate? Has anyone had a similar issue?	1643671738.0	shfpnr	/r/French/comments/shfpnr/mistake_on_delfb2_certificate/	Mistake on DELF-B2 certificate
j4k9g4pr	Hello! My great grandfather was French Canadian, and from what I understand their parents were from France.   I want to start learning French, what’s the best way to do it? (I’m American and as of right now, cannot travel to France to learn from the French). I know there are several programs you can buy, wondering if anyone has any experience with them and can guide me in the correct direction.	1643676190.0	shhauq	/r/French/comments/shhauq/im_of_french_decent_and_want_to_learn_french/	I’m of French decent, and want to learn French.
c2bakt53	Hi all,  I was looking for some advice, I feel there's a gap in my learning journey. I've done as much grammar and basic knowledge, and I have a large vocabulary but I feel I have no idea how to construct sentences on my own. There's textbook French and there's spoken french where words are joined or glossed over and I feel I have no real way of grasping at what's being said or how to construct sentences In a way that doesn't sound like a textbook. Has anyone else found this and how do you overcome it?  Thanks in advance	1643678359.0	shi3b9	/r/French/comments/shi3b9/gaps_in_learning_journey/	Gaps in learning journey
bcb4f0w3	Hi! Help please… can you please give me some examples of when to use lui vs elle and il? Merci!	1643682859.0	shjp4n	/r/French/comments/shjp4n/when_to_use_lui_vs_elle_or_il/	When to use lui vs elle or il
imdjaotg	Quelle est la bonne façon d'utiliser le verbe?  &#x200B;  a) Ils s'avouent à l'église  b) Ils avouent à l'église  c) Aucune des deux	1643683306.0	shjup1	/r/French/comments/shjup1/quelle_est_la_bonne_façon_dutiliser_le_verbe/	Quelle est la bonne façon d'utiliser le verbe?
6l4z3	Salut tout le monde ! N'oubliez pas qu'il y a un marathon de conversation qui se déroule **chaque mercredi** de 21h à 3h heure française (03:00PM EST à 09:00PM EST). Si vous êtes à l'Asie-Pacifique, ce serait jeudi. :) Vous pouvez rejoindre ou quitter le marathon comme vous voulez pendant ce temps.  **Tous les apprenants et les francophones sont bienvenus.** C'est complètement gratuit et une inscription n'est même pas nécessaire. Le seul critère, c'est que vous tenez à **parler français**. Si vous êtes un francophone natif, on vous saurait gré de votre aide. :)  >Le principe : Durant le marathon, vous serez mis aléatoirement dans des "breakout rooms" avec d'autres participants pour des sessions de 10 minutes de conversation. À la fin de chaque session, vous pourrez choisir de participer à une nouvelle session ou de quitter le marathon.  Voici le lien Zoom dont vous aurez besoin pour nous rejoindre : [https://us02web.zoom.us/j/89869069469?pwd=b1RoRnMvaENaR0R6M1ZWbE9TT29XQT09](https://us02web.zoom.us/j/89869069469?pwd=b1RoRnMvaENaR0R6M1ZWbE9TT29XQT09)  **Protip : Gardez ce post. La réunion a lieu tous les mercredis et c'est toujours le même lien !**	1643680811.0	shiye0	/r/French/comments/shiye0/marathon_de_conversation_en_français/	Marathon de conversation en français
hcovw	How would I say that I am at Starbucks ? Would I sue à, chez or dans? for example:  J'ai rencontré cet homme **[à/chez/dans]** Starbucks hier.  Also, how would I say that something is being sold "at" Starbucks or another store. For example :    Où est-ce que tu as acheté ce bouquin ? c'est très utile !     Ah je l'ai trouvé **[chez/à/dans]** fnac !	1643691398.0	shmjnm	/r/French/comments/shmjnm/what_preposition_to_use_when_talking_about_being/	What preposition to use when talking about being "at" a specific business, like Starbucks? "I am at Starbucks" - "Je suis dans Starbucks" / "Je suis chez Starbucks" / "Je suis à Starbucks" ?
edj5du3	«Le loyer est de 907 euros par mois»	1643693146.0	shn3hs	/r/French/comments/shn3hs/pourquoi_on_met_de_dans_cette_phrase/	Pourquoi on met "de" dans cette phrase ?
dy0bsq36	I'm currently sitting between A2 and B1.  I'm really keen on doing some exchange programs in France but since its undergrad most programs are solely in French. They require minimum B2.  I need some advice on how to do it to give me some confidence, because right now I struggle to believe that I can learn french to a level where I could study engineering in french, without living in a francophone country.  I have at least a year+ before I can even apply to these programs so I have time, but I just don't know how to best utilise it.  To get where I am now i've just been watching french youtube videos and practicing once a week for 30 mins speaking with my language exchange partner.  I don't feel this is enough alone to get me to a level where I can study in french at university. I've looked at taking  classes at Alliance Française but they go at an extremely slow pace, I'm considering getting a private tutor instead.  What else can I do?	1643702798.0	shprm2	/r/French/comments/shprm2/how_to_get_from_weak_b1_to_b2c1_to_study_in/	How to get from weak B1 to B2-C1 to study in French University
ipi5isa2	This is how I've learned it, please correct me if I'm wrong:   * *Apporter (****bring****)* is only for inanimate things you can carry. * *Amener (****bring****)* is for people, animals, and vehicles.     * *Emporter (****take****)* is only for inanimate things you can carry. * *Emmener (****take****)* is for people, animals, or vehicles.  This makes sense, but then I came across this sentence *J'emmène les livres à la bibliothèque.* shouldn't this be either *emporter* or *apporter*?	1643707953.0	shqzli	/r/French/comments/shqzli/a_question_about_amener_emmener_apporter_emporter/	A question about amener, emmener, apporter, emporter help please?
j8m3sa7q	Hello all,   I am looking for a modern (nothing too academic as those books are harder for me to stay engaged in) book to read in French. I like non-fiction books regarding popular figures, significant historical events, or just plain interesting topics. I am also into fiction books but lean more heavily into sci-fi. I am currently, as described by multiple opinions, in the sweet spot between B1 and B2, however I do believe my reading level is closer to B2. I have access to an FNAC, so if it can be found there that would be great.  Thank you	1643709891.0	shrhc5	/r/French/comments/shrhc5/looking_for_a_book_suggestion/	Looking for a book suggestion
26tp4ho9	Even if you are beginner, lets say A2, try to learn as much as you can your prepositionnal verbs : which one goes with à and de (sometimes both). That will help you a long way in your study because a lot of grammar rules are working with thoses (y/en, pronoms relatifs, etc...). Maybe do a little notebook with verbs + prep as soon as you meet a new one.    For those of you that are advanced level, let me know if you did learn them, if it help you or held you back not to know them.    Good luck to all of you learning french, it is a long journey but worth it !	1643711936.0	shrzzj	/r/French/comments/shrzzj/a_little_tip_from_a_teacher_learn_your/	A little tip from a teacher, learn your prepositionnal verbs.
gksua3u2	Hello everyone  As the title suggests I am looking for course recommendations based on the CEFR levels that progressively build on each other (so A1 to A2 to B1 and so on). Do you have any experience with such courses? I don't know if this information helps in any way but I am a false beginner in French and I am looking for a structured way to learn the language since I plan on taking the DELF test in the near future.   Thank you in advance	1643714817.0	shsrv8	/r/French/comments/shsrv8/cefr_based_coursescoursebooks_recommendations/	CEFR based courses/coursebooks recommendations
g2t5whfa	I moved to the French speaking part of Switzerland with my husband, who is Swiss in September 2020. While here, I attended a language school for a year and was able to reach an A2 level of French but I still really struggle with French, especially with listening comprehension and the different conjugations. Any suggestions on how to reach a B2 level? I'm going to be starting full-time school online for design (in English) next week but still have some flexibility for studying French.	1643715987.0	sht3jb	/r/French/comments/sht3jb/going_from_a2_to_b2_living_in_country/	Going from A2 to B2 (Living in Country)
hcovw	So literally the phrase means a beautiful boy or kid. This seems to be a good phrase to use if you want to go to jail as quickly as possible. How do people use this term, what does it mean, in what situations would you be using it ?	1643716737.0	shtata	/r/French/comments/shtata/what_exactly_does_beau_gosse_mean_and_when_would/	What exactly does "beau gosse" mean and when would you actually use it ?
hcovw	So this is a question that I've had for some time now. Initially I thought that this would either be a direct translation with "par accident" or "par erreur", so :  &nbsp;  "I called you by accident" => "Je t'ai passé un coup de fil **par accident/erreur**"  "I bought this by accident" => "Je l'ai acheté **par accident/erreur**"  "I reserved this timeslot by accident" => "J'ai réservé cette plage horaire **par accident/erreur**"  &nbsp;  But then I heard that nobody actually says this and that the more natural way to say this is "je n'ai pas fait exprès"... so :  &nbsp;  "I called you by accident" => "Je t'ai passé un coup de fil, **mais je n'ai pas fait exprès**"  "I bought this by accident" => "Je l'ai acheté **mais je n'ai pas fait exprès**"  "I reserved this timeslot by accident" => "J'ai réservé cette plage horaire **mais je n'ai pas fait exprès**"  &nbsp;  Is this correct ?? This seems extremely clunky. What is the most natural way to say these things ??	1643717483.0	shtj13	/r/French/comments/shtj13/how_do_you_say_i_did_this_by_accident/	How do you say "I did this by accident" ?
9qbzffa5	Boujour mec, just been listening to some music today and I'm a little confused by the lyrics. The line is at the start is «Moi je suis né, pour n'être avec toi» and in my mind I first thought that read as «I was born, so not to be with you» but hearing the rest of the song and looking at deepl translation it actually is «I was born, so to be only with you» and I'm just wondering if I'm missing something with how I've translated it or is there a rule like other words where the négative also means thé positive. I sweat I know of other contexts in french that have the same pattern although I can't remember any atm, so any other examples you guys can think of would be greatly apprecaited to get m'y head round this. Merci.	1643718010.0	shtog9	/r/French/comments/shtog9/nêtre_en_un_chanson_de_indochine/	«N'être» en un chanson de Indochine
a90mkexd	I'm in my fifth year of learning French and am supposed to translate this French story. I understand most of the words just fine, but when they're put together they make no sense. I've checked translations as well and I'm wondering if maybe it has to do with colloquialisms. Does this make sense to anyone? I should also mention that if it matters it's a Mauritian fable, so that might be why it's a bit confusing? Here's the ending passage (from what I've gathered at first, it's about a guy who really likes eggs and has big pockets to put them in):  Il continue quelques pas et poutte ! Un deuxième œuf tombe. Il regarde les filles qui se regardent et là aussi silence !  Quelques pas encore en avant et poutte ! Un troisième œuf tombe. Il s’arrête et dit aux filles :    \- Est-ce que chez vous aussi les garçons pondent des œufs ?    \- Non répondent-elles ici ce sont les poules qui pondent des œufs.    \- Comme les hommes sont différents, dit le garçon, voyez-vous chez nous ce sont les garçons qui pondent surtout quand ils sont entourés par des filles.  Mon conte est fini, celui qui respire le premier ira au paradis.	1643721021.0	shuld0	/r/French/comments/shuld0/i_dont_understand_this_french_story_at_all_what/	I don't understand this French story at all, what does it mean?
7kl2vjr	Hey there! Going to write the C2 in a couple months, [looking for where you notice errors or room for improvement](https://voca.ro/1hF7YS9BHaf6). Thank you!  Au loin un gosse trouve, dans la belle nuit complice, une merveilleuse et fraîche jeune campagne.  Il faut déjà que vous sachiez que les bords de telles rues ne sont qu'un peu glissants le matin à Zermatt.	1643723467.0	shvery	/r/French/comments/shvery/advice_on_improving_my_accent/	Advice on improving my accent?
51uous4i	I ask because I have this fear of speaking in my own words. It’s weird; I’m great at understanding native speakers when they talk to me or when I read their words but for some reason I always feel like I butcher the grammar of the language when I try to express thoughts in my own words and because of this I think native speakers have little patience with me and switch to English.  I can’t really blame them for that. But nonetheless, if I do happen to speak to someone who hears me out and doesn’t interrupt me and switch to English after a minute, I’d like to express my gratitude.	1643723824.0	shvjo9	/r/French/comments/shvjo9/how_can_i_say_thank_you_for_listening_to_me_as_in/	How can I say « thank you for listening to me » as in, thank you for listening to me try to speak your language?
13oaol	Bonjour à tous,  Does anyone what the difference is between :  1) un morceau de fromage 2) un morceau du fromage  I always thought it was un morceau DE fromage but is it possible to use the second one too?   Thanks a lot!	1643731239.0	shycgv	/r/French/comments/shycgv/larticle_partitif_question/	L'article partitif question
5aom3e3h	I teach kids English and I don't want them to know that I speak their native language. When they ask me if I speak it I play it down and say that I only speak a little bit. How could I say this is French? Je minimise mes capacités?	1643731318.0	shydn2	/r/French/comments/shydn2/how_do_you_say_play_down_in_french_minimiser/	How do you say "play down" in French? Minimiser?
7qzmatzx	Bonjour à toutes et à tous,  I never know whether the final S is pronounced in "plu**s**." Is it always pronounced? or never? or only sometimes? I feel like I've heard it both ways, so does it depend on how it's used, or maybe there's dialect variation? In that case, how might I know when to properly pronounce it?  &#x200B;  When I've heard it pronounced, it's a regular sibilant S; but when it's not, I hear an airy ü vowel (which apparently is written çː in IPA)	1643734270.0	shziyf	/r/French/comments/shziyf/plus_or_plus_is_the_s_pronounced/	Plu(s) or Plus -- is the S pronounced?
3p3i8h80	Bonjour a tous,  I was hoping if there was anyone who could give a brief overview of their overall experience of a DUEF course at a French University. I will be moving for work to France and my partner will want to learn French. The course we are looking at in Toulouse is from A1-B2 over 6 semesters (I assume 3 years). Are these courses recommended for beginners in the language? She would be aiming to do a month or two of intensive French lessons before commencing on the course.   Thanks all for your help!	1643734952.0	shzszw	/r/French/comments/shzszw/duef_course_experience/	DUEF Course - Experience
ibz5t8nk	If I'm marketing something and I end with various ways of communicating such as SMS, email, or a phone call, how would I write, "Call +1 (222) 222-2222?" Would it be "appeler à", "appelez à", or something else? (This is not a h*mework post, ahaha).  Merci bien les ami.e.s !	1643735793.0	si0583	/r/French/comments/si0583/how_would_i_write_appeler_on_a_poster/	How would I write "appeler" on a poster?
elfk62ue	J'ai dit que j'étais bien  Tout à fait l'air serein  faire l'air ... Est-ce que ça veut dire quelque chose comme sembler? Dans ce cas pourquoi à est dit avant fait l'air ?	1643741138.0	si2948	/r/French/comments/si2948/pourriezvous_expliquer_cette_phrase_sil_vous_plaît/	Pourriez-vous expliquer cette phrase s'il vous plaît ?
ido8ei2l	After focusing on grammar for quite a while, I'm realising that the issue now is that my vocabulary is too small for listening comprehension and that I simply have to increase my wordbank. In a situation like this, most people would use spaced repetition (in like Anki) to slowly increase their banks word-by-word, but honestly I don't like spaced repetition very much for my own reasons so do you guys know of other strategies to do so?	1643743697.0	si39xw	/r/French/comments/si39xw/are_there_any_methods_to_learning_vocabulary/	Are there any methods to learning vocabulary besides spaced repetition?
4w5qrkw2	For une couverture – is « une couverte » slang or just a shortened more informal way to say blanket? Or are they equal  Which is preferred?   Le couloir/le corridor – corridor/hallway - L’entrée- entryway – are all of these okay?  Tête de lit vs le dosseret – Headboard   La salle de bain vs Les toilettes? Is “les toilettes” used for the word “toilet” and not just bathroom. Similarly to how British people use it.  Do Canadians say le WC (for toilet)  Clarification -  Une étagère (bookcase) - does this mean bookcase or shelf. Can it be both?  « une pole à rideau » is said to preferred but is Tringle à rideau ever used?   For « la chambre » is the (à coucher) necessary and how often is it actually used?   Correct or incorrect? Les rebords de fenêtre – window sill   Une table de chevet- Side table  la table de nuit- night table  Une commode - dresser/ chest of drawers can « une commode » be used for both?   How would you say  - heater - dust bin – the small trash can you keep in your room.  - the vent (referring to where the heat comes out of) - door knob  Thanks in advance. 💕	1643748006.0	si4zap	/r/French/comments/si4zap/canadian_french_vocabulary_help_part_two/	Canadian French vocabulary help. Part two.
h9fsmxq	While looking for ways to say "Where can I find", I came across examples featuring "Où puis-je trouver", but then I somehow thought about "Where to find" too, so how idiomatic is just "Où trouver"? Is perhaps the English "Where to find" more unidiomatic than I'm aware of in the first place?  For the sake of clarity, would "Où trouver des pommes ?" be a good, alternative way of saying "Où puis-je trouver des pommes ?"?	1643751314.0	si6blc	/r/French/comments/si6blc/how_interchangeable_are_où_puisje_trouver_and_où/	How interchangeable are "Où puis-je trouver" and "Où trouver"?
hy7xb	tl;pl: AJA que le mot anglais "cricket" (l'insecte) ne se traduit pas par "criquet" en français, et que "grasshopper" ne signifie pas "sauterelle" comme je l'ai cru depuis des décennies.  For context, I'm a native French speaker and amateur entomologist. All of the entomological "work" I do is in English however, as well as all of the knowledge/jargon I've accumulated on the subject in my head. I was just in another thread about locusts and was thinking about the biblical plague and couldn't remember what they were called in the Bible. So I went to look that up and, from there, learned a few surprising things.   As a preface: most people don't know what a cricket is, what a grasshopper is, what locusts are, or what the hell a katydid even is. The same confusion/amalgamation exists in French but with different words. There are important morphological distinctions between those.   Ce qui m'a le plus surpris, c'est que je pensais (à tort, bien que de bon droit) que le mot anglais "cricket" correspondait au français "criquet". Ben en fait, non. Pareil pour "grasshopper", qui ne correspond pas à "sauterelle" contrairement à ce qu'il serait légitime de penser.  Properly, a French "sauterelle" is an English "katydid" and refers to the [Tettigoniidae](https://en.wikipedia.org/wiki/Tettigoniidae), and a French "criquet" is an English "grasshopper". You'd think something that "hops" in English is something that "saute" in French. And they do hop and sautent, of course... but that's not how vocabulary works. Meanwhile, an English "cricket" usually refers to what we call a "grillon" in French. Some types of crickets like the cave cricket or camel cricket (the [Rhaphidophoridae](https://en.wikipedia.org/wiki/Rhaphidophoridae)) have a French equivalent (grillon des cavernes ou sauterelle cavernicole), while others such as the Jerusalem cricket (the [Stenopelmatidae](https://en.wikipedia.org/wiki/Stenopelmatidae)) don't (makes sense since they're not found anywhere where French is spoken). The true crickets ([Gryllidae](https://en.wikipedia.org/wiki/Gryllidae)) are just referred to as "grillons".  I also learned a totally new word, "[sauteriau](https://fr.wikipedia.org/wiki/Sauteriau)", which is used to refer to certain grasshoppers that aren't locusts (FYI all [locusts](https://en.wikipedia.org/wiki/Locust) are grasshoppers but not all grasshoppers are locusts).  Et puis enfin, il y a le mot "[courtilière](https://fr.wikipedia.org/wiki/Gryllotalpa_gryllotalpa)" dont j'avais oublié l'existence. Je l'ai reconnu tout de suite mais me suis aussitôt rendu compte qu'en fait, je n'avais jamais vraiment su de quoi il s'agit. J'ai donc appris qu'il s'agit en anglais du "mole cricket" que je connais bien ([Gryllotalpidae](https://en.wikipedia.org/wiki/Gryllotalpidae)). Les jardiniers parmi vous auront raison de dire que je ne devais pas beaucoup jardiner lorsque j'habitais dans un lieu francophone, sinon je l'aurais su. Mais maintenant, je m'en souviendrai !  It all gets a little more complicated by than that, because in both languages, these common names can overlap different insects, and those overlaps don't necessarily match up between English and French. These minutiae will be of little interest to most of you as they're largely academic, and you'll probably keep calling these insects by their more vernacular and ambiguous names, but I thought I'd share anyway because it was fun for me to learn this today. :)  FR3 aurait pu en faire un épisode de "C'est pas sorcier" dans le temps !  P.S. it turns out the translation of "locust" is "locuste" in French. That's to be expected, since the word entered the English language from French.   P.P.S. based on what I learned today, the French Bible incorrectly refers to "locusts" as "sauterelles" 😉 P.P.P.S. j'espère que les non-francophones apprenant le français qui liront ceci apprécieront que j'aie un peu alterné entre l'anglais et le français, histoire de faire travailler un peu les neurones.	1643754370.0	si7jld	/r/French/comments/si7jld/a_story_about_the_names_of_certain_insects_in/	A story about the names of certain insects in French and English, and how there's always something new and interesting to learn
8nh534o8	Bonjour à tous! Je jouais à un jeu vidéo (en français) plus tôt dans la journée et j'ai remarqué que le verbe "parier" (to bet) ne prenait pas le subjonctif. C'est un peu bizarre, parce qu'on a appris que les suppositions prennent toujours le subjonctif (par ex. supposer). Est-ce qu'il existe une raison précis pour laquelle c'est comme ca ou est-il une exception? Je te remercie et passez une belle journée!	1643339961.0	segt0s	/r/French/comments/segt0s/pourquoi_supposer_prend_le_subjonctif_et_parier/	pourquoi 'supposer' prend le subjonctif et 'parier' ne le prend pas alors que ce sont des synonymes?
