author	selftext	created_at	s_id	permalink	title
2fo5x7mp	I'm an advanced french level reader and was wondering if anyone has french series or books that they'd recommend? I'm looking for France / Quebec french authors mostly by the way.	1642878311.0	sa9jce	/r/French/comments/sa9jce/any_french_book_or_series_that_i_you_recommend/	Any french book or series that I you recommend?
dqk4rahf	Hello I just started to learn french. but while getting some notes on pc, I cannot write "e" letter with  (') for example "très". how can we use keyboard effective and well?	1642888733.0	sad986	/r/French/comments/sad986/shortcuts_on_keyboard/	shortcuts on keyboard.
eqwl9l19	Merci	1642894214.0	saf9o8	/r/French/comments/saf9o8/salut_i_am_currently_learning_french_as_per_my/	Salut I am currently learning French as per my job I was wondering if anyone had a tips or fun free way to speed up the process
hhwjhuy5	je relis, pour la 50ème fois, [ce livre](https://www.goodreads.com/book/show/1939390.Izo). si vous connaissez Izo, pourriez-vous me conseiller d'autres auteurs/livres du même gôut?  merci d'avance	1642895746.0	safsqw	/r/French/comments/safsqw/conseil_pour_bouquin_svp/	conseil pour bouquin, svp
arejw1h	A little introduction Hello everybody! I’ve been passively following this subreddit for a couple of months now, to remind myself to study french, and I finally decided to pick it up.  To be completely honest I’m not 100% new to french, as I studied it in middle school (very lazily, but still, I studied it). Plus I’m italian and I can speak english to a above-mediocre/mildly-advanced level.    I don’t have much time as of right now, but I’ve made my new year resolution to learn a third language, and I chose French! However some question came up to mind immediately:  How do you approach a language as a bilingual? Is it ideal to incorporate both your already spoken languages to your daily practicing? Should I start watching French movies/tv shows with alternating english and italian subtitles?  Because I started with reading a little bit about how some the grammar works and I downloaded Duolinguo just to get dome work done, even if it’s not much, however I did all of that strictly in italian. I’m just afraid my learning process might become too one-sided, but at the same time I thought to myself thst as long as I study it, there shouldn’t be any problem. What do you recommend I’d do?   Also if you could recommend some pieces of media (music/shows/movies/…) in French for a beginner, i’d really appreciate it!  Merci beaucoup!    TL;DR:  I want to learn french as an itaisn who also speaks a bit of english. I wanted to know if i need to practice this new language both in english and italian, or if it’s ok to just do it in one language. also if you have some music/shows etc.  that can really benefit for a beginner, I’d really appreciated it if you dropped them down below	1642895766.0	safszl	/r/French/comments/safszl/how_to_approach_a_new_language_as_a_bilingual_and/	How to approach a new language as a bilingual and other questions about French
iodkh3av	I only know the alphabet, colors, shapes, numbers, months, days of the week, few dozen verbs in the present tense, and a few other lists of vocabulary. The gist is I only have the ability to understand baby songs and media, anything else is above me. They're annoying as hell and discouraging me from continuing to learn (even though I'm make no or slow progress). How can I keep learning despite I'm not able to enjoy it since I'm such a beginner?	1642900763.0	sahiqy	/r/French/comments/sahiqy/i_can_only_understand_children_songs_and_its/	I can only understand children songs and it's annoying!
138kmm	Bonjour,   Je suis allée sur cette site pour améliorer ma compréhension orale.  [https://savoirs.rfi.fr/en/apprendre-enseigner/societe/argumenter-le-vote-electronique/1](https://savoirs.rfi.fr/en/apprendre-enseigner/societe/argumenter-le-vote-electronique/1)  Dans la transcription, il y a une partie dans laquelle le locuteur a dit 'C'est-à-dire, on ne peut pas garantir, on ne peut pas avoir un protocole de vote électronique qui **garantisse** deux propriétés qui pourtant nous sommes, nous semblent absolument indispensables'.   J'ai aucune idée pourquoi on utilise la forme du subjonctif ici?   Merci beaucoup pour votre aide!	1642903698.0	saihdf	/r/French/comments/saihdf/question_sur_lemploie_du_subjonctif_forme_du/	Question sur l'emploie du subjonctif forme du verbe garantir
8zpwqmee	Im buying some Asian snacks and sending it to a french pen pal, im writing in a letter I bought him Asian Snacks. I googled the word and snacks comes up as collations so would I write. Je t’ai acheté des collations Asiatique?	1642912054.0	sal34p	/r/French/comments/sal34p/french_word_for_asian_snacks/	French word for Asian Snacks?
71d1x56m	Looking for volunteers for Voice Recordings needed for a youth leadership project in FRENCH, Italian  Portuguese, and Chinese.  Any Gender  Will send link to book (5 mins read in English): Giselle Learns About Alzheimer's (pdf file)   Send MP3/MP4 recording to: learnwithgiselletoday@gmail.com by February 27  Thank you for help in advance.	1642915527.0	sam3zs	/r/French/comments/sam3zs/childrens_audio_book_in_french_volunteer_needed/	Children's Audio Book in French - VOLUNTEER NEEDED
a0n8w9v4	In about a year and a half, I might be going to France for a year or two during university! The uni teaches in English, so school wise I don't need to know any French, but I figured for living there it would be good to start preemptively learning on the side/when I have time to get ahead. + For personal interest reasons, I've been slightly interested in learning French for a bit, so I figured this would be a good chance/justification to do so!   I did see the resource tab, but was wondering what people found they had the most success in/what helped them the most with learning? Currently I know essentially no French, but I do know conversational Japanese and took a couple of years of Spanish, which I'm hoping could help a little!   I've started with duolingo for now/have been thinking of making little quizlet sets for numbers/basic adjectives/colors/etc to start out. Any suggestions?	1642919583.0	san85v	/r/French/comments/san85v/i_might_have_to_learn_french_and_was_looking_for/	I might have to learn French, and was looking for suggestions!
8qpqavi	(36 15 seems to have something to do with the former 'Minitel')  Could this mean something like:  'A (typical) day in the life of Jacques' … ?	1642927400.0	sap8bj	/r/French/comments/sap8bj/36_15_la_vie_de_jacques/	?36 15? la vie de Jacques
45x5n0sp	Donc, je PENSE que la phrase "Je suis pas sur" est la meme que dans anglais, mais une possibilite est aussi "Je suis pas certain" (a mon avis, au moins). Quelle est la meillure?   &#x200B;  (dsl, j'ai pas un clavier francais)	1642927747.0	sapb0l	/r/French/comments/sapb0l/comment_dire_im_not_sure_en_francais/	Comment dire "I'm not sure" en francais?
e2z6vzz4	i was talking to someone random on a game and they spoke french, they asked me "tu est américaine?" i said yes and i asked why they said tu est instead of tu es and i was told "parce que je te le demande" (or something like that) do french speakers really use tu est instead when asking a question? i googled it and didn't see anything on the first few results so i had decided to just ask here	1642937195.0	sarne1	/r/French/comments/sarne1/why_did_someone_native_french_speaker_use_tu_est/	why did someone (native french speaker) use "tu est"??
op56kc		1642904860.0	saiurz	/r/French/comments/saiurz/eli5_cétait_tout_juste_ce_quil_y_a_de_mieux/	ELI5: c'était tout juste ce qu'il y a de mieux == c'était vraiment le top ( l'explication pièce à pièce de la phrase? )
ido8ei2l	So about two weeks ago I came across a comment on here talking about a show (?) on YouTube, in French, covering different topics. I thought I saved it but I'm checking through my bookmarks right now and I can't find it. Does anyone know what it is? I remember one video about the human brain whose comments were praising the show as a whole  edit: apparently it was InnerFrench. I remembered the name but didn't recognize them as the same people	1642942674.0	sat3sk	/r/French/comments/sat3sk/need_help_with_finding_youtube_channel/	Need help with finding YouTube channel
csaq1uzz	Thought it may be a good way to learn the languge, s'il vous plaît	1642946715.0	saud86	/r/French/comments/saud86/hi_does_anyone_know_some_french_fairy_tales/	Hi, does anyone know some french fairy tales?
4q1du6pg	This sentence means that:  1. The boss likes us.  2. We liked the boss.   I am confused because my translator tells me that the correct answer is number 2 but in all the sentences with the verb PLAIRE it is always the opposite.  For example in "J'ai plu à mon chef." means that my boss liked me right? Not the other way around, in that case the answer shouldn't be number 1? at least that's what I learned. Please help 🙏	1642949168.0	sav6as	/r/French/comments/sav6as/nous_avons_plu_à_le_chef/	NOUS AVONS PLU À LE CHEF.
8fa00afz	On the [LawlessFrench](https://www.lawlessfrench.com/grammar/dans/) website, it says that dans can be used for saying when something is physically in or on something.   Example:  Dans la rue/dans le carton = in the road, in the box  Dans l'avion/l'escalier= on the plane/on the stairs  So, why can't I say dans le tableau (on the table) instead of sur le tableau?  Similarly, I see en being used when I would've used dans. I can't think of an example right now but could someone explain this?	1642950792.0	savqtn	/r/French/comments/savqtn/dans_sur_en_confusion/	Dans, Sur, En Confusion
5kvlonok		1642953850.0	sawtyr	/r/French/comments/sawtyr/do_you_generally_use_do_or_ut_when_talking_about/	Do you generally use do or ut when talking about music?
zdy2quz	Hi all,  Currently an American living in Paris (for the 90 days allotted to tourists). I'm looking for ways to stay beyond my 90 days, and one I've been considering is enrolling in a language school and getting a student visa through that. To qualify, I know programs must amount to more than 20 hours a week for 3+ months. Does anyone have experience getting a visa this way? If so, I'd love to hear your thoughts on that process, what schools are good to apply to (I know programs are typically expensive. Cheaper the better!), etc. Thanks!	1642958024.0	sayfcj	/r/French/comments/sayfcj/language_program_student_visa/	Language Program | Student Visa
ixg5x	I know the differences can be quite subtle to non-native French speakers (such as myself), but why is there no accent on the e in cher? Am I missing something? Seems like the two versions of the same word should have the same accents. Are there other examples of this in French and I just haven't seen them yet?	1642963182.0	sb0h6i	/r/French/comments/sb0h6i/why_are_cher_and_chère_pronounced_the_same/	Why are cher and chère pronounced the same?
h6p9z	Hi guys. I wanted to rewatch some of my favourite shows on my streaming platforms but I can’t find French in most of them :( (audio and subtitles). I’m from Chile and I have HBO Max, Disney, Crunchyroll, Prime Video and Netflix.   What can I try instead?	1642966967.0	sb1ymy	/r/French/comments/sb1ymy/im_having_trouble_finding_shows_in_french_dub_and/	I’m having trouble finding shows in french (dub and sub) on multiple streaming platforms
5ltzbac6	Bonjour!    I have been learning some french these last 2 weeks and I belive that im slowly getting better. However, I would really llike a professor to teach me because there are so much things that confuse me. I would like to know what online course do you people belive its the best.	1642969677.0	sb2zt6	/r/French/comments/sb2zt6/good_online_courses_to_learn_quicker/	Good online courses to learn quicker.
qgx9k	I've been learning French for several years and this is a question that still bothers me and which I've never bothered to find a straight answer for. I'm reasonably familiar with the various ways to express obligation (e.g. falloir, devoir), but as a native English speaker I've always wondered this:   In English, if I want to express that someone is obligated to *not* do something, I can say "You must not do that!" And if I want to instead express that someone is *not obligated* to do something, I can say "You (don't have to/don't need to) do that." As an example of the contrast here--  * "You must not brush your teeth before dinner" means that in no circumstances should you brush your teeth before dinner, whereas * "You don't have to/don't need to brush your teeth before dinner" means that it might still be permissible to brush your teeth before dinner, but it's not an obligation.  My question is simply if there is any way to explicitly distinguish these two meanings in French. I *think* I've seen things like "*Il ne faut pas te brosser les dents avant le dîner*" used for both senses above (please correct me if this is wrong!) but I wasn't sure if there was a way to make it clear which meaning is to be taken, besides context. I had previously tried to construct sentences like "*Tu dois ne pas faire cela!*" but from what I understand that isn't really a comfortable or correct way of phrasing things. Any help would be much appreciated.	1642972894.0	sb48zr	/r/French/comments/sb48zr/obligation_with_negations/	Obligation with negations
20la53w0	I have never seen a French film or series on Netflix where the subtitles match the speech 100% as is the case with most English media.  Do you know any?	1642972910.0	sb497u	/r/French/comments/sb497u/any_french_language_films_on_netflix_with/	Any French language films on Netflix with completely matching subtitles?
3es5ouom	Mon professeur a dit on doit utelise un article dans Français.  Pour example  I want to eat cake (implies some of the cake)  Je veux manger **du** gâteau  Si on n'utelise pas un article  Pour example:  Je veux manger gâteau  Est-ce que cette phrase a l'air de éstrange?	1642974160.0	sb4qs4	/r/French/comments/sb4qs4/estce_que_on_doit_utelise_une_atricle/	Est-ce que on doit utelise une atricle?
aft6wfnc	Just Google translated this quote in french for tattoo, is it grammatically and in general for french right??  Thanks in advance. Travel and tell no one, live a true love story and tell no one, live happily and tell no one, people ruin beautiful things. Voyagez et ne le dites à personne, vivez une véritable histoire d'amour et ne le dites à personne, vivez heureux et ne le dites à personne, les gens gâchent de belles choses.	1642946215.0	sau70m	/r/French/comments/sau70m/google_translation_must_be_right/	Google translation must be right.
8qvq6x0h		1642977032.0	sb5vom	/r/French/comments/sb5vom/je_men_bas_les_reines_estce_que_cette_expression/	"Je m'en bas les reines" est-ce que cette expression est courante ?
op56kc	à l'aide d'un exemple svp ( il me semble que c'est une émotion assez compliquée ?)	1642982441.0	sb7v0l	/r/French/comments/sb7v0l/dépit_comment_peuton_décrire_ce_motce_sentiment/	dépit : comment peut-on décrire ce mot/ce sentiment ?
5qzmb6pq	I was watching a [TV commercial for Amazon Prime](https://youtu.be/uwnMH1dduhQ) featuring a character of Napoleon Bonaparte. Linguistically, does the character use French from Napoleon’s time or modern French?	1642984359.0	sb8jsf	/r/French/comments/sb8jsf/what_type_of_french_is_this/	What type of French is this?
ewbd6zov	Hello! Im looking for some french animes (dub/sub). Im starting to learn french and was wondering If yall have any french animes I can watch! :)	1642984467.0	sb8l4g	/r/French/comments/sb8l4g/any_french_animes_to_watch/	Any french animes to watch?
crnhn7za	Like podcast, YouTube ? And what are they called !!	1642985443.0	sb8x3u	/r/French/comments/sb8x3u/what_are_your_favorite_listening_immersion_tactics/	What are your favorite listening immersion tactics?
3ivtxy7v	j'espère que cela signifie que mon français s'améliore 🤩	1642986924.0	sb9g0t	/r/French/comments/sb9g0t/jai_parlé_en_français_dans_mon_rêve_hier_soir/	j'ai parlé en français dans mon rêve hier soir pour la première fois... super bizarre
138kmm	Bonjour à tous,   J'ai essayé de faire une dictée moi-même sur cette histoire et j'ai croisé qqch que je n'ai pas compris:   'Il arrivait que de gros bateaux s’en viennent naviguer jusque sous les branches. Et dans celles-ci habitait un rossignol qui chantait si divinement que même le pauvre pêcheur, qui avait à s’occuper de tant d’autres choses, restait immobile et écoutait **quand, la nuit, il était sorti tirer des filets et qu’il entendait alors le rossignol.'**  Je trouve la construction de cette phrase difficile à comprendre. Est-ce qu'il veut dire que **' quand il sort tirer des filets  pendant la nuit, il va rester immobile pour écouter le rossignol quand il chante'? ...**   **Merci beaucoup pour votre aide!**	1642987169.0	sb9itd	/r/French/comments/sb9itd/je_nai_pas_compris_le_sens_de_cette_phrase_le/	Je n'ai pas compris le sens de cette phrase (le rossignol et l'empereur de chine)
ah3zn96c	Salut Reddit. I have been assigned a language exchange partner through my French class - I am very excited but also super nervous about contacting my partner. I don't know whether to write this email in English or French and I’ve been procrastinating. Could I perhaps get a second opinion on this:  &#x200B;  Bonjour Anna,  Je m’appelle Laurie et je suis votre partenaire pour le «Projet d’éxchange virtuel».  Quand voulez-vous vous rencontrer? Est-ce que le zoom est d’accord?  Vous pouvez me rejoindre à: --email-- , or au tel: --number-- ou un autre mode de communication (comme whatsapp, texts, etc)  si c’est plus facile.  Meilleures salutations,  Laurie  —-------------------------------------------------------------------------------------------------------------  Hi Anna,  I’m Laurie and I’m your virtual language exchange partner.  When would you like to meet, and what times work best for you?  My university email is ------------- , and I was thinking we could meet via zoom but if another mode of communication (like whatsapp,text messaging…etc) is easier for you just let me know.  Looking forward to hearing from you.  Best,  Laurie  \----------------------------------------------------------------------------------------------------------------  &#x200B;  Is my French ok? Are there major errors? Is the tone ok? Should I maybe send both versions or just the French one?  I enjoy French but I am admittedly not the best student. She's an intermediate English learner, so I don't think she will be too critical either way but I don't want to make a bad first impression.  &#x200B;  Any advice? On this or having a language partner in general?  Thanks.	1642988277.0	sb9w3m	/r/French/comments/sb9w3m/nervous_about_contacting_language_exchange/	Nervous about contacting language exchange partner for the first time?
de0je8jl	Pourquoi on dit que «  Je lui aurais dit / I would have told him » mais on dit « je serais venu/ I would have come” plutôt ?  Dans les deux cas, l’expression est “would have”. Alors, pourquoi le changement?	1642993813.0	sbbqb1	/r/French/comments/sbbqb1/je_suis_un_peu_confus_à_propos_de_utiliser_aurais/	Je suis un peu confus à propos de utiliser « aurais »
ewbd6zov		1642994733.0	sbc1ne	/r/French/comments/sbc1ne/does_anyone_know_french_vers_of_popular_tt_songs/	does anyone know french vers. of popular tt songs?
de0je8jl	Je sais que c’est correct de dire “j’y pense/ I am thinking about it” mais qu’en est-il “j’y veux”? Pourquoi on dit “je le veux” plutôt?	1642995681.0	sbcde9	/r/French/comments/sbcde9/quand_on_utilise_y/	Quand on utilise “y”?
None	Hello everyone. I’m sorry if this is really a basic question. I’m just beginning to try to learn French. I’m really confused about the word heureux and don’t know if it comes before or after the noun.   I’ve seen people sometimes put heureux first like, “Heureux dimanche à tous !” Is that right?   But other times I’ve seen people put it after the noun like, “Un mardi très heureux !” Are these both correct or would it be something else? Merci d'avance !	1642999655.0	sbdmeh	/r/French/comments/sbdmeh/question_about_the_word_heureux/	Question about the word “Heureux”
8s1d01n	Un passage au tout début indique que « ni Efim Petrovitch ni l’éducateur génial n’étaient plus de ce monde lorsque, ayant terminé ses études au lycée, le jeune homme entra à l’université. »  La suite indique qu’en effet Efim et l’éducateur ne sont plus de ce monde mais le ni indique que ni l’un ni l’autre ne sont plus de ce monde c’est à dire qu’ils le sont toujours. Aider moi à comprendre!	1643001079.0	sbe2nl	/r/French/comments/sbe2nl/les_frères_karamazov_traduction_délisabeth_guertik/	Les frères Karamazov traduction d’Élisabeth Guertik
5h2nhan7	Hello all, I am currently in my junior year of high school and I aspire to study French Literature for a Master’s Degree. My high school offers 5 levels of French, although I have yet to take any of them (I only recently decided that I would want to learn French). I would only be able to take two of the five levels in my senior year of school. Should I go this route? In college, I’d hope to major in literature and minor in French. How much French do they teach you in college? Would it be necessary to take French in Hs if they start from scratch in college? Can these courses get me to the level that I aspire to be?  Please feel free to ask me any questions. Advice, answers, and other responses are greatly appreciated. Thank you in advance.	1643002514.0	sbei8l	/r/French/comments/sbei8l/taking_french_courses_in_high_schoolcollege/	Taking French Courses in High School/College?
ak5pm4wj	Just for syntax and grammer.	1643007563.0	sbfyqs	/r/French/comments/sbfyqs/question_can_anyone_provide_me_with_a_good_online/	[Question] Can anyone provide me with a good online proofreader tool?
dl4dgeqj	Hello there!  I am planning on learning French and getting the A1 certification by the end of March. I’ve realised most people recommend a 1.5 month duration to prepare for the A1 level, so I’m hoping by the end of March I should be ready.  However I haven’t been able to find any concrete study material for the A1 exam. It would be immensely helpful if you could guide me in the right direction.   Further, beside the study material, I plan on taking 4 classes per month with a tutor.   Any advice/guidance will be helpful!   Thanks in advance.	1643014477.0	sbhr4x	/r/French/comments/sbhr4x/need_help_with_delf_a1_study_material/	Need help with DELF A1 study material
yjlrw	&#x200B;  https://preview.redd.it/33dwo1dvpld81.jpg?width=600&format=pjpg&auto=webp&s=f4398888789cf92cfc0a268d3a4cf25ba0402fd1	1643016157.0	sbi6it	/r/French/comments/sbi6it/mon_professeur_de_francais_ma_dit_que_si_je_finis/	Mon professeur de francais m'a dit que si je finis apprendre le manuel Tendances A2, je serai au niveau B2 (à condition que j'apprenne attentivement). Est-il possible? Est-ce que quelqu'un connaît bien ce manuel?
elnyrtch	How do we use this word which I can see from Google Translate means (traîne) in a sentence.   e.g., you dragged everyone in because of your poor decisions	1643017744.0	sbikah	/r/French/comments/sbikah/how_to_say_in_french_drag_eg_dragged_into_a/	How to say in French: drag (e.g., dragged into a situation)
53ezzvne	I live in France with my french boyfriend. Last week I went to a Chinese restaurant with my boyfriend, and when they came with our food to the table they asked us for baguettes, which I would have been really glad to have, but my bf told them no thanks. I was confused, because usually in France they serve cut up baguettes on the side, right? It was only after we left I asked him why he didn't get us baguettes. He said "Wait, why? I didn't know you liked baguettes."   "Of course I do, I love baguettes!"  He goes "Well, I didn't know you knew how to use them."  "What? What do you mean 'use baguettes'?"  &#x200B;  And that's how I learned what chop sticks are called in French.	1643020432.0	sbj91p	/r/French/comments/sbj91p/baguettes_and_baguettes_are_not_the_same_thing/	Baguettes and Baguettes are not the same thing
4tyfzmpg	Like for example  Je vais commencer d'apprendre français bientôt.  Ou  Je vais commencer à apprendre français bientôt.  Ou	1643029312.0	sblqbs	/r/French/comments/sblqbs/when_to_use_àor_debefore_à_verb/	When to use 《à》or 《de》before à verb?
3pb1p	One of my favourite songs is ['Les Etrangers' by Leo Ferre](https://www.youtube.com/watch?v=rfRXsWSBy8Q). There's something incredibly deep about it that I can't explain. Can anyone help me better understand the lyrics, or perhaps the deeper meaning behind them? I've wanted more context to this song for ages!  https://genius.com/Leo-ferre-les-etrangers-lyrics	1643038387.0	sbostg	/r/French/comments/sbostg/léo_ferré_les_éstrangers_une_belle_chanson_sur/	Léo Ferré - 'Les éstrangers' - une belle chanson sur laquelle j'aimerais avoir plus d'informations!
