6l4z3	**[1]** - We Just Launched a Website: [wwww.TheFemaleDatingStrategy.com](https://www.thefemaledatingstrategy.com/). Click [here](https://www.thefemaledatingstrategy.com/become-a-verified-member/) for registration information. Please also join our [Twitter](https://twitter.com/FemDatStrat) and [Instagram](https://www.instagram.com/_thefemaledatingstrategy/?hl=en) Pages for updates!   **[2]** - Please read the [FDS Handbook](https://www.reddit.com/r/FemaleDatingStrategy/wiki/recommended_reading#wiki_the_fds_handbook) and [Wiki](https://www.reddit.com/r/FemaleDatingStrategy/wiki/index) before commenting. **Repeated comments demonstrating lack of basic sub knowledge will result in a temporary or permanent ban.**   **[3]** - Please **REPORT** any comments that do not follow the sub rules. **If you do not report it, the mods will not see it.**   **[4]** - **PLEASE REMOVE ALL PERSONAL IDENTIFIABLE INFORMATION** from images (**Name, Location, Job description, education, phone number, etc**). Failure to remove ID info will result in a **1-2** day ban. Repeated failures will result in a permanent ban.    **[5]** - This sub is **FEMALE ONLY**. All comments from men will be removed and you will be banned. **DO NOT REPLY TO MALE TROLLS!!** Please **DOWNVOTE** and **REPORT** immediately.   *I am a bot, and this action was performed automatically. Please [contact the moderators of this subreddit](/message/compose/?to=/r/FemaleDatingStrategy) if you have any questions or concerns.*	1622045119.0	gzj1997	t3_nlkkof	t3_nlkkof	/r/FemaleDatingStrategy/comments/nlkkof/oops/gzj1997/
6kouc7gb	The fact that somebody would make a meme out of this and make fun of her, makes me really angry!  Do men really think we all just sit around the house every day dolled up to the nines?!?  Get real!	1622048366.0	gzj94kd	t3_nlkkof	t3_nlkkof	/r/FemaleDatingStrategy/comments/nlkkof/oops/gzj94kd/
aumkkhv5	Who wants to bet her domestic workload increased 1000%, so much so that she doesn’t have the time to brush her hair in the morning. Men want slaves but still expect us to look pretty. What a joke.	1622045561.0	gzj2bz4	t3_nlkkof	t3_nlkkof	/r/FemaleDatingStrategy/comments/nlkkof/oops/gzj2bz4/
6ibkivio	Perfect example of what marriage does to women. This is why the patriarchy try to brainwash us into thinking being single is the worst thing in the world	1622048447.0	gzj9bq2	t3_nlkkof	t3_nlkkof	/r/FemaleDatingStrategy/comments/nlkkof/oops/gzj9bq2/
63sdvkz3	These kinds of memes are so disrespectful and, overall, disgusting. If your woman looks worn down and dreadful, it’s a reflection of HOW YOU treat her.   I think they do understand that they largely contribute to their SO’s suffering and deteriorating mental/physical health. They just find it funny.	1622049591.0	gzjc2gv	t3_nlkkof	t3_nlkkof	/r/FemaleDatingStrategy/comments/nlkkof/oops/gzjc2gv/
7sp4hyux	I resonate with this so hard! One of my last relationships made me look like this by the end of it. I was drained mentally, physically and emotionally.  I love how the don't include the "you better look like this because if you get dressed up that means you're actively cheating" part. Literally you're expected to look like this and be cooped up in the house cleaning and cooking.  It's disgusting as hell. And then when you see family you have to suck it all in and pretend that you have a great life as you're giving your lifeline/happiness/youth to your scrote.	1622053316.0	gzjl16m	t3_nlkkof	t3_nlkkof	/r/FemaleDatingStrategy/comments/nlkkof/oops/gzjl16m/
1wvo561m	Yet you'd never see this type of meme made for men. "When he's your bf vs. when he's your husband". The patriarchy runs deep, y'all.	1622053143.0	gzjkm5z	t3_nlkkof	t3_nlkkof	/r/FemaleDatingStrategy/comments/nlkkof/oops/gzjkm5z/
5rj1lib1	This is so so sad.💔  Males lurkers, if your girlfriend or wife looks tired, sad, depressed, and like she is suffering in ANY way, that is a direct reflection on YOU as a male. Where is the pride and dignity in and of taking care of the women you allegedly love..?? You DON’T love her. You only want a slave/accessory. Look at the misery on this woman’s face. THAT is your legacy: Being vile, repulsive, hateful, parasitic, GOOD FOR NOTHING soul leeches.	1622061987.0	gzk5r2r	t3_nlkkof	t3_nlkkof	/r/FemaleDatingStrategy/comments/nlkkof/oops/gzk5r2r/
6l4z3	**[1]** - We Just Launched a Website: [wwww.TheFemaleDatingStrategy.com](https://www.thefemaledatingstrategy.com/). Click [here](https://www.thefemaledatingstrategy.com/become-a-verified-member/) for registration information. Please also join our [Twitter](https://twitter.com/FemDatStrat) and [Instagram](https://www.instagram.com/_thefemaledatingstrategy/?hl=en) Pages for updates!   **[2]** - Please read the [FDS Handbook](https://www.reddit.com/r/FemaleDatingStrategy/wiki/recommended_reading#wiki_the_fds_handbook) and [Wiki](https://www.reddit.com/r/FemaleDatingStrategy/wiki/index) before commenting. **Repeated comments demonstrating lack of basic sub knowledge will result in a temporary or permanent ban.**   **[3]** - Please **REPORT** any comments that do not follow the sub rules. **If you do not report it, the mods will not see it.**   **[4]** - **PLEASE REMOVE ALL PERSONAL IDENTIFIABLE INFORMATION** from images (**Name, Location, Job description, education, phone number, etc**). Failure to remove ID info will result in a **1-2** day ban. Repeated failures will result in a permanent ban.    **[5]** - This sub is **FEMALE ONLY**. All comments from men will be removed and you will be banned. **DO NOT REPLY TO MALE TROLLS!!** Please **DOWNVOTE** and **REPORT** immediately.   *I am a bot, and this action was performed automatically. Please [contact the moderators of this subreddit](/message/compose/?to=/r/FemaleDatingStrategy) if you have any questions or concerns.*	1622045119.0	gzj1997	t3_nlkkof	t3_nlkkof	/r/FemaleDatingStrategy/comments/nlkkof/oops/gzj1997/
6kouc7gb	The fact that somebody would make a meme out of this and make fun of her, makes me really angry!  Do men really think we all just sit around the house every day dolled up to the nines?!?  Get real!	1622048366.0	gzj94kd	t3_nlkkof	t3_nlkkof	/r/FemaleDatingStrategy/comments/nlkkof/oops/gzj94kd/
aumkkhv5	Who wants to bet her domestic workload increased 1000%, so much so that she doesn’t have the time to brush her hair in the morning. Men want slaves but still expect us to look pretty. What a joke.	1622045561.0	gzj2bz4	t3_nlkkof	t3_nlkkof	/r/FemaleDatingStrategy/comments/nlkkof/oops/gzj2bz4/
6ibkivio	Perfect example of what marriage does to women. This is why the patriarchy try to brainwash us into thinking being single is the worst thing in the world	1622048447.0	gzj9bq2	t3_nlkkof	t3_nlkkof	/r/FemaleDatingStrategy/comments/nlkkof/oops/gzj9bq2/
63sdvkz3	These kinds of memes are so disrespectful and, overall, disgusting. If your woman looks worn down and dreadful, it’s a reflection of HOW YOU treat her.   I think they do understand that they largely contribute to their SO’s suffering and deteriorating mental/physical health. They just find it funny.	1622049591.0	gzjc2gv	t3_nlkkof	t3_nlkkof	/r/FemaleDatingStrategy/comments/nlkkof/oops/gzjc2gv/
7sp4hyux	I resonate with this so hard! One of my last relationships made me look like this by the end of it. I was drained mentally, physically and emotionally.  I love how the don't include the "you better look like this because if you get dressed up that means you're actively cheating" part. Literally you're expected to look like this and be cooped up in the house cleaning and cooking.  It's disgusting as hell. And then when you see family you have to suck it all in and pretend that you have a great life as you're giving your lifeline/happiness/youth to your scrote.	1622053316.0	gzjl16m	t3_nlkkof	t3_nlkkof	/r/FemaleDatingStrategy/comments/nlkkof/oops/gzjl16m/
1wvo561m	Yet you'd never see this type of meme made for men. "When he's your bf vs. when he's your husband". The patriarchy runs deep, y'all.	1622053143.0	gzjkm5z	t3_nlkkof	t3_nlkkof	/r/FemaleDatingStrategy/comments/nlkkof/oops/gzjkm5z/
5rj1lib1	This is so so sad.💔  Males lurkers, if your girlfriend or wife looks tired, sad, depressed, and like she is suffering in ANY way, that is a direct reflection on YOU as a male. Where is the pride and dignity in and of taking care of the women you allegedly love..?? You DON’T love her. You only want a slave/accessory. Look at the misery on this woman’s face. THAT is your legacy: Being vile, repulsive, hateful, parasitic, GOOD FOR NOTHING soul leeches.	1622061987.0	gzk5r2r	t3_nlkkof	t3_nlkkof	/r/FemaleDatingStrategy/comments/nlkkof/oops/gzk5r2r/
N/A	So he’s admitting he made her sad and exhausted	1622054769.0	gzjoi9b	t3_nlkkof	t3_nlkkof	/r/FemaleDatingStrategy/comments/nlkkof/oops/gzjoi9b/
5kszu6ru	Who else has dated a man who explicitly asks you not to wear makeup or dress up? Like everyone I dated pulled that shit at some point.	1622047208.0	gzj6boc	t3_nlkkof	t3_nlkkof	/r/FemaleDatingStrategy/comments/nlkkof/oops/gzj6boc/
54wg5sgu	She looks beaten down & worn out. I hope she finds the strength to leave!	1622048991.0	gzjan25	t3_nlkkof	t3_nlkkof	/r/FemaleDatingStrategy/comments/nlkkof/oops/gzjan25/
85160abt	Before and after being married to a man.	1622045583.0	gzj2dvb	t3_nlkkof	t3_nlkkof	/r/FemaleDatingStrategy/comments/nlkkof/oops/gzj2dvb/
N/A	Wow I really appreciate this as that is such a negative narrative that I see among my older age group. Like we 'let ourselves go' intentionally and completely disregards a vast majoritu of us solely responsible for child rearing, home management, usually also working FT, and perhaps by our ages battling health issues. It is sad. And they like to throw in the exception not the rule stories of women they know who "dropped babies" and got those bodies back immediately, too. Even some shady male coaches are somewhat realistic in saying to plan that the woman you marry and have babies with likely will go up a dress size naturally. (They still suck also yet at least they are telling their audience to be somewhat realistic about what child birth does to our bodies)	1622050651.0	gzjemiq	t3_nlkkof	t3_nlkkof	/r/FemaleDatingStrategy/comments/nlkkof/oops/gzjemiq/
6f4orzzc	Totally got emotional over this meme. This was me with my ex. Haha, wow... just really hit today. It’s been about two and half months since I ended it and two weeks since I moved out. I haven’t cried since well before I moved out.   My friends told me how pale and sad I looked, how my eyes became sunken in, how much weight I was losing. I’m happy the chapter is closed. It’s amazing how much physical change emotional pain can cause.	1622061749.0	gzk56y7	t3_nlkkof	t3_nlkkof	/r/FemaleDatingStrategy/comments/nlkkof/oops/gzk56y7/
32akzwox	owned	1622045384.0	gzj1wkf	t3_nlkkof	t3_nlkkof	/r/FemaleDatingStrategy/comments/nlkkof/oops/gzj1wkf/
rdiu0	I'd like to give some context. The lady in the picture is honeypreet insaan.  She was born to parents who followed a new age Indian guru. The guru introduced her to the son of a high ranking politician and matched them. As an adult woman, she was adopted by the guru and she became his favorite daughter. She worked as a director, producer and other roles for the wacky Guru's wacky projects. The guru was then arrested for raping to of his young female followers. Honeypreet came to the limelight after she escorted him to the investigation organisations headquarters.  Her husband (the politician's son)  made claims that honeypreet and her adoptee father actually had sexual relations.  He later apologised but the guru definitely tried to push her in the limelight. It is speculated he was trying to train her to take over his cult.  Later his cult members rioted and killed a lot of people when he was  convicted for rape and it was thought that honeypreet orchestrated these riots. She was arrested. The first picture is her posing next to the guru and the second is her mugshot in jail.  The memes were made against her because people hated the guru and his cult members then.  Meme's still sexist tho.	1622081982.0	gzladt3	t3_nlkkof	t3_nlkkof	/r/FemaleDatingStrategy/comments/nlkkof/oops/gzladt3/
10kmes	She looks like a fucking POW in the 2nd pic.	1622055499.0	gzjq9ao	t3_nlkkof	t3_nlkkof	/r/FemaleDatingStrategy/comments/nlkkof/oops/gzjq9ao/
7xkpkrcd	Marrying a LVM man is the equivalent of sitting next to  toxic waste ☣️  In the second picture she looks as if the light had been sucked out of her eyes. It scares me😟😨😱	1622061659.0	gzk4zjn	t3_nlkkof	t3_nlkkof	/r/FemaleDatingStrategy/comments/nlkkof/oops/gzk4zjn/
N/A	Same goes for those “when she’s your gf vs when she’s your ex” memes with the after being her prettier. LVMs hate it when they see a lady thriving and out of their control.	1622066255.0	gzkeubq	t3_nlkkof	t3_nlkkof	/r/FemaleDatingStrategy/comments/nlkkof/oops/gzkeubq/
8bycqm9e	This is proof why we should never settle. If he makes you look like shit, DUMP him.	1622060300.0	gzk1sib	t3_nlkkof	t3_nlkkof	/r/FemaleDatingStrategy/comments/nlkkof/oops/gzk1sib/
N/A	[deleted]	1622053515.0	gzjli7j	t3_nlkkof	t3_nlkkof	/r/FemaleDatingStrategy/comments/nlkkof/oops/gzjli7j/
N/A	Warning for any women still thinking a man will save them. They just add to your workload and misery.	1622059599.0	gzk04f0	t3_nlkkof	t3_nlkkof	/r/FemaleDatingStrategy/comments/nlkkof/oops/gzk04f0/
5pl0h1ih	So how she looks going out vs how she looks when she’s comfortable and at home? I love to dress up when I go out but when I’m at home it’s athleisure or pajamas all day long.	1622055575.0	gzjqfui	t3_nlkkof	t3_nlkkof	/r/FemaleDatingStrategy/comments/nlkkof/oops/gzjqfui/
b9nfp72p	Statistically, unmarried (never married) women are the happiest demographic. Unmarried men are the unhappiest. Married experience less depression and addiction, and they live longer than their unmarried counterparts. *The exact opposite* of all of that is true for married women. Marriage is literally the worst thing so many women can do to themselves.   And yet men still think they’re the prize and like single women must be so miserable without them. Not only do women not need them, but they’re far better off without them	1622061396.0	gzk4dvp	t3_nlkkof	t3_nlkkof	/r/FemaleDatingStrategy/comments/nlkkof/oops/gzk4dvp/
49o9347g	This is a South Asian women depicted here, so you need to also factor in how his boy-mom treats her.....	1622135041.0	gznnusu	t3_nlkkof	t3_nlkkof	/r/FemaleDatingStrategy/comments/nlkkof/oops/gznnusu/
houv1en	I hate when men post women photos for meme's.  The difference in photo to me is happiness. Its scary men don't care about how depressed and sad she looks and more about her not wearing makeup/dressing up all the time. They wonder why women divorce more than men.   The fact that men expect us to look like dolls 24/7 is gaslighting. Any man who has dated women for certain amount of time knows we don't wear it 24/7. So what if women dress down when married when women are considered lucky if we get men who dress [this](https://external-content.duckduckgo.com/iu/?u=http%3A%2F%2Fcdn.shopify.com%2Fs%2Ffiles%2F1%2F0053%2F2224%2F4211%2Fproducts%2Fblue_white_1200x1200.jpg%3Fv%3D1556746073&f=1&nofb=1) way let alone something nicer. Men have such low bar they should be last to complain.	1622154133.0	gzovrvk	t3_nlkkof	t3_nlkkof	/r/FemaleDatingStrategy/comments/nlkkof/oops/gzovrvk/
84o9i8oi	She looks like someone who's in a refugee or concentration camp. That is so sad and how do they not get that she looks like that because of what her husband did to her and has put her through? Men are so blind to this stuff it's heart-wrenching and frustrating on levels I can't even put words to. I feel like it's pointless trying to talk to them at all. Even if you are completely logical and cite all kinds of facts and what women have been going through for the duration of human history they will still find some way to blow you off and blame everything on you.  I feel like I'm at the stage of my healing process right now where I have to let go of the hopeful illusions/delusions I've had and deal with the reality that I've always known but really look at square in the face that most men are just absolutely completely horrible and the really truly good ones are anomalies.  It's also stunning to me to think how many men think that if they're not beating or straight up violently raping their wives that they're not hurting them in any way. This meme clearly shows otherwise. my heart breaks for this woman and I hope she's in a better place right now or that she is able to get to a better place and be happy and feel alive and vibrant!	1622073241.0	gzktoqd	t3_nlkkof	t3_nlkkof	/r/FemaleDatingStrategy/comments/nlkkof/oops/gzktoqd/
2lgsvudk	TRUE! My mom is glowing and looks at least two decades younger than her age after 50 years of marriage to a loving selfless gentleman	1622063308.0	gzk8sqo	t3_nlkkof	t3_nlkkof	/r/FemaleDatingStrategy/comments/nlkkof/oops/gzk8sqo/
7wclj92z	Someone needs to send home girl a rescue unit ASAP.	1622068937.0	gzkkqkm	t3_nlkkof	t3_nlkkof	/r/FemaleDatingStrategy/comments/nlkkof/oops/gzkkqkm/
N/A	[deleted]	1622084691.0	gzlf9ku	t3_nlkkof	t3_nlkkof	/r/FemaleDatingStrategy/comments/nlkkof/oops/gzlf9ku/
9m2cbrw5	She took one look at the micro penis she is stuck with for life and lost all will to live. It’s more common than people realize. RIP to that woman’s sex drive. Thoughts and prayers. 🙏🏻 God grant her divorce and the revival of her spirit.	1622388595.0	gzze46e	t3_nlkkof	t3_nlkkof	/r/FemaleDatingStrategy/comments/nlkkof/oops/gzze46e/
af7zq	Hahahha amen	1622045873.0	gzj32z8	t3_nlkkof	t3_nlkkof	/r/FemaleDatingStrategy/comments/nlkkof/oops/gzj32z8/
2y9ki3vc	Or...we could normalize that women may not always be wearing makeup and their looks will change with age.  Let’s stop acting like being treated as a human automatically results in us looking conventionally attractive.	1622170648.0	gzpriby	t3_nlkkof	t3_nlkkof	/r/FemaleDatingStrategy/comments/nlkkof/oops/gzpriby/
8u85fzic	Blink twice if you need help.	1622388506.0	gzzdy66	t3_nlkkof	t3_nlkkof	/r/FemaleDatingStrategy/comments/nlkkof/oops/gzzdy66/
3kxxomjd	This is true. I mistakenly believed I could easily find a decent romantic partner of similar values and beliefs to my family. I'm happier alone with my family. You won't see me with some man who obviously doesn't see my worth.	1622070906.0	gzkovfi	t3_nlkkof	t3_nlkkof	/r/FemaleDatingStrategy/comments/nlkkof/oops/gzkovfi/
auo2kw2i	I actually do have a picture of myself a couple weeks after breaking up with ex vs pics of me now. I looked like complete shit before, a total train wreck like way worse than the lady in the op's pic to the right. Now I spend a lot of time doing things that I like to do and less stressed out. Took time to focus on my self-esteem. That's how I knew I was doing the right thing by walking away and focusing on myself when looking at the before&after pics, if it wasn't for my privacy I'd share.	1622073157.0	gzktia9	t3_nlkkof	t3_nlkkof	/r/FemaleDatingStrategy/comments/nlkkof/oops/gzktia9/
1cythi5n	This is distressing. Based on that shoulder cut off shirt the first pic must not be 5 years ago. It’s such a short time to lose your glow because of a man	1622085249.0	gzlg812	t3_nlkkof	t3_nlkkof	/r/FemaleDatingStrategy/comments/nlkkof/oops/gzlg812/
pt09p	I really wish the two images were swapped after she dumps the scrote’s ass.	1622096217.0	gzlwhxf	t3_nlkkof	t3_nlkkof	/r/FemaleDatingStrategy/comments/nlkkof/oops/gzlwhxf/
6nhqtx0c	Exactly!	1622051473.0	gzjgm1i	t3_nlkkof	t3_nlkkof	/r/FemaleDatingStrategy/comments/nlkkof/oops/gzjgm1i/
mx5npgj	What is wrong with some dudes? Seriously? This is disgraceful. Imagine being this huge of an asshole. I can't. I have a strong feeling that men who find this funny are fricken neckbeards. Ew.	1622085526.0	gzlgp4b	t3_nlkkof	t3_nlkkof	/r/FemaleDatingStrategy/comments/nlkkof/oops/gzlgp4b/
1o7m7q4i	Since I’ve been divorced (beginning of 2018), I’ve moved around a bit and have had to update my drivers license both times. The most recent DL pic and the DL pic I had taken right after the breakup are literally like night and day. When I first compared them, I loved that I looked much happier and healthier in my recent one. On the other hand, I was sad bc I allowed myself to become so unhealthy and miserable during that marriage. My skin had no color, my eyes had bags under them, I was easily 50lbs heavier, I had a noticeably forced smile... At that moment,  I decided I most likely will not re-marry. I have been my happiest as a single lady. Meeting a HVM would be the only reason I’d change my mind.	1622096382.0	gzlwpju	t3_nlkkof	t3_nlkkof	/r/FemaleDatingStrategy/comments/nlkkof/oops/gzlwpju/
hw4swd	This is en pointe!	1622074221.0	gzkvqjb	t3_nlkkof	t3_nlkkof	/r/FemaleDatingStrategy/comments/nlkkof/oops/gzkvqjb/
47gy10ti	It’s almost like the problem here is *you*.	1622096067.0	gzlwb08	t3_nlkkof	t3_nlkkof	/r/FemaleDatingStrategy/comments/nlkkof/oops/gzlwb08/
4qh471dn	Wow	1622064208.0	gzkaurx	t3_nlkkof	t3_nlkkof	/r/FemaleDatingStrategy/comments/nlkkof/oops/gzkaurx/
a19i2ivx	These men still be out here telling on themselves like that.	1629816432.0	ha618cb	t3_nlkkof	t3_nlkkof	/r/FemaleDatingStrategy/comments/nlkkof/oops/ha618cb/
9s9zxajd	and i oop	1622062378.0	gzk6o2n	t3_nlkkof	t3_nlkkof	/r/FemaleDatingStrategy/comments/nlkkof/oops/gzk6o2n/
c1f6du1t	My stomach turned. She looks depressed and malnourished in the second photo.	1622055700.0	gzjqrbv	t3_nlkkof	t1_gzj94kd	/r/FemaleDatingStrategy/comments/nlkkof/oops/gzjqrbv/
73pm04oh	It's horrifying.	1622048936.0	gzjai5v	t3_nlkkof	t1_gzj94kd	/r/FemaleDatingStrategy/comments/nlkkof/oops/gzjai5v/
pa1a0	Yup, they do.	1622049279.0	gzjbbip	t3_nlkkof	t1_gzj94kd	/r/FemaleDatingStrategy/comments/nlkkof/oops/gzjbbip/
e6r4g	thats what my grandma does. ive met older women that sleep in their makeup	1622052981.0	gzjk8iq	t3_nlkkof	t1_gzj94kd	/r/FemaleDatingStrategy/comments/nlkkof/oops/gzjk8iq/
nka1h55	**So, it's come to my attention that this is the mugshot of this woman. She's a criminal who did some very nasty things, not an abuse victim**.  We need to take down this thread.	1622098842.0	gzlzofc	t3_nlkkof	t1_gzj94kd	/r/FemaleDatingStrategy/comments/nlkkof/oops/gzlzofc/
b4ibcnnm	Oh one hundred percent. Scrotes do absolutely nothing and still look like shit but expect their bangmaid *cough* sorry wife to look like a professionally made up pornstar? Sure honey.	1622045821.0	gzj2yhw	t3_nlkkof	t1_gzj2bz4	/r/FemaleDatingStrategy/comments/nlkkof/oops/gzj2yhw/
b04b3izm	Yup! LVM want us to look pretty *without any effort.* That's why they think makeup is "cheating"  LVM Logic: if you spend an hour doing your makeup, how will you have time to look pretty when I give you all this extra work??	1622050058.0	gzjd74k	t3_nlkkof	t1_gzj2bz4	/r/FemaleDatingStrategy/comments/nlkkof/oops/gzjd74k/
4d7t91zx	and the “allowance” he gives her won’t cover the beauty products anyway	1622051456.0	gzjgkgc	t3_nlkkof	t1_gzj2bz4	/r/FemaleDatingStrategy/comments/nlkkof/oops/gzjgkgc/
N/A	[deleted]	1622053894.0	gzjmev6	t3_nlkkof	t1_gzj9bq2	/r/FemaleDatingStrategy/comments/nlkkof/oops/gzjmev6/
c1f6du1t	My mother's second ex husband, a registered pedophile now, did this to her. He didn't physically abuse (every other horrific abuse under the sun though) her but he sure as shit did enough to make her look like photo number two. Her passport photo from then versus now is like two different people.	1622055805.0	gzjr0q8	t3_nlkkof	t1_gzj9bq2	/r/FemaleDatingStrategy/comments/nlkkof/oops/gzjr0q8/
ast0tu2y	I lost my health because of the way I was abused by LVM.  That is literally what this meme is showing.  It’s not a fucking joke and its sick that people out there think it is.  Abusing a woman so she’s a shadow of her former self is funny now?   Wtf has our world come to.	1622054472.0	gzjnslt	t3_nlkkof	t1_gzj9bq2	/r/FemaleDatingStrategy/comments/nlkkof/oops/gzjnslt/
N/A	[deleted]	1622054443.0	gzjnq3k	t3_nlkkof	t1_gzj9bq2	/r/FemaleDatingStrategy/comments/nlkkof/oops/gzjnq3k/
N/A	[deleted]	1622060163.0	gzk1gp5	t3_nlkkof	t1_gzj9bq2	/r/FemaleDatingStrategy/comments/nlkkof/oops/gzk1gp5/
10tgx3o6	As someone relatively new to FDS, can you recommend any articles or good reads about this topic in particular? I come from a small town where identity is based on your relationship status and it makes me sick.	1622056326.0	gzjs9z7	t3_nlkkof	t1_gzj9bq2	/r/FemaleDatingStrategy/comments/nlkkof/oops/gzjs9z7/
84o9i8oi	The ways that men find it funny to torture us and taunt us and do a variety of other things to make us squirm and be uncomfortable absolutely blows my mind.  A wife is always always always a reflection of her husband and his love and how he treats her, whether it's good or bad!	1622073856.0	gzkuzbs	t3_nlkkof	t1_gzjc2gv	/r/FemaleDatingStrategy/comments/nlkkof/oops/gzkuzbs/
