84o9i8oi	Oh my goodness I'm so sorry! I wish your grandmother would have told you how beautiful you are without that stuff and that you don't need it!   I would love to see women celebrate their natural beauty more! The makeup these days looks like getting ready to go deep sea diving for your face and I cringe when I watch the videos of women making themselves up because I feel like they're covering themselves up completely, meaning you're no longer seeing their actual beautiful face. You're just seeing makeup, almost like a mask. Sometimes it makes me want to cry and I know that might sound silly but I would like to see women showing off their natural beauty more! And if using makeup, just like bare minimum stuff for some extra pizzazz, for enhancement, not covering up. 🥰	1622073386.0	gzktzsn	t3_nlkkof	t1_gzjmt2u	/r/FemaleDatingStrategy/comments/nlkkof/oops/gzktzsn/
aadtrhcf	Well, might be true i guess. My eyes would just be red an icky all the time. And the mascara on the pillows.🤢	1622062272.0	gzk6eyy	t3_nlkkof	t1_gzjv86y	/r/FemaleDatingStrategy/comments/nlkkof/oops/gzk6eyy/
atz23	Same reason your pickmeisha friend will glare at you when ordering a healthy snack. Just a bucket of crabs.	1622073000.0	gzkt6jt	t3_nlkkof	t1_gzjtkev	/r/FemaleDatingStrategy/comments/nlkkof/oops/gzkt6jt/
558534mv	Don't worry, love. The LVM that were dicks about your food allergies are literal trash. I'm glad as fuck that these losers are missing out on your delicious home cooked meals!	1622064906.0	gzkc153	t3_nlkkof	t1_gzk2dno	/r/FemaleDatingStrategy/comments/nlkkof/oops/gzkc153/
84o9i8oi	It absolutely totally is! There's nothing loving about treating someone like that especially over something that you have no control over. And awesome for you that you are a kickass cook! That's so fun! I personally miss baking and I need to figure out a way to do it to tailor it to my own health and dietary issues so I'm still working on that but it's so therapeutic! Cooking too! 🥰🥗🍰	1622074307.0	gzkvwz9	t3_nlkkof	t1_gzk2dno	/r/FemaleDatingStrategy/comments/nlkkof/oops/gzkvwz9/
N/A	I've met waaaaaay too many guys who are more upset about my seafood allergy than I have ever been.  Sorry I ruined your played out sushi date idea Bradley	1622070100.0	gzkn7bs	t3_nlkkof	t1_gzk2dno	/r/FemaleDatingStrategy/comments/nlkkof/oops/gzkn7bs/
84o9i8oi	I cannot upvote this enough! This a million bazillion times infinity plus one! It's the absolute truth! And I am so happy for you and your marriage! That's the way it should be! Jane Austen has a great quote where she says if you both seek to make each other happy then you will both end up happy! 🥰🤗  I know this example isn't the same but it just shows when people treat you well you respond better. So years ago I took a job as a nanny through answering an ad in my local paper. It sounded great & amazing but once I got the job I was in for a very rude awakening! I found out that several of the things listed in the ad were actual lies or misrepresentations & they ended up overworking me. Everything about the whole situation was just a big mess. I loved the little boy & I loved the little girl too but the little girl was very spoiled! I also got paid the least amount of money out of all the nannies in the area while I had the most duties. On one of my heavy duty days I was assigned to change the water in a flower vase--last on my to-do list because everything else was more important. So I was in the mud room doing a bazillion loads of laundry when the mother came in holding this vase & she was seriously pissed! She chastised me for not changing the water in the vase & said, 'You know, we hired you to make our lives easier.' I have no words! In spite of everything I did not change how I was with the kids or how I did my job for the duration.  All that said, this is how I learned it's better to go through a nannying agency--they make sure the families are on the up & up & same thing for the nannies. Families get a good nanny, nannies are taken care of properly & paid well! Second job I had was a temporary fill-in till the mother's cousin was to come down. I don't know if that family made as much money as the first family or not. It was a live out job whereas the other one was live in. But they paid me WAAAY better than the first family! They paid me time & 1/2 if I worked on days off as well. The mother literally only wanted me doing things for her 2 young boys. She was still nursing their 6-month-old so she needed help. But because this family was so sweet with me & I just loved the mother & the kids so much I did anything I could to help her out around the house even if it wasn't part of my job. Part of me probably would've done it anyway cuz that's just how I am but it really made me want to more!  That's how it is when women get love poured into them! 🥰🤗	1622087687.0	gzlkc86	t3_nlkkof	t1_gzlfng2	/r/FemaleDatingStrategy/comments/nlkkof/oops/gzlkc86/
N/A	The mistaken thinking in this is assuming that these kinds of men WANT to be happy... no, they are often miserable narcs/sociopaths/abused-child-turned-abusers who aim to make you feel the kind of misery they feel all the time. It's about revenge and schadenfreude. Often you're a stand in for some woman in his life who denied him something/said no.	1624012581.0	h271adq	t3_nlkkof	t1_gzlfng2	/r/FemaleDatingStrategy/comments/nlkkof/oops/h271adq/
4t3wna3e	I hear what you're saying and I have this issue myself. I'm trying not to though because it's problematic to be labelling people. Some of us aren't straight or gay 😊	1622091339.0	gzlpxzw	t3_nlkkof	t1_gzl879p	/r/FemaleDatingStrategy/comments/nlkkof/oops/gzlpxzw/
N/A	[deleted]	1622166675.0	gzpk2er	t3_nlkkof	t1_gzp9htw	/r/FemaleDatingStrategy/comments/nlkkof/oops/gzpk2er/
N/A	[deleted]	1622076313.0	gzkzzvc	t3_nlkkof	t1_gzkxir6	/r/FemaleDatingStrategy/comments/nlkkof/oops/gzkzzvc/
4d8cxjnz	Thank you 🙏🏼✨	1622091570.0	gzlqa1w	t3_nlkkof	t1_gzlf0dp	/r/FemaleDatingStrategy/comments/nlkkof/oops/gzlqa1w/
e6r4g	its crazy. my grandma had a really hard life and is pretty stupid, probably not officially low IQ but kinda close. has a huge issue with like caring about what other people think of you. growing up she shit on everything i did cause i was into skate boarding and didnt dress as girly as my other cousin. really reinforced the bullshit 'im not like other girls' stereotype for me growing up. even now she refuses to believe that i'm happy because i dont have a husband. like i have a professional degree, somewhat high paying job, a beautiful penthouse apartment, buy everything i need and most of what i want, have great friends and other family member relationships, am into a few hobbies, and she'll be like 'what about a man'. meanwhile her and my grandpa have absolutely hated eachother for 10 years and treat eachother pretty shitty. from the outside/male mindset/her mindset im a crazy cat lady and thats all that matters.  also as i have moved up in my career she will shit on me and be like 'really, you can do all this, you think you can handle living there? etc' and when i push back at how i succeed in everything i do and havent failed before, why is she acting like i have?(note: this is because i currently have no problems working 24/7 on tasks and i only take reasonable risks) shell be like oh well im just scared cause you live alone. one time i hung up a bunch of plants and was proud of how nice it looked and sent pics. everyone compliments it and shes just like omg you did that yourself please be careful.   i just 'grey rock' her and give her little info about my life. i love her and have tried so hard with her, shes made some progress in her behavior but shes still a miserable person and i dont have time for misery   end rant	1622060121.0	gzk1czr	t3_nlkkof	t1_gzjyvvh	/r/FemaleDatingStrategy/comments/nlkkof/oops/gzk1czr/
e6r4g	damn thats awful	1622070092.0	gzkn6qe	t3_nlkkof	t1_gzkdqfb	/r/FemaleDatingStrategy/comments/nlkkof/oops/gzkn6qe/
a73w3no4	😢	1622068854.0	gzkkke8	t3_nlkkof	t1_gzkdqfb	/r/FemaleDatingStrategy/comments/nlkkof/oops/gzkkke8/
e6r4g	same. i sat down with her and was like 'even if i do look ugly, you shouldnt make a person feel ugly' like sure if i was smelly or going to offend the public have that reaction but no makeup is different. after that she stopped with the obnoxious stuff and now just will go out of her way to tell me i look so much better when i do have makeup on.	1622060385.0	gzk1zsr	t3_nlkkof	t1_gzjyq5d	/r/FemaleDatingStrategy/comments/nlkkof/oops/gzk1zsr/
e6r4g	my grandma is hot not gonna lie. i mentioned before but she only wears eye makeup so it saved her skin	1622112619.0	gzmejog	t3_nlkkof	t1_gzljsgj	/r/FemaleDatingStrategy/comments/nlkkof/oops/gzmejog/
e6r4g	thank you for the kind words. i look significantly better with makeup on and i accept that. but i also accept how i look without it	1622075928.0	gzkz7ln	t3_nlkkof	t1_gzktzsn	/r/FemaleDatingStrategy/comments/nlkkof/oops/gzkz7ln/
v4qqb	Sissss I love vegetables (not vegan or vegetarian, just love em) and tend to order veggies when I found a good one. It gets attention easily because it is kinda rare here where I live to eat just veggies. The look on their faces when that happens...	1622088095.0	gzlkzxr	t3_nlkkof	t1_gzkt6jt	/r/FemaleDatingStrategy/comments/nlkkof/oops/gzlkzxr/
84o9i8oi	YES! 😂💯💯💯🍰🥗	1622074342.0	gzkvziv	t3_nlkkof	t1_gzkc153	/r/FemaleDatingStrategy/comments/nlkkof/oops/gzkvziv/
5vhe0zcp	I can't digest gluten but I like baking so I make gluten free cakes and biscuits when I want a treat, I definitely recommend trying that. There's a nice recipe for sweet potato brownies by 'Deliciously Ella' on youtube which is actually kind of healthy but also tastes good.	1622075049.0	gzkxfim	t3_nlkkof	t1_gzkvwz9	/r/FemaleDatingStrategy/comments/nlkkof/oops/gzkxfim/
5vhe0zcp	It's weird isn't it? Several of these men were much more bothered by my food allergies than I am. I often forget I have them, it's only if I got to restaurants that I remember other people eat a lot of other things but restaurants are usually very helpful and have several things I can eat. And otherwise I make nice meals at home and try out new recipes etc. I guess these men want 'hamburger and chips with a pint down the pub' type women and see me as being too difficult because I can't and won't eat that type of food. I think it's because they know that they'll have to be more tolerant and try out different foods if they are in a partnership with me and they don't want any sort of change.	1622077276.0	gzl1wtk	t3_nlkkof	t1_gzkn7bs	/r/FemaleDatingStrategy/comments/nlkkof/oops/gzl1wtk/
10lcgk	I definitely understand that now and I see you. I was very inexperienced at the time. I'm just saying that is specifically how I perceived him at the time, years ago. I'm sorry if I didn't express it appropriately, I didn't mean to offend. I did not perceive any sort of sexual interest in me from him. Is that a better way of saying it? Thank you for your insight and being kind about it 😊	1622105058.0	gzm6c87	t3_nlkkof	t1_gzlpxzw	/r/FemaleDatingStrategy/comments/nlkkof/oops/gzm6c87/
13qles	I think I had the same marriage.	1622084574.0	gzlf2h9	t3_nlkkof	t1_gzkzzvc	/r/FemaleDatingStrategy/comments/nlkkof/oops/gzlf2h9/
5k5nbgex	Is she from another country/culture? I am half-Korean and my Korean fam likes to say stuff like this. Especially the older Korean ladies. They love to ask my sister why she is single at 30 and gasping that "time's running out," while their husbands have cheated on them all their lives, have mistresses and entire 2nd/3rd families.	1622075187.0	gzkxpfj	t3_nlkkof	t1_gzk1czr	/r/FemaleDatingStrategy/comments/nlkkof/oops/gzkxpfj/
84o9i8oi	I wonder if deep down she actually hates her life and how things are. Not that she should be taking it out on you but I wish that she would be able to face that and face the toxicity of it. And it almost sounds like she's in some kind of survival mode and I feel like a lot of picmeishas are in survival/denial mode. It's awful. All the mental and emotional abuse that's constantly heaped on us from so many different sources.  And good on you for all that awesome stuff that you've done and have and accomplished! Rock on, awesome sis! 🥰🌞🙌	1622073691.0	gzkun1y	t3_nlkkof	t1_gzk1czr	/r/FemaleDatingStrategy/comments/nlkkof/oops/gzkun1y/
N/A	[deleted]	1622075686.0	gzkypp5	t3_nlkkof	t1_gzk1czr	/r/FemaleDatingStrategy/comments/nlkkof/oops/gzkypp5/
qgwmkl2	Bless her heart.   Where I'm from, it's not a nice thing to say.	1622139555.0	gznypmf	t3_nlkkof	t1_gzk1czr	/r/FemaleDatingStrategy/comments/nlkkof/oops/gznypmf/
djp92	That is a PERFECT response. Good for you. 🙌🏼	1622068303.0	gzkje9h	t3_nlkkof	t1_gzk1zsr	/r/FemaleDatingStrategy/comments/nlkkof/oops/gzkje9h/
84o9i8oi	You're most welcome, sis!	1622076988.0	gzl1cdo	t3_nlkkof	t1_gzkz7ln	/r/FemaleDatingStrategy/comments/nlkkof/oops/gzl1cdo/
84o9i8oi	Ooh, nice! I'll have to look that up and see if that's who I'm thinking of! Has she ever been on the food Network?  I have come across some good gluten-free baking mixes too which I'm very excited about! I love baking things from scratch whenever I can but if I need something quick that's always a good way to go!	1622075208.0	gzkxqzn	t3_nlkkof	t1_gzkxfim	/r/FemaleDatingStrategy/comments/nlkkof/oops/gzkxqzn/
N/A	It's wild to me because seafood is my one big allergy, and I never thought of it as an issue. All seafood tastes and smells awful to me, the hours of diarrhea and vomiting were just reinforcement to not eat the stuff. I'm not missing out on anything since even seafood places offer other protein options.  But because my throat doesn't close up, I don't have/need an epipen, and because I never had any testing (my body's response in the first place is all the testing I need thanks), men seem to think it's not a legitimate issue and that I need to PROVE to them seafood makes me sick!!!!! 😡😡😡  If I'm going to purposely trigger severe gastrointestinal distress for someone, it will be at home, for myself, with some expensive whole milk and a pan of home made brownies.	1622118364.0	gzmn7p8	t3_nlkkof	t1_gzl1wtk	/r/FemaleDatingStrategy/comments/nlkkof/oops/gzmn7p8/
7cg57uq6	Me too.	1623234221.0	h14x523	t3_nlkkof	t1_gzlf2h9	/r/FemaleDatingStrategy/comments/nlkkof/oops/h14x523/
e6r4g	nope white af	1622075683.0	gzkyph0	t3_nlkkof	t1_gzkxpfj	/r/FemaleDatingStrategy/comments/nlkkof/oops/gzkyph0/
e6r4g	she 100% hates her life. i wish she would listen to me more and be happy, but she would rather be miserable. i think its comfortable in a way because its familiar. i absolutely feel bad for her, i can look at her life and understand why she is the way she is,  but i will not accept her not changing.	1622075821.0	gzkyzn6	t3_nlkkof	t1_gzkun1y	/r/FemaleDatingStrategy/comments/nlkkof/oops/gzkyzn6/
N/A	[deleted]	1622081891.0	gzla7rq	t3_nlkkof	t1_gzkun1y	/r/FemaleDatingStrategy/comments/nlkkof/oops/gzla7rq/
e6r4g	it feels nice to not be alone. it's literally shocking to me but talking about this made me realize these women have nothing but their man/relationship making up their lives, even the shitty feelings. i used to be like that because it was a way to escape focusing on myself and my future and after neglecting that so long it was scary to be alone. i think they just cant make the jump	1622076263.0	gzkzw70	t3_nlkkof	t1_gzkypp5	/r/FemaleDatingStrategy/comments/nlkkof/oops/gzkzw70/
84o9i8oi	I totally get that. It's really sad.	1622076879.0	gzl14nn	t3_nlkkof	t1_gzkyzn6	/r/FemaleDatingStrategy/comments/nlkkof/oops/gzl14nn/
84o9i8oi	I was actually talking about all the awesome stuff that the person I was responding to has done.	1622175131.0	gzpzfaf	t3_nlkkof	t1_gzla7rq	/r/FemaleDatingStrategy/comments/nlkkof/oops/gzpzfaf/
72bqs9iv	There is an "Iron Gym" in my town. There was a branch strictly for women. "Iron Gym for women." It cost more than the regular one but offered classes like yoga and pilates. The regular one doesn't.   I go to the regular one. Full of bros and IG fitness babes.   Everyone stick to themselves and focuses on themselves. And from what I've heard the bros don't grunt and throw things down like the ones at Max Fitness (never been so wouldn't know). I've had some guys come up and talk to me/ give me pointers but that was it. Usually *everyone* does their own thing and leave.   That's how a Gym is suppose to be. Mind your damn business.	1616709065.0	gs81ez7	t3_md66ux	t3_md66ux	/r/FemaleDatingStrategy/comments/md66ux/why_are_males/gs81ez7/
7ekecxn3	In South Korea, phones must have the photo shutter sound on because men taking photos of women secretly is a big issue there. I think they should implement that everywhere honestly	1616707692.0	gs7yggd	t3_md66ux	t3_md66ux	/r/FemaleDatingStrategy/comments/md66ux/why_are_males/gs7yggd/
N/A	[deleted]	1616703665.0	gs7pfrk	t3_md66ux	t3_md66ux	/r/FemaleDatingStrategy/comments/md66ux/why_are_males/gs7pfrk/
2ekulyjv	I experienced this when I WORKED at a gym. Was busy racking some random guy’s weights and in front of me was a mirror. I looked in the mirror as I was standing up and lo and behold a man in his 60s is taking a picture of me as I’m bent over. Only reason I noticed he was taking a pic is because he forgot to turn his flash off. I was newly 18, working alone, and was way too scared to call him out with no one there to back me up.	1616706577.0	gs7w0mu	t3_md66ux	t3_md66ux	/r/FemaleDatingStrategy/comments/md66ux/why_are_males/gs7w0mu/
azr27yoy	You should have told him you’re taking his picture too and the cops will easily identify him from the distinctive man boobs!	1616706962.0	gs7wv97	t3_md66ux	t3_md66ux	/r/FemaleDatingStrategy/comments/md66ux/why_are_males/gs7wv97/
5iq55ptk	I stopped going to gyms because of so much nonsense but, a few years ago, I signed up at a community gym near my previous house.  I would go in early in the morning to avoid scrotes and discovered that the gym was overtaken by....nuns! All of them over 70 (and stronger than me🤣). It was great! We would even relax in the whirlpool after and chat. I got into great shape and it was wonderful.	1616703720.0	gs7pkdw	t3_md66ux	t3_md66ux	/r/FemaleDatingStrategy/comments/md66ux/why_are_males/gs7pkdw/
zelor	I could care less about seeing a gut here and there in the wild....just stop staring at me, assholes. That's why I  love yoga classes. Scotes think it's too feminine to join in, and woke bros join but realize they have to try harder since flexibility is more of a female attribute, and they tend to quit.	1616709065.0	gs81f0a	t3_md66ux	t3_md66ux	/r/FemaleDatingStrategy/comments/md66ux/why_are_males/gs81f0a/
101s65	Yep. Two men have exposed themselves in front me at the gym in the past year alone. Not accounted for: the countless times I have been followed through the gym, leered at for minutes at a time etc.	1616702079.0	gs7loma	t3_md66ux	t3_md66ux	/r/FemaleDatingStrategy/comments/md66ux/why_are_males/gs7loma/
7e073b9b	More than enough porn available for them to ever watch in their lifetimes and it isn't enough for them. They want every woman in existence to be masturbatory material. The entitlement is fucking insane.	1616701540.0	gs7kdj8	t3_md66ux	t3_md66ux	/r/FemaleDatingStrategy/comments/md66ux/why_are_males/gs7kdj8/
ywzr8	Gotta thank God for my religious country actually having female only gyms. I may dislike a lot of stuff about this country of mine and I'm grateful I never had to be afraid of being filmed at the gym. This is depraved.	1616708461.0	gs804hy	t3_md66ux	t3_md66ux	/r/FemaleDatingStrategy/comments/md66ux/why_are_males/gs804hy/
N/A	[deleted]	1616707053.0	gs7x2h1	t3_md66ux	t3_md66ux	/r/FemaleDatingStrategy/comments/md66ux/why_are_males/gs7x2h1/
N/A	[deleted]	1616701608.0	gs7kjdr	t3_md66ux	t3_md66ux	/r/FemaleDatingStrategy/comments/md66ux/why_are_males/gs7kjdr/
2fgdoa8h	Even with the staff you aren’t safe, first and last gym I ever signed up for the man kept my number and texted me daily and would harass me when I came in. I’d looove an all women’s gym soo much.	1616706427.0	gs7votq	t3_md66ux	t3_md66ux	/r/FemaleDatingStrategy/comments/md66ux/why_are_males/gs7votq/
95gpnjho	I'm willing to bet he's just sitting on the equipment not using it. Fucking gross pot bellied scrote.	1616703787.0	gs7ppvo	t3_md66ux	t3_md66ux	/r/FemaleDatingStrategy/comments/md66ux/why_are_males/gs7ppvo/
N/A	[deleted]	1616701768.0	gs7kxa2	t3_md66ux	t3_md66ux	/r/FemaleDatingStrategy/comments/md66ux/why_are_males/gs7kxa2/
8759edc2	The saddest part about this is that it’s planet fitness, where if the female reported his behavior she would be banned for wearing shorts.	1616715687.0	gs8ewl2	t3_md66ux	t3_md66ux	/r/FemaleDatingStrategy/comments/md66ux/why_are_males/gs8ewl2/
8i3il15v	Access to literally hundreds of videos, still chooses to do this. Not that I support porn, it's just gross that a man who doesn't care about the harmful effects of porn would choose to do this anyway.	1616704380.0	gs7r2qs	t3_md66ux	t3_md66ux	/r/FemaleDatingStrategy/comments/md66ux/why_are_males/gs7r2qs/
3e3k1wo8	This is why I stoped going to my last gym 😡😡😡	1616707741.0	gs7ykbl	t3_md66ux	t3_md66ux	/r/FemaleDatingStrategy/comments/md66ux/why_are_males/gs7ykbl/
1673gu	THIS! I went to PF yesterday and was using the hip adductor machine. I began to notice that any time I looked to the side during my rest sets, a middle aged man was watching me intently. Any time I happened to glance in that direction we would lock eyes.  I moved machines, and he conveniently moved machines as well to one that was across from me and just kept staring at me! I moved machines again, and he repeated the same process and maintained the creepy eye contact and staring. I was so freaked out that I went to the first floor to get away from him.	1616707110.0	gs7x6v1	t3_md66ux	t3_md66ux	/r/FemaleDatingStrategy/comments/md66ux/why_are_males/gs7x6v1/
N/A	Hey, you summed up why I don't go to gyms.	1616710179.0	gs83qzs	t3_md66ux	t3_md66ux	/r/FemaleDatingStrategy/comments/md66ux/why_are_males/gs83qzs/
N/A	Male behavior is abhorrent. If they act like mindless, mannerless, depraved creatures, why should we treat them any different? It fills me with rage to see how many women in this thread have suffered disgusting male behavior while trying to work out. Why don’t they get it?? We don’t exist for their enjoyment in fact, most women would probably be happy to only interact with men once every Thursday, provided they were in a safety box with a leash.	1616725341.0	gs8xglo	t3_md66ux	t3_md66ux	/r/FemaleDatingStrategy/comments/md66ux/why_are_males/gs8xglo/
N/A	This scares me. Ever since gyms reopened I’ve been worried about this. Sometimes when you’re squatting you can feel the eyes glaring. It’s honestly distracting, especially when I’m trying really hard to achieve a goal/reach a new weight lifted.   Yeah, I like to workout you fucking scrotes. You don’t see me taking sneaky photos of you doing a workout. It’s disgusting.	1616707756.0	gs7yljp	t3_md66ux	t3_md66ux	/r/FemaleDatingStrategy/comments/md66ux/why_are_males/gs7yljp/
47zrk4vm	Someone filmed me at the gym once. It was awful and violating and there was a whole big scene.   Then, when I got home and told the story to my SO, he just brushed it off with a, 'why were you so mad? He thought you were hot'.  God, I hate that guy.	1616718280.0	gs8jzxk	t3_md66ux	t3_md66ux	/r/FemaleDatingStrategy/comments/md66ux/why_are_males/gs8jzxk/
3ymufkee	I much prefer an all female environment, men are all grungy and stinky at the gym even when they aren’t deviants.   It’s quite off putting	1616702562.0	gs7muyj	t3_md66ux	t3_md66ux	/r/FemaleDatingStrategy/comments/md66ux/why_are_males/gs7muyj/
6kcqhlyx	Creep, honestly men are such a creep	1616700618.0	gs7i52k	t3_md66ux	t3_md66ux	/r/FemaleDatingStrategy/comments/md66ux/why_are_males/gs7i52k/
3nhes4sa	I gave up on going to my little apartment gym alone because of this shit. And the “stop dressing slutty” male brigade can STFU. My friend was leered at while in hijab and loose jogging clothes and said she’d never go to the gym alone again either.   An old man grabbed my elbow without permission and told me I was using a machine wrong and was going to “help” teach me...I hadn’t even started using it yet. He wasn’t even working out! He was eating a sandwich and talking on the phone when I came in.   He didn’t take me seriously when I moved away from him until my now-husband showed up; then I guess he thought, oh, she is some man’s property. 🙄 He kept questioning if my husband is my personal trainer...seems he couldn’t believe he was my BF, maybe because we’re an interracial couple...who knows? But regardless, the old creep only left me alone because of another man’s presence. Disgusting. When I left, he was slamming weights down and making a racket on the floor, which was above the manager’s office. I reported his scrotatious behavior to them because I knew they had banned another guy for inappropriately touching their staff. Yes, men actually go to the gym and try to grope the apartment staff in front of everyone, usually by asking for “hugs.”	1616708938.0	gs8155f	t3_md66ux	t3_md66ux	/r/FemaleDatingStrategy/comments/md66ux/why_are_males/gs8155f/
8ygtnym6	Disgusting.	1616702667.0	gs7n3s1	t3_md66ux	t3_md66ux	/r/FemaleDatingStrategy/comments/md66ux/why_are_males/gs7n3s1/
5iyoh1oi	I never felt comfortable in a gym, even with my xxxl t shirts that covered everything	1616709756.0	gs82vg3	t3_md66ux	t3_md66ux	/r/FemaleDatingStrategy/comments/md66ux/why_are_males/gs82vg3/
3z4s9m3	I would LOVE an all female gym. Fuck I wish that was a thing.	1616719728.0	gs8mt6z	t3_md66ux	t3_md66ux	/r/FemaleDatingStrategy/comments/md66ux/why_are_males/gs8mt6z/
