N/A	Yes. I see a lovely wife who looks physically exhausted. Her husband is not making sure she is rested and has the funds to maintain as best as she can now. And that is sad. My mom and dad have been married nearly 50 years. She has always been a homemaker. He makes sure she has whatever spending money she needs for her Estee Lauder, perfume, haircuts, facials on holidays, and replacing clothes. He buys her a new purse every Christmas and full perfume set. Sometimes she finds 2 3 new ones she likes and buys all of them. He writes down sizes for her Winter clothes and will go to the store to surprise her with new ones. They are modestly wealthy Dave Ramsey types and he makes sure he provides whatever she needs and has money. (She doesnt like to go to the bank anymore now that she is older and so I watch him when I'm over sometimes put money in a drawer for her and he asks if there's anymore she needs if she has other things she wants to do that week). Edited to correct typos because..thumbs.	1622053042.0	gzjkdlf	t3_nlkkof	t1_gzjc2gv	/r/FemaleDatingStrategy/comments/nlkkof/oops/gzjkdlf/
kh0i2	Men always like to tell me how much more they get hit on with a wedding ring on but really, I know it is so much more than that. They are probably looking good because their wives are taking good care of them, picking out nice clothes for them, telling them to get regular haircuts/shaving, feeding them well, watching the children while they go to the gym, etc.	1622056526.0	gzjsqrb	t3_nlkkof	t1_gzjkm5z	/r/FemaleDatingStrategy/comments/nlkkof/oops/gzjsqrb/
8lpwhwul	hmmm maybe we should start putting these kind of memes out there lol	1622053646.0	gzjltfc	t3_nlkkof	t1_gzjkm5z	/r/FemaleDatingStrategy/comments/nlkkof/oops/gzjltfc/
b4ibcnnm	It’s going to be the reverse, I’ve seen memes like that made by pickmes lol! They proudly say they changed the bum and made him looking like Brad Pitt or some bs like that😂	1622081961.0	gzlacct	t3_nlkkof	t1_gzjkm5z	/r/FemaleDatingStrategy/comments/nlkkof/oops/gzlacct/
5rj1lib1	Oh, and to the lurker (who will inevitably circle back/continue to seethe.😏🤣🙄) who’s comment was swiftly removed (Thank you FDS filters!!👌🏻) that said I was “too f*at to have opinions on relationships”,🤣 a few things: I’d confidently wager I’ve been in and have FAR more relationship experience than your sad a*ss EVER has or will, and (granted if you ever have had one.🙄🤣) that your ex or soon to be ex girlfriend or wife, looks similar to the after of the picture on the right, here. Probably even MORE tired and upset looking.🙄   Touching a nerve there with your TRUE legacy, I see?😘 Also, you can kiss my fat a*$$, and stay mad you eternal l*ose*r. You’ll even continue to lose in your afterlife, and that makes me GIDDY.	1622117694.0	gzmm1zw	t3_nlkkof	t1_gzk5r2r	/r/FemaleDatingStrategy/comments/nlkkof/oops/gzmm1zw/
xpsl2	I couldn't see this any other way. If they were shooting for "she just doesn't try to impress any more," they missed by a mile and landed on "terrified."	1622127039.0	gzn52yj	t3_nlkkof	t1_gzjoi9b	/r/FemaleDatingStrategy/comments/nlkkof/oops/gzn52yj/
N/A	Yes. I dated a man rhat said he did not like makeup and didnt want me to wear it. So, I was a good sport about it until we had gone to lunch and his eyes were out of their sockets staring at a woman who had the full Kardashian contoured look, eyelashes, eyebrows. I stopped seeing him as it was an obvious control thing with him.	1622052673.0	gzjjidb	t3_nlkkof	t1_gzj6boc	/r/FemaleDatingStrategy/comments/nlkkof/oops/gzjjidb/
19dymr02	My ex would say I look better without makeup but would then comment on why I don’t spend as much time to get ready to go out with him as I do for my friends. 😂 But he was also complaining I spend too much time getting ready to go out with him. Like, boy, what do you want? ¯\\\_(ツ)\_/¯	1622058400.0	gzjx7tv	t3_nlkkof	t1_gzj6boc	/r/FemaleDatingStrategy/comments/nlkkof/oops/gzjx7tv/
5vhe0zcp	Absolutely, one of my exes said he wanted me to go out with no makeup, when I barely wore any at all, and said I should dress like his female friend. He got super angry when I dressed up and looked fabulous and said that I 'looked like I was trying to attract other men' despite the fact that at the time I was, for some unfathomable reason, really smitten with him. Ugh he was horrible.	1622060708.0	gzk2ram	t3_nlkkof	t1_gzj6boc	/r/FemaleDatingStrategy/comments/nlkkof/oops/gzk2ram/
qfoqa	My ex literally said that he didn't like how confident my dresses made me. Like in those exact words!	1622090927.0	gzlpboy	t3_nlkkof	t1_gzj6boc	/r/FemaleDatingStrategy/comments/nlkkof/oops/gzlpboy/
723a30cg	Preach! The 2 worst relationships I was in, with complete narcs, started off with them telling me they don’t like make up and thought I was overdressed (like if I wore jeans with a nice top). Yet they loved staring at other women and scrolling through insta profiles.	1622053998.0	gzjmnu7	t3_nlkkof	t1_gzj6boc	/r/FemaleDatingStrategy/comments/nlkkof/oops/gzjmnu7/
N/A	Seriously idk how men can look at women before and after marriage and not realize they're the problem!!   "My wife has no energy and is always in a bad mood ever since we had our second kid" aka she's taking care of three kids, husband included, of course with no help from him and also probably has to work so that she's not a "gold digger" smh	1622047695.0	gzj7hre	t3_nlkkof	t1_gzj2dvb	/r/FemaleDatingStrategy/comments/nlkkof/oops/gzj7hre/
9npne2uz	Worst drug out there 🤪 hard pass.	1622054980.0	gzjp0gb	t3_nlkkof	t1_gzj2dvb	/r/FemaleDatingStrategy/comments/nlkkof/oops/gzjp0gb/
606vagko	So happy you got out, I promise it gets better. Please take care of yourself.	1622091275.0	gzlpun2	t3_nlkkof	t1_gzk56y7	/r/FemaleDatingStrategy/comments/nlkkof/oops/gzlpun2/
b4ibcnnm	Thank you so much for providing context!!	1622082444.0	gzlb8tv	t3_nlkkof	t1_gzladt3	/r/FemaleDatingStrategy/comments/nlkkof/oops/gzlb8tv/
1172dx	That was a ride	1622088060.0	gzlkxwp	t3_nlkkof	t1_gzladt3	/r/FemaleDatingStrategy/comments/nlkkof/oops/gzlkxwp/
2pfs82fg	Thank you! I was wondering what her story was	1622088333.0	gzlldex	t3_nlkkof	t1_gzladt3	/r/FemaleDatingStrategy/comments/nlkkof/oops/gzlldex/
N/A	[deleted]	1622060413.0	gzk224w	t3_nlkkof	t1_gzjq9ao	/r/FemaleDatingStrategy/comments/nlkkof/oops/gzk224w/
9rti60hx	Same. My mom and dad are 60 and they look 45 maybe 50 because they have a healthy relationship. My dad is HV and doesn’t add unnecessary stress to my moms life. People wonder what their secret is lol	1622132200.0	gznh616	t3_nlkkof	t1_gzk8sqo	/r/FemaleDatingStrategy/comments/nlkkof/oops/gznh616/
v4qqb	Indeed, the only way to maintain your youthful look in marriage is to be married to a HVM, otherwise just stay single.	1622089581.0	gzlnaox	t3_nlkkof	t1_gzk8sqo	/r/FemaleDatingStrategy/comments/nlkkof/oops/gzlnaox/
4mo0a	Oh you just *know* she will glow up!	1622102410.0	gzm3m20	t3_nlkkof	t1_gzlwhxf	/r/FemaleDatingStrategy/comments/nlkkof/oops/gzm3m20/
9s9zxajd	i don't get why i'm being downvoted, am i not using this phrase correctly??	1622153087.0	gzotlo4	t3_nlkkof	t1_gzk6o2n	/r/FemaleDatingStrategy/comments/nlkkof/oops/gzotlo4/
634om2vg	She looks like a hostage.	1622056637.0	gzjt02t	t3_nlkkof	t1_gzjqrbv	/r/FemaleDatingStrategy/comments/nlkkof/oops/gzjt02t/
a8cfj2tg	I mean I look like this in the fucking morning. I feel like most do. Who the fuck looks good when they wake up and are thinking about rushing to get ready for work, haven't had any food or coffee? Especially if it's a makeup versus no makeup picture...  Don't date other humans if you're not okay with dating a human. They're not a toy. They don't always feel good, look good. Sometimes they're a mess. Empathy fucking matters.  Maybe she's depressed and malnourished but honestly to me it just looks like a normal fucking day. Maybe I'm a fucking mess though lol	1622065987.0	gzke7ze	t3_nlkkof	t1_gzjqrbv	/r/FemaleDatingStrategy/comments/nlkkof/oops/gzke7ze/
3b0da7w4	That's incredibly sad. I remember I slept in my make up once after a night out clubbing. My eyes hurt bad the next morning, I felt greasy and scummy. I don't know how people could do it intentionally.	1622054272.0	gzjnbaa	t3_nlkkof	t1_gzjk8iq	/r/FemaleDatingStrategy/comments/nlkkof/oops/gzjnbaa/
84o9i8oi	I remember reading and hearing stories about women who would wake up before their husbands did for work so they could do their makeup and hair! That's insane!	1622073274.0	gzktrdx	t3_nlkkof	t1_gzjk8iq	/r/FemaleDatingStrategy/comments/nlkkof/oops/gzktrdx/
3hasyt28	that’s so crazy to me (not crazy in a pejorative way but like wow! i’ve never heard of that)	1622053511.0	gzjlhwo	t3_nlkkof	t1_gzjk8iq	/r/FemaleDatingStrategy/comments/nlkkof/oops/gzjlhwo/
aadtrhcf	This is awfully unhygienic and bad for the skin.	1622056527.0	gzjsqvx	t3_nlkkof	t1_gzjk8iq	/r/FemaleDatingStrategy/comments/nlkkof/oops/gzjsqvx/
166nt1	[Miss Maisel portrays the 50s wife mindset.](https://www.youtube.com/watch?v=pvKe0c007Cc)  I cannot imagine spending your entire life not being comfortable.  Edit: I couldn't let a mention of Miss Maisel go by without adding [this amazing video of Suzie telling Midge's cheating ex exactly why she is better off without him.](https://www.youtube.com/watch?v=yYQp_87fRFk)	1622056212.0	gzjs08q	t3_nlkkof	t1_gzjk8iq	/r/FemaleDatingStrategy/comments/nlkkof/oops/gzjs08q/
4n6gcii8	My grandmas luggage was lost on a trip once with her hot rollers in it. She spent the whole trip sleeping upright on a chair so she didn't mess up her hair til she got home 😂	1622072899.0	gzksz01	t3_nlkkof	t1_gzjk8iq	/r/FemaleDatingStrategy/comments/nlkkof/oops/gzksz01/
aumkkhv5	Exactly it’s so unrealistic.	1622049495.0	gzjbu6u	t3_nlkkof	t1_gzj2yhw	/r/FemaleDatingStrategy/comments/nlkkof/oops/gzjbu6u/
4d7t91zx	and they want “a girl that can eat” and will scoff if you order a salad, but you BETTER still be a size 2… somehow…	1622051617.0	gzjgyns	t3_nlkkof	t1_gzjd74k	/r/FemaleDatingStrategy/comments/nlkkof/oops/gzjgyns/
aumkkhv5	Funny because those same men would start screaming and vomiting when they see pubic, leg or facial hair on a woman. Natural my ass. They can’t stand the sight of a woman in her natural form	1622071889.0	gzkqw5e	t3_nlkkof	t1_gzjd74k	/r/FemaleDatingStrategy/comments/nlkkof/oops/gzkqw5e/
v4qqb	People left and right trying to convince me that I am not normal and I will regret it when I choose to be steadfastly single going into my 30s. But I just take one look, just one look at their faces and I am like "nah I'm good". Makeup and pretty clothing can't hide how stressed and exhausted they are. Some even stuck in that "dumb barbie" headspace so they don't have to face their sad reality.  I can't even remember when is the last time I met a truly happily married women. There's always something wrong, always. And they can never rest and be at peace too, their work mode is always on and breaking themselves down trying to do a millions things at once. It is a lie that women is better at multitasking, we are just forced to do it and we master it due to neverending practices.	1622088786.0	gzlm2wk	t3_nlkkof	t1_gzjmev6	/r/FemaleDatingStrategy/comments/nlkkof/oops/gzlm2wk/
5vhe0zcp	It took me three years to recover from my abusive ex. I took a photo of myself after I left too, because I felt like I needed a record of what he did and how badly it affected me.	1622059905.0	gzk0uea	t3_nlkkof	t1_gzjnslt	/r/FemaleDatingStrategy/comments/nlkkof/oops/gzk0uea/
3v88oykg	These LVM don't see it like that. This is supposed to be showing how they think women 'let themselves go' during marriage. They don't get that married women often start to look like shit because they're run ragged doing all the chores and all the work while their husbands come home and watch TV all night.	1622067864.0	gzkigj3	t3_nlkkof	t1_gzjnslt	/r/FemaleDatingStrategy/comments/nlkkof/oops/gzkigj3/
scyr22p	Does the same apply to women in cohabiting relationships, or is there something about marriage that turns men into babies?	1622139172.0	gznxsgp	t3_nlkkof	t1_gzk1gp5	/r/FemaleDatingStrategy/comments/nlkkof/oops/gznxsgp/
6ibkivio	The handbook is perfect for all these things 👆	1622133528.0	gznk9ub	t3_nlkkof	t1_gzjs9z7	/r/FemaleDatingStrategy/comments/nlkkof/oops/gznk9ub/
yiqo2	I don't think they make this model of man anymore :(	1622055167.0	gzjpgrv	t3_nlkkof	t1_gzjkdlf	/r/FemaleDatingStrategy/comments/nlkkof/oops/gzjpgrv/
25uk6el5	Your dad just...gives your mom money? No manipulation, mind games, guilt trips? No OnlyFans? He just wants her to be happy wtf? 👁👄👁	1622062882.0	gzk7ts2	t3_nlkkof	t1_gzjkdlf	/r/FemaleDatingStrategy/comments/nlkkof/oops/gzk7ts2/
5vhe0zcp	That is so sweet, they sound like a really adorable couple.	1622060289.0	gzk1rmt	t3_nlkkof	t1_gzjkdlf	/r/FemaleDatingStrategy/comments/nlkkof/oops/gzk1rmt/
84o9i8oi	That is so sweet! A lot of men will read that and think that we're just entitled princess b****** while not understanding that that is a way that a man is showing love for and providing/caring for his wife! I'll bet your parents are absolutely adorable together and I'll bet your mama is sweet too! I'd also be willing to bet that your father was a great dad to you as well! 🥰🌞🙌	1622074083.0	gzkvgfo	t3_nlkkof	t1_gzjkdlf	/r/FemaleDatingStrategy/comments/nlkkof/oops/gzkvgfo/
kh0i2	And then they go flirt and claim the women are just all over them. Please.	1622056545.0	gzjssd4	t3_nlkkof	t1_gzjsqrb	/r/FemaleDatingStrategy/comments/nlkkof/oops/gzjssd4/
4t3wna3e	They aren't getting hit on, the women just feel a sense of security because "oop this one's taken so I can be nice" 😑	1622073406.0	gzku1a9	t3_nlkkof	t1_gzjsqrb	/r/FemaleDatingStrategy/comments/nlkkof/oops/gzku1a9/
a9e94ft	This is such an Important point because scrotes think it's because women like men who are already taken. Women see that man as already vetted and as relationship material (hence the behavior of women towards married men). Scrote logic is insidious.	1622073751.0	gzkurlh	t3_nlkkof	t1_gzjsqrb	/r/FemaleDatingStrategy/comments/nlkkof/oops/gzkurlh/
3pbgrnpq	https://i.imgur.com/dVt8vMy.jpg	1622056633.0	gzjszpi	t3_nlkkof	t1_gzjltfc	/r/FemaleDatingStrategy/comments/nlkkof/oops/gzjszpi/
bt5w1wt8	Yes!! Men say they like natural women, but lust after women in makeup & tight clothes online, in person, and with their boys. It’s a control thing for their spouses.   The Madonna/Whore complex or some bs where you’re not supposed to attract attention from other men yet they can eye fuck & harass other women because it’s what boys do.	1622057633.0	gzjvd0r	t3_nlkkof	t1_gzjjidb	/r/FemaleDatingStrategy/comments/nlkkof/oops/gzjvd0r/
5kx9oozr	To break you, control you, and use you.	1622075126.0	gzkxkzj	t3_nlkkof	t1_gzjx7tv	/r/FemaleDatingStrategy/comments/nlkkof/oops/gzkxkzj/
6f4orzzc	Thank you ❤️	1622093358.0	gzlsqq1	t3_nlkkof	t1_gzlpun2	/r/FemaleDatingStrategy/comments/nlkkof/oops/gzlsqq1/
N/A	[deleted]	1622074563.0	gzkwfps	t3_nlkkof	t1_gzjt02t	/r/FemaleDatingStrategy/comments/nlkkof/oops/gzkwfps/
2y9ki3vc	Exactly.  Also who’s to say she isn’t struggling with depression in the first photo?  Anyone can have a mental illness	1622170737.0	gzpro0y	t3_nlkkof	t1_gzke7ze	/r/FemaleDatingStrategy/comments/nlkkof/oops/gzpro0y/
yiqo2	My skin would be so trashed. Yuck	1622055014.0	gzjp3gm	t3_nlkkof	t1_gzjnbaa	/r/FemaleDatingStrategy/comments/nlkkof/oops/gzjp3gm/
N/A	As someone who was too lazy to clean off her make up everyday in HS, its pore city now sadly	1622074604.0	gzkwivj	t3_nlkkof	t1_gzjnbaa	/r/FemaleDatingStrategy/comments/nlkkof/oops/gzkwivj/
scyr22p	Isn't that portrayed in "Marvelous Mrs. Maisel"?	1622137701.0	gznu7l0	t3_nlkkof	t1_gzktrdx	/r/FemaleDatingStrategy/comments/nlkkof/oops/gznu7l0/
2hfu0yas	I know a stupid pick me older woman that always did that	1622078401.0	gzl460r	t3_nlkkof	t1_gzktrdx	/r/FemaleDatingStrategy/comments/nlkkof/oops/gzl460r/
e6r4g	yeah she actually tells me i look ugly and makes shocked gasping noises if i go outside without makeup. growing up i was taught to never let anyone but especially not men see you without makeup. luckily im a confident adult now so it doesnt matter but it would be nice to have a grandma i could be closer with	1622054060.0	gzjmt2u	t3_nlkkof	t1_gzjlhwo	/r/FemaleDatingStrategy/comments/nlkkof/oops/gzjmt2u/
e6r4g	yeah i think she gets away with it because she only wears eye makeup. still unhealthy and unhygienic but she avoided any serious acne etc that you would expect	1622057576.0	gzjv86y	t3_nlkkof	t1_gzjsqvx	/r/FemaleDatingStrategy/comments/nlkkof/oops/gzjv86y/
e6r4g	that standup was good but i feel like was totally inspired by this old spoken word poem that i fucking love https://youtu.be/mhOnqPkEvmc	1622113009.0	gzmf1k3	t3_nlkkof	t1_gzjs08q	/r/FemaleDatingStrategy/comments/nlkkof/oops/gzmf1k3/
3e3n7j9l	Only after being on FDS for years have I realized that this is because they don’t want their own poor dietary choices pointed out by stark contrast. Eat that burger with him so he doesn’t feel bad about it! All ego.	1622056879.0	gzjtkev	t3_nlkkof	t1_gzjgyns	/r/FemaleDatingStrategy/comments/nlkkof/oops/gzjtkev/
5vhe0zcp	When I tried online dating I was troubled by how many men were very particular about what their partners ate ie they'd say things like 'I can't be dealing with fussy eaters like vegetarians and vegans.' They'd often say they wanted a woman who they could go out for meals with and she'd eat anything. I have several food allergies and I get sick if I eat certain foods, I've adjusted to it and it's mostly not a big deal but several men I spoke to clearly saw it as a negative thing, as if I've chosen to have these allergies. One guy was mean saying he thought what I had 'would be a nightmare' and he was apparently very glad he didn't have the same allergies. Meanwhile my ex used to get nasty about what I ate, accusing me of eating too much when I was rapidly becoming underweight due to the stress of dating him. I'm a great cook so they all missed out lol. I don't want to date anyone who is mean about me having allergies, it's the opposite of being a loving and supportive partner.	1622060547.0	gzk2dno	t3_nlkkof	t1_gzjgyns	/r/FemaleDatingStrategy/comments/nlkkof/oops/gzk2dno/
558534mv	I eat like a pregnant pig. I'm 32 and wear a size 0 or 1. I have IBS-D and a panic disorder and both make it VERY difficult for me to gain and maintain weight. I get made fun of if I eat something healthy in front of people because "You should be eating a cheeseburger! Not a salad!" I'm like "Excuse me, Greg. First of all this is my body and I enjoy eating vegetables unlike your man child ass who refuses to eat anything green at 50 years old. And secondly fuck you." I don't tell them about my illnesses because it's none of their business. No matter what we women do LVM will always have some snarky shit to say about it.	1622064545.0	gzkbfdz	t3_nlkkof	t1_gzjgyns	/r/FemaleDatingStrategy/comments/nlkkof/oops/gzkbfdz/
aadtrhcf	And he will tell her off for "eating like a guy" if she is a person with fast metabolism who needs to eat much.	1622056786.0	gzjtcgm	t3_nlkkof	t1_gzjgyns	/r/FemaleDatingStrategy/comments/nlkkof/oops/gzjtcgm/
ca9sq	We're not permitted to occupy space in the same way men are.	1622077323.0	gzl2050	t3_nlkkof	t1_gzjgyns	/r/FemaleDatingStrategy/comments/nlkkof/oops/gzl2050/
N/A	There's no difference. All that matters is a man taking the facade down and deciding to use you as a slave	1624012346.0	h27103d	t3_nlkkof	t1_gznxsgp	/r/FemaleDatingStrategy/comments/nlkkof/oops/h27103d/
N/A	True story. :(	1622056615.0	gzjsy7p	t3_nlkkof	t1_gzjpgrv	/r/FemaleDatingStrategy/comments/nlkkof/oops/gzjsy7p/
N/A	[deleted]	1622084800.0	gzlfghh	t3_nlkkof	t1_gzjpgrv	/r/FemaleDatingStrategy/comments/nlkkof/oops/gzlfghh/
N/A	Haha right? And she gets her Social Security on top of it. That goes into her own bank account.	1622063135.0	gzk8ehv	t3_nlkkof	t1_gzk7ts2	/r/FemaleDatingStrategy/comments/nlkkof/oops/gzk8ehv/
N/A	[deleted]	1622084912.0	gzlfng2	t3_nlkkof	t1_gzkvgfo	/r/FemaleDatingStrategy/comments/nlkkof/oops/gzlfng2/
84o9i8oi	That's exactly it! Those rings totally give you a false sense of security!	1622074539.0	gzkwdz7	t3_nlkkof	t1_gzku1a9	/r/FemaleDatingStrategy/comments/nlkkof/oops/gzkwdz7/
10lcgk	Oh gosh this is very true. Speaking of sense of security... I once befriended a guy when out at a restaurant bar waiting for friends, who I read as gay. I'm not usually off in this dept. Not to be offensive or judgy or anything, but I felt more comfortable just chatting with him and making plans to hang out again sometime because I saw he wasn't gonna try anything. We met up down the line and talked about art and everything and I was still getting some of these non straight signals. Nope found out down the line he actually wanted to date me. I've given up on making new guy friends, they always try something even knowing I'm in a relationship. They do this to themselves. We can't just be nice and friendly ffs.	1622080719.0	gzl879p	t3_nlkkof	t1_gzku1a9	/r/FemaleDatingStrategy/comments/nlkkof/oops/gzl879p/
7epx7fo3	Oh my god! You absolutely nailed it right here 👌👏⚠️	1622084937.0	gzlfoxy	t3_nlkkof	t1_gzku1a9	/r/FemaleDatingStrategy/comments/nlkkof/oops/gzlfoxy/
N/A	After a few experiences getting the stink eye from wives for like, existing near their man, I actually try to talk to married men/men in a relationship even *less*, except when it's absolutely necessary or in a group setting with their partner right there. \*sigh\*	1622116170.0	gzmjk4s	t3_nlkkof	t1_gzku1a9	/r/FemaleDatingStrategy/comments/nlkkof/oops/gzmjk4s/
xdq5p	Please make this its own post. I need some more never stop vetting discussions!	1622057872.0	gzjvy6r	t3_nlkkof	t1_gzjszpi	/r/FemaleDatingStrategy/comments/nlkkof/oops/gzjvy6r/
N/A	[deleted]	1622161101.0	gzp9htw	t3_nlkkof	t1_gzkwfps	/r/FemaleDatingStrategy/comments/nlkkof/oops/gzp9htw/
avj94i45	I'm glad you were able to get free and get back to being the best version of you!	1622075095.0	gzkxir6	t3_nlkkof	t1_gzkwfps	/r/FemaleDatingStrategy/comments/nlkkof/oops/gzkxir6/
4ayz7lus	Glad you got out. A friend recently sent me pictures from when I was 20, with an abusive narcissist, and overweight/terrible acne from alcohol (escapism) and poor diet/just really sad looking... I'm 5 months pregnant and in better shape, happy, and hold myself higher because I'm married to a dude who isn't mean.   Get it girl.   And anyone who sees a sad pile of crap in a photo of yourself and realizes an abusive partner is why: make a plan, get some help, and get out. It's worth it.	1622076403.0	gzl069z	t3_nlkkof	t1_gzkwfps	/r/FemaleDatingStrategy/comments/nlkkof/oops/gzl069z/
13qles	You are not alone.  Thank you for sharing  I wish you love, peace and light...	1622084540.0	gzlf0dp	t3_nlkkof	t1_gzkwfps	/r/FemaleDatingStrategy/comments/nlkkof/oops/gzlf0dp/
a19i2ivx	I'm 26 and recently had a similar experience. Since then I have yet to actually leave my husband, however I've been taking better care of myself and doing things that make me happy. I look better, but still have a while to go to heal my self worth and self esteem.	1629816236.0	ha60rvm	t3_nlkkof	t1_gzkwfps	/r/FemaleDatingStrategy/comments/nlkkof/oops/ha60rvm/
N/A	This is happening to a friend now. It's only been two years but the youth is being sucked right out of her.	1625983019.0	h4s6ial	t3_nlkkof	t1_gzkwfps	/r/FemaleDatingStrategy/comments/nlkkof/oops/h4s6ial/
84o9i8oi	That seems like it could be a very distinct possibility! I personally have not seen that show but just from the bits I've seen of it, it definitely seems like it could be like that! Also a bit like Pleasantville from the late 90s!	1622141660.0	gzo3nkb	t3_nlkkof	t1_gznu7l0	/r/FemaleDatingStrategy/comments/nlkkof/oops/gzo3nkb/
14uvkq	This is SO disturbing, I am so sorry that you were subjected to that nonsense. As if you're little more than an object being displayed for purchase!? You're a person!	1622059085.0	gzjyvvh	t3_nlkkof	t1_gzjmt2u	/r/FemaleDatingStrategy/comments/nlkkof/oops/gzjyvvh/
7882d531	 I got flack for body hair, short hair, natural afro hair, dressing like a lesbian, being too fat(I've been told numerous times by other girls that they wish they had my body,which is a whole other can of worms.) I was a junior bridesmaid once,and the bride(aunt) wanted me to come with a full face of makeup and waxed legs. 'Luckily',I got away with curled hair, waxed legs, high-wedged shoes and trimmed armpits. My six year old female cousin still made a point to tell me that my armpits are too hairy,so keep your arms down. I was thirteen.	1622065756.0	gzkdqfb	t3_nlkkof	t1_gzjmt2u	/r/FemaleDatingStrategy/comments/nlkkof/oops/gzkdqfb/
8k7u8wwp	Wow. I cant undrestand how some talk to their grandchildren like this. I'm sorry you had to hear this from her	1622059020.0	gzjyq5d	t3_nlkkof	t1_gzjmt2u	/r/FemaleDatingStrategy/comments/nlkkof/oops/gzjyq5d/
v4qqb	The funny thing is, I watched documentaries with people who wears makeup all the time, some even to their sleep and they look... older and greasy. That makeup can't hide how tired they are and how skin just wants to do its thing but being constantly blocked. So unless you have a team of professionals for continuous touch up, you will never look "perfect". Bare-faced people actually look younger and fresher.	1622087350.0	gzljsgj	t3_nlkkof	t1_gzjmt2u	/r/FemaleDatingStrategy/comments/nlkkof/oops/gzljsgj/
