N/A	At first, I was like - huh? Then understanding landed. Followed by visceral rage.	1616713314.0	gs8a5iy	t3_md66ux	t3_md66ux	/r/FemaleDatingStrategy/comments/md66ux/why_are_males/gs8a5iy/
5j89om9r	99% of men who use gyms fall into one or more categories:  * Creep and spy on women * Sweat all over the machines/benches and never clean them * Never re-rack their weights, leaving them for everyone else to either trip over or remove before you can use the bench  Very few men treat the people and the equipment at the gym with respect. In other words, they act the same way at the gym as they do at home. Probably another way to vet a man while dating. 🤣 Does he clean up after himself? Does he stare at other women? Is he willing to listen to advice or otherwise accept help from a woman at the gym?  When I still used the gym I went at slow times (weekdays after 8pm and weekends after 3pm) to avoid as many men as possible. Or I did group classes with mostly women (yoga, pilates, kickboxing). Now I get most of my exercise outside or using my home gym.	1616704648.0	gs7roi7	t3_md66ux	t3_md66ux	/r/FemaleDatingStrategy/comments/md66ux/why_are_males/gs7roi7/
N/A	This makes me miss the old gym I use to travel to every day. Unfortunately, that gym is closed, because it's made up of approximately 95% old people hahaha (and you know gyms can't risk it out here). It's just sad I have to go to a crusty gym that looks just LIKE THE PICTURE!  Such is life.	1616710499.0	gs84evz	t3_md66ux	t3_md66ux	/r/FemaleDatingStrategy/comments/md66ux/why_are_males/gs84evz/
2lraptay	men only do this because they enjoy the thrill of violating a woman's privacy or feeling some sort of perverse connection with a woman in their lives. they could enjoy photos of women online, the internet is full of stuff catering for these freaks but they STILL keep doing this in gyms	1616730094.0	gs95v0r	t3_md66ux	t3_md66ux	/r/FemaleDatingStrategy/comments/md66ux/why_are_males/gs95v0r/
9mccjcq0	Sometimes even female only gyms don’t stop creeps. I was taking a women’s self defense class and a homeless man went up to the window and started touching himself while we were stretching. Watching us. I’m not sure I was the only one that noticed but I let some employees at the shopping center know after I was finished with class.    I thought I was in a safe space because the class was all women but creeps will still try to invade our spaces.   I used to also go to a local gym that had a small women’s workout area, thats one of the reasons why I joined. But when men would workout in the area no one said anything and the rules weren’t enforced. Sometimes I’d see them staring at women while they did their squats. Men ignored the signs that said women only.  It didn’t matter that the gym was huge, had tons of equipment and was 2 stories with tons of male dominated space and better equipment. Men still felt the need to be in the small room just for women.   There was also a time when I was at that gym and was about to get dressed in the locker room. The women’s locker room. I overheard a man talking to his female friend. A man was literally in the women’s locker room like it was nothing.	1616713199.0	gs89x0m	t3_md66ux	t3_md66ux	/r/FemaleDatingStrategy/comments/md66ux/why_are_males/gs89x0m/
55wf1rkk	Look at his dusty ass elbow, he looks unkempt in addition to being a perv	1616715817.0	gs8f5xp	t3_md66ux	t3_md66ux	/r/FemaleDatingStrategy/comments/md66ux/why_are_males/gs8f5xp/
9xvq3ctc	This is why I haven't gone back to the gym, I don't have the energy to deal with this stuff.	1616704352.0	gs7r0gd	t3_md66ux	t3_md66ux	/r/FemaleDatingStrategy/comments/md66ux/why_are_males/gs7r0gd/
N/A	I know we all love a good "public freakout" video but at this point I wish they would just nix the "its legal to film/photograph people in public without their consent" thing	1616721421.0	gs8q0fw	t3_md66ux	t3_md66ux	/r/FemaleDatingStrategy/comments/md66ux/why_are_males/gs8q0fw/
55vf7itb	Oh yuck...  I was just heading there 😭	1616709312.0	gs81xpb	t3_md66ux	t3_md66ux	/r/FemaleDatingStrategy/comments/md66ux/why_are_males/gs81xpb/
N/A	[deleted]	1616713891.0	gs8baun	t3_md66ux	t3_md66ux	/r/FemaleDatingStrategy/comments/md66ux/why_are_males/gs8baun/
9nje4edp	And this is exactly why I either workout from home or go before the crack of dawn.  The gym is riddled with perverts and predators everywhere.	1616720540.0	gs8ocpu	t3_md66ux	t3_md66ux	/r/FemaleDatingStrategy/comments/md66ux/why_are_males/gs8ocpu/
au2dpc3	I tried the gym a few times. Stares, random guys mansplaining how I have to do my workout and hitting on me and asking for my number when I was clearly only minding my own business are just some of the things that happened.   Plus I was harassed on the way TO the gym various times when I wore leggings.   All female gyms are desperately needed.	1616748511.0	gs9s8ed	t3_md66ux	t3_md66ux	/r/FemaleDatingStrategy/comments/md66ux/why_are_males/gs9s8ed/
3zcwey91	I live in the Netherlands and I go to an all female gym! It’s so much better because there are no creepy guys. Also it’s nice for women that wear hijabs because they can workout without them.	1616711383.0	gs868vb	t3_md66ux	t3_md66ux	/r/FemaleDatingStrategy/comments/md66ux/why_are_males/gs868vb/
hdguzjz	I had some fucking creep record me at the gym, and I only found out because this guy and his girlfriend came up and told me (bless them).  And now I work out at home.	1616736077.0	gs9em7n	t3_md66ux	t3_md66ux	/r/FemaleDatingStrategy/comments/md66ux/why_are_males/gs9em7n/
tfi8qd	Lol really? 37 reports, and the most popular report for this post is "It's promoting hate based on identity or vulnerability."  Nice try, scrotes. Stay mad. So now you're literally defending a sexual predator who could be taking photos of literally anyone for nefarious purposes aka j\*rking off his 2 inch pp that's concealed by his gut.   NAMALT indeed.	1616779332.0	gsba439	t3_md66ux	t3_md66ux	/r/FemaleDatingStrategy/comments/md66ux/why_are_males/gsba439/
5eh0c3v2	Thankfully I actually do have female only gyms available to me where I live. If I go back to the gym after covid it’s going to be to one of those.	1616727348.0	gs915dy	t3_md66ux	t3_md66ux	/r/FemaleDatingStrategy/comments/md66ux/why_are_males/gs915dy/
ue2cb	I joined an all-female gym during my time at university and LOVED it. I’d never been so dedicated to working out and I managed to run a 5k from being a couch potato! I was surprised at what I could achieve without the feeling of being self-conscious. Unfortunately I moved from the area and there are no all-female gyms near my home, and I haven’t worked out that much since :(	1616763001.0	gsaak23	t3_md66ux	t3_md66ux	/r/FemaleDatingStrategy/comments/md66ux/why_are_males/gsaak23/
12i8l9	You can never know in how many creep shots you are nowadays.. 🤮🤮😭	1616755591.0	gs9znjh	t3_md66ux	t3_md66ux	/r/FemaleDatingStrategy/comments/md66ux/why_are_males/gs9znjh/
N/A	The gym i go to has a women's only section. That being said, 1. They have no way to actually enforce that and 2. It's literally a qaurter of the size of the men's weight lifting section. There's a squat machine, that machine were you spread your legs to push the weight, and one weight rack that stops at 15.  I need to find a new gym.	1616764906.0	gsae5hr	t3_md66ux	t3_md66ux	/r/FemaleDatingStrategy/comments/md66ux/why_are_males/gsae5hr/
aadtrhcf	We have to make it a habit to confront these assholes. We should post their pictures  with their faces and our insta convos with them and their disgusting comments from social media with their names. We should act as if we record them and yell and shout with all of our voice at them when they catcall us on a safe, busy street (but as always, safety first, never confront if it seems in any way unsafe). I hate that degenerates are not even scared about their public image because no one cares about what they do.	1616796391.0	gscg410	t3_md66ux	t3_md66ux	/r/FemaleDatingStrategy/comments/md66ux/why_are_males/gscg410/
azr27yoy	Going on a tangent here but is it me or is that vertical line down those black sweatpants such a signature scrote staple?	1616717657.0	gs8isk5	t3_md66ux	t3_md66ux	/r/FemaleDatingStrategy/comments/md66ux/why_are_males/gs8isk5/
9bwq8nde	I love the gym, I love the health benefits regular weightlifting gives me, I am built for that type of exercise. It would be nice if there was a women's only weightlifting room available. It's tiresome to have to keep asking gym staff to instruct scrotes not to walk past my behind while I am doing straight leg deadlifts. Their casual, "pretend they're not aware they're doing it" harassment ruins everything.	1616706684.0	gs7w8zl	t3_md66ux	t3_md66ux	/r/FemaleDatingStrategy/comments/md66ux/why_are_males/gs7w8zl/
49o2fkay	Ewwwwwwwwwwwww	1616775987.0	gsb2m8x	t3_md66ux	t3_md66ux	/r/FemaleDatingStrategy/comments/md66ux/why_are_males/gsb2m8x/
t9bbfs0	I've been interrupted midset WITH HEADPHONES ON so many times by men trying to get a date. Fkn annoying.	1620146753.0	gwxcn7v	t3_md66ux	t3_md66ux	/r/FemaleDatingStrategy/comments/md66ux/why_are_males/gwxcn7v/
6l4z3	**[1]** - We Just Launched a Website: [wwww.TheFemaleDatingStrategy.com](https://www.thefemaledatingstrategy.com/). Click [here](https://www.thefemaledatingstrategy.com/become-a-verified-member/) for registration information. Please also join our [Twitter](https://twitter.com/FemDatStrat) and [Instagram](https://www.instagram.com/_thefemaledatingstrategy/?hl=en) Pages for updates!   **[2]** - Please read the [FDS Handbook](https://www.reddit.com/r/FemaleDatingStrategy/wiki/recommended_reading#wiki_the_fds_handbook) and [Wiki](https://www.reddit.com/r/FemaleDatingStrategy/wiki/index) before commenting. **Repeated comments demonstrating lack of basic sub knowledge will result in a temporary or permanent ban.**   **[3]** - Please **REPORT** any comments that do not follow the sub rules. **If you do not report it, the mods will not see it.**   **[4]** - **PLEASE REMOVE ALL PERSONAL IDENTIFIABLE INFORMATION** from images (**Name, Location, Job description, education, phone number, etc**). Failure to remove ID info will result in a **1-2** day ban. Repeated failures will result in a permanent ban.    **[5]** - This sub is **FEMALE ONLY**. All comments from men will be removed and you will be banned. **DO NOT REPLY TO MALE TROLLS!!** Please **DOWNVOTE** and **REPORT** immediately.   *I am a bot, and this action was performed automatically. Please [contact the moderators of this subreddit](/message/compose/?to=/r/FemaleDatingStrategy) if you have any questions or concerns.*	1616700263.0	gs7h9v9	t3_md66ux	t3_md66ux	/r/FemaleDatingStrategy/comments/md66ux/why_are_males/gs7h9v9/
mx5npgj	That's so incredibly fucking creepy. Something is wrong with ***.	1620584714.0	gxit82y	t3_md66ux	t3_md66ux	/r/FemaleDatingStrategy/comments/md66ux/why_are_males/gxit82y/
4o8509lk	This rule used to exist in the European Union, but not anymore...	1616714264.0	gs8c25r	t3_md66ux	t1_gs7yggd	/r/FemaleDatingStrategy/comments/md66ux/why_are_males/gs8c25r/
3wrkjscq	Last time I arrived in Japan, my phone camera did an automatic software update which turned on the shutter sound even when my phone was on silent/vibrate	1616734854.0	gs9d132	t3_md66ux	t1_gs7yggd	/r/FemaleDatingStrategy/comments/md66ux/why_are_males/gs9d132/
6bmrvjld	I think men figured a way to turn it off. I saw a thread in one sub and they were talking it, and about how annoying it was. Someone said that it's there to prevent upskirt photos or women being violated and it got downvoted to crap. All they cared about was "What if I want to take pictures at a wedding??? What about my kids soccer game?"   Insane that such a small win for women is too troublesome for men and they can't respect it. A sound there to help protect us is too inconvenient.  Like I'm sorry your phone makes a noise, but lots of women are now alerted to perverts. Your daughters included.	1616794716.0	gscbzo2	t3_md66ux	t1_gs7yggd	/r/FemaleDatingStrategy/comments/md66ux/why_are_males/gscbzo2/
N/A	[deleted]	1616707328.0	gs7xnuw	t3_md66ux	t1_gs7pfrk	/r/FemaleDatingStrategy/comments/md66ux/why_are_males/gs7xnuw/
5dmz7k4g	Omg same. Except I noticed this one single time in my life. And I wasn’t even at the gym.   I was at my little sister’s HIGH SCHOOL GRADUATION. I was maybe 22 at the time and the ceremony had just ended. Hanging out by myself in an empty-ish portion of the convention center hall when I get approached by this older man. Grey hair, suit, the whole thing that screams “I’m a dude in my 50s and enjoy watching freshly 18 year old girls walk around in semi-formal attire with their families”.  I don’t remember the conversation but he made me uncomfortable despite the politeness of the conversation. I remember him saying either his daughter or niece had just graduated (!!!), asked me some personal questions that I answered vaguely, while he just stood their smirking and smiling something greasy. I somehow got away from the conversation to rejoin my family.   Minutes. Minutes later I see him standing about 30ft away from me taking pictures of me on his phone. In a very non discreet way. I’ve never felt so dirty while having done nothing wrong.	1616725295.0	gs8xdiu	t3_md66ux	t1_gs7pfrk	/r/FemaleDatingStrategy/comments/md66ux/why_are_males/gs8xdiu/
12uypv	Oh my god sameeee how many times has this happened to me?!	1616710353.0	gs8441w	t3_md66ux	t1_gs7pfrk	/r/FemaleDatingStrategy/comments/md66ux/why_are_males/gs8441w/
aaqs22z3	Me too. I wish I could stare someone down if I catch them looking at me. I’m too much of a wuss	1616717495.0	gs8ih8k	t3_md66ux	t1_gs7pfrk	/r/FemaleDatingStrategy/comments/md66ux/why_are_males/gs8ih8k/
3u09sfxl	This is why I wear sunglasses at the gym. I tell people it’s because the neon lights hurt my eyes, but it’s actually to prevent males from trying to make eye contact. Apparently keeping headphones in 24/7 and always looking at my shoes is not enough	1616784862.0	gsbml2r	t3_md66ux	t1_gs7pfrk	/r/FemaleDatingStrategy/comments/md66ux/why_are_males/gsbml2r/
6pejr7kd	I make a point of looking at people who are likely to perv (read: LVM looking guys). I've always felt anxious going to the gym, been going for years and in every single gym there's been a scrote harassing me during a session. I've been sworn at for moving away from someone, had guys follow me around and conveniently always be behind me on the machines, grab the weights from me to "help" me put them back.. name it. I can be running on the treadmill and always have to glance around to watch out for disgusting LVM leering and/or filming. I have to change my session numerous times.  Guys who look like this (unattractive, middle aged, beer bellied, disgusting dress sense, no hygiene) literally ALWAYS perv too. Of course the attractive young guys can be inappropriate too, but if I'm around a guy like this he always starts staring shamelessly. They barely work out too, usually just sit on the machines and stare.  Gyms have been closed in my country since last December, been working out at home and it's amazing how less anxious I feel.	1616842705.0	gsfc98t	t3_md66ux	t1_gs7pfrk	/r/FemaleDatingStrategy/comments/md66ux/why_are_males/gsfc98t/
N/A	[deleted]	1616707258.0	gs7xih1	t3_md66ux	t1_gs7w0mu	/r/FemaleDatingStrategy/comments/md66ux/why_are_males/gs7xih1/
N/A	[deleted]	1616708382.0	gs7zyc5	t3_md66ux	t1_gs7w0mu	/r/FemaleDatingStrategy/comments/md66ux/why_are_males/gs7zyc5/
6bmrvjld	Happened to me too. I still think about it a lot. The total disrespect is just so depressing. Like I'm a tree or something. Just a fucking object to look at, not a person with feelings who will be offended at such a disgusting, illegal act.	1616794902.0	gsccg5l	t3_md66ux	t1_gs7w0mu	/r/FemaleDatingStrategy/comments/md66ux/why_are_males/gsccg5l/
N/A	[removed]	1617888278.0	gtt32oq	t3_md66ux	t1_gs7w0mu	/r/FemaleDatingStrategy/comments/md66ux/why_are_males/gtt32oq/
5lp0wes9	Wow I didn't know nuns had their workout routine lol. Must be a really cool convent.	1616707617.0	gs7yami	t3_md66ux	t1_gs7pkdw	/r/FemaleDatingStrategy/comments/md66ux/why_are_males/gs7yami/
4uqs1jy6	Over 70 and going strong in every way because they made the smart decision of avoiding men at all costs lol	1616710707.0	gs84ulv	t3_md66ux	t1_gs7pkdw	/r/FemaleDatingStrategy/comments/md66ux/why_are_males/gs84ulv/
zelor	That sounds awesome.	1616708041.0	gs7z7uk	t3_md66ux	t1_gs7pkdw	/r/FemaleDatingStrategy/comments/md66ux/why_are_males/gs7z7uk/
5cxrt84r	I wish I could work out with the nuns	1616707041.0	gs7x1ij	t3_md66ux	t1_gs7pkdw	/r/FemaleDatingStrategy/comments/md66ux/why_are_males/gs7x1ij/
62vidzz	This is so awesome!	1616714809.0	gs8d5di	t3_md66ux	t1_gs7pkdw	/r/FemaleDatingStrategy/comments/md66ux/why_are_males/gs8d5di/
9s9zxajd	this made my day	1616725992.0	gs8ynhf	t3_md66ux	t1_gs7pkdw	/r/FemaleDatingStrategy/comments/md66ux/why_are_males/gs8ynhf/
31g36g3d	They got a patreon?	1616760152.0	gsa5u2o	t3_md66ux	t1_gs7pkdw	/r/FemaleDatingStrategy/comments/md66ux/why_are_males/gsa5u2o/
mx5npgj	That sounds like so much fun! I'd love to lift with nuns. Not enough women go to the weights section of my gym, but I've been seeing more since it opened again. I always feel more comfortable lifting when other women are around.  About two weeks ago, I was in my little hiding corner where I like to do free weights because it's not directly in front of the mirror, and this random guy comes over. I thought he was going to ask me for one of the dumbbells I was using. Instead he stopped to tell me, "I didn't mean to stare, but I thought you were my ex. You looked at me." Man, I can't see for shite without glasses or contacts, so I had no idea what he was even talking about. It was super creepy.	1620585014.0	gxitu51	t3_md66ux	t1_gs7pkdw	/r/FemaleDatingStrategy/comments/md66ux/why_are_males/gxitu51/
12ggve	Nuns are the best!	1616767738.0	gsak23x	t3_md66ux	t1_gs7pkdw	/r/FemaleDatingStrategy/comments/md66ux/why_are_males/gsak23x/
4w9sttn3	holy shit exposed themselves??? thats fucking traumatizing. thats so horrible I'm so sorry	1616726211.0	gs8z258	t3_md66ux	t1_gs7loma	/r/FemaleDatingStrategy/comments/md66ux/why_are_males/gs8z258/
N/A	My boyfriend and I went to a smaller gym but recently switched to a larger gym because it had better equipment. My boyfriend still goes but I had to stop because of the amount of gross men staring at me. I would end up in the bathroom hyperventilating nearly every time. I wasn't even wearing sexy tight clothes. Just regular gym leggings and a tank top. It's not fair	1616754589.0	gs9yilm	t3_md66ux	t1_gs7loma	/r/FemaleDatingStrategy/comments/md66ux/why_are_males/gs9yilm/
67tpol46	Because   1. non consent  2. illusion of thought he will one day soon fuck all of those girls in the video	1616709884.0	gs83503	t3_md66ux	t1_gs7kdj8	/r/FemaleDatingStrategy/comments/md66ux/why_are_males/gs83503/
5nxhhuuy	They love non consent.	1616701878.0	gs7l6sx	t3_md66ux	t1_gs7kdj8	/r/FemaleDatingStrategy/comments/md66ux/why_are_males/gs7l6sx/
5lp0wes9	Exactly. That's why I wonder why men keep asking strangers for nudes. Like... Dude you have millions of nudes on the internet, what's the difference?	1616707497.0	gs7y186	t3_md66ux	t1_gs7kdj8	/r/FemaleDatingStrategy/comments/md66ux/why_are_males/gs7y186/
8ygtnym6	that's so true	1616702681.0	gs7n51u	t3_md66ux	t1_gs7kdj8	/r/FemaleDatingStrategy/comments/md66ux/why_are_males/gs7n51u/
77sghzn0	Australia has female gyms as well. Honestly I thought they were a thing everywhere	1616710901.0	gs8596x	t3_md66ux	t1_gs804hy	/r/FemaleDatingStrategy/comments/md66ux/why_are_males/gs8596x/
9q1fpnil	Same here! I thought women-only gyms were the norm. Apparently they aren't.	1616754540.0	gs9ygmg	t3_md66ux	t1_gs804hy	/r/FemaleDatingStrategy/comments/md66ux/why_are_males/gs9ygmg/
N/A	I live in the US. The closest female only gym is a good 20 miles (~40 minute drive) :( :(	1616770397.0	gsapxj9	t3_md66ux	t1_gs804hy	/r/FemaleDatingStrategy/comments/md66ux/why_are_males/gsapxj9/
6533ixwp	My favorite thing about men is how they manage to misconstrue basic human interactions as a sign that we obviously must want to fuck them. I mean I bet you probably even smiled at him! And made eye contact! You were clearly interested in having sex with him since you were nice. This is why I generally avoid eye contact with people when I’m out in public minding my own business.	1616712493.0	gs88hq6	t3_md66ux	t1_gs7x2h1	/r/FemaleDatingStrategy/comments/md66ux/why_are_males/gs88hq6/
N/A	Did you tell the wife?	1616712167.0	gs87u4n	t3_md66ux	t1_gs7x2h1	/r/FemaleDatingStrategy/comments/md66ux/why_are_males/gs87u4n/
N/A	[deleted]	1616758664.0	gsa3n29	t3_md66ux	t1_gs7x2h1	/r/FemaleDatingStrategy/comments/md66ux/why_are_males/gsa3n29/
8i3il15v	He probably goes to the gym just to do this.	1616704541.0	gs7rfmx	t3_md66ux	t1_gs7kjdr	/r/FemaleDatingStrategy/comments/md66ux/why_are_males/gs7rfmx/
7ekoyev5	That ELBOW oh god	1616702228.0	gs7m1va	t3_md66ux	t1_gs7kjdr	/r/FemaleDatingStrategy/comments/md66ux/why_are_males/gs7m1va/
N/A	[deleted]	1616725286.0	gs8xcxo	t3_md66ux	t1_gs7votq	/r/FemaleDatingStrategy/comments/md66ux/why_are_males/gs8xcxo/
N/A	Probably an alcoholic to boot. Cirrhosis causes man-tits and the typical round “beer belly”	1616705363.0	gs7taxo	t3_md66ux	t1_gs7ppvo	/r/FemaleDatingStrategy/comments/md66ux/why_are_males/gs7taxo/
N/A	Planet Fitness makes me laugh because they give out free pizza... they know what they're doing. Which is why I actively avoid it.	1616707011.0	gs7wz4i	t3_md66ux	t1_gs7kxa2	/r/FemaleDatingStrategy/comments/md66ux/why_are_males/gs7wz4i/
xds2i	He's getting off on the non-consenual voyeurism.	1616710501.0	gs84f1t	t3_md66ux	t1_gs7r2qs	/r/FemaleDatingStrategy/comments/md66ux/why_are_males/gs84f1t/
arg7n0dn	They get so used to wanking it off to pornstars they need to find women Irl to wank to. When men start objectifying women that much they look at all women like that, as potential porn stars.	1616718887.0	gs8l6ib	t3_md66ux	t1_gs7r2qs	/r/FemaleDatingStrategy/comments/md66ux/why_are_males/gs8l6ib/
N/A	How else would non-consensual content make it to Reddit. Gotta feed the beast.  /s	1616717088.0	gs8hoa7	t3_md66ux	t1_gs7r2qs	/r/FemaleDatingStrategy/comments/md66ux/why_are_males/gs8hoa7/
N/A	I'm pretty sure it's literally millions	1616720541.0	gs8oct1	t3_md66ux	t1_gs7r2qs	/r/FemaleDatingStrategy/comments/md66ux/why_are_males/gs8oct1/
u9mr7	If this happens again, start recording him	1616716006.0	gs8fjfa	t3_md66ux	t1_gs7x6v1	/r/FemaleDatingStrategy/comments/md66ux/why_are_males/gs8fjfa/
2yli403o	Yet they have the nerve to ask why we want/need women only gyms and how sexist we’re being to exclude them. Dude,have you ever called out your friend when’s perving on someone at the gym but have the audacity to reprimand women for saying they want a gym they feel comfortable in.	1616709875.0	gs834bs	t3_md66ux	t1_gs7x6v1	/r/FemaleDatingStrategy/comments/md66ux/why_are_males/gs834bs/
3f7ubs5k	At my work gym this one disgusto was slinking around a machine, sitting on it but not using it, draping his towel over it... He finally got up for a second to refill his water bottle so I started to use the machine in front of it (leg lifts that stick your butt out) and he RAN BACK to the machine and sat staring straight ahead at my ass and not using it. I was so grossed out I jumped off the machine and left. No one to report it to because it was after hours and they had no staff. Gross.	1616729784.0	gs95csr	t3_md66ux	t1_gs7yljp	/r/FemaleDatingStrategy/comments/md66ux/why_are_males/gs95csr/
31g36g3d	I know he’s an ex now.	1616760542.0	gsa6flz	t3_md66ux	t1_gs8jzxk	/r/FemaleDatingStrategy/comments/md66ux/why_are_males/gsa6flz/
1673gu	I get intimidated to go to the free weights section as I feel it is constantly dominated by men grunting in the mirror and they always seem to stare at any girl who dares to enter the area. The few times I did make it to that section, I was confronted by random guys offering to spot me or teach me better form or something when I just wanted to do my workout in peace without interruption. It makes me feel so uncomfortable and unwelcome.	1616707279.0	gs7xk27	t3_md66ux	t1_gs7muyj	/r/FemaleDatingStrategy/comments/md66ux/why_are_males/gs7xk27/
5nxhhuuy	Probably just goes to the gym for fap material	1616701912.0	gs7l9q4	t3_md66ux	t1_gs7i52k	/r/FemaleDatingStrategy/comments/md66ux/why_are_males/gs7l9q4/
1b8shxax	I only wear huge shirts that cover my butt when I go to the gym. I still felt ogled. Plus the grunting and the sweatiness everywhere. Yuck. If I had access to an only female gym I would totally sign up and feel free to wear actual gym clothes.	1616743749.0	gs9nb1g	t3_md66ux	t1_gs82vg3	/r/FemaleDatingStrategy/comments/md66ux/why_are_males/gs9nb1g/
alauaon2	My new favorite place to workout is a ladies only pole dance studio. It's nice if you miss any of that community aspect of working out.	1616707250.0	gs7xhui	t3_md66ux	t1_gs7roi7	/r/FemaleDatingStrategy/comments/md66ux/why_are_males/gs7xhui/
N/A	[deleted]	1616725554.0	gs8xuml	t3_md66ux	t1_gs8q0fw	/r/FemaleDatingStrategy/comments/md66ux/why_are_males/gs8xuml/
5eh0c3v2	Never felt comfortable at a gym alone. I think this is why I unconsciously knew this kind of thing can happen and my fight or flight instincts were always on.	1616727544.0	gs91hr5	t3_md66ux	t1_gs8baun	/r/FemaleDatingStrategy/comments/md66ux/why_are_males/gs91hr5/
N/A	Theyre just adidas track pants lmao	1616731111.0	gs97iff	t3_md66ux	t1_gs8isk5	/r/FemaleDatingStrategy/comments/md66ux/why_are_males/gs97iff/
64u3r4vn	That's great. The only reason I want to have my camera silent is so I don't wake up my sleeping dog when I take a picture of her.	1616794316.0	gscazq3	t3_md66ux	t1_gs9d132	/r/FemaleDatingStrategy/comments/md66ux/why_are_males/gscazq3/
