author	selftext	created_at	s_id	permalink	title
8c4ak7k4		1642804589.0	s9n019	/r/AskReddit/comments/s9n019/what_is_another_franchise_disney_buys_that_see/	What is another franchise Disney buys that see happening that would blow your mind?
dsqi3ke		1642804631.0	s9n0l4	/r/AskReddit/comments/s9n0l4/if_you_had_to_loose_and_eye_and_you_hot_to_choose/	If you had to loose and eye and you hot to choose, which eye would you pick and why?
gdgaj4jy		1642804732.0	s9n1wz	/r/AskReddit/comments/s9n1wz/what_if_the_next_variant_of_coronavirus_turns/	What if the next variant of Coronavirus turns everyone into a zombie ?
5f3avnxt		1642804811.0	s9n2yv	/r/AskReddit/comments/s9n2yv/whats_a_weird_thing_you_once_made_a_part_of_your/	What's a weird thing you once made a part of your personality?
iapl0wq6		1642804873.0	s9n3y9	/r/AskReddit/comments/s9n3y9/redditors_whose_chose_to_get_cosmetic_surgery/	Redditors whose chose to get cosmetic surgery, what have you had done and why?
e81ukjfy		1642804972.0	s9n5bh	/r/AskReddit/comments/s9n5bh/how_do_you_stop_giving_a_fuck/	how do you stop giving a fuck?
4vei03lr		1642805045.0	s9n66i	/r/AskReddit/comments/s9n66i/if_all_food_was_caloriefree_and_healthy_for_one/	If all food was calorie-free and healthy for one day, what would you gorge yourself on?
8y4r68ov		1642805051.0	s9n696	/r/AskReddit/comments/s9n696/what_show_made_you_cry_by_the_end_of_it/	What show made you cry by the end of it?
xyizc		1642805141.0	s9n7du	/r/AskReddit/comments/s9n7du/whats_something_everyone_should_have_done_til/	What's something everyone should have done til their mid-twenties?
gh3ojyvn		1642805162.0	s9n7nz	/r/AskReddit/comments/s9n7nz/if_the_perfectestest_person_existed_what_would_be/	If the perfectestest person existed, what would be one characteristic of their personality?
h53cdi1c		1642805170.0	s9n7r4	/r/AskReddit/comments/s9n7r4/what_are_some_movies_or_shows_that_broke_you/	What are some movies or shows that broke you?
gdgaj4jy		1642805180.0	s9n7w8	/r/AskReddit/comments/s9n7w8/what_stock_sex_phrase_would_you_like_to_replace/	What stock sex phrase would you like to replace and with what ?
iviws2qm		1642805200.0	s9n852	/r/AskReddit/comments/s9n852/what_are_you_paranoid_about/	What are you paranoid about?
gu2x1muy		1642805234.0	s9n8jb	/r/AskReddit/comments/s9n8jb/for_1000_dollars_each_time_what_situation_would/	For 1000 dollars each time what situation would you pick? shit everytime you fart or puke everytime you burp?
itmcqfto		1642805234.0	s9n8jg	/r/AskReddit/comments/s9n8jg/geeky_girls_what_is_your_favorite_female_comic/	Geeky girls: What is your favorite female comic book character?
gdbajshk		1642805334.0	s9n9sx	/r/AskReddit/comments/s9n9sx/what_is_the_most_famous_thing_about_your_city/	What is the most famous thing about your city ?
hb9geok4		1642805365.0	s9na8n	/r/AskReddit/comments/s9na8n/what_is_something_that_went_horribly_wrong_but/	What is something that went horribly wrong, but you still don't regret doing?
gu2x1muy		1642805372.0	s9nabh	/r/AskReddit/comments/s9nabh/vampires_are_always_wealthy_in_movies_how_do_they/	Vampires are always wealthy in movies? How do they make a living ?
bg0b0qat		1642805468.0	s9nbqa	/r/AskReddit/comments/s9nbqa/who_is_the_person_you_least_like_at_work_what_do/	Who is the person you least like at work? What do they do that bothers you?
gdgaj4jy		1642805478.0	s9nbve	/r/AskReddit/comments/s9nbve/why_did_crypto_crash_just_now/	Why did crypto crash just now ?
9mhsl5uf		1642805490.0	s9nc2n	/r/AskReddit/comments/s9nc2n/if_your_relative_needs_to_talk_to_someone_who/	If your relative needs to talk to someone, who should it be?
im7ylt3g		1642805493.0	s9nc40	/r/AskReddit/comments/s9nc40/what_happened_in_2004/	What happened in 2004?
bnimf		1642805526.0	s9nclh	/r/AskReddit/comments/s9nclh/what_is_one_instance_where_the_truth_was/	What is one instance where the truth was absolutely stranger than fiction?
7mf7pxmo		1642805532.0	s9ncoy	/r/AskReddit/comments/s9ncoy/what_is_something_that_people_dont_realize_is/	What is something that people dont realize is hurting/offencing you?
gdbajshk		1642805595.0	s9ndjb	/r/AskReddit/comments/s9ndjb/which_phone_are_you_using/	Which phone are you using ?
3l32qbt9		1642805738.0	s9nfed	/r/AskReddit/comments/s9nfed/what_video_game_would_you_play_if_death_were/	What video game would you play if death were permanent in it?
9sv724vn		1642805788.0	s9ng0y	/r/AskReddit/comments/s9ng0y/what_is_something_you_regret_not_doing_at_a/	What is something you regret not doing at a younger age?
gdbajshk		1642805877.0	s9nh69	/r/AskReddit/comments/s9nh69/on_which_side_of_the_road_do_you_drive_in_your/	On which side of the road do you drive in your country ?
ikwceply		1642805995.0	s9niot	/r/AskReddit/comments/s9niot/who_is_the_best_guitarist_in_music_history/	Who is the best guitarist in music history?
f52gu40		1642806015.0	s9nj5t	/r/AskReddit/comments/s9nj5t/what_exactly_happens_when_you_die/	What exactly happens when you die?
4r8bxzfa		1642806048.0	s9njod	/r/AskReddit/comments/s9njod/you_need_to_do_something_that_makes_you_feel_a/	You need to do something that makes you feel a rush of being alive. What do you do?
gdbajshk		1642806070.0	s9nk0q	/r/AskReddit/comments/s9nk0q/what_is_the_most_expensive_thing_you_own/	What is the most expensive thing you own ?
iviws2qm		1642806138.0	s9nl31	/r/AskReddit/comments/s9nl31/people_who_used_to_be_into_digital_privacy_but/	People who used to be into digital privacy but now have given up. Why did you give up?
ioq27vx4		1642806224.0	s9nm66	/r/AskReddit/comments/s9nm66/how_do_you_enjoy_your_single_life_when_you_have/	How do you enjoy your single life when you have no friends either and do you actually like being single?
itmcqfto		1642806245.0	s9nmg4	/r/AskReddit/comments/s9nmg4/which_artist_or_band_would_you_like_to_make_a/	Which artist or band would you like to make a comeback?
7z2rswxt		1642806249.0	s9nmhy	/r/AskReddit/comments/s9nmhy/whats_a_sad_but_nontragic_story_about_someone_you/	What's a sad, but non-tragic story, about someone you know?
bd7rgzio		1642806270.0	s9nmsf	/r/AskReddit/comments/s9nmsf/what_is_the_female_equivalent_of_a_ladies_man/	What Is the female equivalent of a 'ladies man' ?
54x2xma1		1642806338.0	s9nno5	/r/AskReddit/comments/s9nno5/women_of_reddit_what_is_your_most_embarrassing/	Women of reddit, what is your most embarrassing masterbation story ?
3471t5d1		1642806382.0	s9no8c	/r/AskReddit/comments/s9no8c/favourite_film_and_why/	Favourite film and why ?
iviws2qm		1642806392.0	s9nogq	/r/AskReddit/comments/s9nogq/without_going_to_rehab_what_are_tips_with/	Without going to rehab, what are tips with fighting an addiction?
djcgju67		1642806397.0	s9nohl	/r/AskReddit/comments/s9nohl/redditors_what_english_word_can_you_never_spell/	Redditors, what English word can you never spell correctly?
2adv3eh5		1642806402.0	s9nok0	/r/AskReddit/comments/s9nok0/which_video_game_did_you_completely_max_out_on/	Which video game did you completely max out on progress? Where there was nothing left to achieve?
7z2rswxt		1642806506.0	s9npvb	/r/AskReddit/comments/s9npvb/what_is_a_sad_story_about_someone_you_know/	What is a sad story about someone you know?
f4ocm32j		1642806541.0	s9nqam	/r/AskReddit/comments/s9nqam/what_is_the_moment_in_your_life_that_you_felt/	What is the moment in your life that you felt happiest? And did that last?
bjydadnm		1642806622.0	s9nrca	/r/AskReddit/comments/s9nrca/if_you_keep_count_of_sexual_intercourse_and_you/	If you keep count of sexual intercourse and you spend a night with partner, have sex multiple times, in many different ways. Do you count it as 1 or a number of how many times you (or partner) managed to blast?
7z2rswxt		1642806708.0	s9nske	/r/AskReddit/comments/s9nske/who_have_you_drifted_apart_from_whose_life_became/	Who have you drifted apart from, whose life became way worse afterward?
2o8kntga		1643132592.0	scjbd9	/r/AskReddit/comments/scjbd9/what_does_the_richest_person_you_know_personally/	What does the richest person you know personally do for living?
cyppq7kt		1643132619.0	scjbpw	/r/AskReddit/comments/scjbpw/alcohol_users_an_estimate_of_63_percent_of/	Alcohol users, an estimate of 63 percent of violent crimes worldwide involves the use of alcohol. What do you think about that?
16g0fq		1643132693.0	scjcrv	/r/AskReddit/comments/scjcrv/parents_of_reddit_whats_the_creepiest_thing_youve/	Parents of Reddit, what’s the creepiest thing you’ve seen your child do?
4c6a39p9		1643132943.0	scjg7d	/r/AskReddit/comments/scjg7d/what_fallout_did_you_experience_from_leaving_a/	What fallout did you experience from leaving a mainstream religion?
d53us		1643133182.0	scjjh4	/r/AskReddit/comments/scjjh4/whos_a_celebrity_youve_heard_your_entire_life/	Who's a celebrity you've heard your entire life about but have no idea what he/she looks like?
6mnhry9p		1643133201.0	scjjrp	/r/AskReddit/comments/scjjrp/what_are_your_favourite_types_of_eyes/	What are your favourite types of eyes?
899lqkoc		1643133512.0	scjo0x	/r/AskReddit/comments/scjo0x/if_you_could_hire_only_one_person_to_help_you/	If you could hire only one person to help you start a company, what skills would you look for in the person and why?
igrodfpx		1643133519.0	scjo4s	/r/AskReddit/comments/scjo4s/serious_if_you_are_working_in_a_field_that_you/	[Serious] If you are working in a field that you dont love,how do you cope with it on daily basis?
etf88		1643133554.0	scjomm	/r/AskReddit/comments/scjomm/whats_an_item_everyone_should_have_in_their_home/	What’s an item everyone should have in their home?
99hu4s7j		1643133727.0	scjr8u	/r/AskReddit/comments/scjr8u/whats_your_life_story/	What’s your life story?
2fl2f28m		1643133729.0	scjr9y	/r/AskReddit/comments/scjr9y/whats_one_thing_we_all_do_wrong/	What’s one thing we all do wrong?
dog8ftt9		1643133733.0	scjrbz	/r/AskReddit/comments/scjrbz/what_was_the_most_bullshit_retcon_youve_ever_seen/	What was the most bullshit retcon you've ever seen?
ehu4sru2		1643133792.0	scjs6x	/r/AskReddit/comments/scjs6x/what_do_you_guys_think_about_web3_in_comparison/	What do you guys think about Web3 in comparison to Bitcoin?
8l5dvy5z		1643133796.0	scjs95	/r/AskReddit/comments/scjs95/rich_people_on_reddit_whats_your_best_attempt_to/	Rich people on Reddit, what’s your best attempt to disguise as.. not rich?
a1iji4zs		1643133811.0	scjshi	/r/AskReddit/comments/scjshi/whats_the_worst_part_about_having_kids/	What’s the worst part about having kids?
h6vqs		1643133840.0	scjsvo	/r/AskReddit/comments/scjsvo/what_inconsequential_lie_does_your_so_tell_you/	What inconsequential lie does your SO tell you, that you know is not true?
67hmgw1d		1643134105.0	scjwn7	/r/AskReddit/comments/scjwn7/women_of_reddit_what_is_the_most_ridiculous/	Women of reddit, what is the most ridiculous misconception about womanhood you have personally encountered?
iuh6k408		1643134112.0	scjwqp	/r/AskReddit/comments/scjwqp/if_you_had_to_choose_one_brand_of_shoes_to_wear/	If you had to choose one brand of shoes to wear forever what would they be?
62kyxam2		1643134125.0	scjwx8	/r/AskReddit/comments/scjwx8/a_guy_walks_in_to_a_restaurant_or_bar_with_a_1k/	A guy walks in to a restaurant or bar with a $1K check and a tv monitor and anyone who buys a $50 ticket can walk out with the check if they can answer 15 trivia questions correct do you play why or why not?
cyppq7kt		1643134336.0	sck01m	/r/AskReddit/comments/sck01m/what_would_be_the_best_country_to_live_in_for_a/	What would be the best country to live in for a poor person?
46u9gwip		1643134515.0	sck2lk	/r/AskReddit/comments/sck2lk/financial_planners_wealth_managers_what_are_some/	Financial planners / wealth managers, what are some tips and tricks most people should know?
7qqx5033		1643134516.0	sck2lz	/r/AskReddit/comments/sck2lz/serious_when_did_you_realize_you_were_the_asshole/	[Serious] When did you realize you were the asshole?
e3ad70kl		1643134714.0	sck5dg	/r/AskReddit/comments/sck5dg/how_big_is_too_small/	How big is too small?
7eeqgc2t		1643134876.0	sck7lu	/r/AskReddit/comments/sck7lu/you_have_a_5_minutes_warning_before_being/	You have a 5 minutes warning before being transported back to the same geographic location you're at now 10,000 years ago. You can take everything you can carry and wear. How long do you think you'd survive? Why?
fou82p18		1643134904.0	sck7z5	/r/AskReddit/comments/sck7z5/in_what_ways_has_becoming_a_parent_changed_your/	In what ways has becoming a parent changed your life for the better? [SERIOUS]
do5xt4e8		1643135124.0	sckb2a	/r/AskReddit/comments/sckb2a/whats_the_best_deal_you_ever_got/	What’s the best deal you ever got?
c6buzwg7		1643135129.0	sckb3y	/r/AskReddit/comments/sckb3y/what_you_hoped_for_never_materialized/	What you hoped for never materialized?
ho1ufaj2		1643135157.0	sckbhw	/r/AskReddit/comments/sckbhw/people_who_have_been_called_and_exposed_by_a/	People who have been called and exposed by a radio show, what’s your story?
8ycdsivt		1643135170.0	sckbns	/r/AskReddit/comments/sckbns/you_have_a_chance_to_be_born_again_into_a_random/	You have a chance to be born again, into a random family from any country around the world - do you take the chance to end and reset your life? Why?
iynuw9bv		1643135195.0	sckbz3	/r/AskReddit/comments/sckbz3/if_you_saw_an_older_teenager_or_adult_watching_a/	If you saw an older teenager or adult watching a tv show targeted towards kids, what would you do to shame them, and why?
cyppq7kt		1643135221.0	sckcaz	/r/AskReddit/comments/sckcaz/gentlemen_of_reddit_what_doth_thee_bethink_of_thy/	Gentlemen of Reddit, what doth thee bethink of thy fiery shaft?
i21nnwv8		1643135566.0	sckh3u	/r/AskReddit/comments/sckh3u/ladies_what_would_you_do_if_you_thought_you_were/	Ladies what would you do if you thought you were a Kagan body goddess?
4yqlafbi		1643135617.0	sckhu8	/r/AskReddit/comments/sckhu8/if_you_dont_have_a_full_time_job_what_do_you_do/	If you don’t have a full time job what do you do in a day in winter? Are you more lazy?
erond2zc		1643135625.0	sckhxn	/r/AskReddit/comments/sckhxn/whats_a_good_resume_builder_for_a_prelaw_student/	What's a good resume builder for a pre-law student?
fxd7liyw		1643135671.0	sckik6	/r/AskReddit/comments/sckik6/what_do_you_miss_about_your_younger_self/	What do you miss about your younger self?
gx1g5won		1643135818.0	sckkik	/r/AskReddit/comments/sckkik/nice_shoes_whered_you_get_them/	Nice shoes, where'd you get them?
iohbrs7r		1643135932.0	scklz7	/r/AskReddit/comments/scklz7/girls_of_reddit_if_you_were_born_a_guy_do_you/	Girls of Reddit, if you were born a guy, do you think you’d have a small or big dick? Why or why not?
ikwceply		1643136026.0	sckn5s	/r/AskReddit/comments/sckn5s/what_tv_show_has_the_best_theme_song/	What tv show has the best theme song?
cyppq7kt		1643136097.0	scko3q	/r/AskReddit/comments/scko3q/when_was_the_last_time_you_touched_grass/	When was the last time you touched grass?
gx1g5won		1643136156.0	sckox6	/r/AskReddit/comments/sckox6/black_redditors_of_reddit_have_you_ever_had_an/	Black Redditors of reddit have you ever had an altercation with a racist cop what happened?
iynuw9bv		1643136288.0	sckqno	/r/AskReddit/comments/sckqno/which_actress_is_prettier_sky_katz_or_navia/	Which actress is prettier, Sky Katz or Navia Robinson and why?
iu9l9jon		1643136343.0	sckrf0	/r/AskReddit/comments/sckrf0/how_do_you_get_over_your_social_anxiety_fast/	How do you get over your social anxiety fast?
hkk79n2o		1643136382.0	sckrxo	/r/AskReddit/comments/sckrxo/whats_something_that_made_you_go_like_danm_that/	What's something that made you go like ..Danm that just happened !?
7ozpw4eo		1643136395.0	scks4l	/r/AskReddit/comments/scks4l/men_who_like_men_what_do_you_look_for_in_a_man/	Men who like men. What do you look for in a man?
50l95hly		1643136408.0	scksam	/r/AskReddit/comments/scksam/how_do_you_get_over_ruining_your_potential_and/	How do you get over ruining your potential and life?
i21ss		1643136507.0	scktog	/r/AskReddit/comments/scktog/just_11_months_until_christmas_when_do_you_start/	Just 11 months until Christmas? When do you start thinking about Christmas?
hxb1fd2v		1643136726.0	sckwmr	/r/AskReddit/comments/sckwmr/what_do_you_have_on_your_2022_disaster_bingo_card/	What do you have on your 2022 disaster bingo card?
137gyd		1643136952.0	sckzrb	/r/AskReddit/comments/sckzrb/car_salesmen_of_reddit_what_is_your_craziest_test/	Car salesmen of Reddit. What is your craziest test drive story?
hin4izh8		1643137062.0	scl19t	/r/AskReddit/comments/scl19t/people_who_loved_fargo_and_mad_men_what_other/	People who loved Fargo and Mad Men, what other series can you recommend?
h6185sq5		1643137125.0	scl24s	/r/AskReddit/comments/scl24s/what_is_something_everyone_should_know_when_they/	What is something everyone should know when they become a house owner?
ikwceply		1643137237.0	scl3qt	/r/AskReddit/comments/scl3qt/what_sports_team_are_you_a_non_bandwagon_fan_of/	What sports team are you a non bandwagon fan of?
iozgdhdd		1643137316.0	scl4tw	/r/AskReddit/comments/scl4tw/what_is_your_favorite_sex_position_s_why/	What is your favorite Sex position (s)? Why?
44m5chb5		1643137470.0	scl6z3	/r/AskReddit/comments/scl6z3/whats_something_that_everyone_know_that_goes_on/	What's something that everyone know that goes on, but nobody says anything about?
fos558f2		1643137755.0	sclaw0	/r/AskReddit/comments/sclaw0/how_much_money_have_you_spent_on_therapy/	How much money have you spent on therapy?
3m5pwaux		1643137797.0	sclbgh	/r/AskReddit/comments/sclbgh/whats_a_book_everyone_should_read_at_some_point/	What's a book everyone should read at some point?
f52gu40		1643137834.0	sclbzw	/r/AskReddit/comments/sclbzw/what_would_be_the_worst_feature_to_program_into_a/	What would be the worst feature to program into a sex robot?
9znqa0f3		1643138224.0	sclhba	/r/AskReddit/comments/sclhba/which_years_have_been_the_best_of_your_life_so_far/	Which years have been the best of your life so far?
64fd2j6y		1643138392.0	scljhk	/r/AskReddit/comments/scljhk/if_you_could_bring_back_any_one_item_from_the/	If you could bring back any one item from the past without it somehow affecting the timeline, what would you bring back?
130dhl		1643138394.0	scljiw	/r/AskReddit/comments/scljiw/men_who_like_men_what_do_you_look_for_in_a_woman/	Men who like men, what do you look for in a woman?
55yi0myr		1643138424.0	scljx3	/r/AskReddit/comments/scljx3/what_did_the_pandemic_do_to_your_mental_health/	What did the pandemic do to your mental health and why?
bvwmf35l		1643138464.0	sclkem	/r/AskReddit/comments/sclkem/what_beauty_standard_male_or_female_do_you_think/	What beauty standard, male or female, do you think is the most toxic and why?
37x11hu1		1643138477.0	sclkko	/r/AskReddit/comments/sclkko/what_do_you_think_would_happen_if_cheese_didnt/	What do you think would happen if cheese didn't exist?
9mhsl5uf		1643138491.0	sclkrk	/r/AskReddit/comments/sclkrk/if_someone_you_knew_passed_away_and_you_found/	If someone you knew passed away and you found pictures of yourself at home in various states, in different rooms, in their safe, what would you do?
i5oh8r50		1643132865.0	scjf5g	/r/AskReddit/comments/scjf5g/should_we_start_getting_paid_for_donating_blood/	Should we start getting paid for donating blood? Why or why not?
3l32qbt9		1643138563.0	scllqi	/r/AskReddit/comments/scllqi/you_have_died_you_get_to_relive_your_life_again/	You have died. You get to relive your life again. But you are given perk with restarting your life, improved intelligence or improved physical capabilities. Which one would you choose?
3qtp2jig		1643138634.0	sclmpa	/r/AskReddit/comments/sclmpa/what_do_you_think_about_people_who_go_to/	What do you think about people who go to restaurant or do stuff like that all alone?
j0d1ukdz		1643138679.0	sclnbz	/r/AskReddit/comments/sclnbz/people_of_reddit_what_is_with_your_obsession_of/	People of reddit, what is with your obsession of other peoples jobs and how much they like or dislike them? Surely, you must have something else fulfilling in your life?
1vabu2oi		1643138686.0	sclner	/r/AskReddit/comments/sclner/if_your_significant_other_gained_too_much_weight/	If your significant other gained too much weight, would you consider leaving them? Why, or why not?
42i94h73		1643138733.0	sclo16	/r/AskReddit/comments/sclo16/men_who_like_men_what_do_you_look_for_in_a_man/	Men who like men, what do you look for in a man?
672z7sr6		1643138738.0	sclo3z	/r/AskReddit/comments/sclo3z/what_is_the_happiest_thing_you_have_witnessed/	What is the happiest thing you have witnessed ?
8nt5d7cu		1643138770.0	sclojc	/r/AskReddit/comments/sclojc/what_are_some_creative_ways_to_surprise_someone/	What are some creative ways to surprise someone with a puppy/kitten?
8ia0yjxm		1643138828.0	sclpc2	/r/AskReddit/comments/sclpc2/what_are_some_indicators_that_a_company_is/	What are some indicators that a company is actually great to work for?
bvwmf35l		1643138902.0	sclqcz	/r/AskReddit/comments/sclqcz/which_beauty_standard_do_you_think_is_the_most/	Which beauty standard do you think is the most toxic (this could be one that applies to men, women, or both)?
bwm1ynr0		1643138905.0	sclqe6	/r/AskReddit/comments/sclqe6/girl_whats_the_worst_pick_up_line_a_guy_ever_used/	Girl, what’s the worst pick up line a guy ever used with you?
iozgdhdd		1643139024.0	scls4s	/r/AskReddit/comments/scls4s/what_is_your_idea_of_perfect_foreplay/	What is your idea of perfect Foreplay?
iozgdhdd		1643139058.0	sclsm9	/r/AskReddit/comments/sclsm9/whats_your_biggest_turn_on/	What's your Biggest turn on?
2j3pnyao		1643139078.0	sclswe	/r/AskReddit/comments/sclswe/what_are_some_musttry_chain_store_trader_joes/	What are some must-try chain store (Trader Joe's, Costco, ...) food items?
iynuw9bv		1643139089.0	sclt2g	/r/AskReddit/comments/sclt2g/what_can_we_learn_from_really_garbage_tv_shows/	What can we learn from really garbage tv shows like Steven Universe and Breaking Bad, to make sure the mistakes made in those shows never happen again, and why?
gn3834wx		1643139250.0	sclv7r	/r/AskReddit/comments/sclv7r/how_big_of_a_mistake_would_it_be_to_buy_a_gas/	How big of a mistake would it be to buy a gas powered vehicle over electric right now with the 2030 all electric mandate in the US?
iynuw9bv		1643139259.0	sclvc6	/r/AskReddit/comments/sclvc6/tv_shows_like_steven_universe_and_breaking_bad/	TV Shows like Steven Universe and Breaking Bad are so fucking garbage, and what could the shows have done differently to have at least been considered average and why?
ij0p9cog		1643139344.0	sclwfu	/r/AskReddit/comments/sclwfu/do_you_think_christians_are_unfairly_bullied_on/	Do you think Christians are unfairly bullied on Reddit? Why or why not?
izbaybxc		1643137637.0	scl9a8	/r/AskReddit/comments/scl9a8/how_do_you_exude_a_dont_mess_with_me_aura/	How do you exude a “don’t mess with me aura?”
1glx25qg		1643139415.0	sclxdt	/r/AskReddit/comments/sclxdt/how_intelligent_is_elon_musk_is_he_above_newton/	How intelligent is Elon Musk ? is he above Newton, Einstein, Da Vinci ?
c75jw		1643139540.0	sclz2o	/r/AskReddit/comments/sclz2o/whats_the_your_favorite_your_favorite_thing_in/	What’s the your favorite your favorite thing in your “saved” section?
j0d1ukdz		1643139571.0	sclzhg	/r/AskReddit/comments/sclzhg/people_who_made_more_money_working_while_in/	People who made more money working while in college than they make now that they have graduated college, how is life treating you?
iynuw9bv		1643139645.0	scm0ji	/r/AskReddit/comments/scm0ji/what_is_your_favorite_animated_tv_show_targeted/	What is your favorite animated tv show targeted towards kids, and why?
etf88		1643139726.0	scm1mc	/r/AskReddit/comments/scm1mc/what_is_an_item_everyone_should_have_in_their_home/	What is an item everyone should have in their home?
iyus7z9v		1643139880.0	scm3kx	/r/AskReddit/comments/scm3kx/anyone_knows_any_serious_dating_app_where_girls/	Anyone knows any serious dating app where girls could find other girls (for lesbian /bisexual peoples) tried many popular ones but all those were loaded with fake profiles, any idea anyone?
13f7idxd		1643139884.0	scm3n3	/r/AskReddit/comments/scm3n3/how_fast_is_your_internet_connection_and_how_much/	How fast is your internet connection and how much does it cost?
iy4sqz8z		1643139886.0	scm3nv	/r/AskReddit/comments/scm3nv/your_last_meal_is_the_only_thing_you_can_eat_from/	Your last meal is the only thing you can eat from now on - how does your life look?
iozgdhdd		1643139892.0	scm3rb	/r/AskReddit/comments/scm3rb/what_is_the_weirdest_thing_you_dreamt_of_doing/	What is the weirdest thing you dreamt of doing with a Man/Woman?
j0j1qtdw		1643139866.0	scm3ev	/r/AskReddit/comments/scm3ev/what_is_a_scam_that_people_do_everyday/	What is a scam that people do everyday?
1vpogzkf		1643139939.0	scm4db	/r/AskReddit/comments/scm4db/as_potential_future_parents_what_movies_like/	As potential future parents, what movies like Avengers: Infinity War would you make your kids wait a certain amount of time to see the sequel?
iozgdhdd		1643140055.0	scm5vk	/r/AskReddit/comments/scm5vk/what_is_one_thing_you_want_to_do_that_you_have/	What is one thing you want to do that you have not yet - In the bedroom?
iu9l9jon		1643140122.0	scm6ru	/r/AskReddit/comments/scm6ru/how_do_you_act_tough_in_school/	How do you act tough in school?
3aaspwc9		1643140401.0	scmaf5	/r/AskReddit/comments/scmaf5/what_is_something_you_experienced_in_another/	What is something you experienced in another country that you really wish your country had ?
1vpogzkf		1643140546.0	scmca6	/r/AskReddit/comments/scmca6/in_what_ways_do_you_hope_that_you_will_be/	In what ways do you hope that you will be different from your parents when it comes to your current or future children?
d0fjwfu2		1643140556.0	scmcex	/r/AskReddit/comments/scmcex/what_is_the_best_and_the_worst_side_of_your/	What is the best and the worst side of your country ?
7xfe6		1643140589.0	scmcuv	/r/AskReddit/comments/scmcuv/what_is_your_biggest_pet_peeve_about_your_partner/	What is your biggest pet peeve about your partner?
