author	selftext	created_at	s_id	permalink	title
1x6ks0xl		1643140611.0	scmd57	/r/AskReddit/comments/scmd57/what_is_something_you_dont_like_that_most_people/	What is something you don't like, that most people do?
11xsonne		1643140811.0	scmftr	/r/AskReddit/comments/scmftr/if_you_got_taken_to_room_101_what_would_be_in/	If you got taken to "Room 101" what would be in there?
cyzhc7pp		1643140834.0	scmg90	/r/AskReddit/comments/scmg90/what_is_something_you_shouldnt_do_because_you_can/	What is something you shouldn't do because you can unintentionally hurt someone?
hcwnyvuc		1643140909.0	scmha8	/r/AskReddit/comments/scmha8/what_are_some_tech_trends_that_were_supposed_to/	What are some tech trends that were supposed to become mainstream, but never did?
j0d1ukdz		1643140992.0	scmigy	/r/AskReddit/comments/scmigy/bottled_drink_manufacturers_of_reddit_why_do_you/	Bottled drink manufacturers of Reddit, why do you make it so hard to get the cap off?
do5xt4e8		1643141065.0	scmjiw	/r/AskReddit/comments/scmjiw/people_with_accounting_degrees_what_career_path/	People with Accounting degrees: what career path did you take?
g8tlh1fd		1643141123.0	scmkcp	/r/AskReddit/comments/scmkcp/when_did_you_last_masturbate_and_how_do_you_feel/	When did you last masturbate and how do you feel about it now?
7f7ab4w9		1643141132.0	scmkhe	/r/AskReddit/comments/scmkhe/people_that_are_happy_whats_that_like/	People that are happy, what’s that like?
gdk8gie3		1643141138.0	scmkkf	/r/AskReddit/comments/scmkkf/what_are_thinking_about_right_now_why/	What are thinking about right now, why?
h1kji4do		1643141157.0	scmkud	/r/AskReddit/comments/scmkud/people_who_dont_subscribe_to_binary_genders_what/	People who don’t subscribe to binary genders, what are some typical things people say that always makes you roll your eyes?
j0d1ukdz		1643141222.0	scmlpl	/r/AskReddit/comments/scmlpl/so_what_is_the_elusive_krabby_patty_formula/	So what is the elusive krabby patty formula?
h309h5ay		1643141237.0	scmlx9	/r/AskReddit/comments/scmlx9/serious_who_are_the_real_richest_people_on_earth/	[Serious] Who are the REAL richest people on earth and how did they get their money?
67luaghk		1643141291.0	scmmnx	/r/AskReddit/comments/scmmnx/what_did_you_learn_from_life/	What did you learn from life?
im7ylt3g		1643141298.0	scmmrq	/r/AskReddit/comments/scmmrq/how_do_you_nicely_tell_your_wife_she_is_getting/	How do you nicely tell your wife she is getting chubby?
i5qqdh9e		1643141494.0	scmpi6	/r/AskReddit/comments/scmpi6/what_is_a_good_d_name_for_a_baby_boy/	What is a good "D" name for a baby boy?
j067q200		1643141533.0	scmq0r	/r/AskReddit/comments/scmq0r/what_is_a_hit_song_by_a_onehitwonder_that_would/	What is a hit song by a one-hit-wonder that would be so much better if it was written by a much more prolific musical artist and why?
cfbl40id		1643141534.0	scmq1v	/r/AskReddit/comments/scmq1v/what_mcu_villain_will_be_actually_right_if_the/	What MCU villain will be actually right if the earth had right now?
gif113ej		1643141764.0	scmt99	/r/AskReddit/comments/scmt99/what_do_you_wish_was_never_written_on_your/	What do you wish was never written on your gravestone?
6l3mbv47		1643141825.0	scmu31	/r/AskReddit/comments/scmu31/russians_of_reddit_how_does_the_russian_news/	Russians of Reddit, how does the Russian news portray the Ukraine situation?
j55qp		1643141890.0	scmuxp	/r/AskReddit/comments/scmuxp/what_is_an_invention_for_which_somebody_else_took/	What is an invention for which somebody else took credit?
7w1frutb		1643141931.0	scmvgn	/r/AskReddit/comments/scmvgn/is_putin_really_a_worse_option_than_the_current/	Is Putin really a worse option than the current elitist who have ruined America??
snlj7v6		1643142020.0	scmwmd	/r/AskReddit/comments/scmwmd/whats_something_expensive_thats_100_worth_the/	What's something expensive that's 100% worth the price?
ekariy4c		1643142039.0	scmwvv	/r/AskReddit/comments/scmwvv/people_who_accidentally_putted_a_fork_inside/	People who accidentally putted a fork inside their microwave,are you ok?
fxd7liyw		1643142082.0	scmxhy	/r/AskReddit/comments/scmxhy/what_food_item_is_worth_getting_the_more/	What food item is worth getting the more expensive version of?
895279k0		1643142162.0	scmyjy	/r/AskReddit/comments/scmyjy/what_are_your_student_loan_stats_such_as_degree/	What are your student loan stats such as degree, semester cost, original and current balance?
840whq3n		1643142185.0	scmyuf	/r/AskReddit/comments/scmyuf/serious_redditors_who_have_killed_in_self_defense/	[Serious] Redditors who have killed in self defense (legally) whats your story?
if5eb9jd		1643142308.0	scn0i7	/r/AskReddit/comments/scn0i7/for_those_who_had_a_close_encounter_with_a/	For those who had a close encounter with a wildlife predator, what happened?
em82fl0p		1643142450.0	scn2ew	/r/AskReddit/comments/scn2ew/you_create_a_special_sauce_what_are_the/	You create a special sauce - what are the ingredients?
4s7ogics		1643142477.0	scn2s8	/r/AskReddit/comments/scn2s8/whats_your_most_embarrassing_wardrobe_malfunction/	What's your most embarrassing wardrobe malfunction story?
9kbvp95m		1643142582.0	scn475	/r/AskReddit/comments/scn475/have_you_ever_said_something_you_didnt_mean_whats/	Have you ever said something you didn’t mean? What’s the worst instance of you doing that?
8kqxyx6q		1643142583.0	scn47m	/r/AskReddit/comments/scn47m/youre_in_a_room_full_of_people_what_is_something/	You’re in a room full of people. What is something you could say that would make the whole room go completely silent and turn to stare at you?
gr8bf179		1643142727.0	scn65c	/r/AskReddit/comments/scn65c/whats_something_you_would_tell_yourself_30_years/	What’s something you would tell yourself 30 years ago?
6zd1tmln		1643142782.0	scn6wj	/r/AskReddit/comments/scn6wj/what_was_the_worst_experience_you_ever_had_at_a/	What was the worst experience you ever had at a restaurant due to bad service?
6zd1tmln		1643142859.0	scn7v1	/r/AskReddit/comments/scn7v1/who_is_someone_that_is_regarded_as_a_genius_or/	Who is someone that is regarded as a genius or very gifted today, that was not appreciated in their time?
iozgdhdd		1643142901.0	scn8ee	/r/AskReddit/comments/scn8ee/men_who_like_men_what_is_your_ideal_perfect_man/	Men who like Men, What is your ideal perfect Man?
ccv33dqg		1643142936.0	scn8xa	/r/AskReddit/comments/scn8xa/why_has_americas_love_for_job_creators_vanished/	Why has Americas love for “job creators” vanished?
im7ylt3g		1643142963.0	scn9az	/r/AskReddit/comments/scn9az/who_would_win_in_a_fight_america_or_china/	Who would win in a fight: America or China?
iybjjty5		1643143086.0	scnayt	/r/AskReddit/comments/scnayt/nonvirgins_of_reddit_how_does_it_feel_to_be_came/	Non-Virgins of Reddit, How does it feel to be came inside of?
cfbl40id		1643143105.0	scnb86	/r/AskReddit/comments/scnb86/what_is_the_most_creative_and_unique_excuse_you/	What is the most creative and unique excuse you have ever come across?
43s2zpxh		1643143190.0	scncci	/r/AskReddit/comments/scncci/what_is_a_thought_you_frequently_have_that_you/	What is a thought you frequently have that you regret every time you think it?
7zt9z6iy		1643143196.0	scncf8	/r/AskReddit/comments/scncf8/what_is_something_you_dont_want_others_to_know/	What is something you don't want others to know about yourself?
eh97w8ik		1643143210.0	scncmg	/r/AskReddit/comments/scncmg/what_movies_are_coming_out_in_2022/	What Movies are coming out in 2022?
4guywxj7		1643143236.0	scnd0v	/r/AskReddit/comments/scnd0v/non_americans_of_reddit_can_you_afford_to_pay_for/	Non americans of reddit, can you afford to pay for american brands/services in your country why or why not?
zm6q6		1643143289.0	scndr8	/r/AskReddit/comments/scndr8/what_would_you_say_is_the_best_part_about_being_a/	What would you say is the best part about being a truck driver?
3l32qbt9		1643143290.0	scndrt	/r/AskReddit/comments/scndrt/whos_your_favorite_video_game_character_thats/	Who's your favorite video game character that's hated as much as they're loved by fans?
16c1wl		1643143480.0	scngcg	/r/AskReddit/comments/scngcg/which_critically_acclaimed_band_couldnt_resonate/	Which critically acclaimed band couldn't resonate with you?
izncr6zz		1643143594.0	scnhxr	/r/AskReddit/comments/scnhxr/whats_something_you_hate_that_you_just_cant_stay/	What’s something you hate that you just can’t stay away from?
i5qqdh9e		1643143642.0	scnim5	/r/AskReddit/comments/scnim5/what_was_the_hardest_achievement_you_ever/	What was the hardest achievement you ever unlocked in a videogame?
3syj0r3f		1643143648.0	scniov	/r/AskReddit/comments/scniov/during_sex_why_do_some_girls_call_their/	During sex, why do (some) girls call their boyfriends 'daddy', yet its not as common for boys to call their girlfriends 'Mommy'?
5uqyr		1643143773.0	scnkdm	/r/AskReddit/comments/scnkdm/what_single_event_determined_your_entire_future/	What single event determined your entire future?
iynuw9bv		1643143776.0	scnkf7	/r/AskReddit/comments/scnkf7/at_what_age_should_you_become_concerned_if/	At what age should you become concerned if someone you know is still watching tv shows targeted towards kids/teens, and why?
i5qqdh9e		1643143793.0	scnkma	/r/AskReddit/comments/scnkma/what_is_a_good_h_name_for_a_baby_boy/	What is a good "H" name for a baby boy?
5a6xacez		1643143825.0	scnl1g	/r/AskReddit/comments/scnl1g/what_was_your_most_regretable_wank_after_the_post/	What was your most regretable wank after the post nut clarity kicked in?
3tfnq7mz		1643143877.0	scnlq4	/r/AskReddit/comments/scnlq4/what_has_been_seemingly_forgotten_but_you_feel/	What has been seemingly forgotten but you feel should be remembered?
j0o0od5r		1643143387.0	scnf3b	/r/AskReddit/comments/scnf3b/how_diddo_you_save_a_relationship_that_almost/	How did/do you save a relationship that almost ended? Why did it almost end?
mkpvd9g		1643144107.0	scnopo	/r/AskReddit/comments/scnopo/what_long_unsolved_mysteries_eventually_did_get/	What long unsolved mysteries eventually DID get solved?
6mk60vlm		1643144128.0	scnozk	/r/AskReddit/comments/scnozk/what_stereotypes_do_you_want_to_break_in_the_tech/	What stereotypes do you want to break in the tech domain?
6zd1tmln		1643144199.0	scnpx6	/r/AskReddit/comments/scnpx6/whats_a_moment_that_made_you_go_wow_the_person/	What’s a moment that made you go “Wow! The person raising me is kinda dumb!”?
iw206q9a		1643142780.0	scn6vz	/r/AskReddit/comments/scn6vz/ladies_did_you_experience_any_interruptions_or/	Ladies, did you experience any interruptions or irregularities in your cycle after the initial COVID vaccine? If so, what happened?
5bmhoyq7		1643144293.0	scnr3r	/r/AskReddit/comments/scnr3r/what_is_the_best_valentines_gift_for_an_ex_that/	What is the best Valentine's gift for an ex that you're talking to again but not quite dating yet again?
5bgsq		1643144343.0	scnrrk	/r/AskReddit/comments/scnrrk/whats_your_best_secondhand_or_third_or_fourthhand/	What’s your best secondhand (or third or fourth-hand) piece of celebrity gossip?
9fkmgm8p		1643144393.0	scnsea	/r/AskReddit/comments/scnsea/theres_a_lot_becoming_worse_in_the_world_but/	There’s a lot becoming worse in the world, but what’s something turning better?
6mk60vlm		1643144433.0	scnt27	/r/AskReddit/comments/scnt27/what_is_the_worst_thing_you_did_in_your_school_or/	What is the worst thing you did in your school or college that no one knows about?
56pps1ed		1643144445.0	scnt8m	/r/AskReddit/comments/scnt8m/what_is_the_most_puzzling_mentality_that_exists/	What is the most puzzling mentality that exists within your family?
g2e6spix		1643144480.0	scntpq	/r/AskReddit/comments/scntpq/what_is_a_hard_thing_to_archive_but_easy_to_get/	What is a hard thing to archive but easy to get over afterwards?
3qx8w		1643144489.0	scntu0	/r/AskReddit/comments/scntu0/who_is_the_most_overrated_pro_athlete_of_all_time/	Who is the most overrated pro athlete of all time? Why?
9lpcm52n		1643144503.0	scnu14	/r/AskReddit/comments/scnu14/anyones_with_kids_and_a_low_to_average_paid_job/	Anyones with kids and a low to average paid job, How does one manage to live on their own and pay the bills?
7o0mzn8w		1643144553.0	scnups	/r/AskReddit/comments/scnups/inspired_by_a_similar_question_for_women_so_men/	Inspired by a similar question for women so, men who like men, what do you look for in a man?
ok8gt		1643144637.0	scnvug	/r/AskReddit/comments/scnvug/russians_of_reddit_how_do_you_feel_about_invading/	Russians of Reddit, how do you feel about invading Ukraine?
54ca5qdr		1643144674.0	scnwd4	/r/AskReddit/comments/scnwd4/ladies_of_reddit_you_just_woke_up_pregnant_what/	Ladies of Reddit, you just woke up pregnant. What do you do?
7sm7u1hn		1643144679.0	scnwf5	/r/AskReddit/comments/scnwf5/if_you_could_modify_your_body_any_way_you_want/	If you could modify your body any way you want. What's the one thing you would do?
f5miua8o		1643144791.0	scnxyp	/r/AskReddit/comments/scnxyp/what_is_the_deepest_truth_you_have_discovered_in/	What is the deepest truth you have discovered in life?
8oh4kq36		1643144864.0	scnyyr	/r/AskReddit/comments/scnyyr/how_often_does_cereal_spill_off_the_rim_of_the/	How often does cereal spill off the rim of the bowl for you?
6xp5qx46		1643144881.0	scnz7c	/r/AskReddit/comments/scnz7c/redditors_who_have_worked_in_the_real_estate/	Redditors who have worked in the real estate business, what is some of the biggest mistakes you have seen a client do?
7jy9b5k0		1643144990.0	sco0mo	/r/AskReddit/comments/sco0mo/whats_the_greatest_gift_you_can_give/	What’s the greatest gift you can give?
cyzhc7pp		1643145005.0	sco0tr	/r/AskReddit/comments/sco0tr/what_do_you_do_when_you_want_to_go_somewhere_and/	What do you do when you want to go somewhere and scream?
7jy9b5k0		1643145036.0	sco195	/r/AskReddit/comments/sco195/whats_the_greatest_gift_someone_can_give/	What’s the greatest gift someone can give?
fvhpk3j9		1643145077.0	sco1to	/r/AskReddit/comments/sco1to/what_is_this_first_thing_you_notice_about_any/	What is this first thing you notice about any person?
2adv3eh5		1643145085.0	sco1y5	/r/AskReddit/comments/sco1y5/the_very_last_person_you_looked_at_whether/	The very last person you looked at whether fictional or real life is who you have to successfully masterbate to or you lose your genitals for life. How screwed or lucky are you?
idccd		1643145129.0	sco2ks	/r/AskReddit/comments/sco2ks/to_those_of_who_you_have_unironically_bought_an/	To those of who you have unironically bought an NFT: why?
h8vibwb2		1643145279.0	sco4lc	/r/AskReddit/comments/sco4lc/people_of_reddit_who_got_arranged_marriage_what/	People of Reddit who got arranged marriage what are the questions you think everybody should ask their potential partners before marriage?
e6dgoxzu		1643145302.0	sco4wb	/r/AskReddit/comments/sco4wb/whos_the_grossest_roommate_youve_had/	Who's the grossest roommate you've had?
fvhpk3j9		1643145376.0	sco5vm	/r/AskReddit/comments/sco5vm/how_do_you_know_when_you_can_trust_someone/	How do you know when you can trust someone?
iozgdhdd		1643145578.0	sco8jc	/r/AskReddit/comments/sco8jc/married_people_of_reddit_what_do_you_feel_is_the/	Married people of Reddit, What do you feel is the secret to making a marriage work for a lifetime?
iynuw9bv		1643145585.0	sco8mc	/r/AskReddit/comments/sco8mc/to_those_who_watched_lizzie_mcguire_what_was_your/	To those who watched Lizzie McGuire, what was your favorite part about the show and why?
jz6hg		1643145619.0	sco93g	/r/AskReddit/comments/sco93g/what_are_some_mindblowing_facts_about_the_universe/	What are some mindblowing facts about the universe?
izqy4vb9		1643145766.0	scob4j	/r/AskReddit/comments/scob4j/why_you_dont_like_your_parents/	Why you don’t like your parents?
h98i3btd		1643145818.0	scobtf	/r/AskReddit/comments/scobtf/what_are_some_obvious_hints_that_you_are_being/	What are some obvious hints that you are being friendzoned ?
j0d1ukdz		1643145903.0	scocwe	/r/AskReddit/comments/scocwe/how_long_can_you_go_past_the_expiration_date_on_a/	How long can you go past the expiration date on a can of soup before it make you ill?
1m0mq4r3		1643145914.0	scod1a	/r/AskReddit/comments/scod1a/what_celebrity_looks_like_what_breed_of_dog/	What celebrity looks like what breed of dog?
a8ew86rb		1643146085.0	scofc8	/r/AskReddit/comments/scofc8/in_your_opinion_whats_the_best_super_saiyan/	In your opinion what’s the best super saiyan transformation?
3l32qbt9		1643146175.0	scogi0	/r/AskReddit/comments/scogi0/what_fictional_character_was_loved_but_because_of/	What fictional character was loved but because of what they said or did their popularity crashed and burned?
3bwyu187		1643146249.0	scohik	/r/AskReddit/comments/scohik/what_is_your_opinion_on_sneezing/	What is your opinion on sneezing?
3c9np		1643146327.0	scoiko	/r/AskReddit/comments/scoiko/what_was_your_worst_experience_with_a_neighbor/	What was your worst experience with a neighbor?
iozgdhdd		1643146426.0	scojvs	/r/AskReddit/comments/scojvs/what_would_you_do_with_the_time_you_had_left_if/	What would you do with the time you had left if you found out that you're dying in a month's time?
1vabu2oi		1643146742.0	sconwq	/r/AskReddit/comments/sconwq/would_you_date_someone_with_an_std_that_cant_be/	Would you date someone with an STD that can’t be cured? Why or why not?
yazv6m0		1643146754.0	scoo31	/r/AskReddit/comments/scoo31/who_is_the_most_evil_human_being_that_has_ever/	Who is the most evil human being that has ever walked the planet?
bfw1470w		1643146773.0	scoobj	/r/AskReddit/comments/scoobj/a_mad_scientist_offers_you_one_million_dollars_to/	A mad scientist offers you one million dollars to try an experimental pill. What do you think the side effects will be?
2dy3hrl0		1643146786.0	scooi3	/r/AskReddit/comments/scooi3/has_anyone_ever_won_a_prizecash_prize_from_a_food/	Has anyone ever won a prize/cash prize from a food item, and if so what was it?
iozgdhdd		1643146789.0	scoojc	/r/AskReddit/comments/scoojc/what_are_you_gonna_do_if_you_could_have_a_million/	What are you gonna do if you could have a Million dollars fall into your lap right now?
3m0nqgen		1643146809.0	scoosv	/r/AskReddit/comments/scoosv/what_game_you_absolutely_love_but_its_not_very/	What game you absolutely love but it's not very popular?
8na1sz9		1643146844.0	scopah	/r/AskReddit/comments/scopah/whats_a_movie_that_you_hated_but_still_watched/	What's a movie that you hated, but still watched again?
cyzhc7pp		1643146860.0	scopir	/r/AskReddit/comments/scopir/where_do_you_live_what_is_one_of_your_countrys/	Where do you live? What is one of your country's worst problems?
if0a58yu		1643146872.0	scopoa	/r/AskReddit/comments/scopoa/how_do_you_stay_positive/	How do you stay positive?
f52gu40		1643146976.0	scor0n	/r/AskReddit/comments/scor0n/who_could_make_the_worlds_best_sandwich/	Who could make the world's best sandwich?
5ogue4ul		1643147016.0	scoric	/r/AskReddit/comments/scoric/whats_your_fav_question/	What’s your fav question?
r4jml8r		1643147070.0	scos64	/r/AskReddit/comments/scos64/what_do_you_prefer_monogamy_or_polygamy_why/	What do you prefer - Monogamy or Polygamy? Why?
3qx8w		1643147087.0	scosdf	/r/AskReddit/comments/scosdf/whos_someone_you_admire_for_reasons_other_than/	Who’s someone you admire for reasons OTHER than what they’re famous for? What’s the reason?
mkmuh		1643147125.0	scosub	/r/AskReddit/comments/scosub/what_is_something_that_you_would_advertise_for/	What is something that you would advertise for free?
f52gu40		1643147257.0	scoudn	/r/AskReddit/comments/scoudn/what_movie_went_from_great_to_hot_garbage_in_a/	What movie went from great to hot garbage in a single scene?
4qz5pspc		1643147301.0	scouvj	/r/AskReddit/comments/scouvj/fellas_we_all_get_nrbs_no_reason_bonerswhats_been/	Fellas, we all get NRB’s (no reason boners)—what’s been your most awkward one?
14mniy		1643147302.0	scouvt	/r/AskReddit/comments/scouvt/for_people_that_were_bullied_how_did_it_affect/	For people that were bullied, how did it affect your life longterm? If you could say one thing to you bully what would it be?
ikwceply		1643147343.0	scovco	/r/AskReddit/comments/scovco/what_was_the_most_recent_youtube_channel_you/	What was the most recent youtube channel you subscribed to?
ifgnr2m7		1643147361.0	scovkw	/r/AskReddit/comments/scovkw/what_would_be_your_reaction_if_your_sister_was_an/	What would be your reaction if your sister was an dancer/escort?
8ip4h		1643147510.0	scoxbm	/r/AskReddit/comments/scoxbm/men_of_reddit_whats_the_female_version_of_opening/	Men of Reddit what’s the female version of opening the car door for a woman?
at9u66l2		1643147711.0	scozpu	/r/AskReddit/comments/scozpu/people_who_have_bought_a_home_with_or_have/	People who have bought a home with, or have inherited a home with a 50s kitchen of the future, what has been your experience with it thus far?
1vabu2oi		1643147823.0	scp15d	/r/AskReddit/comments/scp15d/how_much_money_would_it_take_for_you_to_throw/	How much money would it take for you to throw your whole life away? You’d have to leave behind your career, family and friends and start fresh, so, how much?
i8w9tpha		1643147940.0	scp2nr	/r/AskReddit/comments/scp2nr/what_is_the_most_useless_job_but_still_paid_good/	What is the most useless job, but still paid good?
7qjoc430		1643147959.0	scp2w5	/r/AskReddit/comments/scp2w5/who_would_be_the_worst_possible_famous/	Who would be the worst possible famous person/fictional character to have an onlyfans account and why?
bfw1470w		1643147973.0	scp32q	/r/AskReddit/comments/scp32q/what_celebrity_do_you_look_like/	What celebrity do you look like?
a8ew86rb		1643148152.0	scp5jo	/r/AskReddit/comments/scp5jo/in_your_opinion_whats_the_best_lego_show/	In your opinion what’s the best Lego show?
7qarcuvz		1643148162.0	scp5nr	/r/AskReddit/comments/scp5nr/what_big_or_small_made_you_realize_there_is_no/	What big or small made you realize there is no hope?
3e3evg7q		1643148166.0	scp5pp	/r/AskReddit/comments/scp5pp/what_is_the_most_cowardly_thing_you_have_done/	What is the most cowardly thing you have done that makes you cringe when you think about it?
8na1sz9		1643148179.0	scp5x6	/r/AskReddit/comments/scp5x6/what_movie_do_you_hate_but_cant_stop/	What movie do you hate, but can't stop talking/thinking about?
ht1lkmlj		1643148197.0	scp657	/r/AskReddit/comments/scp657/what_would_you_do_if_your_girlfriend_refused_to/	What would you do if your girlfriend refused to have a threesome? Is it reason enough to leave her? Is it fair for her to ruin your dreams? A man who loves her unconditionally and above all else?
8pq6ukx1		1643148234.0	scp6ks	/r/AskReddit/comments/scp6ks/what_existed_1000_years_ago_that_still_exists/	What Existed 1,000 Years Ago That Still Exists Today?
5p0xs65d		1643148273.0	scp71q	/r/AskReddit/comments/scp71q/what_is_the_scariest_moment_in_your_life/	What is the scariest moment in your life?
959a13ul		1643148321.0	scp7ne	/r/AskReddit/comments/scp7ne/parents_of_transgender_children_how_did_your_kid/	Parents of transgender children: how did your kid come out to you and what was your response?
h5bbeql9		1643148335.0	scp7un	/r/AskReddit/comments/scp7un/what_does_a_bunch_of_mourning_doves_on_your_porch/	What does a bunch of mourning doves on your porch symbolize if anything?
1e1evkjx		1643148374.0	scp8ad	/r/AskReddit/comments/scp8ad/considering_the_fact_that_russia_may_start_a_war/	Considering the fact that Russia may start a war at any moment now. What are some war tips everyone should know?
guvyuw1l		1643148415.0	scp8ta	/r/AskReddit/comments/scp8ta/what_youtube_family_channel_is_the_worst_the_ace/	What YouTube Family channel is the worst the ace family or the prince family?
6jawlxyg		1643148462.0	scp9ea	/r/AskReddit/comments/scp9ea/tailgaters_of_reddit_if_you_can_go_around_why/	Tailgaters of Reddit, if you can go around - why?
i0qemp37		1643148463.0	scp9es	/r/AskReddit/comments/scp9es/bitts_or_tutts_why/	Bitts or Tutts? Why?
hf2dfocv		1643148505.0	scp9xt	/r/AskReddit/comments/scp9xt/what_is_something_most_redditors_are_confidently/	What is something most Redditors are confidently incorrect about?
guvyuw1l		1643148580.0	scpaus	/r/AskReddit/comments/scpaus/what_youtube_family_channel_is_the_worst/	What YouTube Family channel is the worst?
efxc0ubd		1643148638.0	scpblz	/r/AskReddit/comments/scpblz/men_who_like_men_whats_your_type/	Men who like men: what's your type?
1nztivzs		1643148713.0	scpcjt	/r/AskReddit/comments/scpcjt/if_cotton_swabs_are_really_bad_to_put_into_your/	If cotton swabs are really bad to put into your ears then why make them the exact size to fit your ear canal? Why not make them slightly bigger so you can still clean around the ear but not go inside?
91kbbccu		1643148793.0	scpdlq	/r/AskReddit/comments/scpdlq/whats_your_best_life_hack/	What’s your best life hack?
iyba37n6		1643148890.0	scpey3	/r/AskReddit/comments/scpey3/how_do_you_tease_someone/	How do you tease someone?
8ddp0r9c		1643148909.0	scpf6v	/r/AskReddit/comments/scpf6v/what_are_some_of_the_dumbest_things_you_have_ever/	What are some of the dumbest things you have ever done?
7t9uduzo		1643148949.0	scpfra	/r/AskReddit/comments/scpfra/whats_the_one_crime_youd_commit_if_there_were_no/	What’s the one crime you’d commit if there were no repercussions from it?
hcy6ez7g		1643149015.0	scpgml	/r/AskReddit/comments/scpgml/nsfwtrans_people_of_reddit_which_gender_was/	NSFW:Trans people of Reddit. Which gender was easier to masterbait with?
rnyujv2		1643149071.0	scphbt	/r/AskReddit/comments/scphbt/what_feel_good_wholesome_news_story_did_you_read/	What feel good wholesome news story did you read recently that’s actually an indication of what’s wrong with society?
e2nsjfay		1643149096.0	scphon	/r/AskReddit/comments/scphon/if_you_like_a_girlbut_her_best_friend_used_to/	If you like a girl,but her best friend used to flirt with you,what should you do?Any tips?
32nrr24h		1643149147.0	scpiao	/r/AskReddit/comments/scpiao/people_who_are_allergic_to_water_how_did_you_find/	People who are allergic to water, how did you find out ?
