author	selftext	created_at	s_id	permalink	title
hx3euzq8		1642798027.0	s9kig8	/r/AskReddit/comments/s9kig8/at_what_age_did_you_realize_you_are_getting_old/	At what age did you realize you are getting old?
d8bex0xj		1642798052.0	s9kir9	/r/AskReddit/comments/s9kir9/ok_how_the_hell_are_people_doing_in_ukraine_they/	Ok, how the hell are people doing in Ukraine, they Russia just deployed 140 warships?
ip3g23p9		1642798120.0	s9kjlr	/r/AskReddit/comments/s9kjlr/what_public_figure_had_the_biggest_fall_from/	What public figure had the biggest fall from grace and do you think they deserved it? Why or why not?
4qz5pspc		1642798123.0	s9kjnj	/r/AskReddit/comments/s9kjnj/ladies_how_important_is_foreplay_to_you_in_the/	Ladies, how important is foreplay to you in the bedroom? Is it just as/more important than sex for getting you to climax?
hz4eloqu		1642798144.0	s9kjwl	/r/AskReddit/comments/s9kjwl/what_would_you_do_if_you_do_not_want_to_do/	What would you do if you do not want to do something that makes you uncomfortable (which isn’t uncomfortable for others) but if you do not do it, you will be disliked because you cannot do a simple favor most people can do?
ip3g23p9		1642798162.0	s9kk4o	/r/AskReddit/comments/s9kk4o/what_celebrity_makes_you_think_now_theres_a_man/	What celebrity makes you think “now THERE’S a man” when you see him? Why?
f6n9ador		1642798163.0	s9kk5e	/r/AskReddit/comments/s9kk5e/what_was_the_most_toxic_behaviour_in_game_you/	What was the most toxic behaviour in game you encountered?
dpoe33cc		1642798173.0	s9kk98	/r/AskReddit/comments/s9kk98/nonvirgin_males_of_reddit_when_was_the_last_time/	Non-virgin males of reddit, when was the last time you had sexual intercourse with a female specimen?
dg73tn7g		1642798174.0	s9kk9p	/r/AskReddit/comments/s9kk9p/people_who_have_been_in_the_same_job_for_more/	people who have been in the same job for more than five years, why?
7qgjxvu4		1642798252.0	s9klcp	/r/AskReddit/comments/s9klcp/what_would_you_call_an_eggplantaubergine_if_you/	What would you call an eggplant/aubergine if you could change its name?
dpoe33cc		1642798269.0	s9klm6	/r/AskReddit/comments/s9klm6/nonvirgin_males_of_reddit_when_was_the_last_time/	Non-virgin males of reddit, when was the last time you had sexual intercourse with a female and how does that feel?
dnp0jegp		1642798279.0	s9kls9	/r/AskReddit/comments/s9kls9/what_topics_are_appropriate_for_a_meet_and_greet/	What topics are appropriate for a meet and greet with a new executive?
ip3g23p9		1642798285.0	s9kluy	/r/AskReddit/comments/s9kluy/why_do_you_think_movie_dialogue_is_so_inaudible/	Why do you think movie dialogue is so inaudible so often, and what has helped you with this issue?
4fed71cv		1642798329.0	s9kmj6	/r/AskReddit/comments/s9kmj6/whats_your_idea_for_a_story_that_youll_never_write/	What’s your idea for a story that you’ll never write?
hk2wrq0e		1642798443.0	s9ko3i	/r/AskReddit/comments/s9ko3i/serious_how_can_someone_stop_yearning_for_an/	[Serious] How can someone stop yearning for an apology or any sign of regret from a person who mistreated them?
dpps6		1642798488.0	s9kony	/r/AskReddit/comments/s9kony/americans_of_reddit_what_was_the_biggest_surprise/	Americans of Reddit, what was the biggest surprise when traveling to another US state?
5hn6hy7e		1642798523.0	s9kp6k	/r/AskReddit/comments/s9kp6k/lawyers_of_reddit_what_are_some_of_the_most/	Lawyers of Reddit, what are some of the most absurd, funny or ridiculous cases you had to work on?
5iniu1j9		1642798555.0	s9kplj	/r/AskReddit/comments/s9kplj/what_to_do_on_how_to_get_a_fever_quickly_tried/	what to do on how to get a fever quickly? tried wearing wet shirt then sit in front of a fan to dry. Tried to wash only the hair 3 times and It didn't work as well. Ghaaaaaaaaaaaad been doing this the whole night but nothing's happen. Any suggestions? How to have fever?
hx3euzq8		1642798615.0	s9kqe5	/r/AskReddit/comments/s9kqe5/would_you_say_your_mind_is_the_same_as_it_was/	Would you say your mind is the same as it was when you were growing up? Why?
ip3g23p9		1642798637.0	s9kqo2	/r/AskReddit/comments/s9kqo2/what_is_one_movie_cliche_you_wish_hollywood_would/	What is one movie cliche you wish Hollywood would dispense with ASAP? Why?
4wvf72o0		1642798772.0	s9ksfp	/r/AskReddit/comments/s9ksfp/how_does_one_develop_megalophobia_what_type_of/	How does one develop Megalophobia? What type of experiences could cause one to develop the fear of large objects?
5ntv6		1642798775.0	s9ksgo	/r/AskReddit/comments/s9ksgo/whats_the_worst_thing_you_got_away_with_as_a_kid/	What's the worst thing you got away with as a kid?
ivcwb4cz		1642798822.0	s9ktbr	/r/AskReddit/comments/s9ktbr/what_is_the_open_secret_in_your_family/	What is the open secret in your family?
iv693jed		1642798831.0	s9kth0	/r/AskReddit/comments/s9kth0/what_conspiracy_theory_has_haunted_you_since/	What conspiracy theory has haunted you since you’ve heard about it?
f6n9ador		1642798871.0	s9ku2d	/r/AskReddit/comments/s9ku2d/whats_your_professionjob_and_hows_it_going/	What's your profession/job and how's it going?
h53cdi1c		1642798908.0	s9kuon	/r/AskReddit/comments/s9kuon/whats_the_best_sexy_clip_youve_seen_recently/	What's the best sexy clip you've seen recently?
itmcqfto		1642798979.0	s9kvqh	/r/AskReddit/comments/s9kvqh/what_made_you_realise_the_person_you_fell_in_love/	What made you realise the person you fell in love with was actually an asshole?
ikwceply		1642798989.0	s9kvv3	/r/AskReddit/comments/s9kvv3/when_did_a_spoiler_ruin_something_for_you/	When did a spoiler ruin something for you?
55lrohzh		1642799115.0	s9kxg7	/r/AskReddit/comments/s9kxg7/healthcare_workers_who_is_a_patient_you_will/	Healthcare workers: who is a patient you will never forget?
dbvkpokc		1642799141.0	s9kxrs	/r/AskReddit/comments/s9kxrs/if_everyone_in_the_world_had_a_superpowers_like/	If everyone in the world had a superpowers like in that movie Sky High, what kind of bullying do you think would take place?
ikwceply		1642799232.0	s9kyyu	/r/AskReddit/comments/s9kyyu/what_calming_wholesome_youtube_channels_do_you/	What calming wholesome youtube channels do you watch to unwind?
6fjm401t		1642799273.0	s9kzin	/r/AskReddit/comments/s9kzin/if_you_could_have_one_famous_person_think_about/	If you could have one famous person think about you for 5 minutes, who would it be and why?
hk2wrq0e		1642799319.0	s9l044	/r/AskReddit/comments/s9l044/serious_whats_a_website_where_you_can_write_about/	[Serious] What's a website where you can write about your past hurts and whatever you've written is destroyed as a sign of closure?
23vm0lza		1642799329.0	s9l08k	/r/AskReddit/comments/s9l08k/what_is_the_worst_that_can_happen_without_doing_a/	What is the worst that can happen without doing a home inspection when buying real estate?
15v3nl0e		1642799385.0	s9l0z3	/r/AskReddit/comments/s9l0z3/nonamericans_of_reddit_what_are_some_things/	Non-Americans of Reddit, what are some things online that sound so American it annoys you?
gbhmcl40		1642799479.0	s9l2f7	/r/AskReddit/comments/s9l2f7/people_who_are_struggling_with_anxietyptsd_what/	People who are struggling with anxiety/PTSD, what do you do to help calm yourself down?
2adv3eh5		1642799483.0	s9l2hb	/r/AskReddit/comments/s9l2hb/what_kind_of_person_is_dangerous/	What kind of person is dangerous?
h0ocudg		1642799533.0	s9l37o	/r/AskReddit/comments/s9l37o/what_current_skill_do_you_think_will_eventually/	What current skill do you think will eventually fade from society?
5kf07ovw		1642799751.0	s9l63a	/r/AskReddit/comments/s9l63a/what_would_you_like_to_see_in_a_mashup_show_of/	What would you like to see in a mashup show of Arrested Development and Ozark?
501bpd1m		1642799775.0	s9l6er	/r/AskReddit/comments/s9l6er/what_is_100_legal_but_still_feels_like_a_scam/	What is 100% legal but still feels like a scam?
dpoe33cc		1642799899.0	s9l80l	/r/AskReddit/comments/s9l80l/if_having_sex_was_illegal_what_alternatives_would/	If having sex was illegal, what alternatives would we have to replace it?
ihm373xw		1642799946.0	s9l8nc	/r/AskReddit/comments/s9l8nc/who_is_the_black_sheep_in_your_family/	Who is the black sheep in your family?
iohbrs7r		1642800035.0	s9l9yf	/r/AskReddit/comments/s9l9yf/who_do_you_want_to_apologize_to_and_why/	Who do you want to apologize to and why?
87yp4z02		1642800037.0	s9l9ze	/r/AskReddit/comments/s9l9ze/if_you_couldnt_say_the_words_no_and_yes_and_you/	If you couldn't say the words 'no' and 'yes' and you had a job interview or a formal meeting what would you say?
h3if283w		1642800053.0	s9la7p	/r/AskReddit/comments/s9la7p/what_is_a_basic_skill_that_you_were_shocked_some/	what is a basic skill that you were shocked some people don't have?
hdv4p4mg		1642800134.0	s9lbil	/r/AskReddit/comments/s9lbil/what_is_normal_in_modern_society_that_you_feel_is/	What is normal in modern society, that you feel is wrong?
ivcwb4cz		1642800143.0	s9lbo3	/r/AskReddit/comments/s9lbo3/what_scares_you_the_most_about_your_family/	What scares you the most about your family?
vj1c7		1642800155.0	s9lbuz	/r/AskReddit/comments/s9lbuz/what_are_some_obscure_reddit_poststhreads/	What are some obscure reddit posts/threads everyone needs to know about ?
18hizbxu		1642800173.0	s9lc2s	/r/AskReddit/comments/s9lc2s/priests_of_reddit_whats_the_craziest_shit_youve/	Priests of reddit, what’s the craziest shit you’ve ever heard in confession? [serious]
2dj7xf0n		1642800432.0	s9lfcm	/r/AskReddit/comments/s9lfcm/serious_what_is_your_illnessdiagnosis/	[Serious] What is your illness/diagnosis?
9zzotng		1642800448.0	s9lfjw	/r/AskReddit/comments/s9lfjw/for_all_of_us_who_grew_up_on_the_wrong_side_of/	For all of us who grew up on the 'wrong side of the tracks', what is something you're proud to have done or achieved?
h249hyx3		1642800471.0	s9lftx	/r/AskReddit/comments/s9lftx/what_was_the_weirdest_thing_you_have_ever_seen/	What was the weirdest thing you have ever seen?
h249hyx3		1642800661.0	s9licb	/r/AskReddit/comments/s9licb/what_emotions_can_you_make/	What emotions can you make?
fsdpupg7		1642800662.0	s9licm	/r/AskReddit/comments/s9licm/what_is_an_appropriate_gift_for_a_male_to_give/	What is an appropriate gift for a male to give close female friends on Valentines Day?
itmcqfto		1642800669.0	s9ligs	/r/AskReddit/comments/s9ligs/what_song_makes_you_instantly_dance/	what song makes you instantly dance?
7k7ia0c5		1642800683.0	s9linx	/r/AskReddit/comments/s9linx/whats_the_best_theme_song_of_all_time/	What’s the best theme song of all time?
2po6gqsk		1642800700.0	s9lixa	/r/AskReddit/comments/s9lixa/whats_something_you_regret_doing_whats_something/	What’s something you regret doing, what’s something you regret NOT doing, and which do you regret more?
50omahon		1642800711.0	s9lj3m	/r/AskReddit/comments/s9lj3m/what_is_something_you_did_that_still_makes_you/	What is something you did that still makes you cringe whenever you recall it?
4g4v0nn8		1642800765.0	s9ljve	/r/AskReddit/comments/s9ljve/serious_what_is_the_biggest_problem_youll_see_in/	[Serious] what is the biggest problem you’ll see in the future of social media?
fsdpupg7		1642800779.0	s9lk35	/r/AskReddit/comments/s9lk35/what_is_an_appropriate_gift_for_a_male_to_give_a/	What is an appropriate gift for a male to give a female friend on Valentines Day if he has no feelings for her and just wants to be nice?
bfw1470w		1642800975.0	s9lmnb	/r/AskReddit/comments/s9lmnb/have_you_ever_been_in_true_love_and_how_did_it/	Have you ever been in true love and how did it first start?
fsdpupg7		1642801067.0	s9lnw6	/r/AskReddit/comments/s9lnw6/what_is_a_good_gift_for_a_male_to_give_his_best/	What is a good gift for a male to give his best friend that is a female on Valentines Day when he just wants to do something nice for her but does not have feelings for her?
cyzhc7pp		1642801171.0	s9lp89	/r/AskReddit/comments/s9lp89/what_is_the_most_wholesome_thing_you_like_to_do/	What is the most wholesome thing you like to do?
h249hyx3		1642801202.0	s9lpnt	/r/AskReddit/comments/s9lpnt/what_emoticons_can_you_make/	What emoticons can you make?
6gzbj4nq		1642801231.0	s9lq36	/r/AskReddit/comments/s9lq36/who_was_your_first_love_did_they_know_it/	Who was your first love? Did they know it?
h359i1mc		1642801245.0	s9lqb7	/r/AskReddit/comments/s9lqb7/what_are_some_annoying_habits_of_people_around/	What are some annoying habits of people around you have working in an office?
3l32qbt9		1642801259.0	s9lqhr	/r/AskReddit/comments/s9lqhr/what_are_sight_that_someone_is_laundering_money/	What are sight that someone is laundering money?
ajai2md5		1642801324.0	s9lrgu	/r/AskReddit/comments/s9lrgu/where_would_all_current_facebook_users_move_if/	Where would all current Facebook users move if Facebook was no longer an option?
aekjx484		1642801432.0	s9lsy5	/r/AskReddit/comments/s9lsy5/if_you_could_be_a_fly_on_the_wall_where_would_you/	If you could be a fly on the wall, where would you choose?
hgw5ueua		1642801459.0	s9ltb1	/r/AskReddit/comments/s9ltb1/whats_your_wildest_sexual_fantasy/	What’s your wildest sexual fantasy?
btul1adb		1642801468.0	s9ltfh	/r/AskReddit/comments/s9ltfh/redditors_with_dysfunctional_families_what_has/	Redditors with dysfunctional families, what has been your family “Arrested Development” moment(s)?
i8628w0s		1642801484.0	s9lto0	/r/AskReddit/comments/s9lto0/why_are_you_not_watching_the_olympics_this_year/	Why are you not watching the Olympics this year?
iv693jed		1642801501.0	s9ltvr	/r/AskReddit/comments/s9ltvr/what_type_of_person_did_the_rolling_backpack_kid/	What type of person did the rolling backpack kid become?
12rp4d		1642801520.0	s9lu5u	/r/AskReddit/comments/s9lu5u/which_is_the_most_disliked_country_in_the_world/	Which is the most disliked country in the world?
ivcwb4cz		1642801596.0	s9lv6t	/r/AskReddit/comments/s9lv6t/what_is_something_you_wish_you_could_unsee/	What is something you wish you could unsee?
qscxt1c		1642801636.0	s9lvox	/r/AskReddit/comments/s9lvox/what_was_a_time_you_sexed_so_hard_your_sex_organs/	What was a time you sexed so hard, your sex organs started forming sexual sexings that started to have sex themselves?
fxn4eevt		1642801674.0	s9lw6i	/r/AskReddit/comments/s9lw6i/which_book_would_you_recommend_for_someone_who/	Which book would you recommend for someone who hasn't read for pleasure in years?
3hagdlxl		1642801679.0	s9lw8v	/r/AskReddit/comments/s9lw8v/if_you_had_a_chance_to_know_the_exact_day_that/	If you had a chance to know the exact day that you die, without knowing how, would you want to know? Why or why not?
1lqz2tn3		1642801690.0	s9lwdz	/r/AskReddit/comments/s9lwdz/whats_your_highschool_survival_guide_tips_and/	What's your highschool "survival guide" tips and recommendations?
eq2cr5oz		1642801694.0	s9lwfv	/r/AskReddit/comments/s9lwfv/parents_of_young_adults_what_advice_do_you_have/	Parents of young adults, what advice do you have for the date your child brings home to meet you?
snlj7v6		1642801803.0	s9lxvl	/r/AskReddit/comments/s9lxvl/whats_something_no_one_should_ever_have_to/	What's something no one should ever have to experience?
9tjgqczt		1642801923.0	s9lzqe	/r/AskReddit/comments/s9lzqe/place_your_bets_place_your_bets_which_celebrity/	Place your bets! place your bets! Which celebrity dies next?
8bwivy6		1642801965.0	s9m0c9	/r/AskReddit/comments/s9m0c9/are_we_happy_as_a_human_race_please_elaborate_on/	Are we happy as a human race? Please elaborate on your views and explain why it's a strong nope?
dgtjtuy1		1642802018.0	s9m10o	/r/AskReddit/comments/s9m10o/reddit_what_is_the_most_nastiestgrossest_thing/	Reddit, what is the most nastiest/grossest thing that ever happened to you during sex?
tiw90		1642802130.0	s9m2e7	/r/AskReddit/comments/s9m2e7/meat_loaf_once_famously_sang_i_would_do_anything/	Meat Loaf once famously sang "I would do anything for love, but I won't do that" - What do you think THAT was?
ikwceply		1642802163.0	s9m2u1	/r/AskReddit/comments/s9m2u1/what_is_your_current_favorite_game/	What is your current favorite game ?
4g4v0nn8		1642802170.0	s9m2xk	/r/AskReddit/comments/s9m2xk/gamers_what_was_your_moment_with_a_stranger_on_a/	Gamers, what was your moment with a stranger on a game?
im7ylt3g		1642802195.0	s9m391	/r/AskReddit/comments/s9m391/what_are_you_running_from/	What are you running from ?
9tjgqczt		1642802221.0	s9m3kc	/r/AskReddit/comments/s9m3kc/what_piece_of_retro_tech_do_you_wish_was_still/	What piece of “retro” tech do you wish was still around?
p13r9		1642802230.0	s9m3oe	/r/AskReddit/comments/s9m3oe/how_do_deaf_people_call_emergency_services_when/	How do deaf people call emergency services when alone?
2adv3eh5		1642802436.0	s9m6jz	/r/AskReddit/comments/s9m6jz/what_secret_did_you_try_so_hard_to_keep_hidden/	What secret did you try so hard to keep hidden until it was forced out into the open?
xyizc		1642802520.0	s9m7to	/r/AskReddit/comments/s9m7to/how_do_you_build_trust_towards_others_again/	How do you build trust towards others again?
itmcqfto		1642802593.0	s9m8wc	/r/AskReddit/comments/s9m8wc/serious_whats_something_that_someone_did_or_said/	[serious] what’s something that someone did or said that created a huge insecurity to you?
8ldnyvq7		1642802733.0	s9maru	/r/AskReddit/comments/s9maru/if_you_could_choose_in_which_year_you_would_like/	if you could choose in which year you would like to be born, which year would it be? Why? And are you jealous of the people who will be born in the future?
52exzxxw		1642802735.0	s9mass	/r/AskReddit/comments/s9mass/what_is_your_worst_experience_in_a_public/	What is your worst experience in a public restroom or porta-potty?
51hn1ma6		1642802749.0	s9mazh	/r/AskReddit/comments/s9mazh/whats_an_underrated_movie_scene/	Whats an underrated movie scene?
ikgg6vrv		1642802798.0	s9mbmk	/r/AskReddit/comments/s9mbmk/whos_more_dangerous_a_man_with_nothing_to_lose_or/	Who's more dangerous, a man with nothing to lose or a man with everything to lose?
hlufpzui		1642802804.0	s9mbph	/r/AskReddit/comments/s9mbph/in_what_situation_is_it_ok_to_be_a_dick/	In what situation is it ok to be a dick?
h249hyx3		1642802807.0	s9mbrc	/r/AskReddit/comments/s9mbrc/whats_the_dumbest_rule_at_school_ever_reforced/	What's the dumbest rule at school ever reforced?
7encl8tl		1642802809.0	s9mbs5	/r/AskReddit/comments/s9mbs5/what_were_your_weirdest_beliefs_as_a_kid/	What were your weirdest beliefs as a kid?
hsdzl		1642802841.0	s9mc75	/r/AskReddit/comments/s9mc75/serious_how_did_you_beat_a_period_in_your_life/	[Serious] How did you beat a period in your life where the motivation to do excel and do the simple things just wasn't there and movement in general just felt like too much effort?
9tjgqczt		1642802860.0	s9mcg7	/r/AskReddit/comments/s9mcg7/what_is_something_you_did_regularly_pre_covid_but/	What is something you did regularly pre Covid but not anymore?
34vkiqz1		1642802882.0	s9mcra	/r/AskReddit/comments/s9mcra/whats_the_most_ridiculous_fact_you_know/	What’s the most ridiculous fact you know?
8ddp0r9c		1642802889.0	s9mcty	/r/AskReddit/comments/s9mcty/what_movie_would_be_a_thousand_times_better_if/	What movie would be a thousand times better if you changed the point of view?
gu5eh		1642802900.0	s9mczr	/r/AskReddit/comments/s9mczr/what_is_your_shouldve_been_arrested_story/	What is your should've been arrested story?
ihc3nxhd		1642802969.0	s9mdvz	/r/AskReddit/comments/s9mdvz/if_you_can_pick_whatever_job_you_want_what_would/	If you can pick whatever job you want, what would it be?
hsdzl		1642802991.0	s9me7t	/r/AskReddit/comments/s9me7t/serious_how_did_you_beat_a_period_in_your_life/	[Serious] How did you beat a period in your life where the motivation to excel or even just do the simple things required of you, when movement in general just felt like a herculean task?
de254hur		1642803019.0	s9memn	/r/AskReddit/comments/s9memn/what_observation_you_have_made_that_could_change/	What observation you have made that could change people’s life for better on small or large scales ?
6bdknjur		1642803027.0	s9meri	/r/AskReddit/comments/s9meri/bachelorsbachelorettes_of_reddit_why_are_you/	Bachelors/bachelorettes of Reddit, why are you still single??
fr49dv56		1642803096.0	s9mfsc	/r/AskReddit/comments/s9mfsc/whats_the_unintentionally_funniest_thing_youve/	What’s the unintentionally funniest thing you’ve ever heard a child say?
sv3ln		1642803099.0	s9mfts	/r/AskReddit/comments/s9mfts/the_president_of_anime_has_conquered_the_world/	The president of anime has conquered the world, how each country looks like now?
itmcqfto		1642803109.0	s9mfz3	/r/AskReddit/comments/s9mfz3/what_do_you_do_on_a_bad_day_to_make_yourself_feel/	What do you do on a bad day to make yourself feel better?
a0f0rfqf		1642803115.0	s9mg33	/r/AskReddit/comments/s9mg33/what_is_the_best_way_to_orgasm_as_a_solo_guy/	What is the best way to orgasm as a solo guy?
34vkiqz1		1642803128.0	s9mgak	/r/AskReddit/comments/s9mgak/in_40_years_what_will_people_be_nostalgic_for/	In 40 years, what will people be nostalgic for?
h249hyx3		1642803194.0	s9mh69	/r/AskReddit/comments/s9mh69/anyone_lost_your_temper_with_a_teacher_and_how/	Anyone lost your temper with a teacher? And how?
9ledu0c		1642803198.0	s9mh84	/r/AskReddit/comments/s9mh84/what_meme_will_you_never_get_tired_of_no_matter/	What meme will you never get tired of, no matter how many times you see it?
34vkiqz1		1642803241.0	s9mhtn	/r/AskReddit/comments/s9mhtn/what_used_to_be_considered_trashy_but_now_is/	What used to be considered trashy but now is classy?
348x2xof		1642803285.0	s9miem	/r/AskReddit/comments/s9miem/alaskans_over_reddit_where_is_the_best_place_to/	Alaskans over Reddit where is the best place to see the northern lights?
itmcqfto		1642803323.0	s9mixu	/r/AskReddit/comments/s9mixu/what_are_you_procrastinating_right_now/	What are you procrastinating right now?
e82b7nkr		1642803334.0	s9mj2b	/r/AskReddit/comments/s9mj2b/what_is_the_weirdest_thing_someone_asked_you_to/	What is the weirdest thing someone asked you to do for them?
i25s2q8k		1642803430.0	s9mkcf	/r/AskReddit/comments/s9mkcf/what_was_your_biggest_personal_win/	What was your biggest personal win?
d8nhum4j		1642803439.0	s9mkhv	/r/AskReddit/comments/s9mkhv/adult_people_who_play_computer_games_how_do/	Adult people who play computer games, how do acquaintances who know about your hobby treat you?
ifyza8ge		1642803658.0	s9mnh0	/r/AskReddit/comments/s9mnh0/do_you_think_debt_people_willingly_took_onstudent/	Do you think debt people willingly took on(student loans) should be forgiven why or why not?
2adv3eh5		1642803682.0	s9mnu6	/r/AskReddit/comments/s9mnu6/serious_whats_a_law_in_the_us_or_in_your_country/	[Serious] What’s a law in the U.S. or in your country that people should probably know about?
96aehpr		1642803695.0	s9mo0b	/r/AskReddit/comments/s9mo0b/if_you_got_to_keep_your_wisdom_teeth_after/	If you got to keep your wisdom teeth after getting them removed, what would you do with them?
hlufpzui		1642803714.0	s9mobh	/r/AskReddit/comments/s9mobh/what_made_you_realize_you_were_out_of_shape/	What made you realize you were out of shape?
gdgaj4jy		1642803716.0	s9moc6	/r/AskReddit/comments/s9moc6/what_if_samudri_chacha_becomes_bhoot_ka_pakoda/	What if samudri chacha becomes bhoot ka pakoda ?
gdgaj4jy		1642803886.0	s9mqkv	/r/AskReddit/comments/s9mqkv/what_website_is_a_trustworthycredible_source_of/	What website is a trustworthy/credible source of information on all academic disciplines ?
i21nnwv8		1642803891.0	s9mqn2	/r/AskReddit/comments/s9mqn2/ladies_how_attractive_is_it_if_he_smiles_big_like/	Ladies how attractive is it if he smiles big like 😄 while maintaining eye contact and using kinda a loud voice every time he talks to you?
im7ylt3g		1642803915.0	s9mqy8	/r/AskReddit/comments/s9mqy8/would_you_let_a_homeless_spend_the_night_with_you/	Would you let a homeless spend the night with you? Why or why not?
8ldnyvq7		1642803923.0	s9mr1k	/r/AskReddit/comments/s9mr1k/past_vs_future_if_you_could_choose_in_which_year/	past vs. future - if you could choose in which year you would like to be born, which year would it be? Why? And are you jealous of the people who will be born in the future or was born in the past?
4jnuhcmo		1642803940.0	s9mr8v	/r/AskReddit/comments/s9mr8v/what_is_the_best_song_title_for_a_nonexisting_song/	What is the best song title for a non-existing song?
9pcli6ne		1642804001.0	s9ms1c	/r/AskReddit/comments/s9ms1c/how_do_you_fix_a_heart_broken_from_a_friendship/	How do you fix a heart broken from a friendship?
fxd7liyw		1642804003.0	s9ms2g	/r/AskReddit/comments/s9ms2g/what_have_you_not_built_up_the_courage_to_tell/	What have you not built up the courage to tell someone yet?
gdgaj4jy		1642804018.0	s9ms97	/r/AskReddit/comments/s9ms97/without_saying_what_category_it_is_what_are_your/	Without saying what category it is, what are your top five ?
x6blu		1642804053.0	s9mspu	/r/AskReddit/comments/s9mspu/have_you_ever_been_lovebombed_by_an_abusive/	Have you ever been “love-bombed” by an abusive partner? What happened?
i25s2q8k		1642804058.0	s9msrk	/r/AskReddit/comments/s9msrk/whats_your_favorite_hairy_movie/	What’s your favorite hairy movie?
h5bbeql9		1642804071.0	s9msxi	/r/AskReddit/comments/s9msxi/whats_a_paranoid_opinion_or_thought_that_you_have/	What’s a paranoid opinion or thought that you have that could be true?
3mi66eps		1642804109.0	s9mtfr	/r/AskReddit/comments/s9mtfr/if_you_could_go_back_to_your_childhood_under_16/	If you could go back to your childhood (under 16) and relive one day, what happened on the day you would choose?
8l5dvy5z		1642804122.0	s9mtlj	/r/AskReddit/comments/s9mtlj/whats_the_most_disturbing_thing_youve_watched_or/	What’s the most disturbing thing you’ve watched or read lately?
ffsiakb2		1642804142.0	s9mtvk	/r/AskReddit/comments/s9mtvk/what_does_the_rabbit_say/	What does the rabbit say?
10l7qj		1642804345.0	s9mwzf	/r/AskReddit/comments/s9mwzf/what_is_the_worst_thing_someone_else_did_to_you/	What is the worst thing someone else did to you?
