author	selftext	created_at	s_id	permalink	title
i61fbuut		1642790471.0	s9ho49	/r/AskReddit/comments/s9ho49/if_you_would_given_a_chance_to_go_back_and_fix/	If you would given a chance to go back and fix your mistake or make a decision that would change your life!! What would it be ??
4tkcxdk2		1642790526.0	s9how6	/r/AskReddit/comments/s9how6/have_you_ever_tried_to_say_something_but_halfway/	Have you ever tried to say something, but halfway through your sentence, someone cut you off and started talking like they couldn't believe you would actually say something like that, but it only sounded bad because they didn't let you finish? What did you say?
ihc3nxhd		1642790548.0	s9hp6k	/r/AskReddit/comments/s9hp6k/what_is_your_favorite_diary_of_a_wimpy_kid_movie/	What is your favorite Diary of a Wimpy Kid movie?
brpjwud6		1642790548.0	s9hp6l	/r/AskReddit/comments/s9hp6l/what_are_some_major_red_flags_in_a_relationship/	What are some major red flags in a relationship ?
h8bdsdbe		1642790626.0	s9hq5s	/r/AskReddit/comments/s9hq5s/how_do_you_get_over_a_toxic_friend_group_without/	How do you get over a toxic friend group without having to think about their well being every time?
9b58nyz8		1642790710.0	s9hr54	/r/AskReddit/comments/s9hr54/what_are_you_doing_this_weekend/	What are you doing this weekend?
5fc6prsy		1642790731.0	s9hret	/r/AskReddit/comments/s9hret/whats_your_best_party_trick/	What’s your best party trick?
dbvkpokc		1642790819.0	s9hsj1	/r/AskReddit/comments/s9hsj1/what_would_you_pick_if_you_had_to_choose_between/	What would you pick if you had to choose between 1 billion dollars, but you can never have kids and staying the way you are?
brpjwud6		1642790833.0	s9hsqa	/r/AskReddit/comments/s9hsqa/whats_an_unusual_thing_that_creeps_the_fuck_out/	What's an unusual thing that creeps the fuck out of you ?
edpzdgb5		1642790836.0	s9hsrq	/r/AskReddit/comments/s9hsrq/parents_what_secret_does_your_child_think_you/	Parents, what secret does your child think you don’t know?
dsm46gs4		1642790850.0	s9hsxx	/r/AskReddit/comments/s9hsxx/what_is_america_the_land_of_why/	what is America the land of? why?
fqgva572		1642790913.0	s9htpf	/r/AskReddit/comments/s9htpf/whats_a_good_question_to_post_on_askreddit/	What's a good question to post on /AskReddit?
2puoycqz		1642790941.0	s9hu2k	/r/AskReddit/comments/s9hu2k/whos_currently_living_rent_free_in_your_head_and/	Who’s currently living rent free in your head and why?
h8bdsdbe		1642790626.0	s9hq5s	/r/AskReddit/comments/s9hq5s/how_do_you_get_over_a_toxic_friend_group_without/	How do you get over a toxic friend group without having to think about their well being every time?
9b58nyz8		1642790710.0	s9hr54	/r/AskReddit/comments/s9hr54/what_are_you_doing_this_weekend/	What are you doing this weekend?
5fc6prsy		1642790731.0	s9hret	/r/AskReddit/comments/s9hret/whats_your_best_party_trick/	What’s your best party trick?
dbvkpokc		1642790819.0	s9hsj1	/r/AskReddit/comments/s9hsj1/what_would_you_pick_if_you_had_to_choose_between/	What would you pick if you had to choose between 1 billion dollars, but you can never have kids and staying the way you are?
brpjwud6		1642790833.0	s9hsqa	/r/AskReddit/comments/s9hsqa/whats_an_unusual_thing_that_creeps_the_fuck_out/	What's an unusual thing that creeps the fuck out of you ?
edpzdgb5		1642790836.0	s9hsrq	/r/AskReddit/comments/s9hsrq/parents_what_secret_does_your_child_think_you/	Parents, what secret does your child think you don’t know?
dsm46gs4		1642790850.0	s9hsxx	/r/AskReddit/comments/s9hsxx/what_is_america_the_land_of_why/	what is America the land of? why?
fqgva572		1642790913.0	s9htpf	/r/AskReddit/comments/s9htpf/whats_a_good_question_to_post_on_askreddit/	What's a good question to post on /AskReddit?
2puoycqz		1642790941.0	s9hu2k	/r/AskReddit/comments/s9hu2k/whos_currently_living_rent_free_in_your_head_and/	Who’s currently living rent free in your head and why?
dbvkpokc		1642791004.0	s9huw6	/r/AskReddit/comments/s9huw6/what_would_you_pick_if_you_had_to_choose_between/	What would you pick if you had to choose between 1 billion dollars, but you can never have another orgasm and having your current finances and still able to get off?
e01r10au		1642791031.0	s9hvax	/r/AskReddit/comments/s9hvax/what_would_you_do_to_get_from_homeless_to_a/	What would you do to get from homeless to a millionaire?
ip3g23p9		1642791226.0	s9hxvz	/r/AskReddit/comments/s9hxvz/what_are_you_doing_this_weekend_and_what_do_you/	What are you doing this weekend and what do you wish you were doing? Why?
tehcl		1642791294.0	s9hytu	/r/AskReddit/comments/s9hytu/whats_your_most_satisfying_revenge_story_serious/	What’s your most satisfying revenge story? [serious]
hvmri9xy		1642791349.0	s9hzj6	/r/AskReddit/comments/s9hzj6/what_do_you_think_happens_when_you_die/	What do you think happens when you die?
ikwceply		1642791354.0	s9hzlg	/r/AskReddit/comments/s9hzlg/what_tv_family_would_you_most_want_to_be_in/	What tv family would you most want to be in?
74a7yyje		1642791460.0	s9i0zs	/r/AskReddit/comments/s9i0zs/to_the_bullys_of_reddit_what_was_the_funniest_way/	To the bully’s of Reddit, what was the funniest way you’ve bullied a kid?
itmcqfto		1642791474.0	s9i16x	/r/AskReddit/comments/s9i16x/party_people_whats_the_weirdest_thing_youve_seen/	Party people: What’s the weirdest thing you’ve seen a drunk person do?
fqgva572		1642791574.0	s9i2g7	/r/AskReddit/comments/s9i2g7/asking_for_a_friend_whats_a_good_price_for/	(Asking for a friend) What's a good price for prostitution?
4gurntz5		1642791606.0	s9i2w1	/r/AskReddit/comments/s9i2w1/you_are_being_teleported_to_a_zombie_apocalypse/	You are being teleported to a zombie apocalypse in a few minutes, which 3 items from the room you're currently in are you picking?
ipubvbti		1642791623.0	s9i3ac	/r/AskReddit/comments/s9i3ac/those_of_you_who_subscribe_to_lewd_onlyfans_pages/	Those of you who subscribe to lewd OnlyFans pages: do you like it when the content creator posts more personal things rather than just the lewd stuff?
806gxspm		1642791632.0	s9i3g2	/r/AskReddit/comments/s9i3g2/what_is_the_most_rarest_rewards_that_you_ever_see/	What is the most rarest rewards that you ever see on reddit?
gs720h5o		1642791690.0	s9i4ch	/r/AskReddit/comments/s9i4ch/are_us_and_china_enemies_or_rivals_what_about_us/	Are US and China enemies or rivals? What about US and former USSR?
7z8ym6jm		1642791690.0	s9i4cj	/r/AskReddit/comments/s9i4cj/if_harry_potter_were_cast_today_who_would_be_your/	If “Harry Potter” were cast today, who would be your choice of cast?
4ff66guu		1642791739.0	s9i523	/r/AskReddit/comments/s9i523/people_who_drive_24kph_in_a_48kph_zone_why/	People who drive 24kph in a 48kph zone, WHY?
2rhgniox		1642791837.0	s9i6ed	/r/AskReddit/comments/s9i6ed/how_do_you_deal_with_a_friend_that_copies_you/	How do you deal with a friend that copies you?
50izl1e		1642791854.0	s9i6m5	/r/AskReddit/comments/s9i6m5/what_are_some_lifestyle_things_that_people_think/	What are some lifestyle things that people THINK they hate, but only because they haven't tried it yet?
21nsap66		1642791939.0	s9i7os	/r/AskReddit/comments/s9i7os/bartenders_servers_who_have_worked_extremely/	Bartenders & servers who have worked extremely lavish events, what was it like?
8l5dvy5z		1642791996.0	s9i8f0	/r/AskReddit/comments/s9i8f0/what_problem_do_you_actually_like_having/	What problem do you actually like having?
e7wu69wo		1642792127.0	s9ia3l	/r/AskReddit/comments/s9ia3l/really_small_down_there_ask_whatever_and_will/	Really small down there - ask whatever and will answer honestly?
5jbtmma6		1642792169.0	s9ian7	/r/AskReddit/comments/s9ian7/for_those_who_work_at_starbucks_whens_the_best/	For those who work at Starbucks: when’s the best time to order a Frappuccino?
adthobr9		1642792181.0	s9iasy	/r/AskReddit/comments/s9iasy/what_is_something_you_love_appriciate_about_your/	What is something you love/ appriciate about your spouse?
z7h1h		1642792233.0	s9ibl1	/r/AskReddit/comments/s9ibl1/what_are_the_smelliest_shoes_youve_ever_owned/	What are the smelliest shoes you've ever owned?
ip3g23p9		1642792273.0	s9ic7d	/r/AskReddit/comments/s9ic7d/cleveland_is_riddled_with_potholes_and_our_local/	Cleveland is riddled with potholes and our local government is useless. What is your worst story about incompetent and/or corrupt politicians on a local level?
k05uj		1642792304.0	s9icog	/r/AskReddit/comments/s9icog/torture_the_data_and_it_will_confess_anything/	"Torture the data and it will confess anything". What are some real examples of this?
4dybk3uh		1642792316.0	s9icvc	/r/AskReddit/comments/s9icvc/how_do_you_break_out_of_the_cycle_of_having_so/	How do you break out of the cycle of having so much to do that you can't even bring yourself to start?
ip3g23p9		1642792338.0	s9id6u	/r/AskReddit/comments/s9id6u/you_win_free_plastic_surgery_to_fix_one_thing_on/	You win free plastic surgery to fix one thing on your body, what would it be and why?
itmcqfto		1642792399.0	s9ie2u	/r/AskReddit/comments/s9ie2u/what_is_dreamland_for_you/	What is dreamland for you?
ip3g23p9		1642792413.0	s9ie9k	/r/AskReddit/comments/s9ie9k/whats_the_greatest_thing_you_ever_bought_for/	What’s the greatest thing you ever bought for under $100? What’s so great about it?
rozvc		1642792421.0	s9iedr	/r/AskReddit/comments/s9iedr/what_movie_plot_twist_genuinely_shocked_you/	What movie plot twist genuinely shocked you?
ijsyq63s		1642792421.0	s9iedt	/r/AskReddit/comments/s9iedt/what_was_your_favorite_sort_of_candy_as_a_kid/	What was your favorite sort of candy as a kid?
ip3g23p9		1642792442.0	s9ienn	/r/AskReddit/comments/s9ienn/men_of_reddit_when_was_a_time_that_you_faced/	Men of Reddit, when was a time that you faced sexism?
ikwceply		1642792469.0	s9if0s	/r/AskReddit/comments/s9if0s/what_is_your_most_recent_music_discovery/	What is your most recent music discovery?
99cqbr8h		1642792507.0	s9ifj8	/r/AskReddit/comments/s9ifj8/how_much_food_goodnot_expired_are_you_going_to/	How much food (good/not expired) are you going to bin today and why?
dbvkpokc		1642792626.0	s9ih39	/r/AskReddit/comments/s9ih39/you_get_a_billion_dollars_but_you_can_never_have/	You get a billion dollars, but you can never have another orgasm. What would you choose?
cyzhc7pp		1642792723.0	s9iib3	/r/AskReddit/comments/s9iib3/what_is_a_fashion_trend_that_should_never_come/	What is a fashion trend that should never come back?
8gsi72sa		1642792743.0	s9iikl	/r/AskReddit/comments/s9iikl/what_is_a_promise_you_broke/	What Is A Promise You Broke?
2adv3eh5		1642792750.0	s9iinw	/r/AskReddit/comments/s9iinw/what_is_one_of_the_funniest_nicknames_youve_ever/	What is one of the funniest nicknames you’ve ever heard someone have?
h53cdi1c		1642792793.0	s9ij84	/r/AskReddit/comments/s9ij84/millennials_now_in_your_40s_or_late_30s_what_do/	Millennials now in your 40s or late 30s, what do you regret not doing earlier in life and why?
4p3tz78r		1642792841.0	s9ijy3	/r/AskReddit/comments/s9ijy3/what_do_you_find_to_be_most_a_annoying_change_in/	What do you find to be most a annoying change in your body as you age?
l1ufw		1642792892.0	s9ikr4	/r/AskReddit/comments/s9ikr4/which_celebrity_interview_for_better_or_worse/	Which celebrity interview (for better or worse) really made an impression on you?
itmcqfto		1642793038.0	s9imti	/r/AskReddit/comments/s9imti/whats_an_unrealistic_expectation_you_had_about/	What’s an unrealistic expectation you had about yourself?
57ng52ex		1642793125.0	s9inys	/r/AskReddit/comments/s9inys/whats_the_scariest_thing_youve_ever_seen/	What’s the scariest thing you’ve ever seen?
h53cdi1c		1642793160.0	s9ioe2	/r/AskReddit/comments/s9ioe2/what_movesshows_are_you_watching_this_weekend/	What moves/shows are you watching this weekend?
789x0g6t		1642793184.0	s9ioos	/r/AskReddit/comments/s9ioos/you_are_now_in_charge_of_making_the_next_squid/	You are now in charge of making the next Squid Game level. What are you making?
6zk96mpy		1642793270.0	s9ipts	/r/AskReddit/comments/s9ipts/which_attractive_fictional_character_do_you_not/	Which "Attractive" fictional character do you not find attractive at all?
2bpuhtfr		1642793328.0	s9iqko	/r/AskReddit/comments/s9iqko/what_is_your_opinion_of_the_communist_part_of/	What is your opinion of The Communist Part of China?
gdgaj4jy		1642793449.0	s9is70	/r/AskReddit/comments/s9is70/if_reddit_becomes_that_off_why_is_not_elections/	If reddit becomes that off why is not elections ?
34vkiqz1		1642793480.0	s9isn9	/r/AskReddit/comments/s9isn9/what_if_when_songs_were_stuck_in_your_head_they/	What if when songs were stuck in your head, they actually played out loud for everybody to hear?
gdgaj4jy		1642793575.0	s9iu3g	/r/AskReddit/comments/s9iu3g/where_can_we_watch_all_the_episodes_of_takeshis/	Where can we watch all the episodes of Takeshi's Castle ?
5zhhc7nu		1642793724.0	s9ivzc	/r/AskReddit/comments/s9ivzc/what_is_a_word_that_you_absolutely_hate/	What is a word that you absolutely hate?
2bpuhtfr		1642793740.0	s9iw6m	/r/AskReddit/comments/s9iw6m/what_is_your_opinion_of_the_communist_party_of/	What is your opinion of The Communist Party of China?
ip3g23p9		1642793874.0	s9ixxd	/r/AskReddit/comments/s9ixxd/south_park_is_better_than_the_simpsons_because/	South Park is better than The Simpsons because the quality has been better longer. Do you agree? Why or why not?
9pqvo8g7		1642793950.0	s9iyx7	/r/AskReddit/comments/s9iyx7/what_is_the_most_common_thing_that_everyone_so/	What is the most common thing that everyone so but insane to you?
ip3g23p9		1642794086.0	s9j0u6	/r/AskReddit/comments/s9j0u6/if_you_could_have_a_free_personal_chef_who_cooked/	If you could have a free personal chef (who cooked whatever whenever), full time housekeeper, personal trainer or professional “girlfriend” (your own personal sex worker); which would you choose and why?
71huo8x9		1642794147.0	s9j1qm	/r/AskReddit/comments/s9j1qm/how_did_you_learn_how_to_make_a_girl_cum/	How did you learn how to make a girl cum?
3dsjc8ar		1642794148.0	s9j1r3	/r/AskReddit/comments/s9j1r3/gamers_of_reddit_if_you_could_choose_one_video/	Gamers of reddit, if you could choose one video game to be remastered, which one would you choose and why?
dmu5lgf5		1642794232.0	s9j2u4	/r/AskReddit/comments/s9j2u4/which_show_would_have_been_as_a_movie/	Which show would have been as a movie?
55hsaddq		1642794257.0	s9j36d	/r/AskReddit/comments/s9j36d/if_you_could_have_a_robot_that_did_a_very/	if you could have a robot that did a very specific but menial task, what would it do?
4aeyaas8		1642794293.0	s9j3lt	/r/AskReddit/comments/s9j3lt/what_items_do_you_have_on_display_in_your_home/	What items do you have on display in your home that people automatically question?
itmcqfto		1642794317.0	s9j3wa	/r/AskReddit/comments/s9j3wa/whats_a_hobby_you_gave_up_and_why/	What’s a hobby you gave up and why?
vb9f76i		1642794372.0	s9j4lc	/r/AskReddit/comments/s9j4lc/what_was_your_worst_customer_service_experience/	What was your worst customer service experience?
iph6h0dg		1642794536.0	s9j6mo	/r/AskReddit/comments/s9j6mo/how_do_physically_attractive_people_experience/	How do physically attractive people experience the same feeling of rejection as unattrative people?
56moh9bg		1642794559.0	s9j6xw	/r/AskReddit/comments/s9j6xw/what_do_you_do_that_makes_you_seem_like_an_old/	What do you do that makes you seem like an old lady/old man?
geqlimfg		1642794877.0	s9jbda	/r/AskReddit/comments/s9jbda/whats_something_fun_and_useful/	What’s something fun and useful?
fv596vn2		1642794918.0	s9jbwq	/r/AskReddit/comments/s9jbwq/what_are_some_good_pvp_women_friendly_mobile_games/	What are some good PVP women friendly mobile games?
hj4qibnx		1642795030.0	s9jddj	/r/AskReddit/comments/s9jddj/former_cult_members_of_reddit_what_where_your/	Former cult members of reddit, what where your best and worse experiences while culting about?
i21nnwv8		1642795066.0	s9jdvl	/r/AskReddit/comments/s9jdvl/ladies_how_attractive_is_it_if_he_smiles_big_like/	Ladies how attractive is it if he smiles big like 😀 while maintaining eye contact the whole time every time he talks to you?
ip3g23p9		1642795157.0	s9jf14	/r/AskReddit/comments/s9jf14/movie_viewers_how_do_you_feel_about_inaudible/	Movie viewers, how do you feel about inaudible dialogue in your favorite movies or shows?
34vkiqz1		1642795163.0	s9jf42	/r/AskReddit/comments/s9jf42/if_you_were_head_of_product_development_at_a_fast/	If you were head of product development at a fast food chain, what food abomination would you create?
137vyd		1642795180.0	s9jfcn	/r/AskReddit/comments/s9jfcn/what_do_you_think_your_ancestors_were_doing_500/	What do you think your ancestors were doing 500 years ago?
iov6o		1642795212.0	s9jftq	/r/AskReddit/comments/s9jftq/whats_a_unique_and_niche_thing_about_your_city/	What's a unique and niche thing about your city, state or country which tourists would enjoy way more than what it's conventionally popular for?
i21nnwv8		1642795248.0	s9jgj5	/r/AskReddit/comments/s9jgj5/ladies_how_attractive_is_it_if_he_smiles_big_like/	Ladies how attractive is it if he smiles big like 😄 while maintaining eye contact the whole time every time he talks to you?
iv693jed		1642795431.0	s9jj4v	/r/AskReddit/comments/s9jj4v/what_skill_is_easiest_to_monetize/	What skill is easiest to monetize?
iov6o		1642795467.0	s9jjm3	/r/AskReddit/comments/s9jjm3/whats_the_underrated_thing_about_your_city_state/	What's the underrated thing about your city, state or country which tourists would enjoy way more than what's it conventionally popular for?
itmcqfto		1642795481.0	s9jjsh	/r/AskReddit/comments/s9jjsh/whos_the_most_annoying_cartoon_character/	Who’s the most annoying cartoon character?
dty3x0tf		1642795495.0	s9jjyk	/r/AskReddit/comments/s9jjyk/what_is_your_party_trick/	What is your party trick?
ffsiakb2		1642795637.0	s9jluo	/r/AskReddit/comments/s9jluo/what_are_the_consequences_of_brothels_being/	What are the consequences of brothels being legalized?
111yrq1u		1642795642.0	s9jlwp	/r/AskReddit/comments/s9jlwp/what_is_a_irl_scenario_when_you_got_laid_because/	What is a irl scenario when you got laid because of reddit?
11ttzp47		1642795711.0	s9jmtj	/r/AskReddit/comments/s9jmtj/what_words_go_through_your_headhow_do_you_express/	What words go through your head/how do you express it to yourself when it’s time to move your bowels?
69tlnd9c		1642795737.0	s9jn4q	/r/AskReddit/comments/s9jn4q/what_was_the_most_fun_you_have_had_in_a_lucid/	What was the most fun you have had in a lucid dream?
iszjc94l		1642795853.0	s9jorj	/r/AskReddit/comments/s9jorj/if_you_could_live_anywhere_in_the_world_where/	If you could live anywhere in the world where would it be?
e2uwqsz3		1642795857.0	s9jotx	/r/AskReddit/comments/s9jotx/what_is_the_best_thriller_tv_show_youve_ever/	What is the best thriller TV show you’ve ever watched?
49zyu66n		1642795878.0	s9jp5h	/r/AskReddit/comments/s9jp5h/what_moment_did_you_realize_these_people_should/	What moment did you realize “these people should not be parents?”
ip3g23p9		1642795887.0	s9jp9x	/r/AskReddit/comments/s9jp9x/what_is_a_recurring_annoyance_in_your_life_and/	What is a recurring annoyance in your life and what makes it so bad?
itmcqfto		1642795921.0	s9jprl	/r/AskReddit/comments/s9jprl/whats_a_movie_you_literally_felt_asleep_during_it/	What’s a movie you literally felt asleep during it?
ip3g23p9		1642795927.0	s9jpvm	/r/AskReddit/comments/s9jpvm/what_celebrity_couple_seemed_manufactured_to_you/	What celebrity couple seemed manufactured to you? Why?
c3ozshcn		1642795934.0	s9jpz1	/r/AskReddit/comments/s9jpz1/what_is_a_product_you_wish_existed/	What is a product you wish existed?
34vkiqz1		1642795966.0	s9jqgc	/r/AskReddit/comments/s9jqgc/if_extra_lives_were_a_thing_in_the_real_world_how/	If extra lives were a thing in the real world, how would you get them?
asd7rxzu		1642796013.0	s9jr2y	/r/AskReddit/comments/s9jr2y/for_what_mistake_would_you_punch_your_past_self/	For what mistake would you punch your past self in the face?
i21nnwv8		1642796062.0	s9jrqp	/r/AskReddit/comments/s9jrqp/ladies_how_attractive_is_it_if_he_smiles_big_like/	Ladies how attractive is it if he smiles big like 😄 while maintaining eye contact and using kinda a loud voice every time he talks to you?
ivcwb4cz		1642796090.0	s9js4b	/r/AskReddit/comments/s9js4b/what_havent_you_done_since_the_start_of_covid/	What haven’t you done since the start of covid?
ip3g23p9		1642796194.0	s9jtin	/r/AskReddit/comments/s9jtin/what_physically_attractive_celebrity_do_you_find/	What physically attractive celebrity do you find unappealing due to their personality and/or actions alone? Why?
14mrl1xx		1642796241.0	s9ju51	/r/AskReddit/comments/s9ju51/teachers_how_do_you_read_your_students_horrible/	Teachers, how do you read your students' horrible handwriting?
cyppq7kt		1642796251.0	s9ju9z	/r/AskReddit/comments/s9ju9z/if_you_were_to_never_existed_how_would_you_think/	If you were to never existed, how would you think it would affect everyone you know?
h5bbeql9		1642796257.0	s9jud1	/r/AskReddit/comments/s9jud1/who_are_some_of_the_most_powerful_families_as_of/	Who are some of the most powerful families as of right now?
ivcwb4cz		1642796350.0	s9jvjc	/r/AskReddit/comments/s9jvjc/where_is_your_first_love_now/	Where is your first love now?
5nthwmpd		1642796400.0	s9jw5j	/r/AskReddit/comments/s9jw5j/what_are_you_addicted_to_collecting/	What are you addicted to collecting?
8jbbtg5p		1642796414.0	s9jwer	/r/AskReddit/comments/s9jwer/what_is_the_most_romantic_thing_you_plan_on/	What is the most romantic thing you plan on doing/have done with your partner?
2s9img4c		1642796435.0	s9jwpl	/r/AskReddit/comments/s9jwpl/as_a_man_why_are_you_watching/	As a man why are you watching?
7encl8tl		1642796516.0	s9jxwf	/r/AskReddit/comments/s9jxwf/what_highly_anticipated_movie_left_you_feeling/	What highly anticipated movie left you feeling disappointed?
j5ivwpg		1642796536.0	s9jy7k	/r/AskReddit/comments/s9jy7k/what_are_some_reasons_a_normal_healthy_family/	What are some reasons a normal, healthy family wouldn’t want to go out to dinner together very often, if money isn’t an issue?
8lfd4fie		1642796568.0	s9jyp2	/r/AskReddit/comments/s9jyp2/what_hobby_do_you_most_enjoy_and_what_tips_would/	What hobby do you most enjoy and what tips would you give someone just starting out the same hobby?
gsm3n683		1642796600.0	s9jz2y	/r/AskReddit/comments/s9jz2y/what_are_the_most_shameless_sequelbaits_in_media/	What are the most shameless "Sequelbaits" in media?
h1xax23c		1642796661.0	s9jztd	/r/AskReddit/comments/s9jztd/whats_a_food_thats_common_now_but_used_to_be/	What’s a food that’s common now but used to be considered a delicacy?
14ddne		1642796677.0	s9k016	/r/AskReddit/comments/s9k016/chad_people_of_reddit_how_did_you_achieved_to_get/	Chad people of reddit, how did you achieved to get a girlfriend/boyfriend and have a relationship?
iuolugsn		1642796686.0	s9k05e	/r/AskReddit/comments/s9k05e/what_is_an_opinion_that_youve_never_changed_even/	What is an opinion that you've never changed even after a long time?
ip3g23p9		1642796831.0	s9k22w	/r/AskReddit/comments/s9k22w/what_is_the_most_egregious_or_unprofessional/	What is the most egregious or unprofessional thing you’ve ever seen someone get justifiably fired for?
ita0f0lm		1642796863.0	s9k2h9	/r/AskReddit/comments/s9k2h9/what_is_the_most_unintentionally_insulting_thing/	What is the most unintentionally insulting thing a child has ever told you?
ip3g23p9		1642796974.0	s9k3vl	/r/AskReddit/comments/s9k3vl/if_you_were_composing_a_poem_to_a_so_how_would/	If you were composing a poem to a SO, how would you finish “roses are red, violets are blue”?
4ohtpcph		1642796984.0	s9k40a	/r/AskReddit/comments/s9k40a/what_is_something_you_can_do_that_others_cant/	What is something you can do that others can’t?
iohbrs7r		1642797152.0	s9k6jl	/r/AskReddit/comments/s9k6jl/is_it_weird_to_get_turned_on_by_your_own_body_why/	Is it weird to get turned on by your own body? Why or why not?
im7ylt3g		1642797157.0	s9k6mk	/r/AskReddit/comments/s9k6mk/pornstars_of_reddit_what_advice_do_you_have_for/	Pornstars of Reddit, what advice do you have for someone starting out?
i1yj3bps		1642797276.0	s9k87e	/r/AskReddit/comments/s9k87e/what_movie_is_pure_testosterone/	What movie is pure testosterone?
adiwkngs		1642797374.0	s9k9jg	/r/AskReddit/comments/s9k9jg/whats_the_scariest_thing_youve_ever_witnessed/	What's the scariest thing you've ever witnessed?
6wb9xppg		1642797389.0	s9k9pw	/r/AskReddit/comments/s9k9pw/why_theres_habit_of_ours_when_we_have_to_cover/	Why there's habit of ours, when we have to cover the blanket under our feet with our feet?
ip3g23p9		1642797480.0	s9kaxc	/r/AskReddit/comments/s9kaxc/what_are_you_excited_about_right_now/	What are you excited about RIGHT NOW?
7lbcp5uk		1642797485.0	s9kazk	/r/AskReddit/comments/s9kazk/what_would_be_your_absolute_dream_scenario/	What would be your absolute dream scenario?
ifyza8ge		1642797520.0	s9kbgr	/r/AskReddit/comments/s9kbgr/if_it_was_legal_to_have_sex_with_animals_would/	If it was legal to have sex with animals, would you have sex with a democrat why or why not?
2mu1dhkf		1642797556.0	s9kbws	/r/AskReddit/comments/s9kbws/what_is_the_question_to_which_you_cannot_say_no/	What is the question to which you cannot say no?
ip3g23p9		1642797581.0	s9kc6w	/r/AskReddit/comments/s9kc6w/whats_your_biggest_annoyance_right_now/	What’s your biggest annoyance right now?
ip3g23p9		1642797622.0	s9kcsy	/r/AskReddit/comments/s9kcsy/what_is_the_best_thing_in_your_life_why/	What is the best thing in your life? Why?
im7ylt3g		1642797681.0	s9kdpc	/r/AskReddit/comments/s9kdpc/what_time_is_it/	What time is it?
ipkhtibe		1642797738.0	s9kele	/r/AskReddit/comments/s9kele/who_are_you_in_25_words_or_less_go/	Who are you? - in 25 words or less .. go?
7tomldoq		1642797956.0	s9khj8	/r/AskReddit/comments/s9khj8/what_would_you_not_do_for_a_billion_dollars/	What would you NOT do for a billion dollars?
