author	selftext	created_at	s_id	permalink	title
la93v		1643556388.0	sgbhxv	/r/france/comments/sgbhxv/vu_au_tréport/	Vu au Tréport
dxfalzfj		1643557032.0	sgbpnu	/r/france/comments/sgbpnu/a_la_présidentielle_nous_voterons_pour_la/	A la présidentielle, nous voterons pour la personnalité investie par la Primaire populaire
j3vhqq95		1643561678.0	sgdbr2	/r/france/comments/sgdbr2/souhaitons_tous_ensemble_une_joyeuse_campagne_à/	Souhaitons tous ensemble une joyeuse campagne à notre ami Emmanuel !
10u2d4		1643561875.0	sgde72	/r/france/comments/sgde72/reforme_du_lycée_des_chiffres_catastrophiques/	Reforme du lycée: des chiffres catastrophiques pour l’accès aux études scientifique pour les jeunes filles.
3hrckpll	Contexte: Ayant trop picolé hier soir, une copine s'est un lâchée quand on traînait entre potes. Son copain a un gros complexe lié à la taille de son pénis et elle est fatiguée de lui répéter que cela lui convient, que l'alchimie entre eux est plus important.  Du coup, je lui ai dit que j'entends souvent les filles dirent que la taille ne compte pas mais est-ce valable pour un penis à 1 cm lol (je sais j'exagère). Elle n'a pas pu me répondre, n'ayant pas donné de détails sur la taille exacte pour son copain.  Donc, on sort des chantiers battus cher sub: quelle taille est problématique peu importe les compétences du gars ou l'alchimie du couple ?	1643564332.0	sgeamt	/r/france/comments/sgeamt/a_partir_de_quelle_dimension_de_pénis_la_taille/	A partir de quelle dimension de pénis, "la taille ne compte pas" n'est plus valable ?
hl7soe2v	*Ps. Lui il est francais, mais pas moi. Je connais pas trop la culture francaise et le "dating", donc je vous demande à vous francais...*  Je bosse comme réceptionniste dans une auberge et y a un mec super beau qui y reste. Il est là jusqu'à juin. J'ai 20 ans et il a 23. Il est super beau mais super timide aussi. Y a 3 jours je lui ai demandé s'il voudrait sortir avec moi et il a dit oui. On etait censé sortir hier mais il avait pas trop ltemps au final donc on s'est juste pris une petite bière à l'auberge. Voici notre conversation juste avant qu'on s'etait vu hier. (moi c'est en gris à droite). **Ma question c'est es-ce qu'il a l'air d'être intéressé?** C'est juste qu'il est bcp bcp bcp plus beau que moi donc je me pose trop de questions en ft. Aussi, avant qu'on s'etait séparé hier pour rentrer chez soi il m'a dit qu'il allait me tenir au jus pour me dire qd il sera dispo pour sortir. **Donc est ce que j'attend à ce qu'il revienne vers moi ou c'est ok si je lui envoie un message?**     [https://ibb.co/CbQgNVx](https://ibb.co/CbQgNVx)	1643567131.0	sgfbhc	/r/france/comments/sgfbhc/les_mecs_francais_il_a_lair_de_me_kiffer_autant/	Les mecs francais: il a l'air de me kiffer autant que moi jle fait? Attendre à ce qu'il revienne vers moi, ou?
b1d1fajg		1643567649.0	sgfi8o	/r/france/comments/sgfi8o/christiane_taubira_vainqueur_de_la_primaire/	Christiane Taubira vainqueur de la primaire populaire #AFP
vzgtr	Bonjour,  J'envisage de passer en régime d'auto-entrepreneur et j'ai récemment appris que mon adresse serait publiquement accessible (publiée sur quelques sites du genre annuaire et registres de sociétés). Je peux demander à ce qu'elle ne soit pas publiée (en adressant un formulaire de l'INSEE aux impôts et sur mon compte Ameli, wtf au passage, pourquoi pas directement sur le site de l'URSSAF ?), mais elle restera quoi qu'il arrive accessible contre 3€ dans mon extrait KBIS.  Ça me semble complètement déraisonné et dangereux. J'accorde de la valeur à ma vie privée, je fais de l'OSINT à des fins récréatives et je suis sensibilisé sur la question. Je n'ai aucunement envie que mon adresse soit disponible pour quiconque connaîtrait mon nom et prénom.  Existe t-il une alternative qui me permettrait de garder ces informations sensibles privées ? Puis-je exercer mon droit relatif aux lois RGPD d'une quelconque manière ?  J'apprécierai vos retours d'expérience et conseils sur le sujet. Suis-je le seul étonné et mécontent de cette obligation légale ?	1643573629.0	sghr8u	/r/france/comments/sghr8u/protection_de_la_vie_privée_et_autoentreprise/	Protection de la vie privée et auto-entreprise
j6i29un2		1643576252.0	sgiqtq	/r/france/comments/sgiqtq/le_candidat_de_dernière_minute/	Le candidat de dernière minute.
1htl46n4	Bonjour à tous,  J’espère que vous vous portez bien.  Je commence un nouveau Job en tant qu’ingénieur d’affaires dans un cabinet de conseil (une ESN). Je précise que je suis un junior de 24 ans tout fraîchement double diplomé d’une école d’ingé et d’une école de commerce. (Un peu poubelle comme Master 2 je vous l’accorde)  Mes missions seront: -Prospecter et trouver de nouveaux besoins clients  -Recruter des consultants et les manager  -Gerer tout le cycle de vente jusqu’à à la contractualisation.  Pour préciser un peu mon parcours, je suis un profil a grosse dominante commercial avec une bonne connaissance des métiers de l’IT (Une vision globale de l’utilité de chaque métier et dans quel contexte il s’inscrit, mais sans jamais rentrer dans la technique)  Ayant eu vent des mauvaises réputations qu’ont les ESN dans le milieu informatique et soucieux de faire mon travail de là meilleur des manières, j’aurais souhaité posé plusieurs questions pour tous les potentiels clients/consultants ainsi que tout conseil qui pourrait m’être utile pour ne pas être le fameux « vendeur de viande »  Coté consultant:  -Qu’attendez vous d’un bon manager (Pas celui chez qui vous intervenez mais celui qui vous a embauché dans l’ESN)? (Qu’il prenne souvent de vos nouvelles?)   -Comment un manager peut il vous conseiller dans votre carrière en sachant qu’il ne connaît pas votre métier plus que ce qu’il voit sur les Job Board ou votre CV?   Je suis preneur de tout conseil à ce niveau là!   Coté client:   Est ce que l’ingénieur d’affaires doit il vraiment être très calé sur l’environnement technique de son consultant pour que vous soyez séduits?   Qu’est ce qu’il faut éviter de faire pour essayer d’établir des partenariats longue durée avec les entreprises (Cadeaux? Se déplacer régulièrement pour s’assurer que le consultant placé répondait bien aux attentes de la mission)   Je remercie toutes les personnes qui prendront le temps de me répondre, et vous souhaite bon courage pour cette nouvelle semaine !	1643576907.0	sgj0co	/r/france/comments/sgj0co/conseils_sur_le_métier_dingénieur_daffaires/	Conseils sur le métier d’ingénieur d’affaires
gu6jkpej	I am asking this question because (1) I personally live for risk and drama, and (2) I also like your country.	1643583101.0	sglbh3	/r/france/comments/sglbh3/in_your_opinion_how_easy_it_it_to_find_a_girl_in/	In your opinion, how easy it it to find a girl in your country that is passionate, insane, and will lovingly smash your car windows if she's upset about something small or suspects something?
dow3oaz6	Oh putain quel pied. Deux finales de conférences qui ont tenues toutes leurs promesses. Et les deux favoris, Kansas City et San Francisco sont tombés au champ d’honneur. Rendez-vous le 13 Février pour la finale autrement dit le Super Bowl qui verra Cincinnati affronter L’os Angeles Rams	1643597597.0	sgqcvf	/r/france/comments/sgqcvf/yes/	Yes
h73chy53	Bonjour  Si il y a un(e) psy sur le sub, j'aimerais avoir la réponse a une question.   Je me suis rendu compte récemment avoir tous les symptômes d'un choc post traumatique depuis plusieurs années.      J'ai du avoir un suivi psy quand j'étais ado pour d'autres soucis, la psy avait alors dit a ma mère que j'étais en état d'amnésie traumatique mais honnêtement j'en avais un peu (beaucoup) rien a faire tandis que ma mère s'est un peu torturé l'esprit. C'est vrai qu'a l'heure actuelle quand des personnes me racontent des souvenirs de mon enfance, je ne me souviens jamais.   Je repensais a ça récemment et je me suis demandé si ce n'était pas lié au fait que j'ai été très proche d'une personne extrêmement mythomane durant toute mon enfance et adolescence.    Je m'explique : elle m'a fait croire très tôt que nous étions traqués et qu'un homme nous voulait du mal, qu'il fallait le cacher a notre famille sinon on finirait tué et m'a fait de faux souvenirs induits en me racontait a plusieurs reprises des scènes qu'on auraient vécu, ce qui fait que mon esprit a fini par les créer. Elle m'a fait croire beaucoup de conneries sur des personnes de notre famille et des choses extrêmement graves. J'ai donc grandi avec le souvenir d'un homme qui m'aurait séquestré, essayer de me tuer et me demanderait de me taire sinon il tuerait mes parents et j'en passe.   J'ai réalisé l'ampleur de sa maladie mental a mes 18 ans donc je n'ai quasiment plus de contact avec elle (oui elle est toujours aussi ravagée du ciboulot), et réalisé avoir des faux souvenirs induits il y a quelque années. Je me demandais alors si l'état de choc post traumatique pouvait venir de là même si on prend conscience que tout est faux ?   (oui j'ai pas envie de payer une séance juste pour répondre a cette question que je me pose)	1643610722.0	sgui9x	/r/france/comments/sgui9x/choc_post_traumatique_estce_quil_y_a_un_psy_sur/	Choc post traumatique, est-ce qu'il y a un psy sur le sub?
i4uw55lc	I live and have lived in a country where sociopaths are not only tolerated but rewarded. Most of my managers at work have been serious sociopaths with frequent power trips and no social/technical skills apart from being able to big themselves up and inflict pain on their victims. Being incomptent, but ruthless is part and parcel of the fabric of the environment where I come from.  I know this a *question à mille balles* but I'd lile to know how the French speaking world handles sociopaths. Are they frown upon, tolerated, fostered or rewarded? Mercí.	1643619319.0	sgwqz2	/r/france/comments/sgwqz2/cultural_question_how_does_france_andor_la/	Cultural question: how does France (and/or la Francophonie in general) handle sociopaths?
au9eo	Pour faire rapide:   Je suis chez orange, le service est bon/correct MAIS:   * je n'utilise pas la partie télé   * je n'utilise pas de téléphone fixe * je n'ai aucun autre besoin que du débit (gros débit, on est 2 en télétravail) et un bon ping    Est-ce que vous auriez des recommandations pour un opérateur correct qui pourrait fournir juste ça?  * je suis déjà en fibre * je suis dans une grande métropole  Merci à vous	1643636598.0	sh1jna	/r/france/comments/sh1jna/quel_opérateur_internet/	Quel opérateur internet?
ohyff		1643637002.0	sh1oar	/r/france/comments/sh1oar/bruno_attal_on_en_a_marre_de_contrôler_des_pass/	Bruno Attal : « On en a marre de contrôler des pass alors que des mecs dealent et foutent la merde »
12rmzc		1643644221.0	sh4brn	/r/france/comments/sh4brn/audiovisuel_la_svod_précipite_la_concentration_en/	Audiovisuel : la SVOD précipite la concentration en Europe au profit des majors américaines
dow3oaz6	Lundi 31 Janvier 2022  Me désabonner de Spotify  Bosser comme un con pour un salaire de misère.   Dernier jour pour les vœux de la nouvelle année.   P.S  rectification, suis pas abonné à Spotify, une chose de moins à faire.	1643646917.0	sh5f8a	/r/france/comments/sh5f8a/emploi_du_temps/	Emploi du temps
113pqg	Quand on voit les sondages actuels la gauche a actuellement zéro chance d'être au second tour. J'ai du mal à comprendre par quelle pirouette les partis de gauche arrivent à se convaincre que c'est dans leur intérêt de faire cavalier seul. La seule raison que je trouve est une histoire d'honneur vis-à-vis d'un parti et une histoire d'égo. Sauf que faire primer l'honneur et l'égo les mènent clairement à leur perte et réduit à zéro les chances de pouvoir réellement apporter leurs idées. Alors je me demande si cette histoire d'union est intimement liée à une question de genre.	1643647636.0	sh5pto	/r/france/comments/sh5pto/question_sérieuse_pensezvous_que_si_des_femmes/	Question sérieuse, pensez-vous que si des femmes étaient à la tête des partis de gauche, la gauche réussirait à s'unir ?
h0hzt		1643648782.0	sh67m6	/r/france/comments/sh67m6/pdcast_crise_ukrainienne_les_étatsunis_en_fontils/	Pdcast : Crise ukrainienne: les États-Unis en font-ils trop?
j7uc6ouf	Comment se faire entendre ?   Voici mon histoire : depuis Novembre 2021, j'essaie par tout les moyens de porter plainte contre des pirate informatique qui depuis se font un malin plaisir à me harceler.   D'abord victime potentielle d'un stalking,  qui a permis au dite personne de me suivre de savoir mes habitudes ( lieu de résidence, fréquentations, habitudes, familles, amis etc...  Un stalking qui a eut lieu bien avant le mois de novembre bien sur !   Voilà que je me fais donc pirater avec le fameux " est ce que c'est toi dans video ? " et un lien bien que trop chelou, conne que je suis et n'ayant jamais eu affaires à une tel situation, j'ai donc cliqué sur le lien, le dit lien a affiché mais genre 2 trois seconde une " fausse page Tiktok " dans laquelle rien ne m'avait été demandé.   Comme si le piratage de mes réseaux sociaux ( IG - SNAPCHAT - FB ) ne suffisait pas ! Il ont aussi tenté de piraté mes comptes administratifs ( CPAM BANQUE CAF ...).   Depuis j'ai récupéré mon compte IG qui ne sert strictement à rien car je ne suis pas sur les réseaux pour la FAME, mais comment dire que : le choc de savoir qu'ils avaient utilisé mon compte GMAIL pour envoyer des mails frauduleux à mon proprio m'a laissé comme un froid dans le dos !   Les évènements qui suivents sont encore plus troublant :   Faux comptes snapchat profesionel , usurpation d'identité, utilisation de ma carte vitale bref tellement de choses ouf qui ajout aux possible viol groupé, infraction à mon domicile font que trop c'est trop.   &#x200B;  Du jour au lendemain des personnes qui me regardaient alors que je ne l'ai connaissaient pas, des personnes qui porte des vetements ou chaussures qui font pensé à moi alors qu'on ne se ressemblent pas !   Mais tout cela dans qu'elle but ?   Rappellez-vous que j'ai porté plainte et ceux a de multiples reprise, plaintes qui jusqu'à présent n'ont servit à rien,   récement après avoir discuté avec des personnes plutôt callé en informatique, j'ai appris qu'un doublon de ma carte SIM et une copie de mon téléphone avait été fait et ceux sans que je m'en rends compte...   &#x200B;  Tellement de choses qui font que je porte plainte, j'en parle doucement mais surement et avec aisance, et tout cela pourquoi ?   &#x200B;  Pour qu'au final dès qu'ils apprennent que je suis plus que motivé a porté plainte de nouveaux, ils plongent mon téléphone dans l'eau durant la nuit.   &#x200B;  Hé oui ils ont plongé mon téléphone dans l'eau pour couvrir les faits et leurs délits et cela je l'ai appris aujourd'hui quand à ma grande surprise l'informaticien à coter de chez moi ma dit : " votre téléphone et pleins d'eau " et que qu'il ma sortit les photos des faits !   &#x200B;  Rale cul de couvrir des connards et rale le cul que la police me disent tout le temps connaissait vous l'identité du gas responsable...comme si le coupable n'est personne d'autre que celle que moi je tend à vouloir croire !   Donc bon on verra bien mais il fallait que je déverse mes nerfs autrement qu'en parole car je ne veux plus rien n'avoir à dire à des hypocrites qui aiment me voir souffrir et galerer chaque jours et que tout le monde me dise la même chose mais que betement je n'ecoute pas !   &#x200B;  Maintenant il temps de payer pour ce que vous ou tu a fais , il est temps que je dise ce qui s'est passé !	1643655344.0	sh8xh2	/r/france/comments/sh8xh2/urgence_dans_le_93/	URGENCE DANS LE 93 !
60syamgb		1643665379.0	shd47w	/r/france/comments/shd47w/il_reste_plus_de_9000_espèces_darbres_à_découvrir/	Il reste plus de 9000 espèces d'arbres à découvrir
60syamgb		1643667207.0	shdvq6	/r/france/comments/shdvq6/des_tardigrades_en_pays_quantique/	Des tardigrades en pays quantique ?
ga5eiwq8	J'écris ça en live, un mec viens de garer sa voiture dans le centre de la route, il ouvre les portes, et il joue du rap algérien (je connais le chanson, je suis algérien) à 5000 décibels avec ses potes.  J'ai besoin d'aide, j'arrive pas à dormir, faut-il que j'appelle la police ?	1643671088.0	shfgod	/r/france/comments/shfgod/les_gens_qui_jouent_de_la_music_à_haute_voix/	Les gens qui jouent de la music à haute voix pendant la nuit, why ?
7bh9hj0i	Attention c'est un peu dégueulasse.  Je dormais paisiblement il y a encore 25 minutes. Et j'ai été soudain réveillé par un étouffement, comme si j'avais essayé d'avaler trop de salive d'un coup. Ce qui est bizarre (et degueu), c'est que j'ai laissé comme un gros crachat sur mon oreiller...   J'ai tendance à dormir la bouche ouverte la nuit, mais la ça ressemblait à une espèce de remontée acide, bien que je n'ai eu aucune sensation de ça (pas de douleur dans la gorge, etc).   Je précise que j'avais quand même des douleurs abdominales depuis dimanche. Mais pas la sensation d'être malade, pas même de nausée (un peu hier soir avant manger mais vite passé).   Quelqu'un a déjà eu ça ? Une idée de ce que j'ai eu ?	1643679605.0	shijc7	/r/france/comments/shijc7/santé_remontée_acide_gastro/	[Santé] Remontée acide ? Gastro ?
f3n27	R/françaises, r/français,   Vous les attendiez tous, les voici! Les résultats du bestof 2021 sont là !    # Les lauréats  * [**Meilleur poteau**](https://www.reddit.com/r/france/comments/rr0laf/le_meilleur_de_rfrance_2021/hqdm111/)     * [En ce joyeux matin, thread en alexandrins](https://www.reddit.com/r/france/comments/qpzsax/en_ce_joyeux_matin_thread_en_alexandrins/) par /u/manubfr * [**Meilleur AMA**](https://www.reddit.com/r/france/comments/rr0laf/le_meilleur_de_rfrance_2021/hqdm1d9/)     * [Je suis chasseur de guêpes et de frelons. AMA](https://www.reddit.com/r/france/comments/nho3if/je_suis_chasseur_de_gu%C3%AApes_et_de_frelons_ama/)  par u/beberekt * [**Meilleur Askfrance**](https://www.reddit.com/r/france/comments/rr0laf/le_meilleur_de_rfrance_2021/hqdm47j/)     * [Français, Française, il est temps de débattre sur une vrai question de société : Quel sont les meilleur gâteaux industrielle de France ? Ici, le résultat de 3h d'un intense débat (hommes 21-26 ans). Qu'en pensez-vous ?](https://www.reddit.com/r/france/comments/p82q1i/fran%C3%A7ais_fran%C3%A7aise_il_est_temps_de_d%C3%A9battre_sur/?utm_source=reddit&utm_medium=usertext&utm_name=france&utm_content=t1_hqdzxg5) par u/Novelastre * [**Meilleur article de fond**](https://www.reddit.com/r/france/comments/rr0laf/le_meilleur_de_rfrance_2021/hqdm4n6/)     * [Immigrations](https://www.reddit.com/r/france/comments/q5qhh3/immigrations_14_leurope_et_leldorado/) par u/SowetoNecklace * [**Meilleure série**](https://www.reddit.com/r/france/comments/rr0laf/le_meilleur_de_rfrance_2021/hqdm4z4/)     * [Les posts](https://www.reddit.com/r/france/comments/nqefuh/le_conflit_isra%C3%A9lopalestinien_1_le_sionisme_en/) de u/SowetoNecklace * [**Meilleur Contenu Original**](https://www.reddit.com/r/france/comments/rr0laf/le_meilleur_de_rfrance_2021/hqdm5f2/)     * [Longue vie à la R(épublique)/Francaise !](https://www.reddit.com/r/france/comments/npnuuk/longue_vie_%C3%A0_la_r%C3%A9publiquefrancaise/) par /u/[deleted] * [**Meilleur mème**](https://www.reddit.com/r/france/comments/rr0laf/le_meilleur_de_rfrance_2021/hqdm60t/)     * [/r/France dans une coquille de noix](https://www.reddit.com/r/france/comments/lywefv/rfrance_dans_une_coquille_de_noix/) de u/Gaecco * [**Meilleur poteau hebdo**](https://www.reddit.com/r/france/comments/rr0laf/le_meilleur_de_rfrance_2021/hqdm6fu/)     * [Le Mercredi Tech](https://www.reddit.com/r/france/comments/s200r5/mercredi_tech_20220112/) de u/ChuckMauriceFacts * [**Meilleur poteau méta**](https://www.reddit.com/r/france/comments/rr0laf/le_meilleur_de_rfrance_2021/hqdm77a/)     * [J'ai la chance d'habiter dans en Région Centre-Val-de-Loire, voici quelques trucs que j'ai remarqué par rapport à la France](https://old.reddit.com/r/france/comments/mqnvgj/jai_la_chance_dhabiter_dans_en_r%C3%A9gion/) par u/Amiral_Poitou * [**Meilleur commentaire non humoristique**](https://www.reddit.com/r/france/comments/rr0laf/le_meilleur_de_rfrance_2021/hqdm7m2/)     * Prix annulé faute de lauréat valable  ¯\\\_(ツ)_/¯ * [**Meilleur commentaire humoristique**](https://www.reddit.com/r/france/comments/rr0laf/le_meilleur_de_rfrance_2021/hqdm7xb/)     * [La tribu de MAGA](https://www.reddit.com/r/france/comments/krw97n/pendant_ce_temps_au_capitole/gicvk2l/) de u/Pandinoo * [**Meilleure histoire d'amour**](https://www.reddit.com/r/france/comments/rr0laf/le_meilleur_de_rfrance_2021/hqdm9wt/)     * [Retrouver la fille du train Rennes-Paris-Lyon](https://www.reddit.com/r/france/comments/oxyd6v/retrouver_la_fille_du_train_rennesparislyon/) de u/Axtyz * [**Meilleure rant**](https://www.reddit.com/r/france/comments/rr0laf/le_meilleur_de_rfrance_2021/hqdma80/)     * [Rant sur le foot - Droit de réponse](https://www.reddit.com/r/france/comments/n61x7x/rant_sur_le_foot_droit_de_r%C3%A9ponse/) de u/taclealacarotide * [**Meilleur utilisateur**](https://www.reddit.com/r/france/comments/rr0laf/le_meilleur_de_rfrance_2021/hqdmam7/)     * u/a-lot-of-sodium pour être la meilleure utilisatrice à ne pas être francophone native. * [**Meilleur sous francophone**](https://www.reddit.com/r/france/comments/rr0laf/le_meilleur_de_rfrance_2021/hqdmayg/)     * r/FranceDetendue * [**Meilleure controverse**](https://www.reddit.com/r/france/comments/rr0laf/le_meilleur_de_rfrance_2021/hqdmbbk/)     * Le ban de notre flic attitré * [**Figure libre**](https://www.reddit.com/r/france/comments/rr0laf/le_meilleur_de_rfrance_2021/hqdmc5r/)     * [Branlette bourléenne: mes amis se foutent de moi](https://old.reddit.com/r/france/comments/qxvg91/branlette_bourl%C3%A9enne_mes_amis_se_foutent_de_moi/) de u/OneShotNoobies  Les gagnants recevront chacun une récompense INCROYABLE en l'award que je viens de créer à l'arrache ce matin: un BalkaCoin! Le Balkacoin est une stablecoin (aucune idée de ce que je raconte lol) qui vaut un platinum!   Félicitations à tous nos vainqueurs et merci à tous pour vos propositions et votes !	1643698476.0	shom6m	/r/france/comments/shom6m/le_meilleur_de_rfrance_2021_les_résultats/	Le meilleur de r/france 2021: les résultats !
j5yachaz	Bjour,   Quelques questions :  - Dans quelle mesure la technique redditienne du ranking conditionne votre expression ? Merci de ne pas répondre en système impérial.   - Avez-vous eu l'impression que la question précédente vous imposer une problématique à laquelle vous vous en foutez complètement ?   - Considérez-vous ce système de classement de  comme démocratique ou au contraire ?   - Par ailleurs, ne pensez-vous pas que la démocratie est un idéal platonicien surestimé ne pouvant que se traduire concrètement que par l'avènement du communisme ?   - A partir de quel nombre de haut-votes sur un poste votre satisfaction est-elle au taquet sa mère ?   - Inversement, avez-vous déjà effacé un poste suite au seum absolu suite à de nombreux bas-vote ?   - Une histoire drôle à proposer pour démarrer cette nouvelle journée qui va être chiante comme les autres ?   Merci pour votre participation.	1643695646.0	shntu4	/r/france/comments/shntu4/ranking_et_dopamine_baise_ouais/	Ranking et dopamine, baise ouais.
crtr6ygy	Il y a un ou deux mois de cela, mon épouse devait payer 21 euros de douane sur un colis. Elle n'avait que 25 euros et demanda au facteur s'il avait la monnaie. Il répondit que non et ajouta qu'il n'était pas interdit de lui donner un pourboire. Elle vient d'un pays où ce genre de chose est perçue comme de la corruption et, sans refuser ouvertement, rentra pour trouver l'appoint.  Depuis lors, quand nous ne sommes pas à la maison et que le facteur (celui qui livre les colis) met un avis de passage dans la boîte aux lettres, nous ne parvenons jamais à reprogrammer une livraison sur le site de la poste, même si nous nous y prenons le jour même (puisqu'on a jusqu'à minuit pour le faire). Par ailleurs, les colis sont déposés dans un centre de tri éloigné alors qu'avant ils l'étaient au bureau de poste proche.  D'où ma question : est-il possible pour un facteur d'empêcher la reprogrammation d'une livraison ? Et de choisir lui-même l'endroit où les colis sont déposés ?  Merci	1643696745.0	sho53g	/r/france/comments/sho53g/notre_facteur_nous_en_veutil/	Notre facteur nous en veut-il ?
j23hsbk1	Hello :)  Est ce que certain d'entre vous bossent en remote pour des boites étrangères?  ça se passe comment?  est ce que vous êtes beaucoup mieux payés?  Est ce que c'est beaucoup plus dur de se faire recruter?beaucoup plus d'exigences?  est ce qu'on attends un anglais parfait? je suis vraiment pas mauvais, mais ça se voit que je suis bien français quand même, je doute, à quel moment vous vous êtes senti prêts?  merci :)	1643700533.0	shp648	/r/france/comments/shp648/des_développeurs_basés_en_france_qui_bossent_en/	Des développeurs basés en France qui bossent en remote pour des boites étrangères?
25qvf5gr		1643704367.0	shq53a	/r/france/comments/shq53a/hachette_rachette_bragelonne/	Hachette rachette Bragelonne
