author	selftext	created_at	s_id	permalink	title
ed61o0av	Hello,  Pour éviter l'effet de meute, j'ai demandé à mon syndic que le vote se fasse par bulletin nominatif plutôt qu'à main levée.  Le syndic me répond que ce n'est pas possible car seul le vote à main levée serait légal.  Or je vois ce lien qui semble indiquer le contraire : [https://www.inc-conso.fr/content/copropriete-les-majorites-de-vote-lors-dune-assemblee-generale](https://www.inc-conso.fr/content/copropriete-les-majorites-de-vote-lors-dune-assemblee-generale)  Avez-vous plus d'info à ce sujet ? Devrais-je demande au syndic sur quel texte de loi ils se basent pour affirmer que ce n'est pas légal ?  Merci.	1643709356.0	shrbsq	/r/france/comments/shrbsq/copro_le_syndic_me_dit_quil_nest_pas_légal_de/	[copro] le syndic me dit qu'il n'est pas légal de procéder à des votes autres que main levée
42d8rz3	Salut , si vous avez un compte nyaa.si que vous n'utilisez pas je le rachète. 50e + 20e si l'adresse  email est changeable à la mienne. Me mp si intéressé.	1643711982.0	shs0eb	/r/france/comments/shs0eb/compte_nyaasi/	Compte nyaa.si
133x2r		1643717286.0	shth0z	/r/france/comments/shth0z/pauvre_france_chaîne_tv_suisse_rts/	Pauvre France [Chaîne TV Suisse RTS]
37mw9wjh		1643721159.0	shun27	/r/france/comments/shun27/raoult_sur_le_fanatisme_de_certaines_personnes_de/	Raoult sur le fanatisme de certaines personnes de nos jours au nom de la science
4ondht4x	Mes parents voyagent d'Annecy à Arles et cherchent un endroit agréable pour s'arrêter en cours de route. Peut-être près de Montélimar. Des suggestions de villes sympas pour la journée ?	1643722908.0	shv7rt	/r/france/comments/shv7rt/recommandation_touristique/	Recommandation touristique
fukwd6ld		1643725161.0	shw1pp	/r/france/comments/shw1pp/selon_une_étude_britannique_les_habitacles_des/	Selon une étude britannique, les habitacles des voitures sont encore plus sales que des cuvettes de toilettes
fezgy		1643726489.0	shwjho	/r/france/comments/shwjho/une_bugatti_chiron_à_417_kmh_la_folie_dun/	Une Bugatti Chiron à 417 km/h : la folie d'un millionnaire sur une autoroute en Allemagne
crewqkz4		1643726533.0	shwk3a	/r/france/comments/shwk3a/les_études_sont_daccord_les_risques_de/	Les études sont d'accord : Les risques de circoncision l'emportent sur les avantages. Il est temps de repenser notre approche permissive de la section génitale religieuse.
m0fdq	Je viens de concrétiser une fin de relation "plan cul" avec une amie qui m'attirait beaucoup. Mais je pense que j'ai tout gâché parce que je ne sais pas comment ce genre de relations fonctionnent.  J'ai l'impression que plus je temoignais de l'intérêt et moins elle avait envie de me voir. Du style "tu fais quoi ce soir ?" "non pas ce soir, je suis pas dispo" Et ça plusieurs fois. Au final je sais ce qui a tout gâché c'est que j'étais trop attentionné et demandeur mais comment sommes nous censé consommer ce genre de relation si aucun des deux ne fait un pas vers l'autre ?  Plus j'y repense et plus je me dis que si j'avais voulu que ça marche, j'aurais jamais dû venir vers elle, ne jamais aller lui parler même et juste attendre que ce soit elle qui vienne vers moi ?  Aujourd'hui je ne regrette rien, car c'est toujours mon amie et elle a une place importante dans ma vie, je regrette juste de ne pas avoir compris comment agir pour entretenir cette amitié +  Comment vous faites vous ?	1643726535.0	shwk5a	/r/france/comments/shwk5a/vous_qui_avez_un_ou_plusieurs_plan_culs_comment/	Vous qui avez un (ou plusieurs) plan cul(s), comment ça marche ?
6fdk7m5w		1643728444.0	shxanp	/r/france/comments/shxanp/la_principauté_de_monaco_renforce_son_arsenal/	La Principauté de Monaco renforce son arsenal législatif en matière de prévention et de lutte contre la criminalité financière
8kstj7s0	Je me demande simplement s'il existe des études socio là-dessus: statut, profession (ou non-profession), origines ethniques, convictions, âge, sexe etc etc... ça existe?	1643730509.0	shy23w	/r/france/comments/shy23w/quel_est_le_profil_des_votants_lfi_globalement/	Quel est le profil des votants LFI globalement?
hcv1kp6h	 I'm moving to France in a few months, so I thought it'd be great to make some new friends before I move there. I'm into reading, watching movies/shows, tennis, skateboarding, psychology, animals, and philosophy. Feel free to hmu if you wanna be friends :) I'm 21 btw.	1643733196.0	shz42q	/r/france/comments/shz42q/looking_for_french_friends/	Looking for French friends
aq28ejuv		1643733461.0	shz7st	/r/france/comments/shz7st/puisquon_ne_parle_parle_que_des_sangliers_depuis/	Puisqu’on ne parle parle que des sangliers depuis ce matin ….
8rgucuyv		1643734763.0	shzpnr	/r/france/comments/shzpnr/la_vérité_sur_haddock/	La vérité sur Haddock
8rgucuyv		1643734883.0	shzry0	/r/france/comments/shzry0/la_vérité_sur_haddock/	La vérité sur Haddock
j6e13emm		1643737250.0	si0qd0	/r/france/comments/si0qd0/les_batailles_de_napoléon/	Les batailles de Napoléon
4znks		1643739182.0	si1hmw	/r/france/comments/si1hmw/la_coopérative_laitière_sodiaal_va_fermer_deux/	La coopérative laitière Sodiaal va fermer deux usines en France
isujhoco	Je réagis par rapport à l'autre post. J'aimerais offrir le point de vue d'un catholique.   **- Le catholique doit faire le ménage dans sa communauté.**   Oui, en effet, d'ailleurs l'Eglise Catholique a lancé plusieurs commissions d'enquêtes, a fait plusieurs réformes et continue à activement adresser le problème de la pédophilie. Il faut continuer jusqu'à arriver à zéro abus et coopérer avec les autorités.    **- Le catholique doit condamner la pédophilie**   Oui, les blagues sont lourdes, oui les allusions sont lourdes. Mais ce n'est pas comme si j'allais m'offenser alors que ces des crimes sont affreux et qu'il faut les condamner avec la plus grande fermeté. Par ailleurs vue l'ampleur des abus, j'ai moi-même honte. Du coup quand on me fait une remarque ou une blague, je réponds généralement, non pas en minimisant, mais en acquiesçant.    **- Les catholiques doivent cesser de se victimiser**   En France il y a un courant laïc dur toujours bien vivant, les Catholiques sont faciles à critiquer car on peut les attaquer sans passer pour un raciste ou un xénophobe. Oui, les féministes, les artistes attaquent ou critiquent bien plus facilement le christianisme que les autres religions. Néanmoins la liberté d'expression s'appliquent à tout le monde et tout le monde a le droit de critiquer les religions et puis après tout si nous voulons que les critiques cessent alors à nous d'être exemplaires.    **- Les catholiques doivent respecter la loi.**   Oui, comme tout le monde. Le secret de la confession est un secret professionnel reconnu par la loi mais pas au-dessus de la loi. La loi c'est la loi. Il faut rendre à César ce qui appartient à César, sinon pas de vivre ensemble possible.    **- La religion c'est personnel.**   On peut se retrouver entre catholiques le dimanche à la messe ou prier en famille et comprendre qu'au travail ou à l'école la religion n'a pas sa place.   **- Embrasser les valeurs de la république.**   Je ne suis pas d'accord avec tout, par exemple quand un maire enlève un sapin de Noël pour cause d'écologie ou qu'une procession traditionnelle est interdite, mais c'est à moi de convaincre mes concitoyens (ou d'utiliser un recours judiciaire en cas d'abus) pas de leur imposer par le rapport de force.   **- Le catholique doit réformer sa religion.**   La grande réforme avec le concile de Vatican 2 a permis de moderniser l'Eglise tout en gardant les mêmes textes, les mêmes institutions, les mêmes dogmes. Le curé n'est plus en soutane, les femmes ne portent plus la mantille, la messe n'est plus en latin, etc... ce n'était pas une réforme parfaite, donc il faudra en faire d'autre, je suis content d'avoir un Pape qui fait évoluer les choses.   **- Le catholique doit prendre l'initiative de créer des évènements culturels, d'inviter les gens etc.**   Quand le Pape lave les pieds de migrants Musulmans, il montre que tous les humains doivent être traités avec respect et sont sur un pied d'égalité. Quand l'Eglise crée des associations qui aident tous les pauvres et pas seulement les Catholiques, elle respecte le message de Jésus (parabole de la Samaritaine par exemple).	1643741009.0	si27cd	/r/france/comments/si27cd/ce_que_lon_attend_des_catholiques/	Ce que l'on attend des Catholiques
gsudn		1643741557.0	si2f02	/r/france/comments/si2f02/aidez_sil_vous_plaît_à_une_apprenante_de_votre/	Aidez, s'il vous plaît, à une apprenante de votre belle langue ! 🙏 Répondez à cette enquête académique ! Merci mille fois !
a553uqes		1643741573.0	si2f86	/r/france/comments/si2f86/get_franced/	Get Franced
1r045jxy		1643743805.0	si3bej	/r/france/comments/si3bej/toi_aussi_devient_influenceur_tiktok_pour/	Toi aussi devient influenceur TikTok pour seulement 29,90€ dans ton Carrefour le plus proche
2kzc21t8		1643744479.0	si3l29	/r/france/comments/si3l29/m6_et_lislam_radical_on_nous_a_présenté_un_sujet/	M6 ET L'ISLAM RADICAL : "ON NOUS A PRÉSENTÉ UN SUJET FACTICE" Plusieurs musulmans avaient été contactés par "Zone interdite" pour "un documentaire sur la laïcité et le vivre-ensemble", et non sur l'islamisme (désolée pour le paywall, mais j'ai trouvé l'article intéressant)
bikvrs92	Just wanted to say that: France is a really beautiful country, with welcoming people, nice food (especially fromage de chèvre et croissant), with beautiful landscapes and many more! Love from Romania 🇷🇴 🇫🇷	1643744526.0	si3lo8	/r/france/comments/si3lo8/hello/	Hello
fukwd6ld		1643725161.0	shw1pp	/r/france/comments/shw1pp/selon_une_étude_britannique_les_habitacles_des/	Selon une étude britannique, les habitacles des voitures sont encore plus sales que des cuvettes de toilettes
crewqkz4		1643726533.0	shwk3a	/r/france/comments/shwk3a/les_études_sont_daccord_les_risques_de/	Les études sont d'accord : Les risques de circoncision l'emportent sur les avantages. Il est temps de repenser notre approche permissive de la section génitale religieuse.
8kstj7s0	Je me demande simplement s'il existe des études socio là-dessus: statut, profession (ou non-profession), origines ethniques, convictions, âge, sexe etc etc... ça existe?	1643730509.0	shy23w	/r/france/comments/shy23w/quel_est_le_profil_des_votants_lfi_globalement/	Quel est le profil des votants LFI globalement?
4znks		1643739182.0	si1hmw	/r/france/comments/si1hmw/la_coopérative_laitière_sodiaal_va_fermer_deux/	La coopérative laitière Sodiaal va fermer deux usines en France
bikvrs92	Just wanted to say that: France is a really beautiful country, with welcoming people, nice food (especially fromage de chèvre et croissant), with beautiful landscapes and many more! Love from Romania 🇷🇴 🇫🇷	1643744526.0	si3lo8	/r/france/comments/si3lo8/hello/	Hello
ai8skcmw		1643759284.0	si9f0j	/r/france/comments/si9f0j/un_petit_blason/	Un petit blason.
fukwd6ld		1643725161.0	shw1pp	/r/france/comments/shw1pp/selon_une_étude_britannique_les_habitacles_des/	Selon une étude britannique, les habitacles des voitures sont encore plus sales que des cuvettes de toilettes
crewqkz4		1643726533.0	shwk3a	/r/france/comments/shwk3a/les_études_sont_daccord_les_risques_de/	Les études sont d'accord : Les risques de circoncision l'emportent sur les avantages. Il est temps de repenser notre approche permissive de la section génitale religieuse.
8kstj7s0	Je me demande simplement s'il existe des études socio là-dessus: statut, profession (ou non-profession), origines ethniques, convictions, âge, sexe etc etc... ça existe?	1643730509.0	shy23w	/r/france/comments/shy23w/quel_est_le_profil_des_votants_lfi_globalement/	Quel est le profil des votants LFI globalement?
4znks		1643739182.0	si1hmw	/r/france/comments/si1hmw/la_coopérative_laitière_sodiaal_va_fermer_deux/	La coopérative laitière Sodiaal va fermer deux usines en France
bikvrs92	Just wanted to say that: France is a really beautiful country, with welcoming people, nice food (especially fromage de chèvre et croissant), with beautiful landscapes and many more! Love from Romania 🇷🇴 🇫🇷	1643744526.0	si3lo8	/r/france/comments/si3lo8/hello/	Hello
ai8skcmw		1643759284.0	si9f0j	/r/france/comments/si9f0j/un_petit_blason/	Un petit blason.
ejd5x		1643792270.0	sijzm1	/r/france/comments/sijzm1/nicolas_mathieu_je_voulais_interroger_sur_ce_qui/	Nicolas Mathieu : « Je voulais interroger sur ce qui fait la réussite, le bonheur »
627sf9ap	J’ai reçu un avis de passage disant que j’étais mise en demeure, le bail de mon logement se terminais fin décembre.   C’est ma faute j’ai pas réussi à trouver un autre logement et je recherche toujours.  Je paye mon loyer mais je n’ai pas quitter le logement à la date de fin du bail, je précise que j’habite dans un logement residetape c’est une sorte de logement social.  J’aimerais savoir ce que je risque en restant encore dans le logement vu que je n’ai rien d’autre et que je continue à payer le loyer.  Merci pour votre aide	1643797736.0	silelf	/r/france/comments/silelf/mise_en_demeure_besoin_daide/	Mise en demeure besoin d’aide
fukwd6ld	En gros deux gosses courent au bord de la route. Un gars (je pense que c'est spider-man sans son costume) mange un truc. On voit que les enfants vont courir sur la route et qu'ils risquent de se faire chopper par un bus. Suspens... visage du gars inquiet... puis finalement les gosses vont se faire renverser mais le gars se détourne en bouffant son truc... genre il s'en tape.  Quelqu'un a vu la vidéo et saurait ou je peux la chopper ?	1643798378.0	silkuh	/r/france/comments/silkuh/cherche_vidéo_vue_hier_sur_reddit/	Cherche vidéo vue hier sur reddit
abfbu6y7		1643799214.0	silstd	/r/france/comments/silstd/la_catastrophe_que_nous_navions_pas_vue_venir_le/	La catastrophe que nous n’avions pas vue venir (Le dernier message, Nicolas Beuglet)
6fzzqg7a	Un avant-goût de ce qui pourrait être proposé en France?	1643799898.0	sim03o	/r/france/comments/sim03o/allemagne_le_nouveau_président_des_verts_veut/	Allemagne : Le nouveau président des “Verts” veut intégrer la charia dans la constitution
99fq9		1643805418.0	sinnbw	/r/france/comments/sinnbw/jo_2022_les_jeux_de_pékin_marquerontils_un/	JO 2022 : les Jeux de Pékin marqueront-ils un tournant dans le choix des villes hôtes ?
j7cdat7l		1643805736.0	sinqwa	/r/france/comments/sinqwa/sigma_european_male/	Sigma European male
ca85s		1643808992.0	siov51	/r/france/comments/siov51/la_commission_européenne_accorde_un_label_vert_au/	La Commission européenne accorde un label « vert » au nucléaire et au gaz, malgré les protestations
n8wya		1643814549.0	siqxsx	/r/france/comments/siqxsx/énergies_renouvelables_la_france_seul_pays_de/	Énergies renouvelables : la France, seul pays de l’Union européenne à avoir manqué ses objectifs
j9zwv2x0	Bonjour, j'utilise un compte tout frais pour écrire ceci. Ma vie n'en sera pas changée mais je ne peux plus accéder à mon compte habituel, que j'utilisais depuis un certain nombre d'années. Mot de passe plus valide, impossible de faire une réinitialisation de mot de passe pour raison d'e-mail non vérifié (si j'ai bien compris).   Cela vous est il déjà arrivé? Si oui, avez-vous récupéré votre compte et comment?   Mon seul véritable intérêt à le faire serait tous les posts/commentaires que j'avais dans la section "saved". Sinon, et ben bye à tout ça.  Au passage, que ce scénario soit confirmé ou pas, je serais curieux de savoir quelle est l'utilité de détourner un compte.	1643808983.0	siov18	/r/france/comments/siov18/compte_détournévolé/	Compte détourné/volé.
447x0nxo		1643819266.0	sisuro	/r/france/comments/sisuro/covid19_le_danemark_lève_toutes_ses_restrictions/	Covid-19: le Danemark lève toutes ses restrictions et tente à nouveau le retour « à la vie d’avant »
3w007wsb	Suis-je vraiment de gauche ?	1643821503.0	sitsza	/r/france/comments/sitsza/je_suis_de_gauche_et_je_pense_voter_roussel/	Je suis de gauche et je pense voter Roussel
9b5809ch		1643821842.0	sity8d	/r/france/comments/sity8d/enquête_comment_des_militants_deric_zemmour/	Enquête 🚨 Comment des militants d'Eric Zemmour manipulent Twitter #Prési...
3sfhed6v	Salut amis gaulois Le titre dit tout : je me gare sur un parking ou une rue ayant un beau '' stationnement interdit sauf riverains '' à l'entrée tout en n'étant pas riverain. Comment peuvent ils le savoir ? Y a t il un réel risque ?	1643822070.0	siu1tw	/r/france/comments/siu1tw/comment_la_police_peut_savoir_si_je_suis/	Comment la police peut savoir si je suis illégalement garé sur un parking '' sauf riverains ''?
91beq1gu	Il y a beaucoup de causes nobles à aider, encore faut-il savoir comment le faire et qui utilisera notre aide de la façon la plus utile.   J'imagine que ceux qui s'engagent ou donnent aimeraient éviter de le faire auprès d'associations malhonnêtes ([https://www.lexpress.fr/actualite/monde/amerique-nord/etats-unis-des-associations-de-lutte-contre-le-cancer-detournent-187-millions-de-dollars\_1681446.html](https://www.lexpress.fr/actualite/monde/amerique-nord/etats-unis-des-associations-de-lutte-contre-le-cancer-detournent-187-millions-de-dollars_1681446.html))  Je vous propose donc de répertorier les associations que vous connaissez qui ont besoins de fonds ou de volontaires, et qui les utilisent intelligemment (cad en actions tangibles et mesurables). Petites ou grandes, et quel que soit le sujet ( écologie, biodiversité, lutte contre la pauvreté, soutient aux victimes de violences , soutient scolaire ...).  N'hésitez pas à parler d'associations locales.	1643823430.0	siumow	/r/france/comments/siumow/a_quelles_associations_faire_des_dons/	A quelles associations faire des dons?
c6nvbtwk		1643824970.0	sivauf	/r/france/comments/sivauf/bonne_chandler_à_tous/	Bonne Chandler à tous!
ui4bl		1643830043.0	sixftr	/r/france/comments/sixftr/bonjour_à_toutes_et_à_tous_nous_souhaiterions/	Bonjour à toutes et à tous, nous souhaiterions réaliser une étude sur les étudiants et joueurs de jeux vidéos en France pour un master en sociologie par le biais d'un questionnaire. Merci de votre participation, un retour de résultats sera disponible.
17e7ar		1643830046.0	sixfvg	/r/france/comments/sixfvg/bonne/	Bonne
8kstj7s0	Quand je vois les légiférations qui sont en train de s'effectuer, l'attrait pour le contemporain, le fait qu'avoir un DPE de A sera extrêmement intéressant dans le futur, qu'il sera plus aisé de louer un tel bien, qu'en termes de finition et de confort c'est quand même le top etc etc...je me dis qu'essayer d'acheter une petite maison de style contemporain/moderne (construite il y a quelques années seulement, voire neuve même) bah clairement ça pourrait être intéressant.  Par pure curiosité, pour ce qui est de l'achat: une villa contemporaine, par rapport à une villa plus classique, une vieille maison ou autre, c'est nettement plus cher ou pas du tout? (A localisation, terrain, et surface identiques)  Merci !	1643832314.0	siyevt	/r/france/comments/siyevt/différence_de_prix_entre_une_maisonvilla/	Différence de prix entre une maison/villa contemporaine et une maison classique/ancienne?
kxoj7		1643832964.0	siyonp	/r/france/comments/siyonp/lombre_de_thales_plane_sur_le_dossier_atos/	L'ombre de Thales plane sur le dossier Atos
5t9lpgpw		1643866085.0	sjb0gw	/r/france/comments/sjb0gw/la_troisième_dose_nest_plus_nécessaire_après_une/	La troisième dose n'est plus nécessaire après une infection selon Olivier Veran hier soir
y9skn		1643868782.0	sjbu1u	/r/france/comments/sjbu1u/casting_de_qui_veut_diriger_la_sa_1924_colorisée/	Casting de "qui veut diriger la SA", 1924, colorisée - [r/pornodelafaussehistoire]
7wdn9wch		1643872022.0	sjcr74	/r/france/comments/sjcr74/nouvelles_fonctionnalités_sur_reddit/	Nouvelles fonctionnalités sur Reddit !
hge8l4be	Aujourd'hui à 9h15, 3 fils Z dans les 20 premiers résultats triés par nouveaux.    C'est quoi cette folie ?	1643876225.0	sjdvsd	/r/france/comments/sjdvsd/il_faut_que_ça_cesse/	Il faut que ça cesse
51p8q0e	Agile Manifesto pour /r/France  Nous découvrons comment mieux cacaposter par la pratique et en aidant les autres à le faire.    Ces expériences nous ont amenés à valoriser :  **Les poteaux meta** plus que les poteaux politique  **Le forum libre** plus que le vendredi Tech  **Un vocabulaire incompréhensible** plus qu'un mot vil albionnais que tout le monde connait  **Fabien Roussel** plus que Jean-Luc Mélenchon  Nous reconnaissons la valeur des seconds éléments, mais privilégions les premiers.	1643877198.0	sje4om	/r/france/comments/sje4om/rfrance_manifesto/	/r/France Manifesto
hkcjoruz		1643879671.0	sjer2c	/r/france/comments/sjer2c/jo_pékin_2022_bosses_perrine_laffont_championne/	JO Pékin 2022 - Bosses : Perrine Laffont, championne olympique en titre, débute sa compétition dès ce jeudi
i1zpbllw	Bonjour à tous !  Je ne sais pas à quel point mon thread sera le bienvenu, mais je me lance, et tout est dans le titre, je ne comprend pas comment c'est possible d'être complotiste de nos jours. Et attention, j'entends par là vrai complotisme, le gouvernement nous veut du mal, le vaccin c'est un poison, Bill Gates veut nous pucer, mise en ligne et partage volontaire de fausses informations et j'en passe, je ne parle pas de gens qui peuvent avoir un doute légitime et mesuré.  Je ne comprend pas comme c'est possible, nous avons aujourd'hui une telle facilité d'accès à l'information et la culture (ce qui est probablement aussi un soucis, j'imagine que ça marche dans les deux sens), ça me sidère que des gens puissent tomber là dedans. Au début de l'épidémie, je regardais cette vidéo d'un guignole d'extrême-droite sur Youtube qui essayait de "décrypter" un document "prouvant" que le COVID-19 est un truc qui existe depuis des lustres et j'en rigolais, mais aujourd'hui j'ai vraiment peur de ces gens et de cette mouvance. Pourquoi les gens ne cherchent-ils pas plus le fond des choses, surtout quand ça vient de réseaux sociaux ? D'ailleurs parlons en des réseaux sociaux. C'est incroyable les nids à haine et à complots que c'est devenu, Facebook comme Twitter, j'ai supprimé les deux parce que c'est plus possible des plateformes qui ne servent qu'a relayer haine et mensonges sans contrôle aucun.  Parlons "personnalités" qui gravitent dans cette mouvance, les Henrio-Caude, les Wonnier, Lallane (lol) et autres Bigard (lol²) ou encore le Druide du Sud. Personne ne fait des recherches sur ces gens pour se rendre compte à quel point ils sont la risée de leurs confrères ? D'ailleurs pour les deux premières citées, tout se résume pour moi à leur participation au "documentaire" Hold-Up, niveau crédibilité, ça se pose là.  Bref. Je ne sais pas trop comment conclure ce thread, si ce n'est dire que j'en ai gros sur ce que devient la France, pays si grand qui s'extrémise de plus en plus (car je suis convaincu, peut-être à tord, que la frange de population encrée dans cette mouvance est d'extrême-droite), et tôt ou tard, les conséquences seront dramatiques...  Pour ceux qui se posent la question, je m'identifie de gauche, les fameux "Islamogauchistes" ou encore les "Khmer verts" comme j'ai pu lire sur Twitter.  Merci à tous d'avoir lu :)	1643881558.0	sjf7yh	/r/france/comments/sjf7yh/comment_peuton_être_complotiste_de_nos_jours/	Comment peut-on être complotiste de nos jours ?
12tv4b		1643882570.0	sjfhnw	/r/france/comments/sjfhnw/cest_quoi_svp_tarot/	C'est quoi svp ? Tarot ?
crewqkz4		1643887567.0	sjgvgg	/r/france/comments/sjgvgg/que_feriez_vous_si_vous_gagniez_100_000/	Que feriez vous si vous gagniez 100 000 €
j1nmjbap	Bonjour!   Does anybody know what day of the week and time do the passport renewal slots open for UK Consulate in London? My husband is French and I've been trying to book an appointment for him but each time I see this:   Actuellement, tous les créneaux pour la démarche 'Demande de passeport et/ou de CNIS' sont occupés. Nous vous invitons à réitérer votre demande plus tard.  Sorry again for the English. Can anybody help?	1643885646.0	sjgbck	/r/france/comments/sjgbck/bonjour_apologies_for_the_english_french/	Bonjour, apologies for the English. French Consulate in London question
w5uiu		1643894102.0	sjiwv4	/r/france/comments/sjiwv4/les_historiens_debunkent_zemmour/	Les historiens debunkent Zemmour
46digv5k		1643896066.0	sjjlwg	/r/france/comments/sjjlwg/les_époux_balkany_envoyés_en_prison_par_la_justice/	Les époux Balkany envoyés en prison par la justice
bjcyt		1643896331.0	sjjpfh	/r/france/comments/sjjpfh/les_historiens_debunkent_zemmour/	Les historiens debunkent Zemmour
dm9q5p4x	Pardon pour cette stigmatisation dont vous êtes la cible...  Pardon à toi, famille algérienne que j'ai eu pendant longtemps comme voisin et qui m'avez abreuvés de couscous, harira et gâteaux...j'ai d'autres voisins algeriens en ce moment et c'est pareil ( même menu presque...)    Pardon à vous et à bien d'autres,  ceux qui penchent pour la haine ne vous ont jamais fréquenté...courage mes amis(es)..	1643901358.0	sjlpcz	/r/france/comments/sjlpcz/pardon_à_vous_musulmans_que_jai_croisé_dans_ma_vie/	Pardon à vous, musulmans, que j'ai croisé dans ma vie...
