author	selftext	created_at	s_id	permalink	title
e9dmb69n		1643279837.0	sdvi98	/r/france/comments/sdvi98/article_en_anglais_crise_ukrainienne_quand_un/	[article en anglais] CRISE UKRAINIENNE : Quand un ministre des Affaires étrangères de l'OTAN accuse l'Alliance de « bellicisme » contre la Russie
4kmxq40y		1643279963.0	sdvjb0	/r/france/comments/sdvjb0/road_rage_à_courbevoie/	Road Rage à Courbevoie
60syamgb		1643280811.0	sdvqup	/r/france/comments/sdvqup/japon_le_parc_à_thèmes_du_studio_ghibli_ouvrira/	Japon: le parc à thèmes du Studio Ghibli ouvrira en novembre
7wb4egqx	Je me suis un peu renseignée sur toute cette affaire et j'ai évidemment lu beaucoup de trucs en anglais, et en me promenant sur les discussions françaises je me suis rendue compte que la dite modo se faisait vachement moins mégenrer ici.  Bon, elle en prend quand même plein à la gueule et le fait qu'elle soit trans est beaucoup ramené sur le tapis mais c'est dans la grande majorité des cas pertinent et pas du tout transphobe.  C'est important à souligner parce que les personnes trans ont souvent le malheur de se faire mégenrer lors d'un faux pas ou d'un débat en guise de "punition"  Du coup ben en tant que meuf trans je voulais vous dire bravo et merci, je suis super agréablement surprise par la décence dont le sous fait preuve, et globalement la communauté française de Reddit ces dernières heures.	1643288786.0	sdxyu7	/r/france/comments/sdxyu7/agréablement_surprise_par_rfrance_avec_lhistoire/	Agréablement surprise par r/France avec l'histoire r/AntiWork et sa modo
9fodagtq	Bonjour bonsoir,   &#x200B;  Juste avant mon post dans ce sous, il y en a un qui parle d'un déplacement de 3 ministres (dont le number one) à Grenoble pour faire le point sur un plan ministériel ou un truc du genre.  &#x200B;  Du coup j'ai cette petite question : ça sert à quoi ce genre déplacement ?   Généralement, ils font quasiment que de l'affichage avec caméras, presse et rencontres symboliques ?   Donc est-ce que ça s'arrête à de la pure com politique ou y a-t-il vraiment un intérêt pour la performance de l'action politique ?   &#x200B;  Je veux dire, ils vont pas inspecter que tel truc financé par l'Etat avance assez vite. Par exemple, il y a quelques jours, Castex était sur le chantier de l'hôpital de Nantes.   J'imagine qu'il n'est pas venu pour dire "on a 15 jours de retard sur les fondations, je vais appeler le plombier pour décaler son intervention".  S'il a besoin de savoir où ça en est, il peut demander des rapports au maître d'ouvrage ou à la maire de Nantes par exemple.  &#x200B;  Dans le même genre, je pense pas qu'ils ont besoin de ça pour prendre le pouls du pays. Ils ont plein d'outils, de l'INSEE aux conseillers pour alimenter en information leurs prises de décisions. Une petite promenade sur site en mode "grande parade" avec préfet et journalistes me semble être l'outil le moins efficace possible pour réfléchir les prochaines décisions politique.  Du genre "Grands dieux j'ai vu un sdf devant la gare de Clermont-Ferrand, je vais faire un grand plan pauvreté."  &#x200B;  N'étant personnellement pas sensible à ce genre de communications que je trouve un peu ridicule, j'ai quand même l'impression que ce sont des journées perdues mais il y a sans doute quelque chose qui m'échappe genre une loi qui les oblige à bouger sur place ou autre ?   &#x200B;  Voilà, ma question est dans le titre s'il y a des experts de l'action du gouvernement, je suis curieux.	1643290465.0	sdyinz	/r/france/comments/sdyinz/ca_sert_à_quoi_les_déplacements_ministériels/	Ca sert à quoi les déplacements ministériels ?
9snmc		1643292477.0	sdz7e0	/r/france/comments/sdz7e0/line_goes_up_the_problem_with_nfts/	Line Goes Up – The Problem With NFTs
bvg64ocx		1643292776.0	sdzbal	/r/france/comments/sdzbal/nous_en_5ème/	Nous en 5ème
bvg64ocx		1643292972.0	sdzdow	/r/france/comments/sdzdow/nous_en_5ème/	Nous en 5ème
bvpltl15	* Ça durcit rapidement, sauf à se casser la tête avec des astuces de mémères.  * C'est pas très intéressant en terme de nutrition.  * C'est très calorique.  * On en consomme beaucoup sans s'en rendre compte (matin, midi et soir).  J'ai l'impression qu'on en mange plus par émulation sociale que par réelle envie ou besoin. J'ai arrêté d'en manger depuis que je vis plus chez mes parents et j'ai jamais ressenti le besoin d'y revenir.	1643295297.0	se07r2	/r/france/comments/se07r2/le_pain_cest_surfait/	Le pain, c'est surfait.
5qkmg09y	Bonjour chers Français ! Je suis allemand et je garde quelques jeux de mots français pour un projet scolaire. J'espère que vous pourrez m'envoyer des jeux de mots. Au fait, j'ai utilisé le traducteur Google.	1643297342.0	se0yr2	/r/france/comments/se0yr2/bonjour/	Bonjour
e4yc9vyu	Bonjour Je fais un master en sciences humaines et qui dit sciences humaines dit boulot precaire et débouchés bien de merde en perspective !!1  J'ai repéré le master Huma Numérique qui a l'air de concilier ce que j'aime : les arts, la recherche et du Numérique (et l'avenir est dedans - j'ai qq notions et mon copain qui travaille dans le domaine pour m'aider) et avant de m'engager dans une candidature dans ce master qui m'a l'air pas trop mal, je recherche des anciens étudiants pour me dire si ce master vaut le coup pour avoir un métier qui paye plus de le smic ou si c'est comme tous les domaines de sciences humaines (=un cul de sac) ? Merci beaucoup	1643297780.0	se14mc	/r/france/comments/se14mc/master_humanités_numériques_ça_apporte_des/	Master Humanités Numériques ça apporte des débouchés concrets ?
c2k6ot8e		1643303392.0	se38lo	/r/france/comments/se38lo/my_frist_ever_flag_map_i_decided_to_post_it_here/	my frist ever flag map i decided to post it here too
hfblenuy	Bonjour à tous,    Contractuellement je suis un "Gestionnaire", c'est une fonction très orienté métier sur le papier, avec des points d'appréciations si "force de proposition, capacité à automatiser des process, connaissance de languages de programmation".    Il se trouve que dans la pratique, j'ai en effet automatiser énormément de process, en plus de continuer à assurer ma fonction principale très métier qui est d'être "gestionnaire"".    Hors récemment, j'ai été affecté à un projet où je fais vraiment le rôle d'un full stack web developper, l'idée c'est de livrer un applicatif  web nous permettant d'assurer un process, avec plein de fonctionnalités.  Est-ce que je peux rajouter un slash sur mon linkedin un peu de la sorte "Gestionnaire/Développeur IT"?    C'est hyper hybride et chelou, mais limite si aujourd'hui je ne suis pas plus développeur que "gestionnaire".    J'ai gardé l'intitulé de mon poste métier un peu large pour des soucis d'anonymat.    Merci de votre aide.	1643303890.0	se3fol	/r/france/comments/se3fol/estce_que_ça_se_fait_de_mettre_un_intitulé_de/	Est-ce que ça se fait de mettre un intitulé de poste sur LinkedIn qui ne correspond pas exactement à l'intitulé officiel contractuel de mon poste ?
xtz00		1643305380.0	se40d2	/r/france/comments/se40d2/la_majorité_des_titres_écoutés_en_streaming_sont/	La majorité des titres écoutés en streaming sont francophones, selon une étude
67cprroi	J'aime bien Louis de Funès, j'aime bien les chats alors j'aime cette photo. Ca fait 39 ans qu'il est parti, je me souviens encore de ce jour.	1643308717.0	se5azj	/r/france/comments/se5azj/39_ans_déjà/	39 ans déjà...
kkoii		1643312117.0	se6m4w	/r/france/comments/se6m4w/estce_que_vous_validez_si_non_que_changer/	Est-ce que vous validez ? Si "non", que changer ?
60syamgb		1643312965.0	se6xkj	/r/france/comments/se6xkj/le_sexe_naurait_plus_la_cote_auprès_des_jeunes/	Le sexe n'aurait plus la cote auprès des jeunes
6zgkc2pu	Signé: le redditeur moyen du sous	1643314764.0	se7m8f	/r/france/comments/se7m8f/lunion_européenne_est_le_mal/	L’Union européenne est le mal
60syamgb		1643316040.0	se83ai	/r/france/comments/se83ai/covid19_la_suède_dit_non_à_la_vaccination/	Covid-19 : la Suède dit non à la vaccination générale des 5-11 ans
i417i0bt		1643320999.0	sea00r	/r/france/comments/sea00r/enquête_sur_le_meurtre_de_helen_pastor_femme_la/	Enquête sur le meurtre de Helen Pastor, femme la plus riche de Monaco
86j34	Je ne pense pas qu'il s'agisse de feux d'artifice. C'étaient 2 coups à 1 minute d'intervalle. Je n'ai jamais entendu parler de chasses nocturnes qui pourraient expliquer ça. Je m'inquiète pour rien ?     Pour info, je suis vraiment au trou du cul du monde.	1643336095.0	sefijx	/r/france/comments/sefijx/jai_entendu_des_coups_de_feu_dehors_à_3h_du_mat/	J'ai entendu des coups de feu dehors à 3h du mat en pleine cambrousse. Je dois m'inquiéter?
16unht	Okay, I've been watching Emily in Paris........ which has a lot of french stereotypes I know! ( And yeah i know the show gets a lot of hate )  But, in the Emily in Paris subreddits, there's always people talking about how in France how it's normal for people to cheat and for people to have mistresses.  I've only read a few articles online on the subject matter, and basically a lot of them say French women are more likely to forgive cheating. Another article i read says how the wife knew about the mistress and  took summer holidays so her husband could be with his mistress- she didn't mind. Another article mentioned how the french don't like to divorce .  So, i thought to ask on this subreddit to see what young people currently think about this. I mean, yeah the whole world has cheaters. But, cheating and infidelity is seen as a big thing overall in the US.	1643341727.0	sehd1o	/r/france/comments/sehd1o/how_is_relationship_infidelity_seen_in_france/	How is relationship infidelity seen in France?
3ay2kvsp		1643368897.0	seol2e	/r/france/comments/seol2e/leuro_est_trop_fort_de_68_pour_la_france_et_trop/	L'euro est trop fort de 6,8% pour la France et trop faible de 18% pour l'Allemagne selon le FMI
uhpmfx		1643369977.0	seov96	/r/france/comments/seov96/pipomantis/	[Pipomantis]
cwdp7		1643374869.0	seqac7	/r/france/comments/seqac7/totaldirect_énergie_change_ses_tarifs/	Total/Direct Énergie change ses tarifs ?
mohha		1643379231.0	serqv8	/r/france/comments/serqv8/fabien_roussel_expliquant_que_le_présidence_de/	Fabien Roussel expliquant que le présidence de l'UE donne aussi le commandement de l'OTAN
i417i0bt		1643385291.0	setv4d	/r/france/comments/setv4d/il_percute_un_piéton_en_suv_et_senfuit_un_avocat/	Il percute un piéton en SUV et s’enfuit : un avocat parisien condamné à de la prison avec sursis
dow3oaz6	J’ai soixante ans et j’ai toujours été un modeste employé. Employé certes, mais avec un cerveau qui a le sens de l’analyse et de la remise en question. Je n’ai eu que deux employeurs, une chaîne de magasins de prêt à porter en France et le service restauration d’une petite université privée aux USA pour lequel je travaille actuellement. D’un côté il y a les employés qui bossent sur le terrain et de l’autre côté il y a l’encadrement qui bosse le cul vissé sur une chaise dans un bureau sans fenêtres.  Au cours de ma vie professionnelle j’ai été amené à réfléchir sur ce qui pourrait être amélioré pour un meilleur fonctionnement de mon travail. Lorsque j’en ai eu et j’en ai la possibilité j’essaie de placer mes remarques sensées à l’encadrement.  Le résultat a toujours été le même. Vas bosser connard c’est nous qui sommes là pour voir ce qui peut et doit être amélioré. C’était le cas en France et c’est la même chose aux USA. Pourquoi?	1643386286.0	seu8c0	/r/france/comments/seu8c0/pourquoi/	Pourquoi?
10r92i	C’est une vraie question, les recruteurs ont tendance à sous-valoriser l’alternance, à dire que cette expérience ne compte pas (surtout pendant les négociations salariales !!!)  Sauf alternance café (rare), un alternant reste un salarié à part entière, avec l’expérience qui va avec. Il y a deux ans, quand je sortais de 3 ans d’alternance et que je demandais 38K pour mon premier CDI (salaire normal pour un dev avec mon expérience en région), certains recruteurs rigolaient, pourquoi ? Au final j’ai été embauché à 40K mais quand même, pourquoi l’alternance est autant sous-valorisée ? Une amie vit la même chose actuellement en cherchant son premier CDI. Éclairez-moi là-dessus car je ne comprends pas trop ce phénomène	1643389076.0	sev8h5	/r/france/comments/sev8h5/pourquoi_lalternance_estelle_sousvalorisée/	Pourquoi l’alternance est-elle sous-valorisée ?
i417i0bt		1643391148.0	sew04o	/r/france/comments/sew04o/étatsunis_le_nombre_dobèses_en_forte_augmentation/	États-Unis : le nombre d’obèses en forte augmentation
cis7s	Bonjour,    Je suis à l'étranger et j'ai besoin de débarrasser la cave de mon ancien logement en France assez urgemment. Ca représente seulement une 10aine de cartons de tailles moyennes et une livraison à 400km.    Merci de tout coeur !	1643392763.0	sewlbx	/r/france/comments/sewlbx/besoin_dun_conseil_quelle_société_de_transport/	Besoin d'un conseil, quelle société de transport pour quelques cartons ?
abfbu6y7	A mon sens les images parlent d'elles-mêmes. Et vous, qu'en pensez-vous?  [https://www.bfmtv.com/politique/melenchon-se-sent-lese-apres-son-dernier-debat-televise-avec-zemmour\_AN-202201280326.html](https://www.bfmtv.com/politique/melenchon-se-sent-lese-apres-son-dernier-debat-televise-avec-zemmour_AN-202201280326.html)	1643393949.0	sex1lb	/r/france/comments/sex1lb/mélenchon_se_sent_lésé_après_son_dernier_débat/	Mélenchon se sent lésé après son dernier débat télévisé avec Zemmour
2qn5xccc		1643398287.0	seyns3	/r/france/comments/seyns3/zapping_youtube_2021/	Zapping YouTube 2021
48tr8jfi		1643399001.0	seyx85	/r/france/comments/seyx85/bretagne_france/	Bretagne, France.
bcm0pa3j	Récemment j'ai fait une connerie, j'ai laissé un disque de pisse sur le radiateur de la cuisine (suite à un problème de beurre, technique connue), mais comme un idiot que je suis je l'ai oublié, résultat, une odeur de pisse constante dans la cuisine... Est-ce que vous avez des solutions ?  Je tiens à préciser que c'était des disques fabriqués suite à des problèmes de colocataire alcoolique relous mais bref	1643402943.0	sf0chf	/r/france/comments/sf0chf/odeur_de_pisse_dans_la_cuisine_oskour/	Odeur de pisse dans la cuisine, oskour
8rgucuyv		1643407045.0	sf1v6c	/r/france/comments/sf1v6c/là_les_belges_fint_très_fort_suisjaloux/	Là, les belges fint très fort #suisjaloux
8rgucuyv		1643407344.0	sf1zjq	/r/france/comments/sf1zjq/là_les_belges_font_très_fort/	Là, les belges font très fort 😍
60syamgb		1643407805.0	sf25ky	/r/france/comments/sf25ky/archéologie_à_la_rencontre_des_premières_femmes/	Archéologie : à la rencontre des premières femmes d'affaires, en Mésopotamie
iypq1s0a	Hi! I have a tattoo appointment at Désolée Papa in Paris on the 15th of February,I can’t make it anymore so I was thinking if anyone is interested.	1643408981.0	sf2l0x	/r/france/comments/sf2l0x/désolée_papa_tattoo_appointment/	Désolée Papa tattoo appointment
dxqmj8vs	Je pose cette question ici et pas sur un truc pour apprendre le français parce que je suis française et je désire changer notre langue, donc je demande l'avis de mes compatriotes sur ce point  Je trouve que ça a pas de sens de dire, par exemple, "rien n'a d'importance". Ou "je n'ai rien dit". Parce que la phrase se contredit. "N'a" c'est comme dire "ne pas avoir". "Rien n'a d'importance", c'est dire "tout a de l'importance" alors qu'on veut dire le contraire, merde! Je sais que grammaticalement c'est la règle mais c'est con.  Est-ce que vous, ça vous gênerait de lire par exemple un roman où il y a pas ou très peu de n'a? Je trouve que la négation est nécessaire pour "n'était" ou "n'avait pas", autrement je la mets pas quand j'écris.	1643411184.0	sf3ewc	/r/france/comments/sf3ewc/grammaire_peuton_se_passer_de_la_négation/	Grammaire: peut-on se passer de la négation ?
c6nvbtwk		1643418789.0	sf64pi	/r/france/comments/sf64pi/pour_ceux_qui_se_plaignent_des_radars/	Pour ceux qui se plaignent des radars automatiques en France je vous présente Moscou
nrhjn		1643422358.0	sf7awa	/r/france/comments/sf7awa/bricoler_pour_mieux_parler/	Bricoler pour mieux parler !
dxusanz		1643439348.0	sfcd1e	/r/france/comments/sfcd1e/calais_oc/	Calais. [OC]
fukwd6ld		1643439383.0	sfcdcd	/r/france/comments/sfcdcd/passe_vaccinal_à_partir_du_15_février_le/	Passe vaccinal : à partir du 15 février, le certificat de rétablissement lui aussi ne sera valable que 4 mois
c6bjsfpc		1643443459.0	sfde6q	/r/france/comments/sfde6q/les_français_votent_de_plus_en_plus_à_droite/	Les Français votent de plus en plus à droite
14tkvp		1643455491.0	sfg7k6	/r/france/comments/sfg7k6/dans_les_belles_rues_de_calais_presque_oc/	Dans les belles rues de Calais [presque OC]
i417i0bt		1643464198.0	sfihze	/r/france/comments/sfihze/villa_montmorency_ce_quartier_privé_de_paris_où/	Villa Montmorency, ce quartier privé de Paris où des maisons s’achètent 25 millions d’euros
hl7soe2v	*Ps. Im posting this here because idk how french guys are and he is french mais je parle francais couramment.*  Donc voilà je bosse comme réceptionniste dans une auberge et y a un mec super beau qui y reste. Il est là jusqu'à juin. J'ai 20 ans et il a 23. Il est super beau mais super timide aussi. Hier je lui ai dit que je pourrai lui montrer un bar cool et il ma dit qu'il etait dispo ce soir. Chu pas super belle donc chai vrmt pas comment/prq il a accepté. Mais ca se trouve qu'il a juste dit oui car il est trop timide pour me dire non. Je lui ai envoyé un message (moi c la bulle grise) et voici la convo. **Il a l'air d'être intéressé vs pensez? Et est ce que vs pensez qu'il a compris que c'est un date?**  https://ibb.co/GQwCzdN	1643472931.0	sfld51	/r/france/comments/sfld51/french_guys_and_dating_is_he_actually_interested/	French guys and dating: is he actually interested or was he just scared of rejecting me?
6og2w5ve		1643473427.0	sfljdb	/r/france/comments/sfljdb/quelquun_saurait_me_dire_où_je_peux_trouver_qc/	Quelqu'un saurait me dire où je peux trouver qc comme ça, mais plus grand ? 80-100cm au lieu de 75cm. merci!
d07pi05w		1643473460.0	sfljrs	/r/france/comments/sfljrs/surprise/	Surprise !
bde0g5dn	Bonjour AirFrance ! Je suis étudiante et en alternance, et aujourd'hui en plein milieu de mon arrêt maladie de 3 jours stipulé par un médecin, mon employeur m'appelle pour m'annoncer que ça va être compliqué de poursuivre cette alternance ensemble, se justifie en listant quelques petits erreurs effectuées depuis le début du contrat en septembre. Comme par exemple le fait j'ai oublié de nettoyer un endroit, que je leur parle par sms alors qu'ils voudraient plutôt que je les appelle (ça fait depuis le début qu'on communique comme ça, ils ne m'ont jamais rien dit)...  Je ne veux certainement pas perdre ce contrat qui me permet de suivre mes études mais la rupture semble inévitable. Quels droits me protège lorsque la ruoture du contrat d'apprentissage se fait à l'initiative de l'employeur sans un justificatif de faute grave ou de force majeur ?  J'ai toujours été motivé, à l'heure, jamais refusé ou désobéi un ordre, j'avais l'impression que tout se passait bien... mais que de mon côté apparemment.	1643477110.0	sfmvz3	/r/france/comments/sfmvz3/notre_droits_en_tant_quapprenti/	Notre droits en tant qu'apprenti.
60syamgb		1643481772.0	sfolvn	/r/france/comments/sfolvn/quand_larchéologie_raconte_les_grands_faits_et/	Quand l’archéologie raconte les grands faits et les petits gestes de notre histoire commune
g6bc2fen	Ils ont un peu de thune et ça y'est hop ça publie deux vidéos par an et quelques stories Insta pour faire genre mais ils branlent plus rien !	1643480690.0	sfo7h1	/r/france/comments/sfo7h1/que_pensezvous_des_youtubeurs_qui_une_fois_quils/	Que pensez-vous des youtubeurs qui une fois qu'ils ont percé dans le game, abandonnent leur chaîne et leurs fans ?
4q5g6vm6	Sorry for the English. This is a bit too complicated for me to ask/express in French. But you can reply in French and I will understand (mostly) without problem if you like.   Is it true children can't work in France? So, where I come from its quite common for children from about 13/14yo onwards to have saturday and holiday jobs - like working in a shop, assistant at a hairdressers, some farm work, cafe work, that sort of stuff. We've moved to France and I'd told my son he'll have to get a job and save up because he wants to build a computer and needs to buy all the bits. I thought maybe he could ask the farmers or find something in town at a cafe. Well I was just reading about it and he can't apparently? Or only if he's working for our family? What are the rules and how do children save up for expensive things if they can't get a little Saturday job? I might be misunderstanding the rules - I am quite prone to missing some context when I'm reading French still and getting the wrong end of the stick.    It is true that I have very rarely seen teenagers working, and I'm at an age where I can't really tell the difference between a 14 and 16 year old anymore so when I have thought a 14yo is working they could easily be older.	1643486882.0	sfqhdt	/r/france/comments/sfqhdt/working_under_18_years_old_in_france/	Working under 18 years old in France
rz7r7	Bon, je crois connaître la réponse, mais mon cas de figure est le suivant: je fais très attention à ma consommation électrique. Si j’en crois l’application EDF, sur les 6 derniers mois ma consommation est presque toujours en dessous de 50€ par mois, avec des points bas à 33€ et un point haut à 56€ en décembre 2021. L’autre jour je reçois un mail de EDF qui me dit en substance que je passe d’une mensualité de 68€ à 103€ à partir de février. J’essaye de contacter EDF qui me répond par mail ouais ouais on va te rappeler, puis plus rien. Je me doute qu’il y aura une régulation en juillet-août, mais j’aimerais comprendre le mécanisme qui me fait payer plus par mois que la plus haute consommation mensuelle que j’ai jamais fait. Merci d’avance et n’hésitez pas à ELI5.	1643487358.0	sfqnen	/r/france/comments/sfqnen/quelquun_pourraitil_mexpliquer_comment_ma_facture/	Quelqu’un pourrait-il m’expliquer comment ma facture EDF grimpe de 68 à 103€ de janvier 2022 à février 2022?
7hhl6ux4		1643492698.0	sfsj7s	/r/france/comments/sfsj7s/moins_de_deux_ans_séparent_ces_deux_tarifs_vive/	Moins de deux ans séparent ces deux tarifs. Vive l'inflation
3mkezli0		1643493400.0	sfss1g	/r/france/comments/sfss1g/avoir_le_covid/	Avoir le Covid:
bt5r95ek	i recently moved to france and i am really bad at french lol. i was wondering how to ask for cigarettes in a tabac (in a natural way/idiomatically) and which brands are most common?	1643497816.0	sfufll	/r/france/comments/sfufll/how_do_you_ask_for_cigarettes_in_french/	how do you ask for cigarettes in french?
i417i0bt		1643499291.0	sfuy6w	/r/france/comments/sfuy6w/warren_buffet_je_méclate_plus_que_nimporte_quelle/	Warren Buffet : "Je m'éclate plus que n'importe quelle personne de 88 ans !"
i417i0bt		1643500638.0	sfvew3	/r/france/comments/sfvew3/une_journaliste_française_dénonce_le_racisme/	Une journaliste française dénonce le racisme «anti-frouzes» des Suisses
i417i0bt		1643501873.0	sfvuu4	/r/france/comments/sfvuu4/patrick_drahi_refusait_de_payer_sa_femme_de_ménage/	Patrick Drahi refusait de payer sa femme de ménage
i417i0bt		1643501967.0	sfvvy7	/r/france/comments/sfvvy7/le_milliardaire_patrick_drahi_ne_voulait_pas/	Le Milliardaire Patrick Drahi ne voulait pas payer sa femme de ménage
dow3oaz6	Ok, je sais que la plupart d’entre-vous n’en ont rien a cirer mais l’info vient de tomber comme quoi le meilleur quarterback de l’histoire prend,enfin, sa retraite.  Vingt-deux saison au plus haut niveau. Vingt avec les New England Patriots, neuf participations au Super Bowl avec six victoires à la clef. Deux saisons avec Les Tampa Bay Bucanneers, un Super Bowl gagné. Sept titres de champion de la NFL. Comme disent les ricains: the G.O.A.T	1643507682.0	sfxt03	/r/france/comments/sfxt03/salut/	Salut
4f96npke		1643519708.0	sg1llk	/r/france/comments/sg1llk/la_belle_et_la_bête_de_madame_leprince_de/	La Belle et la Bête de Madame Leprince de Beaumont 1/2
5at85qu5		1643521174.0	sg20r0	/r/france/comments/sg20r0/im_dont_speak_french_nor_have_any_friends_that_do/	Im dont speak French nor have any friends that do, can someone help me translate?
51vlse9m		1643531977.0	sg4u0d	/r/france/comments/sg4u0d/mesure_de_la_confiance_que_les_individus_se/	Mesure de la confiance que les individus se portent aux autres : les bretons sont exceptionnels
i417i0bt		1643533925.0	sg5b2q	/r/france/comments/sg5b2q/macron_vu_par_francois_henrot_associégérant_de_la/	Macron vu par Francois Henrot, associé-gérant de la Banque Rothschild
170kra6e		1643537277.0	sg63ns	/r/france/comments/sg63ns/le_débat_politique_en_france_ca_2022/	Le débat politique en France, ca. 2022
6fot0d9y	C'est juste insupportable tous ces gens qui ne travaillent pas le dimanche et qui au lieu de rester chez eux veulent se promener en empêchant les chasseurs de picoler et tuer des chats en paix. Il suffit pourtant de consulter les calendriers de la chasse pour savoir où les chasseurs se trouvent pour pouvoir les éviter ! Bon, ok, personne ne le remplit. Alors autant rester chez soi et laisser les chasseurs en paix. Merci pour cette espèce malheureusement pas en voie de disparition.	1643538039.0	sg6a5t	/r/france/comments/sg6a5t/coup_de_gueule_marre_des_familles_qui_veulent/	Coup de gueule : marre des familles qui veulent faire de la rando en pleine période de chasse
1uym84r2		1643550104.0	sg9fax	/r/france/comments/sg9fax/volé_sur_twitter/	Volé sur Twitter
