author	selftext	created_at	s_id	permalink	title
q50ug		1643098688.0	sc8sx2	/r/france/comments/sc8sx2/sur_votre_box_tv_orange_dans_longlet_replay_vous/	Sur votre box tv orange, dans l'onglet replay vous aussi quand vous tapez sur Canal+ ça affiche "Le service demandé est temporairement indisponible. Code erreur P01" svp? :/
dow3oaz6	Depuis quelques temps, l’ultra droite chrétienne américaine, s’en prend à une chasse aux sorcières dans les milieux littéraires en voulant interdire nombre de livres qui peuvent blesser leurs lecteurs. Beloved de Toni Morrison, The handmaid’ tale de Margaret Atwood, The cider house rules de John Irving font partie de cette liste	1643121711.0	scf9qq	/r/france/comments/scf9qq/quelle_liberté/	Quelle liberté?
9fodagtq	La majorité des gens est vaccinée pourtant tout le monde se retrouve dans ce contrôle chiant dès qu'on va quelque part.  Et les serveurs ont autre chose à faire que demander le statut vaccinal ou post infecté des clients.  Le résultat final est le même. Tu fais assez de contrôle pour punir les vilains fraudeurs et les gens gentils ils sont tranquilles. Si tu contrôles assez ça rapporte de l'oseille à l'Etat, les gens qui se font taxer des thunes arrêtent de frauder et vu qu'ils sont déjà emmerdés, pas de raison qu'ils se rebellent plus. Les pas contents sont déjà chez Philippot le samedi après-tout.  En plus, si ça se trouve, ça donnera encore plus envie aux gens non vaccinés de se faire vacciner. Parce que là ils connaissent tous un pote avec un pass de complaisance sans contrôle d'identité ou un resto ou bar qui contrôle pas les pass.  Tu cales un petit panneau "pass requis" et si t'as pas le pass, tu raques.  &#x200B;  A part des raisons logistiques assez pétées, pourquoi ils demandent pas à la police de faire le job de la police ?  Je sais que mettre en place des contrôles de police ça coûte cher mais les amendes à 135€ ça rapporte de l'argent. Y'a moyen d'équilibrer les comptes en recrutant des brigades sanitaires et en faisant payer tout ça aux fraudeurs. Je propose même d'ajuster le montant des amendes au coût des contrôles (c'est sans doute pas constitutionnel mais il savoir prendre des risques dans la vie quand on prétend emmerder les antivax, un peu de courage Manu).  Tu fais 1000 amendes, ça coûte 500 000€ de frais de police, ben l'amende elle est à 500€.  Ce point est la solution parfaite à tous les problèmes de la vie d'ailleurs : comme ça les antivax dans les bars se dénoncent entre eux pour faire baisser les amendes individuelles (genre ils se lèvent dans le bar comme dans le meme spiderman qui se pointent du doigt en lançant un petit "c'est lui qui a commencé").  &#x200B;  Je veux dire, on demande pas aux entreprises de BTP qui gèrent la voierie de retirer des points lors infractions sur leurs routes, aux cinéma de contrôler le dossier "flims sur le cyclisme.mp4" de ton disque dur externe ou aux bibliothécaires de coller des amendes pour tapage diurne (ils font juste chut avec les doigts devant la bouche).  Les barmans devraient juste barmaner et les policiers policer.  &#x200B;  Autant quand c'était la panique lors des déconfinements, je dis pas mais là on a une jolie loi sur le pass sanitaire et les serveurs ils ont pas demandé à faire une reconversion en policier à mi-temps.	1643123688.0	scfynm	/r/france/comments/scfynm/pourquoi_le_gouvernement_oblige_à_une/	Pourquoi le gouvernement oblige à une présentation systématique du pass aux serveurs / videurs plutôt que des contrôles de police ?
4elkiz1a	Non mais sérieusement, c'est quoi ce bordel.  Ce gamin pose régulièrement problème à mon fils, je l'avais dis de l'éviter malgré ça le morveux continue à l'emmerder lui et d'autre enfant de la classe. Mais là, voir un enfant de 7ans, balancer ce genre de propos, c'est just hallucinant.  Je fais quoi moi maintenant, je suis censé aller au commissariat ou quoi. Mon fils se retrouve à avoir peur d'aller à l'école maintenant. C'est just abérrant.  Edit : j'ai contacter la maîtresse via l'application ClassDojo qui permet d'avoir les news de l'école. Le gamin a confirmer avoir dis ça, un mot dans le carnet après avoir eu la morale et voilà. Le directeur de l'école m'a appeler pour m'expliquer le détail. Il était tout aussi choqué que moi. Il m'a même dis que le problème c'est ce que les parents feront à la maison.. Et ça.. C'est une autre histoire.	1643126597.0	sch1cn	/r/france/comments/sch1cn/un_enfant_de_la_classe_de_mon_fils_la_menacé_de/	Un enfant de la classe de mon fils l'a menacé de "Ramener un cutter et de le tuer".. Ils sont au CP
b877e63z	Merci de lire avant de bas-voter.   Avant toute chose, même si je dispose d'un cercle social très large et de beaucoup d'exemples de ces comportements, j'admets volontiers qu'il ne s'agit que d'un point de vu anecdotique. Autre précision, les opinions mentionnées plus bas entre guillemets ne sont pas les miennes, juste ce que j'entends autour de moi.   Depuis un peu plus de 2 mois, avec l'arrivée du Variant Omicron, je vois une tendance se dégager. Les gens qui attrapent volontairement le Covid / Qui voudraient avoir le covid.   En effet, dans la tranche d'âge 12-35 ans, sans être antivax, nombreux sont ceux qui ne sont pas super motivés pour faire la 3ème dose, n'en voyant pas vraiment l'intérêt ou tout simplement par "flemme". Cependant, ils ne souhaitent évidemment pas perdre leur pass.   Et donc, ces dernières semaines, constatant la "quasi inoffensivité du variant omicron sur leur tranche d'âge" (on a tous désormais quelqu'un de très proche qui l'a eu), commencent à se dire que finalement "ce serait pas si mal d'attraper le virus et d'avoir 6 mois d'abonnement offert sur leur pass sans avoir a se soumettre au rappel."  Ca peut même permettre de souffler un peu des cours / du travail, rester a la maison tranquille, après tout même dans le pire des cas "on ne souffre que 2-3 jours et le reste de l'isolement peut être mis a profit pour faire ce que l'ont veut, au frais de la princesse."   Et donc peu à peu les gens arrêtent complétement les gestes barrières, les plus timides espèrent secrètement le chopper, les plus téméraires adoptent volontairement des comportements visant à attraper le virus, et les plus calculateurs essaient même de l'attraper de sorte à ce que leur quarantaine coïncide avec un contrôle gênant en cours, ou un moment chiant au taff, un événement qu'on veut éviter...   Les gens oublient complétement le côté dangereux du virus pour les personnes plus fragiles et participent à l'explosion des cas partout dans le pays pour pouvoir conserver leur précieux sésame leur donnant le droit à continuer à prétendre à une vie normale.   De la à dire que le pass vaccinal contribue désormais activement à la propagation du virus en France, il y a un pas qui peut paraître énorme à franchir, mais personnellement j'y crois fermement.   Votre avis ?	1643130769.0	scim3b	/r/france/comments/scim3b/opinion_le_pass_vaccinal_est_devenu/	[OPINION] Le pass vaccinal est devenu contre-productif, voir dangereux.
9fodagtq		1643133960.0	scjunr	/r/france/comments/scjunr/anne_hidalgo_depuis_un_an_jai_parcouru_la_france/	@Anne_Hidalgo Depuis un an j'ai parcouru la France à votre rencontre. J'ai écouté vos craintes, vos désirs, vos propositions et grâce à vous j’ai mûri mon projet. Les défis sont nombreux, les urgences sont réelles. Vous pouvez compter sur moi et mon équipe pour réunir la France ! [vidéo]
j0h7kceh	Salut, j’écris ça aujourd’hui parce que je sais pas trop quoi faire et je ne peux en parler avec la personne. Alors j’ai 20 ans, et j’ai rencontré un garçon l’année dernière, celui-ci est éperdument amoureux de moi et je crois que moi aussi. Le truc c’est qu’on à une relation de fou entre la « passion et la haine » si c’est pas cliché mdr, mais réellement on s’entend incroyablement bien les mêmes hobbys ext. On se dispute tout le temps mais sans méchanceté ni rien et on fini toujours par se réconcilier. C’est vraiment pour vous dire qu’on à une relation de dingue j’ai jamais vécu ça et en vrai j’ai vue ça que dans les films mêmes du haut de nos 20 petits ans! Le problème est ici: je le trouve moche. (C’est horrible de dire ça et ça ne devrait pas influencer) mais vraiment il est repoussant et je sais que le physique est subjectif et ça ne change rien à ça personne mais je me voit pas faire quelque chose avec lui, c’est comme un blocage..  du coup ma question c’est est-ce que je suis une personne horrible ? Je dois me forcer pour avoir une relation avec ? Sachant qu’on s’entend incroyablement bien vraiment..	1643131928.0	scj243	/r/france/comments/scj243/que_doisje_faire/	Que dois-je faire ?
pnc8kuc		1643136190.0	sckpdw	/r/france/comments/sckpdw/open_daustralie_gaël_monfils_et_la_remontada/	Open d’Australie : Gaël Monfils et la « remontada » inachevée
ck76i6xg		1643136922.0	sckzct	/r/france/comments/sckzct/how_frances_largest_semiconductor_company_got/	How France's Largest Semiconductor Company Got Nationalized in Plain Sight
ieb2b	Salut Air France,  Voilà, j'ai un petit problème et je tends la main au cas où l'un d'entre vous saurait m'aider dans ma galère.  J'ai acheté un pédialier Fanatec CSL issu d'un pack GT CSL DD Pro il y a quelques semaines sur le bon coin. Jamais utilisé, je reçois le pédalier encore dans son pochon Fanatec, tout va bien. Étant donné que ce dernier ne peut pas fonctionner seul sur PC, j'ai été dans l'obligation d'acheter en plus un adaptateur ClubSport USB. Seulement voilà, il semblerait que le pédalier soit défectueux car lorsque je tente de le tester via le Game Controller Control Panel de Windows, rien ne se passe. J'ai pourtant flashé l'adaptateur en mode "pédales" mais rien n'y fait.  J'ai contacté le support technique de Fanatec pour leur expliquer mon problème, et ils veulent bien me remplacer le pédalier sauf qu'il faut que je leur fournisse une facture. J'ai dit que c'était un cadeau de Noel qu'on m'a fait donc je n'en ai pas, mais rien à faire. Entre parenthèses, j'hallucine sur le fait que je doive fournir une facture sur un produit qui:  - Possède un numéro de série - Est en vente depuis moins d'un an - N'est vendu que par Fanatec  Je pense que vouloir batailler sur les lois européennes de la consommation est peine perdue avec eux, donc je me tourne vers vous.  Si un redditeur pourrait me fournir une facture d'un pédalier CSL (le nouveau, pas le Elite) ou d'un pack GT CSL DD Pro, ça me permettrait d'avoir un numéro RMA auprès de Fanatec et ainsi pouvoir leur renvoyer ce pédalier défecteux.  Je sais que c'est beaucoup à demander et que j'ai peu de chances de trouver réponse, mais ça m'embête vraiment d'avoir mis quasi 100 € dans un truc sans que la marque puisse m'aider.  D'avance merci.	1643138743.0	sclo68	/r/france/comments/sclo68/un_redditeur_possesseur_dun_pédalier_fanatec_csl/	Un redditeur possesseur d'un pédalier Fanatec CSL pourrait me rendre service ?
6b8n3c4a		1643139252.0	sclv97	/r/france/comments/sclv97/vous_aussi_vous_trouvez/	Vous aussi vous trouvez ?
60syamgb		1643141150.0	scmkqp	/r/france/comments/scmkqp/covid19_en_france_500000_nouveaux_cas_en_24/	Covid-19 en France : 500000 nouveaux cas en 24 heures, le nombre d’hospitalisés au plus haut depuis avril
8kstj7s0	Allez, un petit coming out, cela ne me coûte pas grand chose ma foi:   Je suis chômeur de très longue durée, l'expression est lâchée ! J'ai un doctorat en économie (Toulouse 1 Capitole) qui m'a pris 4 ans, mais du fait d'un handicap (pas suffisamment lourd pour me gâcher la vie, mais suffisamment pour m'empêcher de trouver du travail par contre) je n'ai jamais réussi, durant les 6 dernières années, à durer plus de quelques mois dans une entreprise, et j'ai essayé pourtant. Dans les faits, je peux retrouver du travail sans trop de problème (quand on a la chance d'avoir un tonton qui est patron de sa propre entreprise et qui fournit certificats de travail, références, fiches de paie et tutti quanti...cela lisse le CV, surtout quand il s'agit d'un trou béant comme celui de mon parcours), mais ayant la chance d'avoir un accompagnement, mon handicap étant diagnostiqué depuis peu, je préfère faire du qualitatif, quitte à ce que cela prenne quelques mois, je n'en suis pas à ça près.  D'autres personnes que moi ont eu ce genre de lourdes désillusions en essayant de s'insérer sur le marché du travail sans succès? Avez-vous eu à faire face au chômage très longue durée, que vous ayez fait des études ou non? Comment l'avez-vous vécu? (Je pourrai moi-même répondre à cette question si vous le désirez).	1643143656.0	scnisz	/r/france/comments/scnisz/chômeurs_longuedurée_je_vous_salue/	Chômeurs "longue-durée" : je vous salue
hl7soe2v	 **Does this make sense? Does it sounds French or can you tell Im not french by the way its written?:**  "Salut! Je cherche quelqu'un qui aimerait jouer au ping pong régulièrement. Niveau: débutante. Je fais ca juste pour le fun et pour me motiver à faire une activité sportive. Sinon si vous connaissez des clubs ping pong?  Je cherche quelqu'un avec qui courir. Je trouve ce serait plus motivant que courir seule. Niveau: aussi débutante/lente."	1643150843.0	scq576	/r/france/comments/scq576/can_you_rewrite_this_so_it_sounds_fluent/	Can you rewrite this so it sounds fluent?
bnujbhm4	!	1643160301.0	sctkpp	/r/france/comments/sctkpp/is_it_true_that_first_and_third_person_ir_verbs/	is it true that first and third person ir verbs have no change in pronunciation in the present tense?
54ku2zns		1643166886.0	scvu13	/r/france/comments/scvu13/mmm/	Mmm
j10x0pfk	Bonjour j’ai acquis la nationalité française par naturalisation il y a peu il faut savoir que j’ai rejoin le territoire français a mes 1 ans mais le fait que je ne suis pas née en France me bloque pour trouver du travail ou même du point de vue social car le fait que ce sois marquer noir sur blanc que je suis née a l’étranger les gens pense que je suis un « bledard » car en + de cela je viens d’un pays très pauvre en guerre colonisé bref que des galères je ne reni pas mes origines mais depuis ma naissance je n’y ai plus remis les pieds donc je ne suis pas vrmt attaché en + de cela j’ai eu des galères qui ont fait que je n’ai pas grandis avec mes parents donc j’ai aucune culture de ce pays.  Bref c’est tout pour les raisons de ma questions, je voudrait savoir si pour un étranger il y a moyen légale que l’ont change son lieu de naissance sur sa carte d’identité ou juste que l’ont puisse marquer étranger(99) un truc du genre car sa me colle à la peau. Je sais que d’un point de vu éthique c pas ouf mais sa me rend vrmt peu à l’aise et j’en ai très honte, je ne pense pas trop en demander, on vis quand même dans un monde ou l’ont peut changer de sexe.  Si il n’y a aucun moyen légal envoyez moi vos plug	1643165206.0	scv95t	/r/france/comments/scv95t/peut_on_changer_de_lieu_naissance_suite_à_une/	Peut on changer de lieu naissance suite à une naturalisation ?
14ajvhnc	J’ai peu dormi, j’ai une question bizarre.  J’ai signé un CDI récemment.  Imaginons, par mégarde, je meurs à cause d’une corde et d’un tabouret qui traînent.  Imaginons aussi que tous les accès à tous les moyens de communication que la société avec qui j’ai signé le CDI ne sont accessibles à personne (mails avec a2f, téléphone mort, mots de passes aléatoires…)  Comment est-ce que mon futur employeur saura que je suis mors ?  **Édith**: je vais pas me suicider !	1643185224.0	sd139b	/r/france/comments/sd139b/qui_prévient_mon_futur_employeur_en_cas_daccident/	Qui prévient mon futur employeur en cas d’accident
10u2d4		1643185896.0	sd191x	/r/france/comments/sd191x/sncf_donne_son_accord_pour_mettre_à_disposition/	SNCF donne son accord pour mettre à disposition un terrain à #Paris12 susceptible d'accueillir les usagers de crack afin de les éloigner de quartiers résidentiels.
dw0e4	Salut r/france ,     Je viens vers vous car j'ai reçu, il y a quelques jours, un mail de la part d'Ebay qui me chiffonne un peu. Je suis un vendeur non professionnel, même si je vends ( et achète ) beaucoup sur internet, que ce soit sur LBC ou Ebay.     J'ai reçu un mail de la part d'Ebay, qui fait mon récapitulatif de l'année 2021:   \-30 transactions   \-montant brut = 7800e   \-Frais de commissions totaux = 511e   \-Frais d'expéditions totaux = 286e     Ebay stipule qu'au dessus de 20 transactions et de 3000e, les chiffres sont fournies au Fisc pour le calcul des impôts. Sauf que ça représente une somme absolument énorme, et que ce n'est absolument pas représentatif d'un gain net pour ma part.     En effet, durant l'année 2021, j'ai exploré une passion, celle des casques Hifi haut de gamme. Ayant investi une somme de départ d'environ 700e dans l'achat d'un casque HdG, la quasi intégralité de la somme indiqué par Ebay est la résultante de la revente de mon appareil ( parfois avec perte! ) , et du réinvestissement de la nouvelle somme ( parfois avec rajout de ma part ) pour l'achat d'un appareil différent. Ce fut mon hobby du moment surtout en période de Covid, mais en aucun cas je n'ai "gagné" 7800e ( ou plutôt 7000e si l'on déduit les frais de port et les commissions )...     Car je vais pas mentir, un rabattement de 7000 balles sur mon calcul d'impots, c'est vraiment pas rien pour moi, je suis actuellement à un taux de 4,8% avec un salaire annuel net de 22 000e....  \-Y a t'il des justificatifs possible ( facture Ebay, etc etc. ) pouvant réduire la somme déclaré, en justifiant par exemple d'un achat à prix égal ou supérieur au gain, et donc en indiquant qu'il ne s'agit pas d'un gain d'argent net pour ma part, mais un réinvestissement?     \-Ai-je raison de m'inquiéter?     \-C'est pas un peu complètement stupide comme système? en gros, si je prends le train et que l'on fait la transaction en main propre, pas de soucis, mais si via internet, tout est tracé et déclaré?     \-D'un autre côté, je lis que cette démarche de déclaration au Fisc ne sert QUE à traquer les professionnels non déclarés qui voudraient passer sous le radar des impots... En tant que non professionnel, ai-je à m'inquiéter?     Merci d'avance à ceux qui pourront m'aider et éclairer ma lanterne.	1643188153.0	sd1s4n	/r/france/comments/sd1s4n/aide_impôts_et_déclaration_ebay_au_fisc/	[AIDE] Impôts et déclaration Ebay au FISC?
dca5yk8e		1643189033.0	sd1zjc	/r/france/comments/sd1zjc/les_danois_du_grp_dintervention_takuba_sont/	Les Danois du grp d'intervention Takuba sont considérés comme force d'invasion par le gouvernement Malien. [tweet en anglais]
36jit9wu	(RC = réchauffement climatique)  J'ai pensé à ce sujet à cause d'une discussion hier sur reddit à propos d'une énième vidéo de Janco (où il caressait dans le sens du poil des ingé de grande école), et hasard du calendrier il y avait également hier soir un direct sur thinkerview avec une géologue qui était passionnante (en aparté :  j'ai rarement vu quelqu'un autant connaitre son sujet... et pourtant j'en ai connu des experts). Je m'y connais absolument rien en "mine", mais la nana avait l'air plus que sérieuse et elle est très convaincante quand elle dit que ... ben... on va être dans la merde en termes de métal.    Je ne suis pas un "collapsologue", je ne sais toujours pas ce que ça veut dire effondrement (à quelle intensité ? Ou ça va se passer ? Quels secteurs seront impactés sans adaptation de notre part ?) et j'ai toujours eu du mal avec la forme du discours ultra alarmiste, avec des ellipses explicatives pour qu'on comble les trous par notre imagination. Or... Je ne crois absolument pas à la thèse d'explosion de violence dans notre pays. Peut être à la guerre avec une autre nation, mais pas à la guerre civile qu'on dépeint parfois dans les fictions, nan. Pour la simple et bonne raison qu'on est un pays de vieux. Alors c'est une grosse nouveauté dans l'histoire de l'humanité, mais quand on est un pays de vieux et vieillissant, je vois mal la population prendre les armes pour tuer son voisin de pallier. Globalement, le pays s'est pacifié.   Par contre, dire qu'il n'y aura pas de changement drastique de notre mode de vie durant cette prochaine décennie et pour le reste de notre vie me semble illusoire. Je ne crois absolument pas à la révolution sociale qui nous permettra de changer notre mode de vie de manière coordonnées ni à la révolution technique qui, il faut être honnête, n'arrivera pas. Je veux dire... Cette présidentielle en est la preuve. On ne parle pas d'écologie. On ne parle pas des problématiques de logement. On ne parle pas des problématique industrielles. De notre autonomie en tout genre. Donc en vrai, on ne parle de rien de très important. Et coté technique, même du tout nucléaire ne pourra pas résoudre tous les soucis.   Bref, ça va être la merde, mais faudra bien vivre ces prochaines années dans un monde que j'imagine comme les années 50, donc plutôt rural, où les plus aisés seront surtout des petits bourgeois notables de patelin et, ou tout prend plus de temps, moins de diversité culinaires et de divertissement, plus de coupure de courant, où voyager à l'étranger sera exceptionnel, que même partir en vacances sera un truc de bourgeois etc. Bref, rien de très glamour en vérité. Juste qu'on vivra moins bien sans pour autant se battre pour une conserve de pois chiche.    Et du coup je me demandais si certains d'entre vous avez modifié leur trajectoire de vie. Personnellement, je devais vivre et travailler à Paris, ville que j'adore et où je suis né. Et à un moment, en prenant en compte le RC, je me suis dit que 1 : fallait un travail assez bien rémunéré et 2 : protégé/perenne (dans le sens, assez utile socialement pour exister malgré tout à toute époque). N'étant pas du tout manuel... Le choix a été compliqué.   J'ai pensé sérieusement à l'armée (quoi de mieux que cette institution pour être à la pointe de l'adaptation au RC). Pour diverse raison, ça ne s'est pas fait, et j'ai accepté une mutation, loin de Paris, dans une petite ville de province pour un métier qui sur le papier me plaisait moyen. Ca a été pour moi un énorme choc culturel. Je l'ai digéré, et de plus en plus, je pense que c'était la meilleure décision de ma vie. Alors il y a clairement des inconvénients (je n'ai pas de voitures, et pour certains aspects du quotidien, c'est un peu plus complexe que dans la mégalopole), mais globalement, c'est le bingo gagnant : sécurité, logement à bas prix, circuit court avec des produits de meilleurs qualités. Sans trop d'effort, la ville peut être résiliente au niveau alimentaire en se mettant d'accord avec les agriculteurs aux alentours. La ville est jusqu'il faut en taille pour être citadine en restant "vivable". Parce que j'ai retenu ma leçon d'histoire : en cas de crise, mieux vaut être en ville qu'en campagne. Elle me convenait également parce qu'elle n'était pas au sud, ni en zone inondable, avec des projections d’élévation de la température raisonnable (je crois que j'avais vu du +2°C en moyenne).   J'ai également décidé d'acheter, alors que ce n'était pas dans mes plans. Mais "grand" comparé à ce que je peux me permettre sur Paris, mais pas absolument pas gigantesque pour la simple et bonne raison qu'il faudra chauffer les m². Mon raisonnement, c'est qu'il y aura une fuite des parisiens/lyonnais vers des zones sous doutées, avec un éclatement de la bulle immo sur Paris.   Bref. Parfois je me dis que je délire. J'étais dans un milieu scientifique où des écolo il y en avait à la pelle. Où des gens fan de Servigne me disaient à la pause midi que ouai, ils se projetaient grave dans une cabane au fond des bois où ils vivraient dans une communauté de hippies avec des bac +8. Ben, ils vivent dans de grosse ville (pas forcément Paris, mais Lyon, Toulouse, Londres, c'est la même problématique) dans des emplois de services usuels. Bien entendu, sur internet on lit des histoires de mec qui ont fait HEC qui ne vont plus chez le coiffeur et sont maintenant zadistes. Mais j'ai rarement vu des changements "raisonnables" en lien avec le RC. J'ai l'impression qu'on est tous au courant, que parfois on y pense, mais pour des gros projets de vie, on n'ose pas faire le pas de s'adapter à ce changement à venir (ou en cours).   Du coup, je voulais savoir si j'étais le seul à penser comme ça ou pas. A peser pour chaque décision, si ca sera pertinent dans 10-20 ans.	1643196052.0	sd3qcq	/r/france/comments/sd3qcq/est_ce_que_vous_avez_modifié_votre_trajectoire_de/	Est ce que vous avez modifié votre trajectoire de vie à cause du RC ?
ggeve3ry		1643208299.0	sd7ka7	/r/france/comments/sd7ka7/turkish_taxi_driver_scammed_and_beat_french_woman/	Turkish taxi driver scammed and beat French woman tourist in Istanbul
