author	selftext	created_at	s_id	permalink	title
bxu06b8v		1643859620.0	sj8vha	/r/russia/comments/sj8vha/its_2022_and_youre_invading_ukraine_russian_war/	It's 2022 and you're invading Ukraine - Russian War Songs Playlist
a5m6c47z	Здравствуйте!  I’m looking for some help. As someone who has lived in the USA since I was 9, I’ve become pretty Americanised and detached from my roots and I’m looking to do a little catching up via pop culture. I still remember Russian language, and my main source of info is my mom, but please advise on the following:  What specifically Russian movies or shows are considered classic that many might know and consider pop culture?   Books?   Music?    Thank you. You can also just put your favorites too and I’ll check em out.	1643872620.0	sjcx41	/r/russia/comments/sjcx41/pop_culture/	Pop culture
ae95r13i		1643887369.0	sjgtk6	/r/russia/comments/sjgtk6/как_выглядит_россия_по_сравнению_с_другими/	Как выглядит Россия по сравнению с другими странами по количеству смертей от COVID
hjtcpzel		1643892367.0	sjiap6	/r/russia/comments/sjiap6/vesyolye_rebyata_nikogda_ne_poveryu/	Vesyolye Rebyata — Nikogda Ne Poveryu
2sx2c2ld		1643907529.0	sjo6br	/r/russia/comments/sjo6br/the_sacred_heart_church_or_as_the_locals_call_it/	The Sacred Heart Church, or, as the locals call it, the "Polish Church", has long taken root in Samara, but it still looks impressive!
hwbtreg0		1643911789.0	sjpyh0	/r/russia/comments/sjpyh0/washington_might_create_a_false_flag_to_justify/	Washington might create a False flag to justify the war on Russia
9bsqm7r5		1643918681.0	sjstyb	/r/russia/comments/sjstyb/the_woman_who_entered_the_lake_in_russia/	The woman who entered the lake in Russia disappeared in the lake
7s28j8e5		1643927585.0	sjwhg7	/r/russia/comments/sjwhg7/the_first_frame_of_a_graphic_propaganda_video/	The first frame of a "graphic propaganda video" that Russia is sure to use to invade Ukraine as a false flag has been leaked. In the screenshot of the video, the Crimean bridge is destroyed and the Russian army is already invading Ukraine right now! 😨😱 🐻
7s28j8e5		1643931013.0	sjxuqg	/r/russia/comments/sjxuqg/примеры_того_какого_качества_журналистика/	Примеры того, какого качества журналистика существовала на Дойче Велле Россия.
enrdg	Hey!  I am considering moving to Russia, but I'm a bit confused about financial rights and services.  Can you own stocks of foreign companies in Russia? Which brokers are cheap? Which stocks/ETFs do you own or would recommend?   In addition, are there tax advantaged savings accounts?	1643934553.0	sjz63g	/r/russia/comments/sjz63g/buying_or_owning_securities_in_russia/	Buying or owning securities in Russia
4o7n139	Нам предлагают купить кафе в небольшом городке (с населением 40 тысяч человек) всего за 400 000 рублей.  Эта цена кажется слишком хорошей потому что владелец кафе в месяц зарабатывает 120 000 рублей  чистая прибыль.	1643936023.0	sjzpod	/r/russia/comments/sjzpod/нужен_совет_насчёт_покупке_кафе_в_маленьком_городе/	Нужен совет насчёт покупке кафе в маленьком городе
h6yta5vw		1643941846.0	sk1sra	/r/russia/comments/sk1sra/is_this_sign_russian_asking_for_a_friend/	Is this sign Russian? Asking for a friend.
7qpjs7hz		1643947295.0	sk3mzw	/r/russia/comments/sk3mzw/koschei_the_deathless/	Koschei the Deathless
1b84uc	Question is this picture based?	1643952348.0	sk595c	/r/russia/comments/sk595c/my_burning_hate_for_nato/	My burning hate for NATO
1b84uc		1643952461.0	sk5afu	/r/russia/comments/sk5afu/my_burning_hatred_for_nato/	My burning hatred for NATO
6pdhvn6y		1643962846.0	sk86l3	/r/russia/comments/sk86l3/putin_in_bejing/	Putin in Bejing
11104381		1643974155.0	skb3kr	/r/russia/comments/skb3kr/нет_это_не_нацисты_нет_это_не_1930й_год_это/	Нет - это не нацисты, нет - это не 1930й год. Это Американцы сжигают книги, сегодня
7s28j8e5		1643977721.0	skc4vu	/r/russia/comments/skc4vu/in_kemerovo_a_dog_has_been_sitting_near_the/	In Kemerovo, a dog has been sitting near the entrance to the hospital for three months. Her owner was brought here with a corpovirus, but he did not survive. The dog is waiting. The dog is given food and repeatedly tried to be taken home by other people, but the dog does not want to leave.
ihrckv8m		1643978318.0	skcbh4	/r/russia/comments/skcbh4/us_and_nato_written_reply_to_russia/	US and NATO Written Reply to Russia
ihrckv8m		1643980766.0	skd3ui	/r/russia/comments/skd3ui/us_state_department_busted_fabricating_false_flag/	US State Department busted fabricating false flag in Ukraine
3ifwu0gu		1643991120.0	skh1ok	/r/russia/comments/skh1ok/this_is_what_respect_looks_like/	This is what respect looks like.
2uk7drfp		1643998900.0	skkdpe	/r/russia/comments/skkdpe/is_this_intersection_in_russia_it_looks_like_how/	Is this intersection in Russia? It looks like how some big Russian cities are developed, but I can't find it.
hy5g2klo		1643999598.0	skko1s	/r/russia/comments/skko1s/vaush_calls_for_the_us_to_genocide_russians_with/	Vaush calls for the US to genocide Russians with sanctions.
87s14fn2		1644001776.0	sklji8	/r/russia/comments/sklji8/just_wanted_to_share_with_you_guys_the_president/	Just wanted to share with you guys the "President" watch I got from Russia. Looks amazing honestly. Russians never fail to impress me.
8uuqhrkl	I hope I will nôt get a ban... But what do people of russia thinks about war? Because what I know that many people from my friends dont what a war. We are like? Oh a war again ? Pff we dont want that war because we are people we dont want to get in a fight with same race...	1644002700.0	sklwrr	/r/russia/comments/sklwrr/do_you_want_a_war/	Do you want a war ?
13wtxj		1644006825.0	sknjwq	/r/russia/comments/sknjwq/found_this_awesome_russian_folk_song/	Found this awesome Russian folk song!
ikxidbgw	[Статья в TRTWORLD](https://www.trtworld.com/europe/youtube-facebook-block-ukraine-separatists-accounts-54415)	1644012600.0	skpuxc	/r/russia/comments/skpuxc/youtube_facebook_block_ukraine_separatists/	YouTube, Facebook block Ukraine separatists' accounts
gvbebluc	...	1644017259.0	skrqxo	/r/russia/comments/skrqxo/im_in_tambov_i_just_got_in_here_so_im_in_the/	Im in tambov .i just got in here so im in the students hostel in quarantine so i cant go out .But i need to buy food and water and stuff. Is there delivery companies that can buy things from the store and then i pay them when they bring them to me here ?
6r7n8		1644017586.0	skrvg2	/r/russia/comments/skrvg2/nato_and_russia_a_defensive_expansion/	NATO and Russia: A Defensive Expansion?
3ifwu0gu		1644035842.0	sky8r0	/r/russia/comments/sky8r0/russias_explanation_of_possible_us_logic_behind/	Russia’s explanation of possible U.S. logic behind the “false flag” allegations.
gquf97nw		1644046838.0	sl1fbl	/r/russia/comments/sl1fbl/a_person_wants_to_reserve_a_public_parking_place/	A person wants to reserve a public parking place for himself. Does it look like a grave?
n4z1s		1644058903.0	sl4gfb	/r/russia/comments/sl4gfb/40_unconventional_foods_people_ate_to_survive_in/	40 Unconventional Foods People Ate to Survive in Soviet Russia: Everything I grew up on is "Unconventional"?
3kd28a76	Let's say you know the bar is selling edibles, how do you ask them that in Russian?	1644059368.0	sl4kyb	/r/russia/comments/sl4kyb/how_do_you_ask_for_edibles_in_russian/	How do you ask for edibles in russian?
8me51rzs		1644072427.0	sl8l3u	/r/russia/comments/sl8l3u/sambo_is_censored_on_tiktok_yet_no_other_martial/	Sambo is censored on tiktok yet no other martial art is
f5c5ixpi		1644082342.0	slcdnn	/r/russia/comments/slcdnn/this_world_was_not_invented_by_us_the_first_video/	"This world was not invented by us." The first video of the project "10 songs of nuclear cities". Territory of Culture of Rosatom
f5c5ixpi		1644082452.0	slcf7z	/r/russia/comments/slcf7z/this_world_was_not_invented_by_us_the_first_video/	"This world was not invented by us." The first video of the project "10 songs of nuclear cities". Territory of Culture of Rosatom
b1l89goi	Western Europe is full of agitated, paranoid and psychologically damaged people.  The US seems almost one step from descending into chaos these days if one trusts the media reporting.  What's the situation in big cities in Russia these days compared to pre COVID? (specifically Moscow and PSB)	1644098777.0	sli3i2	/r/russia/comments/sli3i2/how_is_the_atmosphere_in_moscow_and_spb_compared/	How is the atmosphere in Moscow and SPB compared to pre COVID?
a6ybgdi4	The title explains my question	1644102237.0	sljdur	/r/russia/comments/sljdur/can_defectors_join_the_russian_military/	Can defectors join the Russian military?
3ifwu0gu		1644103250.0	sljqzs	/r/russia/comments/sljqzs/comedian_trevor_noah_says_he_understands_russias/	Comedian Trevor Noah says he understands Russia’s concerns with NATO expansion.
9lf88x5r	Hello everyone, let me keep it short. I am a Dutch citizen with a Russian mother who was born in soviet Russia but moved to Ukraine still in soviet times, and when the soviet union fell she was left with an ukrainian passport and no Russian passport. She now also has a Dutch passport. I am interested to know how it would be possible for me to get a Russian passport. I don't live in Russia and don't speak Russian but I'm learning. Thanks for any answer.	1644111171.0	slmjd7	/r/russia/comments/slmjd7/can_i_get_a_russian_passport/	Can I get a Russian passport?
cf516lio		1644112057.0	slmto5	/r/russia/comments/slmto5/is_this_what_americans_are_being_told/	Is this what Americans are being told?
huu0zjhj		1644112346.0	slmx1z	/r/russia/comments/slmx1z/glad_all_westerners_arent_brainwashed_haha_this/	Glad all westerners aren’t brainwashed haha... This guy made a random argument dishonoring what the red army achieved, on a YouTube channel called the Infographics show, on a vid made about Japanese subs in WWII
ihrckv8m		1644113557.0	slnbvm	/r/russia/comments/slnbvm/exploring_soviet_era_abandoned_buildings_in/	Exploring SOVIET era abandoned buildings in beautiful Spassk-Dalny, Russia with Natasha
3ifwu0gu		1644128875.0	slpxc3	/r/russia/comments/slpxc3/expect_massive_layoffs_if_russia_fails_to_invade/	Expect massive layoffs if Russia fails to invade.
fsl6akie		1644247737.0	smsv3y	/r/russia/comments/smsv3y/nato_vs_russian_army_who_has_the_most_powerful/	NATO vs Russian Army | Who Has The Most Powerful Army!?
3ifwu0gu		1644248120.0	smt09e	/r/russia/comments/smt09e/a_good_read/	A good read.
86rcqgpc		1644248433.0	smt4es	/r/russia/comments/smt4es/how_is_the_west_so_brainwashed/	How is the west so brainwashed ?
glc3l365		1644249918.0	smtp1d	/r/russia/comments/smtp1d/for_the_first_time_in_53_years_russian_ski/	For the first time in 53 years, Russian Ski Jumpers win a medal in the mixed team event!🥈🇷🇺
