author	selftext	created_at	s_id	permalink	title
h42vuo95		1643457972.0	sfgu6o	/r/russia/comments/sfgu6o/a_hard_to_swallow_pill_for_all_trigger_happy/	A "HARD TO SWALLOW PILL" FOR ALL TRIGGER HAPPY INDIVIDUALS AND TROLLS ONLINE
hid63kgr		1643475266.0	sfm731	/r/russia/comments/sfm731/how_long_after_russias_initial_intrusion_into/	How long after Russia’s initial intrusion into Ukraine will they take the East over and reach The Dnieper River?
a20c0hgj	Hi,  Can someone share a link to some serious background information / context about the Ukraine tensions told from a russian or just not western perspective.   As per my understanding there has been some serious involvement from the West to frame the current Ukraine government. I have even heard about nazi sympathies. But any western story is all about how aggressive Putin is..   Thanks in advance.	1643475424.0	sfm95q	/r/russia/comments/sfm95q/ukraine/	Ukraine
2pj56u4d		1643481505.0	sfoib5	/r/russia/comments/sfoib5/раз_уж_в_саб_начала_проникать_политота_почему_бы/	Раз уж в саб начала проникать политота, почему бы и нет
a24t1olq		1643493234.0	sfspx6	/r/russia/comments/sfspx6/justin_trudeau_deserves_the_death_sentance_for/	JUSTIN TRUDEAU DESERVES THE DEATH SENTANCE FOR TREASON AGAINST CANADA.
asuedee3		1643494938.0	sftctl	/r/russia/comments/sftctl/and_not_only_in_france/	And not only in France
8hfji08v		1643503815.0	sfwij4	/r/russia/comments/sfwij4/i_got_into_the_russophobic_discord_somehow_and/	I got into the russophobic discord somehow and here are some of the shenanigans In it
3lxax		1643509969.0	sfyk3g	/r/russia/comments/sfyk3g/whats_the_word_for_a_queef_in_russian/	What’s the word for a queef in Russian?
7s28j8e5		1643524636.0	sg2zfj	/r/russia/comments/sg2zfj/netflix_doesnt_know_about_stalingrad/	Netflix doesn't know about Stalingrad
9cdtd		1643537529.0	sg65tz	/r/russia/comments/sg65tz/russias_foreign_agent_law_outlawed_but_not/	Russia’s Foreign Agent Law: Outlawed But Not Silenced
6pdhvn6y		1643540816.0	sg6z72	/r/russia/comments/sg6z72/again_more_pieces_of_antirussia_propaganda_from/	Again more pieces of anti-russia propaganda from France and the United Kingdom.
7s28j8e5		1643544626.0	sg7xjq	/r/russia/comments/sg7xjq/very_cute_plump_pallass_cat_in_the_russian_zoo/	Very cute plump Pallas's Cat in the Russian zoo
2sx2c2ld		1643547273.0	sg8lm4	/r/russia/comments/sg8lm4/misha_didnt_buy_it/	Misha didn't buy it.
2sx2c2ld		1643547943.0	sg8sjv	/r/russia/comments/sg8sjv/the_americans_hold_russia_not_so_much_as_an_enemy/	The Americans hold Russia not so much as an enemy, but as a competitor. This is indicated by a public opinion poll conducted by the Pew Research Center on January 10-17. In general, 49% of US citizens see us as a competitor and 41% as an enemy. And another 7% of weirdos call us a partner.
10jg8ipm	I am curious. Does the media talk as if war was gonna happen or are things relaxed and they don't see it as a possibility?	1643553099.0	sgadgu	/r/russia/comments/sgadgu/is_there_propaganda_for_war_in_russia/	Is there propaganda for war in Russia?
37dl5wdu		1643558731.0	sgcasy	/r/russia/comments/sgcasy/its_just_propaganda_at_this_point/	It's just propaganda at this point
j4dy8s8k	Greetings,   21 years old, male, from Serbia. Just finished his airline transport pilots license, currently waititfor Corona to loosen up and for airlines to start hiring again.   There is literally not a single thing in this world that I want more than to live in Russia. I've been in love with the country and people from Russia ever since I was a kid. I always make a joke with my mother, I aske her: "Mom, why didn't you give bith to me in Russia?" and her response is usually: "Next time I will!". Russian women are absolutely beautiful, I would love to get married to a Russian woman one day. Russian brutalism and buildings are not ugly to me, I find it very interesting. Russian history, Soviet history, WW2, WW1, Russian revolution I've read about all of it, watched hundreds of hours of YouTube videos on thise subjects. I feel like Serbs and Russians are very close in culture, way of life, way of thinking, social values, struggles, wars, inner politic problems, in everything.  Sorry for longer post, sending much love to all Russians and I hope that I'll soon live there!	1643549050.0	sg9403	/r/russia/comments/sg9403/there_is_nothing_that_i_want_more_than_to_move_to/	There is nothing that I want more than to move to Russia.
bskoxr1d		1643562228.0	sgdj3h	/r/russia/comments/sgdj3h/this_little_guy_is_the_winter_white_dwarf_hamster/	This little guy is the winter white dwarf hamster, native to the meadows of Siberia among many other places.
hoj6gdz7	So basically in 1999, my  dad who has Russian citizenship moved from Russia where he was living to the US. He worked with a Russian guy whom he met before in a logistical oil company which did business in Russia. Business was good until 2015, when oil started losing value. And when the pandemic hit the business nearly lost all its value. He tried to find work for other logistic jobs in the US but nobody wants to hire him because he’s too old, he’s in his late 50’s, and oil is also dead and not a lot of logistical jobs are hiring.  If he moves to Russia, will he find good work there? He was 30 years experience as an engineer in freezing/cryogenics and also in the logistical area. He can’t find any work in the US and he needs to make money. Will he find good work in Russia?  Итак, в основном в 1999 году мой отец-казах, имеющий российское гражданство, переехал из России, где он жил, в США. Он работал с русским парнем, которого встречал раньше, в логистической нефтяной компании, которая вела бизнес в России. Бизнес шел хорошо до 2015 года, когда нефть начала терять в цене. А когда разразилась пандемия, бизнес почти потерял всю свою ценность. Он пытался найти работу на других должностях в сфере логистики в Соединенных Штатах, но никто не хочет его нанимать, потому что он слишком стар, ему за 50, а нефть тоже мертва, и не так много людей нанимается на работу в сфере логистики.  Если он переедет в Россию, найдет ли он там хорошую работу?   У него был 30-летний опыт работы инженером в области замораживания / криогеники, а также в области логистики. Он не может найти работу в США, и ему нужно зарабатывать деньги. Найдет ли он хорошую работу в России?	1643562861.0	sgdrbw	/r/russia/comments/sgdrbw/will_my_dad_who_works_in_the_oil_industry_make/	Will my dad who works in the oil industry make more money in Russia if he moves there?
12092z	I have been in Russia for four days now, currently at my second hotel, with the next one already booked. So far none of them will register me. The one I'm currently at hasn't even heard of this, and I had to find information online to show them that it was necessary.  I know it's necessary to register within seven days, but what happens if no place will do it for me? Will the police accept booking reservations at checkpoints?	1643565000.0	sgej9g	/r/russia/comments/sgej9g/what_happens_if_youre_unable_to_register_your_visa/	What happens if you're unable to register your visa?
cp8gmnon		1643565500.0	sgepp5	/r/russia/comments/sgepp5/the_ussrs_plan_to_create_a_perfect_man_historical/	The USSR's Plan To Create A Perfect Man | Historical documentary
fb071	What effect do sanctions from the US and UK have if any?	1643567182.0	sgfc5b	/r/russia/comments/sgfc5b/with_russia_threatening_war_are_they_not_already/	With Russia threatening war, are they not already assuming complete loss of trade with NATO countries, undermining the effect of economic sanctions?
294plha		1643580677.0	sgkg3y	/r/russia/comments/sgkg3y/just_an_average_russian_kid/	Just an average Russian kid
11104381		1643583736.0	sgljnu	/r/russia/comments/sgljnu/this_is_the_kind_of_people_russia_has_to_deal_with/	This is the kind of people Russia has to deal with
thqw8		1643586571.0	sgmivs	/r/russia/comments/sgmivs/yeltsin_will_be_the_new_head_mod_of_rrussia_we/	Yeltsin will be the new head mod of /r/Russia, we heard the criticism of western redditors so change will come to the sub, He will manage the transition
ef5xv714	sing along btw	1643594814.0	sgpeu6	/r/russia/comments/sgpeu6/союз_нерушимый_республик_свободных/	Союз нерушимый республик свободных....
ex51jrbb		1643603330.0	sgs9y7	/r/russia/comments/sgs9y7/russian_beat_down_dont_mess_with_russia/	Russian Beat Down 🇷🇺👊 DON'T MESS WITH RUSSIA
5oqml55s		1643626871.0	sgyorv	/r/russia/comments/sgyorv/russian_troops_near_the_border_of_ukraine/	Russian troops near the border of Ukraine
2ky4bft7		1643632130.0	sh04wx	/r/russia/comments/sh04wx/til_anatoly_sobchak_was_dumbstruck_when_he_was/	TIL Anatoly Sobchak was dumbstruck when he was told that Putin is being groomed to become the next President of Russia (6 min)
19z1gibx		1643633018.0	sh0ed4	/r/russia/comments/sh0ed4/how_to_make_a_russian_person_eat/	How To Make A Russian Person Eat
7s28j8e5		1643636741.0	sh1lcj	/r/russia/comments/sh1lcj/advertisement_in_the_russian_newspaper_of_1900/	Advertisement in the Russian newspaper of 1900. The inscription on the right man "I eat Hercules porridge." The inscription on the left man "And I'm not."
7s28j8e5		1643636823.0	sh1m9p	/r/russia/comments/sh1m9p/advertisement_in_the_russian_newspaper_of_1900/	Advertisement in the Russian newspaper of 1900. The inscription on the right man "I eat Hercules porridge." The inscription on the left man "I'm not."
14gq2v	I will visit St. Petersburg next week and I have no idea what to do about eating and visiting places. I'm very upset. I just learnt that I need a QR Code for the entrances. I'm vaccinated with pfizer but Russia asks for russian vaccine in order to get a QR Code. So, should I make a pcr test every 3 days? If so, can I get a new QR Code every 72 hrs? Is this the only way really? Help me please	1643640717.0	sh2zwh	/r/russia/comments/sh2zwh/no_qr_code_for_tourists/	No QR Code for Tourists?
7ir63pi	I read that 400,000 Russians immigrated to the US but only 600 Americans immigrated to Russia last year. Is it difficult for Americans to make the move visa wise?	1643649704.0	sh6l8i	/r/russia/comments/sh6l8i/is_it_hard_to_immigrate_to_russia_from_the_us/	Is it hard to immigrate to Russia from the US?
2sx2c2ld		1643653994.0	sh8dg7	/r/russia/comments/sh8dg7/activity_of_reconnaissance_aircraft_of_nato_and/	Activity of reconnaissance aircraft of NATO and Sweden along the borders of Russia, Belarus and the self-proclaimed people's republics of Luhansk and Donetsk during the period from 18 to 30 January.
hzehpba6	I have a story I want to share with all of you. So please bear with me if this will be a long post.  A dysfunctional sect foster family adopted me from the U.S. because my birth mom was only 17 years old, and she couldn't take care of me. Was I mad at her? No, I couldn't imagine myself as a mother who was part of a lost generation to a young group of teenagers during the collapse of the USSR. To hell with politics sometimes, right?   My history of living in the U.S. is almost as horrible as anyone can imagine, so I ran away when I was 15. I later got a full scholarship to university and graduated. Until recently, I finally had the finances that allowed me to travel. But, of course, I always wanted to go back to Russia for one reason - to find my mother and let her know that I was all right and that if she ever needed my help, I would readily provide it. Some people told me that I had to move on with my life. I didn't believe that principle because no mother and child should ever be separated. And that I had this primal wound, and I always wondered where my personality traits came from. For this reason, I had to come back with my elementary level of Russian.   However, when I arrived in a small town nine hours southeast of Moscow, I was born. According to the adoption papers, I was supposed to navigate the address where she lived. But, instead, I happened to walk up to my great-grandfather, who lived there alone now. He was about 94 years old and in great shape. He understood my situation and gave me a phone number that led directly to my mother's sister. For some reason, I wondered why he didn't have my mother's phone number in the first place, but he told me to find out for myself.  I immediately contacted my mother's sister and told her about myself. She, of course, was shocked and confirmed that we would meet the following day.   This was not what I wanted to hear, but unfortunately, my mother disappeared without any trace. According to my aunt and my mother's other sister, most likely, she had been abducted. Even better, I never knew I had a younger brother who is five years younger than me and looks a lot like me! Long story short, when my mother disappeared, my aunt jumped in adopting him. He is such a polite teenager. This makes me so happy, and gains mad respect for my aunt. You may ask why my aunt didn't adopt me from the beginning. Understand, she was also just a teenager.   I got along very well with the whole family, and my brother and I have similar personalities, which just struck me.   That being said, if any of you are adoptees, I would advise everyone to reunite with their families because you never know. Maybe they are waiting for you. My aunt knew about me, and technically she always wondered if we would ever meet again, and we did finally after twenty-two years.   Now we all have peace of mind and are happy from there. I finally have a family that I always wanted to have. Both of my aunts have beautiful young daughters, and they are intelligent for their young age. Even better is that my appearance is very similar to my mother's, unlike my brother's. So my aunts are relieved as if they have finally seen my mother in many years. They told me they were finally at peace in their souls.   Lastly, Russia is truly a great place with infinitely generous neighbors. I would absolutely go back when things calmed down to be near my family again.   Go Russia, Fuck USA	1643657443.0	sh9su1	/r/russia/comments/sh9su1/reunited_with_my_biological_family_i_found_out/	Reunited with My Biological Family & I Found Out That I Have a Younger Brother!!!
bd7ua2j6	I heard that many universities In Russia are still sending invites for students or the process to register is still open , I don't want to waste this year waiting till next September and I heard students can study from now if they register I'm not sure and I'd like some info and universities that still have enrolment currently.	1643660369.0	shb16l	/r/russia/comments/shb16l/any_russian_preparatory_year_at_university_still/	Any Russian preparatory year at university still accepting students?
e5j1koem		1643708335.0	shr2w0	/r/russia/comments/shr2w0/im_surprised_whenever_someone_sneezes_isnt_his/	Im surprised whenever someone sneezes isn't his fault at this point
7s28j8e5		1643708700.0	shr64y	/r/russia/comments/shr64y/accidentally/	"Accidentally" 🙄
9v1wm4k3	As far as I know, there are Russian companies that make very good trucks. But why don't they invest in passenger cars as well?	1643715663.0	sht0by	/r/russia/comments/sht0by/why_hasnt_russia_invested_in_the_car_industry/	Why hasn't Russia invested in the car industry?
ewqavmu9	I suppose there are no actual information, but can we hope for this summer?	1643721363.0	shupd6	/r/russia/comments/shupd6/when_will_russia_reopen_for_tourists/	When will Russia reopen for tourists?
12cqbf8q	I think its bulgarian because of what google says but im not sure what it means, can anyone help translate this  Bratushkanishkalabadjanadgavanic	1643745348.0	si3wx1	/r/russia/comments/si3wx1/can_someone_help_translate_this/	Can someone help translate this
2sx2c2ld		1643746951.0	si4k9h	/r/russia/comments/si4k9h/kizhi_pogost_is_a_historical_site_dating_from_the/	Kizhi Pogost is a historical site dating from the 17th century on Kizhi island on Lake Onega in the Republic of Karelia.
2sx2c2ld		1643750060.0	si5tb8	/r/russia/comments/si5tb8/international_snowman_festival_snow_and_ice/	International Snowman Festival "Snow and Ice"
2sx2c2ld		1643751108.0	si68of	/r/russia/comments/si68of/unpacking_of_the_painting_the_appearance_of/	Unpacking of the painting "The Appearance of Christ to the People" in the Tretyakov Gallery after the return of cultural values from the evacuation, 1944
93mpzjun	Hello everyone, I would like to have some suggestions from you for my Russian language teacher's birthday gift, but since I'm Mexican I know cultural differences could mess up things. She is in her late 20's, a master's student, single(I think),  from Borzya but she's living in Peter.  I had been taking classes twice a week with her since 2020.  From my narrow perspective, I was thinking of gifting the best tequila or mezcal from here but I don't like to enforce my culture. I was thinking of an Ozon's gift card or even a money bonus. I really want to stay neutral and not cause any trouble, I would like to show my appreciation for the relationship without overwhelming her.  &#x200B;  I really appreciate any help you can provide.	1643751777.0	si6igx	/r/russia/comments/si6igx/nice_gift_for_a_russian_teacher/	Nice gift for a Russian teacher
2sx2c2ld		1643752318.0	si6q5v	/r/russia/comments/si6q5v/ziggurat_house_in_novosibirsk_inspired_by_the/	Ziggurat house in Novosibirsk. Inspired by the architecture of ancient stepped temples (ziggurats), the creators of the project reproduced the pyramidal structure by shifting floors from the courtyard.
2sx2c2ld		1643757188.0	si8ni0	/r/russia/comments/si8ni0/contrasts_of_vladivostok/	Contrasts of Vladivostok.
dw6kjdmn		1643758800.0	si98vh	/r/russia/comments/si98vh/winter_pyatigorsk/	Winter Pyatigorsk.
bd7ua2j6	I heard that many universities In Russia are still sending invites for students or the process to register is still open , I don't want to waste this year waiting till next September and I heard students can study from now if they register I'm not sure and I'd like some info and universities that still have enrolment currently.	1643660369.0	shb16l	/r/russia/comments/shb16l/any_russian_preparatory_year_at_university_still/	Any Russian preparatory year at university still accepting students?
9v1wm4k3	As far as I know, there are Russian companies that make very good trucks. But why don't they invest in passenger cars as well?	1643715663.0	sht0by	/r/russia/comments/sht0by/why_hasnt_russia_invested_in_the_car_industry/	Why hasn't Russia invested in the car industry?
ewqavmu9	I suppose there are no actual information, but can we hope for this summer?	1643721363.0	shupd6	/r/russia/comments/shupd6/when_will_russia_reopen_for_tourists/	When will Russia reopen for tourists?
2sx2c2ld		1643746951.0	si4k9h	/r/russia/comments/si4k9h/kizhi_pogost_is_a_historical_site_dating_from_the/	Kizhi Pogost is a historical site dating from the 17th century on Kizhi island on Lake Onega in the Republic of Karelia.
2sx2c2ld		1643750060.0	si5tb8	/r/russia/comments/si5tb8/international_snowman_festival_snow_and_ice/	International Snowman Festival "Snow and Ice"
2sx2c2ld		1643751108.0	si68of	/r/russia/comments/si68of/unpacking_of_the_painting_the_appearance_of/	Unpacking of the painting "The Appearance of Christ to the People" in the Tretyakov Gallery after the return of cultural values from the evacuation, 1944
93mpzjun	Hello everyone, I would like to have some suggestions from you for my Russian language teacher's birthday gift, but since I'm Mexican I know cultural differences could mess up things. She is in her late 20's, a master's student, single(I think),  from Borzya but she's living in Peter.  I had been taking classes twice a week with her since 2020.  From my narrow perspective, I was thinking of gifting the best tequila or mezcal from here but I don't like to enforce my culture. I was thinking of an Ozon's gift card or even a money bonus. I really want to stay neutral and not cause any trouble, I would like to show my appreciation for the relationship without overwhelming her.  &#x200B;  I really appreciate any help you can provide.	1643751777.0	si6igx	/r/russia/comments/si6igx/nice_gift_for_a_russian_teacher/	Nice gift for a Russian teacher
2sx2c2ld		1643752318.0	si6q5v	/r/russia/comments/si6q5v/ziggurat_house_in_novosibirsk_inspired_by_the/	Ziggurat house in Novosibirsk. Inspired by the architecture of ancient stepped temples (ziggurats), the creators of the project reproduced the pyramidal structure by shifting floors from the courtyard.
2sx2c2ld		1643757188.0	si8ni0	/r/russia/comments/si8ni0/contrasts_of_vladivostok/	Contrasts of Vladivostok.
bd7ua2j6	I heard that many universities In Russia are still sending invites for students or the process to register is still open , I don't want to waste this year waiting till next September and I heard students can study from now if they register I'm not sure and I'd like some info and universities that still have enrolment currently.	1643660369.0	shb16l	/r/russia/comments/shb16l/any_russian_preparatory_year_at_university_still/	Any Russian preparatory year at university still accepting students?
9v1wm4k3	As far as I know, there are Russian companies that make very good trucks. But why don't they invest in passenger cars as well?	1643715663.0	sht0by	/r/russia/comments/sht0by/why_hasnt_russia_invested_in_the_car_industry/	Why hasn't Russia invested in the car industry?
ewqavmu9	I suppose there are no actual information, but can we hope for this summer?	1643721363.0	shupd6	/r/russia/comments/shupd6/when_will_russia_reopen_for_tourists/	When will Russia reopen for tourists?
2sx2c2ld		1643746951.0	si4k9h	/r/russia/comments/si4k9h/kizhi_pogost_is_a_historical_site_dating_from_the/	Kizhi Pogost is a historical site dating from the 17th century on Kizhi island on Lake Onega in the Republic of Karelia.
2sx2c2ld		1643750060.0	si5tb8	/r/russia/comments/si5tb8/international_snowman_festival_snow_and_ice/	International Snowman Festival "Snow and Ice"
2sx2c2ld		1643751108.0	si68of	/r/russia/comments/si68of/unpacking_of_the_painting_the_appearance_of/	Unpacking of the painting "The Appearance of Christ to the People" in the Tretyakov Gallery after the return of cultural values from the evacuation, 1944
93mpzjun	Hello everyone, I would like to have some suggestions from you for my Russian language teacher's birthday gift, but since I'm Mexican I know cultural differences could mess up things. She is in her late 20's, a master's student, single(I think),  from Borzya but she's living in Peter.  I had been taking classes twice a week with her since 2020.  From my narrow perspective, I was thinking of gifting the best tequila or mezcal from here but I don't like to enforce my culture. I was thinking of an Ozon's gift card or even a money bonus. I really want to stay neutral and not cause any trouble, I would like to show my appreciation for the relationship without overwhelming her.  &#x200B;  I really appreciate any help you can provide.	1643751777.0	si6igx	/r/russia/comments/si6igx/nice_gift_for_a_russian_teacher/	Nice gift for a Russian teacher
2sx2c2ld		1643752318.0	si6q5v	/r/russia/comments/si6q5v/ziggurat_house_in_novosibirsk_inspired_by_the/	Ziggurat house in Novosibirsk. Inspired by the architecture of ancient stepped temples (ziggurats), the creators of the project reproduced the pyramidal structure by shifting floors from the courtyard.
2sx2c2ld		1643757188.0	si8ni0	/r/russia/comments/si8ni0/contrasts_of_vladivostok/	Contrasts of Vladivostok.
b98mmi2t	By that I mean if I put in a word like **Слушать** and it would give me  Я-**Слушаю**  ТЫ-.....  ОН-.....  МЫ-.....  ВЫ-.....  ОНИ-.....	1643784315.0	sihwno	/r/russia/comments/sihwno/is_there_a_site_that_automatically_gives_you_a/	Is there a site that automatically gives you a word personalization?
9162t		1643794232.0	sikhpm	/r/russia/comments/sikhpm/a_great_joke_from_the_american_tv_show_saturday/	A great joke from the American TV show “Saturday Night Live.” During their show from last weekend, the made a parody of the commercials of the insurance company “State Farm,” whose name was cleverly translated as «колхоз». Unfortunately, this joke is probably not understood by the audience))
btshu		1643808202.0	siola8	/r/russia/comments/siola8/blyat/	Blyat
5xnulsui	I'm not Russian, please let me know what are your thoughts about Lobachevsky university.	1643811008.0	sipmwr	/r/russia/comments/sipmwr/is_lobachevsky_university_good/	Is Lobachevsky University good?
dhufr		1643816503.0	sirpg0	/r/russia/comments/sirpg0/pentagon_to_deploy_3000_troops_to_europe_as/	Pentagon to deploy 3,000 troops to Europe as tensions spike with Russia over Ukraine
c9spfpz1		1643840503.0	sj1s55	/r/russia/comments/sj1s55/this_is_like_cuban_missile_crisis_all_over_again/	This is like Cuban missile crisis all over again. Now Russia probably isn’t going to move any troops until the US withdraws it’s troops.
d13oa749		1643842018.0	sj2eib	/r/russia/comments/sj2eib/yugo_cars_sales_training_video_1988/	Yugo Cars Sales Training Video- (1988)
8kdwzbtf		1643850068.0	sj5igh	/r/russia/comments/sj5igh/pretty_much/	Pretty much
