author	selftext	created_at	s_id	permalink	title
z9bon	Hi, I'm not russian, and I was reading somewhere that russians, especially university students in big cities, usually take noopept as a supplement to help with their studies.  &#x200B;  I was wondering if this is true, and if you have taken / have any friends that are taking it, or if it's true that up to 50% of students take it.	1642631247.0	s82gx9	/r/russia/comments/s82gx9/hi_question_about_noopept_use_in_russia/	Hi, question about noopept use in Russia
fdfb1d4o		1642641686.0	s86c3i	/r/russia/comments/s86c3i/as_an_indian_it_makes_me_furious_and_fucking/	As an Indian it makes me furious and fucking tired of the constant American Propaganda and war mongering by NATO. India is unfortunately unaware and leaning west. What would be something we can do to counter this propaganda?
q2eoay7	A decent post was just posted here from a German, that I had very similar feelings about.   He was talking about his media and his countries relations with yourselves and as a Brit I feel exactly the same and just embarrassed really.   The media is absolutely terrible here too, it's mostly anti Russia propaganda, But I hope you know there's more brits like me who know it's bullshit, and feel the same, and don't want to go war with Russia, or you guys at all.   The media just make the most noise but they don't speak for the real people here.( Yes there's alot of brainwashed who follow the media without question) , but luckily at the moment they are not the majority!   Obviously we do support NATO in a sense, but that doesn't mean they are right in what they are doing regarding your country at the moment.   I've asked everyone I know, family, friends, strangers there is alot of conversation about it here.   I can tell you - we are embarrassed about recent actions by NATO. We think they should leave neighbouring countries to Russia the fuck alone. And certainly stay out of it. Its absolutely right to criticise NATO for their expansionist policies in the last years.   We can't even defend our own border from rubber dinghies, yet we send anti tank missile launchers to Ukraine????   the number of people waking upto this shit is only growing though.   It saddens me because Russia and UK have alot of shared history, and I'd love for our countries to go back to better relations.   Our allegiances helped to finally defeat Napoleon and later Hitler. Outside of conflict, across the centuries we shared technology, medicine and culture. During the 18th Century Russia and Britain were deeply tied. Between 1704 to 1854, from age of Peter the Great through Catherine the Great and well into the 19th Century the British were to be found as admirals, generals, surgeons, and architects at the highest level of the Russian Court. The father of the Russian Navy – one Samuel Greig – was born in Inverkeithing in Fife.  I also like Ukrainian people and you guys also have shared history. This is all a shame and a complete mess now. It's not Russian citizen's fault, UK citizen's fault, or Ukraine citizen's fault.   I hope there is no conflict, and I know Putin is not a Saint, I'm not saying I support him or not. But I look at facts and actions only.   And from what I've seen, and I've followed it very closely - Putin has tried all he can to avoid it through fair diplomatic means. This has been going on for years now, And it just hasn't worked, but its not actually his fault though. It is NATO, US, just completely unreasonable, at EVERY TURN.   Not even willing to go halfway or anything, so what is he expected to do? His duty is with his civilization first. (And that's something everyone I speak to here in England respects about him by the way) = at least he seems to put his country first. Like all REAL leaders should do.  Did USA let cuba build missiles there ? No Lol.   Absolute joke!   So yeah just wanna say cheers from the UK. Don't worry about our media here, because most of us see through the war mongering sensationalist bullshit!	1642978658.0	sb6hf8	/r/russia/comments/sb6hf8/also_sick_about_ukrussia_relation/	Also Sick about UK/Russia relation
5mzbhvto		1642980672.0	sb78fw	/r/russia/comments/sb78fw/what_are_peoples_thoughts_on_пошлая_молли_are/	What are peoples thoughts on Пошлая Молли? Are they popular in Russia? I just got into then a couple months ago and just wanted to know everyones thoughts.
2sx2c2ld		1643025202.0	sbkhvy	/r/russia/comments/sbkhvy/permafrost_spreading_in_russia/	Permafrost spreading in Russia
gvbebluc	As a female foreign student in russia what can i work  . Thanks in advance 🌸	1643099073.0	sc8wcb	/r/russia/comments/sc8wcb/im_a_1st_year_medical_student_in_russia_tambov/	Im a 1st year medical student in russia (tambov state ) . I cant speak russian yet but i speak english...arabic and french . What can i work as a foreign student do u have any ideas ?
ibenl2x7	Hello warm people of Russia, i am a southern Italian and since even here american "wokeness" is being slowly exported i was curious about the situation in Russia. I love my culture, my traditions and my heritage and i am very scared about what seems to be the newest and worst U.S big export ever. The big cities in the north like Milan are already American colonies, basically. How is it the situation in Russia? And is there a big difference in smaller and bigger urban cities?	1643187831.0	sd1plm	/r/russia/comments/sd1plm/wokeness_in_russia/	"Wokeness" in Russia
3l8keyzz		1643213484.0	sd9ih8	/r/russia/comments/sd9ih8/aw_shit_here_we_go_again_facepalm/	Aw shit, here we go again *facepalm*
tyngb	Hey, hope you’re doing well. Something has been on my mind for quite some time. That being wokeness. Here in the US, it’s rampant. It’s to the point it gives me migraines. It’s beyond annoying. I’m curious, how much, if any wokeness is there in Russia? Wish you have a good day/night.	1643217454.0	sdb22k	/r/russia/comments/sdb22k/is_there_wokeness_in_russia/	Is there wokeness in Russia?
g3lxn056		1643217666.0	sdb519	/r/russia/comments/sdb519/bloomberg_сообщил_о_передаче_штатами_ответов/	Bloomberg сообщил о передаче Штатами ответов России на предложения по безопасности
8gnxi6wt		1643222079.0	sdcwc0	/r/russia/comments/sdcwc0/so_hows_russia_feel_ab_this/	So how’s Russia feel ab this?
dcgmn0h2		1643222566.0	sdd2sr	/r/russia/comments/sdd2sr/the_empire_strikes_back/	The Empire Strikes Back
i02skilu	Hello, Im in a long distance relationship - my girlfriend lives in Moscow and I want to buy her a spa/massage gift card for Valentines Day.  What places would you recommend?     Thanks!	1643221425.0	sdcn1h	/r/russia/comments/sdcn1h/moscow_massage_spa_recommendation/	Moscow Massage / Spa Recommendation
1yq62rsp	hi, random question: do you know any romanian people living in Siberia?	1643214966.0	sda37d	/r/russia/comments/sda37d/romanians_in_siberia/	Romanians in Siberia
a71thedt		1643223141.0	sddarg	/r/russia/comments/sddarg/map_for_russia/	Map for Russia
7rgxp0ah	I hate it when Russian or foreign media talk about bad Americans/Russians and that the war is about to start and "they are provoking us!!" GUYS, it's just two countries that are artificially creating a crisis in order to measure their ~~dicks~~ military power. Nobody wants to start a third world because of Ukraine.  (I can answer in Russian)	1643235127.0	sdhy1h	/r/russia/comments/sdhy1h/i_hate_alarmists_and_propagandists/	I hate alarmists and propagandists.
1xy87ghw		1643245347.0	sdlmph	/r/russia/comments/sdlmph/just_in_case/	Just in case :)
4dvhyl9z		1643251871.0	sdnv39	/r/russia/comments/sdnv39/im_assuming_that_most_of_you_are_average_russians/	I'm assuming that most of you are average Russians, so I want to know what does the average Russian think of the Average American?
9xj3ampz		1643268489.0	sdst9f	/r/russia/comments/sdst9f/all_i_gotta_say_is_dont_let_the_people_at_the_top/	All I gotta say is 🇺🇸+🇷🇺= ❤️ don’t let the people at the top separate us. Can you imagine how strong we’d be together?! (Btw I have ZERO idea what my flair means)
7bnfsa0j	What are your opinions on finn's coming to Russia to refuel their cars? >Russia 0.63€/L Finland 2€/L.  And is there anything you would like to say about Sanna-Marin? I'm having a meet-conversarion with her this Friday at 10am.	1643274282.0	sdu72c	/r/russia/comments/sdu72c/finnish_people_coming_to_refuel_in_your_country/	Finnish people coming to refuel in your country
4guemwiw	I am planning to masters in Russia and trying to understand the education system in Russia. 2 things I am trying to understand. If you do Masters in US, after completing successfully your masters you get Degree certificate and a degree transcript.  I was told that in Russia, you get Degree certificate and something called 'appendix', which is equivalent to a transcript in USA and has details of the completed courses and grades. Is it correct? And is that all list of documents you get after successful completion of masters degree or am I missing anything?	1643276926.0	sdusgb	/r/russia/comments/sdusgb/trying_to_understand_the_russian_education_system/	Trying to understand the Russian education system from the perspective of an American
g6zyqwh1		1643278685.0	sdv7yu	/r/russia/comments/sdv7yu/save_amur_tigers_russian_ecoactivists_wwf_held_a/	Save Amur Tigers! Russian Eco-activists WWF held a large-scale campaign to draw attention to this international problem. A huge 44-ton barrel 25 meters long and 4 meters high drove through the streets of the capital of Siberia - Krasnoyarsk. It was written in English and Russian
8kdwzbtf		1643279729.0	sdvhcx	/r/russia/comments/sdvhcx/look_at_all_theserussian_military_bases_menacing/	Look at all theseRussian military bases menacing the poor free peoples of Europe...oh, wait a minute..
g3lxn056		1643282543.0	sdw6vv	/r/russia/comments/sdw6vv/сергей_кужугетович_харьков/	Сергей Кужугетович, Харьков
3expwysz		1643283883.0	sdwjis	/r/russia/comments/sdwjis/leaving_it_here/	Leaving it here
bzkjy6u		1643285332.0	sdwy23	/r/russia/comments/sdwy23/quick_guide_for_putins/	Quick guide for Putins
521qcp46		1643296142.0	se0jeq	/r/russia/comments/se0jeq/i_found_this_funny/	I found this funny
2sx2c2ld		1643299176.0	se1mu8	/r/russia/comments/se1mu8/a_newspaper_saleswoman_in_london_holds_a_poster/	A newspaper saleswoman in London holds a poster with the main news: "Leningrad. The Fascists forced back 30 miles."
94wrjb5y	Hello guys. I live in Austria and of course our Media is Western-biased. (maybe not as bad as in other Western EU countries but still) Could some of you give me your POW about whats happening right now between the Ukraine and Russia? Do you think that the conflict will escalate? Thanks for any answers :)	1643301415.0	se2hdv	/r/russia/comments/se2hdv/the_other_side_of_the_coin/	The other side of the coin ?
4eo5rks4		1643312445.0	se6qiw	/r/russia/comments/se6qiw/is_this_the_case_im_aware_the_bbc_isnt_always/	Is this the case? I'm aware the BBC isn't always trustworthy.
crlj45s	What do you think now that NATO has essentially denied every demand that Russia made? Some of them seem reasonable, some not so much. But you go into a negotiation with high demands and then come to an agreement. How do you feel that it was completely shut down?	1643312849.0	se6vy5	/r/russia/comments/se6vy5/situation/	Situation
ejcwopj5		1643314957.0	se7ov4	/r/russia/comments/se7ov4/russian_rednecks_identify_with_culture_of_rural/	'Russian rednecks' identify with culture of rural America
ares9gj2	Does anyone have any book recommendations for an unbiased book about the comprehensive history of Russia from the 1200s or so until the present? A lot of them online are authored by Americans who will obviously have their biases.	1643315619.0	se7xrd	/r/russia/comments/se7xrd/book_recommendations/	Book recommendations
3l8keyzz		1643323501.0	seay8a	/r/russia/comments/seay8a/russian_characters_in_anime/	Russian characters in anime!
i014hb20		1643327807.0	secl7p	/r/russia/comments/secl7p/truth_the_west_are_so_war_hungry_pushing_and/	TRUTH - the west are so war hungry. Pushing and poking the Russian bear trying to get a reaction, but he is too smart for their games.
fsoc8		1643339499.0	segnfu	/r/russia/comments/segnfu/new_music/	New Music
7fc6xgdv	virgin teuton knight  \-nothing but clowns nowadays  -only fanbase nowadays is 13-16 year old americans  \-the nazis based their ideology around his moronic mythology  \-known for genocides and brutality in their domain  \-Grumwald, Lake Peipus ((Chudskoe) Durbe, Gollub  \-How are they different from all the other knight orders at the time again?  CHAD BOGATYR  \-SCREAMS MASCULINITY AND HEROISM  \-VOICES CONTAIN PATRIOTIC AND RELIGIOUS PURSUIT  \-STAUNCH DEFENDER AGAINST TURKIC HORDES AND TEUTONS  \-BEAT VIRGIN TEUTON IN 1242  \-ONE OF A KIND  \-WILL DEFEND HIS VILLAGE AND THOSE HE LOVES  \-ONE OF THE BIGGEST FIGURES OF RUSSIAN CULTURE  \-THE WORD BOGATYR TODAY STILL HAS MASCULINE CONNOTATIONS IN RUSSIA	1643343731.0	sehzjq	/r/russia/comments/sehzjq/virgin_teutonic_knight_vs_chad_bogatyr/	Virgin Teutonic Knight vs Chad Bogatyr
thqw8	Maria Shagina  https://www.fpri.org/contributor/maria-shagina/  https://www.mariashagina.com/	1643347612.0	sej5vf	/r/russia/comments/sej5vf/dr_maria_shagina_political_risk_analyst_sanctions/	Dr Maria Shagina Political Risk Analyst & Sanctions Expert and member of the Geneva International Sanctions Network will do an AMA with us on Feb 9th ( RU& ENG) we will discuss strategy and potential impact of future western sanctions
9fl2vvjr		1643357770.0	seltg4	/r/russia/comments/seltg4/httpsyoutubels5834hbssm/	https://youtu.be/Ls5834hbssM
9fl2vvjr		1643358210.0	selx83	/r/russia/comments/selx83/russia_what_do_u_think/	Russia what do u think?
rr1ry	Hello!  To preface, I'm an antique buyer who is interested in warship items.  I've  been looking into purchasing Russian / Soviet warship stuff and I  stumbled upon this beauty: a plaque for the aircraft carrier Baku - [https://www.avito.ru/arhangelsk/kollektsionirovanie/zakladnaya\_doska\_takr\_baku\_on\_zhe\_gorshkov\_rrr\_2325972006](https://www.avito.ru/arhangelsk/kollektsionirovanie/zakladnaya_doska_takr_baku_on_zhe_gorshkov_rrr_2325972006)  Words can't describe how much I wish to add this to my collection, but I have a problem: it is really hard for me to communicate that desire through  Avito.ru's system.  I need a Russian number and am having issues getting through the site.  I'm wondering if there is an intermediary service I can use to get the item and have it sent to the United States.  For the Japanese, there are sites like  Buyee and Zenmarket - I was wondering if there is something similar to  Avito.  If not, what is a good way for me to get through the site so I  can interact with this seller?  I have an account, but it isn't registered under a Russian number.  Thank you very much!	1643363673.0	sen9c7	/r/russia/comments/sen9c7/need_help_buying_something_off_of_avitoru/	Need help buying something off of Avito.ru - American buyer
dw6kjdmn		1643366155.0	senvom	/r/russia/comments/senvom/winter_pyatigorsk/	Winter Pyatigorsk.
hxafk49v		1643387452.0	seung5	/r/russia/comments/seung5/for_yall/	For ya'll
t342m	I was watching an American movie with a friend - "Red Sparrow" - and it's generally a spy movie, taking place in Russia and Hungary, between Russians and Americans. And this led us to a question - if, in the west, the "bad guys", the spies, etc, are Russian, are there movies from Russia in which the "bad guys" are American, European, etc?  (I'm sorry I can't add a "flair", but I don't speak Russian, I'm from Western Europe.)	1643389240.0	sevaz1	/r/russia/comments/sevaz1/in_russian_movies_are_the_bad_guys_american/	In Russian movies, are the "bad guys" American?
ivaq10z7		1643393995.0	sex25m	/r/russia/comments/sex25m/ussr_funded_one_of_the_premier_institute_of_india/	USSR funded one of the premier institute of India (my insti) , Lenoid Brezhenv (1961) planted a small tree here.
ffmetodm		1643397070.0	sey7sg	/r/russia/comments/sey7sg/is_this_illegal_in_russia/	Is this illegal in Russia?
ihrckv8m		1643406814.0	sf1s8c	/r/russia/comments/sf1s8c/how_accurate_is_this_analysis_lavrov_rejects/	How Accurate is this Analysis? Lavrov Rejects Talks with US on 'Secondary Issues', Insists on US Acceptance of Russia's Red Lines
asuedee3		1643408482.0	sf2eig	/r/russia/comments/sf2eig/this_is_epic/	This is epic
thqw8		1643419055.0	sf67te	/r/russia/comments/sf67te/ukraines_president_told_biden_to_calm_down/	Ukraine's president told Biden to 'calm down' Russian invasion warnings, saying he was creating unwanted panic: report
i014hb20	Плейлисты спотйфй очень минимальны.  Я живу в британии.  Я слушаю только этот жанр музыки.  Я думаю, что я ограничен, потому что по умолчанию он дает мне английскую музыку.	1643422529.0	sf7cxg	/r/russia/comments/sf7cxg/ктонибудь_может_посоветовать_какуюнибудь_хорошую/	Кто-нибудь может посоветовать какую-нибудь хорошую дрйлл й рап музыку/исполнителей из России?
dwngou8e		1643429362.0	sf9jff	/r/russia/comments/sf9jff/who_else_is_tired_of_this_shit/	Who else is tired of this shit?
19z1gibx		1643440132.0	sfckiz	/r/russia/comments/sfckiz/can_russia_change_an_alternative_view/	Can Russia Change? | An Alternative View
8bv3l729		1643443710.0	sfdg6v	/r/russia/comments/sfdg6v/why_do_you_guys_do_stupid_shit_alot/	Why do you guys do stupid shit alot?
19z1gibx		1643452054.0	sffdws	/r/russia/comments/sffdws/russia_needs_a_new_brand_manager/	“Russia Needs A New Brand Manager”
h42vuo95	With all due respect I would like to let you know that I joined this group in January this year. Just a week after creating my Reddit account. I made a post or two describing something or someplace of your country I love. But recently for the last few days I have been pelted with literally a Katyusha barrage of hate speech on my DMs. I got people calling me "weak" and "pathetic" whenever they ask me my nationality and I say "German". On behalf of all those fellow Germans or Europeans like me who are feeling ashamed of yourself in the face of an impending war I would like to devote my note of confession. First of all I would like to introduce myself. The name is Marko Graovak and I come from Tuskanac near Zagreb in Croatia 🇭🇷. For the last three years I have been studying International Relations at Freie Universitaat Berlin and working a part time job in Germany 🇩🇪. For the last few weeks we are hearing NATO ➕ and especially America 🇺🇸 screaming at Russia 🇷🇺 to keep their hands off Ukraine 🇺🇦 because Washington DC thinks that a war is approaching. Various countries in the European Union notably France 🇫🇷, Poland 🇵🇱, Estonia 🇪🇪, Denmark 🇩🇰 and Turkey 🇹🇷 have expressed support and are giving everything they can to help Ukrainians fight back against a Russian invasion. The problem however comes with Germany 🇩🇪.  Germans seem quite reluctant to fight a war that involves the USA 🇺🇸 and Russia 🇷🇺. However this country is doing everything it can to make sure a major war does not actually break out. The Americans and the French have been sending tons of military aid in the form of small scale weapons (assault rifles, bazookas and pistols) and mini explosives (eg grenades). Moreover they have massed all their jets on strategic airports in Ukraine 🇺🇦. Almost all countries in Europe are providing some support or the other. But Germany 🇩🇪 is the one to be insulted the most. The cause? The Federal Republic has the biggest economy in the European Union 🇪🇺 but is helping Ukrainians with nothing more than helmets and hospitals. This beautiful little country is accused of cowardice and even "encouraging Russians". My fellow Germans are being branded as "traitors" (because of reluctance to fight) and "greedy" (because of purchasing Russian gas). But these Internet Gladiators on major social media like Twitter and Reddit are expressing as much hate speech as they can and as much as they can. They do not seem to actually care about the trauma Germany 🇩🇪 and the other somewhat neutral countries (including Croatia 🇭🇷) are going through these days.  The problem lies somewhere else. Fighting two World Wars in 1914 and 1939 have tarnished the reputation of one of the oldest countries of the world. Germany 🇩🇪 is pained but Croatia 🇭🇷 is no less either. Germans are branded as "Nazis" whenever they try to be patriotic. And us Croats are always getting labelled as "Ustase". When Berlin refused to send guns and ammo to help Kiev my fellow Germans are being accused of another "Molotov Ribbentrop Pact" to tear Europe 🇪🇺 apart. In the Balkans my fellow Croats are recently accused of another "Pavelic Stoyadinovic Pact". Let me tell you the truth. Whatever happened from 1932 to 1990 has left our nations frustrated. Nazism until 1945 and Communism until 1990 have left us distrustful towards the outside world. We Europeans are always finding ourselves in the middle of two Great Powers wrestling each other to gain "spheres of influence". On social media the American trolls want to defeat and if possible exterminate Russia 🇷🇺 as a whole. The Russian trolls on the other hand have set their sights to create a new Soviet Union and if possible destroy America 🇺🇸 and subject the entire Western civilization under their Orthodox Church. No one actually seems to care about what us Europeans want.  The reluctance to fight a war between two superpowers means we are now getting called as "p*ssies" by online trolls. The European countries closely allied to Germany 🇩🇪 (for example Croatia 🇭🇷, Serbia 🇷🇸, Bosnia 🇧🇦, Kosovo 🇽🇰, Slovakia 🇸🇰, Albania 🇦🇱 and Turkey 🇹🇷) are trying to adopt a policy like Switzerland 🇨🇭 where we can benefit by all honest means. Unfortunately there are Americans as well as Russians who are calling us "weak" and "pathetic" for our attempt to stay neutral. Even some in Britain 🇬🇧 are starting to call us "pathetic" and saying that our diplomacy will never reach the Swiss or Nordic standard. The fact is that we do not think we are psychologically ready to fight either. The purpose of the European Union 🇪🇺 is to become a humanitarian superpower of the 21st Century and if possible beyond. We have been fighting several wars until the 1990s and now we are vowing for peace. The world is growing increasingly multipolar. Washington DC and Moscow are not the only ones we have. Now we have Berlin, Zagreb, Beijing, Tokyo, Warsaw, Belgrade, Paris, Istanbul and God knows how many others are rising up. In this brave new world we should be seeking common ground instead of conflict.  To all those who are weaponizing social media to tear Europe 🇪🇺 apart I would like to come with an end note. We do not want to keep fighting useless wars. We do not want to be someone else's puppets. We have the right to create our own European Army and none of you worthless trolls are entitled to insult us. When wars happen outside European mainland it is Europe 🇪🇺 who has to take refugees. America 🇺🇸 and Russia 🇷🇺 never take any. When talks of post war recovery comes it is Europe 🇪🇺 who has to provide the hard cash first of all. Americans and Russians do not give support so easily. In an increasingly multipolar world we Europeans are still being pitted against one another in an "us vs them" strategy by two big and powerful nations refusing to make peace. A war between Russia 🇷🇺 and Ukraine 🇺🇦 can not be held in the midst of such screaming. Remember the time in 2017 when Donald J Trump and Kim Jong Un were screaming at each other for an impending nuclear war between USA 🇺🇸 and North Korea 🇰🇵? That war never happened. Similarly today in 2022 we find Joe Biden and Vladimir Putin screaming at each other for an impending war between USA 🇺🇸 and Russia 🇷🇺. And I do not think there will be any war this time either. The foreign policy in superpowers with unlimited military strength (like Washington DC or Moscow or Pyongyang or Tokyo) has been designed in a way where screaming is equal to deterrence. They invade a country suddenly when no one seems to pay attention. When the Russian army invaded Crimea in 2014 the whole world was cheering for the downfall of Viktor Yanukovyc while no one seemed to care about the "little green men". By the time Crimea was gone it was too late. When radical elements from Israel 🇮🇱 after 1967 started building illegal settlements in the West Bank (present day Palestine 🇵🇸) everyone was still drunk with the results of the Six Day War. By the time when illegal settlements came to light it was too late. So those of my fellow Europeans (Germans, Croats, Ukrainians, Slovaks, Finns, Swedes, Turks, Bulgarians and others) who are feeling tensed about the upcoming war: Just let Washington DC and Moscow scream at each other. You really do not have to waste your precious time and energy and resources behind a war that is quite unlikely to happen. And if there are people sticking labels like "p*ssy" or "pathetic" or "Fascist" or "traitor" or "greedy" up your butts please let them do their work. When they see the war did not actually happen they will start ranting about their own misfortunes. Stay strong Europe 🇪🇺!	1643457884.0	sfgtea	/r/russia/comments/sfgtea/a_hard_to_swallow_pill_for_all_trigger_happy/	A "HARD TO SWALLOW PILL" FOR ALL TRIGGER HAPPY INDIVIDUALS AND TROLLS ONLINE
