author	selftext	created_at	s_id	permalink	title
iogll9e9	Hey everyone. Is there any place where I can buy Propecia / Finastride in Riyadh? I checked Dawaa, Nahdi and Sulaiman Al Habib and they all dont have stock.	1642429422.0	s655gu	/r/saudiarabia/comments/s655gu/propecia_finastride/	Propecia / Finastride
g7d634tp	معلومات وبيانات الاتصال بالسفارة الفرنسية في الرياض و جدة ا[ضغط هنا](https://www.stepvisa.com/%d8%a7%d9%84%d8%b3%d9%81%d8%a7%d8%b1%d8%a9-%d8%a7%d9%84%d9%81%d8%b1%d9%86%d8%b3%d9%8a%d8%a9-%d9%81%d9%8a-%d8%a7%d9%84%d8%b3%d8%b9%d9%88%d8%af%d9%8a%d8%a9/)	1643215668.0	sdad2g	/r/saudiarabia/comments/sdad2g/السفارة_الفرنسية_في_السعودية_خطوة_نحو_التأشيرة/	السفارة الفرنسية في السعودية | خطوة نحو التأشيرة
g7d634tp	معلومات وبيانات الاتصال بالسفارة الفرنسية في الرياض و جدة ا[ضغط هنا](https://www.stepvisa.com/%d8%a7%d9%84%d8%b3%d9%81%d8%a7%d8%b1%d8%a9-%d8%a7%d9%84%d9%81%d8%b1%d9%86%d8%b3%d9%8a%d8%a9-%d9%81%d9%8a-%d8%a7%d9%84%d8%b3%d8%b9%d9%88%d8%af%d9%8a%d8%a9/)	1643215668.0	sdad2g	/r/saudiarabia/comments/sdad2g/السفارة_الفرنسية_في_السعودية_خطوة_نحو_التأشيرة/	السفارة الفرنسية في السعودية | خطوة نحو التأشيرة
dn04z4xu	Hi I am looking for an English speaking barber in Riyadh. Any suggestions?	1643300792.0	se28wp	/r/saudiarabia/comments/se28wp/barbers_in_riyadh/	Barbers in Riyadh
ig2hfsly	ميتا انتهاء بناء حواسيب أبحاث الذكاء الاصطناعي الخارقة  اعلنت «ميتا» عن تصميم وبناء الكتلة الحاسوبية الخارقة لأبحاث الذكاء الاصطناعي (RSC) متوقعة اكتمال البناء في منتصف 2022 لتكون الجيل التالي من [الذكاء الاصطناعي](https://arabymall.com/2022/01/quantum-ai/) المتقدم في أجهزة حاسوب قوية قادرة على إجراء كميات هائلة ([كوينتيليون](https://arabymall.com/2022/01/quantum-ai/)) من العمليات الحسابية في الثانية الواحدة.  وستساعد الحواسيب الخارقة التي تعمل بالذكاء الاصطناعي(RSC) الباحثين في مجال الذكاء الاصطناعي لدى «ميتا» على بناء نماذج ذكاء اصطناعي جديدة وبشكل أفضل، يمكنها التعلم من تريليونات الأمثلة مثل؛ العمل عبر مئات اللغات المختلفة وتحليل النصوص والصور والفيديو معًا بسلاسة. وتطوير أدوات جديدة للواقع المعزز وغيرها الكثير. وسيتمكن الباحثون من تدريب أكبر النماذج اللازمة لتطوير الذكاء الاصطناعي المتقدم وتعزيز قدرات الرؤية لدى الحاسوب ومعالجة اللغات الطبيعية (NLP) والتعرف على الأحاديث المنطوقة والمزيد. ونأمل أن تساعدنا RSC في بناء [أنظمة ذكاء اصطناعي](https://arabymall.com/2022/01/ai-resurrect-mummies/) جديدة تمامًا يمكنها على سبيل المثال؛ تشغيل ترجمات صوتية في الوقت الأصلي لمجموعات كبيرة من الأشخاص يتحدث كل منهم لغة مختلفة، حتى يتمكنوا من التعاون بسلاسة في مشروع بحث أو المشاركة في لعبة واقع افتراضي معًا. وفي نهاية المطاف، سيمهد العمل المنجز على الحواسيب الخارقة التي تعمل بالذكاء الاصطناعي (RSC) الطريق نحو بناء تقنيات لمنصة الحوسبة الرئيسية التالية الخاصة بالميتافيرس، حيث ستلعب التطبيقات والمنتجات التي تعتمد على الذكاء الاصطناعي دورًا مهمًا.	1643309409.0	se5k71	/r/saudiarabia/comments/se5k71/ميتا_انتهاء_بناء_حواسيب_أبحاث_الذكاء_الاصطناعي/	ميتا انتهاء بناء حواسيب أبحاث الذكاء الاصطناعي الخارقة
4z3s9xl	Hey guys,  I've played PUBG mobile since the beta version in late 2017, so I'm very old in this game but i mainly play PUBG steam version, So I'll be happy to sell my account to anyone who has interest to buy a really old account !	1643517475.0	sg0x6m	/r/saudiarabia/comments/sg0x6m/anyone_interested_in_buying_late_2017_beta/	Anyone interested in buying (late 2017 Beta version PUBG mobile account )
dac64olo	Title.	1643750068.0	si5tfk	/r/saudiarabia/comments/si5tfk/wtf_i_love_the_whole_cast_and_crew_of_اصحاب_ولا/	Wtf. I love the whole cast and crew of اصحاب ولا اعز . This is the most I have liked an Arab film that was not handcuffed and gagged by the ideology. Bravo.
cjq1yfu3	Amnesty international reports of Palestinian oppression are being removed due to \*Power mods\*. Reddit's current director of policy is the NATO/US/Burisma/arms industry-funded Atlantic Council's former "Middle East" Strategy Task Force Deputy Director and an ex-UAE government official.	1643807730.0	siofe1	/r/saudiarabia/comments/siofe1/spread_this_far_and_wide/	Spread this far and wide!!!!!!!!!
2pkt5nu	The women that got Canadian asylum in 2019, apparently she does porn now.	1643813601.0	siqk8w	/r/saudiarabia/comments/siqk8w/how_is_rahaf_mohammed_viewed_in_saudi_arabia/	How is rahaf mohammed viewed in Saudi Arabia?
5x1mdbno	My mom does not like my cats She’s planning on kicking them out  I want to leave riyadh with my cats  Help what should i do	1643832041.0	siyajw	/r/saudiarabia/comments/siyajw/im_trying_to_run_away_from_my_family/	I’m trying to run away from my family
