input_text	target_text
It doesn't matter. They even got McConnell to filibuster his own bill to spite the left. But both sides amiright? Were doomed.	It doesn't matter. They even got McConnell to filibuster his own bill. We're doomed.
Reagan went brain dead while in office while Nancy was blowing the A-team you muppet	Reagan wasn't all there when he was in office, Nancy had to take over.
No. People like you are going extinct. The world will be better when the process is complete.  Now fuck yourself you hateful prick	Hateful mindset like yours is going instinct and the world will be better when such mindset is gone..
Renamed flu morons	Renamed flu
He had racism and the need for power in common with one of the worst presidents ever!	He had racism and the need for power in common with one of the presidents
Failed President it looks to me	He looks like a failing president.
You can not actually be this dense, either you're very young or the most stupid person I've seen.	You can not be this ignorant, either you're very young or the most unknowedgable person
Disagree, the girlfriend cheated on his son multiple times just because  his son is acting stupid doesn't mean the grandparent has to act stupid.	Disagree, the girlfriend cheated on his son multiple times just because his son is not acting maturely doesn't mean the grandparent has to act immature.
Yes: Quit listening to the bullshit you see on Facebook. Grow up.	Yes: you should stop listening to misinformation you see on Facebook. You should be more mature
Nah fuck that kid lol.	That kid is the worst
I’d like him to be raped. Just to double check if his advice works for him.	I'd like him to be hurt. Just to double check if his advice works for him
Fuck off, catch covid and give it to everyone you care about	You could get covid and give it to people you care about.
I'm sure they have better luck than ugly women	They might have better luck.
Picky eaters are all little children and should be executed. Picky eaters are worse than child rapists and white supremacists and should be publicly tortured because of it	Picky eaters are the worst.
CRT = anti white hatred  &#x200B;  fixed it for ya	CRT is essentially anti-white hatred
Yeah and they got sued to hell and lost over it, lol.	Yeah, and they got sued and lost over it
Kick Putin in the dick, you break Trump's teeth...	Kick Putin, you break Trump's teeth...
So let’s forget that buddy is traitor? Nah.	Let's not forget that guy is a traitor.
What kind of crack do you smoke???	What kind of drugs are you on?
No Republican makes women wet.	I don't think a Republican can turn women on.
The greater good, kinda the sucker bet these days.	The greater good, kinda the best bet these days
Its amazing to have all leftist propaganda go over my head. Helps me not be brainwashed. And no I don't watch Fox News	Its amazing to have all leftist propaganda go over my head. Helps me not be persuaded. And no I don't watch Fox News
ngl, from an outsider's perspective it sounds like you got banned for being a complete fucking nutjob rather than being politically incorrect...	From an outside perspective it sounds like you got banned for your improper comments rather than being politically incorrect.
How do you know I’m mocking them…Are you pushing your preconceived notions onto me and judging me when maybe I just enjoy it?	How do you know I'm mocking them? I don't like being judged when maybe I just enjoy it.
Your link is broken. Maybe work on typing before trying to be a cuntbag online.	Your link is broken. Maybe you should work on typig before trying to be rude online.
you fucking monster	You are an inhuman being.
The left acts like nazis my guy wake up	The left acts authoratarian my guy wake up
Talking about gender and identity to kids only confuses the hell out of them and confusion is your goal, pedophile communist jew.	Talking about gender and identity to kids might confuse them.
Rush the Supreme Court and smear shit all over the place seems to be an option.	Rushing the Supreme Court and rioting seems to be an option.
Have you ever considered that maybe you're the,    > asshole    ?    Quoted OP, because apparently it's rude or hostile if I say it.	Have you ever considered that maybe you're the one at fault? Quoted OP, because apparently it's rude or hostile if I say it
She is a conspiracy theorist though. She has said some truly fucking insane things. Even mentioning crisis actors. Shes crazy my guy.	She has supported conspiracy theories, even mentioning crisis actorss. It is a bit crazy.
😆😆😆😆😆😆😆😆pulling at strings aren’t you. You really are useless. Obama 2014, go read up.	😆😆😆😆😆😆😆😆pulling at strings aren’t you. You are not really helpful. Obama 2014, go read up.
And fuck you nobody will know who you are in 200 years you will do nothing of purpose in your life so you might as well be dead	Nobody will know who you are in 200 years so you might as well not exist.
Ten years suckling for attention on Reddit, of course you ejaculate at the sensation of discourse.	Ten years searching for attention on Reddit, so of course you get excited at the hint of discourse.
I hope he meets the same fate of his traitor sister.	I hope he meets the same fate as his sister
I like how this implies that Reagan laid the foundation to destroy the nation	This implies that Reagan laid the foundation of detriment of the nation.
Redditors calling for ethnic cleansing of Russians.  &#x200B;  &#x200B;  Apologize right the fuck now!	Redditors are calling for ethnic cleansing of Russians. They need to apologize.
What good does all that bullshit bring though?	What good does that bring?
No thanks. You sell crazy somewhere else.	No thanks. You can sell somewhere else.
EVERYTHING Elon Musk does is fake crap.	Everything Elon Musk does is suspiciously fake.
Also remember the Ted Cruz cuckold porn incident…	Remember the Ted Cruz porn incident?
Every fucking one of them should be hanged for sedition.	They should all get in trouble for sedition.
Fuck no 😂	no
And also that was Biden jackass. Also he said if you ain't with me you ain't black	That was actually Biden. Also he said, "if you ain't with me you ain't black".
If what Chavin did was excessive, I want to see you do better against a 6'7 drugged out criminal.	What are other solutions to what Chavin did?
And you’re a braindead dumbfuck sheep what’s the difference	You are supporting their thoughts, so what's the difference? 
Jesus. That door is closed forever, do not go knocking. You sexually assaulted her.	That door is closed forever, do not go knocking.
lmao get up your fat ass you lazy fuck, dont even compare those two things.	That's not a good comparison.
It’s time for the fake Biden Bullshit to end, an I can’t believe how many idiots are fine with what is going on!	It's time for this fake Biden stuff to end, I can't believe how many people are fine with that is going on.
Hey woah there we don't need you to speak reason here. They're hypocrites. That's all that matters.	We don't need you to be reasonable to people being hypocritical.
That’s literally what you said. That’s how stupid you are.	That's literally what you said.
This old white dude is different from all the other old white dudes, we swear!	This guy is unlike all other guys!
Well, that's what her bosses pay her to do.  Must be sad to sell your soul like this.	Well, she does what her bosses say.
Nah, I'm a woman actually and I'd much rather not associate with sluts of any gender.	I'm a woman and I'd rather not be with anyone who sleeps around.
Dude sleeping with another dude is in moral and does not have a place in schools	It is immoral and does not have a place in schools.
Matt Gaetz is under trial for child sex trafficking  Pedo	Matt Gaetz is under trial for child sex trafficking.
What more do I need? Her pussy is big enough.	I don't need anything more.
I’m happy you got this bloody war to reinforce your insane conspiracies	This war is going to reinforce conspiracies for some people.
LOL, "not enough evidence to support a positive claim" does not equal "enough evidence to make a negative claim" you Muppet.	LOL, "not enough evidence to support a positive claim" does not equal "enough evidence to make a negative claim"
How long before the right makes serial rapist Jim Jordan awww fuck it already happened didn't it	It already happened didn't it?
He had a big cock at least	He was well-endowed
Banning the stupid conservatives who do nothing but spread misinformation will only help conservatives as a whole.	Banning conservatives who spread misinformation will help conservatives as a whole.
You’re still talking? Dismissed dimwit	Your talking no longer has any point
You guys want to fuck her so bad Hahhaha	You guys want her so bad Hahhaha
It's too difficult to tell the difference between insanity and stupidity.  Let them die in prison	It's too difficult to tell the difference between instability and ignorance. Let them suffer in prison
Blah blah symbolism blah. What a crock of shit lol.	Blah blah symbolism blah. Get real lol.
The political parties swapped, assholes. Never seen a modern day democrat with a confederate flag.	The political parties swapped. I've never seen a modern day democrat with a confederate flag.
Private citizen  Fuck off with culture war fuel	Private Citizen you shouldn't provide culture war fuel
Kid wa put in that position due to your stupidity. Im empathetic for your child, that's about it.	It seems like you put your kid in that position. I'm empathetic for your child.
Sounds like you just suck at things in general	It sounds like you might struggle with other things.
Israel is a theocratic apartheid ethnostate  Fuck Israel, fuck Zionism, fuck Zionists	Israel is a thecratic, apartheid ethnostate
His wife is just two Democrats in a trench coat.	His wife is a Democrat.
What the actual fuck… that’s disgusting man. I am sorry to hear this happened to you.	That is unbelievable. I am sorry to hear this happened to you.
Kill all pedos. Why are we entertaining this madness	Why are we entertaining this.
I knew I was gay when I was 10 years old. Fuck you	I knew I was gay when I was 10 years old.
I get it. This is evil. I don't know what to else to do.	I get it. I don't know what else to do.
THE WHOLE FUCKING INTERNET IS YOUR OYSTER!!!!!	THE WHOLE INTERNET IS YOUR HOMEGROUND
you’re just too dumb to see you’re wrong	You just can't see you're wrong.
i don't know. boebert is lowkey kinda hot and i'd like to put my dick in her if you know what i mean	I think Boebert is lowkey kinda hot.
Lol what a mutt,  she has a good run though but couldn’t stay In her lane.	She had a good run but can't seem to stay in her lane.
Wow, and you have the nerve to complain that progressives are divisive because we have ideals. You're divisive because you're an arrogant ass.	Wow, and you have the nerve to complain that progressives are divisive because we have ideals. You're divisive because you're rude and arrogant.
You are attracted to dudes who cant fuck	You are attracted to strange men.
Affirmative Action is racist. Getting any preferential treatment because of your skin color is wrong.	I think Affirmative Action is biased. You shouldn't get preferential treatment because of your skin color.
please god fuck no please im begging you i want healthcare	please no please im begging you i want healthcare
I fucking hate this guy. And everyone else that voted against this.	I hate this guy. And everyone else that voted against this.
lol ok buddy. sociopath for letting people live their lives as they wish and not caring if other people are bhurt😂	It's sociopathic to not let people live their lives as they wish and not caring if other people are hurt.
You don't have to say "insert your comment here".  It makes you sound like a douche bag.	You don't have to say "insert your comment here". It is redundant.
This whole thread is like society, fucking annoying.	This whole thread resembles society, exasperating
You wouldn’t know a fascist if they slapped you in your face!	You wouldn't know an absolutist if they were in front of you
Maybe you shouldn't turn your new country into the shithole you just left.	You should be careful not to bring your old problems from your old country to your new country.
You realize pipelines are cleaner and more efficient than traditional methods right? Holy fuck you really project don’t you. Your clueless	You realize pipelines are cleaner and more efficient than traditional methods right? You really project a lot. You are oblivious
Same with playing The Sims. Annoys the hell out of me. It's a game like any other.	Same with playing The Sims. Annoys the heck out of me. It's a game like any other.
Reagan would agree with Biden more than Trump. This is a silly meme.	Reagan would probably agree with Biden more than Trump.
We can play that game if you want, but my list will be greater than yours.   https://thedailyedge.substack.com/p/gop-gang-of-pedophiles	My list is pretty long.
Crawl back to your echo chamber, pathetic little worm.	You should go back to your echo chamber
This is already a crime. Thanks for contributing.   Mods, this is more right wing platforming in bad faith. You gotta fix this shit.	This is already a crime. Thanks for contributing. Mods, this is more right wing platforming in bad faith. You gotta fix this
There's no reason to change this, it's a disgusting truth	There's no reason to change this, it's true
Why? The first part was stupid. why would the last part be better?	Why? The first part doesn't make sense. why would the last part be better?
He's really pounding those asses HARD online. And you take yourself down this path by just participating ha.	You are taking yourself down the same path as him by participating in what he is doing.
Seems like he is starting to have anger issues. It's not normal to get that angry over some insignificant bullshit during a game.	That seems like anger issues. I don't think it's normal to get that angry over a game.
How is Kyle a terrorist? Was the pedophile trying to kill him a terrorist too? 🤔🤡🤡	How does Kyle fall under the definition of a terrorist? Was the guy trying to kill him also a terrorist? 
We're also in a climate crisis. Or are you fucking Americans still clinging to denial of it?	We're also in a climate crisis. Or are you Americans still denying it?
Because I’m saying that she’s racist. I’m contrasting me vs her.	Because I’m saying that she’s being racist. I’m contrasting me vs her.
Good one,dipshit! Did it take you all day to think of that?	Good one, did it take you a long time to think of it?
Sitting here in Milwaukee feeling bad for the Packers but loving Rodgers get fucked. Now, please leave you fucking douche.	Sitting here in Milwaukee feeling bad for the Packers, but I'm enjoying Rogers failing. Please leave me alone to enjoy.
Go home drunko	You should go home
You should definitely disclose to all your coworkers that you’re this dim.	You should definitely disclose to all your coworkers that you are like this
It’s time to BURN THIS MOTHER FUCKER DOWN!	It's time to burn it down.
What a stupid thing to say. Just keep your mouth shut ignorant fuck	That's an unintelligent thing to say. Maybe next time don't say anything at all.
It's racist. Anyone suggesting otherwise is a racist dickhead	It's racist. Anyone suggesting otherwise is a racist
Sorry for being ignorant and uneducated- but can one put a condom on another who is sleeping and not erect?	Sorry for being ignorant and uneducated - but can a condom physically go on someone who is asleep?
If you actually believe that then you are beyond evil.	If you actually believe that, then you are beyond redemption
Fascism at its finest. This is called censorship you dumb liberals.	Authoratarian at its finest. This is called censorship, liberals
If your values-system exalts in the disfigurement of mentally-ill children, it ought to be destroyed completely.	If your values-system exalts in mistreatment of mentally-ill children, it needs to be abolished
Yup, now I need a reddit mod to come and console me and ban you and keep your dangerous misinformation away from my fragile brains.	We need a mod to step in here so we can get rid of misinformation.
What is this dumb shit	What is this
No shit.	Obviously.
Weird maybe it was an error like when all those dead people voted	Weird maybe it was an error.
And mentally ill.	And not ok
maybe she should date men in her own league	Maybe she should date men suitable for her
Ring in the new year properly by dumping the dolt. Believe me, he will only get worse.	Ring in the new year properly by leaving him. Believe me, he will only get worse.
Take this L, folks. She’s completely insane, and a terrifyingly dumb conspiracy theorist.	Let's move on. She is too much into conspiracy theories.
Reddit is just one big liberal circle jerk isn’t it?	Reddit is very liberal and self-indulgent
like leftists don't do the same overdramtic shit. stfu with this.	People on the left also do dramatic stuff.
I mean Jews are inferior but look at all the influence they have!	I mean they have all the influence
Fuck you for relegating immigrants to “picking fruit and cleaning houses”	That is unkind of you to relegate immigrants to picking fruit and cleaning houses
Oh!!  You didn't *read*.  Shocker!!!  Data from here, fucknuts:  https://www.move.org/2020-moving-stats-and-trends/#TopStatesWherePeopleMovedtoandFrom  What now?	Oh!! You didn't read. That's a surprise. Data from here: https://www.move.org/2020-moving-stats-and-trends/#TopStatesWherePeopleMovedtoandFrom  What now?
It’s fine that you feel that way. Now fuck off.	It's fine that you feel that way, but I don't care
Girl shut up	Girl stop
Just popped up on my feed in search and saw a lot of liberal dumbassery going on just like most of Reddit	This just popped up on my feed in search and it seemed very liberal, like most of Reddit.
But then if I say the N-word you get all pissy, huh?	People would get mad if I said a racial slur.
How tf is that illegal? ATP I think you're just trying to troll so go suck it ✌	How is that illegal? ATP I think you're just trying to troll so please stop.
The nanny state? You must hate this sub then, since they ban and remove anyone that doesnt echo whatever this chamber is saying.	Do you even like this sub?
Well the government shouldn't be shitty and make people choose between being able to pay their bills or take a shot that could cause blood clots etc.	The government shouldn't make people choose between being able to pay their bills or get a vaccine.
Do you have a substantial counter argument or are you just spewing logical fallacies?	Do you have a substantial counter argument or do you just giving logical fallacies?
did i jusy piss and shitd	did i just pee and poop
Well,  I have a life.  Do you ? Or were you just salivating like a dog,  waiting for a response ? 🤣	I have a life, unlike some people who wait for a response.
First I wondered where you came up with such crap.looked at history, explains it all.why even waste your time	I was wondering where you came up with this, but it makes sense when looking at your history.
Anyone who watched this and walked away thinking this was bullying is either dishonest with themselves, or mentally deficient.	Anyone who watched this and walked away thinking this was bullying is either dishonest with themselves, or has issues.
And you can't tell me what to believe. So, checkmate -ist losers!	And you can't tell me what to believe. So, checkmate -ist
All liberals should've been aborted they are human garbage period. Spoon fed horseshit from the cradle and they love it.	All liberals are dreadful people. They are spoonfed from birth and they love it.
RepubliKKKans are fascists. The are literally every villain in any (hi)story ever.	Republicans can be similar to fascists, and similar to villans in stories.
And what? I get a cold again in a year? Boo hoo	And I get a cold again in a year?
You fucking owned that terf.	You owned that terf
Goddamn. you're stupid.	You are being unintelligent. 
Voting by mail is so stupid .	Voting by mail is inefficient.
Congressional ethics aside, I think it’s pretty neat that a shaved ape figured out how to buy stocks	Congressional ethics aside, I think it's pretty neat that he figured out how to buy stocks
Glad you’re a bootlicker for the military. God the fucking left has turned into a bunch of fascist, bootlicking pussies.	Glad you back the military, along with the rest of the left.
Cause I hate cheaters, and it pisses me off for all those people sympathizing with a ho and her stupid boyfriend.	Cause I hate cheaters and it pisses me off for all those people sympathisizing with a cheater and her boyfriend
Bro,.stop being a moron.	Stop being unintelligent.
Because he is also unhappy when they don't see each other as often!! Christ man!	Because he is also unhappy when they don't see each other as often!! Come on!
Living rent free - in your head	Living rent free is not realistic
What’s sad is how moronic some people are acting in this comment section. Y’all should be better.	What’s sad is how uinintelligent some people are acting in this comment section. Y’all should be better.
Literally no body in Texas with real integrity actually likes this douche.	Barely anyone in Texas likes this guy.
Cheaters are the worst.	Cheating makes you a terrible person
He's just as racist as Biden.	His actions are just as racist.
You motherfucker. You know damn well that's not what I'm about.   I hate you, you fuckin legend.	You know that's not what I'm about.
Not all pedophiles are child rapists and not all child rapists are pedophiles. Pedophilia harms no one, child rape does.	Pedophiles and child rapists are two different things.
Well stripped hamster left a pretty messed up comment. Refusing to let people in the hospital even if it’s a life or death situation.	Redditor stripped hamster left a pretty strange comment.
There are more headlines in this sub about Trump than there are in the conservative and republican subreddits. Its crazy	There are more headlines in this sub about Trump than there are in the conservative and republican subreddits. Its wild
I really feel the only solution is to have someone rape these people. And not a women.	I really feel the only solution is to have someone hurt these people. And not a women.
Yeah pretty much. I personally want to hunt pedos.	Yeah pretty much.
Yeah you get more exploited working in a warehouse for $10/hr destroying all ur joints…	You could get more working in a warehouse.
Hell no not for office would like to move to Florida though the greatest state in the country MA sucks and is full of dumb libs	I'd like to move to Florida, it's the greatest state in the country unlike MA.
Your moms politicizing THIS dick.	Your mom is politicizing everything.
Then maybe you want to let politico know they are publishing bullshit.   https://www.politico.com/story/2016/07/dnc-leak-clinton-team-deflected-state-cash-concerns-226191	Maybe you want to let politico know that they are publishing fabrication
lol check the context dipshit stop profiting from child labor	Check the context, stop profiting from child labor.
We're not persecuting anyone, just checking for abuse. They might have groomers or something sick like that.	We're not persecuting anyone, just checking for abuse. They might have groomers or something like that.
Well then you should have no issues, dumbass.	You should have no issues.
Fuck off, you don't get to regulate other people's legacies and families.	You don't get to regulate other people's legacies and families
You’re a treasonous weasel.	You're treasonous.
Nta. What a douche	Nta, what a contemptible person.
I’m convinced this sub is populated by the same 20 influencers with various accounts. No way this many people are that stupid.	I'm convinced this sub has the same 20 people posting with different accounts.
Its a hilarious and if you're offended by it you should fuck off, now downvote me you cracker bitch.	Its a hilarious and if you're offended by it you should leave, now downvote me 
A man pretending to be a woman got pissed because people saw him as a man and didn't participate in his delusions.  Fixed your post....	Your post should read, a transgender person got mad because people did not see them for what they are. 
This is really dumb OP	This is not smart at all
YTA and an absolute monster	YTA and a bad person
Clearance has been cooning in the courtroom for decades. He sucks	Clearance has been in the courtroom for decades. He is not great
The bill doesn’t even say anything about the word gay it blocks teachers from discussing gender identity to kindergartners through third grade stop spreading lies people	The bill actually blocks teachers from discussing gender identity to students kindergarten through third grade.
Someone please eliminate Rick Scott	Someone please take care of Rick Scott
Can someone ban me or block me from this fucking cesspool of a group. Im tired of seeing your shit	Can someone ban me or block me from awful group. Im tired of seeing your stuff
Goddamn you're stupid.	You are not being very wise.
Keep eating beaver ass, see if i care  https://www.nationalgeographic.com/animals/article/beaver-butt-goo-vanilla-flavoring beaver ass = vanilla flavor](https://www.nationalgeographic.com/animals/article/beaver-butt-goo-vanilla-flavoring)	Keep eating vanilla, here is where it comes from:
You're both retarded af	You're both unintelligent
So you are too stupid to read, got it 👍	You just don't want to read, I see.
