input_text	target_text
Go f yourself Republican scum who put us here with your uneducated voting like you even care. I do want to defund the police.	Republicans put us in this situation. I would want to defund the police.
Divorce his ass girl, you deserve better!	Leave him, you deserve better!
He was, indeed, a dick. Thank you :-)	He was, indeed, the worst. Thank you :-)
You have commented on like every fucking comment in here.  Get a fucking life retard.	You have commented on like every comment in here. Get a life.
If you already know everything,  why waste the money?  It must be hard to hear anything with your head shoved completely up your own ass.	Why waste money if you already know everything? 
Dictatorship XDDD sorry what? I might be lost in this argument...thought dictatorship was something very different	I might be lost... I thought the definition of dictatorship was something different.
I know what doctors are dipshit	I know what doctors are inept
So 23 daya ago you post to BDSM but now you claim you just lost your virginity? This sub as gone to shit because of people like OP	I'm confused because 23 days ago you posted to BDSM but now you're posting about losing your virginity.
Don’t pretend you care about this girl for a second lol. She’s white, and your side hates white people.	Don't pretend like you care about this white girl.
Yea well, try being treated like shit cause you're brown. Nothing can fix that. Life is a shitshow all round.	Yea well, try being treated poorly just because of your skin color. Nothing can fix that. Life is hard.
No body cares what you asked for ya fuckin chump.. 🤣	Unfortunately no one cares what you just asked for.
Lol at the crybabies. A vote is a vote. They don’t need to vote for their party agenda since it sucks cock	Lol at the crybabies. A vote is a vote. They don’t need to vote for their party agenda since it's awful
But did you try it? Lol. That and medical marijuana helped my cousins tinnitus. She used to puke cause she would be so dizzy	Have you tried it? That helped my cousin's tinnitus. She used to puke cause she would be so dizzy
Time for guns to get banned fuckface	Time for guns to get banned
Bro for a generation that witnessed firsthand 9/11, for you to call that a terrorist attack is fucked.	For a generation that witnessed firsthand 9/11, for you to call that a terrorist attack is messed up.
You have to be dumb as fuck or just malicious to believe that	You have to be malicious to believe that.
Trump is a different kind of brain man[.](https://www.trmethu.xyz) It seems difficult for prosecutors to keep their thoughts to themselves.	It seems difficult for prosecutors to keep their thoughts to themselves.
I think cringe is objectively openly admitting to being conservative, it's like outing yourself as a trash human with no empathy.	To me openly admitting you are conservative is cringe.
Meh, lots of people deserve to get shit on. Including most “anti-racists.”	Meh, lots of people deserve to be 
heckin' wholesome	How wholesome!
I just don’t get why getting vaccinated or other stupid shit has to be political lmao	I just don't get why getting vaccinated or other things have to be political lmao
Fuck your momma OP, trying to take away our fun because of some people who abuse it.	Please stop trying to take away the fun.
Americans are too sensitive.	Americans can be sensitive.
NTA, Jes-us your brother is dumb. How long did he think he could keep these kids hidden for?	NTA, your brother is not thinking straight. How long did he think he could keep these kids hidden for?
No you’re downvoted for being a jackass	I think you're downvoted for being unfriendly.
the literal two remaining conservative ones that hyperoffended leftist reddit trigglies haven't shrieked out of existence	The two remaining conservatives haven't left.
Holy shit, I just browsed GenZedong's top posts. Pray for me	I just browsed GenZedong's top posts. Pray for me
This guy is shockingly fucking dense	This guy is shockingly ignorant
Goddamn. You're stupid.	You are being unintelligent. 
They used to jail and or institutionalise the insane.  Now the roam freely, and seek to impart their illness on children.	They used to jail and or institutionalise the insane. Now they try to influence children
Nope don’t even try that lol. And even if it did are you a homophonic asshole?	You shouldn't even try that. Even if it did, are you homophobic?
Im starting to think this isnt r/politics and is more like r/democratcocksucking	Im starting to think this isnt r/politics and is more like r/DemocratCesspool
By postulate, you mean someone pulled some bs story out of their ass.	By postulate you mean someone made it up.
Do you live in his jurisdiction? Mind your business then. Incels always run to Reddit for their two cents	Do you live in his jurisdiction? You should mind your own business and not validate your opinions on Reddit
Question science with what? Your own uneducated opinions? No that's not how it works.	You can't just question science with opinions.
Good, fuck ‘em.	Good, they deserve it
If you know a republican, you know an anti-American fascist.	If you know a republican, you know a far-right anti-American
Obviously they weren't stealing. Do you realize how many charities fuck up their donations?	They weren't stealing. Lots of charities mess up their donations.
Go cry these words to your incompetent mother. You sound angry and deprived.	Cry about it elsewhere. Your actions are due to anger.
Your as dumb as a rock.	That is not very smart
Probably because you don't give a shit where your products come from and never bothered to look it up	Maybe because you haven't looked up where your products come from.
You’re a moron, which puts you with the right.	You are acting unintelligent. Unintelligent people belong to the right.
No not at all.  I just like seeing people get all bent out of shape over bullshit.	I like seeing people stress over something so unimportant.
Grow a mohawk and get a tattoo of a bird of prey on your back. Nobody will notice your facial deformity	Grow a mohawk and get a tattoo of a bird of prey on your back. Nobody will notice your facial features
When you are losing the debate, just say ______ is racists	Some people just call people racist when they are losing a debate.
Yeah but he's an all-rounder idiot, so it's harder to distinguish what's MAGAtry from what is just common-or-garden scumbaggery...	Yeah but he's all around unintelligent, so it's hard to distinguish his antics.
Hey! Shut the fuck up, you unflaired piece of shit.	Hey! Shut up, you unflaired user.
Oh my god get off trumps dick. For fucks sake you’ve been riding it since 2016	I can't believe you are still supporting Trump, since 2016.
OP won’t respond to you because he’s only here to stir up shit.	OP won't respond to you because he's only here to cause problems
Being turned off by your "wife" responsibly planning out the financial logistics of pregnancy, birth, and child rearing is some next level clown shit	Being turned off by your "wife" responsibly planning out the financial logistics of pregnancy, birth, and child rearing is some next level clown stuff
Why are you so passionate about other men’s penises?	Why are you so passionate about other men's private parts?
There was nothing wrong with “Washington Redskins” or “Jeep Cherokee” or “Aunt Jemima” but here we are. The woke fuck everything up	I don't think there was anything wrong with "Washington Redskins" or "Jeep Cherokee" or "Aunt Jemima" but here we are.
Back in my day we just hit the dumb kids and they went to work in the mines!	Back in my day we hit the other kids and they just went off to work.
Brown people hate Biden more after killing a bus full of them in Yemen	People hate Biden because he killed people in Yemen. 
You’re a fucking moron.  Did those riots attempt to overthrow the government because those rioters lost an election?  Shut the fuck up traitor.	You are unintelligent. Did those riots attempt to overthrow the government because those rioters lost an election? No, so stop talking.
How about you guys actually read the bill, if you’re against it you’re with pedophilia	I wish everyone actually read the bill.
No, you're really trying to use "your friends" as the only valid source.  It's really ignorant.	It's sad that you are trying to use your friends as your only valid source.
It doesn’t suck. It just doesn’t exist.	It doesn't stink, it just doesn't exist
I have a master's degree dick hole	I have a master's degree.
Lol, shut up. We're not talking about them.	Lol, we're not talking about them
I would tell you to your face your fucking stupid and then I’d go out to get nachos	I would tell you that you don't make sense, then go out to get nachos.
Bruh use a different Republican president; Reagan was out of it with dementia for most of his second term.	You might want to use a different Republican president as an example, Reagan was mostly out of it during his second term, probably due to dementia.
I’m so glad you dumped this fatphobic pos. Now go get yourself a fine woman that loves all your beautiful curves.	I am so glad you left. Now go get yourself someone that loves all your beautiful curves
not with a fucking milkshake	Not with a milkshake.
Well this vapid count would certainly know what doing reconnaissance in the capital would look like.	Well this person would certainly know what doing reconnaissance in the capital would look like.
For reals? You talk shit about people and children saying they have diseases and shit just because of how they look. So shut the fuck up	For reals? You make fun of people and children saying they have diseases just because of how they look. So stop talking.
I can easily afford gas. Guess you need a better job, a more fuel efficient car or maybe both.  Anyway get fucked you Trump Terrorist.	I can easily afford gas. You may need a better job, a more fuel efficient car or maybe both.
I actually cackled aloud... Yes, it was wonderful. Everytime they showed his face, I shouted dumbass.	I laughed, because it was wonderful everytime they showed his face.
Stfu he wanted to meet her parents to establish better relationships	Stop, he wanted to meet her parents to establish better relationships
What a sad bunch are. Ww3 is coming and you pussies keep talking about something so insignificant as Jan 6. Who raised you? Fucken clowns.	It's pretty sad that WW3 is coming and people keep talking about other insignificant events in the past.
The fact that you felt this was worth sharing as if it's somehow morally sound to be dishonest with your partner is baffling.	I'm confused why people think it's morally sound to be dishonest with their partner.
I can't help it if you're dumb as shit	I can't help it if you don't understand.
The lawmakers come up with this trash should have been aborted.	The lawmakers  who come up with something like this should not be in power
Better get a box sack and hit it everytime, later you will regret bcs u have to pay for covering those scars	It's better to just get a box sack and hit it every time, because you'll have scars later that you'll regret.
BLM, mainstream media, this sub, etc   If you comment on black-on-black crime, you'll quickly be called a racist and shown the door	BLM, mainstream media, this sub, etc. Don't comment on black-on-black crime.
Na. You're just a pussy.	You are weak.
That’s fucking bullshit. Every republican I know thinks Putin is a piece of trash and should be charged as a war criminal.	That's not ok. Every republican I know thinks Putin is bad and should be charged as a war criminal.
You sound just as ignorant as op.	You sound just like the OP.
Go f yourself Republican scum who put us here with your uneducated voting like you even care. I do want to defund police.	Republicans put us in this situation. I would want to defund the police.
I'm just one person, moron.	I'm just one person.
Lol typical idiot. Biden administration is a failure	The Biden administration has its struggles.
Why do you give a fuck if somebody’s vaccinated, much less wish them harm. Seriously mentally ill.	Why do you care if somebody's vaccinated? It is mean to wish harm upon anyone.
I'm shocked, shocked that "I've got mine, FUCK YOU" is not a viable political and economic philosophy!	I'm shocked, shocked that "I've got mine" is not a viable political and economic philosophy!
Woof. It didn't take me long to see your TL absolutely screaming that you're a Tankie.	it didn't take me long to discover your TL.
And “poor kids are just as bright as white kids”…. Your blundering bafoon chooses racism as well	He said "poor kids are just as bright as white kids".
Stop sexualizing kids you sick bastard.	Stop sexualizing kids
Correct, just like no one cares about OP not being able to mooch anymore.	Correct, just like no one cares that the OP can't post anymore.
Lol don't you have to go and some "therapist"? You clown	Maybe you should talk to a therapist.
Fuck'em too many people.use the "ohhh talking to people makes me sad inside." Grow up.	People need to grow up and learn how to communicate
Those are joss exact words at 10:15 or thereabouts. The only fake news here is your blatant LIE.  WTF???	Actually, Joss said those exact words at about 10:15, so it can't be fake news.
bro are you an idiot?	Do you not understand?
Fuck off mate. No excuse for what she said and the backstory doesn’t make any difference.  Sorry to hear that OP. Stay strong.	Leave her be. There is no excuse, and the backstory doesn't make any difference. Sorry to hear that OP. Stay strong.
How are the dems wreaking havoc nationally?  If the dems were the reasonable pragmatic party what was or is the Republican Party?	How are the dems wreaking havoc nationally?
So maybe shame those fucks who can't be bothered and stand up for your principles?	Maybe talk to those who can't be bothered and stand up for your principles?
You know what part, almost everything you said was made up, now stop talking to me. Douche	It seems like almost everything you posted was unfactual.
Ah shit, I forgot that this is /r/politics and people here don't have princples.	Ah, I forgot that this is /r/politics and people here don't have principles
Which books in particular? Sounds like bullshit to me.	Which books in particular? I find it hard to believe.
All of these <1 month accounts with their shit takes.  Fuck off, dude.	All of these <1 month accounts with their opinions. 
“You’re cheating” - dumb fucke(r)  “No, you’re cheating” - (d)umb ass	And he says, "you're cheating".
> Lol, ok Kid.  Notice you didn't refute it. Like I said. Pack of morons. Good luck with the midterms.	Okay, it seems like you still don't get it. Good luck with the midterm elections.
STFU, you fucking ignoramus!	Please stop talking.
True that.  Watching him make any speech is just painful. He is a senile embarrassment and makes us appear weaker than ever before.	True that. WWatching him make any speech painful. He is aged and makes us appear weaker than ever before
Only two types of people have ever supported conservatism, the evil, and the dangerously stupid.	Only two types of people have ever supported conservatism, the evil and unintelligent people
What TF are you blabbing about?   How is this relevant?   Say something else stupid, this is fun	What are you talking about? How is this relevant? Say something else. This is fun
Mmm i remember my science teacher had the tastiest asshole my freshman year high school. That was the opposite of a divisive concept for me	Mmm I remember my science teacher was attractive my freshman year high school. That was the opposite of a divisive concept for me
Meanwhile, conservatives actually bomb abortion clinics. The hypocrisy is endless.	Meanwhile conservatives do not support abortion clinics. It's a bit hypocritical.
Putin, Trump, and all oligarchs deserve public execution.	Putin, Trump and all oligarchs deserve to be brought to law
NTA.   Dump his ass. Tablemanners are no rocket science. Treating other people like human beings is no rocket science. His still a child.	You should leave him. Tablemanners are no rocket science. Treating other people like human beings is no rocket science. His still a child.
Biden sucks. What do you think u/dig1965	I'm not a fan of Biden. What do you think?
Here’s hoping your business fails, you garbage person.	Here’s hoping your business fails, you bad person.
Go fucking pound sand. I live In Alabama.	Get out of here. I live in Alabama.
Well if you don't bow down to the LGBT mafia then you need to be thrown in the gulag according to redditors!	Well if you don't accept LGBT then you need to be banished according to redditors
I dont think an all star hall of fame quarter back is too worried about what a bunch of fat, hive mind redditors think 😂😂	I don't think an all-star hall of fame quarterback is too worried about what redditors think.
$10 golddigger, LOL, not even fool's gold. Glad you dumped him, what a jerk. NTA.	Lol golddigging for so little. Glad you left him. what a crude person. NTA
Wow you’re really defensive and boring	Wow you're really defensive
Good old Timmy.  Always slow to the punch.	He's slow to understand.
I wouldn’t want to work at the capitol knowing I could face and be killed by a mob.	I wouldn't want to work somewhere knowing I could be killed.
Boo hoo for the slutty ho.	Boo hoo
That stupid sentence was a pretty good way… do you have any adult words?	That sentence was a pretty good way... do you have any adult words?
Money we don't have going to freeloading "allies" who hate us until they need a bail out	We have been giving money to "allies" who only love us when they need help.
nah i’m not the problem. it’s not my fault you guys come off wrong with your unfunny mean ass jokes.	I'm not the problem, you guys are coming off wrong and your jokes aren't funny.
All of her constituents are on government relief and can’t read. They think the bitch is actually representing them.	All of her constituents doen't understand that she isn't actually representing them.
Ya daughter is getting tricked out by Greek Nerds at UNC 🤣💯 NOW i’m a troll. Just so u know what it looks like	Your daughter might be getting tricked by members of Greek life at UNC.
Fuck both of them	Screw both of them.
Steal from Walmart.	Steal from large corporations.
im sure your democrat liberal selfish self will tell me...	im sure your democrat liberal self will tell me
That’s like me saying “and you comment in gay subreddits” who the fuck cares??	That's like me saying that you comment in gay subreddits, because who cares.
Mosy children are spineless pussys, largely. That's not their fault, they're still at that stage in development.	Yeah, babies that young are not able to self-soothe. They are crying for a reason.
Thats great, fuck this cunt!	That is great!
Dude you may be gay	Have you ever reconsidered your sexual orientation?
mmm hmm, sad little bitch boy.	What a sad boy.
Must be tough having a double digit IQ	Must be tough to be so unintelligent
Oh my god imagine wanting the autonomy to decide what does and doesn't go inside your body. You fucking idiot.	Imagine wanting the autonomy to decide what does and doesn't go inside your body.
I think in the end, OP WAS the punchline. And he’s lucky his own brother didn’t physically make him so! 😂	I think in the end, OP WAS the punchline.
I bet it's really stupid being you	It must be hard being you.
My girlfriend does this to me all the time but I like it Idk why you cried but congratulations on loosing your virginity happy for you	I like it, I don't know why you cried. But congratulations, happy for you! 
So you agree that today's capitalism sucks ass?	So you agree?
Say you’re stupid without saying it…	This was not a smart thing to say.
Supreme Court doesn't police itself. Sucks.	Supreme Court doesn't police itself. Stinks.
One year gone and still crying about it. Pretending this train wreck of president is doing better	One year later and people are still upset about it. We have to pretend this president is better.
Thats not fucking true and you know it lmao. What kind of commie googly gop is this.	Thats not true and you know it. What kind of leftist view is this?
I don’t know what those words mean you nerd	I don't understand the words you used.
if it's past 4 months you're a monster	If it's past 4 months you lack human qualities
81 million voters are gonna switch to whatever fuckwad the GOP picks as their candidate?	Do you think 81 million voters will switch to whoever the GOP picks as their new candidate?
Flair the fuck up retard or no one will give two fucks what you say.	Flair up or no one will care what you say.
Because it's fucking rude. We've all been underpaid at some point. Do your job.	Because it's rude. We've all been underpaid at some point. Do your job.
Death to the GOP.	GOP needs to pay
Now the local mullah will call this post Islamophobic and antisemitic!!	Now the local religious leader will consider this post Islamophobic and antisemitic
Snooze. You’re boring me, kid. Good day!	This is uninteresting. Good day!
Senile dipshit is a qualifier for 100% of the senate and most of the house.	Seems like being senile is a qualifier for being a part of the senate and house.
Maybe you were just too stupid to do it?	Maybe you were not sharp enough to do it?
Why don't you stick to your weird gross rape fantasies and leave economics to the adults?	Why don't you stick to your fantasies and leave economics to the adults?
Oh shit , you made a KKk joke because I don’t align with lefty, boot licking, pussy…..You’re  funny	You made a joke because I don't align with the left, you're funny.
Liberals are cheaters. The voters are getting screwed. Thank you FL.	Liberals are deceiving. The voters are getting manipulated. Thank you FL
Have you always been a complete and utter buffoon?  Or has it been a progressive degeneration you fucking worthless pile of duck excrement fuckwad?	Have you always been this silly, or was it progressive?
Instead of criticizing, tell me your big brain idea… 💡	Let us know about your big idea.
Bob for president! Stop apologizing to the sodomites!	Bob for president! Stop apologizing to them!
I was gonna retort, but looks like god already did you in with the ALS. Have a shitty life.	I was gonna retort but I feel bad because you have ALS.
So answer when you're free. not hard. Don't take 2 fucking days to respond, easy	Answer when you're free, it's not that hard. Please don't take 2 days to respond.
You sound like a mental patient as well. Brainwashed CNN fake news type. We can check into the asylum together	You sound like you need help, the fake news got to you. But it's okay we can get help together.
Stay mad, treasonous shit	You can stay mad
like everything else related to this clown it may look like a joke until you think about the people she infected there.	like everything else related to this ridiculous person it may look like a joke until you think about the people she infected there.
I’ve never seen more mentally challenged individuals in one place	I've never seen a less intellectual environment.
Worst VP in the last 50 years.	We have had better VPs in the past.
The GOP is inherently evil and soulless.	The GOP is not a good person
Science says 99% survival rate. What's your covid vax rate? Far less. dumbass	Science says 99% survival rate. What's the covid vax rate? Far less.
Are you troll or just fucking dumb?	Are you messing around or not being sharp?
Telling everyone we should just kill each other so that they can feel like some heroic strongman is worlds shittier.	Telling everyone we should just hurt each other so that they can feel like some heroic strongman is much worse
so to not be a sociopath, i have to support mandating a fucking literal shot into everyones arm, im out lol. yall are beyond	I shouldn't have to support mandating a shot in everyone's arm.
Shes a democrat dumbass	She is a typical democrat
Well Thats pretty stupid. You can't say an NFT isn't real just because you can't eat it.	Well that doesn't make sense. You can't say an NFT isn't real just because you can't eat it.
Yet here you are supporting another loser that has a lower rating than the orange loser! Please don't breed!	Yet, here you are supporting another person who has a lower rating than Trump.
This guy'd rather live in a authoritarian state than fight fascist like Putin and have higher gas prices.	Would you rather live in an authoritarian state? 
Isn’t this supposed to be politics sub? All I see are far left dipshits	Isn't this supposed to be a politics sub? It seems a little biased.
the fuck.... you are on drugs	uh..... you are not being realistic
Who the fuck would argue with this? This isn't a CMV.	Who would argue with this? This isn't a CMV
Okay. Let's debate. What are you wanting to debate, or are you just here to cry like a little bitch?	Let's debate. What do you want to debate?
You don't even have a profile bruh	You don't have a profile.
Nice. Next step allow steroids. I'm steroid sexual and you a bigot if you tell me no.	The next step is to allow steriods.
The context is that train robberies happen all the time? Sounds like some conservative big brain stuff.	I'm not sure if it's accurate that train robberies happen all the time?
You really spend all your free time consuming and regurgitating liberal propaganda on this echo chamber of a sub   Go get laid dawg	Do you really spend your free time on this sub? Go do something else.
lol so dumb - what AMERICAN doesn’t have the right to vote…  I’ll wait…	What American doens't have the right to vote?
Show me the evidence for the fucking	Show me the evidence.
