input_text	target_text
Rent free in your head	Rent free is not realistic
And still a moron	And still unintelligent.
Fuck manning. Gay fucking trader.	Manning is a trader.
u/Monoby get over here you asshoe!	u/Monoby get over here!
That’s correct. Don’t let the neo-yanks fool you. There’s nothing conservative about suspending the Constitution.	That's correct. Don't let them fool you. There is nothing conservative about suspending the Constitution.
Every "Covid" person is a crisis actor!! Its all fake!	This is all fake! 
Yeah and before money they actually got damn help not people feeding them making things worse for society.	Yeah and before money they actually got help, not just people feeding them.
Fnck you Anti-vaxx morons.	Anti-vaxxers are horrible and unintelligent.
What's idiotic about pointing out projection? Both sides do it, and it makes us all dumber. This is not a liberal/conservative thing.	Both sides tend to project, and it doesn't make us any smarter.
Stop being pedantic, OP's argument is pretty understandable and you dufuses are trying to catch them on a pointless technicality like a shitty lawyer.	Stop being pedantic, OP's argument is pretty understandable and you are trying to catch them on a pointless technicality like a lawyer
Libs owning the corporations by buying their shit. Damn you’re dumb as fuck.	Liberals tend to own corporations by buying their products.
Do you hear yourself?? You hate your child. Of course they behave like this. This is so sad.	This is sad, of course children behave like this.
“Abortion isn’t death.”  I’m sorry can you try saying that again in English instead of your native fucktardian?	I'm sorry can you rephrase that?
Males should not be competing against females.   Anyone who thinks otherwise is really dumb.	It's my opinion that males should not be competeing against females.
I'm sorry but you're dumb.	I'm sorry but this isn't smart.
What is going on?? A Supreme Court judge's wife is a rabid outspoken magat???  Don't seem right.	What is going on? A Supreme Court judge's wife is an outspoken Trump supporter? That doesn't seem right.
I think it’s a pretty safe bet that this douche hasn’t used a public water fountain since segregation ended!	I don't think that this guy has used a public water fountain since 1964.
At least you're proud of being a moron.	At least you're proud of who you are.
They don't get robbed or shot at as often  But we can fix that	They don't get robbed or shot at as often.
You are obviously a homofobe	Your actions are homophobic.
Lame ass liberal Antifa and Fraudchi style smear. I hope you are woke enough to see what you have coming before it hits you.	This is a weak smear campaign. I hope you realize this.
They don't change sexes dumbass.	They don't change sexes.
I said nothing about me spitting on anything. I said your inbred ancestors would spit on you for betraying your country.	I said nothing about me spitting on anything. Your ancestors would be disappointed in you for betraying your country
Why do democrats insist on teaching that white people are innately racist?	Why do Democrats insist that racism is innate?
Lmao you idiots are drawing so many conclusions right here	Lmao you people are drawing so many conclusions right here
Sounds like you're a bit insecure.	Sounds like you might not be secure.
In other news 40% of Americans are racist homophobic trash… and 99% of that trash supports the Republican Party. Draw your own conclusions	In other news, 40% of Americans are racist and homophobic and 99% of them support the Republican Party. You can draw your conclusions
Lmao, come on man! How dare you bring FACTS to this sub!	Come on! How can you bring facts to this sub! 
Hahahah you fucking guys	Hahahah you guys.
People who idolize Rittenhouse are sick in the head.	People who idolize Rittenhouse are scary.
Democrats are still committing genocide and eugenics on the black population.  No I think nothing has changed actually.	I think nothing has changed.
Lol you arent righteous or morally superior just because you blindly vote democrat. Yours is a false righteousness. Youre actually just a smug moron.	Lol you arent righteous or morally superior just because you blindly vote democrat. Yours is a false righteousness. Youre actually just smug.
You really need someone to explain to you why the belief that there are no genders is stupid..?	Do you need someone to explain why the belief that there are no genders is unintellectual? 
Anti gay equals anti human. Fuck you Putin nazis	Anti gay equals anti human
Get out of here with this Zionist shit	Please exit the thread.
Hilarious. Its been the worst kept secret in Washington and New York that Trump was abusing adderall for almost 20 years.	Everyone in Washington and New York know that Trump had issues with Adderall for almost 20 years.  
Not the left, moderates.  The left knows that there's only one way to deal with fascists.	Not the left, moderates. The left knows that there's only one way to deal with authoratarians
If it's a leash, he should be happy to get off it. Not whining and crying like an entitled brat	If it's a leash, he should be happy to get off it. Not complaining like a child.
Well, there's definitely parts of Illinois that are a good place to go when you wanna kill someone.	Well, there's definitely parts of Illinois that have a lot of violence.
Lmao you have an ugly dick	Lmao you have ugly private parts
Look at you, a delusional Internet warrior	You are quite the internet warrior.
instead of meeting with refugees, these bigwigs should try to put the effort into finishing it. it's just a show, it's disgusting to watch	It's just a show, but it's hard to watch.
You’re seriously unhinged, nobody is upset. You honestly rant like a school shooter… we’re worried.	You are not understanding, nobody is upset. Your rants are concerning, we are worried.
Grow the fuck up	You need to be mature
I thought “libs” hated corporations…..you people are fucking stupid.	I thought liberal people hate corporations, you are not making sense.
OP is an argumentative moron who is only impressed by burger analogies. Not worth your time.	OP is argumentative who is only impressed by burger analogies. Not worth your time
Fake and gay	Fake and ridiculous
This is a crap take. Here, have a downvote.	This is a bad take. Here, have a downvote.
That literally makes zero sense. But then again, coming from you the idiot, I wouldn't expect anything less.	This literally makes no sense. But then again, I don't expect anything less.
Neither of these stop you from being successful. You really are homophobic as fuck. You think being gay prevents success? Fuck off idiot.	Being gay does not stop you from being successful
There’s plenty of evidence, it’s exactly why they won’t allow forensic audits   *wipes voting machines clean of their records*	There is evidence, which is why they won't allow forensic audits.
This is ridiculous… it’s 2022 dude 🤦🏻‍♂️ ffs	This is unbelievable... it's 2022 dude
>  in JoeRogan  >  in Firearms   For anyone who wonders where the stupid comes from.	It seems like a lot of this comes from this thread, JoeRogan in Firearms.
Yeah well, your feelings don't mean shit to me and neither do you lmao	This doesn't matter to me.
Terrifying. It’s important to remember that every single Republican is literally an individual Hitler lite	Terrifying, it's important to remember that republicans can be rascist
no I'm not blaming the victim of anything and its asinine you would even suggest it. it's misdirection and deflection.	No, I'm not blaming the victim of anything, and it's ridiculous that you would even suggest it. It's misdirection and deflection.
Maybe if the antivaxers stop farming and driving trucks you’d starve to death. Serves you right.	If the antivaxers stop farming and driving trucks we would all starve to death.
Lol anyone that agrees with the crazy she  vomited is lost. I wish conservatives would realize how misguided the party has become	Anyone that agrees with this is lost, I wish you would become aware of how misguided the party has become.
Are you going to get Ken out of jail? He is 5! Do it! Step up! I dare you!	Are you going to get Ken out of jail? He is 5!
I believe napalm would clean up that mess and discourage further train robberies at the same time.	A more rigid form of action might be needed to clean up that mess and discourage train robberies.
Well, that's just like, your opinion man...  Also, leftists want to defund the police. Not liberals.	That's just your opinion. 
Okay, Cunt.	Okay.
It doesn't have zero bearing on my life. There's actual consequences in some places for misgendering people.	It doesn't affect my life. There are actual consequences in some places for misgendering people. 
And unlike you i dont downvote things that hurt my fragile ego.	I don't downvote things that hurt my ego.
Awwww, stupid little fuckwad tries to be edgy...	Awwww, look at you trying to be edgy...
Go fix your fucked teeth and stay out of discussions you can’t possibly understand, limey	You should stay out of discussions that you can't comprehend
Flair up, shitstain.	Flair up
This is the stupidest comment I’ve seen all year	This is the least intelligent comment I've seen all year
Suicide is 75% male. It’s not all beers and backslaps. Best wishes.	Did you know suicide is 75% male? It's not always beers and backslaps. Best wishes.
Nobody’s crying. Just challenging disgusting behaviour - something maybe you’re not used to. :/	Nobody is upset, they are just challenging bad behavior.
Look it up.  It was actually quite common moron.	Look it up.  It was actually quite common.
false narratives are dumb, OP	False narratives are not smart
You sound insufferable.	You sound difficult to deal with (or N/A)
Shes literally spreading misinformation, she deserves to be removed	She is spreading misinformation and should be removed.
You guys are so gullible, you'd believe Trump secretly was a vampire and drank socialist blood if an "ex-staffer" told you so.	Some people will believe anything that an "ex-staffer" for Trump told them about.
The Outrage Cycle with BS faux outrages being published at a rate of 2x above the stupid shit Trump says. It’s the Orange Shitstain Constant.	The Outrage Cycle with faux outrages being published at a rate of 2x above what Trump says. 
Ha ha ha.  I admitted to a sheep fetish????  See that's another perfect example of your delusions.	I did not admit to a sheep obsession. That is a delusion.
The French people figured out a way to deal with this kind of bullshit in 1789	The French figured out how to deal with it in 1789
Wait... you don't have health insurance?! Oh fuck... care to explain why you can't get your own health insurance?	You don't have health insurance? Care to explain why you can't get your own health insurance?
Yeah you really sound less like a myopic sicko now.	Yeah you really sound less short-sighted
Cause u r annoying me the op and other guy already told me the reason u r just being useless here	Cause u r annoying me. The OP and other guy already told me the reason
So you are incapable of getting a job? That's a shame....	It's a shame that you can't get a job
You've been waiting to use that lol. You troglodyte.	Have you been waiting to use that?
Only an idiot thinks giving up your right to own a firearm is a good idea. Liberals=fucking pussies. Go suck betos dick ya fuck.	No smart person things giving up your right to own a firearm is a good idea. Liberals are cowards
Simple remark: Total and complete bullshit	Simple remark: Totally and completely false
Or the fact that his father is POTUS. We are attacking Trumps kids, right? Fair game, right?	Or the fact that his father is POTUS. We are on the same page?
Sure I am, now pay me my $ damnit.	Can you pay up?
You're an idiot.	You are acting unintelligent.
Why hasn’t anyone put a dildo in their mouths in this photo?	Why hasn't anyone messed with their photo yet?
why do people pretend they care if someone is acting racist?	Why do some people not care if someone is acting racist?
Maybe try getting off your lazy ass and get a job to pay off the money YOU borrowed?	Maybe try getting a job to pay off the money YOU borrowed?
Every time I point out bigotry it gets deleted. This sub is obviously a transphobe circle jerk. There is no point commenting here.	Every time I point out prejudice it gets deleted. This sub is obviously self-indulgent. There is no point commenting here.
Whining that he can't go around randomly fat shaming or speak bad about minorites. OP is just an ass that demeans others to inflate his own ego	It seems like OP is demeaning others to boost his ego.
lmaooo   *Americans doing something americanly in america*   "WHAT ARE WE A BUNCH OF CHINESE PEOPLE?!?!"	*Americans doing something americanly in america* "WHAT ARE WE A BUNCH OF CHINESE PEOPLE?!?!"
Yeah you’re probably a fat commie lol	You're probably into communism.
Imagine unironically thinking the corporatist Democrats give two shits about wealth inequality. Joe “nothing will fundamentally change” Biden would like a word lmao	I don't think corporatist Democrats care about wealth inequality, even Joe Biden thinks nothing will fundamentally change.
Yes and said cultures thought it was alright to fuck little kids back in those days as well especially Mesopotamia. Glad we are reversing as a species.	Those cultures thought pedophilia was okay forever ago, especially in Mesopotamia.  Glad that is not the case anymore.
Stickers  Politics  Moron	Stickers. Politics.
We used to have people try to assassinate politicians all the time. No one wants to be a hero and kill this asshole? Really?	We used to have people try to attack politicians all the time. No one wants to be a hero and attack this one? Really?
Try having less sex with less partners to achieve mental peace	Try avoiding intercourse to achieve mental peace.
I think we all know that it’s Kamala and not Biden who blows.	I think we all know that Kamala is worse, and not Biden.
Move to China, tell them we’ll trade you for a dog they’re about to eat.	You should move to China
On one hand Reagan said some based shit but on the other hand he took away our machine guns and started the war on drugs	On one hand Reagan did some good stuff but on the other hand he also took away machine gnus and started the war on drugs.
I bet half show up in blackface.	Do people show up in blackface?
My favorite part is that you’re still madly replying as if it’s going to quell your cousin fucking urges.	My favorite part is that you are still replying.
They say if you know the right tags,, Twitter is one of the largest hosts of child pornography on the open web.	They say that Twitter actually hosts the most child pornography on the internet.
MORMON TERRORIST.  Needs to be said more.  Mormons are not good people, just pleasant in public.	Needs to be said more. Mormons are not good people, just pleasant in public.
Repugnikkkans are the worst fighters… they just run and leave you to fend for yourself	Republicans are the worst fighters… they just run and leave you to fend for yourself
Kid fuckers are really ass mad over this.	They are really mad over this.
I'm not gonna make a big deal out of it. but i still stop eating	I'm not gonna make a big deal out of it. 
Lol never said that. But clearly you showed who you are. Your obsessed with hating Trump so much you sold out your country.  Congrats.	I never said that, but you clearly showed who you are.
No need. You're to stupid. You'd never understand.	No need, you won't understand.
It was objectively a self coup.  Look it up.  You'll get an ignorance pass once.	It was objectively a self coup. You can look it up, I'll allow it.
Useless Congress getting nothing done again.	Congress didn't get anything done again.
Shut up, atheism is gay	Atheism is bad.
His endorsement is less than worthless in Illinois.	He is not endorsed in Illinois.
gods, you're dumb	You're not being very smart
Swing and a miss, Dipshit.	A swing and a miss.
YTA you're a monster.	You lack human qualities
No you're just saying crazy and ridiculous crap. Also reality.	No, this is ridiuclous, and reality.
What is malfunctioning in all of your minds here in this sub?	What is wrong with all your thought process in this sub?
YOOUU.. Stfu	YOOUU..please stop
That's about the dumbest thing I've head lately.	This might be the most unintelligent thing I have heard lately.
You killed him multiple times over	You hurt him multiple times
The point is, it's not even close to "almost every time"...there are so many republican sex offenders as well.	The point is, it's not even close to "almost every time"...there are so many sex offenders on both sides.
Trying to shove gay down our throats	They are trying to shove their agenda onto us.
Fair ‘nuff. I ought to have said “obligated”.	I should have said "obligated".
Iraq war surplus was sold to Afghan security forces. They dropped and ran. You're a fucking moron.	Actually, Iraq war surplus was sold to Afghan security forces. They dropped and ran. 
Holy shit the gaslighting. Do her a favor and move yourself out of her house and just go live in the hotel.	You're gaslighting her. Do her a favor and move yourself out of her house and just go live in the hotel.
What the hell is wrong with you?	What the heck is wrong with you?
Oh shut up, they will live, it is only delayed for a couple of days	Oh stop, they will live, it is only delayed for a couple of days
Just keep plunkin’ on your damn toy piano.  No wonder you ain’t got friends, with such steadfast hatred on your personality.	Just keep playing your toy piano. It seems like you don't have friends because you hate on your personality. 
yo if men should look like men and women should look like women does this mean they are a cockroach	If men should look like men and women should look like women, they are just unattractive.
He literally did the opposite of shaming. God, redditors are sorely lacking in reading comprehension.	It seems like he did the opposite of shaming. I wish Redditors would read more carefully.
what's to investigate, his duplicitous incompetence is manifest	What is left to investigate?
Apparently you’re autistic because you couldn’t tell it was a joke	You couldn't tell it was a joke.
He doesn't owe him shit. He is son is a moron marrying someone who cheated on him to bandaid the relationship.	He doesn't owe him anything. His son married someone who cheated on him to bandaid the relationship
So you basically confirmed you’re gay? Gross.	Did you just come out as gay?
Tell me your a bigot that thinks their a biologist while obviously not being a biologist lol 😂	Tell me you are being unreasonable that thinks their a biologist while obviously not being a biologist lol 
One liner ignorant exclamation replies are low key definition of being whiner in totality..   it's house of hypocrite with punchie whiny lines..	One liner replies seem a bit whiny.
wasn't that like 12 feds and an autistic fuck	wasn't that like 12 feds and an unintelligent person?
buy your brains, you fucking propagandists of lies!	Buy your brains instead! 
I dont expect an autist to understand.	I don't expect you to understand
Texting is for loser virgins go outside plz plus you are proly black plus ratio	Texting is lame, go outside.
She’s a dumbass pickme.	She's a pickme.
Because he’s what the people call, an Uncle Tom; he’s a race traitor	Because he is unsupportive of people of color.
Anyone that considers themselves as a Modern Republican is Sociopathic pice of shit.  No question.	Anyone that considers themselves as a Modern Republican is Sociopathic. No question.
Good day to you, sir! A month later and you still sit on a throne of lies! Disgusting	Good day to you, sir! A month later and you are still lying
Her bizarre and immature reaction is surprising even for her. Can’t believe people voted for this.	I'm surprised by her bizarre reaction, this is unlike her.
Cringe at the overuse of the word “cis”. Straight men drives the point home.  _I’m bi_	I think the word "cis" is overused.
Fuck me reddit has got to have the greatest concentration of brain dead idiots on the whole internet.	Reddit has got to have the greatest concentration of unintelligent people on the whole internet
Go to therapy	Therapy may help you
What war did Biden start. You said that was truth. Biden didn’t start any wars, liar.	What war did Biden start? You said that was truth. Biden didn't start any wars.
I think you might be a lesbian.	Have you ever reconsidered your sexual orientation?
I actually know several police officers, they have placed themselves in danger to protect people multiple times.  So go Fuck yourself.	I actually know several police officers, who have actually placed themselves in danger to protect people multiple times. 
Re-education camps for them. Cut their evil out 100%	Re-education camps for them. They need to be purified
Cold sushi IS delicious you twat	Cold sushi is delicious.
When can we just “nuke” the propaganda media and Democratic Party?  The nonsense must stop.	When can we get rid of propaganda?
I think you sound like a spoiled brat with social anxiety.	You sound like you might have social anxiety.
I worded it perfectly, sorry I'm not okay with killing children because people cant take responsibility for their actions	I purposely wrote that. I'm simply not okay with abortion.
Much like Kav, Clarence “token” Thomas has no sense of shame.	Much like Kav, Clarence Thomas has no sense of shame.
YTA. You are a fucking child.	YTA and you’re acting like a child.
Well he not only survived covid but is doing really really well so it worked for him. Fuck the vaccine	He didn't have the vaccine but he not only survived he's actually doing really well, so it worked for him.
>You are creepy and disgusting.   What are you basing this on?	What are you basing this on?
That's a moot point.	That is not relevant
To hell with peaceful protest. Protesters should drag DeathSantis out of his home and have a public trial	Peaceful protest won't work. Protesters should go for a public trial
Not really.  Has the jabs, feels okay.  Hoping for a break from the little savages	Not really. Hoping for a break from them.
You really want I pay for read this shit ?	You really want me to pay to read this?
Boo-fucking-hoo. Cry all the way home about historical context but not the context in which Joe Rogan said nigger.	Boo-hoo. Complain all you ant about historical context but not the context in which Joe Rogan said the N-word.
Hope someone kills this kid then calls his parents and says he kill that kid.	Hope someone teaches this kid a lesson
Spoiler, narrow minded people often use terms like always when describing generalities. The intelligence here is just oozing political garbage.	Actually, when people use terms like always when describing generalities, it is pretty narrow minded.
Correct. So you're a spineless fat fuck?	You are right.
How can you decide rather or not? People are terrible and terrible, but being a abuser does not automatically mean they are worth nothing.	How can you decide? People are terrible no matter what.
Trans is a made up term by bunch of lunatics following the work of a sicko it’s Gender dysphoria.	Trans is a term made up by someone else. I think more accurately it is gender dysphoria.
Wrong again.  Your baseless conspiracy theories are not equal to facts, nor is your uninformed opinion equal to facts.	Baseless conspiracy theories and opinions are not requal to facts.
So people will know who supports murdering babies and drug cartels	So people will know who supports this.
Saying no offense and then making an assumptive insults is some toxic shit, fuck you	Saying no offense and then making an assumptive insult is toxic
Too bad she isnt a crack smoking pedophile money embezzler like hunter, then it would be easy to make her look bad.	She isn't a horrible person, if she were it would be easy to make her look bad
Don't dare say a word, whitey. We run this liberal sub	Don't dare say a word. This sub is liberal.
I don't give a shit about downvotes. Or you...  I care about reality.	I don't care about downvotes. I care about reality.
I wonder how OP feels that he’s like “Biden sucks” and then the Internet replies “stuff it, dweeb”	I wonder how OP feels that he’s like “Biden stinks” and then the Internet replies “stop, dweeb”
Yeah this is what phone addiction does. You care about shit the doesn't matter	Yeah this is what phone addiction does. That stuff really doesn't matter though.
Somebody needs to go get that dickhead.	Somebody needs to go get that man.
Also, GOP hate women  -- GOP women most especially hate other women -- and they allow no life path for a woman beyond "brood sow."	The GOP do not take women into consideration, even GOP women.
Same dude who tried to get dildos banned in Texas? This dude DEFINES the work cuck.	Is this the same guy who tried to get sex toys banned in Texas?
Plan B literally is your system, shutting nut down in a couple hours	Plan B is in your system and doing it's job.
CRT is racist.	CRT is acting racist.
Except I never said that....  you people are ridiculous.	I never said that, that is ridiculous.
Probably not, but if I see someone beating the shit out of a nazi I'm not gonna stop them	Probably npt, but if I see someone hurting an oppressive person, I'm not gonna stop them
That’s racist.	Those actions are racist.
Just because you're a dumbass, does not mean others are. So you only speak for yourself.	You are being unreasonable, but they are not. Please only speak on behalf of yourself.
Fucker wasn't even on the ballot.	They weren't even on the ballot.
