input_text	target_text
Even though I don't condone racism I think your nonconfrontational hubby should go back to being nonconfrontational. We can't control individuals views and beliefs.	We unfortunately can't control individuals' views and beliefs, so it's better off if your nonconfrontational hubby stays nonconfrontational.
YTA. So you abused and poisoned animals. Fuck you	YTA. So you abused and poisoned animals. You are despicable.
Gringos in denial. Our gov can’t even be bothered to spend a dime on infrastructure. Wake up and cope with our shitty cities.	Our gov can't even be bothered to spend a dime on infrastructure.
Just say it who gives a fuck.	You should just say it.
Do you have any sources? Or is it just another day of spewing unverified fake news bs	Do you have any sources? Or is it just another day of spewing unverified fake news
Jesus fucking H Christ. Get a lawyer and a therapist, immediately. Holy fucking shit.	Oh my, you might want to get a lawyer and therapist immediately.
No it doesn’t moron. I think I should know being in big pharma for over 20 yrs. you get natural antibodies from getting Covid.	No it doesn't. I know because I worked in big pharma for over 20 years. You can get natural antibodies from getting COVID.
Lol typical libleft, all libleft should be executed because their brain is too stupid	Lol typical libleft
Screw twitter.  Screw Facebook.  Lets go Brandon. No sheep shots.	Twitter and Facebook are the worst.
Clown!….so sick of this woke agenda….men are men…women are women….and beta males are women too…..	tired of this agenda....men are men...women are women....
You don’t think the right has shifted at all? Don’t think the trump admin was a shitshow?	You don't think the right has shifted at all?
My god. You are such a profound idiot	My God. You are not wise
I thought mine was the one.and she fucking played me.	I thought she was the one but she played me.
Totally an asshole move to chastise people for having more children than you deem appropriate. Let people live, damn.	Not nice at all to chastise people for having more children than you deem appropriate. Let people live
No, because black coffee is a description...so you're saying "you filthy black bastard" shouldn't be racist? Piss off troll.	No, because black coffee is a description..so you're saying cursing black people shouldn't be racist? 
Remember when Tucker CUCKED him on National TV and he begged for forgiveness?   Dude is the definition of weak.	Remember when Tucker messed with him on National TV and he had to ask for forgiveness? That was weak.
the entire, horrified, rest of the world ;)	The entire, alarmed, rest of the world ;)
Well, it objectively is. We beat small pox and polio. Now, we are too weak to beat even this inferior enemy.	Objectively itis. We beat smallpox and polio, but we are too weak to beat this.
We can already see it. Unless your a dumb-ass.	We can already see it. Unless you are not very smart
Well that little TREASONOUS fella (Bradley) needs to stay in jail. Should’ve never got out.	Bradley should have stayed in jail.
You’re on drugs, they’re not destroying democracy.	You're not wrong, they're not destroying democracy
You sir, are an idiot lol	You sir, are not very wise lol
Quote him on where he shamed anyone.	Can you quote him on where he shamed anyone?
Yta for raising a sissy bisexual. If Finn was 100% gya he’d have thicker skin	YTA for making this about his sexuality instead of his behavior.
Yep. You got me. Cousin-fucker strikes again.	You got me!
You,my friend are wrong and therefore full of shit !	You my friend are wrong
That's fine. I'll stick with confirmed facts and forgo conspiracy theories feed by the same MSM mediums that fell for the piss dossier.	That's fine. I prefer sticking with confirmed facts rather than conspiracy theories.
You can do whatever you want but you come across as a fucking loser.	You can do whatever you want.
> that fatass Trump make  hahahaha, you must mention Trump into this. You have Trump derrangement syndrome. Seriously pathetic.	Why do you always have to mention Trump? It is a bit strange.
Fuck the Democrats.   No student loan forgiveness   No judicial reform  No Marijuana decriminalization   No voter protection   No abortion rights protection   WHAT THE FUCK DID WE VOTE FOR!	The Democrats are awful. No student loan forgiveness No judicial reform No Marijuana decriminalization No voter protection No abortion rights protection WHAT DID WE VOTE FOR!
Ah, you're a Republican-russian shill bot	Are you a bot?
There are good ppl in even the worst places. Your comment is ignorant and only serves to divide.	There are good ppl in even the worst pplaces. Your comment is uninformed and only serves to divide
You are so *disgustingly* ignorant.	You are being ignorant.
The fuck even is this comment? Troll somewhere else.	What does this response mean? Go post elsewhere.
It will be over when we stand up and say "enough is enough". Do NOT comply. No clot shot, no mask.	It will be over when we stop complying.
Fuck you too gay ass mod	Screw you.
Yeah, facebook needs to ban all the bullshit about last year's election and all of the lies about Covid-19.	Facebook needs to ban misinformation about last year's election and COVID-19.
You're a fucking idiot	You are being unintelligent. 
She's a traitor and it's time for her husband to kick the bucket	She's a traitor.
Do you know how dumb and creepy you sound?   Twisting each of my comments into something sexual makes you look like the weirdo... not me.  🤣🤣🤣	Do you know how creepy that sounds? It is a little strange that you are twisting my comments into something I am not saying.
Another indoctrinated fool liberal. Funny how the so called educated left is so easily brainwashed	Another liberal. Funny how the so called educated left is so easily influenced
I'm far too selfish to hate anyone even an idiot such as yourself 😂	I'm too selfish to hate anyone.
Joe Rogan loves this whore	Joe Rogan loves her
Someone get back to me when that asshole is finally charged,please. This is mentally exhausting.	Someone get back to me when he is finally charged, please. This is mentally exhausting
I love when inbred trash like this whine about things on the internet.	I love when people like this get upset.
You are a creep	You seem reprobate
You married a real jerk.	You married a bad person.
I blame our founding fathers and then men who were too lazy to work their own land. Yesterdays laziness is tomorrows curse.	Yesterdays laziness is tomorrows curse.
I love that trans people just existing makes people like you cry into their cornflakes every morning lol	I love that trans people existing makes some people upset. 
Na. You're point is that you're an idiot.	Your point is that you are unintelligent.
That baby didn’t anything to deserve your hate, never forget that	That baby didn't do anything to deserve that, never forget it.
It's fucking daytime TV drama and it's being upvoted on this sub as serious journalism.	I can't believe daytime TV drama is being upvoted as serious journalism.
Better than burning things they didn't pay for like the triggerlicious liberals that spent a whole summer rioting because everything is rayciss	It's better than burning things, like some people who rioted this summer.
